,source,title,excerpt,vader_sentiment_title,tb_sentiment_title,flair_sentiment_title,vader_sentiment_excerpt,tb_sentiment_excerpt,flair_sentiment_excerpt,date
0,Bitcoin.com,SEC Chairman Says Crypto Should Be Treated Same as Other Capital Markets,"SEC Chairman Gary Gensler says that there is no need to treat the crypto market differently from other capital markets. Noting that “the SEC will serve as the cop on the beat,” Gensler encouraged crypto trading and lending platforms “to come in and talk to SEC staff.” SEC Chairman Gensler on Cryp... (Read More...)",50.0,46.25,0.30062198638916016,72.94,49.82142857142857,79.28542494773865,2022-08-24
1,Cryptonews,Japan’s bitFlyer Will ‘Pay Close Attention’ to Any Ethereum Proof-of-Work Hard Fork,"The Japanese crypto exchange bitFlyer has said it will “pay close attention” to any hard forks that may happen as a result of Ethereum’s (ETH) transition from proof-of-work (PoW) to proof-of-stake (PoS), and that forked tokens that continue to rely on PoW could be supported. Writing in a blog pos... (Read More...)",44.865,35.416666666666664,24.821072816848755,61.315,53.47222222222222,5.697169899940491,2022-08-24
2,Decrypt,"John McAfee Is Still Alive, Ex-Girlfriend Reportedly Claims In Documentary","In a new Netflix biopic, McAfee’s former partner Samantha Herrera says the notorious software developer faked his death. (Read More...)",69.08999999999999,52.5,3.770250082015991,11.085,60.60606060606061,1.7376035451889038,2022-08-24
3,Feed - Cryptopotato.Com,"Nike Generated Over $185M in NFT Sales – Gucci, Adidas Trails Behind: Data",The NFT hype among some of the most sought-after fashion brands may not fade anytime soon after all. (Read More...),50.0,30.0,90.97832143306732,50.0,75.0,99.82114732265472,2022-08-24
4,Bitcoinist,Cardano Founder Charles Hoskinson Defends Tornado Cash Developers,Tornado Cash is a crypto mixer that recently came under sanction from the United States government. The reasoning given for this was the fact that it was a protocol used by criminals to hide the origins of their funds. Most notably used by South Korean hackers who have stolen millions of dollars ... (Read More...),50.0,50.0,21.46036922931671,14.984999999999998,68.75,7.516157627105713,2022-08-24
5,NewsBTC,Institutional Investor Sentiment Remains Negative As Bitcoin Outflows Continue,"Institutional investor sentiment has been on the rocks for some time now. This follows the market trend with bitcoin falling below $22,000 and the total crypto market cap finally making its way below $1 trillion once more. With this, institutional investors continue to show a more bearish attitud... (Read More...)",21.405,35.0,0.02867579460144043,42.345,65.0,1.2107908725738525,2022-08-24
6,Bitcoin.com,Blockchain.com Inks Multi-Year Deal With Dallas Cowboys Star Quarterback Dak Prescott,"The crypto firm Blockchain․com announced on Tuesday that the company has inked a multi-year partnership deal with the Dallas Cowboys quarterback Dak Prescott. Blockchain.com says the Cowboys quarterback will appear on TV, radio, and social media in order to bring his “personal brand firepower to ... (Read More...)",50.0,50.0,6.781944632530212,50.0,54.166666666666664,6.94442093372345,2022-08-24
7,CryptoBriefing,Hodlnaut Could Collapse If It Complies With Singaporean Police,"Hodlnaut revealed today that the Singapore Police Force had issued a transfer order that could exhaust its accounts. Singapore police are demanding money from Hodlnaut.In its latest update, Hodlnaut revealed that the Singapore Police Force (SPF) issued a transfer order against it on July 14.That ... (Read More...)",25.305,50.0,0.0020682811737060547,26.165,75.0,0.0088423490524292,2022-08-24
8,Crypto Briefing,Hodlnaut Could Collapse If It Complies With Singaporean Police,Hodlnaut revealed today that the Singapore Police Force had issued a transfer order that could exhaust its accounts. Singapore Police Demand $127 Million Singapore police are demanding money from Hodlnaut.... (Read More...),25.305,50.0,0.0020682811737060547,22.13,75.0,0.025099515914916992,2022-08-24
9,CryptoBriefing,Did John McAfee Fake His Own Death? His Ex Claims So,"Samantha Herrera, John McAfee's ex-girlfriend, says that contrary to official reports, McAfee did not die in his prison cell but escaped and is now living in the United States. John McAfees ex-girlfriend says hes still alive.In the new Netflix documentary, Running With the Devil: The Wild World o... (Read More...)",10.470000000000002,52.5,1.8200963735580444,23.060000000000002,59.20454545454545,94.1912055015564,2022-08-24
10,Crypto Briefing,Did John McAfee Fake His Own Death? His Ex Claims So,"Samantha Herrera, John McAfee’s ex-girlfriend, says that contrary to official reports, McAfee did not die in his prison cell but escaped and is now living in the United States. Happily... (Read More...)",10.470000000000002,52.5,1.8200963735580444,78.03999999999999,82.5,96.22683525085449,2022-08-24
11,The Daily Hodl,"Texas Senator Ted Cruz Says Bitcoin Can Bring Prosperity, Calls BTC Mining a Net Plus for Environment","United States Senator Ted Cruz believes that Bitcoin and BTC mining are beneficial to both the economy and the environment. Cruz says at the Texas Blockchain Summit event that Bitcoin generates prosperity which in turn benefits the environment. “If you look at the environment, pollution is direct... (Read More...)",50.0,50.0,83.12372267246246,90.36999999999999,65.0,11.381900310516357,2022-08-24
12,The Daily Hodl,Ethereum Sees Turnaround in Sentiment Among Institutional Investors As Merge Approaches: CoinShares,"Ethereum (ETH) is enjoying a change in sentiment as the second largest crypto asset’s transition to a proof of stake (PoS) consensus mechanism approaches, according to digital asset manager CoinShares. In its latest Digital Asset Fund Flows Weekly report, CoinShares finds that Ethereum is now in ... (Read More...)",50.0,50.0,93.34055185317993,90.63,62.5,92.19807982444763,2022-08-24
13,Brave New Coin,Gamma - Building through the Bear,"Brett Herskope aka Eliherf is head of growth at Gamma, the platform built to become a hub for Web3 social identity, centered around NFTs. Brett is also project lead for the Stacks Parrots NFT collection. (Read More...)",50.0,50.0,78.72858941555023,69.08999999999999,63.33333333333333,99.14900064468384,2022-08-24
14,crypto.news,DeFi Kingdoms Switch to Metaverse-Focused Blockchain After Dumping Harmony,"The blockchain-based gaming platform, DeFi Kingdoms (DFK), is set to move to the metaverse-focused blockchain network, Katyn. As reported by The Block, a statement from the company indicates that the platform is pulling out of the Harmony Protocol as it… (Read More...)",55.135,50.0,0.4058420658111572,47.42,75.0,0.005209445953369141,2022-08-24
15,BeInCrypto,Crypto Product Trading Volumes Continue Slump During ‘Summer Doldrums’,"In the third week of flatlined trading volumes, digital assets investment products experienced a mere $9 million in outflows. The post Crypto Product Trading Volumes Continue Slump During ‘Summer Doldrums’ appeared first on BeInCrypto. (Read More...)",50.0,50.0,0.007027387619018555,58.894999999999996,58.75,0.001233816146850586,2022-08-24
16,The Block,Ontario securities regulator warns against Kucoin in latest alert,"The OSC has issued another consumer alert warning residents of unregistered crypto platforms, including Kucoin. (Read More...)",72.94,75.0,1.953113079071045,47.42,75.0,0.028824806213378906,2022-08-24
17,ZyCrypto,Hacker Loses 5 Ether In A Failed Exploit On Near Protocol’s Rainbow Bridge,"Crypto bridges have become a hot target for nefarious actors. However, not all malicious attackers make away with millions in stolen digital assets. Some actually lose money during their DeFi exploit attempts. (Read More...)",14.079999999999998,38.33333333333333,0.007611513137817383,30.89,59.375,2.694806456565857,2022-08-24
18,CoinTelegraph,Here’s why holding $20.8K will be critical in this week’s $1B Bitcoin options expiry,"BTC bulls were liquidated in last week’s drop to $20,800, meaning even more downside could occur if this level fails ahead of this week’s $1 billion options expiry. (Read More...)",34.089999999999996,50.0,0.022977590560913086,13.269999999999998,56.25,0.018262863159179688,2022-08-24
19,The Block,Heather Morgan from Bitfinex money laundering scandal breaks 6-month social media silence,Heather Morgan took to Twitter after six months of silence to state that any crypto or NFT project with her likeness is a scam. (Read More...),27.98,51.66666666666667,0.01144111156463623,21.405,75.0,0.0018000602722167969,2022-08-24
20,CryptoPotato,Betting Against CNBC’s Jim Cramer Helps Crypto Trader Book Profits,"The crypto trader's ""Inverse Cramer"" portfolio fetched him significant gains on his initial investment. (Read More...)",83.525,50.0,88.09375762939453,74.695,64.58333333333334,95.15021443367004,2022-08-24
21,crypto.news,"Phemex Announces Contract Trading Fee Adjustments, Traders Can Now Earn More ",Phemex crypto exchange announced trading fee adjustments as they aim to offer affordable trading fees within the crypto market. (Read More...),50.0,75.0,98.40869903564453,50.0,75.0,0.46198368072509766,2022-08-24
22,Decrypt,"Coinbase CEO Says Exchange Is Cutting Costs, Focusing on Subscriptions",Brian Armstrong wants Coinbase to shed its “U.S. lens” and be “the most regulated” in crypto. (Read More...),43.6,20.0,78.27576398849487,50.0,70.0,0.9455293416976929,2022-08-24
23,The Daily Hodl,Nexo CEO Says Ethereum (ETH) ‘Could Go Much Higher’ in Coming Months Under These Conditions,"The co-founder and CEO of Nexo, Antoni Trenchev, is expressing bullish sentiment on Ethereum (ETH). Trenchev says in a CNBC interview that the price of the second-largest crypto asset is setting up for a possible surge following the upcoming Ethereum upgrade next month. The upgrade will see Ether... (Read More...)",50.0,62.5,0.1410365104675293,68.06,56.25,3.9440572261810303,2022-08-24
24,BeInCrypto,Shibaswap Volume Crashes More Than $1.6B in Yearly Low ,Shibaswap saw a steep fall in trading volume in July due to a decline in the liquidity poured into alternate coins (altcoins) listed on the platform. The post Shibaswap Volume Crashes More Than $1.6B in Yearly Low appeared first on BeInCrypto. (Read More...),36.34,62.5,0.005310773849487305,36.34,59.375,0.0011563301086425781,2022-08-24
25,crypto.news,Huobi Technology Obtains MSB License to Operate in Canada,"Huobi Technology Holdings Limited will be introducing virtual holdings to the globe of traditional finance in the Canadian market. Cloud-based offerings, data center offerings, SaaS, digital asset finance, trust &amp; custody, OTC, financing, exchange market, and strategic investment are covered… (Read More...)",50.0,50.0,98.32559525966644,79.97000000000001,53.28571428571428,99.53542351722717,2022-08-24
26,Cointelegraph,"Celsius countersues KeyFi, claims deceit and incompetence led to tens of millions in losses","Crypto lender Celsius has gone on the offensive against former staking and DeFi strategy associate KeyFi and its CEO, which had sued it a week before it went bankrupt. (Read More...)",7.990000000000003,50.0,0.004678964614868164,11.75,62.5,0.037357211112976074,2022-08-24
27,The Block,"Crypto stable following sell-off, while crypto stocks sink lower",Crypto markets show signs of life after drastic sell-off on Friday. (Read More...),50.0,50.0,21.942773461341858,50.0,75.0,77.46799886226654,2022-08-24
28,The Block,"DOJ charges Miami-based trio with defrauding banks, crypto exchange for $4 million",The US Department of Justice has accused three people of using fake and stolen identities to defraud banks and a crypto exchange. (Read More...),36.34,50.0,0.5959153175354004,18.755,50.0,0.12333393096923828,2022-08-24
29,The Block,"Bitcoin mining stock report: Tuesday, August 23","Here's how crypto mining companies performed on Tuesday, August 23. (Read More...)",50.0,50.0,0.011119246482849121,50.0,75.0,0.018161535263061523,2022-08-24
30,CoinTelegraph,"A bullish Bitcoin trend reversal is a far-fetched idea, but this metric is screaming 'buy'","Non crypto-related factors continue to weigh on BTC price, but a key on-chain metric that called previous market bottoms suggests Bitcoin is severely undervalued. (Read More...)",23.665000000000003,50.0,0.023943185806274414,19.379999999999995,55.55555555555556,1.5172690153121948,2022-08-24
31,Bitcoin.com,Metaverse Startup Ready Player Me Raises $56 Million in Series B Led by Andreessen Horowitz,"The AI-generated avatar creation cross-platform for the metaverse, Ready Player Me, has raised $56 million in a Series B funding round led by Andreessen Horowitz (a16z). The startup’s co-founder and CEO Timmu Tõke says the funding will be used to scale the cross-platform metaverse avatar system. ... (Read More...)",68.06,60.0,23.192936182022095,77.86999999999999,58.333333333333336,92.45599806308746,2022-08-24
32,Decrypt,Crypto Exchange Celsius Countersues KeyFi for 'Gross Mismanagement',"“The defendants were not just incompetent, they also were thieves,"" Celsius says. (Read More...)",26.165,50.0,0.05278885364532471,68.62,53.75,0.2647906541824341,2022-08-24
33,Cointelegraph,"Iconic brands including Nike, Gucci have made $260M off NFT sales","Nonfungible tokens give major brands new ways of interacting with their consumers spanning art, fashion and gaming. (Read More...)",50.0,75.0,0.10711252689361572,50.0,61.64772727272727,99.74205791950226,2022-08-24
34,U.Today,"Cardano Creator Addresses Criticism About ""Hush-Hush"" Culture","Charles Hoskinson says that complex technical discussions should be kept off toxic social media platforms, but some community members disagree (Read More...)",27.98,50.0,3.005543351173401,23.665000000000003,52.916666666666664,0.500914454460144,2022-08-24
35,ZyCrypto,"Cardano (ADA) Beats PayPal, Netflix & YouTube In Annual Energy Efficiency","According to the graphical representation, Cardano consumes only... (Read More...)",77.86999999999999,50.0,99.83299374580383,50.0,62.5,0.043335556983947754,2022-08-24
36,CryptoPotato,Hodlnaut Reveals Engaging in Two Sets of Legal Proceedings,The battered crypto lender has been granted a much-needed breathing space as it focuses on a recovery plan. (Read More...),72.02,65.0,98.61159920692444,62.5,75.0,0.06850361824035645,2022-08-24
37,The Block,Sotheby’s hires NFT specialist to join digital art team,"Brian Beccafico, an NFT art collector who goes by Arthemort online, will be on Sotheby's team as an NFT specialist. (Read More...)",64.8,50.0,9.34499204158783,50.0,75.0,99.90103244781494,2022-08-24
38,The Daily Hodl,"Here’s the Worst-Case Scenario for Bitcoin (BTC) in 10 Years, According to Macro Guru Raoul Pal","Real Vision CEO Raoul Pal says that Bitcoin (BTC) can still erupt en route to outperforming other asset classes in the next 10 years even in his worst-case scenario. In a recent roundtable discussion on the Scott Melker YouTube channel, the former Goldman Sachs executive explains how the more ext... (Read More...)",50.0,50.0,0.00032782554626464844,77.115,57.67857142857142,12.33031153678894,2022-08-24
39,Crypto Daily,Coinbase Faces Class Action Lawsuit Over Lapses in Security,"Crypto exchange Coinbase is facing yet another lawsuit, this time over alleged lapses in security. The lawsuit filed in a federal court in Georgia alleges that the exchange failed to secure users’ accounts against hacks and theft. A complaint filed in the U.S. District Court for the Northern Dist... (Read More...)",56.400000000000006,55.00000000000001,0.11605918407440186,22.884999999999998,50.0,0.004875659942626953,2022-08-24
40,BeInCrypto,"A16z Crypto Lead Slams Web 2 Giants, Says Decentralization Is the Future","Chris Dixon says decentralization and crypto are the new frontiers for a16z investment as it fuels entrepreneurship and gives power back to the creator. The post A16z Crypto Lead Slams Web 2 Giants, Says Decentralization Is the Future appeared first on BeInCrypto. (Read More...)",50.0,50.0,5.584675073623657,50.0,58.86363636363636,98.81243407726288,2022-08-24
41,Cryptonews,54% of Indian Crypto Investors Surveyed in Q2 Aimed to Invest More in 6 Months - KuCoin,"Despite the latest market downturn, more than 50% of India’s survey respondents intend to expand their investments in crypto in the coming six months – indicating an optimistic approach to the market, according to a report by crypto exchange KuCoin.... Read More: 54% of Indian Crypto Investors Su... (Read More...)",50.0,75.0,0.11702179908752441,77.86999999999999,75.0,96.68970704078674,2022-08-24
42,crypto.news,"SudoRare Vanishes From the Internet, Taking 519 ETH Worth Almost $1 Million","Automated market maker (AMM) SudoRare has reportedly stolen 519 ETH, worth about $985K at current market prices. Platform Removes Online Presence A member of the crypto community going by the name Sungjae_han was the first to report the suspicious transaction… (Read More...)",61.315,65.0,0.013574957847595215,20.705000000000002,63.125,0.032457709312438965,2022-08-24
43,The Daily Hodl,Bitcoin (BTC) Flying Out of Exchanges As HODLers Lose Faith In Centralized Entities: Crypto Insights Firm,"Arcane Research says that investors are moving their Bitcoin (BTC) out of exchanges as crypto users increasingly prefer holding their own digital assets. In a new report, the crypto insights firm says that the benchmark digital asset has been flowing out of exchanges for seven of the past eight m... (Read More...)",51.29,40.0,0.01156628131866455,74.695,55.61688311688312,0.20815134048461914,2022-08-24
44,CryptoGlobe,"With Ethereum’s “Merge” 22 Days Away, CZ Says “Trade $ETH for Free on Binance”","On Tuesday (August 23), with Ethereum’s “Merge” upgrade, which marks the Ethereum network’s transition from proof-of-work (PoW) to proof-of-stake (PoS) just over 22 days away, the Binance Co-Founder and CEO delivered good news to $ETH traders. Here is how Ethereum Foundation explains the Merge, w... (Read More...)",75.53,70.0,1.42441987991333,72.02,80.0,0.41666924953460693,2022-08-24
45,CoinTelegraph,"Celsius calls out Prime Trust in court, alleging firm didn't turn over $17M in crypto","""Prime Trust was obligated under the Bankruptcy Code to deliver all property belonging to Celsius [...] including these remaining crypto assets,"" said Celsius' legal team. (Read More...)",75.53,40.0,0.11736452579498291,79.295,67.5,3.2620638608932495,2022-08-24
46,Bitcoinist,Why Celsius Filed A Counter Lawsuit Against KeyFi For “Stealing Millions”,"According to a document filed with the Southern District of New York, crypto lending firm Celsius Network and Celsius KeyFi introduced a lawsuit against trading firm KeyFi and Jason Stone. The crypto lending firm claims Stone and his company were “incompetent” and “deceitful” during their partner... (Read More...)",38.685,50.0,1.276862621307373,38.685,47.759740259740255,0.03196299076080322,2022-08-24
47,Finbold,"Tech mogul John McAfee ‘faked death and is alive’ in Texas, ex-girlfriend claims",The ex-girlfriend of crypto proponent and tech mogul John McAfee has claimed that the computer programmer is still alive and... Continue reading (Read More...),20.029999999999998,55.00000000000001,4.460906982421875,69.08999999999999,65.0,92.784783244133,2022-08-24
48,CoinGape,Just-In: Bitfinex To Support Ethereum PoW (ETHPoW) Fork,Bitfinex rolls out plans to support the Ethereum PoW (ETHPoW) fork ahead of The Ethereum Merge. Several big names in the industry have declared support for the imminent fork to the Ethereum blockchain post-Merge. Bitfinex is the latest in line to join in the bandwagon. BitFinex Derivatives launch... (Read More...),70.095,50.0,11.004874110221863,88.25,62.5,89.14080858230591,2022-08-24
49,CoinTelegraph,Rep. Emmer demands an explanation of OFAC’s Tornado Cash sanction from Sec. Yellen,The Minnesota Republican highlighted the practical issues that could allegedly arise from the placement of smart contract addresses on the SDN list in a series of pointed questions. (Read More...),50.0,45.0,0.9859293699264526,70.095,60.238095238095234,90.69679081439972,2022-08-24
50,CryptoGlobe,$BTC: A Weaker U.S. Dollar Allows Bitcoin and Rest of the Crypto Market to Move Higher,"Although the U.S. Dollar Index (DXY) surged to 109.22 — its highest level in over two decades — earlier today, since then it has dropped to 108.60, thereby allowing stocks and crypto to get some badly needed oxygen. Wikipedia says the U.S. Dollar Index” (DXY)—which is designed, maintained, and pu... (Read More...)",27.98,62.5,0.25436878204345703,26.165,46.666666666666664,0.10481476783752441,2022-08-24
51,Bitcoinist,Bitcoin Total Exchange Flows At Multi-Year Lows As Interest In BTC Remains Low,"Data shows the total Bitcoin inflows and outflows on exchanges have gone down in recent weeks as the general interest in the crypto remains low. Bitcoin Total Exchange Flows Are Now At Multi-Year Lows According to the latest weekly report from Glassnode, activity on exchanges has dropped to level... (Read More...)",51.29,50.0,0.039950013160705566,51.29,55.59027777777777,0.005429983139038086,2022-08-24
52,NewsBTC,"Bitcoin Realized Losses Going Down, But Still At Significant Value","Data shows the net amount of losses being realized in the Bitcoin market is going down, but nonetheless remains at a high value. Bitcoin Net Realized Profit/Loss Still Has A Pretty Negative Value As per the latest weekly report from Glassnode, the net loss realization has reduced a bit recently, ... (Read More...)",76.73,55.486111111111114,99.66160655021667,58.275,54.772222222222226,98.6611545085907,2022-08-24
53,The Daily Hodl,Analyst Says Bitcoin (BTC) and Crypto Bear Market Just Getting Started – Here’s Why,"Closely followed analyst Nicholas Merten says that Bitcoin (BTC) and crypto markets are only at the beginning of an extended bear cycle. In a new strategy session, the host of DataDash tells his 515,000 YouTube subscribers that other markets are already starting to signal that an unfavorable macr... (Read More...)",50.0,50.0,1.3507038354873657,50.0,55.11363636363637,79.33809459209442,2022-08-24
54,crypto.news,Nvidia Announces Several Metaverse Projects at SIGGRAPH 2022,"Since the Metaverse began to gain momentum, various firms have joined the trend. A popular manufacturer of GPUs, Nvidia, would not be left out as the company has decided to enter the Metaverse fully. At SIGGRAPH, the company said it… (Read More...)",50.0,50.0,99.02808368206024,86.75500000000001,63.74999999999999,98.45314621925354,2022-08-24
55,BeInCrypto,POS Ethereum Will Be Censorship and OFAC Resistant Argues Eric Wall,"In the wake of sanctions from the Office of Foreign Assets Control (OFAC) against Tornado Cash, crypto analyst Eric Wall has trashed the possibility of an OFAC-compliant Ethereum chain, calling the notion “dead on arrival.” The post POS Ethereum Will Be Censorship and OFAC Resistant Argues Eric W... (Read More...)",30.910000000000004,50.0,22.037839889526367,38.685,52.916666666666664,0.011530518531799316,2022-08-24
56,CryptoPotato,Coinbase Slapped With Another Lawsuit for Crashing During Market Volatility,Coinbase’s latest lawsuit alleges that it failed to uphold customer account access when it mattered most. (Read More...),38.685,50.0,0.060996413230895996,18.154999999999998,62.5,0.03609359264373779,2022-08-24
57,The Daily Hodl,Creditors of Bankrupt Voyager Digital Oppose Company Giving Out Bonuses to Employees,"An embattled crypto brokerage firm is under fire for seeking to pay out nearly $2 million as part of an employee retention package. According to a new filing in a New York bankruptcy court, lawyers speaking on behalf of a group of unsecured creditors are disputing Voyager Digital’s proposed Key E... (Read More...)",67.0,50.0,1.7666518688201904,10.18,54.8051948051948,0.0548243522644043,2022-08-24
58,The Daily Hodl,The X.LA Metaverse Revealed in Detail,"August 23, 2022 – Cologne, Germany X.LA Foundation executive Aleksey Savchenko has revealed details of the eagerly anticipated X.LA metaverse. Before an expectant crowd at Gamescom in Cologne, Germany, Savchenko promised an immersive experience, delineating a vision backed by technology that will... (Read More...)",50.0,50.0,99.98517334461212,86.75500000000001,75.0,99.98960793018341,2022-08-24
59,The Daily Hodl,Coinbase Puts Two Low Cap Ethereum Altcoins on Its Listing Roadmap As Crypto Markets Stall,"Top US crypto exchange Coinbase has put two Ethereum-based altcoin projects on its roadmap to becoming a part of its burgeoning roster of tradable assets. Announcing via Twitter, Coinbase says it has placed Aurora and MXC to its roadmap. Aurora aims to execute Ethereum contracts on the NEAR block... (Read More...)",27.98,50.0,0.3476649522781372,68.06,69.375,99.74746704101562,2022-08-24
60,Bitcoin.com,What Is The Merge? A Brief Explanation of Ethereum’s Transition From Proof-of-Work to Proof-of-Stake,"In 23 days the Ethereum network will transition to a proof-of-stake (PoS) consensus algorithm after operating as a proof-of-work (PoW) blockchain since July 30, 2015. While the change may not mean much to ethereum users and traders, what’s changing under the hood is a very big deal. You’ve Heard ... (Read More...)",50.0,50.0,97.42721617221832,50.0,60.703125,76.10257267951965,2022-08-24
61,AMBCrypto,Analyzing Lido Finance’s potential to rise beyond staking domain,"Lido Finance [LDO], the largest platform for liquid staking services on Ethereum [ETH] continues to impress investors. In the past week, the native token (LDO) rallied more than 18% on CoinMarketCap. Even at press time, LDO surged by more than 11%, changing hands at $2.15. But does the platform h... (Read More...)",50.0,50.0,96.88643515110016,61.91,65.625,91.04196727275848,2022-08-24
