,source,title,excerpt,vader_sentiment_title,tb_sentiment_title,flair_sentiment_title,vader_sentiment_excerpt,tb_sentiment_excerpt,flair_sentiment_excerpt,date
170,CryptoSlate,Congressman Tom Emmer alleges SEC Chairman Gensler was aware of FTX fraud,"United States Congressman Tom Emmer has alleged that SEC Chairman Gary Gensler knew that FTX was fraudulent, but still held meetings with the disg...",20.705000000000002,53.75,0.119057297706604,47.42,45.0,0.7719278335571289,2022-12-14
171,AMBCrypto,"Bitcoin rallies from $17k after core CPI data release, should you go long now?",Disclaimer: The findings of the following analysis are the sole opinions of the writer and should not be considered investment advice The lower ti...,50.0,47.5,0.008159875869750977,35.199999999999996,50.0,2.977427840232849,2022-12-14
172,Finbold,Bitcoin outperformed the financial markets in 7 out of last 10 years,"Bitcoin (BTC) has long been associated with high volatility, with the digital currency making attempts to become a mainstream financial … Continued",50.0,50.0,1.0419189929962158,50.0,51.37500000000001,2.484142780303955,2022-12-14
173,Crypto Daily™,Coinbase Adds 19 Million Verified Users Despite Market Downturn,"The unprecedented market turndown has certainly claimed many victims in 2022, with companies and crypto exchanges crashing left, right and center....",50.0,50.0,99.90975558757782,51.29,62.5,0.7142573595046997,2022-12-14
174,CoinGape,Big Short’s Michael Burry Returns To Twitter,,50.0,50.0,0.9682416915893555,50.0,50.0,0.0,2022-12-14
175,CryptoSlate,BUSD’s supply falls below $20B as USDC’s supply climbs above $45B,Binance USD&#8217;s (BUSD) supply declined by over 15% to $18.8 billion from $22 billion within the last 24 hours after Binance experienced a surg...,50.0,50.0,0.1867741346359253,50.0,70.0,0.004655122756958008,2022-12-14
176,CoinGape,Here’s How Much Your $100 Investment in Tron Will Be Worth If TRX Reaches $1,"Altcoins: Tron (TRX) has seen a fair amount of volatility over the years. With a market capitalization of $5 Billion, it seeks to host a global en...",63.660000000000004,62.5,0.5311161279678345,65.91,67.5,1.7477631568908691,2022-12-14
177,Cointelegraph,"Alameda had ‘unfair’ trading advantage, special access to FTX funds: CFTC filing","CFTC court filing outlines a murky relationship between FTX and Alameda Research, highlighting the latter’s unfair trading advant...",78.595,46.42857142857143,17.363986372947693,26.165,37.5,1.331809163093567,2022-12-14
178,NewsBTC,Senator Lummis Claims Pouring Retirement Funds In Bitcoin Is Still A Good Idea,"Bitcoin is widely regarded as a store of value by most investors. However, in the year, the value of bitcoin plummeted due to macroeconomic factor...",72.02,85.0,6.065225601196289,79.295,54.58333333333334,0.007897615432739258,2022-12-14
179,CoinGape,“Epsteined” Trends On Twitter After SBF Arrest,,32.99999999999999,47.5,0.19271373748779297,50.0,50.0,0.0,2022-12-14
180,Seeking Alpha,Bitfarms receives Nasdaq non-compliance notification,Bitfarms (NASDAQ:BITF) has received a Nasdaq notification for failing to meet the exchange's minimum bid price continued listing requirement. For...,50.0,50.0,0.008949637413024902,24.47,50.0,0.029414892196655273,2022-12-14
181,Protos,Justin Sun’s stablecoin USDD quietly loses peg amid FTX chaos,Justin Sun's stablecoin USDD has been unable to maintain a price of $1.00 ever since FTX and Alameda went bankrupt. What's the deal? The post Just...,14.079999999999998,35.0,0.10589063167572021,22.13,25.0,0.001239776611328125,2022-12-14
182,CoinGape,"What Is Monero (XMR)? Monero Price Trends, Key Events, Mining","While Bitcoin is definitely the largest cryptocurrency to ever exist, it has various shortcomings as well. Since the beginning, crypto enthusiasts...",50.0,50.0,1.369825005531311,79.295,50.0,0.016951560974121094,2022-12-14
183,Cointelegraph,"Listen up! Cointelegraph launches crypto podcasts, starting with 4 shows",Want more crypto content? Cointelegraph’s new podcast section features four separate shows exploring a variety of impactful topic...,50.0,50.0,99.71018135547638,53.86,65.9090909090909,98.35855066776276,2022-12-14
184,CoinGape,Elon Musk Hints Of Building Payment App To Compete With PayPal,Elon Musk indicates that he is working on a Twitter payment processor which is going to be better than PayPal. When a twitter user questioned whet...,50.0,50.0,76.29267275333405,68.06,75.0,0.2947390079498291,2022-12-14
185,CryptoSlate,Total crypto market cap makes 4 week high to $874B following CPI release,The total crypto market cap recorded inflows of $27.2 billion in the last 24 hours to post a four-week high of $871.4 billion. The post Total cry...,50.0,52.666666666666664,0.0022411346435546875,50.0,52.0,0.002175569534301758,2022-12-14
186,CoinGape,Why XRP Lawsuit Is More Important Than Ever For SEC?,"XRP Lawsuit: The arrest of FTX’s Former CEO, Sam Bankman-Fried (SBF) turned out to be the biggest positive news for the crypto market in a very lo...",52.49,63.33333333333333,20.754221081733704,53.86,54.715909090909086,2.0599812269210815,2022-12-14
187,Cointelegraph,SEC sues Atlas Trading for $100M stock manipulation scheme,"Eight individuals promoted deceptive demand for stocks via Twitter, Discord and YouTube to sell their shares at a high point. ...",35.199999999999996,45.0,0.024497509002685547,60.114999999999995,57.99999999999999,0.2998441457748413,2022-12-14
188,Bitcoinist,Australia To Make Regulatory Changes To Boost Security In Crypto Sector,"Given the prevalence of scams and fraud in the crypto industry, governments of different countries are trying to protect their citizens. The FTX, ...",81.245,50.0,86.84680759906769,14.079999999999998,50.0,2.1748006343841553,2022-12-14
189,U.Today,XRP Reclaims 6th Spot in Crypto Market Rankings Amid Fresh Inflows,XRP flips BUSD to reclaim sixth spot in crypto rankings,65.91,65.0,99.77606534957886,50.0,50.0,21.418491005897522,2022-12-14
190,AMBCrypto,"Polkadot’s parachain, ecosystem projects thrive, but when will DOT follow the suit?","Polkadot’s latest tweet revealed all the developments that happened in the last few weeks.  Metrics looked positive for the crypto, but a decline ...",50.0,50.0,1.8260985612869263,65.91,56.59090909090909,0.0017881393432617188,2022-12-14
191,CoinGape,"Tron Founder Justin Sun Withdraws 100M BUSD From Binance, FUD Ending?",Tron founder Justin Sun on Wednesday withdrew 100 million BUSD stablecoins from crypto exchange Binance. The 100 million BUSD withdrawn was then m...,28.610000000000003,50.0,0.00712275505065918,50.0,50.0,0.044977664947509766,2022-12-14
192,Cryptonews,Cardano Price Forecast – Can ADA Blast Up to $1 This Week?,Cardano's price is up modestly as investors are focusing on recent US inflation data and the Fed's decision on interest rates.&#160; The ninth-la...,50.0,50.0,0.1650780439376831,72.94,52.5,86.33737564086914,2022-12-14
193,CoinGape,VanEck Predicts Bitcoin Could Fall To $10k By This Time,,50.0,50.0,0.013628602027893066,50.0,50.0,0.0,2022-12-14
194,AMBCrypto,Italy onboards Algorand for bank and insurance guarantees,"Blockchain layer-1 platform The Italian banking and insurance industries will adopt an &#8220;innovative digital guarantees platform,&#8221; which...",50.0,50.0,99.1237610578537,58.894999999999996,50.0,99.9233067035675,2022-12-14
195,Crypto Daily™,Australia to regulate crypto service providers by early 2023,Australia will put a comprehensive framework together in early 2023 in which rules will be established for regulating crypto service providers. Th...,50.0,55.00000000000001,89.5003467798233,62.5,55.00000000000001,97.17169106006622,2022-12-14
196,Decrypt,Binance CEO Tells Staff Next Few Months ‘Will Be Bumpy’: Report,"The statement comes as Binance comes under intense scrutiny from both the private and the public sectors, as well as its own customers.",50.0,45.0,1.2642085552215576,67.0,60.0,1.665833592414856,2022-12-14
197,CoinGape,SBF Parents Face Scrutiny As SBF Appears In Court,,50.0,50.0,1.711660623550415,50.0,50.0,0.0,2022-12-14
198,The Block,Compound DAO sued by plaintiffs who held only $100 in COMP tokens,The plaintiffs accused Compound DAO and the other defendants of violating U.S. securities regulations by selling COMP tokens to inves...,50.0,50.0,0.008565187454223633,22.884999999999998,43.75,0.07458627223968506,2022-12-14
199,Finbold,"Crypto Fear & Greed index hits 30-day high after better-than-expected inflation, CPI data","Bitcoin (BTC) is currently focusing on reclaiming the $18,000 level as the flagship cryptocurrency shows signs of a possible bullish … Continued",14.52,57.99999999999999,0.439608097076416,55.135,50.0,1.1782705783843994,2022-12-14
200,Bitcoinist,"Bitcoin Vs. Gold: Why The Yellow Metal Will Outshine Crypto, According To Goldman Sachs","Bitcoin has been questioned for a very long time because of its unpredictability and speculative tendency. Goldman Sachs, one of the largest finan...",50.0,50.0,1.041969656944275,50.0,46.75,0.6229013204574585,2022-12-14
201,Cointelegraph,Bitcoin bear market 70% dip kills BTC ‘tourists’ as metric screams buy,"Bitcoin risk-return is now presenting a macro buying opportunity, says Philip Swift as data shows a move from capitulation to acc...",15.46,50.0,0.00603795051574707,77.86999999999999,50.0,98.01661372184753,2022-12-14
202,Decrypt,Australia to Launch Crypto Licensing Regime to ‘Modernize’ Financial System,"Australia's move to rope in crypto into a new licensing regime is part of the Treasury's ambitions to ""modernize"" its financial system.",50.0,50.0,22.531375288963318,50.0,53.40909090909091,14.890491962432861,2022-12-14
203,CryptoSlate,US authority alleges that SBF donated to politicians using other people’s name,An indictment filed by the Southern District of New York (SDNY) alleged that the arrested FTX founder Sam Bankman-Fried made political donations i...,53.86,43.75,0.046372413635253906,26.165,50.45454545454545,0.3033250570297241,2022-12-14
204,CoinGape,Shiba Inu News: SHIB Tokens Emerges As Top Choices Among Ethereum Whales,"Shiba Inu Coin News: Shiba Inu (SHIB), the world’s second-largest meme cryptocurrency is trading under increased selling pressure due to the recen...",60.114999999999995,75.0,99.96914267539978,48.71,43.75,12.420901656150818,2022-12-14
205,Cointelegraph,Jack Dorsey pushes for decentralized Twitter alternative,Former Twitter CEO Jack Dorsey highlighted that a solution to Twitter’s censorship issues is making a platform resilient from cor...,50.0,50.0,18.77373456954956,65.91,50.0,20.39109766483307,2022-12-14
206,NewsBTC,CFTC Deems Ethereum A Commodity In Recent Court Filing – Here’s Why,Cryptocurrencies like Ethereum have their fair share of controversy regarding categorization. Government regulatory bodies like the Securities and...,50.0,50.0,6.550982594490051,93.29,85.0,5.042198300361633,2022-12-14
207,The Block,Scottie Pippen unpacks the power of flexing in the metaverse,"In this episode of The Scoop, Scottie Pippen and Orange Comet CEO Dave Broome discuss how Web3 is creating new ways for celebrities a...",50.0,50.0,99.88498389720917,71.075,56.81818181818181,11.632040143013,2022-12-14
208,Crypto Daily™,Algorand To Support Digital Guarantees Platform In Italy,The Layer-1 blockchain technology protocol Algorand has been chosen as the public blockchain to support bank and guarantees insurance in Italy.&nb...,70.095,50.0,99.28781688213348,70.095,50.0,99.94752109050751,2022-12-14
209,Decrypt,"Avalanche, Solana Jump as Crypto Market Claws Back $26 Billion Overnight","As the wider crypto market recovered some ground on Tuesday, the Avalanche and Solana tokens are among the day's top gainers.",50.0,50.0,8.494284749031067,60.114999999999995,75.0,99.9680370092392,2022-12-14
210,Bitcoinist,"FTX CEO Ray Says It’s Impossible To Recoup All Losses, US Clients Fare Better",Yesterday&#8217;s testimony hearing of new FTX CEO John Ray III to the U.S. House of Representatives Financial Services Committee brought to light...,52.580000000000005,45.833333333333336,0.02892613410949707,50.0,58.93939393939394,2.047121524810791,2022-12-14
211,BSCnews,BNB Chain Launches Kickstart to Help Developers Scale,Build and scale your dApps on BNB Chain by utilizing premium services and critical development tools at special discounts.,70.095,50.0,96.67490422725677,55.135,58.92857142857143,99.90158379077911,2022-12-14
212,The Block,Binance CEO warns colleagues ‘crypto winter’ isn’t over: Bloomberg,"Binance CEO Changpeng Zhao reportedly warned colleagues that the proverbial ""crypto winter"" isn't over, and the months ahead won't be...",44.865,50.0,16.978004574775696,36.34,50.0,0.514480471611023,2022-12-14
213,AMBCrypto,FTX CEO John Ray’s Congressional testimony reveals SBF’s poor management,"The United States House Committee on Financial Services heard the testimony of John Ray III, the man in charge of cleaning up the mess at the bank...",26.165,30.0,0.02097785472869873,53.86,45.625,94.89718973636627,2022-12-14
214,CoinGape,"Worst 3 NFT Tokens This Week: Flow, Chiliz, and Axie Infinity Are The Big Coins In NFT That Dropped",NFT Tokens This Week: The past 7 days have been a very tumultuous period for an already shaky year for the crypto market. The coins have started t...,18.755,25.0,0.0004649162292480469,38.685,43.611111111111114,0.010392069816589355,2022-12-14
215,CoinGape,"Worst Performing 3 DeFi Tokens This Week: SushiSwap, Curve DAO Token, and Chainlink Are The Coins That Plummeted Most","This week, most of the coins in the crypto market had been trading in red. The result of this is that most coins on DeFi have been trading in the ...",18.755,37.5,0.0006616115570068359,50.0,66.66666666666666,0.0007808208465576172,2022-12-14
216,Bitcoinist,Financial Stability Board To Set Global Standards For Crypto Regulation In 2023,"Crypto regulations have been deliberated in and out of the industry. However, recent events have raised concerns about the lack of regulation on d...",50.0,50.0,99.44199025630951,34.089999999999996,50.0,2.443814277648926,2022-12-14
217,CoinGape,"Bitcoin Price Prediction: BTC Enters Pre-Halving Accumulation Phase, Time To Buy?","Bitcoin price rallied over $17.3k for the first time after the FTX crisis, rising almost 6%. The positive sentiments caused the BTC price to skyro...",50.0,50.0,0.008818507194519043,40.325,61.93181818181819,1.7162621021270752,2022-12-14
218,CryptoSlate,"CFTC considers Bitcoin, Ethereum, Tether to be commodities",The United States Commodity Futures Trading Commission (CFTC) stated in its December 13 court filing against FTX founder Sam Bankman-Fried that di...,50.0,50.0,0.2953141927719116,71.075,50.0,0.0118941068649292,2022-12-14
219,CoinGape,CFTC Reveals Alameda Had “Speed” Advantage On FTX,The US Commodity Futures Trading Commission asserts that Sam Bankman-trading Fried&#8217;s firm Alameda Research had a covert speed advantage when...,62.5,50.0,89.97839391231537,62.5,40.0,1.0235488414764404,2022-12-14
220,Crypto Daily™,FTX Stored Private Keys Without Encryption; Left Funds Vulnerable,The Pandora&rsquo;s Box that is the FTX debacle continues to churn out one astonishing revelation after another about the leadup to the exchange&r...,38.685,41.66666666666667,0.059282779693603516,50.0,75.0,0.04706084728240967,2022-12-14
221,Cointelegraph,Crypto blame game back on US Senators' menu following SBF arrest,"While Congressman Brad Sherman saw SBF as the poster child of the crypto ecosystem, congressman Tom Emmer highlighted the crypto ...",20.705000000000002,44.375,0.19263029098510742,50.0,50.0,94.21447813510895,2022-12-14
222,Cointelegraph,Crypto blame game back on US politicians' menu following SBF arrest,"While U.S. Representative Brad Sherman saw Sam Bankman-Fried as the poster child of the crypto ecosystem, Congressman Tom Emmer h...",20.705000000000002,44.375,0.1578688621520996,50.0,50.0,1.0045737028121948,2022-12-14
223,Cointelegraph,Bahamian securities regulator slams new FTX CEO over 'misstatements',"Bahamian regulators say that they were the first to take action against SBF, and that recent actions of the current CEO hindered ...",64.8,56.81818181818181,0.544053316116333,50.0,51.5,0.09572505950927734,2022-12-14
224,The Block,Atlas Trading founders targeted by SEC for alleged fraud via Twitter and Discord,"The founders of Atlas Trading and several alleged co-conspirators have been accused of stock manipulation, using Twitter and Discord,...",12.104999999999999,45.0,0.11381804943084717,23.665000000000003,47.5,0.13234615325927734,2022-12-14
225,AMBCrypto,"Bitcoin [BTC] bounces above 50-day MA, but what should LTH expect?","A surge in BTC&#8217;s demand in the spot market was observed in the last 24 hours at press time. Addresses with balances greater than 1,000 BTC h...",50.0,50.0,0.5120009183883667,62.5,62.5,98.02238643169403,2022-12-14
226,CoinGape,If Convicted SBF May Face This Much Jail Time,,50.0,45.0,0.41273534297943115,50.0,50.0,0.0,2022-12-14
227,CryptoGlobe,$ADA: Hoskinson Explains Why Making Solana a Sidechain of Cardano Is a Great Idea,"Charles Hoskinson, Co-Founder and CEO at Input Output Global (“IOG), the blockchain technology firm responsible for the development of Cardano ($A...",81.245,90.0,17.675909399986267,65.91,50.0,90.97189903259277,2022-12-14
228,CoinGape,"Twitter HQ Reportedly Behind Rent, Musk Set To Auction Off Supplies",,50.0,30.0,0.009641051292419434,50.0,50.0,0.0,2022-12-14
229,Cointelegraph,How to trade crypto using Wyckoff accumulation theory,Not all Wyckoff accumulation setups lead to massive price rallies as far as the Bitcoin and cryptocurrency markets are concerned....,50.0,50.0,92.86799430847168,50.0,52.5,0.04099905490875244,2022-12-14
230,CoinGape,CZ Issues Memo To Binance Staff Amid Heavy Withdrawal,"Binance, the world’s largest crypto exchange is witnessing heavy withdrawals amid the broad market recovery. As per the data provided by Nansen, A...",51.29,40.0,0.7606148719787598,50.0,46.5625,0.18053054809570312,2022-12-14
231,Use The Bitcoin,CZ: ‘Stress Test’ Is A Welcome Challenge As Binance Resumed USDC Withdrawal Requests,Cryptocurrency exchange Binance has been hit by large outflows as traders move to take custody of their tokens amid concerns about its proof of re...,76.335,90.0,24.622049927711487,50.0,60.71428571428571,0.1212090253829956,2022-12-14
232,The Block,Binance.US rolls out fee-free instant settlement feature ‘Pay’,"Binance.US introduced a new feature, Pay, that allows users to send, request and receive crypto with instant settlement and zero fees...",50.0,50.0,1.5414834022521973,44.865,53.40909090909091,15.763074159622192,2022-12-14
233,AMBCrypto,"CFTC again calls Ethereum [ETH] a commodity in a court filing, details inside",The Commodity Futures Trading Commission (CFTC) has again called the ETH coin a commodity in a court filing on 13 December. It has given rise to s...,50.0,50.0,1.1654764413833618,50.0,50.0,0.4089951515197754,2022-12-14
234,Bitcoinist,CZ Says Binance ‘Will Survive Any Crypto Winter’ – On-Chain Data Too?,"Binance experienced a historic day and stress test yesterday after several rumors and FUD surfaced. As Bitcoinist reported yesterday, most of it w...",50.0,50.0,0.563010573387146,15.794999999999998,66.25,0.31372010707855225,2022-12-14
235,NewsBTC,"Bitcoin Zeroes In On $18,000 – Can BTC Upside Breakout Materialize?","After weeks of consolidation, Bitcoin &#8211; the largest cryptocurrency by market capitalization &#8211; and the broader cryptocurrency market ha...",50.0,50.0,0.010320544242858887,50.0,50.0,23.05823564529419,2022-12-14
236,The Block,Australia plans framework for crypto service-provider regulation in 2023,The Albanese government aims to define what digital assets should be subject to financial services laws and how to safeguard consumer...,50.0,50.0,95.89985013008118,75.53,47.22222222222222,92.58309304714203,2022-12-14
237,AMBCrypto,Why 1INCH should be among the top cryptos in your watchlist this week,"Top addresses have been accumulating 1INCH since the start of the month. Moreover, 1INCH has been flowing out of exchanges for the last two weeks....",60.114999999999995,75.0,94.51391100883484,60.114999999999995,62.5,0.0003695487976074219,2022-12-14
238,CoinGape,Jack Dorsey Reveals “Biggest Mistake” He Made As Twitter Head,"Former Twitter CEO Jack Dorsey commented on the revelations in the &#8220;Twitter Files&#8221; in a blog post published on Tuesday. He said that, ...",50.0,50.0,0.0471264123916626,50.0,50.0,1.8728584051132202,2022-12-14
239,Crypto Daily™,Binance Announces Resumption Of USDC Stablecoin Withdrawals,Cryptocurrency exchange Binance has announced that it is resuming USDC stablecoins after temporarily pausing requests for several hours.&nbsp; The...,50.0,50.0,0.09285807609558105,50.0,50.0,0.007545948028564453,2022-12-14
240,CoinGape,"Top Crypto Gainers Today: Toncoin Price Jumps 12.06%, Bitcoin, Aptos, & Solana Also See Positive Price Movement","Following better-than-expected US inflation data, today&#8217;s crypto market saw a bullish run. The Price of major cryptocurrencies contributed t...",82.985,68.18181818181819,99.3716448545456,50.0,51.5625,0.002294778823852539,2022-12-14
241,AMBCrypto,Revolutionizing the financial norm with decentralization: An interview with Akt.io,"In 2017, Automata Group launched the AKT.IO project. Gael ITIER gathered a team of experts in traditional finance, blockchain, and tech in order t...",50.0,50.0,99.50725436210632,56.400000000000006,50.0,98.8289475440979,2022-12-14
242,buzzsprout,"Dec 14: SBF denied bail, charges revealed, U.S. politician calls him 'snake,' new FTX CEO speaks out","<p>On today's CoinMarketRecap with Connor Sephton, Sam Bankman-Fried is denied bail in The Bahamas and will remain behind bars until February at t...",19.379999999999995,56.81818181818181,0.0691533088684082,27.98,30.0,6.3675642013549805,2022-12-14
243,BeInCrypto,Bitcoin Exchange Exodus Continues as Self-Custodied Supply Hits New High,"Crypto investors are still moving their Bitcoin off exchanges, but not necessarily to sell it. The amount of BTC held off-exchange is now at its h...",50.0,57.40909090909091,2.745261788368225,50.0,50.0,0.5993008613586426,2022-12-14
244,CoinGape,"Binance News: “Things Have Stabilized, Deposits Are Coming Back In” – CEO CZ",Binance CEO Changpeng &#8220;CZ&#8221; Zhao on Wednesday said deposits are coming back to the crypto exchange. The FUD surrounding Binance facing ...,50.0,50.0,97.38467633724213,28.610000000000003,50.0,0.0027894973754882812,2022-12-14
245,CoinGape,"SBF Cites Vegan Diet To Keep Out Of Jail, Bail Denied",,27.98,45.0,3.25181782245636,50.0,50.0,0.0,2022-12-14
246,Cointelegraph,White House silent on whether it will return $5.2M in donations from SBF,A White House spokesperson dodged point-blank questioning on whether President Joe Biden is planning to return the political dona...,50.0,50.0,0.16237497329711914,44.865,50.0,1.7477244138717651,2022-12-14
247,CoinGape,Crypto Prices Today 14 Dec: The Market Bounces Back; Curve DAO Token Soars By 8.09%,Crypto Prices Today: The market had seen several days of trading in red this week. Today morning we woke up to greenly painted charts as all the m...,50.0,50.0,1.100805401802063,50.0,46.666666666666664,0.16988515853881836,2022-12-14
248,Bitcoinist,Sam Bankman-Fried To Spend Christmas In Jail After Bahamas Judge Denied Him Bail,"Things are not looking good for Sam Bankman-Fried ahead of Christmas. Well, what&#8217;s there to be excited about when spending the Yuletide seas...",27.98,45.0,90.35305976867676,63.59,76.875,20.078420639038086,2022-12-14
249,CoinGape,Bank Run: Binance CEO Warns Staff Of Tough Times,,38.685,30.555555555555557,19.78510320186615,50.0,50.0,0.0,2022-12-14
250,Cointelegraph,Binance US finally rolls out mobile payments service to US customers,"Binance’s US arm has rolled out a feature for US customers called ""Pay"" which was launched by its global parent to users outside ...",50.0,50.0,0.24562180042266846,56.400000000000006,50.0,97.13691473007202,2022-12-14
251,Cointelegraph,Binance.US finally rolls out mobile payments service to US customers,"Binance’s US arm has rolled out a feature called ""Pay"" that was launched by its global parent to users outside the US in 2021. ...",50.0,50.0,0.1949310302734375,56.400000000000006,50.0,80.43168485164642,2022-12-14
252,CoinGape,"Crypto News Live Updates Dec 14: Bitcoin, Ethereum Price Jumps; SBF Bail Denied",Crypto News Today Live Updates December and Latest News: (14 December 2022) The global digital asset market registered a broad recovery on Wednesd...,27.98,56.81818181818181,0.01639723777770996,68.06,49.57386363636363,79.65175211429596,2022-12-14
253,Cointelegraph,Australian 'token mapping' consultation paper to release in early 2023: Treasurer,The consultation paper will give an insight into how certain crypto assets should be regulated alongside frameworks for company l...,56.400000000000006,52.5,99.90253448486328,71.075,60.71428571428571,97.39111959934235,2022-12-14
254,AMBCrypto,Stader Labs unveils plan for DeFi-friendly solutions on Ethereum,"Stader Labs, a leading multi-chain liquid staking protocol, has announced that it is launching its liquid staking solution, ETHx for Ethereum. Thi...",58.894999999999996,50.0,99.58537518978119,65.91,50.0,15.629571676254272,2022-12-14
255,CoinGape,Australia Targets Crypto In Major Regulatory Changes for 2023,"On Wednesday, December 14, the Australian government said that it&#8217;s taking enough steps to improve regulation for crypto service providers. ...",50.0,53.125,22.690197825431824,72.02,50.0,8.745476603507996,2022-12-14
