,source,title,excerpt,vader_sentiment_title,tb_sentiment_title,flair_sentiment_title,vader_sentiment_excerpt,tb_sentiment_excerpt,flair_sentiment_excerpt,date
127,Cointelegraph,Metaverse sneak peek: Project aims to build a creator-focused economy through blockchain,Cointelegraph explored Web3 creator economy protocol DEIP’s metaverse in an online event last week. (Read More...),50.0,50.0,97.00380861759186,50.0,62.5,93.11487078666687,2022-06-09
128,U.Today,Alibaba's Cloud Branch Launches Own NFT Service,Alibaba Cloud merges into NFT space with new solution (Read More...),50.0,80.0,97.58765399456024,65.91,65.9090909090909,99.6641993522644,2022-06-09
129,Bitcoin Magazine,365 Days Of Financial Freedom: The Stories Of Bitcoin Adoption In El Salvador,"A year after the introduction of bitcoin as legal tender in El Salvador, we can reflect on the stories of those who’ve experienced the adoption firsthand. (Read More...)",81.845,50.0,99.64376091957092,56.400000000000006,75.0,99.59039390087128,2022-06-09
130,Bitcoin Magazine,From Bernie To Bitcoin: In Search Of The Revolution,One man’s journey in search of the revolution he thought would be brought about by trusting a one-person solution for fixing America’s problems. (Read More...),50.0,50.0,24.203765392303467,65.91,75.0,97.97782003879547,2022-06-09
131,CoinGape,THETA Price Analysis: Rising RSI Slope Encourages $1.52 Breakout,"The widespread uncertainty in the crypto market has bounded the THETA price action within the $1.52 and $1 mark. Therefore, the interested need to be patient in this no-trading zone and wait for a decisive breakout before they position their funds. Furthermore, a potential breakout from the overh... (Read More...)",72.02,50.0,0.2305150032043457,64.8,60.62499999999999,0.14230608940124512,2022-06-09
132,U.Today,"GYM Network Protocol Hacked, $2,1 Mln Stolen: Here's How",An error in a single function of a liquidity pool codebase resulted in seven-digit losses (Read More...),14.52,50.0,0.0034332275390625,17.015,60.71428571428572,0.0014781951904296875,2022-06-09
133,U.Today,ApeCoin (APE) Becomes Most Traded Asset Among Whales In Last 24 Hours,"Despite being popular asset among whales, ApeCoin fails to deliver any kind of performance on cryptocurrency market (Read More...)",70.865,62.5,97.97849953174591,13.074999999999998,65.0,0.024700164794921875,2022-06-09
134,Crypto Daily,"Three Cryptocurrencies That Will Give You A High ROI In 2022: Uniswap (UNI), Binance Coin (BNB) and Chronoly (CRNO)","ROI, or return on investment, is a performance metric used to assess an investment's efficiency or profitability as well as used to compare the efficiency of many investments. The return on investment aims to directly evaluate the amount of profit made on any given investment in relation to its c... (Read More...)",50.0,57.99999999999999,86.26753389835358,93.895,68.33333333333333,97.98727631568909,2022-06-09
135,Crypto Daily,The Future Faces an Urgent Need to Up the Game on Waste Treatment.,"The EU has committed to reducing greenhouse gas emissions by at least 40% below 1990 levels by 2030, with at least 27% of total energy coming from renewables. The European Union is also turning away from outdated Waste-To-Energy burning processes. In concert with some influential European financi... (Read More...)",37.5,40.0,0.8477389812469482,86.345,46.42857142857143,84.89686250686646,2022-06-09
136,crypto.news,Solana Ventures Launches $100M Fund for Web3 Startups in South Korea,"Solana, a blockchain operator, unveiled its latest $100 million fund for South Korean web3 startups. The new fund is meant to foster the expansion of NFT, gaming, and DeFi initiatives on Solana, as well as to assist former Terra developers… (Read More...)",50.0,50.0,94.92582678794861,63.660000000000004,64.20454545454545,99.57607388496399,2022-06-09
137,The Block,Bitcoin mining difficulty increases by 1.29%,"Bitcoin network difficulty increased by 1.29%, according to BTC.com. (Read More...)",32.99999999999999,50.0,0.02288222312927246,46.14,75.0,0.04012882709503174,2022-06-09
138,U.Today,Bitfinex Delists MegaDogecoin (MDOGE) Pairs,"""Normal"" Dogecoin will remain available on exchange without any restrictions (Read More...)",50.0,50.0,87.85748183727264,50.0,67.5,13.522043824195862,2022-06-09
139,Crypto Briefing,Chainlink Targets Double Digits After Staking Roadmap Update,Chainlink has released a long-term roadmap detailing how the network plans to implement LINK token staking. Chainlink Breaks Out on Staking News Chainlink appears to be gaining bullish momentum after... (Read More...),50.0,50.0,0.0071048736572265625,71.075,75.0,0.03708302974700928,2022-06-09
140,CoinGape,Here’s How Altcoins Could Fare In The Near Future,"Despite speculation of Bitcoin dropping to the $20,000 mark, its market dominance trajectory appears to be on the upside. Currently, Bitcoin’s share of the cryptocurrency market stands at a staggering 47.33%, while altcoin prices suffered recently. BTC To Have 50% Market Share? According to Proje... (Read More...)",50.0,52.5,16.495797038078308,62.5,58.333333333333336,0.532957911491394,2022-06-09
141,CryptoPotato,Ripple Price Analysis: Fakeout or a Possible Rally for XRP After Reclaiming $0.4?,"Ripple is going through a sideways trend in line with the entire crypto market. Currently, the trading volume is low, and there is no reliable bullish sign in the price action. Technical Analysis By Grizzly The Daily Chart On the daily timeframe, XRP is trading on the horizontal support at $0.33 ... (Read More...)",50.0,50.0,0.061568617820739746,42.345,53.75,0.0008046627044677734,2022-06-09
142,The Block,Frax co-founders propose spending $20 million to buyback FXS token,Frax Finance co-founders have proposed a $20 million token buyback and burn program to boost the FXS token price. (Read More...),50.0,50.0,0.017976760864257812,70.095,75.0,0.41775405406951904,2022-06-09
143,CoinGape,AliBaba Launches NFT Tools Even As China Cracks Down,"Alibaba Cloud, a subsidiary of Alibaba Group, announced the launch of non fungible tokens (NFTs) solutions. The computing Company will also be building NFT marketplaces, including web hosting and content management. Meanwhile, the Chinese government has adopted a very restrictive approach toward ... (Read More...)",50.0,42.22222222222222,99.60694015026093,58.894999999999996,61.66666666666667,0.0148087739944458,2022-06-09
144,CryptoPotato,Russia’s Latest Bill Proposal Could Ban Crypto as a Payment Method,"If the Federal Council and President Putin greenlight the proposal, digital currencies will be illegal to be used as a means of settlement on Russia's territory. (Read More...)",22.13,75.0,0.07164478302001953,22.13,50.0,0.427323579788208,2022-06-09
145,Crypto Daily,"Launchpads: How Do PancakeSwap IFO, Binance Launchpad, and BoostX Compare?","When it comes to crypto, it can be difficult to know which projects are worth investing in, especially the newer projects entering the market. Having to consider profitability, scalability, community, and so on, there’s a lot to think about before investing. This is where launchpads come in. Laun... (Read More...)",50.0,50.0,0.17630159854888916,56.400000000000006,53.75,94.04810667037964,2022-06-09
146,U.Today,XRP Lawsuit: Ripple Case Direction Now to Be Determined by Speech of Former SEC Official: Fox Business,Ripple lawsuit could all come down to speech made by former SEC official (Read More...),56.400000000000006,47.5,9.22212302684784,38.685,53.05555555555556,0.12508928775787354,2022-06-09
147,Cryptomode,Top Liquidity Pools On Uniwap And PancakeSwap Today,"Liquidity pools across decentralized exchanges remain an excellent way to earn passive income on crypto holdings. Both Unsiwap and Pancakeswap present tremendous opportunities on this front. Unsurprisingly, stablecoins are the way to go for users with less risk appetite. Uniswap Has Outspoken USD... (Read More...)",60.114999999999995,75.0,99.78291392326355,87.12500000000001,66.66666666666666,99.38414990901947,2022-06-09
148,Trustnodes,"Ethereum Miners Add 200,000 ETH","ETH miners have increased their reserves over the past year after a 400,000 sell off in autumn 2020. (Read More...)",50.0,50.0,98.62923920154572,63.660000000000004,56.25,95.88751792907715,2022-06-09
149,U.Today,229 Million SHIB Burned in 11 Transactions: Report,"Quarter of billion SHIB destroyed since yesterday morning; however, by now, burn rate has begun to decrease (Read More...)",50.0,50.0,0.005280971527099609,25.305,75.0,0.2187579870223999,2022-06-09
150,The Daily Hodl,"Here’s What It Will Take for Ethereum, Solana and Avalanche To Spark Long-Awaited Rallies, According to Top Crypto Analyst","A closely tracked crypto strategist is mapping out high timeframe scenarios that will inspire bullish momentum in Ethereum (ETH) and two of its leading competitors. In a new strategy session, pseudonymous crypto analyst Cred says Ethereum is currently trading below crucial weekly support and bull... (Read More...)",70.095,75.0,93.15614998340607,87.53,57.96363636363636,0.03711283206939697,2022-06-09
151,CryptoSlate,LINK spikes 24% following Chainlink reveal of ‘Economics 2.0’ roadmap,"Decentralized oracle protocol Chainlink (LINK) posted details of its long-term goals and new roadmap on June 7, which will take the network to the “Chainlink Economics 2” era. (Read More...)",50.0,50.0,0.07652342319488525,50.0,65.9090909090909,17.19958782196045,2022-06-09
152,AMBCrypto,Bitcoin: Bull run or a bear halt? Here’s what crypto analysts are suggesting,"Major analysts across the crypto industry are predicting a bear run for Bitcoin [BTC] despite a recent price surge. Furthermore, a majority of the population holding the token is also reporting a negative sentiment over the prized BTC. The question is- What has led to this negative sentiment and ... (Read More...)",50.0,50.0,0.01774430274963379,19.379999999999995,49.625,0.012925267219543457,2022-06-09
153,Blockworks,Q&A: Bank of England Vet Says CBDCs Will Be a “Centerpiece to a Wider Ecosystem of Stablecoins”,Fireblocks’ Varun Paul says central banks feel growing pressure to offer alternative to stablecoins The post Q&amp;A: Bank of England Vet Says CBDCs Will Be a “Centerpiece to a Wider Ecosystem of Stablecoins” appeared first on Blockworks. (Read More...),50.0,50.0,90.00642597675323,43.6,62.5,7.162603735923767,2022-06-09
154,Bitcoin Magazine,The Bitcoin Network Is As Healthy As Ever,"Entities transacting on Bitcoin, network value and the number of addresses with non-zero balances all continue to grow, pointing toward greater adoption. (Read More...)",70.095,75.0,98.42303991317749,81.845,75.0,97.4574476480484,2022-06-09
155,BeInCrypto,South Korean Authorities Investigate Terraform Employee Over Bitcoin Theft,South Korean authorities have launched investigations into a Terraform Labs employee over alleged bitcoin embezzlement. The post South Korean Authorities Investigate Terraform Employee Over Bitcoin Theft appeared first on BeInCrypto. (Read More...),50.0,50.0,0.4554539918899536,56.400000000000006,60.83333333333334,0.050315260887145996,2022-06-09
156,Bitcoinist,"Cardano Is The Most Held Crypto In A Bear Market, Survey Shows","Cardano is showing some toughness in a time when its peers are just about to crack under pressure. The bear market is hammering the cryptocurrency market, with the majority of cryptocurrencies now trading at prices not seen since the middle of last year. However, this decline has created an oppor... (Read More...)",50.0,75.0,23.69314432144165,44.865,58.333333333333336,0.054073333740234375,2022-06-09
157,Decrypt,"Before Building the Metaverse, Blockchain Needs an Operating System","Blockchain needs an operating system, to provide a visual metaphor that everyone can understand and operate, argues Peer CEO Tony Tran. (Read More...)",50.0,50.0,3.5236358642578125,30.910000000000004,62.5,2.9863715171813965,2022-06-09
158,Cointelegraph,Wall Street sends BTC price to $30.8K as latest US dollar uptick fails,U.S. dollar strength is waning as traders hope for critical levels to break to exit Bitcoin’s “no trade zone.” (Read More...),28.925,50.0,0.006663799285888672,79.295,62.5,0.042939186096191406,2022-06-09
159,Bitcoin Magazine,3iQ Launches Australia’s Third Bitcoin ETF With A Unique Structure,3iQ’s fund operates as a mutual underlying fund of bitcoin holdings valued by the weighted average price of BTC without taking direct custody of any bitcoin. (Read More...),50.0,59.375,99.99014437198639,72.02,57.49999999999999,98.83843064308167,2022-06-09
160,CryptoPotato,DigitalBits XDB Added to List of Legalised Cryptocurrencies in Ukraine,"[PRESS RELEASE – Please Read Disclaimer] KYIV, Ukraine, — The cryptocurrency DigitalBits XDB has been added the list of approved cryptocurrencies in Ukraine and will be accepted for donations to support ongoing military and humanitarian needs. DigitalBits becomes the next cryptocurrency accepted ... (Read More...)",50.0,50.0,99.76668059825897,93.75,56.666666666666664,98.8980770111084,2022-06-09
161,Crypto Daily,MyFunding.Network: How This Trading dApp is Soaring in Popularity on the Market,"MyFunding.Network is a decentralized automated crypto trading application taking the whole market by storm. From the moment of its release, something about the platform attracted a significant amount of users to it, so much so that it is almost impossible not to wonder what exactly the roots of i... (Read More...)",73.83500000000001,50.0,96.68927192687988,77.86999999999999,57.15277777777777,99.97037053108215,2022-06-09
162,Crypto Daily,Does Mushe Token (XMU) Maintain a Better Blockchain Infrastructure Than The Sandbox (SAND) AND Stepn (GMT)?,A crypto token is a tradable asset and utility element on its blockchain. Investors utilise this cryptocurrency token for investments and resources in the project's ecosystem. The crypto market is springing up with several cryptocurrency options proving themselves better for investors. Upon a new... (Read More...),72.02,75.0,0.9966164827346802,82.985,64.20454545454545,99.95796084403992,2022-06-09
163,Finbold,"Ethereum’s total value locked in DeFi shrank 35% in May, while TRON’s rose 47%","At the end of April, Terra (LUNA) had more than $25 billion in total value locked (TVL), the second-largest decentralized... Continue reading (Read More...)",67.0,65.0,0.8249998092651367,67.0,66.66666666666666,0.7125824689865112,2022-06-09
164,Trustnodes,Medvedev Disses Geeks,The former President and Prime Minister of Russia Dmitry Medvedev has insulted geeks. Is Russia now ruled by thugs? (Read More...),44.865,50.0,8.058419823646545,21.405,62.5,0.3255605697631836,2022-06-09
165,NullTX,Investors Keep Losing Money As Terra Revival Plan Fails,"Ever since Terra Luna’s founder, Do Kown, unveiled a new “Terra Ecosystem Revival Plan 2” that’s supposed to bring back the glory days of Terra Luna, the asset, however, has been a free fall ever since. After a relatively small gain of about 77% immediately after launch, it seems investors are no... (Read More...)",17.015,25.0,0.05268752574920654,95.67999999999999,57.86363636363636,0.010332465171813965,2022-06-09
166,Decrypt,Ethereum’s Merge Upgrade Goes Live Today on Ropsten Testnet,"In a historic move, Ethereum's longest-running testnet called Ropsten is transitioning to a proof-of-stake algorithm on Wednesday. (Read More...)",50.0,56.81818181818181,98.08677434921265,50.0,62.5,0.1420736312866211,2022-06-09
167,Bitcoin.com,Binance US Adds Staking Services for 7 Different Crypto Assets,"Binance US is now offering crypto staking services and the firm details that seven digital currencies are currently available with annual percentage yields (APYs) up to 18%. Customers can earn yields on proof-of-stake (PoS) cryptocurrencies that include binance coin, solana, avalanche, livepeer, ... (Read More...)",58.894999999999996,50.0,99.6956318616867,50.0,58.75,99.24764931201935,2022-06-09
168,Cointelegraph,Edge announces confidential no-KYC digital currency Mastercard,"The company said there will be a $1,000 daily spending limit, but no personal information is required. (Read More...)",50.0,50.0,7.926419377326965,28.925,58.333333333333336,0.030618906021118164,2022-06-09
169,crypto.news,Krew Studios Unveils Ambitious Pastel World Metaverse,"Whether it’s Google Cloud creating a dedicated web3 unit, Japan’s Prime Minister incorporating web3 infrastructure into the country’s growth strategy, or Andreessen Horowitz earmarking $1.5 billion for blockchain startups, signs suggest that momentum is building for an interoperable landscape fea... (Read More...)",73.83500000000001,62.5,99.69978630542755,88.915,75.0,4.163160920143127,2022-06-09
170,Finbold,"SHIB loses over 20,000 holders in a week as demand for meme coin slumps","Meme cryptocurrency Shiba Inu (SHIB) is still reeling from the general crypto market volatility, with the coin losing a significant... Continue reading (Read More...)",28.925,35.0,0.004637241363525391,30.910000000000004,65.41666666666667,0.02149045467376709,2022-06-09
171,Cryptomode,Is Investing in NFTs Worth It Right Now?,The high demand for NFTs has had an interesting effect on the rise in the value of cryptocurrencies. Whether holding the digital rights to digital artwork by Beeple street art or Jack Dorsey’s first tweet is worth the valuations they are on the market is a question that investors ask themselves. ... (Read More...),61.315,64.64285714285714,98.34302961826324,83.525,62.21428571428571,99.8715728521347,2022-06-09
172,Cointelegraph,"Thailand’s crypto islands: Working in paradise, Part 1",(Read More...),81.845,50.0,99.99054968357086,50.0,75.0,96.50535881519318,2022-06-09
173,CryptoPotato,Discover Futuristic Opportunities of Toncoin on 1xBit,"[PRESS RELEASE – Please Read Disclaimer] With the latest upgrade on its database, you can use Toncoin as a payment method on 1xBit. Toncoin, one of the few established cryptocurrencies, has proven itself a remarkable asset – a blockchain platform from Telegram founders who initiated the Telegram ... (Read More...)",69.08999999999999,50.0,99.82888400554657,90.63,69.375,99.2342472076416,2022-06-09
174,Finbold,U.S. satellite TV giant DISH launches a loyalty coin system built on Cardano blockchain,"As the cryptocurrency market begins its slow path to recovery, Cardano (ADA) is among its best performers in the past... Continue reading (Read More...)",77.115,50.0,0.9344518184661865,81.845,61.875,97.65535891056061,2022-06-09
175,CoinGape,Bitcoin Price Analysis: When Will BTC Consolidation End?,"The Bitcoin(BTC) price responding to the descending trendline, faced another reversal on June 7th. Thus, continuing with a follow-up candle, the coin price registered a 2.82% intraday fall and the formation of an evening star pattern. Accordingly, sustained selling pressure could pull the BTC pri... (Read More...)",50.0,50.0,0.08987784385681152,35.199999999999996,75.0,0.036153197288513184,2022-06-09
176,Cryptomode,Trace Network Now Allows Minting Customized BUDDY Avatars with TRACE Tokens,"To expand the utility of its TRACE tokens, Trace Network Labs has now enabled the mining process of BUDDY NFT avatars with TRACE tokens on the app. With this new functionality, users will be able to mint their customized avatars generated by an algorithm with TRACE tokens. Using TRACE to mint BUD... (Read More...)",50.0,50.0,87.28124499320984,65.91,68.93939393939394,99.93520379066467,2022-06-09
177,Cryptomode,The Science DAO’s Token Launch Sets a new Paradigm for the Global Crypto Market,"As per recent estimates, the number of cryptocurrencies has surpassed 10,000. It indicates that the global digital assets market has come a long way since Bitcoin was introduced to the world in 2009, at the heel of the infamous economic crisis of 2008. That said, most crypto holders focus only on... (Read More...)",50.0,53.40909090909091,99.97720420360565,26.165,53.61111111111111,90.23929536342621,2022-06-09
178,CryptoPotato,"Despite the Bear Market, Michael Saylor Explains Why Bitcoin Is Going to $1M","Bitcoin is headed towards $1,000,000, while the US crypto-friendly regulatory bill recognizes digital assets are a ""real thing that is going to be with us,"" Saylor argued. (Read More...)",50.0,50.0,0.009319186210632324,39.885,61.66666666666667,0.05182623863220215,2022-06-09
179,Cointelegraph,"US central bank digital currency commenters divided on benefits, unified in confusion","Like a Rorschach ink blot, the Federal Reserve Board’s CBDC discussion paper provided stakeholders with an opportunity to find what they wanted to see in it. (Read More...)",72.94,50.0,0.07027089595794678,82.43,75.0,98.06250631809235,2022-06-09
180,Ethereum World News,Japan’s Crypto Exchange Supervisor Reasseses Token Listing Policy,Summary: Prime Minister Fumio Kishida suggested the current process stifles the crypto economy. The JVCEA could implement a new system by the end of the year. Token listings in Japan take as long as 6 months or more before approval is issued. A new policy could incentive foreign exchanges like Co... (Read More...),50.0,50.0,84.1111272573471,90.575,57.840909090909086,0.0639796257019043,2022-06-09
181,Bitcoin.com,"Bitcoin, Ethereum Technical Analysis: BTC Continues to Consolidate, Prices Move Slightly Above $30,000","Bitcoin moved away from Tuesday’s lows during the hump-day session, as prices were once again above $30,000. Prices have been hovering above and below this level over the last few weeks, with no significant gains in the period. ETH was also marginally higher. Bitcoin The volatility in crypto mark... (Read More...)",50.0,50.0,0.2831369638442993,52.580000000000005,52.589285714285715,0.010463595390319824,2022-06-09
182,Cointelegraph,Ethereum 'double doji' pattern hints at a 50% ETH price rally by September,"ETH's bullish reversal candlesticks form near a strong support confluence, raising anticipations about a sharp upside retracement ahead. (Read More...)",50.0,50.0,0.0806570053100586,85.92,61.354166666666664,99.76991713047028,2022-06-09
183,Cryptomode,How you can play casinos online from your phone – in the example of Mr.Play Casino,"Sophisticated technologies have greatly changed people’s lifestyles. Gambling could not avoid the influence of the Internet; thus, along with real casinos, online ones have been created. Online casinos provide more convenience and ease for the gamblers since you may enjoy the game at home. Many o... (Read More...)",67.0,50.0,7.876664400100708,95.455,68.75,94.17803883552551,2022-06-09
184,CryptoGlobe,Ripple’s Managing Director for Europe: ‘We Continue To See Strong Demand’,"On Tuesday, June 7, Sendi Young, Managing Director for Europe and UK at FinTech firm Ripple, explained during an interview why Ripple is continuing “to see strong demand.” On 30 June 2021, Ripple announced Young’s appointment. Ripple’s press release stated that Sendi will “oversee strategy and ch... (Read More...)",75.53,71.66666666666667,98.71978163719177,75.53,59.33333333333333,98.00840318202972,2022-06-09
185,Cryptomode,Tron (TRX) and Hedera (HBAR) Are Likely To Get Overtaken By Chronoly (CRNO),"Tron (TRX) and Hedera (HBAR) Are Likely To Get Overtaken By Chronoly (CRNO) So, what is the ‘Next Big Thing’ in the world of crypto? What’s the best investment right now? Who’s coin and brand is growing and whose is on the wane? We’re going to look at two solid coins, both of which are […] The po... (Read More...)",50.0,50.0,0.05378425121307373,89.645,62.755102040816325,0.47017931938171387,2022-06-09
186,Crypto Daily,Solana Ventures Set Up $100M Fund For South Korean Startups,"The $100 million investment and grant fund has been launched to fund Web3 startups in South Korea, primarily those involved in DeFi and GameFi. Solana Continues Expansion The fund has been established through the efforts of both Solana Ventures (the VC arm of the Solana ecosystem) and the Solana ... (Read More...)",50.0,50.0,84.79251563549042,72.94,72.5,99.6535986661911,2022-06-09
187,Trustnodes,Bitcoin Miners Accumulate 1.8 Million BTC,"Bitcoin miners seem to have moved counter-cyclically with their reserves, are their savings now too low and is accumulation coming? (Read More...)",50.0,50.0,0.004422664642333984,36.34,62.5,1.149025559425354,2022-06-09
188,The Block,Skolem announces $20 million Series A round led by Galaxy Digital,DeFi data and trade services provider Skolem announced a $20 million round amid a slowdown in such deals. (Read More...),50.0,45.0,18.242070078849792,50.0,55.00000000000001,0.17372071743011475,2022-06-09
189,U.Today,Shiba Inu's BONE to Go Live on This Digital Asset Derivatives Trading Platform: Details,BTCEX offers spot (leveraged spot included) and derivatives trading services (Read More...),68.06,53.40909090909091,99.98508393764496,50.0,65.0,87.14545369148254,2022-06-09
190,CryptoPotato,"BitKeep Debuts Decentralized Crypto Red Packets, Bringing Fun to Social Media Platforms","[PRESS RELEASE – Please Read Disclaimer] BitKeep, the top Web3.0 wallet in Asia, launched a new feature named “Crypto Red Packets” on June 1, 2022. As a leader in cross-chain wallets that supports more than 55 mainnets, more than 1,000,000 NFTs, and more than 10,000 DApps, BitKeep is committed to... (Read More...)",75.53,55.55555555555556,99.94148910045624,90.10000000000001,68.83116883116884,95.39308845996857,2022-06-09
191,Crypto Daily,PayPal expands crypto offering with new feature that allows users to transfer crypto externally,"Payments giant PayPal has announced it now allows users to transfer crypto from their accounts to external wallets and exchanges. PayPal’s recent Crypto Push is in response to customer demand, according to Jose Fernandez da Ponte, SVP and general manager of blockchain, crypto, and digital currenc... (Read More...)",55.135,53.40909090909091,97.04404473304749,43.6,54.58333333333334,98.24489951133728,2022-06-09
