,source,title,excerpt,vader_sentiment_title,tb_sentiment_title,flair_sentiment_title,vader_sentiment_excerpt,tb_sentiment_excerpt,flair_sentiment_excerpt,date
186,Crypto Daily,Flasko (FLSK) Set to Dominate the Market and Overtake Neo (NEO) and Zcash (ZEC),"In recent years, the crypto market has seen countless projects come up from nowhere. However, most of these projects faded into oblivion and could not maintain high standards such as those exhibited by Bitcoin and Ethereum. Relishing the times when the likes of Neo (NEO) and Zcash (ZEC) coins wer... (Read More...)",43.6,50.0,7.932955026626587,82.985,59.66666666666667,15.559038519859314,2022-09-07
187,Cryptonews,Will Bitcoin Really Go Into Terminal Decline After Ethereum Merge?,"As the long-awaited Ethereum Merge draws closer, one of the most interesting facts about 2022’s bear market is that ethereum (ETH) has outperformed bitcoin (BTC) along pretty much every timeframe. ... Read More: Will Bitcoin Really Go Into Terminal Decline After Ethereum Merge? (Read More...)",50.0,60.0,0.04928112030029297,86.72999999999999,68.92857142857143,0.5812942981719971,2022-09-07
188,U.Today,Ethereum Bellatrix Upgrade Now Live: Details,Bellatrix upgrade just went live on Ethereum Beacon Chain (Read More...),50.0,56.81818181818181,96.36254906654358,50.0,65.9090909090909,1.4777213335037231,2022-09-07
189,CryptoPotato,Yield App Unveils Higher Yield Passive Income Product,"[PRESS RELEASE ESTONIA — 1 SEPTEMBER 2022] Yield App’s new Earn Plus products are an addition to the existing passive crypto income range Yield App, a global FinTech company and digital wealth platform which has attracted more than 80,000 customers since its launch in February 2021, is enhancing ... (Read More...)",60.114999999999995,62.5,93.13555657863617,88.915,61.36363636363637,99.94754195213318,2022-09-07
190,Crypto Daily,Ripple (XRP) and Polygon (MATIC) likely to see tough competition from Flasko (FLSK) in 2023,"Ripple (XRP) and Polygon (MATIC) are well-known cryptocurrencies that have solidified their positions as top cryptos through significant price increases and ecosystem improvements. As a result, Ripple (XRP) and Polygon (MATIC) have generated enormous profits for their early investors. Currently, ... (Read More...)",43.6,40.27777777777778,1.4816731214523315,88.915,62.291666666666664,99.91727471351624,2022-09-07
191,Trustnodes,Ethereum Crosses Half a Bitcoin,Eth's market share has risen to its highest in years just as its devaluation is to fall to 10x that of bitcoin in dollar terms. Flippening in sight? (Read More...),50.0,41.66666666666667,0.05913078784942627,64.8,75.0,0.1482546329498291,2022-09-07
192,CryptoPotato,LUNC Skyrockets 25% Daily: The Highest Price Since the Terra Collapse,Terra's original native cryptocurrency skyrocketed by double digits daily to its record price since the ecosystem tumbled. (Read More...),25.305,50.0,0.2585083246231079,65.91,60.9375,0.025469064712524414,2022-09-07
193,CoinGape,Range Breakout May Resolve This Uncertainty In AVAX Price,"On August 26th, the AVAX/USDT pair pierced the monthly support of $20.6. However, the post-retest fall was interrupted by the 0.786 Fibonacci retracement level and resulted in a minor price correction. Furthermore, with the coin price rising over the past four days, retests breached support of $2... (Read More...)",52.580000000000005,50.0,17.25272834300995,74.695,53.333333333333336,0.0007510185241699219,2022-09-07
194,CryptoSlate,Circle CEO says Binance decision to stop USDC support is good as it increases utility,Circle CEO Jeremy Allaire said Binance’s decision to convert its users’ USD Coin (USDC) holdings to its Binance USD (BUSD)stablecoin is good. (Read More...),76.335,85.0,10.378074645996094,72.02,80.0,11.471295356750488,2022-09-07
195,BeInCrypto,Ethereum Name Service Sales Surge Ahead of Merge,"The Ethereum Name Service (ENS) has been hotly trending recently, just ahead of Ethereum’s Merge upgrade anticipated sometime next week. The post Ethereum Name Service Sales Surge Ahead of Merge appeared first on BeInCrypto. (Read More...)",50.0,50.0,99.47862327098846,50.0,60.0,78.45338582992554,2022-09-07
196,Cointelegraph,CBDCs require governments to put a special focus on security,"Any nation implementing a CBDC in the near future must make sure it’s ready to defend its digital assets and, most importantly, its private keys. (Read More...)",81.245,67.85714285714286,6.258758902549744,89.8,62.22222222222222,90.93814492225647,2022-09-07
197,Cointelegraph,"Hut 8 surpasses 8,000 BTC mark as it continues to HODL",The Canadian mining operator has managed to HODL through tough market conditions while other miners have sold holdings to manage operational costs. (Read More...),50.0,50.0,15.040311217308044,43.6,49.76851851851852,91.52095913887024,2022-09-07
198,Bitcoin Magazine,"Singapore’s Largest Bank To Expand Bitcoin, Crypto Services Amid Bear Market","DBS Group Holdings is looking to expand its digital asset exchange to 300,000 of its wealthiest clients across Asia and build out new products. (Read More...)",65.91,50.0,86.37330830097198,89.53,60.60606060606061,99.07708764076233,2022-09-07
199,crypto.news,Colony Avalanche Index brings indexed crypto investing to Avalanche,"In a first for the Avalanche network, ecosystem accelerator Colony Lab has partnered with the crypto index platform Phuture to offer indexed exposure to the blockchain's top decentralized applications. (Read More...)",50.0,50.0,99.90180432796478,60.114999999999995,70.83333333333334,99.90826547145844,2022-09-07
200,U.Today,"Bitcoin at $20,000 Likely to Be False Bottom: Peter Schiff","Vocal Bitcoin opponent Peter Schiff issues yet another warning to Bitcoin holders, telling them to ""abandon the sinking ship"" (Read More...)",50.0,40.0,0.15227794647216797,17.570000000000004,75.0,0.03357529640197754,2022-09-07
201,CoinGape,Ripple Lawsuit Summary Judgement Might See XRP Vs ETH Comparison,"The U.S SEC Vs Ripple lawsuit is moving forwards with the most awaited Summary judgment. However, the commission is still protecting its assertion over the crucial Hinman document. Meanwhile, now lawyers seek how Ripple is going to compare their XRP token to Ethereum. Ripple Lawsuit depends on Hi... (Read More...)",38.685,50.0,3.7351012229919434,25.365,61.25000000000001,2.834370732307434,2022-09-07
202,CoinGape,"Will Ethereum Merge Finally Spike ETH Price Toward $2,000?",Ethereum Merge is happening soon as can be seen in the recent ETH price action. ETH extends the previous sessions’ gain and turns north. The second largest cryptocurrency by market value looked set for a renewed price rally as the Ethereum Merge is coming ahead. Ethereum price analysis remained p... (Read More...),50.0,50.0,1.7479568719863892,87.14999999999999,54.333333333333336,23.023343086242676,2022-09-07
203,CoinGape,Breaking: Ethereum Jumps 7% As The Final Merge Upgrade Goes Live,"The Bellatrix upgrade has gone through on the Beacon chain. It is the last upgrade before the Ethereum merge is completed the next week. In anticipation of the Bellatrix upgrade, Ethereum prices have gone up close to 7%. It is currently trading at $1,688. The After Effects Of The Bellatrix The Be... (Read More...)",50.0,53.40909090909091,0.11763274669647217,55.135,56.25,2.812296152114868,2022-09-07
204,CoinGape,Expert Says Cardano (ADA) Ahead Of Ethereum In Key Network Metric,"The Cardano Foundation promised increased network capacity and lowered costs with the upcoming Vasil hard fork on the network. The promise brings Cardano to the centerstage of crypto community, which is also bracing for a separate milestone event on Ethereum network. It really appears to be a gre... (Read More...)",50.0,50.0,99.959996342659,80.62,56.80555555555556,99.83055889606476,2022-09-07
205,Ethereum World News,Aave Halts ETH Loans As Ethereum Bellatrix Merge Upgrade Goes Lives,Aave pauses ETH loans ahead of the merge. (Read More...),50.0,50.0,0.806012749671936,50.0,75.0,0.7733672857284546,2022-09-07
206,Cointelegraph,DeFi Regulations: Where US regulators should draw the line,The U.S Federal agency’s approach to the DeFi market has raised several concerns over the future of the industry: Experts weigh in on what’s the right approach. (Read More...),50.0,50.0,1.4751464128494263,50.0,59.82142857142857,1.0976821184158325,2022-09-07
207,U.Today,"ETH and ERC-20 Deposits, Withdrawals Now Suspended on Binance: Details","This, it claims, was required for its preparations for Ethereum Merge (Read More...)",26.165,50.0,3.6865234375,50.0,75.0,82.58390724658966,2022-09-07
208,CoinGape,Netflix Won’t Show Crypto Ads In Its New Subscription Tier,(Read More...),50.0,56.81818181818181,0.6177037954330444,50.0,75.0,96.50535881519318,2022-09-07
209,Decrypt,Lending Platform dAMM Brings Transparency to Institutional DeFi,"The DeFi platform addresses systemic problems faced by institutional lenders and borrowers, including capital inefficiency and a lack of transparency. (Read More...)",50.0,50.0,99.90469515323639,19.379999999999995,75.0,14.060884714126587,2022-09-07
210,NullTX,Top 5 Web3 Tokens Below $15M Market Cap To Watch In September 2022,"Decentralization, blockchain technology, and token-based economies are all included in the concept of Web3. It’s a hot space with a robust total cryptocurrency market capitalization of Web 3.0 tokens sitting around $23,601,139,870 and a total trading volume of around $1,503,081,327. Today, we wil... (Read More...)",60.114999999999995,75.0,22.58174419403076,67.0,59.375,99.73571598529816,2022-09-07
211,Cryptomode,tomi Sets Out to Build a Decentralized Cloud Computing & Mining Network,"New York, United States, 6th September, 2022, Chainwire tomi is a decentralized network and DAO aiming to build a peer-to-peer cloud computing network, a vision that after 13 years of Bitcoin’s existence is still hard to find. Free Economy and Free Speech now require a completely Free Web. While ... (Read More...)",50.0,50.0,99.90034997463226,96.155,62.87247474747475,98.28849732875824,2022-09-07
212,crypto.news,Carrieverse and Polygon Collaborate to Expand “Carrie and Friends” Metaverse Project,A new partnership has been announced between Carrieverse and Polygon to build the Carrieverse metaverse project. The Ethereum scaling solution is expected to host the metaverse project on the Polygon network. Carrieverse and Polygon Link Up to Develop Metaverse Initiative… (Read More...),65.91,50.0,99.20514822006226,65.91,58.93939393939394,94.4378674030304,2022-09-07
213,Crypto Daily,The Rise of Cloud Computing as the Future of Crypto Mining,"One of the most important and prominent processes in the blockchain space has been crypto mining. Since the advent of Bitcoin (BTC) back in 2009, crypto investors have been obsessed over mining, with the whole process experiencing wild changes and evolution in such a short period of time. Simply,... (Read More...)",50.0,50.0,98.99755716323853,72.545,57.72727272727273,99.92321729660034,2022-09-07
214,The Block,DeFi investing platform Credix raises $11 million in Series A round,Credix has announced an $11.25 million Series A round to expand in Latin America. (Read More...),50.0,40.0,79.36869263648987,65.91,57.49999999999999,92.57838726043701,2022-09-07
215,Finbold,Bitcoin’s 5-year returns dwarf major banking stocks’ ROI by over 500% despite crypto winter,"Bitcoin’s (BTC) volatility continues to stand out in 2022, with the cryptocurrency recording significant sell-offs while attempting to navigate the... Continue reading (Read More...)",50.0,53.125,92.30085909366608,60.114999999999995,71.875,17.428764700889587,2022-09-07
216,NewsBTC,"Ethereum Classic (ETC) Produces A Godlike Candle, How Far Can It Go?","Ethereum Classic (ETC) produced a godlike candle as the market’s sentiments changed to bullish against tether (USDT). The crypto market has become promising as most altcoins appear bullish, coming out of their shells with the like of Ethereum Classic producing double gains ahead of the “Ethereum ... (Read More...)",50.0,56.666666666666664,81.20594620704651,88.25,62.77777777777778,6.933784484863281,2022-09-07
217,CoinGape,"Just-In: Bitcoin (BTC) Price May Remain Below $20,000 This Year, Here’s Why","Bitcoin (BTC) price struggles to surpass $20,000 as the bear hug tightens further. The rise in selling pressure, the Fed’s hawkish rate hikes, and whales selling their BTC holdings degrade the chances of any revival. Moreover, the increasing dormant BTC supply is making the bear market stretch lo... (Read More...)",50.0,50.0,1.2935757637023926,29.905000000000005,62.5,0.00584721565246582,2022-09-07
218,Cryptonews,Bitcoin Aims Higher While Ethereum and Altcoins Rise,"Bitcoin price is still trading below the key USD 20,500 resistance zone. BTC is currently (11:20 UTC) consolidating near the USD 20,000 pivot zone. To start a fresh increase, the price must surpass USD 20,200 and USD 20,500. Besides, most major altcoins are slowly moving higher. ETH settled above... (Read More...)",50.0,62.5,6.179708242416382,77.86999999999999,57.06250000000001,0.0073909759521484375,2022-09-07
219,Bitcoin.com,"Bitcoin, Ethereum Technical Analysis: ETH Above $1,600 as ‘Bellatrix’ Hard Fork Commences","Ethereum rallied on Tuesday, as founder Vitalik Buterin confirmed a part of the “Merge” event was commencing today. In a tweet he stated: “What’s happening today is the Bellatrix hard fork, which prepares the chain for the merge.” Bitcoin was also higher, as it traded near $20,000. Bitcoin Bitcoi... (Read More...)",44.865,45.13888888888889,1.2733876705169678,44.865,59.583333333333336,0.2744019031524658,2022-09-07
220,Forkast.News,‘Doctor Bitcoin’ claims to be heading to prison for P2P BTC sale,"Crypto entrepreneur Mark Hopkins, also known as Doctor Bitcoin” or “Rizzn”, claimed on Twitter that he has been sentenced to six to 15 months in federal prison for allegedly participating in peer-to-peer Bitcoin sales without a federal license. See related article: Tornado Cash arrest heralds sto... (Read More...)",24.47,50.0,0.02447366714477539,14.984999999999998,54.37499999999999,0.016742944717407227,2022-09-07
221,Bitcoinist,"Marketplace To Refuse Forked NFTs After ETH Merge, Claims OpenSea","OpenSea is a renowned marketplace similar to Esty, Amazon, and eBay. However, the only difference here is the items available for purchase. All items on the market are special digital collectibles that come as NFTs (nonfungible tokens). Market users can buy, sell, or mint these tokens. OpenSea us... (Read More...)",35.199999999999996,50.0,0.13335943222045898,76.335,60.476190476190474,97.21059501171112,2022-09-07
222,Crypto Daily,IIC launches next-generation Web3 boating ecosystem test drive,The Industry IoT Consortium explained that its Marine Management Test Drive uses blockchain to show boaters and marina owners how they can turn underutilized resources into revenue. Ahoy and IoTeX lead this MachineFi-focused pilot The Internet-of-Things (IoT) sector is growing in popularity and p... (Read More...),50.0,50.0,99.92183744907379,79.295,75.0,99.05878603458405,2022-09-07
223,Blockworks,Ethereum’s ‘Bellatrix’ Upgrade Goes Live,The last hurdle before the Merge was surmounted at approximately 7:35 am ET The post Ethereum’s ‘Bellatrix’ Upgrade Goes Live appeared first on Blockworks. (Read More...),50.0,56.81818181818181,95.63997983932495,50.0,54.86363636363636,8.133727312088013,2022-09-07
224,CryptoPotato,Colony Avalanche Index Launches to Offer Yield-Bearing Avalanche Ecosystem Exposure,"[PRESS RELEASE – Paris, France, 6th September 2022] Colony Lab, the Avalanche ecosystem accelerator, has partnered with decentralized crypto index platform Phuture to launch CAI, the first index token offering exposure to the AVAX ecosystem. AI, or Colony Avalanche Index, is an investment tool to... (Read More...)",50.0,50.0,22.697553038597107,50.0,68.75,93.53165328502655,2022-09-07
225,Cryptomode,Colony Avalanche Index Launches to Offer Yield-Bearing Avalanche Ecosystem Exposure,"Paris, France, 6th September, 2022, Chainwire Colony Lab, the Avalanche ecosystem accelerator, has partnered with decentralized crypto index platform Phuture to launch CAI, the first index token offering exposure to the AVAX ecosystem. CAI, or Colony Avalanche Index, is an investment tool to bene... (Read More...)",50.0,50.0,22.697553038597107,50.0,68.75,92.86407828330994,2022-09-07
226,U.Today,New XRP Payment Solutions to be Presented In XRPL Developers Summit Hosted by Ripple,XRPL devs to present new XRP payment solutions at Apex Dev Summit in Las Vegas (Read More...),58.894999999999996,56.81818181818181,99.83597695827484,58.894999999999996,60.60606060606061,91.63812100887299,2022-09-07
227,Cryptomode,Wombat Exchange Dominates Stableswap Market With $217M TVL in 24 Hours,"Hong Kong, Hong Kong, 6th September, 2022, Chainwire Wombat, a multichain stableswap, has broken records for Total Value Locked (TVL) within 24 hours of launching. Users on BNB Chain deposited $217M of stablecoins within the decentralized exchange’s first day of operations, making it the network’... (Read More...)",52.580000000000005,50.0,99.51958656311035,41.105000000000004,54.37499999999999,0.03167092800140381,2022-09-07
228,Crypto Daily,Wombat Exchange Dominates Stableswap Market With $217M TVL in 24 Hours,"Hong Kong, Hong Kong, 6th September, 2022, ChainwireWombat, a multichain stableswap, has broken records for Total Value Locked (TVL) within 24 hours of launching. Users on BNB Chain deposited $217M of stablecoins within the decentralized exchange’s first day of operations, making it the network’s... (Read More...)",52.580000000000005,50.0,99.51958656311035,41.105000000000004,54.37499999999999,0.050261616706848145,2022-09-07
229,CryptoPotato,Caduceus Blockchain‍ Announces Incubator Program M4TTER,"[PRESS RELEASE – London, United Kingdom, 6th September 2022] The M4TTER incubator will see successful projects awarded a $10,000 grant in funding Today, Caduceus Foundation announces the launch of M4TTER, an incubator to promote DeFi, NFT, GameFi, and other blockchain projects. The incubator prov... (Read More...)",50.0,50.0,11.981523036956787,96.22999999999999,68.75,98.80203902721405,2022-09-07
230,U.Today,"Ethereum Enters 25% Rally, But Not One You Would Expect",Classic version of Ethereum is now seeing continuation of hashrate surge (Read More...),50.0,50.0,0.20946860313415527,50.0,66.66666666666666,99.54113364219666,2022-09-07
231,BeInCrypto,Will Axie Infinity (AXS) Price Be Boosted by AxieCon?,"Axie Infinity (AXS) has broken down from its corrective pattern, but it is attempting to create its first higher low on the heels of the first AxieCon conference. The post Will Axie Infinity (AXS) Price Be Boosted by AxieCon? appeared first on BeInCrypto. (Read More...)",68.06,50.0,1.0595113039016724,64.8,55.90277777777778,6.707793474197388,2022-09-07
232,Crypto Daily,Decentralized Venture Capital Is Upsetting The Apple Cart,"When Sotheby’s auctioned off the last remaining privately-owned copy of the U.S. constitution in the summer of 2021, it was the first time that the famous, 278-year old auction house had denominated assets in the cryptocurrency Ethereum. By allowing bids to be made in the popular cryptocurrency, ... (Read More...)",26.165,50.0,0.06656646728515625,77.115,66.25,0.02307891845703125,2022-09-07
233,Trustnodes,Ethereum Rises as the Merge Locks In,"Ethereum's Beacon Chain has upgraded, successfully completing the first stage to the full Proof of Stake consensus system. (Read More...)",50.0,50.0,98.86234998703003,74.695,73.125,99.814373254776,2022-09-07
234,Cryptomode,Noft Games Launch A New Marketplace,"Noft Games, a BSC-based play-to-earn game, has rolled out a new version of an in-game Marketplace opening access to a secondary NFT market. Noft Games keeps expanding its ecosystem with an ambition to offer a compelling product to the gaming audience. For a while, setting up the trading instrumen... (Read More...)",50.0,56.81818181818181,99.80952143669128,61.315,52.36363636363637,97.74128496646881,2022-09-07
235,Cointelegraph,Ethereum co-founder's poll shows people want $100 lifetime .eth domains,"Almost 50% of the 91,130 votes answered that the fair price for 100 years of owning a five-letter .eth domain is under $100. (Read More...)",53.86,50.0,7.80712366104126,65.91,80.0,90.76986312866211,2022-09-07
236,Decrypt,"Crypto Is ‘Key’ to Cracking Down on Crime, Says Europol","According to experts, blockchain networks allow investigators to easily follow illicit funds and recover stolen assets converted into crypto. (Read More...)",22.884999999999998,46.11111111111111,98.46728444099426,60.114999999999995,73.33333333333334,99.68549013137817,2022-09-07
237,Cryptonews,ETH Open Interest Retraces from All-Time High - Where Next?,"Open interest (OI) in ethereum (ETH) futures has retraced from the all-time highs in ETH terms reached in late August, despite Ethereum’s highly anticipated transition to proof-of-stake moving closer by the day.... Read More: ETH Open Interest Retraces from All-Time High - Where Next? (Read More...)",72.94,52.666666666666664,1.4335006475448608,88.46499999999999,56.375,0.11863410472869873,2022-09-07
238,Crypto Daily,My Neighbor Alice Partners Up With “Over the reality” To Hunt ‘Island Spirits’,"The metaverse has been one of the year's hottest topics. Several companies from around the world have already expressed an interest in becoming more involved with this new digital endeavor, including but not limited to Samsung, Decentraland, Emirates and JPMorgan. Likewise, the gaming industry ha... (Read More...)",50.0,50.0,75.71597397327423,72.93499999999999,61.586270871985164,99.61368143558502,2022-09-07
239,Crypto Daily,"LG Launches NFT Marketplace, Crypto Daily TV 06/09/2022",In Todays Headline TV CryptoDaily News: LG collabs with Hedera Blockchain to launch NFT marketplace on its smart TVs. South Korean consumer electronics company LG has partnered with Hedera Network to launch an NFT marketplace called LG Art Lab with the aim of boosting NFT adoption on its smart TV... (Read More...),50.0,50.0,87.75775730609894,88.915,65.47619047619048,12.75756061077118,2022-09-07
240,U.Today,Cardano Ecosystem Gears Up for Vasil Upgrade as Five Exchanges & Projects Confirm Readiness,Cardano ecosystem gears up for Vasil upgrade (Read More...),62.5,50.0,99.93818998336792,50.0,75.0,90.92049300670624,2022-09-07
241,The Block,21Shares parent company raises $25 million at $2 billion valuation,"21.co, the parent company of 21Shares, has raised $25 million at $2 billion valuation, making it ""Switzerland's largest crypto unicorn."" (Read More...)",50.0,50.0,17.71175265312195,50.0,75.0,16.223397850990295,2022-09-07
242,CryptoSlate,"Bellatrix upgrade goes live, sets stage for Ethereum’s Merge",The Bellatrix upgrade was activated at epoch 144896 on the Beacon Chain and is now live. (Read More...),50.0,56.81818181818181,99.31094944477081,50.0,65.9090909090909,94.06258165836334,2022-09-07
243,Cryptonews,This Cryptocurrency has Pumped 300% in a Month – Too Late to Buy?,"Luna classic (LUNC), the native token of the old Terra blockchain, has risen by well over 300% in the past 30 days after entering what looks like a parabolic rally. But with such a massive rally now behind it, is there still time left to buy? As of 10:05 UTC, LUNC is up 302% for the past 30 days,... (Read More...)",50.0,35.0,0.002187490463256836,65.91,49.25925925925926,84.13800001144409,2022-09-07
244,Finbold,Checkout.com strategist expects Ethereum Merge to ‘renew some confidence’ in crypto ecosystem,"The imminent Ethereum (ETH) Merge upgrade is currently driving capital inflow into the digital asset, with some industry analysts anticipating that the... Continue reading (Read More...)",50.0,50.0,1.8891990184783936,68.06,58.333333333333336,98.267462849617,2022-09-07
245,Bitcoinist,Indonesian GoTo Platform Bought A Crypto Firm For $8.4M,"The cryptocurrency space seems to be increasing in leaps and bounds as more entry continues. Over the past decade, more people and businesses have joined the train of digital assets. This is primarily due to the high profitability that the assets could offer over other traditional investments. It... (Read More...)",50.0,40.0,0.469893217086792,77.115,56.44444444444444,99.8839944601059,2022-09-07
246,CoinGape,"Ethereum Classic Explodes, How Long Will The Rally Sustain","The Ethereum Merge is a highly bullish event for Ethereum. However, Ethereum Classic is one of its biggest beneficiaries. Just days before the merge, Ethereum Classic prices are exploding. ETC prices have gone up by 27% in the last 24 hours. The bullish movement is not slowing down either. It has... (Read More...)",50.0,52.916666666666664,97.82567322254181,71.075,56.98148148148148,20.06315290927887,2022-09-07
247,crypto.news,Fidelity Introduces Metaverse ETF To Its Thematic Portfolio,"Fidelity International, one of the leading investment solutions providers, has added five new products to its exchange traded funds (ETF) range. The firm has unveiled a metaverse ETF to continue its virtual ecosystem expansion as part of its themed ETF… (Read More...)",50.0,50.0,99.99788999557495,58.894999999999996,55.45454545454545,99.91759657859802,2022-09-07
248,Crypto Daily,Vitalik B Created Ethereum as a Response to His WoW Mistreatment,"Vitalik Buterin is one of the most prominent names in the crypto sphere, thanks to its role as Ethereum creator, the second most popular cryptocurrency tailing Bitcoin. The Russian-Canadian prodigy managed to create much more than just a cryptocurrency — he came up with a decentralized platform, ... (Read More...)",85.015,55.00000000000001,9.06732976436615,93.265,70.625,99.8516321182251,2022-09-07
