,source,title,excerpt,vader_sentiment_title,tb_sentiment_title,flair_sentiment_title,vader_sentiment_excerpt,tb_sentiment_excerpt,flair_sentiment_excerpt,date
0,AMBCrypto,Assessing Cardano’s [ADA] health ahead of Vasil hard fork,Cardano is ramping up activity since Vasil fork is edging closer as we enter the second week of June. It is now up and running on the right path with major indicators leading the way for a bullish rally. IOHK has also given a timely update on the latest developments on the project. As per […] (Read More...),44.865,35.416666666666664,99.89025294780731,50.0,63.482142857142854,99.93261396884918,2022-06-09
1,NullTX,5 NFT Projects and Marketplaces Committed to the Terra 2.0 (LUNA) Ecosystem,"Many projects have been launched within the ecosystem despite the negative energy and uncertainties around the New Terra 2.0 launch. Even some Digital Asset Managers such as Hex Trust, Nebula, and CyberDeck have also shown their support for rebuilding the new Terra ecosystem. This article looks a... (Read More...)",63.660000000000004,50.0,99.99319911003113,91.545,56.94805194805195,79.97225522994995,2022-06-09
2,BeInCrypto,Top South Korean Crypto Exchanges Set Litecoin (LTC) Delisting Date Following MimbleWimble Upgrade,"After a series of investment warnings following the Litecoin MimbleWimble Extension Blocks (MWEB) upgrade, top exchanges in South Korea have set a date for its delisting. (Read More...)",60.114999999999995,62.5,99.88420009613037,34.089999999999996,66.66666666666666,0.003045797348022461,2022-06-09
3,crypto.news,Alibaba Cloud Unveils a New Product for NFTs,"Alibaba Cloud, the leading cloud service provider in China, has announced the launch of NFT solutions. The entity plans to help NFT developers build their NFT marketplaces through Alibaba Cloud solutions or web hosting, digital marketing, and content delivery. This… (Read More...)",50.0,56.81818181818181,98.78842234611511,81.245,62.5,97.65286445617676,2022-06-09
4,NullTX,17-Times Billboard Global Top 10 Rapper Announces Exclusive Membership Pass,"The 17-times Billboard Global Top 10 record holder rapper – French Montana, will release his Exclusive Membership pass with a step forward in the music industry that combines exclusive memberships, music rights, and in-real-life special experiences. French Montana will receive his first RIAA Diam... (Read More...)",65.91,62.5,93.33955347537994,83.525,61.47959183673469,99.22406673431396,2022-06-09
5,crypto.news,Attacker Bags 20 Million Optimism (OP) Tokens Meant for Wintermute Loan,Ethereum-scaling Layer-2 solution Optimism recently announced that some 20 million OP governance tokens were stolen by an attacker who interfered in a token recovery process involving Wintermute. Attacker Steals 20 Million OP Tokens Barely a week after the official airdrop… (Read More...),47.42,50.0,0.18091201782226562,7.790000000000003,59.166666666666664,0.059676170349121094,2022-06-09
6,Bitcoin.com,"Citadel, Charles Schwab, Fidelity Join Forces to Build Cryptocurrency Trading Platform",Citadel Securities and Virtu Financial are reportedly building a cryptocurrency trading platform with help from Fidelity Investments and Charles Schwab. “We know there is significant interest in this cryptocurrency space and we will look to invest in firms and technologies working to offer access... (Read More...),64.8,50.0,99.88291263580322,91.355,64.58333333333334,2.624228596687317,2022-06-09
7,Feed - Cryptopotato.Com,South Korea to Establish Guidelines for Crypto Exchanges as Watchdogs Probe Terra Collapse,The main focus of the South Korean regulatory watchdogs is to ramp up investor protection and add more stringent market supervision. (Read More...),25.305,50.0,0.5597293376922607,50.0,69.44444444444444,2.266266942024231,2022-06-09
8,NewsBTC,U.S. Macro Pressure Responsible For Entire Bitcoin Downtrend,"There have been multiple sell-off trends recorded in bitcoin since the crash in December 2021. These sell-offs have been responsible for the decline in prices recorded in the digital asset over the last couple of months. Naturally, sell-off trends can be recorded on their magnitude depending on w... (Read More...)",51.29,55.00000000000001,2.183958888053894,63.660000000000004,56.666666666666664,7.3073118925094604,2022-06-09
9,Bitcoinist,Shock And Awe: Bitcoin Lightning Network Capacity Reaches New ATH,"The adoption of the bitcoin lightning network has been on the rise for a while now. This was especially pronounced during the multiple bull rallies of 2021. It triggered an accelerated rate of adoption. Thus leading to network congestion due to all of the new users moving in. Naturally, transacti... (Read More...)",32.99999999999999,56.81818181818181,99.90571141242981,50.0,55.09469696969697,92.56137907505035,2022-06-09
10,crypto.news,"Microstrategy Acquires BTC, Fundraising Rounds Continue, Paypal New Feature for Crypto ","On June 6th, reports emerged that Microstrategy purchased BTC after taking a $2.4 billion debt. Microstrategy Buys BTC with Debt Funding Reports now indicate that Microstrategy currently owns 129k BTC worth $3.8 billion. In August 2020, Microstrategy bought its first… (Read More...)",50.0,56.81818181818181,93.7721699476242,26.165,63.33333333333333,22.439876198768616,2022-06-09
11,BeInCrypto,Grayscale Taps Ex-Obama Lawyer to Argue Its Case Against SEC,"Grayscale Investment LLC acquires a new secret weapon in the form of former solicitor-general Donald Verrilli, who worked in the Obama administration from 2011 to 2016. (Read More...)",32.99999999999999,45.0,99.28568601608276,35.199999999999996,52.95454545454545,10.440728068351746,2022-06-09
12,Blockworks,"In Latest Crypto Hack, 20M Tokens Lost as Market Maker Wintermute Takes Blame","Attacker deployed layer-1 multi-signature technology to the layer-2 before the Wintermute recovery team The post In Latest Crypto Hack, 20M Tokens Lost as Market Maker Wintermute Takes Blame appeared first on Blockworks. (Read More...)",21.405,75.0,0.02001821994781494,9.370000000000001,70.83333333333334,0.050833821296691895,2022-06-09
13,Crypto Briefing,Oasis’ EVODeFi Bridge May Be Missing $66M In Funds,"Rumors of insolvency are circulating around EVODeFi, a bridge in the Oasis Protocol ecosystem that may be $66 million short of funds. Possibly $66 Million in Unbacked Funds On June... (Read More...)",35.199999999999996,40.0,0.9915649890899658,50.0,58.333333333333336,0.0046193599700927734,2022-06-09
14,AMBCrypto,"Report: MANA, SAND, AXS, APE, GMT lead crypto game with…","In a recent publication titled the “May 2022 market recap and outlook”, Kraken, a leading cryptocurrency exchange in the United States provided interesting insights into the performance of some metaverse tokens in the month of May. According to the report, a major highlight for the month of May w... (Read More...)",50.0,30.0,0.23024976253509521,89.225,63.28125,99.38495755195618,2022-06-09
15,Blockworks,Ethereum Ropsten Testnet Successfully Merged to Proof-of-stake,"Ethereum's oldest testnet, Ropsten, was merged today, with minor software releases to be expected over the next few days The post Ethereum Ropsten Testnet Successfully Merged to Proof-of-stake appeared first on Blockworks. (Read More...)",74.695,87.5,99.7240424156189,74.695,58.214285714285715,6.627076864242554,2022-06-09
16,CryptoGlobe,"Cardano ($ADA) Now Has Over 1,000 Projects Building on It, Input Output Reveals","The Cardano ($ADA) network now has over 1,000 projects building on it, according to its developer Input Output, which also shared the nature of these projects. According to a tweet Input Output shared with its over 250,000 followers on the microblogging platform Twitter, the number of projects bu... (Read More...)",50.0,50.0,99.97540712356567,81.245,75.0,98.98996651172638,2022-06-09
17,The Daily Hodl,"Bitcoin (BTC) Could Rally Significantly From Here, Says Analyst Benjamin Cowen – But There’s a Catch","A popular crypto analyst is using one particular metric to plot out where Bitcoin (BTC) might be headed on the price charts. In a new strategy session, Benjamin Cowen tells his 748,000 YouTube subscribers the 200-day simple moving average (SMA) is an accurate indicator of future BTC prices, citin... (Read More...)",50.0,68.75,5.770391225814819,71.075,60.33143939393939,17.806345224380493,2022-06-09
18,Decrypt,Edge CEO Paul Puey Talks 'Confidential' Bitcoin Mastercard Launch,"Paul Puey, CEO of Edge Wallet, spoke to Decrypt's Jason Nelson about Edge's announcement of a new ""confidential"" crypto Mastercard. After Edge announced the card on Wednesday, Mastercard blasted crypto media to say it has nothing to do with the product—despite Puey telling Decrypt, ""MasterCard is... (Read More...)",50.0,50.0,97.8229820728302,50.0,50.60606060606061,0.006860494613647461,2022-06-09
19,The Daily Hodl,Bank for International Settlements Says Cryptocurrencies Have One Huge Disadvantage to Traditional Finance,"The Bank for International Settlements (BIS) says that crypto assets may have one massive downside compared to the traditional financial system. In a new bulletin from BIS, the institution says that blockchain-based digital assets are subject to fragmentation, which ultimately renders them unable... (Read More...)",43.6,56.666666666666664,0.10281503200531006,55.135,49.848484848484844,0.011476874351501465,2022-06-09
20,Bitcoinist,How This U.S. Cable Provider Will Launch Loyalty Coin On Cardano,"Per an official post by Input-Output Global (IOG), a major cable provider in the U.S. DISH Network will launch a decentralized identification and loyalty program on the Cardano blockchain. The publicly-traded company gave its “first step” into the deployment of a Minimum Viable Product (MVP). Rel... (Read More...)",77.115,50.0,1.548716425895691,77.115,60.15625,0.5478888750076294,2022-06-09
21,BeInCrypto,BeInCrypto Video News — Top 7 Altcoins For June 2022,"In this episode of BeInCrypto’s Video News Show, host Juliet Lima gives you our picks for the top-7 altcoins for June 2022. (Read More...)",60.114999999999995,75.0,94.15110349655151,50.0,75.0,80.6471198797226,2022-06-09
22,Decrypt,"Anthony Hopkins Adopts Ethereum Name, Asks Snoop Dogg What NFT to Buy","The Oscar-winning actor starred in ""Zero Contact,"" a film released via NFTs last year. Now he's looking to buy his first NFT. (Read More...)",58.894999999999996,50.0,13.491815328598022,50.0,62.5,96.71278893947601,2022-06-09
23,Bitcoin Magazine,Climate-Advocate CFTC Chair Wants To Change Bitcoin,"In a recent interview, Rostin Behnam revealed that if Lummis-Gillibrand were to be enacted, the CFTC could advocate for a less energy-intensive Bitcoin. (Read More...)",50.0,60.0,4.054760932922363,50.0,55.55555555555556,0.5355149507522583,2022-06-09
24,NullTX,Move-to-Earn-Tips for Popular GameFi Project STEPN,The GameFi concept is getting more and more popular every day. The trending project in the Move-to-earn category STEPN (GMT- Green Metaverse Token) is created by the Solana Blockchain. STEPN is a move-to-earn project based on earning GST (Green Satoshi Token) using your NFTs (Sneakers). Knowing t... (Read More...),71.075,80.0,90.27885496616364,82.745,64.16666666666667,95.96178233623505,2022-06-09
25,The Block,CFTC chair eyes disclosures to curb energy consumption in Bitcoin mining,"With the right and accurate disclosures, Benham said he expects people will move away from energy consumptive behavior. (Read More...)",63.660000000000004,50.0,87.52573132514954,63.660000000000004,69.76190476190476,97.72866070270538,2022-06-09
26,Cointelegraph,"Information, AML/CFT steps are key to fighting international digital crime, DOJ report says","The Justice Department report, mandated by the president executive order on digital asset development, recommends more efforts along the lines already being pursued. (Read More...)",14.079999999999998,50.0,99.80383813381195,88.915,66.66666666666666,6.234860420227051,2022-06-09
27,CryptoPotato,"Salesforce Launches a Pilot NFT Platform, Won’t Support PoW Blockchains",The technology giant did not specify which blockchains will be supported by NFT Cloud. (Read More...),70.095,50.0,0.0397413969039917,65.91,62.5,0.011017918586730957,2022-06-09
28,Cointelegraph,"Traders target $1,400 Ethereum price after ETH drops closer to a critical support level","Ethereum’s Ropsten testnet successfully integrated the merge to become proof-of-stake, but this hasn’t stopped traders from adjusting their downside price targets. (Read More...)",55.135,50.0,0.17406940460205078,29.410000000000004,81.25,98.80535006523132,2022-06-09
29,The Block,Greenidge Generation mined 195 BTC in May,"Bitcoin miner Greenidge produced 195 bitcoin in May, according to an operational update released Wednesday. (Read More...)",50.0,50.0,0.00940859317779541,50.0,75.0,0.02022683620452881,2022-06-09
30,Bitcoin.com,"Paypal Upgrades Crypto Service — Now Lets Users Transfer Cryptocurrencies to Other Wallets, Exchanges","Paypal has begun letting users transfer cryptocurrencies between its platform and other wallets and exchanges. “This feature has been consistently ranked by users as one of the most requested enhancements since we began offering the purchase of crypto on our platform,” Paypal revealed. Paypal Now... (Read More...)",50.0,43.75,99.02291893959045,50.0,64.0625,98.96674156188965,2022-06-09
31,Cointelegraph,"Digital assets still make a lot of sense, says Codex co-founder","In a Davos interview, Codex's Alex Gordon-Brander talked about the Ethereum launch, Codex’ liquidity specialties, and solving real-world problems with crypto. (Read More...)",58.894999999999996,50.0,99.93216693401337,46.14,75.0,98.63301813602448,2022-06-09
32,BeInCrypto,Chainlink (LINK) Announces Details of Staking Program,"Chainlink, a leader in the decentralized oracles sector, yesterday unveiled the details and roadmap of its upcoming staking program. Holding LINK will strengthen the network's cryptographic security and earn holders a 5% APY. The post Chainlink (LINK) Announces Details of Staking Program appeared... (Read More...)",50.0,50.0,81.11861050128937,78.595,75.0,91.21575057506561,2022-06-09
33,Bitcoin Magazine,An Easy Guide To Use The ColdCard Bitcoin Hardware Wallet,"How to use the ColdCard hardware wallet, a popular choice amongst Bitcoiners concerned with security and privacy. (Read More...)",72.02,71.66666666666667,98.4693855047226,81.845,77.5,99.7281163930893,2022-06-09
34,crypto.news,Ethereum’s Ropsten Testnet Merge Sees Success,The Ropsten Testnet of Ethereum has successfully merged with its beacon chain. It is the first testnet dress rehearsal to prepare Ethereum for the upcoming proof-of-stake shift. Ropsten Testnet Completes Merge The first dress rehearsal for the Ethereum blockchain’s forthcoming… (Read More...),78.595,65.0,99.14539158344269,74.695,71.875,99.53308999538422,2022-06-09
35,Crypto Briefing,New York’s NYDFS Issues Guidance on Stablecoins,The New York Department of Financial Services (NYDFS) has issued new regulatory guidance for companies that create stablecoins. NYDFS Sets Out Guidance The NYDFS’ guidance sets out three baseline requirements... (Read More...),50.0,56.81818181818181,22.36783504486084,63.660000000000004,59.65909090909091,96.09541594982147,2022-06-09
36,The Block,Attacker snipes 20 million OP tokens intended for Wintermute loan,"Ethereum scaling startup Optimism said Wednesday that an attacker interfered in a token recovery process involving Wintermute, resulting in the loss of some 20 million OP governance tokens. (Read More...)",21.405,50.0,0.36177337169647217,31.94,75.0,0.0013470649719238281,2022-06-09
37,CryptoPotato,"SEC Chairman Believes Bitcoin and Ethereum are Commodities, According to Senator","By Senator Gillibrand’s account, there is now broad regulatory consensus that Ethereum is a commodity. Even Gary Gensler agrees. (Read More...)",50.0,45.0,0.1781940460205078,60.114999999999995,64.0625,13.800090551376343,2022-06-09
38,The Block,"Bitcoin mining stock report: Wednesday, June 8","Here's how crypto mining companies performed on Wednesday, June 8. (Read More...)",50.0,50.0,0.0098496675491333,50.0,75.0,0.024402141571044922,2022-06-09
39,The Block,Entropy announces $25 million seed round led by Andreessen Horowitz,"The company, billed as a decentralized custodian, aims to compete directly with centralized custodians such as Fireblocks and Coinbase. (Read More...)",50.0,40.0,2.3250162601470947,50.0,60.0,0.7162898778915405,2022-06-09
40,Decrypt,What Is Stepn? The ‘Move-to-Earn’ NFT App That Pays You Crypto to Exercise,"Stepn lets users earn crypto for exercising—giving them real returns for walking, jogging or running. But gameplay is complicated. (Read More...)",50.0,50.0,15.337371826171875,50.0,53.333333333333336,0.41987597942352295,2022-06-09
41,U.Today,Jim Cramer Claims Crypto Shouldn't Be Treated as Safe Investment,CNBC host Jim Cramer believes that people shouldn’t be discouraged from investing in cryptocurrencies as long as they realize the risks associated with them (Read More...),72.02,75.0,0.015908479690551758,20.705000000000002,61.25000000000001,2.1192818880081177,2022-06-09
42,CoinGape,Why Upcoming Ethereum (ETH) Merge May Crash ETH Prices?,"Ethereum merge is simply the transition of the network’s current system of proof-of-work (PoW) to proof-of-stake (PoS). After the Merge, rewards will go to stakers instead of miners. The PoS system uses around 99% less energy than PoW. A DeFi Educator, who goes by the name “korpi87″ on Twitter, h... (Read More...)",29.905000000000005,50.0,0.1993119716644287,80.01499999999999,54.166666666666664,0.42187273502349854,2022-06-09
43,Blockworks,"In Historic Move, Jamaica Makes CBDC Akin to Cash","Jamaica’s senate authorized the Bank of Jamaica to issue Jam-Dex, which is launching later this month, as legal tender (Read More...)",50.0,50.0,99.03190732002258,56.400000000000006,61.66666666666667,1.1293768882751465,2022-06-09
44,The Daily Hodl,FTX Chief Sam Bankman-Fried Says Firm Will Continue Hiring As Others Cut Jobs Amid Crypto Winter,"FTX chief executive Sam Bankman-Fried says his exchange plans to continue hiring new people despite the crypto market downturn. Bankman-Fried says FTX has focused on expanding its workforce in a slower, more sustainable way that ensures the company has a chance to properly train all of its new hi... (Read More...)",36.34,40.0,1.300966739654541,77.86999999999999,62.72727272727272,90.28425216674805,2022-06-09
45,BeInCrypto,Solana Announces $100M Fund to South Korean Web3 Startups,"The Solana Foundation and Solana Ventures have committed $100 million to non-fungible token (NFT), gaming, and decentralized finance (DeFi) projects on the network in order to assist with the continued growth of Terra (LUNA) projects following its collapse. (Read More...)",50.0,50.0,94.14660334587097,56.400000000000006,62.5,95.57206630706787,2022-06-09
46,The Daily Hodl,Chainlink (LINK) Bounces Nearly 25% After Release of New Long Term Roadmap,"Decentralized oracle network Chainlink (LINK) is surging after the release of a new roadmap for its future. According to a new blog post, the project’s long-term goals revolve around the introduction of staking to the protocol, which aims to increase the blockchain’s security, increase participat... (Read More...)",50.0,53.1060606060606,99.51595067977905,85.92,59.65909090909091,87.73362040519714,2022-06-09
47,CryptoPotato,India’s Central Bank Is Constantly Engaged With the Government on Crypto: RBI Chief ,"A Finance Ministry official recently hinted that work on crypto regulation is going on, a move that RBI may not fully agree with. (Read More...)",70.095,50.0,94.56928968429565,33.794999999999995,62.5,0.16464293003082275,2022-06-09
48,CryptoGlobe,"Cardano ($ADA) Investors Keep HODLing Through Bear Market, Poll Shows","Cardano ($ADA) investors aren’t planning on selling their holdings throughout the cryptocurrency bear market, as a recent poll has shown that most cryptoasset investors who bet on ADA aren’t planning on selling. The poll, conducted by London Real, saw cryptocurrency enthusiasts vote on which cryp... (Read More...)",50.0,50.0,0.09972155094146729,67.0,65.0,0.381961464881897,2022-06-09
49,The Block,"European crypto ETN and ETP report: Wednesday, June 8","Here's how crypto investment vehicles performed in Europe on Wednesday, June 8 (Read More...)",50.0,50.0,14.686945080757141,50.0,75.0,0.09096264839172363,2022-06-09
50,Decrypt,"Madison Cawthorn Failed to Properly Disclose up to $950K in Bitcoin, Ethereum, Solana Trades",The North Carolina congressman also has been accused of a pump-and-dump scheme tied to the “Let’s Go Brandon” coin. (Read More...),24.47,37.5,0.0138014554977417,35.199999999999996,75.0,0.06630420684814453,2022-06-09
51,AMBCrypto,LUNC: Decoding what growth in number of unique addresses could mean for investors,"As people continue to run from Terra’s Luna Classic token [LUNC] and its accompanying stablecoin, UST, recent data from CoinMarketCap showed that even more people are running towards it. Following the 9 May incident that led to the depegging of the UST stablecoin and the collapse of Terra’s LUNC,... (Read More...)",72.02,51.5625,97.13364243507385,25.305,61.66666666666667,0.06219744682312012,2022-06-09
52,The Block,SEC’s Gensler floats routing equity trades to auctions to increase competition,Securities and Exchange Commission chair Gary Gensler is considering new requirements to increase order-by-order competition. (Read More...),65.91,45.0,20.61125338077545,77.115,65.9090909090909,5.65284788608551,2022-06-09
53,Cointelegraph,New York state releases guidance for issuing dollar-backed stablecoins,"The NY State Department of Financial Services, notorious for its strictness, claims to be the first regulator in the country to impose requirements of the type. (Read More...)",50.0,56.81818181818181,2.3212701082229614,18.755,62.5,0.4386335611343384,2022-06-09
54,Bitcoin Magazine,Achieva Becomes Florida’s First Credit Union To Allow Customers To Buy Bitcoin,"Achieva Credit Union released a new application that allows customers to buy and sell bitcoin, becoming the first of its kind in Florida to do so. (Read More...)",77.115,62.5,99.49412047863007,85.92,69.36363636363636,93.22155117988586,2022-06-09
55,Bitcoinist,NYDIG Paper Claims Algorithmic Stablecoins Are Impossible And DeFi Too Risky,"In “On Impossible Things Before Breakfast,” NYDIG uses the Terra/ LUNA collapse as a case study. The paper aims to prove that the algorithmic stablecoin concept is flawed in nature. It also takes aim at the current state of the DeFi stack and shows how fragile it is. The subtitle says it all, “a ... (Read More...)",39.885,16.666666666666668,0.013193488121032715,25.305,43.333333333333336,97.26743698120117,2022-06-09
56,ZyCrypto,Over $1.5 Billion Worth Of Bitcoin Leaves Exchanges As Accumulation Wars Intensify,Bitcoin continued to trade narrowly on Wednesday after a nine-week extended sell-off. (Read More...),29.905000000000005,65.0,0.05879700183868408,50.0,57.49999999999999,0.003892183303833008,2022-06-09
57,NullTX,"Bringing More Fun to Social Media Platforms, BitKeep Debuts Decentralized Crypto Red Packets","BitKeep, the top Web3.0 wallet in Asia, launched a new feature named “Crypto Red Packets” on June 1, 2022. As a leader in cross-chain wallets that supports more than 55 mainnets, more than 1,000,000 NFTs, and more than 10,000 DApps, BitKeep is committed to creating a one-stop decentralized crypto... (Read More...)",77.815,60.416666666666664,99.75869953632355,89.82,68.83116883116884,99.49007332324982,2022-06-09
58,Cointelegraph,"Bitcoin bears have plenty of reasons to hold BTC price below $32,000","Regulatory pressure and macroeconomic uncertainty continue to pin traders' sentiment and BTC price under $32,000. (Read More...)",50.0,50.0,0.13089478015899658,22.13,75.0,0.21190345287322998,2022-06-09
59,CryptoSlate,Cross The Ages: Not another NFT project,"While the metaverse is still a relatively novel concept, there hasn’t been a shortage of projects capitalizing on the popularity of decentralized virtual worlds. (Read More...)",50.0,50.0,99.04709458351135,76.335,62.5,90.92504680156708,2022-06-09
60,Bitcoinist,Bitcoin Back Above $30k As Coinbase Observes 38k BTC Outflows,"On-chain data shows the crypto exchange Coinbase observed 38k BTC in outflows shortly before Bitcoin recovered back above $30k. Bitcoin Netflow For Coinbase Pro Shows Deep Negative Spikes As pointed out by an analyst in a CryptoQuant post, outflows from Coinbase Pro wallets measured to around 38k... (Read More...)",50.0,50.0,0.07063150405883789,21.405,51.66666666666667,0.002461671829223633,2022-06-09
61,BeInCrypto,Bella Protocol (BEL) Retraces After 165% Increase on June 7,Bella Protocol (BEL) more than doubled in price on June 7 but has created a long upper wick since. The post Bella Protocol (BEL) Retraces After 165% Increase on June 7 appeared first on BeInCrypto. (Read More...),65.91,50.0,0.02149641513824463,83.26,62.0,0.0028908252716064453,2022-06-09
62,crypto.news,Yuga Labs Rescinds Code Permitting Limitless Bored Apes Creation,Yuga Labs has removed a code that would permit the unlimited supply of Bored Apes. The parent company of the Bored Apes recently announced it had revoked the program to stop the minting of Bored Ape non-fungible tokens (NFTs). Yuga… (Read More...),50.0,25.0,0.4437297582626343,12.104999999999999,40.0,0.0034868717193603516,2022-06-09
63,Cryptomode,4 Ways the Rich Are Using to Earn Passive Income,"The world houses a large number of wealthy people. Their wealth scale is unreachable by ordinary people even after working their entire lives. This allows them to easily get hold of the luxury cars and mansions that many people dream of. However, you must be wondering how they do it, right? To un... (Read More...)",82.985,68.75,15.052995085716248,92.775,63.645833333333336,97.00720608234406,2022-06-09
