,source,title,excerpt,vader_sentiment_title,tb_sentiment_title,flair_sentiment_title,vader_sentiment_excerpt,tb_sentiment_excerpt,flair_sentiment_excerpt,date
64,Cryptonews,Shiba Inu Price Prediction – Can This New Meme Token Overtake SHIB and DOGE?,"Shiba Inu price prediction continues to be mixed, as the coin has formed a symmetrical triangle pattern, indicating investor indecision. Even though Shiba Inu (SHIB) was one of the worst hit cryptocurrencies during the recent market crash, the token has made a respectable comeback over the past w... (Read More...)",50.0,56.81818181818181,1.600879430770874,15.46,47.91666666666667,1.7076075077056885,2022-10-06
65,Bitcoinist,Will FTX Grab The Opportunity To Buy Celsius Assets As Final Bid Date Nears,"Due to the long bearish reign, the crypto industry recorded several bankruptcy calamities in some crypto firms, Celsius happened to be one of the failing firms battling bankruptcy hearings. But it seems the Celsius Network would pack up for good this time. It has set dates for Auctioning its asse... (Read More...)",77.115,50.0,18.08869242668152,64.23,60.25,0.03617703914642334,2022-10-06
66,CoinTelegraph,"Nifty News: Yuga Labs launches BAYC council, Animoca backs Cool Cats and more…",Solana NFT volume surged to $130 million in September and Gary Vaynerchuck’s VeeFriends are set to be released as collectibles at Macy’s and Toys “R” Us. (Read More...),79.295,67.5,99.73853528499603,50.0,75.0,80.801922082901,2022-10-06
67,BeInCrypto,"Recession? Apparently Not. Downturns are Psychological, Not Economic, says Professor","Recession? There isn’t evidence that we are in a recession, or even close, says Laurence Kotlikoff, a professor of economics at Boston University. The post Recession? Apparently Not. Downturns are Psychological, Not Economic, says Professor appeared first on BeInCrypto. (Read More...)",28.925,47.91666666666667,0.17171204090118408,8.505,56.25,0.005972385406494141,2022-10-06
68,Forkast.News,"S.Korea financial regulator restates support for blockchain, crypto protections","Kim Joo-hyun, the chairman of South Korea’s top financial regulator, the Financial Services Commission (FSC), said on Thursday the agency will promote blockchain technology and user protections in the crypto market. See related article: South Korea’s all-encompassing crypto law is coming — what w... (Read More...)",70.095,50.0,0.30978918075561523,76.335,60.0,8.36351215839386,2022-10-06
69,Forkast.News,Is that bottle of ‘Grand Cru’ for real? An NFT can nose out the truth,"The tradition-bound wine world is not always open to change, writes Sebastian Schier of vinID. But new technology can solve the age-old problem of wine fraud. (Read More...)",65.91,67.5,3.119659423828125,8.994999999999997,60.60606060606061,99.36690330505371,2022-10-06
70,Bitcoin Magazine,Expecting Volatility In An Uncertain Market,Volatility thrives in market uncertainty and comes out the most in bear markets. It helps to examine the volatility conditions throughout past cycles. (Read More...),35.199999999999996,50.0,0.15134811401367188,52.580000000000005,62.5,99.81691837310791,2022-10-06
71,Forkast,Joining The Sandbox metaverse: All the Cool Cats are doing it,"Cool Cats Group LLC, the Web3 company behind the cartoon feline-based NFT collection Cool Cats, announced Thursday that it had received a strategic investment and partnership from Animoca Brands, owner of the metaverse platform The Sandbox. See related article: Asus launches NFT platform to plug ... (Read More...)",65.91,67.5,99.44729506969452,77.86999999999999,57.99999999999999,92.99942553043365,2022-10-06
72,Chain Debrief,What Are Soulbound Tokens? Will They Be Web3 Credentials Of The Future?,"Vitalik Buterin, recently co-published a paper explaining the future of Ethereum and an idea called Soulbound tokens(SBTs). What exactly are these? Soulbound tokens, or SBTs, are essentially non-fungible tokens (NFTs) with a special purpose. But hold on reader, these aren’t just meme pictures – S... (Read More...)",50.0,50.0,75.52911937236786,60.72,59.226190476190474,0.3767967224121094,2022-10-06
73,CoinTelegraph,GameFi could be the answer to unemployment for some — Aussie game studio,"The executives say traditional jobs are increasingly at risk through factors such as automation, but GameFi can provide a viable alternative to earn a wage. (Read More...)",27.98,30.0,9.985366463661194,42.97,58.333333333333336,4.343760013580322,2022-10-06
74,Forkast.News,Terra CEO Do Kwon’s passport to be canceled in two weeks,"South Korea’s Ministry of Foreign Affairs posted a notice on its website on Wednesday saying the passport belonging to Terraform Labs Pte. Ltd. chief Kwon Do-Hyung, also known as Do Kwon, will be nullified in two weeks. See related article: South Korea’s investigation of Do Kwon ‘unfair’: Terrafo... (Read More...)",50.0,50.0,0.6098419427871704,50.0,48.4375,0.008589029312133789,2022-10-06
75,Cointelegraph,Web3 gaming still a long way from mainstream adoption: Survey,"In a survey commissioned by Coda Labs, 6,921 people from five countries were asked a series of questions to determine their perception of crypto, NFTs, and Web3 gaming. (Read More...)",50.0,47.5,15.465599298477173,50.0,75.0,82.82818496227264,2022-10-06
76,Crypto Briefing,How To Tell if a Crypto Project Is a Scam,"The crypto industry is known for continuously innovating. Projects come up with different ways of solving real-world problems. Quite often, these solutions attain a level of complexity that can be... (Read More...)",21.405,50.0,0.1460731029510498,58.445,62.5,99.99131858348846,2022-10-06
77,Cryptonews,Bitcoin Price Up Since Bitboy Crypto's Bearish Short Term Prediction,"Bitboy Crypto has shared several short term bearish - but long term bullish - Bitcoin price predictions. Since then the market has rallied. A love / hate figure in cryptocurrency, Ben Armstrong (@Bitboy_Crypto) now has 892,000 followers and is one of the most followed crypto Twitter influencers. ... (Read More...)",50.0,50.0,0.10148584842681885,67.53,54.64285714285714,99.16255176067352,2022-10-06
78,Bitcoin.com,South Korea Reportedly Freezes Do Kwon’s Crypto Worth $40M — Luna Founder Says the Funds Are Not His,"South Korean authorities have reportedly frozen $40 million in crypto assets, including bitcoin, allegedly belonging to Luna founder Do Kwon. However, Kwon denied that any funds of his have been frozen. “I don’t even use Kucoin and Okex, have no time to trade, no funds have been frozen,” he insis... (Read More...)",60.114999999999995,65.0,0.018161535263061523,15.960000000000003,60.0,0.006878376007080078,2022-10-06
79,crypto.news,US Lawmaker Offended as Federal Energy Agencies Show Unwillingness to Act on White House’s Crypto Mining Recommendations,"Jared Huffman, a United States House of Representatives member, has reportedly queried some U.S. federal agencies’ unwillingness or reluctance to respond to recommendations in a recently released White House report on cryptocurrency mining. Jared Huffman, a United States lawmaker who… (Read More...)",51.29,50.0,0.2867072820663452,74.695,58.333333333333336,0.7546365261077881,2022-10-06
80,Forkast.News,"Markets: Bitcoin dips but holds above US$20,000, Ether falls, XRP only gainer in top 10","Bitcoin fell in Thursday morning trading in Asia but held above the US$20,000 support line. Ether also lost ground. XRP was the only token in the cryptocurrency top 10 by market capitalization to gain. See related article: Is crypto money? A South Korean court says no Fast facts Bitcoin fell 0.9%... (Read More...)",64.8,58.333333333333336,0.08302927017211914,84.04,57.49999999999999,0.025200843811035156,2022-10-06
81,Cointelegraph,Taliban had a ‘massive chilling effect’ on Afghan crypto market: Report,"Crypto value received in Afghanistan surged in the wake of the Taliban seizing power in August 2021, but crypto markets have flat lined under the regime. (Read More...)",48.71,37.5,12.724503874778748,58.894999999999996,61.875,0.050130486488342285,2022-10-06
82,crypto.news,"Nuant Launching Unified Platform for Digital Asset Data, Analytics and Portfolio Intelligence","Nuant, a Swiss-based integrated platform for portfolio management, analytics, and due diligence of crypto assets, is launching a unified platform that gives users, live access to accurate on-chain and market data, metrics, analytics, and compliance tools for all current holdings… (Read More...)",90.10000000000001,50.0,99.934983253479,75.53,59.11363636363637,99.95953142642975,2022-10-06
83,crypto.news,Translucia Partners With Sunavotech to Build a Billion-Dollar Metaverse Project,"Metaverse development and expansion have continued to take center stage, with enterprises agreeing to explore the virtual world through partnership. The duo of Translucia (Thailand) and Sunovatech (India), alongside collaborations with other global brands, are building $3 billion worth of… (Read More...)",50.0,50.0,99.26395416259766,75.53,55.75,99.90226626396179,2022-10-06
84,Bitcoinist,"McDonald Set To Accept Payments In Tether And Bitcoin In Lugana, Switzerland","The American multinational fast food chain McDonald’s has started accepting payments in Bitcoin and Tether in Switzerland’s city of Lugana, populated by around 63,000 people. The announcement comes in a tweet by Bitcoin magazine on October 3. And it posted a video in which a customer ordered food... (Read More...)",69.08999999999999,50.0,2.8456509113311768,69.08999999999999,61.66666666666667,0.03161132335662842,2022-10-06
85,The Block,"Institutions are getting serious, Alluvial executive Mara Schmiedt says",Alluvial Chief Growth Officer Mara Schmiedt said the coming years hold a flood of institutional adoption for crypto staking protocols. (Read More...),46.14,33.333333333333336,99.84864592552185,69.08999999999999,75.0,99.57627356052399,2022-10-06
86,BeInCrypto,"Cardano (ADA) Price Will Tank, Says Renowned Trading Veteran Peter Brandt","Seasoned futures trader Peter Brandt predicts that Cardano (ADA) will drop to $0.25, keeping with a current descending triangle chart pattern. The post Cardano (ADA) Price Will Tank, Says Renowned Trading Veteran Peter Brandt appeared first on BeInCrypto. (Read More...)",50.0,50.0,0.6028175354003906,36.34,60.0,0.004446506500244141,2022-10-06
87,Bitcoin.com,Elon Musk Hints Everything App ‘X’ Is Coming — Says Buying Twitter Accelerates Creation of X,"Tesla and Spacex CEO Elon Musk has hinted that “X, the everything app,” is coming. He explained that his purchase of the social media platform Twitter is an accelerant to the creation of X, which could knock three to five years off the project. Elon Musk’s X — The Everything App Tesla CEO Elon Mu... (Read More...)",63.660000000000004,50.0,95.19619047641754,63.660000000000004,63.33333333333333,0.3712594509124756,2022-10-06
88,crypto.news,Pyth Network Implements Price Feed on BNB Chain,BNB Chain has partnered with Pyth Network to provide high-quality live market data for crypto feeds. (Read More...),50.0,50.0,14.093294739723206,50.0,65.9090909090909,99.87114667892456,2022-10-06
89,crypto.news,Luxury Watch and Jewelry Retailer Bucherer Acquires Blockchain Startup,"Bucherer, one of the world’s biggest companies in the luxury goods field, has acquired digital authentication startup Adresta, with the takeover taking immediate effect as of September 30th. Adresta, which will be fully integrated into the Bucherer Group immediately, uses blockchain… (Read More...)",50.0,50.0,4.86215353012085,50.0,62.5,0.11177659034729004,2022-10-06
90,crypto.news,Valkyrie Funds Unveils Crypto SMAs as Institutions Focus on Digital Assets,"Valkyrie Funds, a US-based alternative asset management firm, announced the launch of a new Valkyrie Risk Managed Separately Managed Account (VSMA) platform on Tuesday to allow financial advisors, fund managers, and other financial services providers to deliver digital asset investments… (Read More...)",58.894999999999996,50.0,84.52482223510742,79.295,52.22402597402598,15.077441930770874,2022-10-06
91,U.Today,"Dogecoin (DOGE) Price Spike Is Not What You Might Think: Crypto Market Review, October 5",Positivity on cryptocurrency market fades away after investors get hit with first spike in selling pressure (Read More...),50.0,50.0,0.03313720226287842,63.660000000000004,68.75,0.22035539150238037,2022-10-06
92,CoinTelegraph,NEAR Protocol partners with Google Cloud to support Web3 devs,"Under a partnership with NEAR Protocol, Google Cloud will support NEAR developers in building and scaling their Web3 projects and DApps. (Read More...)",70.095,55.00000000000001,99.03411865234375,70.095,61.66666666666667,99.19614493846893,2022-10-06
93,Decrypt,Former SEC Attorney: 'It's Much Easier If You Launch Your Network In a Compliant Way’,"The problem, according to Teresa Guillén, is launching without first receiving legal guidance or advice. (Read More...)",71.075,51.66666666666667,90.41484296321869,26.43,65.83333333333333,0.030362606048583984,2022-10-06
94,AMBCrypto,Assessing the odds of SAND reaching $1 in the coming week,"Binance U.S. confirmed that the exchange will be adding the Sandbox [SAND] token on the platform. This news was also retweeted by Sandbox on their Twitter account. Since the news broke, investors and SAND reacted positively to this announcement. Furthermore, the trend appeared to be continuing as... (Read More...)",60.114999999999995,50.0,0.846177339553833,57.655,68.78787878787878,1.4502286911010742,2022-10-06
95,Cryptomode,Gym Culture Enters the Metaverse: A bespoke fitness experience could be the first actual use case of NFTs,"Grace Chen / October 3, 2022 / If modern day gym culture was born in southern California, its teenage party years are happening in Las Vegas. What had started as an obscure pastime for beach bums and wandering souls, the fitness industry has become a trillion dollar industry and is achieving reli... (Read More...)",63.660000000000004,56.25,8.38773250579834,88.25,58.75,95.6735759973526,2022-10-06
96,Feed - Cryptopotato.Com,Bitcoin Defi Protocol Sovryn Gets Hacked for Over $1 Million,An exploiter ran off with over 44 RBTC using a price manipulation technique in one of the protocol’s lending pools. (Read More...),29.905000000000005,50.0,0.0018775463104248047,35.199999999999996,75.0,0.02714693546295166,2022-10-06
97,Bitcoinist,In Grayscale We Trust: GBTC Bitcoin Reaches Largest Discount Ever,"The Grayscale Bitcoin Trust (GBTC) has made a name for itself in the public markets as not only the first-ever publicly traded trust underlined by a cryptocurrency, but it is also the largest bitcoin trust in the world. However, Grayscale has not had an easy go of it in the last as it had been […] (Read More...)",77.115,50.0,99.46945011615753,84.24499999999999,57.77777777777777,96.64629101753235,2022-10-06
98,Bitcoin.com,Solidus Ai Tech Announces New Partnership With Metaverse Giants Galaxy Arena,"Solidus Ai Tech has recently announced a new strategical partnership with Galaxy Arena, currently the only VR Earn game aggregator metaverse hub. Galaxy Arena are really making some noise in the Play2Earn and Meta space by bridging the gap between virtual and reality by ‘bringing events, attracti... (Read More...)",50.0,56.81818181818181,99.86624121665955,50.0,53.116883116883116,99.84784126281738,2022-10-06
99,NewsBTC,"Near Protocol Collapses Despite Rounded Bottom, Is $6 Possible?",NEAR price continues to struggle on both low and high timeframe despite showing signs of recovery in recent times. NEAR price trades in a range as the price looks set for a retest of key support areas. The price of NEAR fails to break above resistance despite forming rounded bottom on the daily t... (Read More...),35.199999999999996,52.5,0.0014722347259521484,22.884999999999998,52.090909090909086,0.9325593709945679,2022-10-06
100,CryptoSlate,"CryptoSlate Wrapped Daily: Bitcoin up 22% vs crypto stocks; Russia blocks OKX; US, EU set to discuss crypto regulation","The biggest news in the cryptoverse for October 5 includes SEC opposing third parties seeking to defend Ripple, Do Kwon describing news of a $40 million crypto freeze as falsehood, and SWIFT showing CBDCs, tokenized assets can be integrated into the global financial system. (Read More...)",38.685,50.0,0.37584006786346436,86.485,54.0,0.3821372985839844,2022-10-06
101,Cointelegraph,Opensea to allow users to submit bulk NFT listings and purchases,The company said that users can now list and buy up to 30 items in a single flow. (Read More...),61.315,50.0,90.6879186630249,50.0,60.71428571428572,10.89276373386383,2022-10-06
102,Decrypt,JPEGs Are 'Not the Future of Web3 and NFTs': Polygon Studios Metaverse Lead,"Polygon’s Brian Trunzo sees a broader array of NFT use cases taking hold in the future, from fashion to gaming and beyond. (Read More...)",50.0,50.0,0.056365132331848145,50.0,62.5,99.5404839515686,2022-10-06
103,Bitcoin Magazine,A Bitcoiner’s Guide To Bitcoin Amsterdam,The largest Bitcoin only gathering in Europe is happening in one week — here is everything you need to know about it. (Read More...),50.0,50.0,95.09217739105225,50.0,62.5,17.91245937347412,2022-10-06
104,CryptoPotato,Bitcoin Will Outperform Other Assets When Economic Tide Turns: Bloomberg Intelligence,"Bitcoin’s stability in Q3 may indicate its propensity to outperform later, and possibly transition into a risk-off asset. (Read More...)",79.295,51.87500000000001,0.16175508499145508,68.06,58.333333333333336,3.980952501296997,2022-10-06
105,The Daily Hodl,Have We Bottomed? FTX’s Sam Bankman-Fried Weighs In on State of Crypto Markets As Prices Consolidate,"The chief executive of digital asset derivatives exchange FTX is naming one catalyst that he thinks could have the biggest impact on the current state of the crypto markets. In a new interview on the Unchained Podcast with journalist Laura Shin, Sam Bankman-Fried says that the crypto markets rema... (Read More...)",50.0,50.0,1.2863695621490479,68.06,57.95454545454546,9.587821364402771,2022-10-06
106,The Daily Hodl,"Hacker Forfeits $21,849,087 Worth of Bitcoin to Feds, Sentenced to 20 Years in Prison","A Canadian hacker is forfeiting millions of dollars worth of Bitcoin (BTC) to the U.S. government while facing a multi-decade prison sentence. According to a new press release from the Department of Justice (DOJ), 35-year-old Sebastian Vachon-Desjardins has been sentenced to 20 years in prison fo... (Read More...)",31.94,65.0,0.01277625560760498,36.34,65.6060606060606,0.0416874885559082,2022-10-06
107,Bitcoin.com,Over 300 NFTs From Three Arrows Capital’s NFT Fund Moved by Liquidator to New Wallet,"Hundreds of non-fungible tokens (NFTs) collected by Starry Night Capital have been transferred to a new wallet. The NFT fund of the insolvent crypto hedge fund Three Arrows Capital (3AC) bought the tokens in 2021. 3AC filed for bankruptcy earlier this year, after taking a hit from the collapse of... (Read More...)",50.0,56.81818181818181,4.544845223426819,25.305,60.60606060606061,0.01144707202911377,2022-10-06
108,Crypto Briefing,Bitcoin Conference Heads to Amsterdam,"The Bitcoin Conference, a two-day, in-person gathering of some of the most prominent voices in the Bitcoin ecosystem, is heading to Amsterdam for the first time. Bitcoin Amsterdam Is Upon... (Read More...)",50.0,50.0,1.1661738157272339,69.02000000000001,71.875,99.23472106456757,2022-10-06
109,The Block,Asset manager GoldenTree reveals $5.3 million stake in SushiSwap token,Asset management firm GoldenTree has taken a $5 million stake in the governance token for SushiSwap. (Read More...),68.06,50.0,10.773232579231262,68.06,57.49999999999999,81.11169934272766,2022-10-06
110,crypto.news,Jefferson Nunn With Shawn Owen of SALT Lending – Around the Block,"In the newest edition of “Around the Block With Jefferson Nunn,” Jefferson interviews Shawn Owen of SALT Lending. To listen to the podcast, click on the link below. Listen Here- Around the Block. Hey guys, buckle up for a new edition of… (Read More...)",27.98,50.0,94.46074068546295,14.984999999999998,65.9090909090909,84.13487374782562,2022-10-06
111,CoinTelegraph,US lawmakers request Justice Dept share CBDC assessment,"The House members claimed the ""appropriate place for the discussion"" on legislation concerning a digital dollar would be in the U.S. legislative branch. (Read More...)",84.04,50.0,5.997505784034729,50.0,66.66666666666666,0.5001097917556763,2022-10-06
112,CryptoSlate,Bitcoin outperforms traditional crypto stocks in 2022 by up to 22%,"Bitcoin’s price is down roughly 56% since January but crypto-related stocks such as Microstrategy, Riot Blockchain, Coinbase, and Hut8 Mining are down up to 74%. (Read More...)",50.0,50.0,0.26288628578186035,14.52,50.888888888888886,0.017344951629638672,2022-10-06
113,Decrypt,Bored Ape Yacht Club Community Council Formed by Yuga Labs,"Seven holders of the coveted Ethereum NFTs have been appointed to serve, but not everyone is pleased. (Read More...)",36.34,25.0,0.049430131912231445,26.090000000000003,75.0,0.06911754608154297,2022-10-06
114,CoinTelegraph,Three Arrows Capital's NFTs collection to be liquidated,"As part of 3AC's bankruptcy proceedings, over 300 NFTs from Starry Night Capital were moved this week. (Read More...)",50.0,50.0,0.06445050239562988,50.0,75.0,0.1437455415725708,2022-10-06
115,Crypto Briefing,Starry Night Capital’s NFT Collection Will Be Liquidated,Crypto hedge fund Three Arrows Capital (3AC) is liquidating its NFTs as part of its ongoing bankruptcy proceedings. Starry Night NFTs Founded Three Arrows Capital is getting rid of its... (Read More...),50.0,50.0,0.04324615001678467,50.0,75.0,0.020316243171691895,2022-10-06
116,CryptoBriefing,Starry Night Capital’s NFT Collection Will Be Liquidated,Crypto hedge fund Three Arrows Capital (3AC) is liquidating its NFTs as part of its ongoing bankruptcy proceedings. Three Arrows Capital is getting rid of its NFTs.A statement released through public relations firm Teneo indicates that joint liquidators have acquired NFTs from Three Arrows' NFT f... (Read More...),50.0,50.0,0.04324615001678467,50.0,55.00000000000001,0.03543496131896973,2022-10-06
117,Blockworks,SWIFT Says It Can Resolve a Major Obstacle to CBDC Adoption,"SWIFT is already being used to connect more than 11,500 banks and funds across 200 countries, making it a potentially excellent candidate for becoming the standard for cross-border CBDC settlements The post SWIFT Says It Can Resolve a Major Obstacle to CBDC Adoption appeared first on Blockworks. (Read More...)",69.425,53.125,99.71405863761902,91.725,69.73214285714286,99.52425360679626,2022-10-06
118,NullTX,"Bitcoin and Ethereum Price Remains Unchanged, Crypto Market Still at $960 Billion","This week’s trading in cryptocurrency markets has been sideways as Bitcoin and Ethereum have remained near $20k and $1.3k, respectively. The market capitalization of all cryptocurrencies is currently $960 billion, barely changing over the last day. The market has held support this week and is pro... (Read More...)",50.0,50.0,4.279857873916626,81.245,55.41666666666667,2.267131209373474,2022-10-06
119,CryptoPotato,Latest Market Crash Proved to be Narrative Breaker and Reality Check For Bitcoin: Report,"With several narratives at stake, data suggests that Bitcoin is yet to mature. (Read More...)",29.905000000000005,75.0,5.835551023483276,71.075,60.0,0.09323954582214355,2022-10-06
120,The Block,"Apollo Global, Elon Musk end talks on Twitter financing: Reuters",The alternative investment firm Apollo had previously sought to lead the preferred financing for the takeover. (Read More...),50.0,50.0,3.842732310295105,50.0,52.22222222222223,0.5090624094009399,2022-10-06
121,Bitcoinist,Kardashian’s EthereumMax Lawsuit Turns Against SEC Chair,"Earlier this week, the U.S. Securities and Exchange Commission (SEC) charged and settle a lawsuit with socialite and billionaire Kim Kardashian for allegedly withholding information about promoting EthereumMax. The influencer received $250,000 as compensation for leading her 330 million Instagram... (Read More...)",38.685,45.0,0.4949212074279785,62.5,53.75,0.10622739791870117,2022-10-06
122,The Daily Hodl,Successful Cardano (ADA) Upgrades Send Bullish Signals to Institutional Investors: Coin Bureau,"The pseudonymous host of Coin Bureau says the successful upgrade of Cardano (ADA) should catch the eye of institutional investors next bull run. In an interview with fellow analyst Benjamin Cowen, Guy says in the near future investors will look for blockchain projects with a proven track record f... (Read More...)",79.295,87.5,0.07935762405395508,79.295,63.5,0.18386244773864746,2022-10-06
123,BeInCrypto,Bitcoin Price at Generational Bottom With Institutions Buying en Masse,"Crypto analyst Cred opines that bitcoin may have hit a generational bottom, presenting a good buying opportunity for long-term holders. The post Bitcoin Price at Generational Bottom With Institutions Buying en Masse appeared first on BeInCrypto. (Read More...)",50.0,50.0,0.07739067077636719,84.53999999999999,74.16666666666667,0.22405385971069336,2022-10-06
124,The Block,"Bitcoin mining stock report: Wednesday, October 5","Here's how crypto mining companies performed on Wednesday, Oct. 5. (Read More...)",50.0,50.0,0.007265806198120117,50.0,75.0,0.028011202812194824,2022-10-06
125,The Block,Greenidge seeks to raise up to $22.8 million in stock offer,Greenidge Generation seeks to raise up to $22.8 million in a stock offer. (Read More...),50.0,50.0,2.150598168373108,50.0,75.0,3.2432138919830322,2022-10-06
