,source,title,excerpt,vader_sentiment_title,tb_sentiment_title,flair_sentiment_title,vader_sentiment_excerpt,tb_sentiment_excerpt,flair_sentiment_excerpt,date
0,U.Today,Bitcoin Might Rival Top Custodian Banks With Unmatched Market Value,CryptoQuant CEO opines that Bitcoin (BTC) could rival top custodian banks as seven of the nine largest custodian banks have entered crypto custody in 2022 (Read More...),72.02,75.0,75.93182325363159,60.114999999999995,75.0,12.1382474899292,2022-10-12
1,FX Street,Big Eyes coin on its way to become a mainstream meme coin like Shiba Inu,There are many things about the crypto-verse that keeps traders and investors on their toes. One of those many reasons is that new coins are constantl (Read More...),68.06,50.0,99.8938262462616,50.0,70.45454545454545,95.61192691326141,2022-10-12
2,FX Street,"Ethereum strengthens its deflationary status after the Merge, ETH price slides","Ethereum price is on the way to reclaiming the ground it lost above $1,300. The pioneer smart contracts token tags support at $1,270 after being rejec (Read More...)",72.94,50.0,89.11267518997192,73.83500000000001,61.904761904761905,88.98314833641052,2022-10-12
3,FX Street,"Here's why Ethereum price could retest $1,000 again [Video]","A brief technical and on-chain analysis on Ethereum price. Here, FXStreet's analysts evaluate where ETH could be heading next. Please, subscribe to o (Read More...)",50.0,50.0,0.008445978164672852,65.91,56.25,0.43111443519592285,2022-10-12
4,FX Street,"This Bitcoin price fractal forecasts a drop to $15,800 before an explosive rally [Video]","A brief technical and on-chain analysis on Bitcoin price. Here, FXStreet's analysts evaluate where BTC could be heading next. Please, subscribe to our (Read More...)",36.34,50.0,0.025832653045654297,65.91,56.25,0.3016829490661621,2022-10-12
5,FX Street,Why you should have Ripple on your watchlist and what to expect from XRP price? [Video],"A brief technical and on-chain analysis on Ripple price. Here, FXStreet's analysts evaluate where XRP could be heading next. Please, subscribe to our (Read More...)",50.0,50.0,0.5945146083831787,65.91,56.25,1.438373327255249,2022-10-12
6,FX Street,Can this Shiba Inu price move trigger the best swing trade opportunity for 2022? [Video],"A brief technical and on-chain analysis on Shib Inu price. Here, FXStreet's analysts evaluate where SHIBA could be heading next. Please, subscribe to (Read More...)",89.53,100.0,80.29468655586243,65.91,56.25,1.907464861869812,2022-10-12
7,FX Street,MATIC price could drop 25% as Polygon sellers plan selling spree [Video],"A brief technical and on-chain analysis on Polygon price. Here, FXStreet's analysts evaluate where MATIC could be heading next. Please, subscribe to o (Read More...)",36.34,50.0,0.003451108932495117,65.91,56.25,0.5443215370178223,2022-10-12
8,FX Street,Two critical reasons why LUNA Classic price will continue to plummet in Q4 [Video],"A brief technical and on-chain analysis on Terra Classic price. Here, FXStreet's analysts evaluate where LUNC could be heading next. Please, subscribe (Read More...)",34.089999999999996,54.166666666666664,0.5016684532165527,65.91,56.666666666666664,5.3221195936203,2022-10-12
9,FX Street,"CRO price flaunts buy signal as Crypto.com taps Transak for Visa, Google Pay Services",Crypto.com price appears to be exhausting its downtrend in the wake of rejection from its September highs around $0.1250. The native exchange token wi (Read More...),44.865,50.0,0.7659614086151123,14.079999999999998,52.5,0.018739700317382812,2022-10-12
10,FX Street,XRPArmy wages war against Charles Hoskinson amidst SEC v. Ripple lawsuit,"The US regulator SEC and Ripple are embroiled in a prolonged legal battle over the status of XRP, security or not. The XRP community cheered Judge Tor (Read More...)",14.984999999999998,45.0,0.8265376091003418,77.86999999999999,60.0,1.4839529991149902,2022-10-12
11,FX Street,"Top 3 Price Prediction Bitcoin, Ethereum, Ripple: The start of a larger decline","The crypto market descends in freefall fashion. At the current time, jumping into the market for a bounce could lead to painful losses. Key levels hav (Read More...)",60.114999999999995,62.5,1.27621591091156,15.960000000000003,47.5,0.23594796657562256,2022-10-12
12,Decrypt,Crypto Bankruptcies Have Generated a Wave of New Accounting Clients for Armanino,"The chill on stablecoins has thawed, Armanino told Decrypt, as banks have again started exploring issuing their own. (Read More...)",50.0,56.81818181818181,98.8430768251419,50.0,77.5,0.9738773107528687,2022-10-12
13,AMBCrypto,"USDT, USDC, BUSD- Know this update before you park your money in it","Stablecoins play a key role in the decentralized finance and broader cryptocurrency ecosystem, without a doubt. But the rivalry between USDT and USDC seems to have taken a different route. USDT, continues to lead across all the top blockchains with a market cap exceeding $68 billion. This is foll... (Read More...)",50.0,50.0,0.148734450340271,76.77000000000001,62.5,6.535577774047852,2022-10-12
14,Bitcoin.com,"Google Cloud Partners With Coinbase to Accept Crypto Payments, Drive Web3 Innovation","Google Cloud has announced a partnership with Coinbase to drive Web3 innovation that includes using the crypto exchange to accept cryptocurrency payments. “We are excited Google Cloud has selected Coinbase to help bring Web3 to a new set of users and provide powerful solutions to developers,” sai... (Read More...)",81.845,50.0,99.88279938697815,95.765,66.39204545454545,99.84816610813141,2022-10-12
15,Feed - Cryptopotato.Com,Hackers Use Fake Solana Phantom Updates to Steal Crypto (Report),Cybercriminals reportedly urged individuals to install the update to breach victims' passwords and steal crypto from their wallets. (Read More...),12.85,25.0,0.19626617431640625,16.475,75.0,0.07655322551727295,2022-10-12
16,Bitcoinist,"One Year Later, CNN Shuts Down NFT Marketplace, Accused Of ‘Rugging’ Users","After just over a year of operations, CNN is shuttering it’s NFT platform, ‘The Vault.’ Despite the crypto and NFT markets enduring substantial downturn throughout a good portion of this year, CNN was operating a modest, relatively under-the-radar NFT project that was the media outlet’s first web... (Read More...)",35.199999999999996,46.11111111111111,0.008854269981384277,78.595,65.5,1.5776365995407104,2022-10-12
17,Decrypt,"An ‘Open, Interoperable’ Metaverse is ‘Better for Everyone’: Meta’s Mark Zuckerberg","Zuckerberg reiterated that Meta won’t build the metaverse alone, but stopped short of saying the firm will fully embrace Web3 technologies. (Read More...)",50.0,62.5,82.89506137371063,56.89999999999999,55.00000000000001,83.55105221271515,2022-10-12
18,The Block,Hacker steals over $100 million from Mango Markets,"The platform said it's investigating and taking steps to have “third parties freeze funds in flight,” it tweeted. (Read More...)",24.47,50.0,0.47325193881988525,72.02,62.5,0.043460726737976074,2022-10-12
19,Bitcoin Magazine,Bitcoin Miners Are The Dung Beetles Of The Energy Sector,"Miners will consume every last drop of wasted energy available, because they’re incentivized to do so. (Read More...)",63.660000000000004,50.0,0.6525635719299316,25.305,58.75,0.04781782627105713,2022-10-12
20,U.Today,"Pivotal XRP Indicators Are About to Cross: Crypto Market Review, October 11","Unfortunately, digital assets are failing to break prolonged downtrend (Read More...)",50.0,62.5,97.14843034744263,19.379999999999995,62.5,2.033868432044983,2022-10-12
21,The Block,Celsius examiner files preliminary work plan for upcoming investigation,The Celsius examiner has filed a preliminary plan that estimates the total cost of her investigation could be as high as $5 million. (Read More...),50.0,50.0,90.67355394363403,50.0,61.0,0.10915398597717285,2022-10-12
22,AMBCrypto,Bitcoin [BTC] holders anticipating a bear market floor should read this,"Bitcoin [BTC] prices have been unusually volatile in recent weeks. This can be considered in contrast with the broader financial markets (equities, credit, and currency markets) that have been significantly volatile within the same period, as per Glassnode’s latest report. While there were specul... (Read More...)",50.0,50.0,0.04229545593261719,69.08999999999999,61.25000000000001,0.025919079780578613,2022-10-12
23,Bitcoinist,Shiba Inu Active User Count Nosedives Amid Bear Market Blues,"Shiba Inu continues to be a prominent presence in the crypto market but that has not helped it escape the onslaught of the crypto bear market. The meme coin has not only taken a beating price-wise, but its active user count has also been on the decline. Data shows that investors are no longer as […] (Read More...)",70.095,43.333333333333336,0.11888444423675537,79.585,60.83333333333334,0.0037610530853271484,2022-10-12
24,NewsBTC,Bitcoin Mining Difficulty Adjustment May Force Miners To Dump Their BTC,"Last week, the bitcoin hashrate touched a new all-time high after tremendous growth. While this was a welcome development, it had significant implications for the next mining difficulty adjustment which took place on Monday. As expected, the difficulty adjustment had jumped by double-digits, beat... (Read More...)",19.379999999999995,50.0,0.011405348777770996,69.08999999999999,62.248316498316505,0.03629028797149658,2022-10-12
25,crypto.news,"BNY Mellon, The Oldest Bank in The U.S., Will Provide Crypto Custody Service","BNY Mellon has stated it would start accepting cryptocurrency assets from customers, making it the first major U.S. bank to protect digital properties and traditional holdings on the same network. (Read More...)",50.0,50.0,99.08600151538849,85.48,56.770833333333336,5.683702230453491,2022-10-12
26,The Block,Former U.S. bank regulator says Biden officials ‘overtly hostile to crypto’,"Brooks, now the CEO of digital asset service company Bitfury, was Comptroller of the Currency in the waning days of the Trump administration. (Read More...)",30.910000000000004,50.0,0.1689136028289795,68.06,62.5,0.5260258913040161,2022-10-12
27,CryptoGlobe,"$TRX and $XRP Could Soon Start Outperforming $BTC, Popular Crypto Analyst Suggests","A popular cryptocurrency analyst has recently suggested that based on their charts, both TRON ($TRX) and the $XRP token could soon start outperforming the flagship cryptocurrency Bitcoin ($BTC) ahead of the release of economic data this week. In a series of tweets shared with their over 500,000 f... (Read More...)",71.075,80.0,0.17100870609283447,84.04,66.25,1.1675328016281128,2022-10-12
28,U.Today,"Ripple Gains Another Edge Over SEC, Wins Judges’ Support",Judge Torres rules for I-Remit and TapJets to file their amicus briefs in support of Ripple (Read More...),91.58,55.00000000000001,99.5270699262619,70.095,75.0,95.37754356861115,2022-10-12
29,Bitcoin.com,"Bitcoin Miner Cleanspark Completes Sandersville Facility Acquisition, Firm’s Hashrate Now 4.7 Exahash","On October 11, the publicly-listed bitcoin miner Cleanspark announced that it has completed the acquisition of Mawson Infrastructure Group’s Georgia-based bitcoin mining facility. Following the acquisition, Cleanspark says it now manages 220 megawatts (MW) of bitcoin miners with a hashrate of ove... (Read More...)",50.0,40.0,79.23534214496613,50.0,62.5,96.85810804367065,2022-10-12
30,Bitcoin Magazine,It Is Time to Re-Found the American Republic,"This article is the core story in Bitcoin Magazine's ""The Orange Party Issue”. Click here to subscribe now. An Era of Democratic RevolutionsIn the early 1980s, my parents immigrated to the United States from communist Poland. Both software engineers, they saw in the U.S. a place where they could ... (Read More...)",50.0,50.0,1.9735455513000488,83.525,65.0,86.21020317077637,2022-10-12
31,CryptoPotato,Billionaire Paul Tudor Jones: Bitcoin and Ethereum Prices Could Rise Amid Inflation,"Despite the ongoing market crash, Tudor Jones remains bullish on the largest cryptocurrencies. (Read More...)",50.0,50.0,0.8499383926391602,29.905000000000005,75.0,0.7368803024291992,2022-10-12
32,The Daily Hodl,"$47,000,000,000 Asset Manager Could Spark Turnaround of Decentralized Exchange Protocol: Analyst","A widely followed crypto analyst says the entry of a $47 billion asset manager could provide a much-needed shot in the arm for decentralized exchange (DEX) protocol SushiSwap (SUSHI). Will Clemente tells his 660,800 Twitter followers that one of the consistent use cases of crypto is enabling mark... (Read More...)",76.335,50.0,97.25218713283539,68.06,60.83333333333334,9.85918939113617,2022-10-12
33,Crypto Briefing,Understanding Art Gobblers: The Mechanics of Justin Roiland’s New NFT Collection Unpacked,"Art Gobblers is expected to launch in twenty days. While the new Factory NFT collection markets itself as a self-sustaining art ecosystem, its tokenomics appear to reward early adopters disproportionately.... (Read More...)",50.0,56.81818181818181,99.8591423034668,78.595,57.95454545454546,2.132636308670044,2022-10-12
34,CryptoBriefing,Understanding Art Gobblers: The Mechanics of Justin Roiland’s New NFT Collection Unpacked,"Art Gobblers is expected to launch in twenty days. While the new Factory NFT collection markets itself as a self-sustaining art ecosystem, its tokenomics appear to reward early adopters disproportionately. A new kind of NFT collection is entering the crypto scene with the upcoming launch of Art G... (Read More...)",50.0,56.81818181818181,99.8591423034668,78.595,61.43939393939394,1.5530377626419067,2022-10-12
35,The Daily Hodl,Google Chooses Coinbase To Power New Crypto Payment Tool for Cloud Services: Report,"Tech giant Google is reportedly partnering with crypto exchange Coinbase to allow its users to pay for cloud services with crypto assets. In early 2023, the Google Cloud Platform will begin accepting cryptocurrency payments using the Coinbase Commerce service from select Web 3.0 developers, accor... (Read More...)",50.0,56.81818181818181,96.14912271499634,79.295,60.0,3.8419753313064575,2022-10-12
36,AMBCrypto,Ethereum traders could have a lot to look forward to owing to these developments,"Ethereum [ETH] bears have been dominant since last week, leading to a higher price drop towards the lower range for 2022. Amid all this, there were some interesting observations that investors should take note of. ETH’s exchange reserves dropped back to the lowest year-to-date levels. The last ti... (Read More...)",50.0,50.0,99.71097707748413,25.305,60.416666666666664,0.06828010082244873,2022-10-12
37,U.Today,More Bitcoins to Exit Market; Whale Manipulation in Play?,Percentage of BTC held on exchanges drops to a four-year low of 8.7% in October as whales have been accumulating (Read More...),52.580000000000005,75.0,0.04889369010925293,36.34,62.5,0.007265806198120117,2022-10-12
38,crypto.news,France to Spend €100 Billion on Inflation Between 2021-2023: Implication for Crypto,"The French government announced its intention to spend €100 billion to buffer inflation's effect on citizens, which has a major effect on crypto. (Read More...)",50.0,50.0,0.8750796318054199,50.0,59.375,0.15777945518493652,2022-10-12
39,Cointelegraph,Bitcoin analysts and traders say BTC’s low volatility is ‘a calm before the storm’,"Stocks markets slide toward yearly lows, while Bitcoin price remains range-bound. Here’s why crypto analysts expect a sharp move from BTC soon. (Read More...)",52.580000000000005,57.49999999999999,9.291502833366394,39.885,59.375,0.16161203384399414,2022-10-12
40,CoinTelegraph,CNN to shut down its NFT marketplace and issue 20% refund,"The nonfungible token venture, originally scheduled with a half-year road map, lasted little under four months. (Read More...)",50.0,42.22222222222222,0.01386106014251709,50.0,61.458333333333336,0.00635981559753418,2022-10-12
41,BeInCrypto,Solana (SOL):  the ‘Bright Spark’ That Keeps Flickering,"When Solana (SOL) launched a little more than two years ago, the blockchain network held a lot of promise. Now, it has become canon fodder for social media banter. Observers quipped that Solana has more power cuts than what is expected for the U.K this winter. The post Solana (SOL): the ‘Bright S... (Read More...)",50.0,85.00000000000001,99.90471303462982,54.14,63.89880952380953,2.7983397245407104,2022-10-12
42,CryptoBriefing,Why the SEC Is After Yuga Labs and What It Means for NFTs,"In what will be seen as a major escalation in its crypto enforcement agenda, the Securities and Exchange Commission is said to be investigating Yuga Labs, the creators and distributors of Bored Ape Yacht Club, for illegal securities offerings. The SEC is investigating Yuga Labs to determine if an... (Read More...)",50.0,45.0,93.10390949249268,34.089999999999996,44.625,0.3770798444747925,2022-10-12
43,Crypto Briefing,Why the SEC Is After Yuga Labs and What It Means for NFTs,"In what will be seen as a major escalation in its crypto enforcement agenda, the Securities and Exchange Commission is said to be investigating Yuga Labs, the creators and distributors... (Read More...)",50.0,45.0,93.10390949249268,64.8,64.0625,4.902750253677368,2022-10-12
44,AMBCrypto,Why investments in SUSHI may be a matter of ‘personal taste’ in Q4,Good news came in for SushiSwap [SUSHI] as it managed to nab the second position in the list of top gainers in the Solana ecosystem in the last seven days. Sushi registered some promising price movements lately that helped the token achieve this new milestone as it registered over 12% weekly gain... (Read More...),51.29,50.0,8.8946133852005,87.53,60.85227272727273,99.54237341880798,2022-10-12
45,Cointelegraph,Financial Stability Board opens proposed crypto regulatory framework for public comments,"“Effective regulatory and supervisory frameworks should be based on the principle of ‘same activity, same risk, same regulation,’” said the FSB proposal. (Read More...)",50.0,50.0,85.09430289268494,36.34,61.0,0.4683971405029297,2022-10-12
46,Cointelegraph,TempleDAO exploit results in $2M loss,The hack was allegedly caused by “a missing onlyMigrator check.” (Read More...),29.905000000000005,50.0,0.014403462409973145,35.199999999999996,53.333333333333336,0.013497471809387207,2022-10-12
47,The Block,"Step secures $300 million in debt funding, launches crypto investment service","Step, a banking platform for teens and young adults, revealed a cryptocurrency investment platform and $300 million in debt financing. (Read More...)",47.42,50.0,98.19300174713135,31.94,65.0,0.23489594459533691,2022-10-12
48,Blockworks,The Bug That Took Down Wintermute Is Still at Large,"Though no funds were lost, ParaSwap is the latest protocol found to have a vulnerable deployer address The post The Bug That Took Down Wintermute Is Still at Large appeared first on Blockworks. (Read More...)",50.0,51.46825396825396,1.9480764865875244,17.015,56.739417989417994,92.85980761051178,2022-10-12
49,Blockworks,The Bug That Took Down Wintermute Is Still at Large,"Though no funds were lost, ParaSwap is the latest protocol found to have a vulnerable deployer address (Read More...)",50.0,51.46825396825396,1.9480764865875244,17.015,58.333333333333336,77.45580673217773,2022-10-12
50,CoinTelegraph,City of Niagara Falls orders Blockfusion facility to cease and desist crypto mining,The city notice effectively stopped the facility from conducting “any cryptocurrency mining or related operations” until Blockfusion was in compliance with local zoning ordinances. (Read More...),50.0,50.0,0.008243322372436523,62.5,63.74999999999999,22.18979299068451,2022-10-12
51,CryptoBriefing,"TempleDAO, STAX Hacked for $2.3 Million","TempleDAO and its associated project STAX Finance have been hacked for approximately $2.3 million. TempleDAO and STAX have been exploited.STAX acknowledged the attack in a maintenance note. It wrote that the attacker managed to steal a total of 321,154 xLP on October 11. Those tokens were swapped... (Read More...)",29.905000000000005,50.0,0.002402067184448242,4.320000000000002,51.66666666666666,0.0028371810913085938,2022-10-12
52,Crypto Briefing,"TempleDAO, STAX Hacked for $2.3 Million",TempleDAO and its associated project STAX Finance have been hacked for approximately $2.3 million. TempleDAO and STAX Hacked TempleDAO and STAX have been exploited. STAX acknowledged the attack in a... (Read More...),29.905000000000005,50.0,0.002402067184448242,5.575000000000002,52.5,0.00393986701965332,2022-10-12
53,U.Today,This Firm Going to Hire More Developers Despite Massive 2022 Layoffs,VeChain is looking for over 100 developers while eying an HQ in Europe (Read More...),50.0,55.00000000000001,99.04637932777405,50.0,75.0,95.59811651706696,2022-10-12
54,CryptoSlate,"CryptoSlate Wrapped Daily: Another Spot Bitcoin ETF gets rejected by SEC; Google, Coinbase partner for crypto payments","The biggest news in the cryptosphere for October 10 includes Google’s new partnership with Coinbase to start accepting crypto payments, Bittrex’s $30 million fine for violating federal sanctions, and the SEC’s rejection of WisdomTree’s Spot Bitcoin ETF for not having enough surveillance. CryptoSl... (Read More...)",24.47,47.5,0.004595518112182617,22.13,59.53030303030303,0.07915496826171875,2022-10-12
55,The Daily Hodl,"U.S. Treasury and FinCEN Hit Crypto Exchange Bittrex With $53,000,000 in Fines for Two Offences","Crypto exchange Bittrex is settling with the U.S. Treasury and the Financial Crimes Enforcement Network (FinCEN) to the tune of $53 million. According to a press release, the Treasury’s Office of Foreign Assets Control (OFAC) and FinCEN have charged Bittrex with violating sanctions and anti-money... (Read More...)",42.345,50.0,0.5844324827194214,28.925,56.25,0.00871121883392334,2022-10-12
56,Cointelegraph,Stellar Development Foundation launches $100M fund to support native smart contract adoption,The Soroban Adoption Fund incentivizes developers to begin building products and tools on the new smart contract platform. (Read More...),82.985,61.60714285714286,97.32081294059753,70.095,64.17748917748918,21.710383892059326,2022-10-12
57,crypto.news,Google Cloud and Coinbase to Boost Innovation and Creativity in Web3,Google Cloud and Coinbase have announced a new long-term strategic alliance to serve the growing Web3 ecosystem and its developers. (Read More...),89.225,50.0,99.18027222156525,58.894999999999996,65.9090909090909,99.68791007995605,2022-10-12
58,Decrypt,OpenSea Adds Avalanche NFT Support,"The largest NFT marketplace now offers art on seven blockchains, including the “smol” world of Avalanche. (Read More...)",70.095,50.0,95.85653245449066,50.0,65.0,98.65192174911499,2022-10-12
59,The Block,"Bitcoin mining stock report: Tuesday, October 11","Here's how crypto mining companies performed on Tuesday, Oct. 11. (Read More...)",50.0,50.0,0.008943676948547363,50.0,75.0,0.014320015907287598,2022-10-12
60,Decrypt,How a Web3 Data Storage Startup Got Microsoft to Invest,The Space and Time CEO reveals why Microsoft backed a decentralized data warehouse during a bear market. (Read More...),50.0,50.0,9.841111302375793,51.29,75.0,12.515923380851746,2022-10-12
61,BeInCrypto,Yuga Labs and Bittrex Under Scrutiny as US Crypto Crackdown Intensifies,"The next crypto market bull run has encountered another hurdle as the U.S. Securities and Exchange Commission and the Treasury Department target two pillars of the crypto ecosystem, Bored Ape Yacht Club and Bittrex. The post Yuga Labs and Bittrex Under Scrutiny as US Crypto Crackdown Intensifies ... (Read More...)",50.0,50.0,84.85517501831055,61.315,50.0,0.6596416234970093,2022-10-12
62,Feed - Cryptopotato.Com,SEC Probes Bored Ape Creator for Potential Unregistered Securities Sale,The commission is interested in whether some of Yuga’s NFTs behave like securities. (Read More...),51.29,40.0,0.01296699047088623,87.53,68.75,1.7073512077331543,2022-10-12
63,Cryptonews,Ethereum Price Prediction – Will ETH Fall Back to $800 Again?,"Ethereum, the second-largest cryptocurrency, is trading with a bearish bias, down 5.00% in seven days to $1,282.51. The cost of sending Ethereum's gas has increased from $2.58 on October 8 to $4.75 on October 10, an increase of 84%. ... Read More: Ethereum Price Prediction – Will ETH Fall Back to... (Read More...)",50.0,50.0,0.12438297271728516,72.94,60.55555555555555,0.0019669532775878906,2022-10-12
64,NewsBTC,"Ethereum Gains So Much Demand To Buy At $500, Will This Be Possible?","ETH prices continue to trend downwards as prices remain bearish, with price trading on critical support. ETH trades below 50 and 200-day Exponential Moving Average as price struggles to regain bullish signs as many traders and investors wish for $500. The price of ETH needs to break and hold abov... (Read More...)",57.925000000000004,55.00000000000001,82.07469284534454,57.655,60.62499999999999,0.4319220781326294,2022-10-12
65,AMBCrypto,1inch: Assessing why the price performance has been underwhelming,"1inch, the native token of the decentralized exchange aggregator 1inch Network, has posted interesting movements in the last 24 hours. Described by blockchain analytics platform Santiment as “several anomalies” on the 1inch network, the cryptocurrency asset registered a spike in some of its key o... (Read More...)",50.0,50.0,0.23789405822753906,81.845,60.0,1.9733309745788574,2022-10-12
66,Bitcoin.com,"Portugal Prepares to Tax Crypto Gains at Rate of 28%, Draft Budget Unveils","Authorities in Portugal intend to impose a levy on gains from short-term crypto investments with the state budget for next year. The document, which still needs the approval of Portuguese lawmakers, signals a change in the EU nation’s positive attitude towards crypto assets. Government of Portuga... (Read More...)",67.0,50.0,0.1215130090713501,91.125,62.121212121212125,24.89471733570099,2022-10-12
