,source,title,excerpt,vader_sentiment_title,tb_sentiment_title,flair_sentiment_title,vader_sentiment_excerpt,tb_sentiment_excerpt,flair_sentiment_excerpt,date
62,CoinGape,Weekly Bullish Formation Looks For 15% Gains In Bitcoin; know Here,"Bitcoin bulls took a breather today. In the previous session, the price zoomed 10%. The continuation of the upside momentum needs additional buying participation. As of press time, BTC/USD is trading at $21,607, down 0.27%. Bitcoin price consolidates near higher levels waiting for more bullish co... (Read More...)",67.0,50.0,1.7149388790130615,50.0,58.56481481481482,0.009706616401672363,2022-09-11
63,Cointelegraph,How GameFi contributes to the growth of crypto and NFTs,The GameFi sector has achieved unprecedented growth over the past couple of years and is attracting investors. (Read More...),69.08999999999999,50.0,99.95736479759216,84.53999999999999,64.16666666666666,99.94760751724243,2022-09-11
64,CoinGape,How Will Elon Musk’s Deflation Warning Affect Crypto,"Tesla CEO and billionaire, Elon Musk, has a chilling warning for the U.S. economy. Musk believes the economy is heading towards deflation in light of the fed’s hawkish stance against inflation. Elon Musk’s warning, if true, will not be good news for the crypto market He believes another major int... (Read More...)",32.99999999999999,50.0,1.4607936143875122,22.84,62.60416666666666,7.189726829528809,2022-09-11
65,CoinGape,What Are Odds Of Ethereum Merge Failure?: Experts Predict,"Amid high anticipation for the upcoming Ethereum network upgrade, The Merge is all set to happen in next few days. Already, the Ethereum Foundation had announced the shutdown of Ethereum Merge testnet Kiln during next week. The developers indicated that the potential timeline could be anywhere be... (Read More...)",50.0,34.166666666666664,0.2230912446975708,55.135,53.833333333333336,0.020566582679748535,2022-09-11
66,U.Today,"BTC, ADA, and BNB Price Analysis for September 10",Can market finally return to midterm bullish trend? (Read More...),50.0,50.0,2.1578073501586914,50.0,62.5,1.5935122966766357,2022-09-11
67,CoinTelegraph,Liquid staking is key to interchain security,"Liquid staking allows larger proof-of-stake (PoS) blockchains to help secure smaller ones, conferring benefits to the industry as a whole. (Read More...)",67.0,50.0,99.93802309036255,88.58500000000001,61.0,99.93230402469635,2022-09-11
68,CryptoSlate,Op-ed: Zoom out – Suicide Prevention Day,The following content contains references to suicide. (Read More...),16.475,50.0,87.8872960805893,16.475,62.5,0.32890141010284424,2022-09-11
69,U.Today,Cosmos (ATOM) Price Spikes by 40% in Two Days: Possible Reasons,"ATOM, core native cryptocurrency of Cosmos interblockchain ecosystem, outperformed all large caps in last days, here's why (Read More...)",50.0,50.0,0.07463991641998291,50.0,61.904761904761905,91.65742099285126,2022-09-11
70,Crypto Daily,Flasko (FLSK) predicted to be top investment in 2022 over Algorand (ALGO) Polygon (MATIC),"The acceptance of cryptocurrencies has increased over time. Many investors have benefited from their choice to invest in certain projects. New coins appear daily, and experts alongside fans analyze and forecast their potential. Experts are closely monitoring new cryptocurrency coins like Flasko (... (Read More...)",60.114999999999995,75.0,10.650286078453064,91.355,60.621521335807046,99.6276468038559,2022-09-11
71,NullTX,Top 5 Fantom Ecosystem Tokens Below $5M Market Capitalization to Watch in September 2022,"Fantom Ecosystem Tokens are recording good profits despite the dull and bearish market. According to data from CoinMarketCap, Fantom Ecosystem Tokens tops the list with over 225.14% price increase with a total market capitalization of $73,853,142,994 and a trading volume of $8,837,296,819. Today,... (Read More...)",60.114999999999995,75.0,1.3314247131347656,95.63999999999999,61.354166666666664,98.83532524108887,2022-09-11
72,CryptoGlobe,Billionaire David Rubenstein: Failing Trust in Government Is Spurring Crypto Speculation,"David Rubenstein, the billionaire co-founder of private equity firm Carlyle Group, says that investing in Bitcoin is akin to gambling, and that waning confidence in governments is leading to greater belief in speculation. Speaking in a recent interview with Anthony Pompliano, Rubenstein compared ... (Read More...)",50.0,50.0,0.14785230159759521,85.015,57.99999999999999,0.08152425289154053,2022-09-11
73,Crypto Daily,Mark Zuckerberg Questioned About Plans To Combat Crypto Scams,"CEO of Meta Platforms, Mark Zuckerberg, has been asked in a letter from a group of Democratic senators about what he plans to do about fighting cryptocurrency scams on its Facebook, WhatsApp, and Instagram platforms. Zuckerberg received a letter from six Democratic senators in which they cited st... (Read More...)",11.75,50.0,0.7941395044326782,12.85,75.0,0.36333799362182617,2022-09-11
74,The Block,Ethereum’s staking yield after The Merge will be lower than expected,"Some believe Ethereum will consistently pay out 12% yield post Merge, but the current data suggests it will be much lower. (Read More...)",35.199999999999996,45.0,0.29783546924591064,27.060000000000002,61.875,1.7263531684875488,2022-09-11
75,NewsBTC,Algorand Fast Upgrade Could Be A Game-Changer – Here’s How,"Algorand (ALGO) has always been lauded for its imagination and innovation. Algorand’s mainnet update can process as much as 6,000 TPS ALGO beats BTC and ETH when it comes to speedy transactions ALGO price is now up by 6.88% following the announcement of mainnet update And it’s now stepping up the... (Read More...)",50.0,60.0,99.10368919372559,69.08999999999999,61.66666666666667,99.57657754421234,2022-09-11
76,CoinGape,Payment Firm Bolt Drops $1.5 Bln Deal Amid Crypto Market Downturn,"Bolt Financial Inc, a US based checkout firm on Friday announced that it has dropped the $1.5 billion accusation deal with Wyre Payment Inc. This big statement has come amid the crypto market downturn. Is falling crypto market affecting deals? As per the report, Bolt decided to take this big step... (Read More...)",50.0,40.0,0.06278157234191895,30.910000000000004,53.0,11.382454633712769,2022-09-11
77,BeInCrypto,Final Ethereum Shadow Fork Before Merge Goes Live,The Ethereum development team completed the final shadow fork test before the Ethereum Merge yesterday. The post Final Ethereum Shadow Fork Before Merge Goes Live appeared first on BeInCrypto. (Read More...),50.0,53.40909090909091,5.248856544494629,50.0,58.86363636363636,1.306241750717163,2022-09-11
78,U.Today,Whales Grab 600 Billion SHIB Overnight As Number of SHIB Holders Hits New ATH,Top investors have bought nearly 600 billion SHIB worth $7.8 million (Read More...),53.86,56.81818181818181,87.58105635643005,70.095,67.5,98.88589978218079,2022-09-11
79,The Block,Three biggest crypto stories from the past week,"Ethereum's Bellatrix upgrade, Binance's BUSD push and the White House's call for crypto mining standards were some of the week's key developments. (Read More...)",50.0,37.5,0.6615340709686279,50.0,58.333333333333336,94.67920958995819,2022-09-11
80,CryptoGlobe,$BTC: Cardano Founder Says White House Report Suggests Bitcoin Could be Banned in U.S.,"On Friday (September 9), Charles Hoskinson, Co-Founder and CEO of IOG, the blockchain technology firm behind Cardano’s R&amp;D, explained why a recently released White House report paints a worrying picture for Bitcoin in the U.S. It all started on March 9, when President Joe Biden signed the Exe... (Read More...)",27.060000000000002,50.0,0.00680088996887207,32.99999999999999,49.0,2.620992064476013,2022-09-11
81,Crypto Daily,Cardano (ADA) and Solana (SOL) Predictions Looks Bearish As Top Analyst Raises The Hideaways (HDWY) Price Target,Both Cardano and Solana have been hugely popular investments and investors. Unfortunately both the Cardano price and Solana price have dropped significantly in the crypto market. The ADA price is down 75% over the past 12 months and the SOL price is down 77%. It’s no wonder that investors are rus... (Read More...),60.114999999999995,75.0,1.1237233877182007,43.51,52.95634920634921,0.07495284080505371,2022-09-11
82,Crypto Daily,Sky Mavis-Google Cloud Partnership To Tighten Security On Ronin,"The creator of the hugely popular Axie Infinity game, Sky Mavis, has announced that it has partnered with Google Cloud. The partnership will help significantly tighten the Ronin blockchain’s security and allow it to scale securely and sustainably. A Multi-Year Collaboration On most occasions, pro... (Read More...)",67.0,50.0,99.42134916782379,94.415,66.45833333333333,99.9078780412674,2022-09-11
83,CryptoPotato,White House Report Recommends Banning Bitcoin Mining to Slash GHG Emissions,The White House recommended “eliminating” the use of energy-intensive consensus methods if other measures fail to reduce crypto carbon emissions. (Read More...),47.42,50.0,0.17472505569458008,29.905000000000005,48.4375,4.081994295120239,2022-09-11
84,The Daily Hodl,Popular Crypto Strategist Issues Severe Warning on Embattled Altcoin That’s Exploded by Over 330% in a Month,"A widely followed crypto analyst is issuing a warning to investors about an altcoin that has surged over 330% since August. The pseudonymous trader known as Crypto Capo tells his 510,000 Twitter followers that he believes Terra Luna Classic (LUNC), the rebranded version of stablecoin issuer Terra... (Read More...)",35.199999999999996,80.0,0.015854835510253906,32.99999999999999,59.44444444444444,0.01372992992401123,2022-09-11
85,Crypto Daily,"Big Eyes Coin Price Fires Up During Presale, As Investors Eye Ethereum, Shiba Inu","The crypto market craze makes it hard to figure out blue chip coins to watch. Many new decentralized tracking tools like Dextools.io are gaining momentum to help traders figure out new and promising coins to try out. Surprisingly, rug pull projects also use these platforms to their advantage, mak... (Read More...)",50.0,50.0,0.0353693962097168,94.895,61.75662878787879,2.13969349861145,2022-09-11
86,Crypto Daily,Solana (SOL) and Cardano (ADA) holders sell to buy into Flasko (FLSK) presale,"The year 2022 was very unusual. People had high expectations for it, but as Bitcoin (BTC) entered a downtrend, their hopes were dashed and many had to sell their portfolios. The cryptocurrency projects Flasko (FLSK), Cardano (ADA), and Solana (SOL) are three you shouldn't pass up if you're hoping... (Read More...)",50.0,50.0,9.946426749229431,78.595,67.75,0.007969141006469727,2022-09-11
87,Bitcoinist,Why Bitcoin Casinos Are Proving To Be A Better Alternative,"Bitcoin casinos are becoming increasingly popular due to their plethora of advantages. With the more mainstream adoption of cryptocurrency, these casinos have been able to plug a significant gap in the gambling industry. For many, the fact that they have to input their personal banking informatio... (Read More...)",72.02,75.0,0.046372413635253906,86.345,68.33333333333333,99.92474913597107,2022-09-11
88,Bitcoinist,Ford Motor Gears Up For The Metaverse With Trademarks For Virtual Cars,"Ford Motor, a world-renowned U.S. car maker, is maneuvering towards the -fungible tokens and the metaverse as it files for 19 trademark applications for its American car brands with the U.S. Patent and Trade Office (USPTO). Ford dipping into the metaverse and NFT or Web3 ecosystem came after the ... (Read More...)",50.0,50.0,99.42961037158966,50.0,62.5,1.1644423007965088,2022-09-11
89,Finbold,Stock market guru with 40 years of experience slams fiat money as fraudulent,Professional trader and chief market strategist of BubbaTrading.com Todd ‘Bubba’ Horwitz has slammed the current fiat monetary system terming it... Continue reading (Read More...),25.305,50.0,0.41002631187438965,50.0,60.0,3.2696962356567383,2022-09-11
90,CoinGape,Elon Musk’s Dire Warning: US Economy Headed Towards Deflation,Tesla and SpaceX CEO Elon Musk has a dire warning for the US economy. Musk warns that another major federal reserve hike will result in deflation. Musk’s warning comes as the Fed is expected to move forward with another jumbo interest rate hike at the September FOMC meeting. Musk is not the major... (Read More...),17.015,50.0,1.1231929063796997,18.154999999999998,56.56250000000001,0.08349120616912842,2022-09-11
91,Bitcoin.com,"Bitcoin, Ethereum Technical Analysis: ETH Bulls Targeting $1,800 This Weekend","Ethereum rallied to a fresh three-week high to start Saturday’s session, however gains eased as the day progressed. The token continues to trade above $1,700, as market sentiment remains bullish. Bitcoin experienced a similar day, with the token slowly losing steam, after a failed breakout of a k... (Read More...)",50.0,50.0,0.2298593521118164,50.0,56.00000000000001,0.0014066696166992188,2022-09-11
92,U.Today,"SHIB Burn Rate 258% Up, Here’s How Many SHIB Gets Burned",Major SHIB burn tracker says that the burn rate has surged dramatically today; anonymous whale has sold 368 billion SHIB (Read More...),50.0,75.0,0.0050961971282958984,50.0,64.0625,98.49220812320709,2022-09-11
93,crypto.news,Google Cloud to Validate Transactions on Axie Infinity’s Ronin Network,"Google Cloud is willing to run a validator node on the Ronin network, the blockchain behind Axie Infinity. (Read More...)",68.06,50.0,98.35878610610962,50.0,55.833333333333336,98.41717779636383,2022-09-11
94,crypto.news,MicroStrategy Files to Sell Up to $500M of Stock to Buy More Bitcoin,MicroStrategy has filed a new prospectus with the US SEC to sell as much as $500 million in stock. Proceeds may be used to buy Bitcoin. (Read More...),50.0,75.0,0.07792413234710693,50.0,59.20454545454545,0.13199150562286377,2022-09-11
95,NewsBTC,"VGX, Native Crypto Of Troubled Voyager Platform, Gains 44% Over Last 24 Hours","Voyager (VGX), the crypto exchange platform that declared bankruptcy in July, used to be a force to reckon with in the crypto space. VGX pumps up in price by 44% in the past 24 hours Voyager Digital files notice for public auction of the remainder of its assets VGX registers a spike in trading vo... (Read More...)",42.345,37.5,77.47751474380493,58.894999999999996,53.125,90.59456586837769,2022-09-11
96,CryptoGlobe,$BTC: deVere Group CEO Says Bitcoin ‘Whale Watching’ Is Telling Him to Buy the Dip,"In a recent blog post, deVere Group CEO Nigel Green commented on Bitcoin’s price action, and why he views the current dip in the price of Bitcoin as a “key buying opportunity.” His comments were made on a blog post published on Wednesday (September 7), which is when the Bitcoin price dropped belo... (Read More...)",50.0,50.0,0.007700920104980469,50.0,53.333333333333336,1.2738555669784546,2022-09-11
97,AMBCrypto,This automobile giant becomes the latest to step foot in the NFT world,The Ford Motor Company has revealed its metaverse ambitions. The automobile giant has been the latest to file a trademark with the United States Patent and Trade Office (USPTO). Trademark attorney Mike Kondoudis tweeted that the American car giant filed 19 trademark applications covering major br... (Read More...),50.0,62.5,99.9426543712616,71.075,58.854166666666664,3.4628182649612427,2022-09-11
98,Bitcoin.com,China to Crack Down on Copyright Infringement Through NFTs,"Authorities in China are going after creators of digital collectibles based on other people’s works of art, the use of which was not authorized. The government offensive is part of a campaign to combat online copyright infringement and piracy with the participation of several departments. Regulat... (Read More...)",26.165,42.22222222222222,0.23711621761322021,9.120000000000001,54.6875,0.007283687591552734,2022-09-11
99,BeInCrypto,MicroStrategy Plans to Raise Funds to Buy More Bitcoin,Business intelligence firm MicroStrategy may buy more Bitcoin with funds raised from selling some of its shares to Cowen and Company and BTIG. The post MicroStrategy Plans to Raise Funds to Buy More Bitcoin appeared first on BeInCrypto. (Read More...),50.0,75.0,5.4330021142959595,82.43,65.5,0.022163987159729004,2022-09-11
100,CryptoBriefing,The Ethereum Merge Is Coming—Here’s How to Earn ETH From Staking,"""The Merge"" is approaching, and ETH holders have the option to stake their assets through solo staking, independent staking pools, liquid staking protocols, and centralized exchanges. While each method slightly differs from the others, all of them have different benefits and risks. Ethereum is ab... (Read More...)",50.0,50.0,76.16505324840546,64.8,53.333333333333336,98.9939272403717,2022-09-11
101,Crypto Briefing,The Ethereum Merge Is Coming—Here’s How to Earn ETH From Staking,"“The Merge” is approaching, and ETH holders have the option to stake their assets through solo staking, independent staking pools, liquid staking protocols, and centralized exchanges. While each method slightly... (Read More...)",50.0,50.0,76.16505324840546,58.894999999999996,54.166666666666664,22.349917888641357,2022-09-11
102,U.Today,Elon Musk and DOGE Co-Founder Make Fun of Uniswap and CZ Scam Twitter Bots on Halloween,"Dogecoin co-creator was trolling crypto scam bots that impersonate CZ, when Elon Musk stepped in with his Halloween tweet (Read More...)",44.865,65.0,0.03898143768310547,21.405,75.0,0.701373815536499,2022-09-11
103,The Block,Zuckerberg asked by senators what he is doing to fight crypto scams on social media,"FTC data shows that 49% of cryptocurrency fraud reports specified scams originated on social media from Jan. 1, 2021 through March 31, 2022, costing consumers about $417 million. (Read More...)",12.469999999999997,51.66666666666667,0.10448992252349854,8.875,63.33333333333333,0.048291683197021484,2022-09-11
104,U.Today,"LUNC Falls 15%, Here Is Why It Is Doomed to Fail",LUNC downfall is beginning of ultimate end for Do Kwon's infamous project (Read More...),8.645000000000003,25.0,0.003701448440551758,50.0,50.0,0.4479914903640747,2022-09-11
105,CoinGape,"US SEC Playing Silly Games With Serious Litigation, Alleges Whistleblower Firm","The US SEC, the watchdog responsible for building regulations around digital assets, again got alleged of not taking litigations seriously. However, the recent crucial running lawsuits proceeding also suggests that the SEC has applied delay tactics to stretch them. Is SEC escaping vital questions... (Read More...)",47.42,35.833333333333336,0.440216064453125,73.105,50.303030303030305,0.17655491828918457,2022-09-11
106,AMBCrypto,This UK Parliament member wants the country to be a hub for cryptos,"“We want to become the country of choice for those looking to create, innovate and build in the crypto space,” said UK Economic Secretary to Treasury Richard Fuller. This statement was made as part of the parliamentary debate on crypto assets regulation in the country. He added that with the new ... (Read More...)",50.0,60.0,10.389211773872375,89.82,63.93939393939394,95.64038515090942,2022-09-11
107,The Daily Hodl,"Bitcoin Whale Activity Is Sending a Bullish Signal for BTC, Says deVere Group CEO Nigel Green – Here’s Why","The CEO of financial advisory giant deVere Group, Nigel Green, says that recent activity by Bitcoin (BTC) whales is making him bullish on the flagship crypto asset. According to Green, one of the reasons he is bullish is that Bitcoin whales could be preparing to jump back into the market after a ... (Read More...)",50.0,40.0,0.022277235984802246,72.02,50.71428571428571,0.019180774688720703,2022-09-11
108,U.Today,Is Cardano Expanding? Charles Hoskinson Is Working on “Something Really Cool” in Papua New Guinea,IOG and Cardano founder says he is busy working in New Guinea now (Read More...),50.0,62.15909090909091,14.443093538284302,50.0,62.272727272727266,0.1678466796875,2022-09-11
109,CryptoGlobe,CZ Explains Says Binance Has No Connection to the Chinese Government,"The chief executive officer of leading crypto exchange Binance has once again pushed back on the notion that his company is affiliated with China. In a recent blog post, Binance Co-Founder and CEO Changpeng Zhao (better known as “CZ”) likened attempts to associate the exchange with China and the ... (Read More...)",35.199999999999996,50.0,0.007081031799316406,50.0,62.5,0.04738271236419678,2022-09-11
110,CoinTelegraph,BTC price nears $21.7K as whales boost Bitcoin 'almost perfectly',"It's all about the big-volume buy and sell zones for Bitcoin on short timeframes, data reveals. (Read More...)",88.27499999999999,100.0,0.26738643646240234,50.0,62.5,9.803321957588196,2022-09-11
111,crypto.news,Presearch Rolls Out $1 Million Advertising Grant Program for Crypto Projects,"Presearch, a decentralized search engine protocol, has announced that it’s offering $1 million in advertising grants. (Read More...)",68.06,50.0,2.6848018169403076,61.315,75.0,0.047788023948669434,2022-09-11
112,Crypto Daily,"Audited Crypto Gem Shortlist: Uniglo (GLO), PancakeSwap (CAKE), BakerySwap (BAKE), And Polygon (MATIC)","Crypto gems are digital assets with low market caps that have the potential to become very valuable in the future. Unlike traditional investments, investing in crypto gems is still very new and risky. However, many people believe that the potential rewards are worth the risks. There are a few thi... (Read More...)",50.0,50.0,76.07613503932953,79.495,56.15530303030303,78.96535396575928,2022-09-11
113,CryptoPotato,Crypto Market Cap Soars Above $1T: Bitcoin Taps 2-Week High,"The crypto market cap has reclaimed the coveted $1 trillion mark following the recent gains from BTC, ETH, and many others. (Read More...)",50.0,54.0,0.01004040241241455,67.0,62.5,90.97505211830139,2022-09-11
114,NewsBTC,Finding The Best Bitcoin Poker Sites In 2022,The traditional financial system and fiat currencies have been operating for almost 100 years without challenge until the launch of Bitcoin in 2009. The cryptocurrency prompted a financial revolution with implications yet to come and a new era of independence for individuals. In the online and ga... (Read More...),81.845,100.0,99.82061088085175,47.14,56.36363636363636,99.72410202026367,2022-09-11
115,Bitcoin.com,ETC Group Says It Will List an Exchange-Traded Product Based on Anticipated ETH Hard Fork,Digital asset-backed securities provider the Etc Group has said it will list an exchange-traded product (ETP) based on an anticipated hard fork of the Ethereum blockchain on September 15. Current holders of Etc Group’s ethereum ETP (ZETH) will be issued with “units of the new security free of cha... (Read More...),44.865,35.416666666666664,0.4760563373565674,87.895,56.20580808080808,0.39793550968170166,2022-09-11
116,Cryptomode,MNNT Ecosystem Partners with Bytrix Technologies,"Developers of the MNNT blockchain gaming ecosystem recently entered into a partnership with Bytrix Technologies – a global software development company. As a result, MNNT now has one of the most powerful and productive development teams in the entire blockchain industry since Bytrix Technologies,... (Read More...)",50.0,50.0,99.90041553974152,73.77,60.83333333333334,99.93208944797516,2022-09-11
117,Cryptomode,"Uniglo (GLO) Is The New Golden Child Of Ethereum (ETH) And Uniswap (UNI) Whales, Analyst Claims","An analyst claims Uniglo is the new golden child of Ethereum and Uniswap whales. The new “favorite” is an Ethereum-based DeFi protocol that has seen a surge in price and liquidity in recent weeks, making it one of the most popular assets in the market right now. Now, this leading analyst says tha... (Read More...)",50.0,60.909090909090914,13.955932855606079,81.07,66.43578643578644,96.18422091007233,2022-09-11
118,BeInCrypto,Bitcoin Miners’ Revenue Drops Below $1B Amid Bearish Market & Increasing Mining Difficulty,Bitcoin mining revenue fell under $1 billion in August due to decreasing investor interest which led to falling prices as well as difficulty in mining the cryptocurrency. The post Bitcoin Miners’ Revenue Drops Below $1B Amid Bearish Market &amp; Increasing Mining Difficulty appeared first on BeIn... (Read More...),32.99999999999999,50.0,0.10001957416534424,46.14,60.416666666666664,0.002568960189819336,2022-09-11
119,Cryptomode,"Crypto News Today: The Next Cryptocurrencies To Make A Big Splash In The Coin Market – Fantom, Compound, and Big Eyes Coins","The coin market is constantly evolving, with new tokens introduced nearly daily. However, only a few of them manage to make the necessary impact. This piece will reveal the crypto tokens that are set to explode the crypto space – Fantom (FTM), Compound (COMP), and Big Eyes (BIG) Fantom (FTM) Fant... (Read More...)",50.0,50.0,99.50893521308899,50.0,52.42424242424243,0.6499409675598145,2022-09-11
120,Cryptomode,"Crypto News Today: What’s Unique about Ethereum, Enjin coin, Tamadoge, and Big Eyes Coin?","When it comes to crypto investments, users are often concerned about the utility. No one wants to waste money on a project without any added benefits. While some projects do not necessarily need direct use cases (meme coins), others do. In this regard, we’d be revealing four top tokens and their ... (Read More...)",50.0,59.375,97.20656871795654,17.099999999999998,59.166666666666664,6.495067477226257,2022-09-11
121,Cryptonews,This Cryptocurrency is Set for a 10x Price Explosion According to Analysts,"Tamadoge, one of the most well-known ERC20 tokens, takes a novel approach by combining meme currency concepts with play-to-earn (P2E) game elements. Simply put, Tamadoge aspires to be the finest meme coin by capitalizing on the ""Doge"" style's widespread appeal. ... Read More: This Cryptocurrency ... (Read More...)",50.0,50.0,0.2243250608444214,65.91,61.0,99.9850332736969,2022-09-11
