,source,title,excerpt,vader_sentiment_title,tb_sentiment_title,flair_sentiment_title,vader_sentiment_excerpt,tb_sentiment_excerpt,flair_sentiment_excerpt,date
63,The Daily Hodl,"Top Crypto Strategist Says Bitcoin (BTC) at $22,000 Is Where ‘Dreams Are Made’ – Here’s What It Means","A closely tracked crypto strategist who built his following with timely Bitcoin (BTC) calls says $22,000 is a make or break level for the king crypto. Pseudonymous analyst DonAlt tells his 414,000 Twitter followers that he’s keeping an eye on how Bitcoin reacts as it slowly grinds its way up to $... (Read More...)",60.114999999999995,75.0,98.72934818267822,50.0,53.333333333333336,2.8156518936157227,2022-07-12
64,CoinTelegraph,"REPORT: Binance allegedly continued to serve Iranian customers, despite ban and sanctions",Iranian cryptocurrency users claim to have used global exchange Binance months after a company-imposed ban and renewed economic sanctions against the country. (Read More...),72.245,45.0,0.16159415245056152,22.13,61.66666666666667,0.20074248313903809,2022-07-12
65,Ethereum World News,Celsius Network Withdraws 6k Wrapped BTC Worth $124M from Aave,"Summary: Celsius Network has withdrawn 6,083 Wrapped Bitcoin worth $124 million from Aave. Celsius Network also repaid $78 million in USDC to Aave. The lending platform has been winding down on its DeFi positions since mid-June. The financially embattled DeFi lending protocol Celsius Network has ... (Read More...)",61.315,65.0,0.0330120325088501,61.315,58.05555555555555,0.0023245811462402344,2022-07-12
66,ZyCrypto,"Why Wall Street Sees Bitcoin Falling Sharply To $10,000",Bitcoin could be primed for a steeper retracement. (Read More...),42.345,43.75,0.0513613224029541,50.0,75.0,0.002878904342651367,2022-07-12
67,The Daily Hodl,Global Regulatory Body To Present New Crypto Rule Proposal at Next G20 Meeting: Report,"An international body of regulators, officials, and bankers is set to propose widespread crypto rules in October. According to a new report from Reuters, The Financial Stability Board (FSB), an organization established by the G20 group, says the recent crypto market carnage produces a ripple effe... (Read More...)",50.0,51.70454545454546,99.72307682037354,50.0,56.36363636363636,0.18727779388427734,2022-07-12
68,CryptoPotato,Capital Flooding in Bitcoin and Ethereum Tends to Stay: Messari,"Crypto IPOs and ETFs are more important to institutions interested in crypto assets than retail investors looking for similar exposure, Messari's annual report reveals. (Read More...)",50.0,50.0,0.02409219741821289,83.485,66.5,7.170623540878296,2022-07-12
69,Bitcoin.com,"China Frozen Bank Account Controversy: Affected Clients Injured During Protests, Nearly $6 Billion Missing","Some Chinese bank clients, whose accounts were frozen in April, were injured while staging a protest at the Zhengzhou branch offices of the country’s central bank. Reports from local media outlets suggest that as much as $6 billion in client funds is missing and the individual believed to be behi... (Read More...)",12.469999999999997,47.5,0.7735401391983032,14.52,53.57142857142857,0.07378756999969482,2022-07-12
70,AMBCrypto,When will Bitcoin [BTC] make a comeback? This exec thinks…,"Ruchir Sharma, Managing Director and Chairman of Rockefeller International, claims that Bitcoin (BTC) is essentially a great idea. One that has been wrecked by too much access to cheap capital and speculative zeal, however. Ruchir Sharma is the latest to join the list of well-known personalities ... (Read More...)",50.0,50.0,9.358274936676025,88.58500000000001,70.0,18.19782853126526,2022-07-12
71,The Daily Hodl,Cardano (ADA) vs. Algorand (ALGO)? Coin Bureau Weighs In on Potential Rivalry Between Top Ethereum Challengers,"A popular crypto analyst known for doing in-depth research is reacting to the news that a key developer has decided to jump ship to work for a competing project. In a new YouTube update, the pseudonymous host of Coin Bureau known as Guy discusses the implications of top Cardano (ADA) architect Jo... (Read More...)",64.8,62.5,1.37920081615448,77.86999999999999,67.36363636363636,15.879496932029724,2022-07-12
72,Crypto Daily,"Globe Exchange announces listing of Near token, offering traders up to 100X leverage on new $NEAR-Perp!","Globe Exchange has this week announced another highly significant listing on their final-generation derivatives exchange; $NEAR perpetuals are to be listed on July 13th at 6 PM UTC, offering the community access to up to 100X leverage on $NEAR-Perps! James West, Founder &amp; CEO of Globe Exchang... (Read More...)",50.0,56.76136363636364,9.87851619720459,66.835,62.18749999999999,88.2187008857727,2022-07-12
73,BeInCrypto,"Binance Bypassed US-Led Sanctions on Iran for Years, Report Claims","Binance, the largest crypto exchange by volume, reportedly allowed users in Iran to trade in contravention of U.S. sanctions, a Reuters investigation alleges. The post Binance Bypassed US-Led Sanctions on Iran for Years, Report Claims appeared first on BeInCrypto. (Read More...)",50.0,50.0,0.2978295087814331,50.0,68.75,0.01792311668395996,2022-07-12
74,Cointelegraph,Voyager can't guarantee all customers will receive their crypto under proposed recovery plan,"The crypto lending firm said that the exact amount reimbursed to users will “depend on what happens in the restructuring process and the recovery of 3AC assets."" (Read More...)",40.615,50.0,0.04689991474151611,50.0,59.166666666666664,0.01176297664642334,2022-07-12
75,Cryptonews,Crypto Listing and Delisting Announcements: Week 28,"Here is our weekly collection of digital asset listing and delisting, trading pair-related announcements by crypto exchanges that we found last week and today. Have we missed something? Do you have information about new listings and/or delistings? Let us know here. _______________________________... (Read More...)",50.0,50.0,0.006139278411865234,58.4,57.95454545454546,0.1015394926071167,2022-07-12
76,The Block,Celsius transfers $124 million in wrapped bitcoin from Aave,Celsius continues to repay and reclaim large amounts of collateral from its DeFi positions. (Read More...),50.0,50.0,0.022929906845092773,50.0,67.85714285714286,10.758867859840393,2022-07-12
77,CryptoSlate,FSB to submit crypto and stablecoin regulation recommendations in October,"The Financial Stability Board (FSB), an international body that monitors and proposes rules for the global financial system, will release recommendations to regulate stablecoins and cryptocurrencies in October, according to a statement on July 11. (Read More...)",50.0,50.0,5.28947114944458,50.0,55.00000000000001,0.9937018156051636,2022-07-12
78,U.Today,“Doom Loop”: Arthur Hayes Reiterates $1 Million Bitcoin Price Prediction,Arthur Hayes has doubles down on his $1 million Bitcoin price call (Read More...),50.0,50.0,0.39097070693969727,50.0,58.611111111111114,0.02752840518951416,2022-07-12
79,AMBCrypto,Axie Infinity: This is how AXS is recovering after $600m exploit,Play-to-earn (P2E) game Axie Infinity is seeing a turnaround in fortunes after its latest performance in the NFT market. The project has been attracting new customers with many developments on the platform. Axie Infinity grabbed the spotlight three months during the famous $600 million Ronin hack... (Read More...),44.865,50.0,1.7434895038604736,73.83500000000001,64.46969696969697,98.67976903915405,2022-07-12
80,The Block,Compass Mining recovers machines from hosting provider following court order,Compass mining regained access to its miners hosted with Dynamics Corp in Maine via a court order. (Read More...),50.0,50.0,9.700194001197815,63.660000000000004,75.0,4.569107294082642,2022-07-12
81,Bitcoinist,"Polkadot And Revolut Launch “Crypto Learn”, Users Can Earn Up To $15 Per Lesson","Financial service platform Revolut launched a crypto educational tool on Polkadot (DOT) and the nascent industry. Aimed at making the jargon and the complexities of the digital asset class easy to understand, Crypto Learn will be comprised of two courses, according to an official post. Related Re... (Read More...)",50.0,50.0,7.844796776771545,85.48,59.86111111111111,95.99814414978027,2022-07-12
82,CoinTelegraph,Comic-Con guru explains why storytelling is the key component for successful NFT projects,Kumite NFT founder Gareb Shamus chats with NFT Steez about how NFT projects can engage with their respective communities through storytelling. (Read More...),79.295,68.75,99.98783767223358,81.845,62.5,95.97514867782593,2022-07-12
83,Cryptonews,"Three Arrows Founders in Hiding, Voyager's Unknowns, Vauld's 'Breathing Space' + More News","Get your daily, bite-sized digest of cryptoasset and blockchain-related news – investigating the stories flying under the radar of today’s crypto news._______... Read More: Three Arrows Founders in Hiding, Voyager's Unknowns, Vauld's 'Breathing Space' + More News (Read More...)",35.199999999999996,75.0,92.25659668445587,35.199999999999996,68.75,24.461308121681213,2022-07-12
84,Bitcoin.com,How a Presale Ethereum Wallet Containing 1000 ETH Was Recovered by KeychainX,An Ethereum enthusiast contacted KeychainX a few months ago with a unique story. He was a part of the Ethereum pre-sale in 2014 and amassed a fantastic 1000ETH today worth about 4 million USD for a mere 300USD – an astonishing 13000x increase in value. The story began when Alex sent the KeychainX... (Read More...),50.0,50.0,0.17686784267425537,94.67,59.82142857142857,99.95840191841125,2022-07-12
85,Bitcoinist,"How Crypto Exchanges Are Handling The Bear Market, Bitrue CMO","As the crypto bear market rages on, investors have had to deal with multiple exchanges and platforms limiting/blocking withdrawals due to “extreme market conditions.” This is why we have reached out to Adam O’Neill, CMO at Bitrue. In this interview, O’Neill gives us a rundown of what has led to t... (Read More...)",50.0,50.0,0.5016505718231201,29.905000000000005,53.125,1.007235050201416,2022-07-12
86,crypto.news,Yam Finance DeFi Platform Successfully Foils Potential $3.1 Million Heist,Yam Finance DeFi protocol has successfully prevented a malicious governance attack that would have allowed a hacker to steal the entire funds in its treasury. Decentralized finance protocols are now major targets for bad actors. Yam Finance Thwarts Attack Yam… (Read More...),74.695,68.75,85.23469865322113,7.5950000000000015,56.125,99.19177889823914,2022-07-12
87,Cointelegraph,"Despite 'worst bear market ever,' Bitcoin has become more resilient, Glassnode analyst says","Though on-chain metrics point to the worst Bitcoin bear market on record, they also highlight hodlers' growing resilience. (Read More...)",75.48,37.5,0.5010783672332764,37.5,37.5,99.22244250774384,2022-07-12
88,Crypto Daily,Dusk Network’s Daylight Testnet brings upgraded staking contract,"The second iteration of Dusk Network’s testnet has been launched. Daylight implements an upgraded staking contract which will improve blockchain stability, and will allow many more nodes to participate without any adverse effects. Since the first Daybreak testnet released in March this year, the ... (Read More...)",50.0,50.0,99.7582733631134,87.57,67.5,99.28840696811676,2022-07-12
89,The Daily Hodl,Cardano Sharks Accumulate Nearly 80 Million ADA in Just 30 Days While Whales Stay Flat: Analytics Firm Santiment,"Blockchain analytics firm Santiment says Cardano sharks have entered into an accumulation phase after a lengthy period of selling activity. According to the firm, sharks, or entities holding between 10,000 and 100,000 ADA, have added over 79 million Cardano worth over $35.5 million to their stack... (Read More...)",50.0,47.91666666666667,5.438423156738281,61.315,55.00000000000001,0.4160374402999878,2022-07-12
90,Feed - Cryptopotato.Com,Twitter Shares Now 36% Cheaper Compared to Elon Musk’s Buyout Offer,Twitter already plans to take Musk to court after he backed out on his offer to purchase the company on Friday. (Read More...),64.8,50.0,0.12000501155853271,51.29,75.0,0.015205144882202148,2022-07-12
91,The Block,Greenidge Generation mined rougly 18% more bitcoin in June,Greenidge Generation mined 230 BTC in June and ended the month with a hash rate of 2.5 exahash per second. (Read More...),50.0,75.0,0.015610456466674805,50.0,62.5,0.0006854534149169922,2022-07-12
92,Blockworks,What Could Crypto M&A Look Like in This Year’s Second Half?,Industry watchers expect well-funded companies in the sector to seek out opportunities during the downturn The post What Could Crypto M&amp;A Look Like in This Year’s Second Half? appeared first on Blockworks. (Read More...),68.06,45.83333333333333,0.05355179309844971,81.245,57.291666666666664,0.11284351348876953,2022-07-12
93,Cointelegraph,Bitcoin risks new lows as $20K looms amid dollar euro parity,"Support is thin on the ground, analysts and traders warn, as ex-BitMEX CEO Arthur Hayes heralds the start of the fiat currency ""doom loop"" with USD/EUR parity. (Read More...)",22.884999999999998,56.81818181818181,0.0053822994232177734,44.865,52.5,0.020936131477355957,2022-07-12
94,Finbold,Swiss post office to offer crypto trading and custody services by 2024,"The Swiss post office through its banking arm, PostFinance has announced plans to extend its cryptocurrency entry by rolling out... Continue reading (Read More...)",50.0,50.0,99.42837953567505,58.894999999999996,75.0,78.95774841308594,2022-07-12
95,Bitcoin.com,Rebase Token Economy Dropped From $8 Billion to $577 Million in 7 Months,"Seven months ago, the top rebase crypto tokens by market capitalization were collectively worth $8.03 billion and since then, the entire rebase token economy has lost more than 92%, dropping to $577 million. Olympus has dropped 99% since the asset’s all-time high (ATH), klima dao shed 99.9%, and ... (Read More...)",50.0,50.0,0.026747584342956543,55.135,66.33333333333333,0.0121384859085083,2022-07-12
96,CoinTelegraph,G20 regulator to present global crypto rules in October 2022,The FSB seems more concerned with the crypto market given its recent turmoil and the “increasing interconnectedness with the traditional financial system.” (Read More...),50.0,50.0,97.88838922977448,31.94,60.0,4.613015055656433,2022-07-12
97,BeInCrypto,ING Innovations Lab Spins out Pyctor Crypto Trading Platform,"Digital asset post-trade solution Pyctor has been spun out by ING’s innovations lab and acquired by GMEX, a provider of institutional trading technology. The post ING Innovations Lab Spins out Pyctor Crypto Trading Platform appeared first on BeInCrypto. (Read More...)",50.0,50.0,1.3704776763916016,79.295,62.5,10.125952959060669,2022-07-12
98,CoinGape,ETH Price Analysis: Bearish Reversal Propels Ethereum Near $1000 Mark,"On July 8th, a long wick rejection candle at $1250 resistance indicated the sellers continue to defend the level with vigor. The resulting reversal may trigger a new bear cycle within the range-bound rally, suggesting the Ethereum(ETH) price may retest the $1000 support Key points: The ETH chart ... (Read More...)",50.0,55.00000000000001,3.798004984855652,53.86,57.32954545454545,0.016188621520996094,2022-07-12
99,Crypto Briefing,Binance Serviced Iranian Crypto Traders Despite Sanctions: Report,"In indirectly responding to the allegations on Twitter, Binance CEO Changpeng Zhao highlighted that the exchange has been using Reuters own KYC verification product, WorldCheck, since 2018. Binance Reportedly Operated... (Read More...)",50.0,50.0,16.675040125846863,50.0,77.5,0.12796521186828613,2022-07-12
100,Cointelegraph,"3 reasons why Solana can repeat Ethereum's 2018 fractal to 5,000% gains","Solana's price can mimic Ethereum's impressive recovery after the 2018 bear market, analysts argue. (Read More...)",67.0,50.0,98.00864458084106,61.315,87.5,76.57757699489594,2022-07-12
101,Coinnounce,Kenya Leads Africa in Crypto Adoption As Per UN Study,"In comparison to other African nations, Kenya has the highest adoption rate of digital currencies. As per the United Nations, Kenya has the biggest percentage of its population owning cryptocurrencies in Africa, indicating the nation’s vulnerability to the developing collapse of the digital curre... (Read More...)",50.0,50.0,77.87834405899048,34.089999999999996,53.75,94.1759705543518,2022-07-12
102,Bitcoinist,G20 Treasury Officials To Present 1st Global Crypto Regulations In October,"The G20 has thus far restricted itself to merely keeping an eye on the cryptocurrency market, noting that it has found no compelling reason to strictly clamp down on the industry because it poses no “systemic risk.” The Financial Stability Board, which is made of treasury officials and central ba... (Read More...)",60.114999999999995,50.0,99.63341951370239,24.47,48.53174603174603,0.04362165927886963,2022-07-12
103,U.Today,"BTC, SOL, and AVAX Price Analysis for July 11",Which coins can stay strong against market fall? (Read More...),50.0,50.0,3.637269139289856,75.53,73.33333333333334,12.271484732627869,2022-07-12
104,ZyCrypto,Grayscale Looks To Score Major Win Against SEC Over Its Spot Bitcoin ETF — How It Could Play Out In Court,Grayscale’s application for a Bitcoin ETF was scuttled by the Securities and Exchanges Commission (SEC) but the company will not be backing down without a fight. (Read More...),86.75500000000001,62.708333333333336,6.217244267463684,75.24,54.074074074074076,4.608681797981262,2022-07-12
105,The Block,"Vauld issues letter to its creditors, disclosing $70 million shortfall",Vauld has disclosed a shortfall of $70 million in a letter to creditors. (Read More...),50.0,50.0,0.45166611671447754,50.0,75.0,1.263687014579773,2022-07-12
106,Bitcoinist,Revolut Teams Up With Polkadot to Teach Crypto 101,"Revolut has entered the crypto educational sector with a new initiative designed to foster “financial literacy.” The program, which will teach crypto newcomers the basics of digital assets, starts with a primer on all things Polkadot – and there’s $15 of DOT up for grabs. Crypto saving app and de... (Read More...)",50.0,50.0,99.53200817108154,58.894999999999996,58.86363636363636,88.65889608860016,2022-07-12
107,Crypto Daily,"ECB new report states crypto could reach a systemic threshold, threatening financial stability","The European Central Bank (ECB) has published a report stating that the crypto economy is growing fast, and could get to the point where crypto-assets pose a risk to financial stability. In a report entitled “A deep dive into crypto financial risks: stablecoins, DeFi and climate transition risk”,... (Read More...)",24.47,53.40909090909091,0.28970539569854736,44.865,55.00000000000001,80.85840344429016,2022-07-12
108,Crypto Daily,BTC/USD Extends Downturn After Stops Elected Below 21005: Sally Ho's Technical Analysis 12 July 2022 BTC,"Bitcoin (BTC/USD) extended its recent pullback early in the Asian session as the pair failed to sustain recent gains and tested the 20546.77 level, representing the 50% retracement of the recent appreciating range from 18603 to 22490.54. Stops were elected below the 21005.50 area during the move ... (Read More...)",48.71,50.0,1.5014052391052246,55.135,50.71428571428571,0.025224685668945312,2022-07-12
109,U.Today,Cardano Network Stands Near 60% Under Utilization – Data Finds,IOHK has increased block-size limit twice this year to allow for more transactions per block (Read More...),50.0,55.00000000000001,0.33885836601257324,47.89,75.0,77.00945436954498,2022-07-12
110,Finbold,"Online broker TradeStation lists six new coins including SHIB, MATIC, LINK","With the cryptocurrency sector exponentially growing and its major assets becoming more popular around the world, crypto brokers are recognizing... Continue reading (Read More...)",50.0,56.81818181818181,3.3654332160949707,83.485,71.125,97.68474102020264,2022-07-12
111,U.Today,ProShares's Bitcoin ETF Surpasses Grayscale's GBTC in Trading Volume. What About Its Inverse One?,Grayscale has sued SEC after regulator did not approve its bid to launch first Bitcoin ETF (Read More...),50.0,50.0,93.37734580039978,50.0,60.83333333333334,0.14275014400482178,2022-07-12
112,Blockworks,"Funding Roundup: Despite Bear Market, Money Is Still Pouring Into Crypto","Can fresh funds keep crypto companies afloat? The post Funding Roundup: Despite Bear Market, Money Is Still Pouring Into Crypto appeared first on Blockworks. (Read More...)",50.0,50.0,0.004827976226806641,65.91,63.125,0.21698176860809326,2022-07-12
113,CoinTelegraph,Major South Korean telecom company plans launch of blockchain wallet for crypto and NFTs,"In 2020, the company also launched a wallet for blockchain-powered digital certificate storage aimed at addressing certifications amid the COVID-19 pandemic. (Read More...)",50.0,53.125,94.93798017501831,56.400000000000006,62.5,88.95466327667236,2022-07-12
114,Protos.com,"Coinbase fixes snafu, US users able to withdraw again",Coinbase took just an hour and a half to fix its latest withdrawal problem that left US users unable to cash out to their bank accounts. (Read More...),22.884999999999998,75.0,0.04649460315704346,30.910000000000004,53.333333333333336,0.13175904750823975,2022-07-12
115,Finbold,Playboy to build a ‘MetaMansion’ in the metaverse,Playboy’s iconic party mansion will soon have a home in the digital realm as the internationally renowned lifestyle brand is... Continue reading (Read More...),50.0,50.0,3.9052635431289673,70.095,62.5,96.94774448871613,2022-07-12
116,Bitcoin.com,"Biggest Movers: XTZ Nears 3-Week High, UNI Remains Close to 2-Month High","XTZ was a notable mover in the crypto top 100 on Monday, as prices rose towards a three-week high to start the week. Prices collided with a key resistance level during the move, and this came as UNI continued to trade above a ceiling of its own. Tezos (XTZ) XTZ was a notable mover to […] (Read More...)",50.0,57.99999999999999,0.11935830116271973,60.114999999999995,68.66666666666667,0.2737998962402344,2022-07-12
117,AMBCrypto,How Polygon is taking advantage of this latest exodus from Terra,"Around 50 distinct cryptocurrency projects that were based on the defunct Terra Network have now switched to Polygon. In a 9 July tweet, Ryan Wyatt, CEO of Polygon Studios, expressed his happiness at his network’s ability to integrate so many projects into the ecosystem. He also made a suggestion... (Read More...)",62.5,75.0,8.177480101585388,85.48,75.0,92.32834577560425,2022-07-12
118,BeInCrypto,Axie Infinity (AXS) Breaks Down From Short-Term Pattern,Axie Infinity (AXS) has been moving upwards since June 18 but has yet to break out from a descending resistance line. The post Axie Infinity (AXS) Breaks Down From Short-Term Pattern appeared first on BeInCrypto. (Read More...),50.0,42.22222222222222,0.0044345855712890625,50.0,59.90740740740741,0.009098649024963379,2022-07-12
119,Bitcoin Magazine,A New Physically Backed Bitcoin ETN Just Launched In Germany,EQONEX Limited launched a physically backed bitcoin ETN for German investors which will allow free bitcoin redemption and low management fees. (Read More...),57.655,53.40909090909091,2.7009516954421997,71.075,56.904761904761905,2.148112654685974,2022-07-12
120,U.Today,Ripple Partners Up with Major Web3 Company to Bring XRPL NFTs to CrossTower's Marketplace,XRPL NFTs will be available on CrossTower's marketplace thanks to partnership with Ripple (Read More...),50.0,53.125,99.72383677959442,72.02,68.33333333333333,99.24546182155609,2022-07-12
121,CryptoPotato,Su Zhu and Kyle Davis From Three Arrows Capital Do Not Cooperate: Court Filing,Su Zhu and Kyle Davies are rumored to have fled Singapore and their whereabouts are unknown. (Read More...),50.0,50.0,0.0456392765045166,50.0,60.0,1.0536640882492065,2022-07-12
122,CryptoPotato,Two Probable Scenarios for XRP as Price Approaches $0.3 (Ripple Price Analysis),"Through the recent market rally, buyers have managed to reclaim the 50-day moving average for the second time. Moreover, the price formed a higher low above $0.28, but it could not even touch the last high at $0.39. It seems that the bears are fighting back. Technical Analysis By Grizzly The Dail... (Read More...)",50.0,50.0,0.9987354278564453,20.705000000000002,53.45454545454545,4.151511192321777,2022-07-12
123,U.Today,Cardano: Veteran Trader Peter Brandt Points Out a Familiar Trend Pattern on ADA Charts,Cryptocurrency market remains under selling pressure (Read More...),50.0,59.375,99.74648356437683,35.199999999999996,75.0,0.37463605403900146,2022-07-12
124,CryptoPotato,"Bearish Signs for BTC Reapper, Will $20K Hold or More Pain Ahead? (Bitcoin Price Analysis)","Bitcoin’s price has been consolidating above the 2017 all-time high range of $17K-$20K over the past few weeks, after a sharp decline from the $30K level in June. The price has now rebounded twice from the mentioned support, but it has yet to reclaim the $24K resistance level, which would be the ... (Read More...)",22.185,75.0,11.930075287818909,60.72,50.708333333333336,0.027307868003845215,2022-07-12
125,CoinTelegraph,KPMG to audit new pound-backed stablecoin GBPT,"In terms of daily turnover, the British pound (GBP) is the fourth most traded fiat currency in the world, according to the Bank for International Settlements. (Read More...)",50.0,56.81818181818181,2.383124828338623,50.0,58.333333333333336,22.204256057739258,2022-07-12
126,crypto.news,Regulators at the G20 Call for New Cryptocurrency Global Rules,The Financial Stability Board monitors and makes recommendations about the global financial system. The body was established by the G20 at its April 2009 Summit in London. Recent Calls and Assignments The board has now called for a set of… (Read More...),50.0,53.40909090909091,6.833332777023315,50.0,55.00000000000001,98.9166408777237,2022-07-12
