,source,title,excerpt,vader_sentiment_title,tb_sentiment_title,flair_sentiment_title,vader_sentiment_excerpt,tb_sentiment_excerpt,flair_sentiment_excerpt,date
128,Bitcoin Magazine,"Silvergate Bank Saw Over $14 Billion in Bitcoin, Crypto Deposited In Q1 2022",Silvergate saw customers deposit an average of $14.7 billion worth of bitcoin and cryptocurrency to the firm’s platform during the first quarter of this year. (Read More...),50.0,50.0,0.1600503921508789,61.315,56.99999999999999,0.33417344093322754,2022-04-20
129,Finbold,"Apple user loses $650,000 in seconds as iCloud hack exposes MetaMask vulnerability","As the market for cryptocurrencies and non-fungible tokens (NFTs) grows larger, it becomes an increasingly attractive target to hackers who... Continue reading (Read More...)",21.405,35.0,0.011941790580749512,72.02,71.66666666666667,97.32170403003693,2022-04-20
130,CryptoBriefing,STEPN Soars Another 26% On ASICS Sneaker Drop,(Read More...),36.34,50.0,99.87251460552216,50.0,75.0,96.50535881519318,2022-04-20
131,U.Today,"BTC, ADA, and BNB Price Analysis for April 19",Can altcoins rise faster than Bitcoin (BTC) at the moment? (Read More...),50.0,50.0,5.918264389038086,50.0,75.0,14.054661989212036,2022-04-20
132,U.Today,"1.2 Billion SHIB Burned in Last 7 Days, Terra Spikes 9%, Crypto Will Surge Should Fed Raise Inflation Target: Crypto News Digest by U.Today",Keep an eye on the crypto industry’s happenings with U.Today’s news digest! (Read More...),50.0,50.0,0.0030040740966796875,50.0,75.0,9.810850024223328,2022-04-20
133,CryptoPotato,"Ethereum Price Analysis: ETH Reclaims $3000, But Here is The Next Crucial Resistance Level","Ethereum started the week on the green side. After the bears pushed the price down to $2880 yesterday, the bulls entered the market and were able to close the daily candle in green, with a nice wick to the downside (bullish structure). It remains to be seen whether the bulls can take control of t... (Read More...)",50.0,50.0,9.713298082351685,60.114999999999995,57.460317460317455,17.63337254524231,2022-04-20
134,CoinDesk,Sara Baumann: NFTs Let Me Quit My Job,The founder of the badass Women With Weapons franchise on how she made it and what comes next. Baumann is a speaker at CoinDesk's Consensus Festival. (Read More...),50.0,50.0,0.14441609382629395,46.14,62.5,95.87501585483551,2022-04-20
135,CoinDesk,"Framework Ventures Launches $400M Fund to Back Web 3 Gaming, DeFi",The crypto investment firm now has $1.4 billion in assets under management. (Read More...),50.0,50.0,1.3047099113464355,58.894999999999996,57.49999999999999,99.64269697666168,2022-04-20
136,CoinGape,Terra Price Prediction: Terra Price Rallying North To Regain $100 Mark,"The Terra(LUNA) price has made a significant comeback from the widespread correction phase of the crypto market. This retracement plunged the altcoin price to the 0.382 Fibonacci retracement level on April 18th. However, the coin price witnessed a 20% intraday pump this Monday, responding to Terr... (Read More...)",50.0,50.0,5.004227161407471,60.114999999999995,71.875,0.00903308391571045,2022-04-20
137,Decrypt,Coinbase Chief Legal Officer: SEC Exchange Definition ‘Just Doesn’t Work’,Coinbase said in its comment letter that the SEC “contains no such discussion” of how its new exchange rule will impact DeFi. (Read More...),56.400000000000006,52.5,0.007796287536621094,35.199999999999996,56.70454545454545,0.9383141994476318,2022-04-20
138,The Block,Liquid staking protocol Lido allocates $6 million to Ethereum development,The $6 million grant will go towards the long-term maintenance of the Ethereum codebase via the Protocol Guild funding mechanism. (Read More...),50.0,50.0,13.446450233459473,68.06,75.0,96.56156003475189,2022-04-20
139,Bitcoin.com,"Biggest Movers: RUNE Rises by Over 20% Today, as NEAR Climbs to Resistance","NEAR rose to its highest level since last Thursday, as prices rebounded from recent lows. SAND and RUNE also climbed from long-term support levels on Tuesday, with RUNE rising by over 20% in today’s session. THORChain (RUNE) RUNE was easily one of the biggest gainers during today’s trading sessio... (Read More...)",50.0,55.00000000000001,99.96051788330078,75.53,63.61111111111111,99.80812072753906,2022-04-20
140,Blockworks,Australia Gets Go-Ahead to List Country’s First Bitcoin ETF Next Week,"Trading could begin on CBOE Australia as early as April 27, following a seven-day notice period The post Australia Gets Go-Ahead to List Country’s First Bitcoin ETF Next Week appeared first on Blockworks. (Read More...)",50.0,56.25,99.84345734119415,50.0,59.166666666666664,2.7252912521362305,2022-04-20
141,U.Today,Cardano (ADA) Vasil Hardfork Details Shared by Developer,Cardano (ADA) enthusiast explained basics of Vasil hardfork for Plutus-centric developers and DeFi ecosystem of Cardano (ADA) (Read More...),67.0,50.0,85.85287034511566,68.06,75.0,97.41237461566925,2022-04-20
142,Cryptomode,Solana based NFT game Plutonians to launch two Metaverse and Ecosystem tokens on April 19,"Sydney, Australia, 19th April, 2022, Plutonians, an RPG game built on the Solana blockchain, is preparing for the launch of its first-ever two new tokens, PLD (Plutonian DAO) and RPC (Republic Credits). The NFT enabled, and SLP (Smooth Love Potion) powered web2-web3 hybrid Metaverse game intends ... (Read More...)",50.0,30.0,23.755797743797302,81.845,56.13636363636364,92.15452969074249,2022-04-20
143,CoinDesk,BlockApps Raises $41M to Bring More Real Assets to Its Blockchain,"The enterprise blockchain firm has partnered in the past with Amazon, Bayer Crop Science and Blockchain for Energy, an association of large energy companies. (Read More...)",62.245,67.5,9.508484601974487,79.97000000000001,53.30357142857143,98.99472892284393,2022-04-20
144,The Block,Framework Ventures unveils $400 million fund with a special focus on blockchain gaming,"Framework Ventures, a crypto-focused venture capital firm, said Tuesday that it has raised $400 million for a new fund. (Read More...)",70.095,67.85714285714286,92.29192435741425,50.0,57.27272727272727,0.7248818874359131,2022-04-20
145,U.Today,U.Today Website is Now Listed on CryptoLinks Aggregator,"U.Today is now listed on one of the biggest crypto-related website aggregators, CryptoLinks (Read More...)",50.0,50.0,16.94728136062622,50.0,75.0,95.93960046768188,2022-04-20
146,NullTX,Top 3 Metaverse Crypto Coins With a Market Cap Below $120 Million (April 2022),"Cryptocurrency markets are showing slight bullish momentum today as Bitcoin and Ethereum manage to hold support. Metaverse Crypto coins also see significant price gains, with many rising over 10%. Today, we look at our pick of the top three Metaverse crypto coins with a market cap below $120 mill... (Read More...)",60.114999999999995,75.0,98.83492290973663,88.58500000000001,67.08333333333334,23.705938458442688,2022-04-20
147,Cointelegraph,Robinhood acquires British crypto firm Ziglu to push expansion plans,Robinhood has renewed its global expansion plans by acquiring the British crypto firm Ziglu after aborting its U.K. expansion back in 2020. (Read More...),50.0,45.0,82.4030339717865,50.0,53.0,89.21502232551575,2022-04-20
148,CoinDesk,Pantera Joins $3.7M Round for Solana Lending Protocol Hedge,Race Capital led the round for the interest-free lending protocol ahead of its public launch. (Read More...),50.0,40.0,89.85546231269836,50.0,55.00000000000001,98.03909063339233,2022-04-20
149,Decrypt,Solana DeFi Platform Hedge Raises $3.7 Million to Offer Interest-Free Loans,DeFi platform Hedge has attracted investors who see a bright future for the Solana blockchain. (Read More...),50.0,50.0,0.6511837244033813,84.53999999999999,70.0,91.86048805713654,2022-04-20
150,crypto.news,Binance’s BNB Chain Burns Over $741 Million Worth of Binance Coin (BNB),"BNB Chain is set to burn 1,839,786.26 BNB tokens worth $741,840,738. The network is awaiting the execution of the transaction which will permanently remove the coins from circulation at the time of filing this report. 1.8 Million BNB Removed from… (Read More...)",61.315,65.0,1.3807207345962524,61.315,70.0,0.00020265579223632812,2022-04-20
151,U.Today,RippleNet’s 2C2P Teams Up with Alipay Parent Company to Improve Digital Payments in Asia,RippleNet member has partnered with Ant Group to bring innovation to digital payments in Southeast Asia (Read More...),72.02,50.0,99.63149428367615,69.08999999999999,62.5,99.40605759620667,2022-04-20
152,BeInCrypto,European Crypto Firms Urge EU to Reconsider New Regulations,The European Union has been asked by crypto businesses to reconsider plans to require firms to disclose transaction details. The post European Crypto Firms Urge EU to Reconsider New Regulations appeared first on BeInCrypto. (Read More...),50.0,53.40909090909091,0.9486615657806396,50.0,58.86363636363636,0.5380570888519287,2022-04-20
153,Ethereum World News,Metaverse Startup The Sandbox Wants To Raise $400 Million At a $4 Billion Valuation,Metaverse project The Sandbox is looking to raise $400 million from new and existing investors to expand its open metaverse project. (Read More...),50.0,60.0,79.37696278095245,65.91,60.60606060606061,75.73127150535583,2022-04-20
154,Decrypt,Jack Dorsey: Ethereum Has “Many Single Points of Failure”,"Block CEO Jack Dorsey has laid into Ethereum before, but this is the first time he's shared his criticisms of the number two crypto network. (Read More...)",50.0,51.86507936507937,0.11131465435028076,53.22,68.75,1.210319995880127,2022-04-20
155,NewsBTC,Now Or Never: Bitcoin Builds Base At Decade-Long Parabolic Curve,"The masses are bearish on Bitcoin. The market is convinced that prices below $30,000 will be revisited given the continued weakness in the top cryptocurrency by market cap. All eyes are on the massive “bear flag,” but could it instead be a bear trap? Bitcoin price continues to grind along a decad... (Read More...)",50.0,9.999999999999998,95.82147002220154,30.910000000000004,66.66666666666666,0.002866983413696289,2022-04-20
156,U.Today,U.S. Secret Service Confiscates $102 Million Worth of Crypto,U.S. Secret Service has seized more than $100 million worth of criminally tainted cryptocurrencies since 2015 (Read More...),61.315,47.5,3.3323466777801514,61.315,55.00000000000001,1.0468482971191406,2022-04-20
157,CoinGape,Just-In: CoinShares Leads Crypto Industry Protest Against EU Policies,"Over 40 crypto related businesses, led by asset manager CoinShares, have come forward with demands for friendlier crypto laws in the European Union. In a letter to the EU Parliament, industry members have asked the bloc not to mandate disclosures over all crypto transactions, and ease regulatory ... (Read More...)",37.5,50.0,3.457459807395935,89.53,58.333333333333336,84.3318909406662,2022-04-20
158,Finbold,Spain: Real estate investing soars 400% in 2022 fueled by crypto and stocks payments,Data from the Spanish real estate market shows that interest in the sector has increased 400% since November as it... Continue reading (Read More...),50.0,60.0,93.019500374794,81.245,61.66666666666667,84.69758629798889,2022-04-20
159,The Daily Hodl,XRP Gaining Ground to the Bullish Side As Ethereum (ETH) and Solana (SOL) Print Reasonable Lows: Crypto Analyst,"Popular crypto analyst and trader Jason Pizzino thinks XRP is displaying one promising trend for long-term holders. In a new video, Pizzino tells his 263,000 YouTube subscribers that XRP has been hitting higher lows for nearly a year despite the bad news the crypto asset has faced. The U.S. Secur... (Read More...)",62.5,60.0,0.3687351942062378,92.11,57.75974025974027,0.3208070993423462,2022-04-20
160,Crypto Daily,Digital fashion in the metaverse: NFT's and beyond,"With Gen Z and millennials embracing the metaverse, it stands to reason that the next big boom in the metaverse is fashion. Digital fashion has grown as an industry within the metaverse over the past year, with several big fashion houses including Louis Vuitton and Ralph Lauren. Virtual worlds we... (Read More...)",50.0,50.0,99.84020590782166,50.0,51.78571428571429,99.56375360488892,2022-04-20
161,Crypto Daily,"Upgrade Your Crypto Game With Parody Coin (PARO), Avalanche (AVAX) and UniSwap (UNI)","It has been a wonderful and promising twelve months for the world of crypto, with many remarkable innovations and revolutionary coins, platforms and utilities. There is certainly a coin for every type of investor as there are a total of 17,000 cryptocurrencies. Have you found yours? How Innovatio... (Read More...)",50.0,30.0,0.6948351860046387,95.405,72.60204081632654,99.87144768238068,2022-04-20
162,Bitcoin.com,"Bitcoin, Ethereum Technical Analysis: BTC Back Above $41,000 as Crypto Bulls Return","Following recent losses, BTC rallied on Tuesday, as bulls appeared to have returned to cryptocurrency markets. In addition to bitcoin, ETH also moved away from yesterday’s low below $2,900, with price now hovering close to $3,100. Bitcoin After several days of bearish pressure, cryptocurrency pri... (Read More...)",50.0,50.0,0.2646207809448242,14.079999999999998,55.00000000000001,0.2987593412399292,2022-04-20
163,CryptoPotato,CurrencyCom Attacked Hours After Announcing Pullout From Russia,"Before CurrencyCom announced to exit from the Russian market, it had approximately 500,000 customers based in the country. (Read More...)",27.060000000000002,50.0,0.01100003719329834,50.0,51.66666666666666,75.10828673839569,2022-04-20
164,CoinDesk,Hut 8 in Deal to Become 100% Self-Mining Company,The digital asset miner will buy out all hosted rigs at its Medicine Hat mining facility in Alberta. (Read More...),50.0,50.0,1.6781240701675415,68.06,62.5,4.655182361602783,2022-04-20
165,CryptoPotato,Shiba Inu Price Analysis: SHIB Fails to Breakoutout of Consolidation Range,"Despite the listing on Robinhood, SHIB has lost most of its recent gains. Key Support level: $0.000023 Key Resistance level: $0.000028 The rally last week, which was following the news, could not hold SHIB’s price above the key resistance at $0.000028. Since then, SHIB has dropped back toward the... (Read More...)",28.925,25.0,0.04227757453918457,71.075,55.00000000000001,0.0018477439880371094,2022-04-20
166,Bitcoinist,Game of Silks Raises $2 Million To Bring Thoroughbred Racehorses Onto The Blockchain,"Game of Silks, the first-ever play-to-earn (P2E) metaverse featuring derivative NFTs (non-fungible tokens), has announced the successful completion of its fundraising campaign. According to the official statement, the team behind this highly anticipated blockchain game has raised $2 million, whic... (Read More...)",50.0,30.0,97.78246283531189,79.295,51.74999999999999,95.70563733577728,2022-04-20
167,Crypto Briefing,"People Are Rushing to Pay $50,000 for Digital Owls",(Read More...),44.865,50.0,0.015991926193237305,50.0,75.0,96.50535881519318,2022-04-20
168,Bitcoinist,"Crypto May Be Used To Fund Terror, Indian Finance Minister Says","Nirmala Sitharaman, India’s finance minister, presented a compelling argument Tuesday for the global regulation of crypto in order to limit the risk of money laundering and terrorist financing. Her remarks came as she addressed a seminar at the International Monetary Fund’s ongoing spring meeting... (Read More...)",23.665000000000003,50.0,0.14194846153259277,9.370000000000001,60.0,93.65208446979523,2022-04-20
169,Bitcoinist,Russian Finance Ministry Clarifies Rumors Of Crypto Legalization,"Russian Ministry of Finance now “advises” using cryptocurrencies as legal tender? That sounds like an old story. Crypto journalists have reported that the Russian Ministry of Finance pushes for tokens to be treated as legal tender. However, there’s no evidence whatsoever to back up these claims. ... (Read More...)",61.315,50.0,1.1045455932617188,65.91,57.14285714285714,0.007730722427368164,2022-04-20
170,CoinDesk,Solana DeFi Protocol Delta One Raises $9.1M to Offer Crypto Options Trading,"Options trading has long been popular in traditional finance, but the crypto-backed version has only recently started moving beyond institutions to retail investors. (Read More...)",50.0,50.0,0.5482405424118042,61.315,58.75,14.785274863243103,2022-04-20
171,BeInCrypto,Terra (LUNA) Bounces After 37% Drop From All-Time High: Multi-Coin Analysis,"Be[in]Crypto takes a look at the price movement of seven different cryptocurrencies, including LUNA, which increased by 20% since April 18. The post Terra (LUNA) Bounces After 37% Drop From All-Time High: Multi-Coin Analysis appeared first on BeInCrypto. (Read More...)",36.34,57.99999999999999,90.60255885124207,50.0,61.375,11.469528079032898,2022-04-20
172,The Block,Robinhood to acquire crypto wallet and card startup Ziglu,"Crypto wallet and card startup Ziglu is set to be acquired by brokerage app company Robinhood, according to a Tuesday statement from the companies. (Read More...)",50.0,50.0,84.47420299053192,50.0,75.0,0.11026263236999512,2022-04-20
173,U.Today,First Australian Bitcoin ETF to Launch Next and Expectedly Bring $1 Billion to Industry,Australia is getting ready for the listing of its first Bitcoin ETF (Read More...),50.0,51.87500000000001,99.69277679920197,68.06,65.83333333333333,96.71745002269745,2022-04-20
174,Forbes,Could Lugano’s ‘Plan B’ Bring Bitcoin To The Masses?,The Swiss city's ambitious plan to become the European capital of bitcoin looks credible. (Read More...),50.0,50.0,1.4012038707733154,73.83500000000001,64.375,99.38145875930786,2022-04-20
175,Cointelegraph,"Bitcoin climbs above $41K on Wall Street open as gold dives, dollar cements highs",Bitcoin carves out its own trajectory as Wall Street trading gets underway in the first session after Easter. (Read More...),50.0,50.0,2.293798327445984,50.0,72.5,0.9396463632583618,2022-04-20
176,Cointelegraph,Basic and weird: What the Metaverse is like right now,(Read More...),60.114999999999995,46.42857142857143,1.0138362646102905,50.0,75.0,96.50535881519318,2022-04-20
177,Cointelegraph,"'There are already digital means of payment:' EU Commission gets 11,000 public comments on CBDC project","Less than two weeks after the consultation process' start, the prevalent mood in the comments section appears quite negative. (Read More...)",50.0,50.0,1.5184581279754639,19.424999999999997,50.55555555555556,0.0071108341217041016,2022-04-20
178,NullTX,"Top 3 Metaverse Crypto Coins Gaining The Most Price Today (UOS, MLT, MOOV)","Metaverse Crypto coins show significant price gains today as Bitcoin and Ethereum register single-digit percent growth. Several Metaverse crypto coins are showing double-digit percent growth, signaling the sector’s tremendous potential. Today we look at the top three Metaverse crypto coins gainin... (Read More...)",77.86999999999999,75.0,99.98827278614044,92.405,64.23611111111111,99.6215432882309,2022-04-20
179,Finbold,U.S. Air Force files trademarks to a secure digital metaverse for training and operational environments,"As the list of organizations, corporations, and personalities joining the metaverse keeps on growing, the air service branch of the... Continue reading (Read More...)",67.0,60.0,99.94317293167114,58.894999999999996,75.0,90.15392661094666,2022-04-20
180,Trustnodes,Jack Dorsey Disses ETH,"The founder of Twitter, Jack Dorsey, has dismissed eth in a reply to ethereum’s co-founder Vitalik Buterin. The two started off in agreement with Buterin cautioning against “wealthy people/orgs hostile-takeovering... (Read More...)",50.0,50.0,90.87584614753723,74.695,75.0,0.08765459060668945,2022-04-20
181,Decrypt,Okcoin Is the Latest Exchange to Announce NFT Marketplace,"Today, the new marketplace opens its waitlist and says it will come with zero fees for NFTs on Ethereum, Polygon, and other blockchains. (Read More...)",50.0,75.0,97.5422590970993,50.0,58.52272727272727,9.204140305519104,2022-04-20
182,Bitcoin.com,FBI Issues Alert Concerning Malicious State-Sponsored North Korean Hackers Targeting Crypto Firms,"On April 18, the Federal Bureau of Investigation (FBI), the U.S. Treasury Department, and the Cybersecurity and Infrastructure Security Agency (CISA) published a Cybersecurity Advisory (CSA) report concerning malicious North Korean state-sponsored cryptocurrency activity. According to the U.S. go... (Read More...)",64.8,50.0,0.9119212627410889,74.695,75.0,0.1158595085144043,2022-04-20
183,The Block,"Silvergate says its crypto customer base grew to more than 1,500 in 2022’s first quarter","The crypto-focused customer base of Silvergate Bank grew to more than 1,500, according to the first-quarter results published Tuesday. (Read More...)",50.0,49.166666666666664,78.58068943023682,50.0,53.333333333333336,2.511844038963318,2022-04-20
184,CoinDesk,IMF Says Capital Control Powers Should Include Crypto,The financial stability watchdog is the latest to worry digital assets are being used to evade sanctions on Russia. (Read More...),50.0,50.0,0.1120448112487793,35.199999999999996,62.5,0.23620128631591797,2022-04-20
185,Crypto Daily,FIREPIN (FRPN): A New Path to Become a Millionaire. Can It Surpass AXIE (AXS) Infinity and ApeCoin (APE)?,"Cryptocurrencies are all the rage lately, and there is a multitude of them to choose from. So, which one should you invest in? Well, it depends on what you're looking for. If you're interested in a cryptocurrency that is focused on gaming, then FIREPIN (FRPN) may be a good choice for you. Created... (Read More...)",50.0,56.81818181818181,99.80727434158325,84.53999999999999,64.375,96.85001075267792,2022-04-20
186,CoinDesk,Robinhood Agrees to Acquire UK Crypto Platform Ziglu,Online brokerage platform Robinhood has acquired London-based crypto platform Ziglu giving it a Financial Conduct Authority-regulated arm in the U.K. (Read More...),60.114999999999995,50.0,5.455741286277771,67.0,62.5,23.424452543258667,2022-04-20
187,CoinGape,"Breaking: After Listing Shiba Inu, Robinhood To Buy UK Crypto Firm Ziglu",Trading app Robinhood said on Tuesday it will acquire UK-based crypto exchange Ziglu. The move comes as the equity trading app looks to expand further in offering cryptocurrency trade. The acquisition also marks Robinhood’s second attempt to expand into the UK since a failed plan to launch a stoc... (Read More...),50.0,40.0,0.05195140838623047,53.86,50.0,3.2316088676452637,2022-04-20
188,CoinGape,Sandbox Price Prediction: SAND Price Aims $3.6 Mark with Double Bottom Breakout,"The recent correction sentiment in the crypto market discounted the Sandbox(SAND) price by 28% and plunged to last quarter’s bottom support at $2.65. However, today the coin price witnessed a significant inflow responding to the recent report that the platform seeks to raise about $400 million, w... (Read More...)",50.0,50.0,0.019362568855285645,78.595,58.75,0.46805739402770996,2022-04-20
189,CoinDesk,The End of NFT Rug Pulls?,"The ERC-721R standard guarantees refunds for non-fungible tokens, offering greater security for buyers and legitimacy for creators. But risks remain for both sides. (Read More...)",50.0,50.0,8.555826544761658,47.42,66.66666666666666,1.1066257953643799,2022-04-20
190,CryptoPotato,Sabai Ecoverse Introduces Non-Fungible Token (NFT) Collection,"[PRESS RELEASE – Please Read Disclaimer] We are pleased to introduce our first collection of NFTs, consisting of 1,850 NFTs. Each NFT has a unique utility, and gives holders a share of SABAI tokens. Sabai NFT owners will get to experience real-world utility associated with our base real estate co... (Read More...)",50.0,50.0,97.28772640228271,87.53,58.54166666666667,99.87658858299255,2022-04-20
191,BeInCrypto,WonderFi Now Houses the Largest Community of Web3 Users in Canada; Will Acquire Coinberry for $38.6 Million,"On Friday, DeFi platform WonderFi announced it's in the process of acquiring Coinberry, Canada’s first pure-play licensed crypto broker. With this accretive acquisition, WonderFi will now host the largest community of Web3 users in Canada. The post WonderFi Now Houses the Largest Community of Web... (Read More...)",50.0,50.0,99.64480698108673,50.0,68.75,99.79906678199768,2022-04-20
192,CryptoPotato,"Binance Burns Another $740M Worth of BNB, CZ Says It Proves Deflationary Mechanism","Binance's 19th quarterly burn saw 1,830,382 BNB tokens worth more than $740 million removed from circulation. (Read More...)",61.315,65.0,0.19542276859283447,61.315,71.66666666666667,0.005805492401123047,2022-04-20
193,U.Today,Scam Alert: PeckShield Discloses Honeypot Scam with Thousands of Victims,"ZTZDao's core asset ZTZ is most likely a honeypot scam, as unveiled by PeckShield experts (Read More...)",9.120000000000001,50.0,0.24697482585906982,32.325,66.66666666666666,0.13183653354644775,2022-04-20
194,CoinDesk,First Mover Americas: Bitcoin Struggles as Dollar Breaks Multi-Year Bearish Trendline,"The latest moves in crypto markets in context for April 19, 2022. (Read More...)",31.94,62.5,0.1791238784790039,50.0,75.0,94.24498677253723,2022-04-20
195,Crypto Briefing,The Sandbox Reportedly Plans $400M Raise at $4B Valuation,(Read More...),50.0,50.0,23.397323489189148,50.0,75.0,96.50535881519318,2022-04-20
196,CoinTelegraph,"Four years on, Telegram’s blockchain project gains ground in Africa","After raising $250 million from a host of mainstream entities such as Huobi, Kucoin and MEXC, TON’s recent global adoption seems to be rapidly increasing. (Read More...)",67.0,50.0,99.85663294792175,50.0,56.25,99.90598857402802,2022-04-20
197,CoinDesk,"Nearly Half of Jurisdictions Still Not Applying Crypto Laundering Norms, Global Regulator Says","The Financial Action Task Force has vowed to toughen its monitoring, though some fear customer identification rules could harm online privacy. (Read More...)",50.0,45.83333333333333,0.8073568344116211,11.75,60.0,7.326799631118774,2022-04-20
