,source,title,excerpt,vader_sentiment_title,tb_sentiment_title,flair_sentiment_title,vader_sentiment_excerpt,tb_sentiment_excerpt,flair_sentiment_excerpt,date
250,Crypto Daily,Crypto’s worst week since March 2020 Covid crash - Retail spooked and UST loses peg,"A truly torrid week is being experienced by the crypto market as a whole. Bitcoin has fallen 25% so far, and lost 13% amidst frantic selling yesterday. The crypto market had nearly $200 billion erased from its total market cap yesterday, taking it down to $1.45 trillion. The UST stablecoin lost i... (Read More...)",7.790000000000003,17.5,0.0012040138244628906,11.659999999999998,61.03174603174604,0.0011146068572998047,2022-05-11
251,The Block,Queen’s Speech: UK government to introduce bill to tackle illicit finance,"Prince Charles made the comments in the state opening of Parliament, which the Queen missed for health reasons. (Read More...)",50.0,50.0,92.13054180145264,35.199999999999996,75.0,1.4969080686569214,2022-05-11
252,Finbold,"3,000 Bitcoin ATMs were installed globally in 2022 more than 20 a day","As cryptocurrency use becomes more mainstream, the sector is putting in place infrastructure to facilitate the transition, such as Bitcoin... Continue reading (Read More...)",50.0,62.5,99.8376339673996,50.0,66.66666666666666,96.2009459733963,2022-05-11
253,U.Today,DOGE 87% Down From ATH Pumped by Elon Musk on SNL One Year Ago,Leading meme coin has lost 87% of its gains obtained a year ago thanks to Elon Musk's debut on SNL (Read More...),50.0,42.22222222222222,0.01780986785888672,72.94,67.5,0.0016033649444580078,2022-05-11
254,The Block,"Citigroup, Wells Fargo join $105 million round for crypto infrastructure firm Talos","Crypto firm Talos has raised $105 million in a Series B round from Citi, Wells Fargo and others as it plans global expansion. (Read More...)",74.695,40.0,22.340580821037292,62.5,51.24999999999999,97.88852632045746,2022-05-11
255,Bitcoin.com,Report: Nigerian Crypto Restrictions and Twitter Ban Have ‘Crippled Foreign Direct Investment in the Fintech Industry’,"A new report has concluded that restrictions on cryptocurrency trading, as well as the banning of Twitter by Nigerian authorities, may have “crippled foreign direct investment in the fintech industry.” Foreign Direct Investment ‘Crippled’ A new report has found that restrictions imposed by Nigeri... (Read More...)",22.13,49.375,0.01754164695739746,60.114999999999995,55.162337662337656,0.012215971946716309,2022-05-11
256,Bitcoinist,Metaverse Land Value Is Dropping – Should You Buy Now?,"The prices of real estate in the metaverse has dropped to 15%. So, is this the best time to go for a buying spree? Metaverse is the buzzword of the future. As more people are clamoring for that immersive experience, they aim to build more into the virtual domain. Apart from Otherside, the most po... (Read More...)",67.0,50.0,0.7200241088867188,81.845,72.85714285714286,90.98775386810303,2022-05-11
257,BeInCrypto,"El Salvador Buys the Dip, Adding 500 BTC to State Coffers","El Salvador capitalized on bitcoin's (BTC) dump below $31,000 yesterday by adding another 500 coins to its holdings. The post El Salvador Buys the Dip, Adding 500 BTC to State Coffers appeared first on BeInCrypto. (Read More...)",50.0,50.0,91.13703668117523,30.910000000000004,68.75,1.0994940996170044,2022-05-11
258,CoinGape,"Bitcoin (BTC) To Stay Supported Above $30K For Now, Here’s Why","Bitcoin (BTC) appears to have stabilized around 2022 lows after sharply consolidating over the past week. The token is now trading just above the $30,000 level. A bulk of BTC’s decline was driven by concerns over rising inflation and interest rate hikes by the Federal Reserve- two factors that ar... (Read More...)",65.91,50.0,1.7092972993850708,64.8,51.5625,0.01430213451385498,2022-05-11
259,Crypto Briefing,Binance Halts Terra Withdrawals Amid UST Meltdown,Terras woes escalated early Tuesday as UST plummeted as low as $0.62 on Binance. Binance Responds to UST Crash Binance users holding Terra are facing a problem. The worlds top... (Read More...),50.0,50.0,1.8596440553665161,7.224999999999998,63.74999999999999,0.5825400352478027,2022-05-11
260,U.Today,Justin Sun's Tron DAO Purchased 600 Million TRX and 500 BTC,Tron DAO is on its way to forming reserves for a newly released stablecoin (Read More...),50.0,50.0,79.02394235134125,50.0,65.9090909090909,18.269920349121094,2022-05-11
261,CoinGape,This South Korean Metaverse Giant Plans To Expand Into Europe,"South Korea’s SK Telecom said it plans to expand its rapidly-growing Ifland metaverse into Europe through a German partnership. During a first-quarter call, South Korea’s largest telecom operator said it will introduce an open platform and crypto-economic system for Ifland. Moreover, the company ... (Read More...)",65.91,50.0,95.7226425409317,65.91,58.333333333333336,0.49077272415161133,2022-05-11
262,Decrypt,Binance Halts LUNA Withdrawals as Terra Token Plummets 50%,"As Terra's LUNA token faces extreme sell pressure, Binance has temporarily halted withdrawals for the token as well as the stablecoin UST. (Read More...)",50.0,50.0,0.13206899166107178,48.71,59.375,0.0924140214920044,2022-05-11
263,Forbes,KuCoin Raises $150 Million At $10 Billion Valuation To Grow Presence In Web3,"Crypto exchange KuCoin announced on Tuesday that it had raised $150 million in a funding round led by Jump Crypto, the investment arm of U.S. proprietary trading firm Jump Trading. (Read More...)",50.0,50.0,99.36886727809906,50.0,51.66666666666666,0.2084285020828247,2022-05-11
264,Cointelegraph,"Analyst claims that exchanges sell your Bitcoin, crypto trading platforms respond",A crypto analyst claimed that staking Bitcoin within exchanges allows them to sell it to someone else; Cointelegraph reached out to the platforms for more info. (Read More...),50.0,50.0,0.4161417484283447,55.135,75.0,0.3353238105773926,2022-05-11
265,Forbes,African Crypto Startup Raises $30 Million To Build A Web3 WeChat For The Continent,Jambo’s Series A funding round was led by crypto-focused venture capital giant Paradigm. (Read More...),50.0,50.0,85.24461090564728,50.0,55.00000000000001,11.222997307777405,2022-05-11
266,CryptoPotato,Luna’s BTC Reserves Gone as Exchanges Halt UST Withdrawals Amid Turbulent 24 Hours,Luna's BTC reserves are depleted as exchanges halt UST withdrawals amid turbulent 24 hours. (Read More...),50.0,50.0,98.50503504276276,50.0,75.0,0.7602214813232422,2022-05-11
267,Forkast.News,Run on UST cuts the ground from under Terra’s feet,A probable run on terraUSD (UST) has weighed on the ability of the company and the non-profit behind the pioneering stablecoin project to defend its dollar peg. (Read More...),35.199999999999996,50.0,84.17995870113373,65.91,52.5,1.0321617126464844,2022-05-11
268,Crypto Daily,Market Crumbles As LFG Moves To Defend UST Peg,"Luna Foundation Guard has announced that it would take decisive steps to proactively defend the larger Terra economy and the UST Dollar peg. The move comes after its algorithmic stablecoin, TerraUSD, fell below its $1 peg. The foundation announced several measures, such as loaning $750 million wo... (Read More...)",50.0,50.0,0.029528141021728516,61.315,56.25,0.018399953842163086,2022-05-11
269,U.Today,Binance Temporarily Suspends LUNA Withdrawals,LUNA and UST withdrawals were suspended at 2:20 a.m. UTC on May 10 (Read More...),50.0,50.0,0.7434576749801636,26.165,75.0,0.17202794551849365,2022-05-11
270,CoinTelegraph,Binance suspends LUNA and UST withdrawals citing network congestion,"The market value of UST, Terra’s stablecoin offering, recently fell below the expected $1 price point as LUNA’s price witnessed a sharp decline owing to a significant selloff. (Read More...)",50.0,50.0,0.1530766487121582,74.695,56.49999999999999,0.19724369049072266,2022-05-11
271,Decrypt,Crypto Industry Facing Same 'Lull' as Early Internet: Mark Cuban,Mark Cuban reckons that crypto is currently experiencing the same downturn that internet companies faced in the early 2000s. (Read More...),50.0,52.5,0.14372766017913818,50.0,57.49999999999999,0.011739134788513184,2022-05-11
272,BeInCrypto,"Central Bank of Nigeria to Upgrade eNaira for More Uses, Including Bill Payments","The Central Bank of Nigeria will launch an upgrade for its eNaira that will allow the digital currency to be used on a wider range of goods and services, including bill payments. The post Central Bank of Nigeria to Upgrade eNaira for More Uses, Including Bill Payments appeared first on BeInCrypto. (Read More...)",50.0,62.5,24.267607927322388,61.315,60.416666666666664,2.7117788791656494,2022-05-11
273,Finbold,"SHIB adds over 15,000 holders in a month despite wiping $4 billion from its market cap","Despite the entire cryptocurrency market getting caught in the bearish streak this week, with all the major assets trading in... Continue reading (Read More...)",50.0,50.0,97.77648746967316,58.894999999999996,59.375,4.624062776565552,2022-05-11
274,Forkast,CoinDCX investment arm to invest US$13 mln in Web3 startups,"CoinDCX Ventures has pledged Rs 100 crore (US$13 million) to early stage cryptocurrency, blockchain and Web 3.0 startups over the next 12 months, cofounder Sumit Gupta announced on Tuesday. See related article: India’s crypto shakedown be damned, CoinDCX raises $135 million Fast facts Crypto exch... (Read More...)",50.0,50.0,85.81226468086243,20.705000000000002,57.99999999999999,5.414384603500366,2022-05-11
275,Ethereum World News,Luna Foundation Guard Drains Bitcoin Treasury To Save UST Peg,"The Luna Foundation Guard used $1.5 billion from its treasury to help project the $1 peg of UST. $750 million worth of bitcoin has been budgeted for OTC trading firms. Binance has suspended withdrawals of LUNA and UST until trading volume reduces. The Luna Foundation Guard, which acts as the trea... (Read More...)",80.62,50.0,0.03777742385864258,65.91,70.0,0.0636667013168335,2022-05-11
276,The Daily Hodl,Veteran Trader Tone Vays Says Bitcoin Capitulation Incoming – Here’s His Timeline,"Seasoned trader Tone Vays says he’s expecting Bitcoin (BTC) traders and investors alike to succumb to panic and sell their BTC stacks in the coming days. In a new strategy session, Vays tells his 121,000 YouTube subscribers that both the monthly and weekly charts look nasty as Bitcoin struggles t... (Read More...)",50.0,50.0,0.11573433876037598,7.224999999999998,48.57954545454545,0.11076629161834717,2022-05-11
277,Finbold,LUNA dives 50% in a day wiping 10 billion from its market cap; What’s next?,"Terra (LUNA) had been doing well in the previous three months, with its price continuing to grow as the DeFi... Continue reading (Read More...)",50.0,50.0,0.05957484245300293,63.660000000000004,58.333333333333336,83.3361268043518,2022-05-11
278,CoinGape,Azuki NFT Prices Plummet After Founder Raises Rug-Pull Alarm,"Azuki, one of the most popular NFT collections, saw its prices tumble after its founder revealed a past affiliation with abandoned NFT projects. The NFT collection prices saw a huge drop of around 50% . The NFT’s floor price sank 21% to touch 11 Ethereum (approx $26,200)- its lowest level since l... (Read More...)",32.99999999999999,50.0,0.03299415111541748,34.015,67.5,0.0020444393157958984,2022-05-11
279,BeInCrypto,"Bitcoin (BTC) Briefly Trades Below $30,000 Sinking to New Yearly Low","Bitcoin (BTC) bounced after reaching a low of $29,730 on May 10, validating the $30,500 horizontal area as support. The post Bitcoin (BTC) Briefly Trades Below $30,000 Sinking to New Yearly Low appeared first on BeInCrypto. (Read More...)",36.34,52.27272727272727,0.004136562347412109,70.095,57.38636363636363,0.0003337860107421875,2022-05-11
280,CryptoPotato,"BTC Dipped Below $30K for the First Time Since July 2021, LUNA Plummets 45% (Market Watch)",Terra continues to freefall as LUNA plummeted by more than 40% in the past 24 hours alone. Bitcoin dipped below $30K for the first time in almost a year. (Read More...),50.0,62.5,0.00508427619934082,37.5,62.5,0.024765729904174805,2022-05-11
281,NewsBTC,Dragon War is Bringing the Most Exclusive NFT Collections to Magic Eden,"NFT strategy game Dragon War has confirmed a partnership with Magic Eden, Solana’s fast-growing NFT marketplace. As part of the deal, the play-to-earn project will make Magic Eden its preferred INO launchpad, with 5,000 non-fungible tokens (NFTs) set to go live on the site on May 16, 2022. For th... (Read More...)",26.105,75.0,99.98614490032196,20.029999999999998,63.63636363636363,99.7494250535965,2022-05-11
282,U.Today,Investors Grab 372.4 Billion SHIB As It Flips FTT For Biggest Whale Holding in USD,"Two large Ethereum whales have acquired close to 400 billion SHIB, while number of SHIB holders has risen significantly in May (Read More...)",50.0,50.0,86.10691130161285,53.86,68.15476190476191,18.059435486793518,2022-05-11
283,CoinGape,"As Prices Plummet, Tron Buys 500 Bitcoin For Its Stablecoin Reserve","Tron founder Justin Sun said on Tuesday that the blockchain had capitalized on a recent drop in Bitcoin (BTC) prices and bought 500 tokens. The tokens were purchased for $15.5 million, representing an average price of $31,031. BTC is currently trading around $31,900- having slightly recovered fro... (Read More...)",50.0,50.0,5.5785685777664185,36.34,51.83333333333333,0.08930563926696777,2022-05-11
284,Bitcoinist,Dragon War is Bringing the Most Exclusive NFT Collections to Magic Eden,"NFT strategy game Dragon War has confirmed a partnership with Magic Eden, Solana’s fast-growing NFT marketplace. As part of the deal, the play-to-earn project will make Magic Eden its preferred INO launchpad, with 5,000 non-fungible tokens (NFTs) set to go live on the site on May 16, 2022. For th... (Read More...)",26.105,75.0,99.98614490032196,20.029999999999998,63.63636363636363,99.7494250535965,2022-05-11
285,U.Today,Binance CEO Remains Bullish on Crypto After Massive Crash,Binance CEO Changpeng Zhao has urged traders and investors to control their emotions as extreme fear grips the market (Read More...),29.905000000000005,50.0,0.029742717742919922,25.305,59.375,2.091449499130249,2022-05-11
286,Bitcoin.com,Qualcomm CEO States Metaverse Will Be a ‘Very Big’ Opportunity,"Qualcomm, one of the largest fabless mobile chip makers, is very optimistic about the future of the metaverse and what it might bring for companies and consumers in the area. Qualcomm CEO Cristiano Amon believes that, while there is much to do in the development space, this development is real an... (Read More...)",71.075,50.0,12.101566791534424,69.02000000000001,61.0,99.87071752548218,2022-05-11
287,Cryptomode,Why Ethereum Users Tolerate Exorbitant Gas Fees,"The high gas price of Ethereum has consistently been a controversial affair, not only for ETH users but for the entire community of cryptocurrency. Critics often address this issue and consider it one of the most fatal flaws of Ethereum. Creating wide opportunities for “ETH killers” to dethrone i... (Read More...)",50.0,50.0,1.0013461112976074,25.395,61.625,0.9372591972351074,2022-05-11
288,U.Today,Traders Moved Record-Breaking $5.6 Billion Worth of BTC On Exchanges Amid Market Turmoil,Record-breaking $5.6 billion in Bitcoin flowed on centralized exchanges as traders were leaving the market in panic (Read More...),42.345,65.0,91.03273153305054,24.47,75.0,0.5326956510543823,2022-05-11
289,Cryptomode,"3 Cryptocurrencies competing for Bitcoin’s position in 2022: Apecoin (APE), Tezos (XTZ), and FIREPIN Token (FRPN)","NFTs are digital or virtual assets that are represented by tokens that run on smart contracts via the blockchain. They can be used to authenticate works of art, produce limited-edition collectibles, or depict gaming characters. As investors looked at capitalising on the crypto mania, digital art ... (Read More...)",50.0,50.0,1.580938696861267,76.335,58.92857142857143,16.090959310531616,2022-05-11
290,Cryptomode,Potential Moonshot Cryptocurrencies you do NOT want to miss out on – Parody Coin (PARO) and Cronos (CRO),Cryptocurrency ecosystems are on the rise and some of them will provide users with new possibilities while reducing the number of steps required to trade and interact with blockchains. Both the Parody Coin (PARO) and Cronos (CRO) are creating virtual ecosystems which will integrate an array of fu... (Read More...),52.86,50.0,5.372399091720581,68.06,65.9090909090909,98.78833591938019,2022-05-11
291,Bitcoinist,LUNA Sinks As Binance Suspends Withdrawals Of Tokens Amid Market Turmoil,"LUNA is bearing the brunt of a major turbulence taking shape in the broader crypto market. The de-pegging of the UST stablecoin from the U.S. dollar has caused chaos on Satoshi Street. Tuesday morning, the UST price fell to $0.60, a 40 percent depeg from the USD. This has led to large liquidation... (Read More...)",31.94,45.0,0.018233060836791992,21.405,62.94642857142857,0.0008702278137207031,2022-05-11
292,crypto.news,Anchain.AI Integrates its Next-Gen Web3 Blockchain Analytics Solution with Elrond ,"Elrond Network (EGLD) has announced its successful integration with Anchain.AI, to boost regulatory compliance and fraud prevention across the Web3 payments, decentralized finance (DeFi), and the metaverse economy. Anchain.AI Live on Elrond Elrond Network (EGLD), an internet-scale blockchain infr... (Read More...)",65.91,50.0,99.570232629776,70.095,73.10606060606061,98.44184815883636,2022-05-11
293,BeInCrypto,Fed: Sharp Interest Rate Spikes and Stablecoin Runs Pose Risk to US Economy,The United States Federal Reserve has warned that a spike in interest rates and stablecoins could pose risks to the U.S. economy. The post Fed: Sharp Interest Rate Spikes and Stablecoin Runs Pose Risk to US Economy appeared first on BeInCrypto. (Read More...),61.315,43.75,0.4856407642364502,77.115,60.416666666666664,0.218161940574646,2022-05-11
294,crypto.news,Otherdeed NFT From Yuga Labs Sells for a Record $1.5 Million,"A record 625 ETH ($1.5 million) was paid on the NFT marketplace X2Y2 on Sunday for Otherdeed #59906, the eight rarest virtual land piece from Yuga Labs’ Otherside metaverse project. An enthusiastic collector of NFTs, “n0b0dy.eth,” purchased the piece. Going… (Read More...)",50.0,50.0,2.271980047225952,74.695,77.5,99.811652302742,2022-05-11
295,CryptoPotato,Mark Cuban Sees Similarities in Current Crypto Market and DotCom Bubble,"The next ""driver"" for the cryptocurrency industry will be when businesses start employing smart contracts to gain a competitive advantage, Mark Cuban thinks. (Read More...)",50.0,50.0,94.18492913246155,91.58,61.904761904761905,11.909681558609009,2022-05-11
296,Quartz,The punitive crypto tax regime forming in India is already shrinking the industry,There is resentment in India's cryptocurrency community. (Read More...),24.47,50.0,0.01278221607208252,27.98,75.0,1.036602258682251,2022-05-11
297,CoinGape,"Bitcoin (BTC) Price Recovers To $32K As Whales, Institutions Buy The Dip","Bitcoin’s (BTC) price showed a mild recovery after crashing below $30,000 on Monday . Whales and institutional traders are seen accumulating BTC at lower prices. It has resulted in the BTC price recovering marginally to trade around $32,096. While some have sold their BTC under panic, many invest... (Read More...)",50.0,50.0,0.19123554229736328,16.475,72.22222222222221,0.195273756980896,2022-05-11
298,Cointelegraph,'Kwontitative easing' — BTC price hits $43K in UST as Terra empties $2.2B Bitcoin bag,"A frantic effort to rescue UST continues as Bitcoin weathers the storm to receive a $35,000 target next. (Read More...)",53.86,50.0,0.01678466796875,55.135,62.5,0.28017759323120117,2022-05-11
299,Coinnounce,Binance Halts LUNA and UST Withdrawals Amid Market Volatility,"Traders stated that the order book for LUNA and UST looked to be frozen on Tuesday AM Asia time, with no orders going through. Binance announced the temporary restrictions in a blog post, blaming network congestion for “a high volume of pending withdrawal transactions.” “Once we determine that th... (Read More...)",50.0,50.0,0.2993851900100708,17.570000000000004,66.5,0.0043392181396484375,2022-05-11
300,NewsBTC,The Nightly Mint: Daily NFT Recap,"In the midst of crypto chaos, the NFT market is essentially following suit. We’re here through rain, sleet and snow (and sunshine, of course) with our five-day-a-week report quickly covering some of the brief stories each day around all things NFTs. While the markets at large continue to get hamm... (Read More...)",50.0,50.0,97.78788983821869,43.6,60.476190476190474,99.71673488616943,2022-05-11
301,Bitcoinist,The Nightly Mint: Daily NFT Recap,"In the midst of crypto chaos, the NFT market is essentially following suit. We’re here through rain, sleet and snow (and sunshine, of course) with our five-day-a-week report quickly covering some of the brief stories each day around all things NFTs. While the markets at large continue to get hamm... (Read More...)",50.0,50.0,97.78788983821869,43.6,60.476190476190474,99.71673488616943,2022-05-11
302,Cointelegraph,Nouriel Roubini oversees the development of tokenized dollar replacement,Nouriel Roubini is helping develop a tokenized financial instrument aiming to act as an alternative to the U.S. dollar for major investors. (Read More...),50.0,50.0,99.30370450019836,64.8,59.375,96.29728496074677,2022-05-11
303,BeInCrypto,Coinbase Earnings Expectations Crushed on Crypto Crash as Stock Price Slumps,U.S. crypto exchange giant Coinbase is poised to release its Q1 earnings report but expectations have been battered along with company stock value on the crypto market slump. The post Coinbase Earnings Expectations Crushed on Crypto Crash as Stock Price Slumps appeared first on BeInCrypto. (Read More...),16.475,45.0,0.032654404640197754,21.765,58.12500000000001,0.07374584674835205,2022-05-11
304,The Daily Hodl,"Over $1,000,000,000 in Crypto Liquidated in Just 24 Hours As Bitcoin (BTC) Nosedives to 10-Month Low",Hundreds of thousands of crypto traders are getting their positions liquidated as Bitcoin (BTC) and the rest of the digital asset market witness a massive sell-off event. Data from cryptocurrency futures trading and information site Coinglass reveals that $1.01 billion worth of trader positions i... (Read More...),36.34,50.0,0.001329183578491211,76.335,60.0,0.3815561532974243,2022-05-11
305,Blockonomi,Instagram to Integrate NFTs From Top Blockchains,"Not Facebook, or the popular communication app WhatsApp, Instagram is the most anticipated Meta’s child company when it comes to non-fungible tokens (NFTs). Expectations can be a good place to start, and Meta has recently stepped up in this NFT game with the latest announcement. Instagram is work... (Read More...)",60.114999999999995,75.0,90.59728384017944,84.53999999999999,67.14285714285715,15.881386399269104,2022-05-11
306,crypto.news,HUMAN Protocol Foundation Grant Awarded to VeritaTrust to Develop On-Chain Rewards for Reviews,"HUMAN Protocol, a broadly applicable solution geared toward the management of distributed workforces today announced it had awarded a grant to VeritaTrust to power on-chain reviews. HUMAN Protocol Gives Grant to VeritaTrust In an announcement made today, HUMAN Protocol stated… (Read More...)",90.36999999999999,50.0,98.383429646492,92.00999999999999,55.625,24.37947988510132,2022-05-11
307,CryptoPotato,Almost 47% of Bitcoin’s Supply at a Loss as BTC Price Crashed Below $30K,Data shows that almost 47% of Bitcoin's supply is at a loss - a historically good time for accumulation. (Read More...),34.089999999999996,50.0,0.0768125057220459,57.655,80.0,0.5282282829284668,2022-05-11
308,Bitcoin.com,India Considers Imposing 28% GST on All Crypto Transactions: Report,The Indian government is reportedly considering imposing a 28% goods and services tax (GST) on all crypto transactions. “Currently tax is levied only on the part of the services provided by crypto exchanges. Subjecting the whole transaction to tax at a higher slab of 28% could give the markets a ... (Read More...),44.865,50.0,0.08759498596191406,44.865,59.5,0.006425380706787109,2022-05-11
309,AMBCrypto,Is it ‘AAVE’ test for investors as monthly new accounts shrink to toy dog size,"As the broader market crashed terribly on 9 May, it did not spare any cryptocurrency, including AAVE. Within 24 hours, over $186 billion was wiped out. At the time of writing, the market looked primed for a bear run and panic-selling appeared to be the prevailing mood of the investors. AAVE and i... (Read More...)",50.0,56.81818181818181,0.08472800254821777,22.13,37.5,0.006592273712158203,2022-05-11
310,BeInCrypto,ApeCoin (APE) Becomes Third Most-Purchased Crypto by Top-100 Ethereum Wallets,ApeCoin has surpassed Tether (USDT) and Loopring (LRC) as the third most purchased cryptocurrency after Ethereum (ETH) and USDC by the top-100 Ethereum wallet addresses. The post ApeCoin (APE) Becomes Third Most-Purchased Crypto by Top-100 Ethereum Wallets appeared first on BeInCrypto. (Read More...),50.0,50.0,80.27744591236115,50.0,62.5,23.64860773086548,2022-05-11
311,CoinGape,Bargain Hunting? Ethereum Whales Are Buying These Cryptos Amid A Crash,"With the crypto market plummeting to 2022 lows, major whales appear to be heavily buying stablecoins and a few select tokens. While this has done little to support prices, given that selling is largely outpacing buying, whale transactions could help indicate which tokens are set for a quicker rec... (Read More...)",38.685,50.0,4.326781630516052,75.705,51.577380952380956,0.1405268907546997,2022-05-11
