,source,title,excerpt,vader_sentiment_title,tb_sentiment_title,flair_sentiment_title,vader_sentiment_excerpt,tb_sentiment_excerpt,flair_sentiment_excerpt,date
127,Crypto Daily,Binance Obtains License to Operate as Virtual Asset Service Provider in Spain,Cryptocurrency exchange Binance has secured registration by the Bank of Spain to offer cryptocurrency trading and custody services via its Moon Tech subsidiary. The license allows Binance to operate complying with the country’s anti-money laundering (AML) and counter-terrorist financing (CTF) rul... (Read More...),68.06,50.0,96.92643582820892,70.095,75.0,92.11331307888031,2022-07-12
128,CoinGape,"Vauld Customers Demand Swapping Enabled, As Nexo Update Awaited","As anxious customers await an update on Vauld’s future course of action, there are rising demands for allowing minimal features. The users are asking for clarity what could be the fate of their funds. Many users are also starting to believe that their money, or a part of it, is lost already. Over... (Read More...)",42.345,50.0,90.57293236255646,47.42,55.35714285714286,0.000858306884765625,2022-07-12
129,Crypto Briefing,Cardano Sharks Circle Ahead of Potential Bullish Breakout,Cardano continues to consolidate within a tight price range that is getting narrower over time. The eighth-largest cryptocurrency now looks primed for a significant price movement after enduring a prolonged... (Read More...),50.0,50.0,99.74932074546814,60.114999999999995,61.60714285714286,99.19443726539612,2022-07-12
130,The Block,Klarna valuation cut to $6.7 billion in $800 million fundraise,It had previously been valued at more than $45 billion. (Read More...),36.34,50.0,0.3483593463897705,72.02,63.888888888888886,20.32794952392578,2022-07-12
131,CoinGape,Breaking: Celsius Withdraws All wBTC From Aave Amid CEL Short Squeeze,"Celsius has withdrawn all wBTC collateral from the Aave wallet and has only a few wBTC left in the Compound wallet. Moreover, the crypto lender has paid off another 40 million in USDC for its Aave loan, making a total of 60 million in USDC repayment today. In addition, the crypto lender has also ... (Read More...)",50.0,50.0,0.0205308198928833,50.0,53.0,0.046512484550476074,2022-07-12
132,U.Today,"Watch Bitcoin, Cardano and Ethereum Closely On This Week: Crypto Market Review, July 11",This week might finally bring some volatility back to cryptocurrency market as U.S. inflation data is coming (Read More...),50.0,50.0,96.27264142036438,50.0,58.333333333333336,96.04630470275879,2022-07-12
133,Finbold,Top 5 highest gaining new coins listed for trade in the last 24 hours,"Despite the ongoing cryptocurrency bear market, several projects are still emerging aiming to attract new investors. In this line, some... Continue reading (Read More...)",77.86999999999999,60.60606060606061,99.97844994068146,68.06,60.60606060606061,80.86386919021606,2022-07-12
134,CryptoPotato,Cradles: The First Subscription-Based Blockchain Game,"Blockchain technology is disrupting many industries, and the gaming sector is no exception. The tech is rapidly transforming how online games are played, introducing a new method of asset ownership and earning opportunities. While blockchain games have garnered interest recently, they still have ... (Read More...)",50.0,46.25,99.68000054359436,90.36999999999999,64.20454545454545,98.53406846523285,2022-07-12
135,CoinGape,Uniswap Price Analysis: Inverted H&S Pattern Breakout Prepares UNI Price to Hit $8,"Under the influence of the inverted head and shoulder pattern, the Uniswap(UNI) pattern pierced the monthly resistance of $6. Thus, the coin buyers acquire another foothold to climb higher in the price chart. Furthermore, the technical setup for this bullish reversal pattern should encourage buye... (Read More...)",50.0,50.0,0.06672143936157227,75.53,62.5,0.022044777870178223,2022-07-12
136,CoinGape,Breaking: Binance Evaded US Sanctions To Serve Iranian Crypto Traders,"Binance has been dealing with global regulators’ scrutiny lately. Meanwhile, the latest investigation has found out the world’s largest crypto exchange worked against the US imposed sanctions on Iran. Traders used Binance to evade sanctions As per a report by Reuters, Binance didn’t stop its trad... (Read More...)",50.0,50.0,0.5332857370376587,31.94,58.75,3.5554111003875732,2022-07-12
137,Protos.com,‘Grandparent’ scammers stole $2M from elderly and laundered with crypto,"In 2021, grandparent scams accounted for $6.5 million in losses with senior citizens tricked into believing a family member was in need. (Read More...)",50.0,50.0,0.09601116180419922,10.18,75.0,0.0046312808990478516,2022-07-12
138,The Daily Hodl,"US State Regulators Investigating Crypto Brokerage Voyager, Looking Into Potential Improper Disclosures: Report","Securities regulators from two US states are reportedly looking into embattled crypto brokerage firm Voyager Digital for possibly failing to disclose vital information regarding its loans and creditworthiness to its clients. According to a new report by Bloomberg, regulation agencies from the sta... (Read More...)",50.0,50.0,12.691572308540344,72.94,54.46969696969697,0.027045607566833496,2022-07-12
139,BeInCrypto,Ocean Protocol (OCEAN) Scrambles for Support After Price Breakdown,"Ocean Protocol (OCEAN) has created a triple bottom pattern close to its all-time lows. However, technical indicators do not yet confirm the potentially bullish pattern. The post Ocean Protocol (OCEAN) Scrambles for Support After Price Breakdown appeared first on BeInCrypto. (Read More...)",70.095,50.0,0.047579407691955566,72.02,59.375,0.031498074531555176,2022-07-12
140,NullTX,Top 5 Web3 Tokens Below $250 Million Market Capitalization to Watch in July 2022,"In the development of the internet, Web3 has the potential to be a game-changer. Web3 is fundamentally a plan for a more open, secure, and decentralized internet, made possible by technological developments like blockchain and machine learning. Particularly in the context of the entertainment sec... (Read More...)",60.114999999999995,75.0,0.22106468677520752,89.46499999999999,59.166666666666664,99.91880059242249,2022-07-12
141,Finbold,"Shiba Inu (SHIB) adds 20,000 holders in a month despite sluggish market",Despite the bearish sentiment surrounding the crypto market as a whole and the fact that Shiba Inu (SHIB) is now... Continue reading (Read More...),65.445,50.0,99.10993278026581,50.0,67.5,93.05987060070038,2022-07-12
142,Bitcoinist,Crypto Adoption Rate In Kenya Highest In Africa – Here’s Why,"The rate of digital currency adoption in Kenya is unlike any other country in Africa. The United Nations reports that Kenya has the highest proportion of its people holding cryptocurrencies in Africa, highlighting the country’s exposure to the unfolding digital currency market crash. According to... (Read More...)",50.0,50.0,23.05217683315277,51.29,54.6875,82.84042775630951,2022-07-12
143,U.Today,Dogecoin Developer Shows a “Real” DOGE Use Case; Here’s What Transpired,Dogecoin Foundation says that it seeks to maximize potential for Dogecoin (Read More...),50.0,60.0,89.27803933620453,50.0,62.5,6.732213497161865,2022-07-12
144,Crypto Daily,Hong Kong Introduces Draft Legislation to Treat Cryptocurrency Exchanges Like Traditional Finance,Hong Kong lawmakers have introduced new legislation tailored to regulate the cryptocurrency space and aim to implement a new licensing regime for crypto service providers. The proposed law governing cryptocurrencies will boost Kong Kong’s leap into the virtual asset market and will also bring the... (Read More...),81.845,50.0,24.753615260124207,81.845,62.878787878787875,98.61185252666473,2022-07-12
145,Crypto Daily,"How Degrain (DGRN) Presale Star Could 1,000x, Is Likely Overtake Flow and Vechain",Crypto's latest advertisement in the New York Subway station. This guide will educate you on the cryptocurrencies that offer a potential return of over 1000 times. Examine these digital assets to see how you may increase your ROI with one of these currencies. VeChain: will be overtaken by presale... (Read More...),50.0,50.0,0.003135204315185547,72.94,61.36363636363637,4.717037081718445,2022-07-12
146,Cryptomode,Crypto Casinos: Reasons to Try This Trend,"Several decades ago, humanity couldn’t even imagine that a monetary system that cannot be tracked by any country would appear. And all people who use it are interconnected with each other with the well-known blockchain technology. Developers have already understood that such an innovation is quit... (Read More...)",50.0,50.0,77.38260924816132,69.08999999999999,54.6875,0.22134184837341309,2022-07-12
147,Cryptonews,This Is Low Long Grayscale vs. SEC Battle Over Bitcoin ETF Might Last,"A major legal battle between digital asset giant Grayscale Investments and the US Securities and Exchange Commission (SEC) over the rejected application to convert the Grayscale Bitcoin Trust (GBTC), the world's largest BTC fund, to a spot exchange-trading fund (ETF) might last even two years or ... (Read More...)",21.405,48.125,0.005990266799926758,69.08999999999999,54.732142857142854,0.06842911243438721,2022-07-12
148,Crypto Daily,Revolut Unveils Financial Literacy Course for Crypto Savers,Crypto-powered financial app Revolut has announced an educational program that will award participants in return for completing quizzes. The scheme is designed to raise awareness and knowledge of cryptocurrencies and is targeted at users of Revolut’s popular crypto-saving app. The multi-part educ... (Read More...),50.0,50.0,89.28046226501465,87.14999999999999,66.875,83.20484459400177,2022-07-12
149,Use The Bitcoin,"Crypto Market Hasn’t Yet Bottomed, Here’s Why","The market crash can be attributed to various reasons, but one thing is certain: Bitcoin and the crypto space aren't looking so good right now. (Read More...)",50.0,50.0,0.5981266498565674,89.265,67.0,0.0867992639541626,2022-07-12
150,CoinGape,"Bitcoin Might Fall To $10,000, Wall Street Survey Predicts","According to Bloomberg MLIV Pulse survey, bitcoin is more likely to see $10,000 and see its value cut in half in the short term. (Read More...)",50.0,50.0,0.013121962547302246,53.86,58.333333333333336,0.0173032283782959,2022-07-12
151,U.Today,"Hyundai Dives Deeper Into Metaverse with NFTs, Virtual Clothing and More",Hyundai has dived deeper into the metaverse space with its latest patent filing (Read More...),50.0,75.0,86.63427531719208,50.0,75.0,24.124521017074585,2022-07-12
152,Decrypt,G20 Watchdog Says 'Robust' Crypto Rules Coming in October,"Following news of stiff crypto regulations coming this October, members of the community shared their thoughts with Decrypt. (Read More...)",50.0,50.0,98.39146435260773,67.0,54.761904761904766,23.359110951423645,2022-07-12
153,Finbold,South Korea’s tech giant SK Telecom to launch cryptocurrency wallet,Korea Mobile Telecommunications Services Corp also more commonly known as SK Telecom announced on July 11 that it had reached... Continue reading (Read More...),50.0,50.0,89.91929590702057,50.0,61.66666666666667,0.21412670612335205,2022-07-12
154,BeInCrypto,"CeFi Should Be Regulated Like Traditional Banks, Says DeFi Boss","Recent difficulties at Celsius, BlockFi, Babel, Vauld and Novi demonstrate the fundamental flaws of centralized finance (CeFi), and clearly demonstrate why centralized operators require far stronger regulatory oversight. The post CeFi Should Be Regulated Like Traditional Banks, Says DeFi Boss app... (Read More...)",68.06,50.0,0.3893643617630005,84.04,56.99999999999999,0.3080219030380249,2022-07-12
155,CryptoPotato,Terra Projects Flee to Polygon Following the UST-LUNA Collapse,"In mid-May, Polygon Studios' CEO revealed working closely with several Terra-based projects to help them migrate over to the layer 2 network. (Read More...)",25.305,50.0,0.02492070198059082,70.095,62.5,7.223096489906311,2022-07-12
156,CoinGape,IOTA Price Analysis: 20-EMA Fakeout May Trigger a Downfall to $0.25,"For nearly two months, the IOTA price has been wavering between $0.39 to $0.23. Furthermore, with the price action shaping into a cup and handle, the buyers are attempting to breach the $0.3 neckline. However, can they undermine the overhead selling pressure? Key points Long-wick rejection near $... (Read More...)",50.0,50.0,0.027957558631896973,9.120000000000001,57.99999999999999,0.0004947185516357422,2022-07-12
157,Crypto Daily,Terra Projects Abandon Ship For Polygon,"The Terra blockchain is experiencing a mass exodus post its collapse, as projects have been leaving the network for Polygon. NFTs Choose Polygon So far, 48 projects have migrated to the Ethereum Layer 2 protocol, Polygon, since the collapse of the Terra network. As confirmed by CEO Ryan Wyatt, th... (Read More...)",27.98,50.0,0.2874612808227539,12.469999999999997,66.66666666666666,1.0659188032150269,2022-07-12
158,Cointelegraph,US crypto regulation bill aims to bring greater clarity to DAOs,"The Responsible Financial Innovation Act proposes a comprehensive set of regulations for the digital assets sector, and one potentially impactful section is DAOs. (Read More...)",81.845,75.0,95.10251581668854,88.25,56.99999999999999,82.19168484210968,2022-07-12
159,CoinGape,"U.S. Inflation Data Will Make or Break Crypto Markets, Here’s Why",The U.S. Bureau of Labor Statistics will release the CPI data for the month of June on the 13th of July. The Consumer Price Index is a monthly data point that reveals the change in prices paid. It is considered an important indicator of inflation. Crypto market have responded poorly to CPI data t... (Read More...),50.0,50.0,0.2729445695877075,60.114999999999995,56.25,0.02319812774658203,2022-07-12
160,CryptoSlate,"3AC founders in hiding, offices abandoned as court filing cites fear that assets may be “disposed of”",A filing in the United States Bankruptcy Court of the Southern District of New York states that the liquidators of Three Arrows Capital have been unable to communicate with the founders “in any meaningful way.” The location of founders Zhu Su and Kyle Livingstone Davies is currently unknown as th... (Read More...),11.414999999999997,50.0,0.06307661533355713,81.245,54.46969696969697,0.042432546615600586,2022-07-12
161,U.Today,"Altcoins May Suffer 30% Drop, If Fail to Meet These Requirements: Rekt Capital",Altcoins' struggle to break key resistance levels may cause a massive drop (Read More...),7.790000000000003,25.0,0.16621947288513184,23.665000000000003,58.333333333333336,0.46709179878234863,2022-07-12
162,CoinTelegraph,"Tether fortifies its reserves: Will it silence critics, mollify investors?",USDT is under attack from short sellers. Would they go away if only the company hired a Big Four accounting firm to audit its balance sheet? (Read More...),35.199999999999996,50.0,94.3689376115799,26.165,53.0,0.005233287811279297,2022-07-12
163,CoinGape,Binance’s CZ Rubbishes Rumors Over Mt Gox Bitcoin Impact,"After Mt. Gox Trustee’s announcement last week that they would repay its creditors, there was speculation around Bitcoin crash. There was widespread fear in the crypto community that the returns would bring Bitcoin price down in a freefall. However, there is an opposing argument that long term Bi... (Read More...)",50.0,50.0,0.02677738666534424,9.370000000000001,53.68055555555556,0.127449631690979,2022-07-12
164,NewsBTC,"Crypto Community Remains Upbeat On XRP, Despite Bearish Market Conditions","The crypto community got a major surprise two years ago when a leading provider of crypto solutions for businesses was slapped with a lawsuit by the U.S. Securities and Exchange Commission. Ripple was taken to court by the SEC, which sparked what has become the most closely watched legal showdown... (Read More...)",50.0,50.0,99.29953217506409,79.725,61.625,98.17032217979431,2022-07-12
165,The Block,Vauld CFO leaves struggling Asian crypto lender: sources,"Vauld CFO Jatin Mazalcar left after the crypto lender abruptly halted withdrawals last week, sources tell The Block. (Read More...)",28.925,50.0,0.1681685447692871,27.98,54.6875,0.03396868705749512,2022-07-12
166,crypto.news,"Celsius (CEL) Dumps Legal Advisors, Hires Kirkland & Ellis LLP for Its Restructuring","Celsius (CEL) has dumped its legal advisors and has engaged the services of Kirkland &amp; Ellis LLP for its restructuring process, according to reports on July 10, 2022. The crypto lender has halted fund withdrawals since May and recently sacked… (Read More...)",35.199999999999996,60.0,0.015723705291748047,56.400000000000006,61.66666666666667,0.03699362277984619,2022-07-12
167,Cryptonews,"‘Robust’ Regulations Needed in Crypto & Stablecoin Sector, Says G20 Advisory Body Ahead of Its Report in October","One of the world’s leading financial policy-making organizations said that it will tell governments to step up their supervision of stablecoins later this year – against a “backdrop of the recent turmoil” in the crypto sector. In a press release from the Financial Stability Board (FSB), which adv... (Read More...)",50.0,50.0,99.78843927383423,50.0,55.00000000000001,4.715394973754883,2022-07-12
168,Protos.com,"Binance deliberately skirted US sanctions to serve Iran users, says Reuters",Reuters revealed Binance knew it was serving Iran-based users despite US sanctions prohibiting them from doing so. (Read More...),50.0,50.0,0.4295080900192261,50.0,75.0,0.10479092597961426,2022-07-12
169,Cointelegraph,"PoS gives Ethereum the economic structure to overtake Bitcoin, says DeFi researcher","Researcher Vivek Raman said that after the Merge, ETH inflation will be lower, security will be better and ETH will position itself as a digital bond. (Read More...)",50.0,60.0,23.63514006137848,73.83500000000001,66.66666666666666,96.48465514183044,2022-07-12
170,CoinGape,Sandbox Joins Hands With Korean Bank; Will This Pump SAND Price?,Metaverse has proved to be a very diverse opportunity for financial institutions to jump in. The Sandbox announced that KEB Hana Bank will be entering into the digital virtual world with them. Hana Bank to launch K-verse Hana Bank provides the largest range of foreign exchange products in South K... (Read More...),50.0,50.0,0.8702516555786133,73.64,55.75,98.7140953540802,2022-07-12
171,U.Today,Here's Most Profitable DEX Trader In Whole Industry (You Might Be Surprised),This address made $550 million by trading on decentralized exchanges (Read More...),74.635,63.33333333333333,99.96302425861359,50.0,75.0,14.68881070613861,2022-07-12
172,U.Today,Shiba Inu Average Balance Held by Large Holders Spikes 18% as New Milestones Are Set,Whales continue to accumulate Shiba Inu amid recent price drop (Read More...),50.0,53.344155844155836,98.92062246799469,36.34,62.5,8.027982711791992,2022-07-12
173,CoinGape,Football Club Paris Saint-Germain Sells NFTs Tickets,Football Club PSG is selling NFT tickets worth 30 million Yen for its first Japan tour in 27 years. (Read More...),50.0,50.0,88.55035901069641,61.315,67.5,97.51842021942139,2022-07-12
174,Bitcoin.com,"Bitcoin, Ethereum Technical Analysis: BTC Falls Below $22,000 to Start the Week","Bitcoin started the week in the red, as Monday saw prices fall for a second consecutive session. Following a recent run towards $22,000, the world’s largest crypto dropped below $21,000 earlier today, with ETH slipping below $1,200. Bitcoin Bitcoin dropped below $21,000 on Monday, as prices conti... (Read More...)",50.0,50.0,0.007307529449462891,50.0,52.85714285714286,0.006639957427978516,2022-07-12
175,BeInCrypto,OKX Extends Manchester City Partnership Deal Despite Market Slowdown,Crypto platform OKX has extended its partnership with Manchester City by becoming the club's new official training kit sponsor. (Read More...),56.400000000000006,50.0,98.37827384471893,50.0,68.10606060606061,99.07677173614502,2022-07-12
176,ZyCrypto,Shiba Inu Primed For Strong Recovery As Ecosystem Mulls Introducing Stablecoin Before Year-End,Shiba Inu may be gearing up for an earth-shattering comeback following a plan to launch a stablecoin for the ecosystem later this year. (Read More...),75.53,71.66666666666667,99.72091317176819,50.0,58.333333333333336,99.61411654949188,2022-07-12
177,Cointelegraph,"Binance ban off the cards, says Philippine trade and industry department","The Philippine Department of Trade and Industry waved off a Binance ban proposal, citing a lack of regulatory stance on cryptocurrencies from the central bank. (Read More...)",22.13,50.0,0.05994439125061035,14.52,62.5,0.01946389675140381,2022-07-12
178,Finbold,Chief strategist sees ‘no upside catalysts’ for crypto as BTC yet to sink into a recession,"As the cryptocurrency market continues to struggle with the bearish sentiment that has prevailed in recent weeks, some experts believe... Continue reading (Read More...)",28.925,50.0,1.5300452709197998,34.089999999999996,62.5,2.382659912109375,2022-07-12
179,CryptoPotato,The Crypto Market Crash Prompts the FSB to Propose Global Regulations (Report),The Financial Stability Board's proposal will aim to impose regulations on stablecoins and prevent cryptocurrencies from being used in illicit operations. (Read More...),29.905000000000005,50.0,3.896796703338623,36.34,62.5,1.8146872520446777,2022-07-12
180,The Block,"Binance continued Iranian operations despite sanctions, Reuters says",The report says the crypto exchange's employees knew and joked about the tranche of Iranian users. (Read More...),50.0,50.0,97.20840454101562,65.91,75.0,0.45554935932159424,2022-07-12
181,CryptoPotato,Cardano Price Analysis: What’s the Next Support for ADA if $0.45 Fails?,"ADA returned on the critical support at $0.45. Buyers have to show strength again or risk a costly defeat. Key Support levels: $0.45, $0.38 Key Resistance levels: $0.50, $0.55, $0.66 Every time the price tests a key level, the chance of it breaking increases. ADA’s price has now tested the key su... (Read More...)",48.71,37.5,0.5312025547027588,71.075,54.166666666666664,0.003987550735473633,2022-07-12
182,Cryptonews,"Bitcoin and Ethereum Look for Direction, XMR and CHZ Outperform","Bitcoin price settled below the USD 21,200 pivot level. BTC is currently (11:49 UTC) consolidating near the USD 20,500 level and is down almost 4% in a day and up over 6% in a week. Similarly, most major altcoins are showing bearish signs. ETH is struggling and might break the USD 1,120 support. ... (Read More...)",50.0,50.0,0.10249316692352295,48.71,58.391203703703695,0.0007808208465576172,2022-07-12
183,Crypto Briefing,Cornered Crypto Lender Celsius Hires New Restructuring Team,"Kirkland &amp; Ellis LLP, Celsius new legal firm, will replace the companys prior lead restructuring counsel. Celsius Hires New Lawyers Celsius has hired a new set of lawyers. According to... (Read More...)",36.34,56.81818181818181,0.28294920921325684,56.400000000000006,56.493506493506494,97.76400029659271,2022-07-12
184,Bitcoin Magazine,How Bitcoin Helps Survivors Of The Prison Industrial Complex,"For Americans cut off from basic financial rights because of their incarcerations, bitcoin can be freedom money. (Read More...)",41.105000000000004,35.0,99.90088939666748,73.83500000000001,58.333333333333336,0.12255609035491943,2022-07-12
185,crypto.news,ChainWars Makes It Easier for Players to Own In-Game Assets,ChainWars is a Digital Collectible Card Game (DCCG) with the intention of utilizing blockchain’s decentral identity to offer its community a big variety of applications for custom Chain Wars blockchain implementation and use cases. ChainWars is joining the new innovative… (Read More...),77.115,80.0,99.93937909603119,22.13,47.803030303030305,99.9484121799469,2022-07-12
186,Cryptomode,"BIB Exchange Launches a Lucrative Campaign, Offering a 90% off BTC Subscription","Singapore, July 2022 – Recently, the world’s leading cryptocurrency trading platform, BIB Exchange, unveils its newest and one-of-a-kind campaign – to thank for user’s continued loyalty and support, BIB invites cryptocurrency traders to take part in its celebration and takes out 16 BTC for an 8-r... (Read More...)",50.0,50.0,12.815570831298828,91.355,62.5,98.60870242118835,2022-07-12
187,The Daily Hodl,"Biggest Ethereum Whales Scoop up The Sandbox, Apecoin, Decentraland and Three More Metaverse Tokens: WhaleStats","The largest whales on the Ethereum (ETH) network are jumping into a series of different altcoins associated with the metaverse sector over the last seven days, according to blockchain tracking service WhaleStats. As per WhaleStats’ on-chain data, virtual world The Sandbox (SAND) is currently by f... (Read More...)",57.655,75.0,94.09763813018799,50.0,56.25,0.5009561777114868,2022-07-12
188,Coinnounce,Celsius: Crypto Lending service swaps lawyers,"Crypto lending platform Celsius has seen fit to hire new restructuring lawyers. It is hiring Kirkland and Ellis LLP, the firm currently aiding Voyager Digital. Although Celsius’s communication has been elusive for a while, we learn that the company is hiring a new law firm to work out the possibi... (Read More...)",50.0,50.0,76.25057697296143,68.06,54.82954545454546,4.248061776161194,2022-07-12
189,CoinGape,Just-In: Digital Euro Project: Experts To Finalize Roadmap Next Week,"The European Central Bank (ECB) is organizing an online technical talk next week to explore the design of the Digital Euro. The ECB event could see experts from blockchain, crypto, and financial technology firms help the central bank finalize a privacy-focused digital euro design. Experts to Disc... (Read More...)",50.0,50.0,99.84525740146637,70.095,52.77777777777778,98.6141562461853,2022-07-12
