,source,title,excerpt,vader_sentiment_title,tb_sentiment_title,flair_sentiment_title,vader_sentiment_excerpt,tb_sentiment_excerpt,flair_sentiment_excerpt,date
63,Crypto Daily,"Web 3 Payment Solution, PIP Button Launches To Enhance Simple Blockchain Payments For Content Creators","The new improved payment solution will leverage blockchain technology to offer users one of the simplest and cheapest payment systems in websites and personal media. Solana-based payment solution, PIP Button announced its launch introducing one of the simplest and most effective ways for users to... (Read More...)",65.91,50.0,98.98239374160767,93.88499999999999,67.36363636363636,99.62415993213654,2022-06-21
64,BeInCrypto,Smaller Firms Scoop up Crypto Demand as Large Fund Providers Still Unconvinced,"Smaller, more specialized firms have been meeting retail investors’ growing demands for cryptocurrency exposure, yet major funds remain wary. The post Smaller Firms Scoop up Crypto Demand as Large Fund Providers Still Unconvinced appeared first on BeInCrypto. (Read More...)",31.94,55.35714285714286,1.5951842069625854,39.885,56.41741071428572,0.25462806224823,2022-06-21
65,Cointelegraph,More 'forced selling' ahead'? Purpose Bitcoin ETF holdings plunge by 51% in biggest outflow ever,"The shocking Bitcoin withdrawals appeared as BTC's extended its decline below $20,000 over the weekend. (Read More...)",24.525000000000002,55.00000000000001,0.09897351264953613,29.905000000000005,37.5,0.022342801094055176,2022-06-21
66,Ethereum World News,WeChat Warns China Users Against Using the App to Trade Crypto and NFTs,Summary: WeChat has warned users in China against using the app to trade cryptocurrencies and NFTs. The warning reiterates China’s government directive to ban crypto trading and mining within its borders. The popular social media platform WeChat has warned its users in China against using the app... (Read More...),44.865,50.0,0.008764863014221191,12.469999999999997,68.88888888888889,0.007283687591552734,2022-06-21
67,Crypto Daily,LinkedIn fraudsters lure victims into fake cryptocurrency investments,"Judged by the FBI to be a “significant threat”, scams are abounding on LinkedIn which coax potential victims onto fraudulent platforms where their investment is stolen. Beginning with a harmless looking contact, small talk is used to direct the potential victim into first investing into a perfect... (Read More...)",8.42,25.0,0.2786874771118164,4.4099999999999975,60.55555555555555,0.03586113452911377,2022-06-21
68,Decrypt,‘Like Coming Off Heroin’: How Bad Will This Bitcoin Bear Market Get?,Analysts interviewed by Decrypt said that this Crypto Winter could be even worse than the downtown that began in December 2017. (Read More...),22.884999999999998,15.000000000000007,0.03196895122528076,26.165,52.5,0.007915496826171875,2022-06-21
69,ZyCrypto,"Bitcoin Reclaims $20,000, But This Famed Finance Personality Warns Of Bull Trap Potential","Even though the recent corrective rally has provided somewhat of a sigh of relief for BTC prices, some market observers are far from convinced that the sell-off is over. (Read More...)",22.504999999999995,50.0,0.25722384452819824,84.15,60.0,5.38182258605957,2022-06-21
70,Bitcoin.com,"‘Bitcoin Is Dead’ Google Searches Skyrocket, Bitcoin Obituaries Records 15 Deaths This Year","According to the Bitcoin Obituaries list, bitcoin has died 15 times in 2022, and the last obituary written about bitcoin’s death was on June 18, in a recent statement that said: “Bitcoin Will Not Recover.” Interestingly, Google Trends data shows that the search phrase “bitcoin is dead,” is estima... (Read More...)",50.0,40.0,0.002020597457885742,6.619999999999998,57.99999999999999,0.0014007091522216797,2022-06-21
71,CoinTelegraph,Why the crypto market crash may play in Bitcoin's favour,"Podcaster and Bitcoin educator, Natalie Brunell, believes the current market turmoil could lead to regulation favouring Bitcoin over alts. (Read More...)",69.08999999999999,50.0,2.973160147666931,47.42,62.5,6.782761216163635,2022-06-21
72,Cryptomode,Gorilix (SILVA) up +45% whilst Ethereum (ETH) and Polygon (MATIC) begin to recover,"Although Gorilix DeFi’s native token, SILVA, has only been on the market for a couple of weeks, it’s already showing promise whilst the markets have spent the last few weeks in a downturn, SILVA is up +45%, showing gains some big crypto players are currently dreaming of. Although in the previous ... (Read More...)",50.0,50.0,14.22516405582428,78.595,50.208333333333336,84.8481148481369,2022-06-21
73,Bitcoinist,Binance And Luxury Brand Vertu Paris To Roll Out New Smartphone NFTs,"Crypto exchange Binance and luxury brand Vertu is celebrating luxury and innovation. In honor of the 22nd anniversary of Vertu Paris and the introduction of the next generation of smartphones, the luxury brand is forging a partnership with Binance to salute the ultimate integration of cryptocurre... (Read More...)",50.0,56.81818181818181,99.59048330783844,92.955,58.333333333333336,99.9249815940857,2022-06-21
74,Blockworks,Small Cap Cryptos Bounce as Markets Attempt Recovery,"Bitcoin dominance dropped more than 7% over the past week, as smaller names bounce harder relative to BTC The post Small Cap Cryptos Bounce as Markets Attempt Recovery appeared first on Blockworks. (Read More...)",50.0,37.5,0.6711959838867188,60.114999999999995,54.0625,0.015807151794433594,2022-06-21
75,Bitcoin Magazine,"Frogs Over Fiat Bitcoin NFT Art Gallery Opens Tomorrow In Manhattan, NY","The Frogs &gt; Fiat art gallery for bitcoin NFTs opens tomorrow in lower Manhattan, NY and will have many prominent artists and collectors in attendance. (Read More...)",50.0,50.0,2.6252180337905884,51.29,75.0,99.95862245559692,2022-06-21
76,BeInCrypto,"Bancor (BNT) End Impermanent Loss Protection, Blame ‘Hostile Market Conditions’","Bancor Protocol has ‘paused’ impermanent loss protection, blaming hostile market conditions for the move. (Read More...)",21.405,50.0,1.357230544090271,10.18,75.0,0.11145472526550293,2022-06-21
77,Bitcoin Magazine,Bitcoin Songsheet: Resisting The Fiat Morality Pushed By Elites,Today’s virtue signaling is a symptom of the morals imposed by money-printing elites. Bitcoin’s sound money system would put an end to it. (Read More...),50.0,50.0,5.570751428604126,68.06,72.5,18.281030654907227,2022-06-21
78,CoinGape,Breaking: Korean Financial Authority Imposes Departure Ban On Terra Developers,"According to Korean news site JTBC, the Seoul Joint Financial and Securities Crime Investigation Team has placed travel embargoes on developers in the Terra team. This is as a result of the ongoing investigation on Terra by Korean Authorities. TFL’s members were not informed about the ban After t... (Read More...)",21.405,50.0,0.062346458435058594,14.52,62.5,0.020167231559753418,2022-06-21
79,Bitcoinist,"Think You’re Down Bad? This Ethereum Wallet Got Liquidated Over 71,800 ETH","Most investors in the crypto market have been feeling the heat ever since digital assets like Ethereum began their downtrend. Being more than 70% down from its all-time high, it’s no secret that a good number of investors are held holding Ethereum bags that are currently in the loss. However, the... (Read More...)",22.884999999999998,28.611111111111114,0.02168118953704834,76.335,63.358024691358025,0.05974769592285156,2022-06-21
80,crypto.news,Tether (USDT) Braces Up for Full Audit to Increase $USDT Reserves Transparency,"In an interview, Paolo Ardoino, the CTO of Tether, stated that the company is embarking on a thorough audit to increase transparency over its $USDT assets. In order to increase transparency on $USDT holdings, a firm by the name of… (Read More...)",65.91,67.5,6.12415075302124,82.43,57.49999999999999,0.17927289009094238,2022-06-21
81,The Block,ZigZag DEX to sell governance tokens with airdrop down the line,Those who buy ZigZag's governance tokens in an initial sale will decide the requirements for its upcoming airdrop. (Read More...),50.0,42.22222222222222,0.2037644386291504,50.0,62.5,95.12642621994019,2022-06-21
82,The Daily Hodl,"Analyst Says Solana (SOL), Polygon (MATIC) and One Additional Altcoin To Come Out Alive From Crypto Bear Market","A closely followed crypto analyst says that only a select group of altcoins will survive the bear market and recover in the coming years. The pseudonymous analyst known as Altcoin Sherpa tells his 178,000 Twitter followers that he expects about 5% of altcoin projects to survive the current crypto... (Read More...)",69.08999999999999,55.00000000000001,13.98741900920868,50.0,58.333333333333336,0.01017749309539795,2022-06-21
83,CoinGape,Avalanche Price Analysis: Can Channel Breakout Lead AVAX To $38?,"Avalanche(AVAX) price has steadily fallen, responding to a falling parallel channel pattern. The downward spiral dumped the altcoin to a $14 low, offering enough demand pressure for another bullish cycle within the pattern. Can the potential rally hit the $38 mark? Key points: The AVAX jumps from... (Read More...)",50.0,50.0,0.1319795846939087,6.874999999999998,54.761904761904766,0.002843141555786133,2022-06-21
84,The Daily Hodl,Learning About Crypto With Phemex Academy and Phemex Blog,"Having a blog or a specialized articles page is essential for any business. People trust the written word, and blogs improve the level of trust toward the organization or venture. This is true for one of today’s most popular domains – the crypto industry. Since crypto is a constantly developing f... (Read More...)",50.0,50.0,95.25865614414215,96.855,66.25,99.91723895072937,2022-06-21
85,Crypto Briefing,ProShares Wants You to Short Bitcoin Through Its New ETF,ProShares just announced the launch of a new Bitcoin futures ETF that will allow investors to conveniently profit from price drops. The company was the first to offer a Bitcoin... (Read More...),50.0,55.6060606060606,14.756816625595093,79.295,64.77272727272727,19.3733811378479,2022-06-21
86,CoinTelegraph,ProShares will launch ETF aimed at shorting Bitcoin following dip under $20K,"The ETF will allow U.S. investors to bet against BTC using futures contracts given the cryptocurrency’s performance in a single day, as measured by the CME Bitcoin Futures Index. (Read More...)",50.0,50.0,0.13649165630340576,61.315,60.71428571428572,0.4681438207626343,2022-06-21
87,CryptoPotato,ProShares Announces First Bitcoin-Linked Short ETF in U.S.,"Yet another futures-based Bitcoin ETF is set to launch in the United States, but with no spot ETF in sight. (Read More...)",50.0,56.25,5.783531069755554,38.685,75.0,0.0106126070022583,2022-06-21
88,Crypto Daily,South Korea Delays Crypto Tax By 2 Years,"The 20% taxation on digital assets in South Korea that was supposed to be levied from 2023 has been delayed by another two years. Tax Announced Back In 2020 Before the announcement of the 2-year delay, the hefty 20% tax on crypto-asset gains was supposed to come into action on January 1, 2023. Ho... (Read More...)",50.0,50.0,0.08080601692199707,48.71,57.49999999999999,0.0042438507080078125,2022-06-21
89,Ethereum World News,"Purpose Bitcoin ETF Puked 24.5k BTC on Friday, Leading to the Weekend Low of $17.6k – Arthur Hayes","Summary: Arthur Hayes has highlighted that the Purpose Bitcoin ETF offloaded 24.5k BTC into the markets on Friday’s close. Bitcoin went on to drop to the local low of $17,600 due to the selling pressure that could have been a run to trigger stop losses. The Bitcoin and crypto markets have since r... (Read More...)",20.029999999999998,50.0,0.0028967857360839844,7.405,54.6875,0.30303001403808594,2022-06-21
90,AMBCrypto,"Bancor pushes the pause button, but does that really work for BNT","The latest crypto-market sell-off managed to put a lot of pressure on DeFi platforms. Bancor, like many other platforms like it, is feeling the heat too. Bancor recently announced a temporary pause on impermanent loss protection. The announcement is part of its plan to cut down on huge liquidity ... (Read More...)",50.0,60.0,99.1802304983139,64.8,61.56746031746032,0.1765131950378418,2022-06-21
91,Bitcoin.com,"Biggest Movers: MKR up 20% to Start the Week, Whilst AVAX Rebound Continues","MKR was up by nearly 20% to start the week, as prices continued to move away from recent lows. AVAX was also in the green, as it climbed by over 10% on Monday, after hitting a ten-month low during the weekend. Maker (MKR) MKR was a notable mover to start the week, as prices climbed […] (Read More...)",50.0,50.0,81.22783601284027,27.98,57.49999999999999,4.278656840324402,2022-06-21
92,Crypto Daily,Lisk Announces the 5th Wave of its Grant Program ,"Over the last few years, the explosion in blockchain’s popularity has meant that more programs and resources are being developed to serve the space. From projects that foster cross-chain operability to new blockchains themselves, developers in the space are constantly coming up with new innovatio... (Read More...)",68.06,50.0,99.94476437568665,73.83500000000001,57.32954545454545,99.75990355014801,2022-06-21
93,BeInCrypto,Vitalik Buterin and His Dad Share Their Thoughts on the State of Crypto,Vitalik Buterin and his father have shared their opinions on the Terra collapse and the general state of the crypto market. (Read More...),64.8,50.0,99.75189864635468,39.885,63.74999999999999,97.98884689807892,2022-06-21
94,The Block,Bitfinex and Tether say they have no plans to cut jobs amid market turmoil,Sister crypto firms Bitfinex and Tether have no plans to reduce staff. Both firms are in fact looking to hire more people. (Read More...),14.984999999999998,50.0,0.17964541912078857,35.199999999999996,75.0,0.7823556661605835,2022-06-21
95,NullTX,These 2 Metaverse Crypto Coins Gained Over 45% Today,"Several projects have shown substantial growth in the past 24 hours, with cryptocurrency markets recovering from this weekend’s selloff. Some Metaverse and NFT projects gained over 45% today, signaling plenty of momentum and traders waiting on the sidelines, ready to buy the dip. Today we look at... (Read More...)",69.08999999999999,50.0,99.93676245212555,90.88000000000001,55.625,99.59373772144318,2022-06-21
96,U.Today,More Than 70 Million SHIB Burned Via Amazon This Sunday,"This weekend, this business platform destroyed more than 70 million SHIB via Amazon and other projects (Read More...)",58.894999999999996,75.0,0.006961822509765625,31.94,64.58333333333334,0.004035234451293945,2022-06-21
97,Protos.com,Terra team held in South Korea as Do Kwon named in securities lawsuit,"The suit alleges defendants, which also include Terraform Labs, conned investors by failing to register tokens as securities with the SEC. (Read More...)",53.86,50.0,0.9714305400848389,36.34,60.0,0.052094459533691406,2022-06-21
98,Bitcoin Magazine,Michael Saylor Lists 10 Things For Bitcoin To Become A Stronger Asset,"In an interview with Bloomberg, Michael Saylor detailed 10 things that needs to happen over the next decade for bitcoin to become a stronger asset for institutions. (Read More...)",81.245,50.0,84.07373130321503,81.245,65.0,86.79988086223602,2022-06-21
99,Crypto Daily,BTC/USD Peaks Around 20795: Sally Ho's Technical Analysis 21 June 2022 BTC,Bitcoin (BTC/USD) struggled to sustain a small improvement early in the Asian session as the pair tried to get back above the psychologically-important 20000 figure after peaking around the 20795.11 area during a short-lived recovery higher. The short-lived rally fizzled out below the 20867.15 ar... (Read More...),50.0,50.0,24.40994679927826,57.655,54.285714285714285,0.0017285346984863281,2022-06-21
100,CryptoPotato,"XRP Price Analysis: Following a 10% Rebound, is Ripple’s Bloodbath Over?","The cryptocurrency market finally saw some relief. Although XRP has experienced a continuous downward trend for three months, it seems that buyers are gradually entering the market. Given the broader market conditions, however, it might be too early to make long-term conclusions. Technical Analys... (Read More...)",50.0,50.0,2.124550938606262,73.83500000000001,64.0,92.8496390581131,2022-06-21
101,Finbold,Interest in ‘Bitcoin’ on Google Search hits 12-month high amid heightened volatility,"Over the last year, interest in Bitcoin (BTC) has surged, with the cryptocurrency recording fluctuating price movements characterized by an... Continue reading (Read More...)",72.94,57.99999999999999,0.2964824438095093,72.94,62.5,94.76642310619354,2022-06-21
102,Decrypt,‘It’s Not a Game’: How Versity Is Set To Revolutionize Real Estate Using The Metaverse,"No mere virtual land platform, Versity is building an ‘immersive mirror of the real world’ to streamline the world of bricks-and-mortar real estate. (Read More...)",50.0,60.0,96.82583212852478,35.199999999999996,64.375,99.98337626457214,2022-06-21
103,Crypto Daily,Solend Users Vote For “Forced Takeover” Amidst Whale Liquidation Crisis,"After voting for a “forced takeover” for a whale account, Solend users have revisited the ballots to decide that Sunday’s “Emergency Powers” plan must be invalidated. Extreme Measures - “Whale” Account Takeover The crypto market downturn is causing ripples throughout the industry, causing many De... (Read More...)",18.755,35.0,0.687149167060852,50.0,57.1875,0.3383249044418335,2022-06-21
104,Protos.com,LinkedIn users fight back against growing crypto cons,The FBI has warned LinkedIn users of a growing crypto scam problem. Some have decided to take matters into their own hands. (Read More...),38.685,50.0,3.86793315410614,11.414999999999997,77.5,0.4880547523498535,2022-06-21
105,CoinTelegraph,‘Bitcoin dead’ Google searches hit new all-time high,"Sentiment in the crypto community is the lowest it has ever been, leading to fresh speculation that BTC is a dying asset. (Read More...)",50.0,51.60606060606061,0.18325448036193848,64.8,70.0,0.04985630512237549,2022-06-21
106,Blockworks,Babel Finance Working To Ease ‘Unusual Liquidity Pressures’,The crypto financial services provider suspended redemptions and withdrawals from its products on Friday The post Babel Finance Working To Ease ‘Unusual Liquidity Pressures’ appeared first on Blockworks. (Read More...),68.06,60.0,97.70694971084595,42.345,61.875,0.01271665096282959,2022-06-21
107,U.Today,Ripple CTO on Solend’s Whale Liquidation Crisis; Decentralized Systems Are Very Democratic,Release of XRP is controlled by these escrows on ledger (Read More...),18.755,60.0,97.37517237663269,50.0,75.0,3.0179262161254883,2022-06-21
108,Crypto Briefing,Terraform Labs Staff Banned From Leaving South Korea: Report,South Korean prosecutors investigating Terraform Labs and its co-founders Daniel Shin and Do Kwon over Terra’s collapse have reportedly imposed a departure ban on current and former employees. Prosecutors Impose... (Read More...),27.060000000000002,50.0,0.07013380527496338,10.18,58.333333333333336,1.0846883058547974,2022-06-21
109,U.Today,"$220,000 for Bitcoin Still in Play This Year: Max Keiser","Prominent Bitcoin maximalist Max Keiser believes that this year Bitcoin still has high odds of reaching $220,000 (Read More...)",67.0,50.0,99.52698349952698,73.83500000000001,69.33333333333334,0.9229600429534912,2022-06-21
110,Finbold,Desperate investor raids gold shop to cover cryptocurrency losses,"During the carnage that engulfed the cryptocurrency market over the course of last week, many investors suffered heavy losses, including... Continue reading (Read More...)",19.379999999999995,20.0,0.49172937870025635,14.52,60.0,0.015819072723388672,2022-06-21
111,Coinnounce,The Complete Guide to Investing in Cryptocurrency for Beginners,"Over the last few years, the popularity of cryptocurrency has skyrocketed beyond many expert’s expectations. However, the profitability of the crypto market couldn’t exist without volatility. For example, CNBC informs that Bitcoin plummeted below $23,000, hitting its lowest level since December 2... (Read More...)",50.0,55.00000000000001,94.44614052772522,69.08999999999999,60.0,1.79654061794281,2022-06-21
112,U.Today,Crypto Industry's Ad Spending Collapses by 90%,Cryptocurrency ad spending blitz came to an end after prices crashed (Read More...),35.199999999999996,50.0,0.003343820571899414,50.0,75.0,0.051909685134887695,2022-06-21
113,U.Today,"SHIB Hits New Milestone, Charles Hoskinson Denies Claiming to Be Satoshi, Kraken Lists DOGE Futures: Crypto News Digest by U.Today",Read U.Today’s news digest to not miss out on the latest crypto news! (Read More...),28.925,56.81818181818181,86.63471341133118,59.33500000000001,78.125,98.84082973003387,2022-06-21
114,CoinGape,Here’s Why Hedera (HBAR) Prices Might Surge Ahead,"The HBAR Foundation has announced that it will be joining hands with the Dropper NFT in order to launch some services for them. Meanwhile, Its native token (HBAR)’s 24-hour trading volume has jumped by 30%. Dropper to grant $5 mln grant to participants The foundation mentioned that it will be dep... (Read More...)",50.0,50.0,21.477094292640686,80.62,75.0,0.0066339969635009766,2022-06-21
115,U.Today,"ProShares Short Bitcoin ETF to Launch on Tuesday, June 21",Launch of first U.S. ETF linked to Bitcoin price declining tomorrow has been confirmed (Read More...),50.0,50.0,10.443618893623352,50.0,69.16666666666667,75.35693347454071,2022-06-21
116,Cryptomode,Bancor Temporarily Pauses Impermanent Loss Protection To Avoid Further BNT Devaluation,"Even though decentralized finance remains one of the more exciting verticals in cryptocurrency, there are many concerns. One protocol after the next suffers from depegging, strange behavior, paused withdrawals, or pausing impermanent loss protection. A recent change affecting Bancor has many peop... (Read More...)",22.884999999999998,50.0,0.23752450942993164,29.835,59.166666666666664,0.031116604804992676,2022-06-21
117,Cointelegraph,BTC price recovers to 3-day highs as new whale support forms at $19.2K,"At least some were buying the dip below $20,000, data shows, while PlanB fields fresh criticism of his stock-to-flow BTC price models. (Read More...)",70.095,56.81818181818181,5.288046598434448,42.345,58.333333333333336,0.10203719139099121,2022-06-21
118,Decrypt,Solana Lending DAO Overturns Vote to Take Over At-Risk ‘Whale’ Wallet,Solend’s controversial governance proposal to take over the DeFi lending protocol’s largest wallet has been invalidated after a follow-up vote. (Read More...),50.0,50.0,0.5002200603485107,39.885,76.25,1.336541771888733,2022-06-21
119,Cointelegraph,Scams in GameFi: How to identify toxic NFT gaming projects,"While NFTs could change the gaming economy, some blockchain-based projects can be less than honest. (Read More...)",20.705000000000002,50.0,0.20167231559753418,73.13499999999999,65.55555555555556,0.9576588869094849,2022-06-21
120,CryptoSlate,Circle CEO fails to dismiss allegations USDC users can be blocked,"Founder of the Daily Gwei newsletter, Anthony Sassano, claims that USDC accounts can be blocked. (Read More...)",20.029999999999998,25.0,9.085637331008911,36.34,62.5,0.025290250778198242,2022-06-21
121,AMBCrypto,Analyzing ETH’s dual scenarios following this interesting ‘record’,"Ethereum [ETH], the world’s largest altcoin, has suffered extensively in June. ETH fell below $1,000 for the first time in more than a year as the broader crypto-market continues to slide south with no quick remedy in sight. That being said, ETH might have one — thanks to the ‘much anticipated,’ ... (Read More...)",74.05,62.5,99.51170682907104,31.94,60.59523809523809,0.002092123031616211,2022-06-21
122,crypto.news,Bybit Cryptocurrency Exchange Announces the Launch of the Grid Trading Bot for Registered Users,"Bybit, one of the world’s most liquid cryptocurrency exchanges offering a wide range of exciting features, including an ultra-fast matching engine, has released the Grid Trading Bot. The Grid Trading Bot According to a press release on June 20, 2022,… (Read More...)",50.0,50.0,93.8876360654831,74.695,65.0,99.7876226902008,2022-06-21
123,crypto.news,PIP Introduces the ‘No-Code’ PIP Button to Simplify Monetization of Creative Content,PIP has launched a new Solana blockchain-based payment solution dubbed PIP Button. The PIP Button is designed to make it easier for content creators to monetize their content without having to write complex codes into their platforms. The No-Code PIP… (Read More...),72.02,75.0,98.51986467838287,84.04,55.6060606060606,18.065625429153442,2022-06-21
124,BeInCrypto,Tron (TRX) Falls by More Than 35% After USDD De-Peg,"Tron (TRX) has been decreasing since the end of May, having fallen by 35% so far. It is possible that the decrease is occurring as a result of the de-pegging of USDD The post Tron (TRX) Falls by More Than 35% After USDD De-Peg appeared first on BeInCrypto. (Read More...)",50.0,75.0,0.0012874603271484375,31.94,63.5,0.00026226043701171875,2022-06-21
125,Crypto Daily,Hong Kong-based crypto platform Hoo.com suspends withdrawals,"Hong Kong based crypto platform Hoo.com has suspended withdrawals, days after the collapse of crypto hedge fund Three Arrows Capital, and other cryptocurrency platforms in Hong Kong have suspended withdrawals. On Sunday, crypto trading platform Hoo.com announced via Twitter, that it would be halt... (Read More...)",50.0,50.0,0.0651329755783081,7.224999999999998,59.375,0.012835860252380371,2022-06-21
126,Blockworks,"Bybit To Slash Staff, Citing Turbulent Markets","Starting this week, the Singapore-based cryptoasset exchange will review some of its roles and functions, a spokesperson said The post Bybit To Slash Staff, Citing Turbulent Markets appeared first on Blockworks. (Read More...)",36.34,50.0,0.057956576347351074,36.34,62.5,0.02709329128265381,2022-06-21
