,source,title,excerpt,vader_sentiment_title,tb_sentiment_title,flair_sentiment_title,vader_sentiment_excerpt,tb_sentiment_excerpt,flair_sentiment_excerpt,date
123,Cryptomode,Binance Removes Most Trading Pairs And DeFi Features For USDC And Two Other Stablecoins,"Binance is the leading cryptocurrency exchange globally. It has the most volume and users, but the team sometimes makes highly unusual decisions. The decision to auto-convert various stablecoins to BUSD – at least visually – is somewhat controversial but it strangely makes some sense. What Is Bin... (Read More...)",50.0,59.375,0.06547868251800537,22.425,57.77777777777777,98.6311286687851,2022-09-07
124,The Block,"Digital assets belong in traditional banking, ex-U.S. regulator says","More crypto business and innovation should be moved into the traditional banking industry, at least according to some bankers and a former bank regulator. “The federal government doesn’t want basically unregulated third parties basically creating their own currency,” Gene Ludwig, a former top U.S... (Read More...)",58.894999999999996,50.0,96.10022008419037,91.125,60.0,1.7473846673965454,2022-09-07
125,CryptoPotato,Ethereum Classic is a Dead Project: Cardano’s Charles Hoskinson,"After comparing Solana to an old Nintendo console, Charles Hoskinson has lashed out at Ethereum Classic. (Read More...)",17.570000000000004,49.166666666666664,99.42299127578735,50.0,62.77777777777778,15.478438138961792,2022-09-07
126,The Block,"Fuel Labs raises $80 million for modular execution layer, touting superior speed","Fuel Labs, a startup that aims to quicken crypto transactions, has announced an $80 million raise from some of the sector’s heavyweights. (Read More...)",71.075,85.0,99.7022807598114,50.0,75.0,80.53052127361298,2022-09-07
127,Cryptonews,Last-gasp Brazilian Securities Regulator Intervention Could Scupper MPs’ Efforts to Police Crypto,"Brazilian markets regulator says it wants to play a leading role in regulating crypto – in a move that could derail parliamentarians’ own attempts to regulate the sector. Per the financial arm of the newspaper giant Globo, the Brazilian Securities and Exchange Commission, known locally as the CVM... (Read More...)",64.8,50.0,0.8949726819992065,67.0,60.83333333333334,5.038684606552124,2022-09-07
128,Crypto Daily,Crypto Assets Are No Longer Niche Products: IMF Report,"According to the newest report by the International Monetary Fund (IMF), cryptocurrencies can no longer be seen as niche products, and have called for comprehensive regulation to govern the sector. Over the past couple of years, digital assets have transitioned from niche products to more mainstr... (Read More...)",43.6,50.0,0.8855640888214111,56.400000000000006,57.49999999999999,79.96962368488312,2022-09-07
129,BeInCrypto,Ethereum Classic (ETC) Price Surges as Ethereum Miners Flock in Anticipation of the Merge,Ethereum Classic (ETC) has broken out from a short-term pattern and is approaching a crucial resistance area at $45. The post Ethereum Classic (ETC) Price Surges as Ethereum Miners Flock in Anticipation of the Merge appeared first on BeInCrypto. (Read More...),55.135,58.333333333333336,99.5929628610611,29.905000000000005,54.88095238095239,23.642054200172424,2022-09-07
130,Crypto Daily,Will UK’s New Administration Be Crypto-Friendly?,"The new Prime Minister, Liz Truss, had previously stated that the UK should welcome cryptocurrencies. New PM Takes Office Over the weekend, the United Kingdom welcomed its new Prime Minister, former Foreign Secretary Liz Truss. Earlier today, she was sworn into office by Queen Elizabeth II. Crypt... (Read More...)",50.0,56.81818181818181,0.13832151889801025,90.10000000000001,57.87457912457913,95.01313865184784,2022-09-07
131,U.Today,"Bitcoin May Soar After Current “Discount”, If History Repeats Itself: Bloomberg’s Chief Analyst",Major analyst of Boomberg names cases in the past when Bitcoin nosedived like now and then spiked (Read More...),50.0,50.0,1.6642093658447266,68.06,55.208333333333336,98.82571399211884,2022-09-07
132,Protos.com,Exiled Myanmar gov’t asks US for $1B in frozen funds to issue crypto,The exiled government of Myanmar has asked the US Federal Reserve to release $1 billion in frozen funds to issue its own crypto. (Read More...),50.0,50.0,0.09188950061798096,50.0,77.5,0.07759332656860352,2022-09-07
133,Blockworks,Investment Products Shorting Bitcoin See Record Inflows,"Products betting against the asset helped the space’s offerings avoid a fourth straight week of outflows, according to CoinShares report The post Investment Products Shorting Bitcoin See Record Inflows appeared first on Blockworks. (Read More...)",50.0,50.0,20.17066478729248,64.8,61.875,0.4619896411895752,2022-09-07
134,Decrypt,21Shares Parent Company 21.co Raises $25M at $2 Billion Valuation,"The company claims this makes it ""Switzerland’s largest crypto unicorn."" (Read More...)",50.0,50.0,18.4382826089859,50.0,75.0,8.918505907058716,2022-09-07
135,CryptoBriefing,“Real Yield” Mania Has Hit DeFi. Here Are Five Projects to Watch,"As the era of high-risk, high-reward yields in decentralized finance has all but come to an end, a new trend of projects offering smaller but more sustainable yields has started to replace it. Anyone remotely involved with crypto has noticed that the market moves in cycles. So-called bullish peri... (Read More...)",50.0,60.0,99.49692487716675,50.0,60.36363636363637,0.06805360317230225,2022-09-07
136,Crypto Briefing,“Real Yield” Mania Has Hit DeFi. Here Are Five Projects to Watch,"As the era of high-risk, high-reward yields in decentralized finance has all but come to an end, a new trend of projects offering smaller but more sustainable yields has started... (Read More...)",50.0,60.0,99.49692487716675,50.0,64.20454545454545,80.67186176776886,2022-09-07
137,The Block,Russia’s Finance Ministry is working on stablecoin platforms to avoid cross-border dollar settlement: Tass,Russia's finance ministry is apparently looking to stablecoins to avoid international payment rails denominated in the dollar and euro. (Read More...),35.199999999999996,50.0,0.4570573568344116,35.199999999999996,59.166666666666664,0.007891654968261719,2022-09-07
138,Cryptomode,What do you know about mining?,Do you think that this is a complex mechanism? Let’s deal with this topic using the example of the new Azimuth Finance project. It includes several services. One of them is MINER. On the Azimuth Finance platform you can participate in mining using stable and familiar cryptocurrencies. $AZM token ... (Read More...),50.0,50.0,97.6664662361145,64.8,57.11363636363637,23.657909035682678,2022-09-07
139,Cointelegraph,Traders say Bitcoin price bounce is overdue after a ‘massive’ BTC long position appears,"A Binance futures entity has been accumulating for days, and the result could be quite the squeeze, analysts believe. (Read More...)",50.0,48.75,0.25921761989593506,50.0,75.0,1.426801085472107,2022-09-07
140,Bitcoinist,"Crypto Plays A Crucial Role In Helping Combat Crime, Europol Says","As crypto use spreads to every nook and cranny of society, so does its misuse of the system to perform novel crimes and launder illicit funds. While Bitcoin and other cryptocurrencies are now being widely used in nefarious activities, the decentralized nature of blockchain technology presents law... (Read More...)",29.905000000000005,50.0,99.74152743816376,65.91,54.58333333333334,0.10672509670257568,2022-09-07
141,Bitcoin.com,"Biggest Movers: ETC up Nearly 30% on Tuesday, as Merge Timeline Is Set","Ethereum classic was a notable mover in today’s session, as the token rose by nearly 30% on Tuesday. The surge comes as it was confirmed that the Ethereum merge event will take place next week, between September 13-15. Another big mover was avalanche, which rose by over 8% earlier today. Ethereum... (Read More...)",50.0,55.00000000000001,97.8382259607315,50.0,64.33333333333333,88.9957845211029,2022-09-07
142,CoinGape,This Chart Formation Indicates A Correction Is Round The Corner In ADA Price?,"ADA price extends the downside momentum and remained offered below $0.50. In the last few hours, the price is trading in the red. Cardano (ADA) price analysis is bearish for the day. ADA price edges lower for the second consecutive day. A double top formation on the 4-hour chart calls for more lo... (Read More...)",50.0,40.0,0.04265308380126953,38.685,58.12500000000001,0.022235512733459473,2022-09-07
143,Crypto Daily,Bitcoin Price Analysis: Bears Still Prevailing - 7 September 2022,"BTC/USD Downside Risks Prevailing: Sally Ho’s Technical Analysis – 7 September 2022 Bitcoin (BTC/USD) extended its recent depreciation early in the Asian session as the pair continued to orbit the 19742.48 area, representing the 78.6% retracement of the appreciating range from 19513.74 to 20582.6... (Read More...)",50.0,50.0,80.53917586803436,47.42,56.00000000000001,22.52446711063385,2022-09-07
144,Cointelegraph,Will the Ethereum Merge crash or revive the crypto market? | Find out now on The Market Report,"On this week’s episode of “The Market Report,” Cointelegraph’s resident experts discuss the Ethereum (ETH) merge and how it might impact the crypto market. (Read More...)",46.14,50.0,0.08938908576965332,50.0,75.0,19.9517160654068,2022-09-07
145,Ethereum World News,Circle (USDC) CEO Jeremy Allaire Supports Binance Stablecoin Decision,"Summary: Circle CEO Jeremy Allaire supports Binance’s latest stablecoin announcement. Binance said USDC, TUSD, and USDP would be removed as tradeable assets. Users would be able to deposit and withdraw these three stablecoins regardless of the change, per the announcement. Allaire believes the mo... (Read More...)",68.06,50.0,97.52467572689056,74.695,75.0,0.05303323268890381,2022-09-07
146,CoinGape,Cardano Shows High Performance Signs Ahead Of Vasil Hard Fork,"Ahead of the much anticipated Vasil hard fork, there has been increased activity on the Cardano network. The hard fork, touted as the biggest network upgrades on the network so far, is aimed at improving its scalability. This comes at a time when the crypto ecosystem is looking forward to another... (Read More...)",44.865,46.708333333333336,99.96754229068756,72.02,52.16666666666667,95.38520872592926,2022-09-07
147,Finbold,Solana-based transactions approach 100 million despite challenging 2022,"The Solana (SOL) network continues to record development as the blockchain strives to take on established platforms like Ethereum (ETH),... Continue reading (Read More...)",44.305,75.0,4.283607006072998,68.06,75.0,99.80800747871399,2022-09-07
148,U.Today,Ethereum (ETH) Price Analysis for September 6,"Can Ethereum (ETH) get to the $1,700 mark this week? (Read More...)",50.0,50.0,1.1799812316894531,50.0,75.0,0.7393151521682739,2022-09-07
149,CoinGape,Here’s What To Expect From CRV Price This September,"The Curve Dao(CRV) has been walking a sideways trend for nearly four months. A cup and handle pattern forms on the weekly time frame chart, reinforcing a bullish reversal sentiment among market participants. However, the supply zone at $1.22 resistance restricted the buyers’ growth and could keep... (Read More...)",50.0,50.0,99.98145699501038,50.0,65.0,0.0028312206268310547,2022-09-07
150,Crypto Daily,Bnk to the Future looks to buy crypto lender SALT,"Bitcoin and securities platform Bnk To The Future has submitted a letter of intent to acquire crypto lending platform SALT. The first Bitcoin and crypto securities platform and the first crypto lending platform look to be combining, as Simon Dixon’s Bnk To The Future seeks to acquire SALT. The mo... (Read More...)",50.0,50.0,0.04832744598388672,76.335,60.0,21.11895978450775,2022-09-07
151,CoinTelegraph,Circle co-founder says converged dollar books on Binance would be good for USDC,The world's largest crypto exchange announced yesterday it would cease trading support for USDC and auto-covert deposits to its own stablecoin after Sept 29. (Read More...),72.02,85.0,0.07344484329223633,70.095,77.5,0.0022411346435546875,2022-09-07
152,CoinTelegraph,"1inch users on Optimism to receive airdrop of 300,000 OP tokens",The DEX aggregator and automated market maker was first deployed on the Optimism mainnet in August 2021. (Read More...),77.115,50.0,0.11019706726074219,77.115,68.75,82.94602036476135,2022-09-07
153,ZyCrypto,"Ethereum (ETH) Darts Higher As Bellatrix Hard Fork, The Merge Enter Home Stretch","Ethereum’s landmark Merge event is coming — possibly even sooner than expected. According to a recent tweet by Ethereum co-founder Vitalik Buterin, the upgrade will now be fully executed sometime around September 13-15. (Read More...)",44.865,48.95833333333333,19.506967067718506,53.86,55.00000000000001,97.06752598285675,2022-09-07
154,Protos.com,BAYC sells just 16 NFTs in a week as OpenSea dries up,"ENS domains made more than 2,305 ETH ($3.8 million) on OpenSea while Bored Ape Yacht Club dipped 40% on the previous week's sales. (Read More...)",50.0,50.0,0.08587241172790527,36.34,54.166666666666664,0.0021696090698242188,2022-09-07
155,AMBCrypto,Arbitrum’s latest milestone has a lot to do with this upgrade,Ethereum [ETH] L2s are experiencing a resurgence after overcoming June’s bottoms. Arbitrum is heading this charge after accomplishing its latest milestone. Daily transactions on the Arbitrum network have hit an all-time high recently after the launch of the Nitro upgrade in September. According t... (Read More...),50.0,75.0,99.82553422451019,50.0,61.6,99.74955022335052,2022-09-07
156,BeInCrypto,Swiss Crypto Unicorn 21.co Sees Valuation Hit $2B After Latest Funding Round,"Swiss investment firm 21.co has raised £25 million in its latest funding round, valuing the company at $2 billion. The post Swiss Crypto Unicorn 21.co Sees Valuation Hit $2B After Latest Funding Round appeared first on BeInCrypto. (Read More...)",50.0,57.49999999999999,0.6392300128936768,67.0,58.214285714285715,4.293814301490784,2022-09-07
157,The Block,Franklin Templeton launches metaverse ETF for European investors,"Investment firm Franklin Templeton, which oversees $1.4 trillion in assets, has launched a metaverse ETF in Europe. (Read More...)",50.0,50.0,98.07267189025879,64.8,57.49999999999999,76.39078795909882,2022-09-07
158,The Block,3AC withdraws $45 million from Curve and Convex,Troubled crypto hedge fund Three Arrows Capital has reclaimed $45 million in deposits it had previously staked on Curve and Convex Finance. (Read More...),50.0,60.0,0.1623690128326416,27.060000000000002,50.416666666666664,84.42411720752716,2022-09-07
159,U.Today,475 Billion SHIB Scooped up by Whales as ETH Merge Promises Positive Effects for SHIB,"Top whales on Ethereum have grabbed nearly 500 billion SHIB, expecting largely positive effects of Merge on SHIB (Read More...)",86.75500000000001,61.36363636363637,88.8941079378128,82.985,66.5909090909091,5.673214793205261,2022-09-07
160,Trustnodes,Gas Falls Another 4%,Gas dives as the UK government moves to cover costs while EU plans price caps on Russian gas. (Read More...),50.0,50.0,0.004231929779052734,50.0,62.5,0.012603402137756348,2022-09-07
161,U.Today,Sony Music Files NFT-Related Trademark,Sony Music Entertainment has filed several trademark applications for non-fungible tokens and NFTs (Read More...),50.0,50.0,7.629305124282837,71.075,62.5,0.9795546531677246,2022-09-07
162,Cryptomode,Helium (HNT) dips following the proposed Solana move. BudBlockz (BLUNT) private sale on track to sell out,"Helium Deflates It’s been a turbulent week for Helium (HNT). Following the announcement that they were considering scrapping their entire blockchain in favor of Solana’s blockchain, the market reacted quickly to show the Helium team exactly what they thought. The initial signs indicate unfavorabl... (Read More...)",50.0,50.0,3.4936487674713135,70.095,59.02777777777778,0.01658797264099121,2022-09-07
163,Cryptomode,MEXC Will List Web 3.0 Infrastructure Project Point Network on September 5,"On September 5, the Web 3.0 infrastructure project Point Network (POINT) will be listed on the world-renowned cryptocurrency trading platform MEXC. The heading on the website is: “World’s First Full Web 3.0 Implementation”. What do they mean? First, what is Web 3.0? At this time last year, a16z, ... (Read More...)",50.0,50.0,4.736393690109253,50.0,58.64583333333333,88.16688358783722,2022-09-07
164,U.Today,"Bitcoin Still In the Bull Market, Just Selling At a Discount, Says Senior Bloomberg Analyst",Bloomberg Intelligence senior commodity strategist on correlation between crypto and crude oil &amp; Bitcoin being in bull cycle still (Read More...),50.0,50.0,0.006127357482910156,42.345,45.0,5.986317992210388,2022-09-07
165,Bitcoin Magazine,"Nigeria To Establish Special Economic Zone For Bitcoin, Crypto",The NEPZA is in discussions with Binance and Talent City to establish a special economic zone for bitcoin and cryptocurrencies in West Africa. (Read More...),70.095,63.92857142857142,11.962142586708069,83.525,67.61904761904762,6.527414917945862,2022-09-07
166,CoinGape,Breaking: 20K Staked ETH (stETH) Worth $33 Mln Removed From Curve,"Bankrupt hedge fund Three Arrows Capital on Tuesday removed nearly 20,945 stETH worth nearly $33.76 million from Curve ETH liquidity pool. Three Arrows has also withdrawn 203 WBTC, 4,051,368 USDT, and 2462 WETH from Curve. Three Arrows Capital Withdraws Staked Ether (stETH) Again According to Eth... (Read More...)",61.315,65.0,0.014027953147888184,29.905000000000005,62.5,0.011232495307922363,2022-09-07
167,Feed - Cryptopotato.Com,$33 Million Worth of Staked ETH Removed from Curve by Three Arrows Capital Wallet,A wallet associated with 3AC has removed $33 million worth of stETH from Curve's liquidity farming pool. (Read More...),61.315,65.0,0.5986392498016357,61.315,70.0,0.25624334812164307,2022-09-07
168,CryptoPotato,"Ready, Set, Go! Apex Doodles Launches its Genesis NFT Collection on OpenSea","[PRESS RELEASE – Please Read Disclaimer] Ever since non-fungible tokens started taking over the world last year, the place to go for buying, selling, and overall interacting with these digital assets has been OpenSea. Being an NFT-related project, it’s an essential step of your growth and develop... (Read More...)",70.99499999999999,62.5,99.948650598526,84.04,55.00000000000001,99.64499473571777,2022-09-07
169,The Block,Cowen Digital snags dozens of clients in six months as expansion plans proceed,Cowen Digital has been onboarding dozens of clients since launching in March. (Read More...),50.0,50.0,99.65363442897797,50.0,62.5,99.03434216976166,2022-09-07
170,CryptoGlobe,How $ETH Holders Can Receive Free $ETHW Tokens From a Post-Merge PoW Fork,"A group of miners and developers are planning to fork the Ethereum blockchain after the Merge upgrade, which is expected to take place between September 13 and September 15, as a result of which $ETH holders could get $ETHW tokens via an airdrop. As you probably already know, the Merge marks the ... (Read More...)",75.53,70.0,4.34328019618988,50.0,60.0,0.0144273042678833,2022-09-07
171,Crypto Daily,Binance To Delist USDC From Spot Trading Pairs,"Binance has announced that it will be removing the USDC stablecoin from the platform’s spot trading pairs list, along with two other stablecoins. USDC, USDP, TUSD Delisted The other stablecoins being delisted along with USDC are USDP and TUSD. Binance, the world’s largest crypto exchange by tradi... (Read More...)",50.0,50.0,0.0014424324035644531,50.0,54.166666666666664,0.02784430980682373,2022-09-07
172,Finbold,"Over 3,600 crypto-related U.S. trademark applications filed in 2022 beating entire 2021","As the cryptocurrency industry grows, so does one significant component of it that is increasingly being used by businesses and... Continue reading (Read More...)",27.060000000000002,50.0,97.29856550693512,63.239999999999995,71.875,97.41981029510498,2022-09-07
173,Cointelegraph,Crypto investment product firm 21.co raises $25M to reach $2B valuation,"Founded during the major market slump of 2018, 21Shares holds its vision that solid crypto products only grow stronger during crypto winters. (Read More...)",51.29,40.0,17.29346215724945,81.845,57.03125,79.00952100753784,2022-09-07
174,The Daily Hodl,FTX CEO Sam Bankman-Fried Makes the Case for On-Chain Social Media,"Sam Bankman-Fried, the CEO of crypto derivatives exchange FTX, thinks on-chain social media would offer some unique benefits. The crypto billionaire says on Twitter that the on-chain social media would offer a distinct feature that enables users to verify the authenticity of certain data included... (Read More...)",50.0,51.66666666666667,12.792414426803589,78.595,62.132936507936506,76.36561989784241,2022-09-07
175,BeInCrypto,"Avalanche NFT Marketplaces Are Booming, Aiding AVAX Price Recovery","Avalanche (AVAX) is attempting to create its first higher low since reaching a temporary bottom in June, however it has yet to show any decisive bullish reversal signs. The post Avalanche NFT Marketplaces Are Booming, Aiding AVAX Price Recovery appeared first on BeInCrypto. (Read More...)",50.0,50.0,99.62378442287445,70.095,62.5,1.9428551197052002,2022-09-07
176,CryptoPotato,"ETH at Highest Levels Against BTC Since December 2021, What’s Next? (Ethereum Price Analysis)","Ethereum has resumed its upward trajectory in recent days. This happened after the bears failed to push the price below the support level of $1,420. The positivity is also highlighted by the fact that Ethereum is trading at its highest price against Bitcoin since December 2021. Technical Analysis... (Read More...)",50.0,50.0,3.942808508872986,70.095,50.0,0.48653483390808105,2022-09-07
177,U.Today,"XRP Desperately Trying to Breakthrough: Crypto Market Review, September 6",Not all cryptocurrencies are rallying ahead of Merge update (Read More...),30.910000000000004,20.0,1.136547327041626,50.0,75.0,0.08656978607177734,2022-09-07
178,Bitcoin Magazine,Is Channel Jamming A Threat To Bitcoin’s Lightning Network?,Channel jamming has emerged as a potential attack vector for Bitcoin’s Lightning Network. But does it pose a real threat? (Read More...),23.665000000000003,50.0,0.1038581132888794,11.580000000000002,61.66666666666667,2.624255418777466,2022-09-07
179,Blockworks,21Shares’ Parent Company Valued at $2B After Marshall Wace-led Fundraise,21.co seeks to bolster product suite and global reach as it seeks to expand to a dozen more regions The post 21Shares’ Parent Company Valued at $2B After Marshall Wace-led Fundraise appeared first on Blockworks. (Read More...),72.02,50.0,0.035628676414489746,82.43,65.625,14.955571293830872,2022-09-07
180,CryptoPotato,GreenPower Network and Global Smart Energy Source Provider to Develop NFT and Energy Tracking System,"[PRESS RELEASE – Please Read Disclaimer] With an official public launch scheduled for later this year, GreenPower Network lays out how GPN members can use the use-to-earn metaverse platform as a vehicle for daily rewards. The newest X-to-Earn app release encompasses the social, competitive, gamif... (Read More...)",85.48,55.35714285714286,99.91849958896637,86.345,55.333333333333336,82.14438259601593,2022-09-07
181,Bitcoinist,Crypto’s 1st VR All-Girl Idol Group ‘Fantasia’ Set For Debut In X World Games,"Crypto and the metaverse – and yes – virtual reality featuring cute girls, they share lots of interesting stuff. Just when you thought you’ve seen it all in the virtual reality scene, now you can rave and be in a fan girl mode, with this new all-girl idol group, in the X World Games metaverse. […] (Read More...)",50.0,50.0,99.47296380996704,94.895,70.45454545454545,99.98135566711426,2022-09-07
182,NullTX,Coincheck Cryptocurrency Exchange Review 2022,"Founded in 2012, Coincheck is a well-known cryptocurrency exchange headquartered in Tokyo, Japan. It features professional-grade charting software and blocks transactions for higher rates for more skilled traders. Coincheck’s security measures include storing customer assets in cold wallets, coop... (Read More...)",50.0,50.0,94.25251185894012,64.8,61.5,99.74271357059479,2022-09-07
183,Bitcoin.com,"Stablecoin USDN Trades Below $1 Parity for 14 Days in a Row, Token Taps $0.91 Low This Week","Approximately 14 days ago, the stablecoin neutrino usd (USDN) tapped a high of $0.994 per unit, and ever since then, USDN has not been able to rise above the $0.97 per unit range. The dollar-pegged asset is associated with the Waves blockchain protocol, and recently the Neutrino Protocol decided ... (Read More...)",36.34,50.0,0.0036537647247314453,68.06,56.333333333333336,0.0012278556823730469,2022-09-07
184,Bitcoin Magazine,"Human Rights Foundation Donates $325,000 In BTC For Bitcoin Development","HRF made eight donations in BTC to further censorship-resistance, open-source solutions, Bitcoin Core development and other initiatives in the ecosystem. (Read More...)",50.0,50.0,21.754354238510132,58.894999999999996,56.25,18.32680106163025,2022-09-07
185,Crypto Daily,Phemex: The Power of Low Crypto Trading Fees and Most Optimal VIP program ,"While the profits can certainly be impressive, crypto trading can be an expensive investment vehicle. Besides the cost of buying a token itself (a single bitcoin will set you back thousands of dollars even in a bear market), there are other associated fees, many of which are paid to the exchange ... (Read More...)",85.94,62.5,99.99204277992249,91.125,59.31122448979592,0.14078915119171143,2022-09-07
