,source,title,excerpt,vader_sentiment_title,tb_sentiment_title,flair_sentiment_title,vader_sentiment_excerpt,tb_sentiment_excerpt,flair_sentiment_excerpt,date
264,CoinDesk,Privacy Focused Monero Plans Hard Fork in July; XMR Surges 11% on ‘Monerun’,The hard fork would see version fifteen of Monero launched with several upgrades for improved security. (Read More...),64.8,35.416666666666664,10.56322157382965,84.04,53.47222222222222,1.7738819122314453,2022-04-20
265,Decrypt,Terra’s LUNA Soars 17% Amid Wider Crypto Market Recovery,"LUNA is significantly outperforming the broader crypto market following a massive surge, reclaiming the 8th spot in the rankings. (Read More...)",50.0,50.0,99.51828122138977,50.0,60.9375,90.28022885322571,2022-04-20
266,The Daily Hodl,"Top Analyst Says One Group of Altcoins Can Pull Off 10x Rallies, Updates Outlook on Three Crypto Assets","Crypto trader Michaël van de Poppe is eyeing several crypto assets as well as one blockchain sector that he says is experiencing major adoption. In a new tweet, the popular analyst presents his 584,800 Twitter followers with a chart tracking the price action of decentralized oracle network Chainl... (Read More...)",68.06,75.0,0.4094064235687256,84.04,61.65719696969697,0.7170945405960083,2022-04-20
267,U.Today,243.6 Billion SHIB Scooped Up by Whales As Token Recovers from Recent Fall,Two major whales continue to acquire massive amounts of Shiba Inu as token regained 6% after a recent decline (Read More...),50.0,50.0,11.27961277961731,50.0,57.03125,96.74873054027557,2022-04-20
268,The Block,Blockchain.com aims to go public this year: report,The crypto exchange and wallet service is looking to go public as soon as this year and is having conversations with banks. (Read More...),50.0,50.0,85.81166863441467,50.0,62.5,22.839730978012085,2022-04-20
269,CoinDesk,Ireland's Political Parties to Be Banned From Accepting Crypto: Report,"Political parties in the Republic of Ireland are to banned from accepting donations in cryptocurrency, the Irish Independent reported Tuesday. (Read More...)",65.91,50.0,0.06587207317352295,65.91,56.25,0.04310011863708496,2022-04-20
270,Cryptomode,GADA Sale on KICK.IO – Here’s Everything You Need to Know,"Spring is coming on strong for our launchpad. GADA, the first permissionless and community-governed launchpad ecosystem on Cardano, will launch a sale on KICK.IO on the 20th of April! With the help of two launchpads – GADA Pro and GADA Light – GADA helps various projects to both raise liquidity a... (Read More...)",50.0,50.0,99.34302270412445,91.78,63.19444444444444,99.95450377464294,2022-04-20
271,Crypto Daily,CoinDCX Doubles Valuation In Latest Funding,"The Indian crypto exchange has raised $135 million in its latest funding round, at an over $2 billion valuation, which is double what it was eight months back. Series D Rakes In $135M The 30% crypto tax that went into effect this month does not seem to have affected funding rounds held by Indian ... (Read More...)",50.0,75.0,90.36754965782166,42.345,57.99999999999999,0.009337067604064941,2022-04-20
272,CoinGape,Ripple Vs SEC: XRP Lawyer Explains How Both Sides Could Win,"The U.S. Securities and Exchange Commission (SEC) Vs Ripple lawsuit is approaching its summary judgment this week. Many rumors and speculations regarding the outcome of the case have already made it to the market. John Deaton, an attorney representing XRP token holders in the case has suggested p... (Read More...)",79.295,67.5,83.54312479496002,53.86,61.25000000000001,0.1210242509841919,2022-04-20
273,CryptoPotato,"Green Market Watch: After Dipping to $38K BTC Spiked to $41K, LUNA Up 17%","The crypto market has turned green with a notable $3,000 increase from bitcoin. Terra has soared by 17% to $90. (Read More...)",50.0,40.0,0.04461109638214111,65.91,63.33333333333333,5.55419921875,2022-04-20
274,BeInCrypto,Warren Accuses TurboTax of ‘Scamming Taxpayers’ Over Software,"Senator Elizabeth Warren has accused Intuit of offering products that ""scam American taxpayers into paying for services that should be free."" The post Warren Accuses TurboTax of ‘Scamming Taxpayers’ Over Software appeared first on BeInCrypto. (Read More...)",32.99999999999999,50.0,0.17986297607421875,9.629999999999999,64.375,0.009331107139587402,2022-04-20
275,Cryptomode,Bobcoin: The World’s First Cryptonisation of a For-Profit Social Enterprise,"What is BOBC? The native token of Bob Eco that’s dedicated to fighting poverty and pollution, BOBC is the world’s first cryptonisation of a for-profit social enterprise. Backed up by equity and assets, BBOBC aims to fulfil its mission to prioritise environmental and equal opportunity objectives i... (Read More...)",50.0,57.08333333333333,97.71932661533356,60.114999999999995,59.791666666666664,24.073046445846558,2022-04-20
276,Cryptomode,Do Ripple (XRP) and Cardano (ADA) and Parody Coin (PARO) Show Signs of Doubling?,Ripple (XRP) has seen a strong accumulation between the levels of $0.72 to $0.79 with Cardano (ADA) soon catching up with investors buying huge volumes near the $1 region. Cryptocurrency investors are also accumulating big volumes of Parody Coin (PARO) which is currently in the presale phase. Lon... (Read More...),50.0,50.0,0.0034809112548828125,84.04,64.52380952380952,0.35160183906555176,2022-04-20
277,AMBCrypto,"Is Litecoin lit with MVRV, whales, demand zones showing unbridled ambition","Litecoin has been in a strong correction phase this month like many other top cryptocurrencies after the March rally. However, LTC attempted a recovery rally post 12 April last week, but it was short-lived as the bearish market conditions during the weekend subdued its bullish run. LTC traded at ... (Read More...)",43.6,50.0,84.01203751564026,75.53,65.06944444444444,0.003033876419067383,2022-04-20
278,ZyCrypto,Ethereum Foundation Now Holds $1.6 Billion In Assets Despite Dumping Its ETH At All-Time High,"The Ethereum Foundation, the non-profit organization behind the largest smart contract network, has released a detailed 2021 financial report. While it's barely bedtime reading, the report outlines the... (Read More...)",69.72,57.99999999999999,97.72784113883972,70.095,56.36904761904762,19.61663067340851,2022-04-20
279,U.Today,Atari Token Tanks as Video Game Developer Distances Itself from Cryptocurrency,"Atari and its subsidiaries have severed ties with ICICB Group, sending the token much lower (Read More...)",50.0,30.0,0.13707876205444336,21.405,67.5,0.01646280288696289,2022-04-20
280,CoinDesk,Indian Crypto Exchange CoinDCX Raises Over $135 Million in New Funding Round,"The raise brings CoinDCX's valuation to more than $2 billion, said Rasika Joshi, the company's media relations director. (Read More...)",50.0,48.40909090909091,99.17065501213074,50.0,75.0,80.12508749961853,2022-04-20
281,CoinTelegraph,Ethereum price 'bear flag' could sink ETH to $2K after 20% decline in three weeks,Analysts still expect Ethereum to hold its long-term bullish bias on bets that its highly-anticipated technical upgrade this year will be successful. (Read More...),50.0,50.0,0.0009357929229736328,76.335,70.83333333333334,0.2627849578857422,2022-04-20
282,BeInCrypto,"Bitcoin (BTC) Creates Bullish Candlestick and Shoots Back Above $40,000","Bitcoin (BTC) is showing strong signs of a bullish trend reversal after increasing considerably on April 18 and generating a bullish divergence. The post Bitcoin (BTC) Creates Bullish Candlestick and Shoots Back Above $40,000 appeared first on BeInCrypto. (Read More...)",63.660000000000004,50.0,0.008046627044677734,82.985,60.69444444444444,0.0008046627044677734,2022-04-20
283,Bitcoinist,Brazil’s Crypto Pro Regulation Bill Heading For Key Vote,"The Brazilian crypto market has seen a lot of growth in recent months, and it looks like an ambitious private member’s bill could help regulate this booming business by the end of this June. MP’s will be voting next week Tuesday for whether or not they want to pass regulations that would provide ... (Read More...)",50.0,50.0,93.24328303337097,93.25,57.49999999999999,78.7369579076767,2022-04-20
284,Bitcoin.com,"Survey: Adoption in Argentina Grows, With 12 out of 100 Adults Having Invested in Crypto","Argentinians are very interested in cryptocurrencies, according to a survey made by Americas Markets Intelligence. According to data sourced from the study, more than one in ten Argentinians have made some kind of crypto investment. Furthermore, 18% of the surveyed stated they had an interest in ... (Read More...)",50.0,50.0,0.8650064468383789,92.19500000000001,69.25,4.831212759017944,2022-04-20
285,crypto.news,"Bitcoin Spot ETF Approval is Nigh, Grayscale Investments CEO Beckons","Regulators and financial authorities handling matters on cryptocurrencies have constantly taken a harsh stance toward these virtual assets. However, many believe that the SEC’s approval of a spot exchange-traded fund (ETF) for Bitcoin is only a matter of time. A… (Read More...)",73.83500000000001,50.0,1.0171949863433838,63.660000000000004,55.00000000000001,0.6606400012969971,2022-04-20
286,Cointelegraph,Crypto exchange CoinDCX raises $135M funding to support Indian Web3,"The latest funding round doubled CoinDCX's valuation to $2.15 billion, making it the most-valued crypto company in India. (Read More...)",70.095,50.0,95.35581171512604,50.0,63.33333333333333,99.6817946434021,2022-04-20
287,Crypto Daily,"Moonbirds Make Spectacular Debut, Register $290 Million Worth Of Sales In Four Days","Ethereum-based NFT project Moonbirds has collectors falling over each other. The project registered sales of around $290 million in four days, soaring to the top of trading volume charts and stunning the crypto-sphere. The collection already ranks amongst other hugely successful collections such ... (Read More...)",61.315,72.5,99.95082020759583,89.205,64.28571428571428,99.86813366413116,2022-04-20
288,NewsBTC,Conquering Terrain: Terra’s Stablecoin UST Is Now Crypto’s Third Biggest,"Terra’s US dollar-pegged algorithmic cryptocurrency UST is moving up the ladder and now ranks third in terms of overall market capitalization. Today, the fast-growing Terra USD (UST) stablecoin from the Terra ecosystem passed another pivotal point, reaching a market valuation of more over $17 bil... (Read More...)",50.0,50.0,99.34408664703369,60.114999999999995,65.0,92.9867684841156,2022-04-20
289,U.Today,"Cardano Creator Says Cardano Is Just Starting After Adding 100,000 New Address In Last Month",Charles Hoskinson expects a bright future for the network (Read More...),50.0,52.27272727272727,93.13385784626007,72.02,70.0,3.224003314971924,2022-04-20
290,CoinDesk,UK Crypto Industry Hopes for More Clarity From Planned Stablecoin Rules,A new regulatory package for crypto could clear up some gray areas for digital asset companies around which regulations they should comply with. (Read More...),84.985,75.0,0.7837086915969849,81.245,59.20454545454545,88.8556718826294,2022-04-20
291,CoinGape,Just-In: CoinDCX Raises $135 Mln Despite India’s Crypto Limbo,"Indian crypto exchange CoinDCX said on Tuesday it raised $135 million in its latest funding round. Tech-focussed venture capitalists Pantera and Steadview led the round, with participation from Kingsway, DraperDragon, and Republic. The raise, which was announced in a press release, brings CoinDCX... (Read More...)",50.0,50.0,19.88849639892578,50.0,57.49999999999999,99.83606040477753,2022-04-20
292,CoinDesk,BNB Chain to Burn Over $740M Worth of BNB Tokens,The tokens are expected to burn automatically for the first time this quarter. (Read More...),61.315,65.0,1.015239953994751,50.0,60.83333333333334,0.0001609325408935547,2022-04-20
293,Brave New Coin,How Is Nebeus Improving Its Platform to Help Its Customers in 2022?,The Nebeus crypto lending app announces the integration of seven new cryptocurrencies to its platform in addition to further expansion of its core service offerings in 2022 (Read More...),83.525,50.0,6.241434812545776,50.0,60.60606060606061,99.44460690021515,2022-04-20
294,CoinDesk,Terra’s LUNA Surges 17% as UST Becomes Third Largest Stablecoin,"Terra has also purchased record amounts of Convex tokens in the past month, a research found. (Read More...)",50.0,50.0,97.35372364521027,50.0,57.49999999999999,0.34347474575042725,2022-04-20
295,BeInCrypto,"Japan Looks to Sweden for CBDC Approach, Not China","The Bank of Japan will shape the implementation of its CBDC pilots after Sweden’s steady approach, not China’s large pilot programs. The post Japan Looks to Sweden for CBDC Approach, Not China appeared first on BeInCrypto. (Read More...)",50.0,50.0,0.15953481197357178,50.0,64.13690476190477,0.5036592483520508,2022-04-20
296,CryptoPotato,Solana-based Crypto Wallet Phantom Now Available on Android,"Just months after releasing a mobile application on iOS, Phantom has gone live on Android as well. (Read More...)",50.0,70.0,78.05708944797516,63.660000000000004,65.9090909090909,11.820405721664429,2022-04-20
297,CoinGape,Breaking: Crypto Exchange Blockchain.com Plans U.S. IPO In 2022,Crypto exchange Blockchain.com reportedly intends to file an initial public offering (IPO) with the U.S. Securities and Exchange Commission (SEC) this year. The exchange is currently working with investment banks over the necessary legal and compliance procedures. The planned listing will be the ... (Read More...),50.0,50.0,0.11278986930847168,70.095,54.285714285714285,0.3568202257156372,2022-04-20
298,CryptoPotato,"Ripple Price Analysis: After Disappointing Weekly Close, XRP Facing Huge Resistance","Last week, after the news of Ripple’s complaint to the SEC was released, the price went up by 10%, and the bulls tried to turn the weekly candle green. Despite that, it ended in the red. Technical Analysis Technical analysis by Grizzly The Daily Chart On the daily timeframe, the bears defended th... (Read More...)",38.685,45.0,1.4062762260437012,35.199999999999996,49.5,0.019475817680358887,2022-04-20
299,The Daily Hodl,Billionaire Chamath Palihapitiya Says Solana (SOL) Part of Massive Disruption of Global Payments Industry,"Billionaire investor Chamath Palihapitiya thinks Solana (SOL) will play a part in a market disruption that challenges the financial supremacy of giant payment companies. In a new interview on the All-In Podcast, Palihapitiya says there’s been a surge in activity in the past 90 days in the payment... (Read More...)",31.94,50.0,0.5738228559494019,55.135,53.86363636363636,85.81977188587189,2022-04-20
300,CryptoPotato,Yield App Launches Referral Program,"[PRESS RELEASE – Tallinn, Estonia, 16th April 2022] Digital wealth platform launches program allowing customers to earn up to 1,000 YLD together with their friends Yield App, a global FinTech company and digital asset platform, is thrilled to unveil its hotly anticipated Referral Program, which w... (Read More...)",50.0,50.0,95.29641568660736,94.67,61.25000000000001,99.84492063522339,2022-04-20
301,CryptoPotato,HJH Investments Presents its Tracking Token,"[PRESS RELEASE – Wichita, Kansas, 15th April 2022] As a tracking token for HJH Investments’ real estate holdings, HJH REAL Token is a game-changing innovation. Any trader interested in buying the token needs to download the Coinbase app and add funds. Following this step, it would be necessary to... (Read More...)",50.0,50.0,97.28705883026123,82.43,59.583333333333336,99.86235201358795,2022-04-20
302,CoinDesk,Blockchain.com Could Look at an IPO as Early as This Year: Report,The exchange is looking at a listing after reaching a valuation of $14 billion last month. (Read More...),50.0,55.00000000000001,0.183868408203125,60.114999999999995,62.5,0.011727213859558105,2022-04-20
303,BeInCrypto,Germany Knocks Singapore Off the Top of Crypto-Friendly Countries,Germany is hot in the crypto world. The central European country knocked Singapore off the top spot as the friendliest crypto country. The post Germany Knocks Singapore Off the Top of Crypto-Friendly Countries appeared first on BeInCrypto. (Read More...),60.114999999999995,75.0,1.8947869539260864,86.75500000000001,64.28571428571428,6.038329005241394,2022-04-20
304,AMBCrypto,Ethereum: $300M in non-crypto assets and here’s why you should give an “EF”,"It’s that time of year when you squint at your receipts and tax forms to better understand your financial habits. If that sounds daunting, you can rest assured that even those who run crypto projects are doing something along similar lines. To that end, when the Ethereum Foundation published its ... (Read More...)",58.894999999999996,50.0,21.561437845230103,82.985,62.5,77.50653326511383,2022-04-20
305,Bitcoinist,Singapore’s Ride-hailing App Turns to Request Finance to Expand its Crypto Payments Offering,"Ryde, the ride-sharing app, is ramping up its crypto payments capability with Request Finance, allowing it to expand the options for its users to top up their in-app Ryde wallets. Besides, it is also launching an NFT project. Launched in 2014, this Singapore-based ride-hailing company today boast... (Read More...)",65.91,50.0,1.4487862586975098,77.86999999999999,75.0,99.38573837280273,2022-04-20
306,The Block,"Indian crypto exchange CoinDCX raises $135 million, now valued at $2.15 billion",Indian cryptocurrency exchange CoinDCX raised over $135 million in a Series D funding round led by Pantera Capital and Steadview. (Read More...),72.02,50.0,0.6770819425582886,50.0,57.49999999999999,24.23403263092041,2022-04-20
307,CoinGape,Here’s How Traders Are Pumping Monero (XMR) Prices To 6-Mth Highs,"Privacy token Monero (XMR) saw a large price surge in the past 24 hours, and was among the best performing cryptocurrencies. Its latest gains appear to be driven by a liquidity squeeze initiated by some holders of the token. XMR jumped 10% in the past 24 hours to $267.65- its highest level since ... (Read More...)",50.0,50.0,0.07983744144439697,88.25,64.28571428571429,99.56550002098083,2022-04-20
308,Forkast.News,"India’s crypto shakedown be damned, CoinDCX raises $135 million","Indian cryptocurrency exchange CoinDCX’s latest funding comes as investors double down on the country’s potential to emerge as the world’s top market despite government apathy. See related story: CoinDCX’s Sumit Gupta on CBDCs, regulation and India’s potential for crypto in 2021 Fast facts Series... (Read More...)",20.705000000000002,50.0,76.79553627967834,69.975,58.58024691358025,13.718485832214355,2022-04-20
309,BeInCrypto,Federal Reserve Monetary Meddling Will Push Crypto and Gold Higher: Economist,A well-renowned economist has predicted that the Federal Reserve interest rate hikes could push safe-haven assets such as Bitcoin and gold up in value. The post Federal Reserve Monetary Meddling Will Push Crypto and Gold Higher: Economist appeared first on BeInCrypto. (Read More...),50.0,62.5,6.56069815158844,86.345,62.5,1.8909811973571777,2022-04-20
310,CryptoPotato,Whales Bought the Dip as Bitcoin Reclaims $40K: Analyst,A massive outflow volume potentially corresponds to strong buying interests from whales. (Read More...),50.0,50.0,0.5274146795272827,82.43,61.66666666666667,84.11277830600739,2022-04-20
311,crypto.news,Mina (MINA): Expanding Computational Requirements for dApps,"Mina (MINA), a minimalistic blockchain protocol used for optimizing computational requirements, offers new standards of security and decentralization for dApps’ users and developers. (Read More...)",50.0,50.0,99.87510144710541,82.985,62.272727272727266,99.73172545433044,2022-04-20
312,crypto.news,Crypto Firm Blockchain.com Strategizes to Roll Out Its IPO This Year,"According to Bloomberg, which first reported the move, the firm's flotation could happen as soon as before the end of 2022. However, the IPO may be delayed until 2023, and these plans could also change, according to a report described by credible sources. The company's representative declined to ... (Read More...)",50.0,40.0,81.75217509269714,38.685,61.875,0.02307891845703125,2022-04-20
313,Forkast,Hyundai Motor drives into metaverse branding with Meta Kongz NFT project,"Hyundai Motor plans to support its own non-fungible token (NFT) community with an initial token release in collaboration with Meta Kongz this week, and a dedicated NFT website to launch in May. See related article: 20,000 line up for South Korean convenience store’s NFTs on White Day Fast facts H... (Read More...)",50.0,50.0,91.5888100862503,84.53999999999999,60.83333333333334,93.09947788715363,2022-04-20
314,Bitcoinist,WonderFi To Buy Second Canadian Crypto Exchange For $38 Million,"WonderFi Technologies, based in Vancouver, has sealed an agreement to purchase another licensed Canadian cryptocurrency platform, less than a month after completing its takeover of Bitbuy Technologies. WonderFi, a tech company that gives financial services access via DeFi, intends to continue its... (Read More...)",50.0,50.0,2.4841278791427612,74.695,55.55555555555556,0.04859566688537598,2022-04-20
315,Cointelegraph,Crypto startup Blockchain dot com planning 2022 IPO,Blockchain.com would be just the second crypto exchange to go public in the U.S. if it can perform an IPO before Binance.US which is attempting to do the same. (Read More...),50.0,50.0,84.34949219226837,50.0,56.25,0.15744268894195557,2022-04-20
316,Cointelegraph,Animoca Brands buys major stake in Aussie digital services agency,Be Media has begun an aggressive hiring process in the fields of blockchain development and project management following the acquisition. (Read More...),50.0,51.5625,2.1522462368011475,42.345,62.5,98.30656051635742,2022-04-20
317,U.Today,Crypto Veteran Blockchain.com on Track to Have IPO This Year,Blockchain.com may become the latest major company to go public (Read More...),50.0,50.0,99.75790679454803,50.0,63.28125,4.7903746366500854,2022-04-20
318,Cointelegraph,Ireland bans political crypto donations on foreign interference fears,A raft of new political and electoral integrity laws proposed in Ireland will see the banning of donations made in crypto to political parties in the country. (Read More...),28.925,46.875,0.391116738319397,82.43,57.95454545454546,0.13983845710754395,2022-04-20
319,Bitcoin.com,"Digital Ruble ‘Much Needed,’ Russia’s Central Bank Says, Won’t Delay Testing","The Central Bank of Russia has emphasized the importance of moving forward with its digital ruble project. According to a statement by a top representative, the monetary authority has no intention to delay the trials despite not all invited banks being ready to participate yet. Bank of Russia to ... (Read More...)",34.089999999999996,53.333333333333336,97.5204586982727,69.08999999999999,62.0,13.41804563999176,2022-04-20
320,Bitcoin.com,GADA Sale on KICK․IO – Here’s Everything You Need to Know,"PRESS RELEASE. Spring is coming on strong for our launchpad. GADA, the first permissionless and community-governed launchpad ecosystem on Cardano, will launch a sale on KICK.IO on the 20th of April! With the help of two launchpads – GADA Pro and GADA Light – GADA helps various projects to both ra... (Read More...)",50.0,50.0,78.10719013214111,91.78,63.19444444444444,99.94983971118927,2022-04-20
321,CoinGape,"Unlike China, the Bank of Japan is Not Willing to Conduct Large Scale Pilot Tests for Digital Yen","Central banks worldwide have accelerated the developments when it comes to building their own central bank digital currencies (CBDCs). However, the Bank of Japan is not willing to press ahead with its plan of having a Digital Yen in the market. The Janpenese central bank recently said that it wou... (Read More...)",50.0,51.488095238095234,1.7008066177368164,50.0,55.41666666666667,11.155891418457031,2022-04-20
322,Bitcoinist,The Nightly Mint: Daily NFT Recap,"Moonbirds went from mint to moon. The project has been the talk of the town since we left you last week, skyrocketing to a 20 ETH floor and serving out over $200M worth of sales volume. Let’s break down that story and more in our bite-sized weekday report, The Nightly Mint. The Nightly Mint Lates... (Read More...)",50.0,50.0,97.78788983821869,61.315,59.53703703703703,99.79511797428131,2022-04-20
323,CryptoSlate,North Korean hackers are targeting leading crypto organizations,"Arthur Cheong, the founder of DeFiance Capital, believes North Korean hackers are actively looking to compromise top crypto organizations. (Read More...)",50.0,50.0,0.15775561332702637,73.83500000000001,64.44444444444444,0.12504756450653076,2022-04-20
324,Cointelegraph,Ethereum Foundation treasury expands non-crypto assets to 19%,"The foundation that oversees and funds developments on the Ethereum network has disclosed its total holdings, which include a sizable fifth in non-crypto assets. (Read More...)",72.02,50.0,83.78871381282806,58.894999999999996,62.5,99.56901371479034,2022-04-20
325,BeInCrypto,"Teens: With Money to Invest in Their Future, What Would They Buy?","Teens and crypto: Kids aged 13 to 17 with money to invest would spend differently to their parents. So where is crypto in this mix? The post Teens: With Money to Invest in Their Future, What Would They Buy? appeared first on BeInCrypto. (Read More...)",50.0,50.0,3.0059337615966797,50.0,56.49999999999999,0.015747547149658203,2022-04-20
326,Bitcoinist,Could Musk Fix This? Blue Checked NFT Scams Swamp Twitter,"The crypto and NFT side of Twitter are flooding with scams. It only takes a few interactions to get your first “@Elonmusk_ started following you” notification. And if you ever reply to the tweet of a trader, dev, etc, then expect at least one of these fake bots asking you to ‘DM’ them. Most users... (Read More...)",20.705000000000002,50.0,0.003445148468017578,10.775000000000002,51.5625,0.0005781650543212891,2022-04-20
