,source,title,excerpt,vader_sentiment_title,tb_sentiment_title,flair_sentiment_title,vader_sentiment_excerpt,tb_sentiment_excerpt,flair_sentiment_excerpt,date
62,Crypto Daily,MetaMask vs Coinbase Wallet - Which Wallet is Better?,Table of Content 1. What is MetaMask Wallet? MetaMask Wallet Overview 1.1. General Wallet Info 1.2. Main Functionality 1.3. Platforms and Features 1.4. User's rates and reviews 2. MetaMask Wallet Pros &amp; Cons 2.1. MetaMask Pros 2.2. MetaMask Cons 3. What is Coinbase Wallet? Coinbase Wallet Ove... (Read More...),72.02,75.0,0.029218196868896484,50.0,61.94444444444444,10.624486207962036,2022-08-24
63,Blockworks,MakerDAO Opens $100M DAI Loan to Huntingdon Valley Bank,The MakerDAO loan to Huntingdon Valley Bank marks the first integration between a decentralized finance protocol and a traditional bank The post MakerDAO Opens $100M DAI Loan to Huntingdon Valley Bank appeared first on Blockworks. (Read More...),50.0,50.0,3.996977210044861,50.0,62.5,90.0610476732254,2022-08-24
64,ZyCrypto,"Bitcoin Basher Peter Schiff Pounces Again, Warns BTC Doomed For Another Terrifying Crash","Peter Schiff, one of bitcoin’s most notorious bears, is sticking by his prediction that the benchmark cryptocurrency is on the verge of more bloodletting. (Read More...)",4.994999999999999,0.0,0.30193328857421875,25.365,75.0,0.4399299621582031,2022-08-24
65,Cointelegraph,China begins next phase of CBDC testing with e-CNY payment for public transport,Scan and pay with e-CNY is now available in multiple Chinese cities for citizens looking to ride their local buses and subways. (Read More...),50.0,50.0,22.755655646324158,44.865,59.0,84.77516174316406,2022-08-24
66,U.Today,Nearly Half of Americans Have Heard of NFTs,"Still, only a minuscule share of Americans has invested in non-fungible tokens despite their skyrocketing popularity (Read More...)",50.0,41.66666666666667,82.0490688085556,45.45,62.5,0.7639497518539429,2022-08-24
67,Crypto Daily,Party In The Metaverse: Miley Cyrus Registers NFT Trademark,"Musical artist Miley Cyrus showed interest in joining the metaverse as she applied for two trademark registrations. From Music To Metaverse Miley is no stranger to the metaverse as she has featured previously in Gucci Town by Roblox. In her latest metaverse initiative, however, she is taking more... (Read More...)",70.095,50.0,92.60740578174591,60.114999999999995,63.33333333333333,3.239208459854126,2022-08-24
68,The Daily Hodl,"Trading Bot Known for Beating Crypto Markets Allocates to Solana (SOL), Cardano (ADA), and One More ETH Rival",A trading robot that’s garnered a reputation for outperforming the markets is unveiling its newest portfolio allocations as most cryptocurrencies try to recover from a week-long slump. Every week the Real Vision Bot conducts surveys while compiling algorithmic portfolio assessments that generate ... (Read More...),27.060000000000002,75.0,0.801396369934082,62.5,70.0,0.6114423274993896,2022-08-24
69,BeInCrypto,Bitcoin (BTC) Will Not Reach New ATH Until 2025 – 7991 People Poll,"According to the results of a survey released today, 47% of respondents believe that Bitcoin (BTC) will not reach a new ATH until 2025. This result reflects the extremely pessimistic sentiment of cryptocurrency market participants, which is further confirmed by data from Google Trends. The post B... (Read More...)",49.045,56.81818181818181,0.15805959701538086,28.290000000000003,59.11363636363637,0.3867238759994507,2022-08-24
70,The Block,Celsius sues Prime Trust for the return of $17 million,The lawsuit stems from a disagreement over how much Prime Trust owes Celsius after the termination fo their relationship. (Read More...),75.53,50.0,0.09050071239471436,48.71,67.5,0.07176697254180908,2022-08-24
71,CoinGape,"Bitcoin Price Analysis: BTC Holds Key Support At $21,300; Hold Or Exit?","Bitcoin price analysis implies an extended consolidation with a bearish bias. For the past few hours, the price is trading in green and is attempting to scale up to $21,750. The seller looks for fresh participation to roll down the price further. BTC continues to harness a support zone after book... (Read More...)",70.095,50.0,8.144938945770264,77.86999999999999,49.96031746031746,0.05021393299102783,2022-08-24
72,Decrypt,"Coinbase Hit With $5M Lawsuit Over Exchange Crashes, Alleged Securities Violations",The San Francisco-based exchange is facing yet another lawsuit from a disgruntled customer. (Read More...),26.165,45.0,0.019481778144836426,38.685,75.0,0.01800060272216797,2022-08-24
73,The Block,"Celsius countersues KeyFi, former employee for being ‘thieves’","Celsius filed a complaint against the former head of its staking subsidiary and the firm it acquired, KeyFi. (Read More...)",50.0,50.0,0.11060237884521484,35.199999999999996,50.0,0.042444467544555664,2022-08-24
74,AMBCrypto,NFT lending platform BendDAO initiates vote to alter protocol,"Ripples of the credit crisis that affected several crypto-exchanges are now being felt in the NFT space. Popular NFT-based lending platform BendDAO has now initiated a vote to approve emergency changes. This, in a bid to avert what experts are describing as a “death spiral” for the NFT market. In... (Read More...)",50.0,50.0,83.58301520347595,22.13,68.33333333333333,96.35791182518005,2022-08-24
75,Cryptomode,Consumer Goods Have Become Over 100% More Expensive In Bitcoin This Past Year,"The ongoing bearish pressure affecting bitcoin has created some interesting metrics. The price of consumer goods – when depicted in BTC – has changed dramatically in the past year. However, all of that can be wiped off the chart once BTC becomes bullish again. Consumer Goods Become Cheaper In Bit... (Read More...)",50.0,45.83333333333333,0.6605535745620728,68.06,62.5,0.022163987159729004,2022-08-24
76,CryptoPotato,How a Hacker Lost His ETH While Attacking Rainbow Bridge,"Aurora Labs’ security system warded off yet another bridge attack, slashing the attacker of $8,000 worth of ETH in the process. (Read More...)",17.570000000000004,50.0,0.3975480794906616,15.960000000000003,70.0,0.06031990051269531,2022-08-24
77,NullTX,"While Holding the $21K Level, Bitcoin’s Price Fluctuates With An Increased Trading Volume","The bitcoin market today is still unchanged, and the price continues trading in the same range. Little has changed in the price of Bitcoin and Ethereum during the last day. The price of BTC holds support despite falling to a low of around $21k last week. The increase in trading volume raises the ... (Read More...)",63.660000000000004,50.0,93.07788014411926,86.99,52.604166666666664,99.8727947473526,2022-08-24
78,Crypto Briefing,Celsius Counter-Sues KeyFi for Tens of Millions,Celsius is accusing KeyFi of stealing and mismanaging funds during their former partnership. Many Tens of Millions in Cryptocurrencies Celsius is counter-suing its former partner. The struggling crypto lending company... (Read More...),50.0,50.0,0.03834366798400879,9.899999999999999,62.5,0.06079971790313721,2022-08-24
79,CryptoBriefing,Celsius Counter-Sues KeyFi for Tens of Millions,"Celsius is accusing KeyFi of stealing and mismanaging funds during their former partnership. Celsius is counter-suing its former partner.The struggling crypto lending company filed a lawsuit today against decentralized finance (DeFi) strategy firm KeyFi and its CEO Jason Stone, claiming that KeyF... (Read More...)",50.0,50.0,0.03834366798400879,7.790000000000003,53.75,0.04340708255767822,2022-08-24
80,Decrypt,'Privacy is Normal': Rep. Tom Emmer Wants Answers About Tornado Cash Ban,The Treasury’s recent ban on Ethereum mixing service Tornado Cash has a U.S. Representative asking tough questions. (Read More...),22.13,58.75,80.30728101730347,18.755,51.85185185185185,0.8030623197555542,2022-08-24
81,Ethereum World News,Celsius Claims KeyFi Stole Million Of Dollars And Laundered Crypto Through Tornado Cash In New Filing,Summary: Celsius claims that KeyFi stole millions in crypto from the now-bankrupt crypto lender. The company’s filing claims that KeyFi CEO Jason Stone mismanaged and embezzled Celsius digital assets on several occasions. Stone is also accused of using company coins to purchase NFTs like Crypto P... (Read More...),50.0,56.81818181818181,0.055989623069763184,62.5,58.333333333333336,0.003606081008911133,2022-08-24
82,Protos.com,Voyager creditors say the firm should be culling staff not bribing them to stay,The Official Committee of Unsecured Creditors of Voyager Digital says it “vehemently opposes” plans to pay workers to not seek new jobs. (Read More...),50.0,40.0,0.6129473447799683,27.060000000000002,60.60606060606061,0.24657249450683594,2022-08-24
83,CryptoPotato,Crypto Startup Lyra Brings Crypto Spending to Millions of Merchants,"[PRESS RELEASE – Please Read Disclaimer] Now you can create and use Visa cards on demand using the most popular cryptocurrencies. Lyra has announced the launch of its new platform, which allows users to spend their cryptocurrency in any of the millions of online merchants worldwide. These include... (Read More...)",50.0,50.0,94.72723007202148,85.89,71.70454545454545,94.9957937002182,2022-08-24
84,Cryptomode,The X.LA Metaverse Revealed In Detail,"Cologne, Germany, 23rd August, 2022, Chainwire X.LA Foundation executive Aleksey Savchenko has revealed details of the eagerly anticipated X.LA Metaverse. Before an expectant crowd at Gamescom in Cologne, Germany, Savchenko promised an immersive experience, delineating a vision backed by technolo... (Read More...)",50.0,50.0,99.98517334461212,86.75500000000001,75.0,99.94159042835236,2022-08-24
85,Crypto Daily,The X.LA Metaverse Revealed In Detail,"Cologne, Germany, 23rd August, 2022, ChainwireX.LA Foundation executive Aleksey Savchenko has revealed details of the eagerly anticipated X.LA Metaverse. Before an expectant crowd at Gamescom in Cologne, Germany, Savchenko promised an immersive experience, delineating a vision backed by technolog... (Read More...)",50.0,50.0,99.98517334461212,86.75500000000001,75.0,99.93149638175964,2022-08-24
86,Cointelegraph,"Celsius, 3AC demonstrated why financial infrastructure should move on-chain","Instead of operating in darkness, more players in the financial industry should move their transactions to the blockchain, where every move is public. (Read More...)",50.0,50.0,4.437547922134399,37.5,62.5,15.576612949371338,2022-08-24
87,NewsBTC,Bearish Indicator: Bitcoin Retail Volumes Show Weakness In Rally,"The decline in the price of bitcoin following the rally has unearthed some underlying weaknesses that were not easily seen before. The run-up and eventual rundown from $25,000 have shown that retail investors are not as moved by the market as expected. Even now, transaction volumes for retail inv... (Read More...)",28.925,50.0,0.029957294464111328,22.610000000000003,52.29166666666667,0.06673932075500488,2022-08-24
88,Bitcoinist,Here’s How Many Wallets Is Needed For Bitcoin To Be An Inflation Hedge,"One of bitcoin’s main selling points has been the fact that its return has often put it ahead of the inflation rate. Due to this, it has gained notoriety as the “digital gold” as a good portion of the community put forward that the digital asset is a better inflation hedge than any asset. However... (Read More...)",50.0,75.0,0.13483762741088867,95.405,62.44047619047619,79.47633862495422,2022-08-24
89,Bitcoin Magazine,The Scaling Problem For Lightning Lab’s Taro On The Bitcoin Blockchain,"While Taro could bring interesting developments to Bitcoin, the impacts on the bitcoin fee market and the scaling issues this will cause are unclear. (Read More...)",29.905000000000005,50.0,79.82767820358276,58.894999999999996,75.0,0.6964534521102905,2022-08-24
90,Cryptonews,"MEW Launches NFT Manager, Hodlnaut Denies Police Investigation, Influencer Hodlonaut Receives BTC 52 in Donations Ahead of 'Faketoshi' Battle + More News","Get your daily, bite-sized digest of cryptoasset and blockchain-related news – investigating the stories flying under the radar of today’s crypto news. __________... Read More: MEW Launches NFT Manager, Hodlnaut Denies Police Investigation, Influencer Hodlonaut Receives BTC 52 in Donations Ahead ... (Read More...)",17.015,75.0,15.28157889842987,28.925,66.66666666666666,1.2128323316574097,2022-08-24
91,crypto.news,SK Networks Plunges $3 Million Into Com2Verse For Metaverse Development,"Since its inception, the metaverse concept has continued to elicit reactions from companies looking to venture into the virtual landscape. SK Networks has partnered with the South Korean metaverse developer, Com2Verse, to further explore opportunities in the ecosystem. SK Networks… (Read More...)",50.0,50.0,5.2717506885528564,69.08999999999999,62.5,99.77805018424988,2022-08-24
92,BeInCrypto,Metaverse Platform Ready Player Me Closes $56M Series B Round,"Ready Player Me, a cross-game avatar platform that enables users to explore the metaverse, has closed a $56 million Series B round led by Andreessen Horowitz (a16z). The post Metaverse Platform Ready Player Me Closes $56M Series B Round appeared first on BeInCrypto. (Read More...)",68.06,50.0,5.871221423149109,80.62,54.642857142857146,3.021720051765442,2022-08-24
93,Blockworks,Celsius Alleges Prime Trust Owes $17M In New Lawsuit ,"As it continues to work through its bankruptcy proceedings, Celsius is attempting to regain $17 million in assets it claims it is owed The post Celsius Alleges Prime Trust Owes $17M In New Lawsuit appeared first on Blockworks. (Read More...)",67.0,56.81818181818181,0.1202017068862915,73.83500000000001,64.77272727272727,0.0071942806243896484,2022-08-24
94,The Daily Hodl,"Tornado Cash Used to Obfuscate Over $2,440,000,000 Worth of Ethereum (ETH) in First Half of 2022: Report","Crypto traders relied on digital asset mixing service Tornado Cash to conceal billions of dollars worth of Ethereum (ETH) in the first six months of the year. According to a new report from blockchain security firm SlowMist, users deposited 955,277 ETH worth $2.44 billion to Tornado Cash across t... (Read More...)",61.315,56.388888888888886,0.15158355236053467,88.58500000000001,59.18831168831169,0.02250969409942627,2022-08-24
95,Bitcoinist,Why This U.S. Congressman Condemned Tornado Cash Sanctions,"U.S. Congressman Tom Emmer sent a letter to Secretary of the Treasury Janet Yellen regarding the sanctions imposed on the Ethereum decentralized exchange Tornado Cash. The government official called the measures “unprecedented” as they targeted a technology, not an individual or entity. Related R... (Read More...)",27.98,50.0,0.25039613246917725,56.400000000000006,63.74999999999999,0.0393986701965332,2022-08-24
96,Blockworks,BendDAO Proposes Emergency Changes During Liquidity Crisis,The NFT lending protocol is running out of ether The post BendDAO Proposes Emergency Changes During Liquidity Crisis appeared first on Blockworks. (Read More...),11.414999999999997,50.0,86.45583987236023,11.414999999999997,68.75,0.007796287536621094,2022-08-24
97,CryptoSlate,"Crypto community balks at SEC Chair Gensler’s assertion that regulation for capital markets, crypto should be same","A recent tweet from SEC Chair Gary Gensler clarified his position on crypto markets, saying they should be treated the same as other capital markets, regardless of digital assets using “different technology.” “There’s no reason to treat the crypto market differently from the rest of the capital m... (Read More...)",50.0,47.5,1.91689133644104,64.8,51.71875,2.752608060836792,2022-08-24
98,Bitcoin.com,"Terra’s 2 Classic Coins Mysteriously Spike in Value, USTC Climbs 42% Higher in 24 Hours","During the last 24 hours, crypto asset prices have improved as the global cryptocurrency market capitalization today has risen 1.9% to $1.07 trillion. Interestingly, the two so-called ‘defeated’ Terra blockchain tokens, now called terraclassicusd (USTC) and luna classic (LUNC), have seen signific... (Read More...)",67.0,56.94444444444444,17.48216152191162,90.36999999999999,61.66666666666667,24.073705077171326,2022-08-24
99,The Daily Hodl,"Post Voyager Announces the Launch of Jellyme, MOOI Network’s NFT Marketplace","August 23, 2022 – Singapore, Singapore Post Voyager, a blockchain arm of a Japanese mobile game powerhouse Cocone and a developer of the MOOI Network, announced on Monday the launch of its non-fungible token (NFT) marketplace, Jellyme. Jellyme is described as a “decentralized NFT marketplace that... (Read More...)",50.0,50.0,98.73357117176056,50.0,51.66666666666666,18.782463669776917,2022-08-24
100,AMBCrypto,"Au Revoir Ethereum, Chiliz [CHZ] has relied enough on you","Many cryptocurrencies, on multiple occasions, have followed Bitcoin [BTC] where price plunges are concerned. It was almost the same between 17 August and 18 August when the latest capitulation happened as BTC fell from $24,000. Chiliz [CHZ], the social engagement fan token, did accompany Bitcoin ... (Read More...)",50.0,50.0,77.13927924633026,82.43,62.77777777777778,0.0064432621002197266,2022-08-24
101,CoinGape,ETH Price Analysis: Bullish Hopes Resurface With This Reversal Pattern,"The Ethereum(ETH) price dropped by 20% last week after facing resistance at the overhead resistance of $2000. However, the buyers regain the trend control at $1600 and prepare another bullish launchpad to drive the prices higher above the $2000 mark. So, should you consider turning bullish for Et... (Read More...)",71.075,50.0,1.4938503503799438,50.0,59.375,0.006753206253051758,2022-08-24
102,BeInCrypto,Bitcoin (BTC) on-Chain Analysis: Mining Indicators Give Bottoming Signals,"Be[in]Crypto takes a look at Bitcoin (BTC) on-chain indicators that relate to miners, more specifically, the difficulty ribbon compression and the Market Cap to Thermocap Ratio The post Bitcoin (BTC) on-Chain Analysis: Mining Indicators Give Bottoming Signals appeared first on BeInCrypto. (Read More...)",50.0,50.0,3.127354383468628,30.264999999999997,70.83333333333334,6.218862533569336,2022-08-24
103,Cointelegraph,"Plaintiff in Coinbase lawsuit raises issues of account lockouts, crypto as a security","A Coinbase user claimed the crypto exchange ""boldly flouts federal and state laws"" by not completing the proper registration as a securities exchange in the United States. (Read More...)",56.400000000000006,50.0,0.19927024841308594,87.895,63.888888888888886,0.007271766662597656,2022-08-24
104,U.Today,"Binance Announces XRP Rewards, 111 Trillion SHIB Could be Burned in Months, John Deaton Predicts Shocking Thing about Ripple Lawsuit: Crypto News Digest by U.Today",U.Today’s crypto news digest will not let you miss any of the industry’s most important events! (Read More...),43.6,0.0,0.8649677038192749,71.35000000000001,75.0,99.12697076797485,2022-08-24
105,Crypto Daily,Crypto Community Protests Arrest Of Tornado Cash Developer,"The arrest of Tornado Cash developer Alexey Pertsev in the Netherlands has resulted in widespread protests in the community. #FreeAlex Snowballs Roughly a week earlier, Dutch law enforcement authorities arrested one of the developers of the infamous Tornado Cash app, Alexey Pertsev, on charges of... (Read More...)",24.47,47.5,0.2085477113723755,9.120000000000001,48.5,0.28901100158691406,2022-08-24
106,Crypto Briefing,"SudoRare Pulled the Rug for $820,000. How Will Kraken Respond?","As a U.S.-based regulated exchange, all Kraken customers are required to submit identification as part of mandatory Know Your Customer checks. SudoRare Attack Demands Answers The team behind the SudoRare... (Read More...)",50.0,50.0,3.840431571006775,28.925,52.5,22.474756836891174,2022-08-24
107,CryptoBriefing,"SudoRare Pulled the Rug for $820,000. How Will Kraken Respond?","As a U.S.-based regulated exchange, all Kraken customers are required to submit identification as part of mandatory Know Your Customer checks. The team behind the SudoRare NFT exchange stole $820,000 and vanished early Tuesday, but thanks to the public nature of the blockchain, the attackers left... (Read More...)",50.0,50.0,3.840431571006775,36.915,53.333333333333336,0.02849400043487549,2022-08-24
108,Cryptomode,Nine Chronicles announces the launch of their PFP NFT project,"Nine Chronicles, a fully decentralized role-playing fantasy game based on Norse Mythology, has announced the launch of its PFP NFT project called D:CC (De:Centralized Cat). The project is part of Nine Chronicle’s plan to give users an altered identity in their multiverse where players can immerse... (Read More...)",50.0,50.0,99.94521141052246,50.0,52.5,99.67448711395264,2022-08-24
109,Ethereum World News,"Crypto Rugpull Alert: SudoRare NFT Exchange Disappears After Stealing $800,000 Worth Of User Funds","SudoRare NFT exchange has abandoned its project and has stolen nearly $800,000 worth of user funds. The project went offline within six hours of launching and has also erased all of its official social media accounts An NFT exchange dubbed SudoRare has disappeared after scamming and draining user... (Read More...)",27.060000000000002,65.0,0.01589059829711914,11.414999999999997,61.66666666666667,0.000762939453125,2022-08-24
110,CoinGape,Tezos Price Analysis: XTZ Bounces Back Toward $1.60; Is Correction Over?,"The Tezos price analysis indicates a modest gain amid discount buying opportunities. The price is fetching some fresh buying interest as the sellers seemed exhausted near $1.50. However, the upside is capped at $1.60 in the short-term time frame. The longer the price stayed below this level, the ... (Read More...)",50.0,50.0,0.042444467544555664,91.58,56.00000000000001,0.01284778118133545,2022-08-24
111,Cryptomode,"Chronoly.io (CRNO) Sustains 560% growth, while Uniswap (UNI), Solana (SOL) Present Glimpse of Recovery","The highly volatile cryptocurrency market is home to a wide range of projects. Due to the high volume of projects on the market, both newbies and experienced investors are constantly on the lookout for tokens or projects they can include in their portfolios for stability. Adding tokens with littl... (Read More...)",69.08999999999999,50.0,99.03445243835449,50.0,59.964285714285715,99.59278106689453,2022-08-24
112,Bitcoinist,Telegram Founder Suggests Auctioning Usernames As NFTs To 700 Million Users,"Telegram Founder Pavel Durov has come up with an idea that millions of the service’s usernames and addresses can be auctioned off as NFTs. Durov made this recommendation on his Telegram channel that has more than 651,000 subscribers. Further, Durov pointed out that this move is mostly influenced ... (Read More...)",50.0,50.0,0.10050535202026367,50.0,68.75,0.10778307914733887,2022-08-24
113,Cryptomode,Exploring the Role of Blockchain in IoT and Machine Age,"Science fiction writers of the 20th Century visioned a world where machines took over the world, to humanity’s great dismay. Well, things are not quite there yet, but advances in machine communication make up for it. Advances in communication, artificial intelligence, and processing speeds have c... (Read More...)",50.0,50.0,99.99023377895355,87.345,58.75,94.784876704216,2022-08-24
114,CryptoSlate,"SudoRare developers reap $815,000 from rug pulling project","Adding to the growing list of exploits, SudoRare developers have shut down operations after withdrawing $815,000 (519 ETH) from the AMM protocol. (Read More...)",50.0,50.0,5.273500084877014,41.105000000000004,58.611111111111114,0.002080202102661133,2022-08-24
115,Bitcoin.com,"Biggest Movers: ATOM up 12% on Tuesday, as NEAR Snaps Losing Streak","Cosmos was a notable gainer on Tuesday, as prices of the token rose by as much as 12% in the day. Today’s surge sees the cryptocurrency climb for a third straight day, hitting a five-day high in the process. Near protocol was also in the green, as it rebounded following recent declines. Cosmos (A... (Read More...)",30.910000000000004,55.00000000000001,2.8934508562088013,61.315,59.36363636363636,1.4069855213165283,2022-08-24
116,Decrypt,How Web3 Can Change Hollywood: Decentralized Pictures CEO,"Decentralized Pictures aims to use the wisdom of crowds to fund new projects—and has support from Roman Coppola, Kevin Smith, and Steven Soderbergh. (Read More...)",50.0,50.0,75.180184841156,86.345,65.9090909090909,99.58584010601044,2022-08-24
117,The Block,Distributed Finance acquires Algorand NFT marketplace Rand Gallery,"Distributed Finance acquires Algorand NFT marketplace Rand Gallery, and closes a $2.5 million seed round led by Borderless Capital. (Read More...)",50.0,50.0,88.3070856332779,50.0,57.49999999999999,3.5271555185317993,2022-08-24
118,Crypto Daily,BTC/USD Glides Higher to 21672 - 24 August 2022 - Sally Ho,"BTC/USD Glides Higher to 21672 Level: Sally Ho’s Technical Analysis – 24 August 2022 Bitcoin Bitcoin (BTC/USD) attempted to add to nominal gains early in the Asian session as the pair was lifted to the 21679.52 area after trading as low as the 20889.69 level, with the interday low representing a ... (Read More...)",50.0,62.5,99.632528424263,39.885,56.07142857142857,12.331181764602661,2022-08-24
119,Cointelegraph,What crashed the crypto relief rally? | Find out now on The Market Report,"On this week’s episode of “The Market Report,” Cointelegraph’s resident experts discuss what factors lead to the collapse of the bear market rally. (Read More...)",73.83500000000001,50.0,0.04570484161376953,25.305,75.0,7.458692789077759,2022-08-24
120,crypto.news,AMC Crashes In Volatile Launch for New Dividend Share; APE & AMC Stocks Halted 13 Times,"Minutes after making its debut on the New York Stock Exchange on Monday, AMC Entertainment’s (AMC) new preferred dividend was halted and lost more than 20% of its starting price. CEO Adam Aron Confirms Halts The new shares, which AMC… (Read More...)",64.8,56.81818181818181,0.10870397090911865,48.71,61.74242424242424,0.008752942085266113,2022-08-24
