,source,title,excerpt,vader_sentiment_title,tb_sentiment_title,flair_sentiment_title,vader_sentiment_excerpt,tb_sentiment_excerpt,flair_sentiment_excerpt,date
0,Bitcoin Magazine,The All-Important Journey To Self-Custody Bitcoin,Two Bitcoiners explain their custody journey and invite others to reflect upon their own steps to claiming their sovereignty. (Read More...),50.0,50.0,93.49587857723236,57.655,77.5,13.725599646568298,2022-09-11
1,AMBCrypto,"Cardano [ADA] stands below XRP by market cap, but daily gains state otherwise","Cardano [ADA] has been building lately ahead of the Vasil hardfork. This has resulted in a significant increase on the ADA prices. Since 9 September, ADA went as high as 8.5% on the daily chart but the surge has since slowed down. At press time, ADA was up by 3.5% according to CoinMarketCap and w... (Read More...)",73.83500000000001,50.0,4.6790748834609985,63.085,54.82870370370371,95.88698446750641,2022-09-11
2,Bitcoin Magazine,Bitcoin And Making Sense Of The European Crisis,"As the European energy crisis peaks, the larger implications for the world economy and bitcoin are becoming apparent. (Read More...)",18.755,50.0,99.88915622234344,27.060000000000002,60.0,89.7850751876831,2022-09-11
3,The Daily Hodl,Robinhood Working To Provide Transfers for Cardano (ADA) and All Other Crypto Assets on Its Platform,"Retail trading giant Robinhood is working on enabling external transfers for the Ethereum (ETH) competitor Cardano (ADA). The firm, which cited customer demand as its reason for listing the ADA earlier this month, is again listening to a customer request on Twitter to be able to transfer Cardano.... (Read More...)",58.894999999999996,43.75,99.78806674480438,43.6,56.666666666666664,0.1470118761062622,2022-09-11
4,AMBCrypto,Ethereum Name Service developers disagree with Vitalik ‘here’ but ENS remains…,"Ethereum [ETH] co-founder Vitalik Buterin and Ethereum Name Service [ENS] developers are at loggerheads due to the newly proposed pricing arrangements. On 9 September, Vitalik published a post via his ENS website, asking if the domains should follow a recurring pricing structure. According to him... (Read More...)",39.885,50.0,8.181160688400269,50.0,58.52272727272727,0.13031363487243652,2022-09-11
5,Bitcoin.com,Blockchain Gaming Publisher and Web3 Firm Animoca Brands Secures $110 Million,"Blockchain gaming publisher Animoca Brands announced the company has raised $110 million in a funding round led by Temasek, Boyu Capital, and GGV Capital. The company raised the funds by issuing convertible notes to a handful of institutional investors. Animoca Brands Raises $110 Million From Str... (Read More...)",65.91,40.0,99.46364462375641,50.0,57.49999999999999,5.513465404510498,2022-09-11
6,The Block,"JPMorgan seeking hire to push banking products onto metaverse, crypto companies","The bank said in the job advert that ""there is no industry playbook"" for web3, crypto, and metaverse segments. (Read More...)",50.0,50.0,6.316962838172913,35.199999999999996,75.0,0.4427403211593628,2022-09-11
7,CryptoPotato,Florida Man Faces Five Years in Prison for Stealing $100M Worth of Crypto,Joshua Nicholas might spend up to five years in jail after he and his colleagues stole $100 million in digital assets from investors. (Read More...),13.655000000000001,65.0,0.7177025079727173,58.894999999999996,56.666666666666664,0.18817484378814697,2022-09-11
8,AMBCrypto,ETH vs. BTC: A change of scenario in the futures market has left BTC at #2,"Bitcoin [BTC]‘s ever-dominating rise in the spot market (market cap) has left all rivals behind by a margin. Ethereum [ETH], the closest rival still has miles and miles to go before it could catch up with the king coin. However, what would happen if we change the battleground to the futures (mark... (Read More...)",50.0,50.0,85.24095714092255,29.905000000000005,51.66666666666666,0.16606450080871582,2022-09-11
9,Cointelegraph,"Binance removes 3 stablecoins, Russia eyes cross-border crypto payments and UK exudes crypto positivity: Hodler’s Digest, Sept. 4-10",(Read More...),75.53,50.0,13.89508843421936,50.0,75.0,96.50535881519318,2022-09-11
10,The Block,Vitalik Buterin makes surprise appearance at Kyiv Tech Summit,"Vitalik Buterin, the co-founder and face of Ethereum, has made an appearance at Kyiv Tech Summit in a show of support for Ukraine. (Read More...)",63.660000000000004,50.0,99.86997246742249,70.095,75.0,12.690562009811401,2022-09-11
11,The Daily Hodl,"Bitcoin Veteran Anthony Pompliano Disavows Crypto Price Predictions After Incorrect $100,000 BTC Forecast","Responding to recent social media criticism, longtime Bitcoin (BTC) advocate Anthony Pompliano says BTC showed him that price predictions are a fool’s game. Pompliano, who co-founded investment firm Morgan Creek Digital, recently received backlash from some members of the crypto community for rem... (Read More...)",50.0,50.0,0.04277229309082031,27.98,49.523809523809526,0.013056397438049316,2022-09-11
12,U.Today,"Bitcoin Back Above $21,000, Here’s Why: Satoshi Action Fund Founder","Bitcoiner Dennis Porter believes he knows the reason of the current Bitcoin rise, Peter Schiff takes a jab at BTC (Read More...)",50.0,51.66666666666667,0.11901557445526123,50.0,62.5,5.334237217903137,2022-09-11
13,Bitcoin.com,Payments Firm Bolt Scraps Deal to Acquire Crypto Company Wyre,"California-based online payments company Bolt is pulling out of an agreement to buy crypto provider Wyre. The news of the scrapped deal, which was agreed to earlier this year, comes amid plunging valuations in the crypto and fintech sectors. Bolt Gives Up Plan for $1.5 Billion Wyre Acquisition Bo... (Read More...)",50.0,40.0,0.5482107400894165,82.43,62.5,0.01061856746673584,2022-09-11
14,Cointelegraph,3 major mistakes to avoid when trading cryptocurrency futures markets,"Crypto traders love to “ape” and make “degen” investments using high leverage in futures markets, but most traders fall victim to these three key mistakes. (Read More...)",21.405,53.125,0.003808736801147461,21.435,63.208333333333336,0.0658184289932251,2022-09-11
15,CoinGape,EOS Price Prints 17% Weekly Gains; Time To Buy?,"EOS price trades higher with remarkable gains. The formation of the double structure near $1.38 resulted in a jump of 35% to the highs of $1.80. However, the bulls meet resistance at the current level. At the time of drafting, the EOS coin is trading at $1.74, up 5.73% for the day. EOS price trad... (Read More...)",67.0,50.0,17.72274672985077,85.92,63.33333333333333,90.96166491508484,2022-09-11
16,Crypto Daily,Bitcoin Price Analysis: BTC Orbits 21081 - 11 September 2022,"BTC/USD Gains May Continue: Sally Ho’s Technical Analysis – 11 September 2022 Bitcoin (BTC/USD) awaited fresh technical direction early in the Asian session as the pair orbited the 21081.65 area after peaking around the 21677.79 area, with current price activity right around the 50% retracement o... (Read More...)",50.0,50.0,9.163787961006165,77.86999999999999,57.410714285714285,99.28483963012695,2022-09-11
17,The Daily Hodl,DeFi Total Value Locked on Ethereum and Other Chains Decreasing to ‘Alarming’ Levels: DappRadar Report,A new DappRadar report is sounding the alarm over the sharp decrease of capital residing in the decentralized finance (DeFi) subsector. The report highlights that the total value locked (TVL) in the DeFi space witnessed a massive 70% decline in just eight months. According to the data acquisition... (Read More...),67.0,46.25,0.3033846616744995,50.0,55.11363636363637,0.026538968086242676,2022-09-11
18,Cryptonews,"Best Crypto to Buy Trending Now - 10 Sept: LTC, XRP, LUNC, RVN, POLY, TAMA, HNT, SAND, GST, MIR","Looking for the best crypto to buy right now and you could be spoilt for choice after bitcoin powered 10% higher yesterday. It is altcoins taking up the running from the large caps today, with some relative newcomers and some old friends, showing good form.... Read More: Best Crypto to Buy Trendi... (Read More...)",81.845,100.0,99.97104406356812,97.00999999999999,72.75,99.79997277259827,2022-09-11
19,AMBCrypto,Reasons why XRP’s 14% uptick could turn into a full-fledged bull run,Ripple [XRP] is finally regaining its affinity for the upside after about three weeks of weak price action. The cryptocurrency slipped out of its short-term ascending channel after a bearish performance at the end of August. XRP’s bullish performance in the last three days has pushed it back to t... (Read More...),50.0,80.0,0.14214515686035156,27.98,51.87500000000001,0.0024199485778808594,2022-09-11
20,Bitcoinist,Hackers Moved $500K Stolen Funds To Tornado Cash Undermining The Ban,"The previously sanctioned crypto mixer app Tornado Cash used to increase the anonymity of crypto funds for privacy concerns, still is being used by hackers. Two blockchain security and research firms, Peckshield and Certik, have detected the transfer of stolen funds of the DAI Maker exploit that ... (Read More...)",7.405,50.0,0.05793869495391846,51.29,58.333333333333336,0.038558244705200195,2022-09-11
21,CoinGape,A breakout Above This Critical level Would Sustain Gains In Cardano,Cardano price edges higher amid sustained buying pressure. The price is finally able to breach the critical $0.55 level. ADA is capitalizing on the fundamental trigger and broader crypto market recovery. The bulls have taken the charge as the price took viable support near the $0.46 level. The pr... (Read More...),51.29,50.0,96.56548500061035,39.885,63.5,2.6171326637268066,2022-09-11
22,Cryptomode,The Crypto Banks Landscape Of 2022,"Bear markets are very rough times for investors and speculators. However, crypto banks have a tough time, too, as they have to try to grow an audience. Interestingly, things are slowly coming together for some projects, whereas others remain behind the curve. The Prominent Crypto Banks The term “... (Read More...)",50.0,50.0,97.24479019641876,77.115,52.007936507936506,0.2777904272079468,2022-09-11
23,CoinGape,Has Helium Coin’s Relief Rally Reached Its Peak?,"The Helium coin price has recovered 77% over the past four days. The bull run currently challenges the $5.5 resistance, indicating buyers attempt for another leg higher. In addition, a significant pump in volume activity bolsters the same cause and can push the altcoin to the $7 mark. Key points ... (Read More...)",77.115,50.0,22.833767533302307,63.660000000000004,56.25,0.2991616725921631,2022-09-11
24,Bitcoin.com,Ethereum Devs Successfully Complete Merge Shadow Fork With No ‘Client Incompatibility Issues’,"Next week or roughly around four days from now, The Merge is expected to be implemented and Ethereum will transition from proof-of-work (PoW) to proof-of-stake (PoS). According to Ethereum developers, prior to the Paris upgrade, programmers successfully completed the 13th and last shadow fork. Et... (Read More...)",62.5,55.00000000000001,99.95611011981964,74.695,56.56250000000001,80.92907071113586,2022-09-11
25,AMBCrypto,Bitcoin [BTC]’s latest surge may not last long and the culprit is none other than…,"The price per Bitcoin [BTC] grew by 5.16% in the last 24 hours, and stood at $21,612.76 as per data from CoinMarketCap revealed. The king coin was impacted by the broader financial assets market drawdown. This led to the price falling by 12% in August alone. However, the BTC market remains consis... (Read More...)",50.0,54.0625,0.3076523542404175,38.685,58.333333333333336,0.004541873931884766,2022-09-11
26,Feed - Cryptopotato.Com,These Countries Have the Best Crypto Tax Legislation: Research,"According to a Coincub's analysis, Germany, Italy, and Switzerland are the top three crypto tax heavens for residents. (Read More...)",81.845,100.0,99.85880851745605,77.115,75.0,17.8876131772995,2022-09-11
27,NewsBTC,"Kyber Network (KNC) Ticks All Bullish Sentiments, Can Price Go To $3?","Kyber Network (KNC) has recently struggled against tether (USDT) after its price was rejected at $5.5. Bitcoin’s (BTC) price increased dramatically, rising from a low of $18,500 to a high of $21,000. This movement has impacted other altcoins, as most cryptocurrencies, including Kyber Network, are... (Read More...)",50.0,50.0,0.04598498344421387,15.46,58.62500000000001,0.979536771774292,2022-09-11
28,The Daily Hodl,FTX Investment Arm Buys 30% Stake in Anthony Scaramucci’s Skybridge Capital As Expansion Spree Continues,The investment arm of Samuel Bankman-Fried’s crypto derivatives exchange FTX is buying a sizeable stake in Anthony Scaramucci’s SkyBridge Capital. The former White House Communications Director revealed that FTX Ventures is acquiring a 30% stake in the alternative investments firm. “FTX Ventures ... (Read More...),50.0,50.0,9.590882062911987,50.0,53.75,0.8013337850570679,2022-09-11
29,BeInCrypto,"Roblox Touts Huge Russian Player Base, Targets Metaverse Ads","Roblox Corporation has over 2 million active players in Russia, even as it looks to expand its metaverse offerings. The post Roblox Touts Huge Russian Player Base, Targets Metaverse Ads appeared first on BeInCrypto. (Read More...)",64.8,43.333333333333336,0.17073750495910645,86.75500000000001,51.80555555555556,3.465476632118225,2022-09-11
30,Bitcoin Magazine,"At Underground Citadel, Bitcoiners Learned How To Build Sovereign Lives","Last month, at the fifth Underground Citadel event in Texas, attendees learned skills to help achieve more freedom from incumbent systems. (Read More...)",50.0,50.0,19.424423575401306,90.08,66.66666666666666,86.21874749660492,2022-09-11
31,CryptoGlobe,$BTC: Founder of Crypto Fund Manager Cyber Capital Goes Ballistic on Bitcoin,"The founder and chief investment officer (CIO) of crypto-focused asset management firm Cyber Capital says that Bitcoin is “technically one of the worst cryptocurrencies,” in light of advancements being made by top competitors. In a series of tweets, Cyber Capital founder Justin Bons argued that B... (Read More...)",50.0,50.0,0.029665231704711914,24.47,51.66666666666667,0.0007033348083496094,2022-09-11
32,U.Today,"Cardano’s First NFT Lending Platform Announces $25,000 in Bounty Ahead of Mainnet Launch",Aada Finance intends to launch in advance of Vasil upgrade (Read More...),50.0,62.5,97.40200638771057,50.0,75.0,12.61393129825592,2022-09-11
33,CoinGape,"LUNA Price Surged Another 30%, But Is It Sustainable?","Following a long accumulation, the LUNA price surged significantly in the last two days. Moreover, the technical chart justifies this price action with a rounding bottom pattern in the daily time frame. This bullish reversal pattern should encourage buyers to extend the recovery above $9. However... (Read More...)",50.0,50.0,5.26709258556366,80.62,55.13888888888889,0.006103515625,2022-09-11
34,U.Today,"XRPL Could Become a Go-To Platform for CBDCs, Here's How","Wo Jake, XRP Ledger (XRPL) contributor and enthusiast of Everscale platform, explained why Federated Sidechains concept is crucial one for CBDCs' progress (Read More...)",50.0,50.0,3.311815857887268,82.43,62.5,89.77395296096802,2022-09-11
35,Protos.com,The Weekend Shift: Ethereum and the British Monarchy,"The most interesting reads, podcasts, charts, and opinions from the internet this weekend — curated for you by the Protos newsroom. (Read More...)",50.0,50.0,99.5630294084549,72.88,75.0,96.79924845695496,2022-09-11
36,Bitcoin.com,"While Bitcoin’s Hashrate Grew by 22,900% in 6 Years, Discovering Block Rewards Is Far More Difficult","Over the past 12 months, Bitcoin’s hashrate has increased by 85.77%, while 53,547 blocks were mined and 334,668.75 new bitcoin were minted into circulation. More than two dozen bitcoin mining pools have dedicated hashrate toward the Bitcoin blockchain during the last six years, and while the hash... (Read More...)",30.979999999999997,51.66666666666666,0.28367340564727783,74.695,58.86363636363636,0.7744550704956055,2022-09-11
37,Bitcoinist,Why Dogecoin Co-Creator Is Accusing Mark Cuban Of Scamming Investors,"Dogecoin co-creator Jackson Palmer has once again taken to the Internet to spew his disdain for the cryptocurrency industry. This time, he lashes out at Mark Cuban, owner of the Dallas Mavericks. In an interview with Business Insider, the Adobe specialist stated that billionaire entrepreneur Cuba... (Read More...)",41.105000000000004,50.0,0.020894408226013184,26.165,75.0,0.026527047157287598,2022-09-11
38,U.Today,Here's How Much Ethereum Validators Will Earn Post-Merge,"Pintail, pseudonymous Ethereum (ETH) researcher, calculated average rewards of Ethereum (ETH) validators in its upcoming proof-of-stake (PoS) version (Read More...)",50.0,60.0,11.225613951683044,73.83500000000001,58.75,9.269523620605469,2022-09-11
39,ZyCrypto,XRP Lawsuit: Ripple Aims For Ultimate Win As Case With The SEC Finally Inches Towards ‘End Game’,Ripple Labs and the Securities and Exchange Commission (SEC) have filed a joint proposal hinting at a speedy resolution of the case. (Read More...),72.02,53.0,2.28307843208313,64.8,60.0,11.50260865688324,2022-09-11
40,U.Today,"New Terra LUNA Records 3300% Spike in Trading Volumes as Price Triples, What Is Happening?",Crypto market observers are surprised by LUNA's unusual price movement (Read More...),50.0,56.81818181818181,3.6518722772598267,61.315,63.33333333333333,99.18654561042786,2022-09-11
41,NullTX,Top 5 Cybersecurity Tokens below $10M Market Capitalization to Watch in September 2022,"Cybersecurity is the protection of computer systems, information, and networks from hackers who try to steal software or electronic data. Cybersecurity is a critical sector as many Crypto DeFi projects are exploited daily. For this reason, we are looking at some cybersecurity tokens below $10m ma... (Read More...)",60.114999999999995,75.0,15.22417962551117,9.120000000000001,62.5,12.321600317955017,2022-09-11
42,CoinGape,"Will Ethereum Price Hit $2,000 Next Week?","Ethereum price remains sidelined for the day. The price has appreciated by nearly 15% in the last four days, indicating a probable upside continuation outside of the consolidation. Ethereum price trades with a positive bias in a very tight range. The $1,720 remained a critical challenge for the b... (Read More...)",50.0,50.0,0.06111562252044678,83.525,54.969561688311686,0.2825051546096802,2022-09-11
43,NewsBTC,Binance Coin Surpasses 1 Billion Trading Volume After BNB Network Upgrade,There is strength in numbers and Binance Coin (BNB) has proven that time and again with its robust community of Bitcoin enthusiasts whose faith in the coin has always been its strong fortress. BNB surpasses 1 billion in terms of trading volume following network upgrade BNB price up by 2.04% Binan... (Read More...),50.0,50.0,81.65347874164581,96.00500000000001,65.55555555555556,99.94988739490509,2022-09-11
44,Finbold,YouTuber with 13 million subscribers hacked by crypto scammers; Here’s how much they stole,Popular YouTuber Scuba Jake has confirmed the hacking of his channel with over 13 million subscribers and 1.75 billion views... Continue reading (Read More...),29.905000000000005,60.0,0.012871623039245605,71.075,75.0,0.05836784839630127,2022-09-11
45,U.Today,Ethereum (ETH) Price Analysis for September 10,Has Ethereum (ETH) found local resistance level yet? (Read More...),50.0,50.0,1.1169731616973877,50.0,62.5,2.5228917598724365,2022-09-11
46,Decrypt,Why DeFi Speculators Are Borrowing Ethereum as Merge Looms,DeFi degens are borrowing ETH in the hopes of getting airdropped a new coin if there's a fork after the merge. Now pools are limiting the borrowing. (Read More...),42.345,50.0,3.355887532234192,71.075,65.9090909090909,0.014743208885192871,2022-09-11
47,CryptoPotato,Jack Dorsey’s Bitcoin Academy Airdrops $1000 in BTC to All Attendees,The philanthropic initiative helped educate and bootstrap some of Marcy’s residents onto the Bitcoin network. (Read More...),50.0,50.0,99.81326162815094,50.0,75.0,98.80587756633759,2022-09-11
48,CoinTelegraph,Entrepreneurs must learn to tackle business risks in the Metaverse,The Metaverse is fraught with risks. Implementing effective safeguards — both physical and virtual — will be critical to entrepreneurs seeking to do business there. (Read More...),36.34,50.0,97.24146723747253,63.660000000000004,63.74999999999999,85.80081462860107,2022-09-11
49,U.Today,Shiba Inu’s BONE Squashes Official 230 Million Token Cap; Here’s What Now Happens,BONE minting now halted as it sets new milestone ahead of Shibarium release (Read More...),50.0,50.0,0.1941084861755371,50.0,65.9090909090909,12.648564577102661,2022-09-11
50,The Daily Hodl,Top Crypto Trader Predicts Sizeable Gains for Bitcoin (BTC) and Ethereum (ETH) – But There’s a Catch,"A popular crypto analyst thinks both Bitcoin (BTC) and Ethereum (ETH) could capitalize on their recent momentum and move even higher. The pseudonymous crypto trader known as Altcoin Sherpa tells his 182,800 Twitter followers that Bitcoin could soon surge by another 8% if it reaches $21,700. “Sque... (Read More...)",63.660000000000004,75.0,97.72291481494904,72.94,66.875,0.1556187868118286,2022-09-11
51,BeInCrypto,Bitcoin Rises Above $21K as Market Sees Around $300M in Liquidation,The positive performance of Bitcoin and other major crypto assets in the last 24 hours has led to almost $300 million in liquidations. The post Bitcoin Rises Above $21K as Market Sees Around $300M in Liquidation appeared first on BeInCrypto. (Read More...),50.0,50.0,0.023663043975830078,82.43,56.53409090909091,0.017654895782470703,2022-09-11
52,U.Today,Ripple CTO David Schwartz Explains Why is XRPL Better than All Mainstream Blockchains,"Seasoned software developer David Schwartz, chief technology officer (CTO) of fintech decacorn Ripple, indicates advantages XRP Ledger has over its major competitors (Read More...)",72.02,75.0,99.84423816204071,68.06,63.541666666666664,99.77501332759857,2022-09-11
53,Crypto Daily,Ethereum (ETH) to USDT chart on a 1 day time frame on 10.09.2022.,"Hello everyone, let's take a look at the ETH to USDT chart on a 1 day time frame on 09.09.2022. As you can see, price is moving above the local uptrend line. &lt;/ Let's start with the designation of the support line and as you can see the first support in the near future is $ 1639, if the suppor... (Read More...)",50.0,50.0,2.895456552505493,82.985,57.08333333333333,13.947486877441406,2022-09-11
54,Bitcoin.com,"Biggest Movers: ADA, SAND Surge to Multi-Week Highs on Saturday","Cardano was one of Saturday’s notable gainers, with the token surging to a three-week high. The sandbox was also in the green, rising to a multi-week peak, as sentiment in the cryptocurrency market remains mostly bullish. Overall, the global crypto market cap is up nearly 2% as of writing. Cardan... (Read More...)",50.0,50.0,99.94865655899048,50.0,59.75,99.14134740829468,2022-09-11
55,Bitcoinist,Crypto Words ‘Metaverse’ And ‘Altcoin’ Get Spot In Merriam-Webster Dictionary – Yeet!,"New crypto words are being enshrined into the book of language. Since Merriam-Webster has validated a number of internet catchphrases and colloquialisms the modern youth today coin by including them in the dictionary, language elitists will have to get pretty chill with them fast. Merriam-Webster... (Read More...)",50.0,50.0,96.51530385017395,82.985,62.86363636363637,99.85495209693909,2022-09-11
56,Decrypt,"This Week in Coins: Bitcoin and Ethereum Rebound, LUNA Moons","The new British government sounds bullish on crypto, while discussions in Washington about regulation are intensifying. (Read More...)",50.0,50.0,0.0675886869430542,50.0,60.60606060606061,5.10152280330658,2022-09-11
57,NullTX,Top Social Money Tokens to Watch in September 2022,"“Social Money” refers to financial services technology for developing novel products that focus on assisting consumers and clients in investing and saving by encouraging the creation of an open financial protocol for everyone. Social Money Tokens have a total market capitalization of $118,173,224... (Read More...)",60.114999999999995,63.33333333333333,99.95616972446442,88.915,54.047619047619044,98.16851317882538,2022-09-11
58,U.Today,"MicroStrategy Returns To Buy More Bitcoin, Will This Impact BTC Price?",Company stated that it would save all potential future earnings to buy more Bitcoin (Read More...),50.0,75.0,2.654796838760376,74.695,62.5,0.030171871185302734,2022-09-11
59,Cointelegraph,How does high-frequency trading work on decentralized exchanges?,High-frequency trading allows cryptocurrency traders to take advantage of market opportunities that are usually unavailable to regular traders. (Read More...),50.0,50.0,5.674350261688232,77.86999999999999,54.166666666666664,99.95884597301483,2022-09-11
60,Cryptomode,Web3.0 Interaction Example | Read the decentralized video sharing platform X METAVERSE PRO in one article,"Internet iterations, from Web1 to Web2 to Web3, a more open network is weaved by more professionals that anyone around the globe can participate in the creation, dissemination and sharing of information. Web2 Disadvantages The UGC model is applicable to the current phase of the Web2 Internet, whi... (Read More...)",71.075,50.0,95.59192657470703,64.8,65.0,97.67583012580872,2022-09-11
61,The Block,Singapore’s biggest bank DBS to acquire land in The Sandbox metaverse,DBS has partnered with The Sandbox to create a metaverse experience. The bank will also buy a 3x3 land plot in The Sandbox. (Read More...),50.0,50.0,92.477285861969,63.660000000000004,75.0,0.9016513824462891,2022-09-11
