,source,title,excerpt,vader_sentiment_title,tb_sentiment_title,flair_sentiment_title,vader_sentiment_excerpt,tb_sentiment_excerpt,flair_sentiment_excerpt,date
262,crypto.news,OECD Issues Framework to Tackle International Tax Evasion Using Crypto-Assets,OECD has issued a global tax reporting framework for cryptocurrencies that will assist tax authorities in keeping track of cross-border transactions of crypto assets. (Read More...),50.0,50.0,17.128202319145203,58.894999999999996,62.5,99.65353310108185,2022-10-12
263,Cryptonews,Bitcoin Price Forecast – Where is the Bottom for BTC?,"Bitcoin, the world's most valuable cryptocurrency, dropped more than 2% today to $19,061. At the time of writing, the total market capitalization of cryptocurrencies is $920 billion, just shy of $1 trillion. The stronger economic events in the United States are keeping the dollar bullish while we... (Read More...)",50.0,50.0,0.009402632713317871,88.89,60.0,0.03808140754699707,2022-10-12
264,The Block,CNN offers holders partial refunds as it suddenly shutters NFT Vault,Collectors who purchased NFTs from Vault by CNN want refunds after the news outlet announced it was winding down the project. (Read More...),50.0,50.0,0.00756382942199707,53.86,58.611111111111114,0.0594019889831543,2022-10-12
265,Bitcoinist,Turkey Ramps Up Efforts To Become The Next Crypto And Blockchain Hub,"Turkish residents continuously maintain a bullish stance on crypto transactions despite the bear markets. Ismail H. Polat, a media lecturer at Kadir Has University in Istanbul, said the driving factor is the high inflation. Recent reports show the Turkish crypto industry is working to build the c... (Read More...)",50.0,50.0,89.35764133930206,50.0,61.0,0.2404928207397461,2022-10-12
266,Decrypt,'Quantum-Resistant' Blockchain QANplatform Suffers Bridge Hack for Over $1 Million,"In the early hours of the morning, QANPlatform's Ethereum bridge smart contract was exploited for over $1 million. (Read More...)",26.165,20.0,0.007528066635131836,46.14,63.57142857142857,0.2776503562927246,2022-10-12
267,CoinGape,"Just In: Google, Coinbase Tie Up For Crypto Payments In Some Services","Tech major Google on Tuesday announced its plans to partner with crypto exchange Coinbase for various applications. Starting early next year, some of Google Cloud users would be able to pay for the services with cryptocurrencies. In a separate partnership, Coinbase would shift to Google Cloud for... (Read More...)",50.0,50.0,93.69465410709381,44.865,58.30357142857143,0.3748178482055664,2022-10-12
268,Crypto Daily,Why Investors Are Choosing Flasko (FLSK) Over Solana (SOL) And Cardano (ADA),"Due to the recent collapse of the cryptocurrency market, Solana (SOL) and Cardano (ADA) may have recently seen large gains. For example, Cardano (ADA) could achieve a price hike of around 5% within a period of 24 hours. But Flasko seems to dominate the presale, surpassing both currencies. All cry... (Read More...)",50.0,50.0,0.4684269428253174,35.77,55.892857142857146,92.69770085811615,2022-10-12
269,CryptoPotato,Google to Accept Crypto for Cloud Services: Partners with Coinbase,Google will start accepting cryptocurrency payments for certain services as of next year. (Read More...),69.08999999999999,50.0,98.6084371805191,78.595,61.904761904761905,0.07260739803314209,2022-10-12
270,CoinTelegraph,Breaking: Google taps Coinbase to bring crypto payments to cloud services,Google says early next year users will be able to pay for cloud services using cryptocurrencies like Bitcoin via Coinbase. (Read More...),50.0,50.0,0.18225908279418945,63.660000000000004,63.74999999999999,0.6521075963973999,2022-10-12
271,Finbold,Exposed: Celsius founder is still dumping hundreds of thousands of dollars in CEL across wallets,After the news broke that senior executives of cryptocurrency lending firm Celsius had cashed out between $17 and $23 million... Continue reading (Read More...),30.910000000000004,50.0,0.036135315895080566,28.925,57.49999999999999,3.0181676149368286,2022-10-12
272,Cryptomode,Move-to-earn Darling STEPN Has Under 350 New Users Per Day As GMT Momentum Sours Further,"The move-to-earn concept gained tremendous initial traction when it was still fresh. Unfortunately, projects in this space struggle to establish sustainable economies, like most play-to-earn games. As a result, STEPN, once one of the M2E frontrunners, has seen its traction dwindle significantly, ... (Read More...)",79.295,53.40909090909091,0.8656740188598633,70.095,60.77380952380952,0.0027418136596679688,2022-10-12
273,Protos.com,FOI reveals 20% of UK crypto fraud last year relied on Binance,"UK police say Binance was linked to $40 million worth of crypto fraud in the country in 2021, almost double the previous year's figure. (Read More...)",20.705000000000002,50.0,0.1211315393447876,27.98,57.91666666666666,0.19028186798095703,2022-10-12
274,U.Today,"Gokhshtein on SHIB: I Should Have Got into It, Regardless of “DOGE Killer” Tag Line","Cryptocurrency enthusiast Gokhshtein regrets not going all in on Shiba Inu earlier, here's why (Read More...)",50.0,50.0,82.67674744129181,50.0,56.666666666666664,99.8512476682663,2022-10-12
275,The Block,"Bitcoin companies join in push to promote Stratum V2 adoption, launch open-source test version",Bitcoin mining companies Spiral and Braiins launched an industry working group to promote an upgrade to the current Stratum V1 protocol for miners. (Read More...),79.295,50.0,93.36926341056824,73.83500000000001,62.5,17.66127049922943,2022-10-12
276,Crypto Daily,Flasko (FLSK) Is Predicte To Win Over Chainlink (LINK) And Fantom (FTM),"Chainlink (LINK) and Fantom (FTM) are two popular cryptocurrencies that have addressed multiple issues in the crypto world. However, the hype for Chainlink (LINK) and Fantom (FTM) now seemed to be over. Some investors are now interested in the new cryptocurrency Flasko. Fantom (FTM) Investors Hav... (Read More...)",79.295,90.0,99.64487552642822,83.525,64.86363636363637,12.206640839576721,2022-10-12
277,Bitcoin Magazine,Tor Is Under Attack And Bitcoiners Must Help Fix It,"With a lack of funding, the Tor project is struggling to defend against denial-of-service attacks, putting Bitcoin projects at risk. (Read More...)",44.865,50.0,0.006186962127685547,7.790000000000003,75.0,0.006651878356933594,2022-10-12
278,crypto.news,Binance Breaks Guinness Record by Hosting World’s Largest Crypto Class,"Leading global crypto exchange platform, Binance, teamed up with Mexican recruiting firm Talent Network to conduct the largest crypto lesson, breaking the Guinness World Record. (Read More...)",50.0,50.0,99.86336827278137,71.075,53.75,99.1048276424408,2022-10-12
279,Bitcoin Magazine,"Spiral, Braiins Establish Working Group To Develop Bitcoin Mining Protocol",The working group will streamline processes for bitcoin miners looking to upgrade to the Stratum V2 communication protocol that connects miners to the network. (Read More...),50.0,50.0,99.93188083171844,50.0,75.0,88.26428055763245,2022-10-12
280,The Block,Ethereum’s weekly supply growth turns deflationary for first time since Merge,Ethereum has become deflationary on a weekly timeframe for the first time since The Merge as activity on the network spikes. (Read More...),69.08999999999999,62.5,0.014594197273254395,50.0,68.75,0.002384185791015625,2022-10-12
281,Ethereum World News,"SushiSwap Head Chef Jared Grey Accused Of Several Scams, SUSHI Down 10%","Summary: Jared Grey was accused by a Twitter user of several scams and copyright infringement dating as far back as 2012. The accusations also include sexual abuse of a horse, per tweets and reports circling the crypto community. Grey responded via a thread, saying the accusations are “100% untru... (Read More...)",14.984999999999998,46.574074074074076,0.07061958312988281,2.6150000000000007,57.14285714285714,0.010731816291809082,2022-10-12
282,CoinGape,"Will Hinman Conflict Delay SEC, Ripple Summary Judgement?","U.S. Securities and Exchange Commission (SEC) and Ripple defendants submitted their motions for Summary Judgement in the XRP lawsuit last month. These filed motions sent all sorts of positive among the XRP holders. However, the crucial Hinman notes are yet to be revealed in the XRP lawsuit. XRP l... (Read More...)",22.13,45.0,23.863962292671204,72.94,56.27272727272727,6.438347697257996,2022-10-12
283,The Daily Hodl,"Analyst Known for Calling 2022 Crypto Market Crash Predicts Fakeout Rallies for Bitcoin, Stellar and Litecoin","The pseudonymous crypto trader who nailed Bitcoin’s collapse this year is forecasting brief rallies for BTC, Stellar (XLM) and Litecoin (LTC) prior to the resumption of their downtrend. Capo tells his 549,100 Twitter followers that he expects a rally for these digital assets leading up to Thursda... (Read More...)",29.905000000000005,62.5,79.05672490596771,31.94,57.49999999999999,0.0467151403427124,2022-10-12
284,Crypto Daily,ARK Offers “Data-Driven” Advice To Fed,"Asset management firm, ARK Invest, has directly addressed the Federal Reserve over its decision to increase funds interest rates, with the concern that such serious policy errors could lead to deflation. ARK Founder Questions Interest Hikes Founder Cathie Wood penned an open letter addressing the... (Read More...)",50.0,55.00000000000001,94.59055960178375,89.82,50.55555555555556,2.91748046875,2022-10-12
285,Cryptomode,Awareness and knowledge of Bitcoin in 2022,"Over the last few years, more and more people became interested in the Cryptocurrency market, its structure, advantages and innovations. But does the number of Bitcoin-knowledgeable people rose considerably as well? Let’s take a look at this matter as per analysed in 2022. Since its launch in 200... (Read More...)",50.0,50.0,99.92733895778656,87.67,64.0625,20.108798146247864,2022-10-12
286,CryptoPotato,Millionaire by Chance Now Pleads Not Guilty in a Court Case Against CryptoCom,The woman and her partner thought they won $10.5 million from a contest supposedly organized by CryptoCom. (Read More...),75.79,62.5,6.85497522354126,78.595,75.0,0.02931356430053711,2022-10-12
287,U.Today,"Bitcoin Just Broke New Record, Here's What Is It","Bitcoin is successfully growing as network, but it most likely will not reach its market value (Read More...)",28.925,56.81818181818181,0.04546642303466797,83.2,71.875,0.10086297988891602,2022-10-12
288,Cryptomode,"Why A-List Celebrities are Geared up to Get Involved with BNB, BudBlockz, and Dogelon Mars","All A-List celebrities have one thing in common; RELEVANCE. By associating themselves with the most relevant issues of the day, celebrities get to lead conversations, entrench themselves in the center of public consciousness, and gain a head-start in accessing potential opportunities. And what is... (Read More...)",50.0,50.0,0.085410475730896,85.92,57.14285714285714,99.91332590579987,2022-10-12
289,Cointelegraph,Tether stablecoin issuer freezes 8.2M USDT on Ethereum: Data,"Tether has frozen a total of 215 USDT addresses on Ethereum in 2022 so far, according to data compiled by ETH researcher Philippe Castonguay. (Read More...)",48.71,50.0,0.9699493646621704,50.0,60.0,0.22300183773040771,2022-10-12
290,CryptoPotato,"BNB Tumbles 5% Weekly, Now Facing Critical Support (Binance Coin Price Analysis)","Binance Coin had a difficult week after being rejected at the key resistance and entered into a downtrend. Key Support level: $260 Key Resistance level: $300 BNB could not move above the $300 resistance, and since then, the bears took over. The next key support is found at $260, and if buyers don... (Read More...)",55.135,50.0,1.3712972402572632,44.865,50.0,0.0005125999450683594,2022-10-12
291,Blockworks,OECD Releases Framework to Unify Global Crypto Tax Reporting,The proposed guidelines are aimed at sharing cryptoasset taxpayer information between the OECD countries The post OECD Releases Framework to Unify Global Crypto Tax Reporting appeared first on Blockworks. (Read More...),50.0,50.0,98.34114611148834,71.075,62.5,1.6491740942001343,2022-10-12
292,Bitcoin.com,Japanese Telecom Giant NTT Docomo Launches $412 Million Metaverse Unit,"NTT Docomo, the largest telecom carrier in Japan, has launched a new division that will be dedicated to directing its metaverse push. The unit, named Qonoq, is already operating and has a staff of 200 people, researching and developing software and hardware solutions directed to integrate extende... (Read More...)",50.0,50.0,89.7441029548645,81.845,65.9090909090909,99.7948706150055,2022-10-12
293,crypto.news,Algorand Partners with AnChain.AI for Payments Fraud Prevention and More,"Algorand (ALGO) has signed a partnership deal with AnChain.AI.With the new alliance, the platform's developers can now take advantage of AnChain.AI’s artificial intelligence-powered solutions. (Read More...)",20.705000000000002,75.0,99.4421124458313,70.095,50.60606060606061,99.32357370853424,2022-10-12
294,U.Today,Crypto Hack: Tron’s JUST Ecosystem Reportedly Hit With 4600 BNB Exploit,Tron-based JST token seems to have been rugged (Read More...),44.865,50.0,0.9475201368331909,50.0,75.0,91.97666347026825,2022-10-12
295,Blockonomi,EU Regulations: Dapper Labs Blocks Russian Access To Its Blockchain,"Growing political tension between Russia and the European Union (EU) has ruptured the country’s access to international services, like Dapper Labs’ platform. In an article published recently, Flow blockchain developer Dapper Labs announced an immediate suspension of Russian accounts following the... (Read More...)",38.685,50.0,0.015980005264282227,61.315,53.57142857142857,0.04005134105682373,2022-10-12
296,Bitcoinist,Why Bitcoin Investors – Who Are Paranoid About Hacks – Are Turning To ‘Old’ Tech,"Bitcoin and its fellow cryptocurrencies are on their way to show the world one of the biggest ironies in the field of financial technology. These assets, widely heralded as the future of FinTech, might turn back time and go old school courtesy of holders who are paranoid about protecting their in... (Read More...)",37.5,55.00000000000001,0.002944469451904297,64.8,54.166666666666664,92.68363118171692,2022-10-12
297,Bitcoinist,UAE’s Stack Of Web 3 Projects Puts It Ahead Of The Competition,"The world is changing with more innovative approaches and techniques for all processes in the future, Web 3 is the new movement where the future of the internet will be based on the users’ data. With the future in mind, new infrastructures and platforms are emerging into Web 3. They aim to change... (Read More...)",50.0,50.0,99.94612634181976,74.635,61.07954545454546,99.95146989822388,2022-10-12
298,CoinGape,Amitabh Bachchan Birthday Special- Big B’s Crypto Connection,(Read More...),70.095,58.92857142857143,99.97406899929047,50.0,75.0,96.50535881519318,2022-10-12
299,BeInCrypto,Solana Price Prediction: Things Ain’t Looking Good,The Solana price dumped over 3% on the daily chart as a mostly bearish sentiment retook control over the global crypto market. The post Solana Price Prediction: Things Ain’t Looking Good appeared first on BeInCrypto. (Read More...),72.02,85.0,0.02511739730834961,52.580000000000005,66.25,0.0009298324584960938,2022-10-12
300,Finbold,"Bitwise CEO says bear markets are moments for making fortunes, projects crypto rally in 2024",The 2022 crypto market downturn has impacted the investors’ activity as a majority await on the sidelines for a possible... Continue reading (Read More...),50.0,50.0,81.92432522773743,55.135,62.5,11.651995778083801,2022-10-12
301,Coinnounce,TMC NFT: Explained in detail,"A platform for producing memes The Meme Club (TMC), a platform that allows meme authors, collectors, and other interested parties to purchase and trade memes internationally using Non-Fungible Tokens, has been introduced by MemeChat (NFTs). (Read More...)",50.0,50.0,99.88844990730286,82.985,57.8125,87.759068608284,2022-10-12
302,Coinnounce,Could NFT memes make you rich?,The NFT memes culture emerged after and gave memes more purpose than just a way to convey hilarious information and expanded their potential by giving them monetary worth. (Read More...),77.86999999999999,68.75,90.09848535060883,85.92,68.0,98.72334003448486,2022-10-12
303,Cointelegraph,Community interaction beaming through the crypto space: Blockchain Economy Dubai 2022,The Blockchain Economy Dubai Summit 2022 highlighted that the crypto community is eager to engage and interact with fellow community members. (Read More...),50.0,50.0,99.93031322956085,79.97000000000001,75.0,99.74347352981567,2022-10-12
304,CryptoGlobe,$ADA: A Closer Look at the Top Cardano NFT Collection by Volume and Floor Price,"This article takes a look at The Ape Society ($SOCIETY), which is “a collection of 7,000 unique NFTs generated on the Cardano blockchain.” The Ape Society token, $SOCIETY, can be used for transactions inside the ecosystem. As highly popular and respected Cardano influencer “ADA Whale” (“@cardano_... (Read More...)",60.114999999999995,75.0,92.91878640651703,87.74,74.58333333333333,95.43097019195557,2022-10-12
305,The Block,Crypto.com backs discovery platform Magic Square amid fundraising flurry,Crypto discovery platform Magic Square has raised a total of $4 million through token rounds and is valued at $75 million. (Read More...),47.42,75.0,19.149506092071533,72.02,66.66666666666666,99.17455613613129,2022-10-12
306,FX Street,Bitcoin risks key support as trader says BTC price bottomed at $17.6K,"Bitcoin wicked below $19,000 on Oct. 11 as crucial support saw its first test in a week. BTC/USD 1-hour candle chart (Bitstamp). Source: TradingView B (Read More...)",57.655,50.0,0.4308044910430908,41.105000000000004,62.5,0.008207559585571289,2022-10-12
307,crypto.news,"CNN Announces End to Its NFT Marketplace, Vault","The Vault by CNN, a debut Web3 experiment by the international media house, has come to an end. (Read More...)",50.0,50.0,0.2075672149658203,50.0,62.5,0.3192126750946045,2022-10-12
308,Chain Debrief,From Apple To LVMH: Here’s 5 Ways Top Companies Are Using Blockchain Technology,"Key Takeaways: Companies like Apple, LVMH, and Disney are increasingly venturing into Web3.0 By using a decentralized, immutable ledger, they can ensure a safe and reliable chain of information NFTs and the metaverse have also been a key gateway for major companies _______________________________... (Read More...)",60.114999999999995,75.0,96.555295586586,89.53,60.62499999999999,99.95298683643341,2022-10-12
309,CoinGape,"CNN Abandons NFT Project, Users Accuse of Rug Pull",(Read More...),26.165,50.0,0.010570883750915527,50.0,75.0,96.50535881519318,2022-10-12
310,U.Today,Peter Schiff Called Out Billionaire Paul Tudor Jones For Holding Bitcoin,Fund manager does not believe billionaire holds significant amount of Bitcoin (Read More...),50.0,50.0,0.4238605499267578,60.114999999999995,71.875,0.2569913864135742,2022-10-12
311,CoinGape,"Ripple Expands Further In Europe, Here’s How XRP Price May Move",Ripple on Tuesday announced two new On-Demand Liquidity (ODL) partners amid its continued expansion in Europe. The payment settlement protocol firm Ripple partnered with payment provider Lemonway in France and money transfer provider Xbaht in Sweden. Ripple’s latest partnerships and strong positi... (Read More...),55.135,50.0,98.78287315368652,75.53,63.696969696969695,99.86622333526611,2022-10-12
312,Cryptonews,XRP Price Prediction – Will XRP Jump to $1 This Week?,"Ripple’s XRP token is in the spotlight again with a strengthening technical analysis outlook for the token. At the same time, investors are becoming more hopeful that a long legal battle with America’s financial regulator could soon end and, with XRP potentially skyrocketing as a result.... Read ... (Read More...)",50.0,50.0,0.040653347969055176,84.50500000000001,58.88888888888889,99.68111217021942,2022-10-12
313,CryptoSlate,Terra USTC spikes 33% after talks of re-peg,"De-pegged Terra Classic stablecoin, Terra UST (USTC), rose by over 30% after the emergence of a proposal by Terra classic core developer Tobias Andersen to re-peg the token. (Read More...)",50.0,50.0,0.13133883476257324,50.0,67.91666666666667,0.0017940998077392578,2022-10-12
314,Coinnounce,"Could This Week's 15% Drop In Ethereum Signal A Retreat To The $1,000 Support?","Ethereum has had a good week, increasing its price by 3.7% and spending the last seven days in the cryptocurrency market's positive territory. (Read More...)",67.0,50.0,0.022485852241516113,87.895,67.8409090909091,92.67116785049438,2022-10-12
315,U.Today,XRP: Here Are Next Key Dates in Ripple-SEC Lawsuit,October 24 remains key date (Read More...),38.685,50.0,0.2984076738357544,50.0,62.5,88.66598904132843,2022-10-12
316,Blockworks,Coinbase Secures Crypto Payments License in Singapore,"Coinbase joins 17 others in receiving in-principle approval from the central bank of Singapore, having held an exemption until now The post Coinbase Secures Crypto Payments License in Singapore appeared first on Blockworks. (Read More...)",65.91,50.0,99.38071370124817,82.985,62.5,96.07444405555725,2022-10-12
317,FX Street,The crypto market: Numbness or stability?,"Bitcoin rose 1.3% over the past week, finishing near $19,500. Ethereum added 1.3% to $1320. Other leading altcoins from the top 10 showed mixed dynami (Read More...)",36.34,50.0,0.018590688705444336,60.114999999999995,59.464285714285715,0.010028481483459473,2022-10-12
318,FX Street,Falling stocks demoralise crypto buyers,"Bitcoin is losing 1.9% over the past 24 hours, falling back to $19K amid falling stock indices and a stronger US dollar. BTCUSD has rolled back to las (Read More...)",42.345,50.0,0.062394142150878906,35.199999999999996,53.125,0.0007510185241699219,2022-10-12
319,FX Street,"Polkadot price on edge, slight bearish wind could trigger a 20% nosedive","Polkadot price shows a full-fledged bearish continuation pattern that could trigger a steep decline if buyers do not intervene. If, as expected, bulls (Read More...)",50.0,41.66666666666667,0.10533630847930908,50.0,66.66666666666666,0.03177821636199951,2022-10-12
320,crypto.news,Portugal Proposes a 28% Crypto Tax In the 2023 National Budget,Portuguese authorities are proposing a 28% crypto tax in their 2023 budget. The new policy may become effective in next year's national budget. (Read More...),50.0,50.0,0.0745624303817749,73.83500000000001,65.45454545454545,0.028130412101745605,2022-10-12
321,The Block,Large Bitcoin transaction briefly took down bulk of Lightning Network,A Bitcoin developer executed a complex transaction that temporarily caused chaos for the experimental Lightning Network. (Read More...),50.0,50.97883597883598,0.16207396984100342,21.405,55.00000000000001,77.30973958969116,2022-10-12
322,NewsBTC,"Glassnode On Bitcoin Mining: Difficulty Reaches ATH, Profitability Decreases","The latest Glassnode report focuses on the topic of the day: bitcoin mining. While bitcoin’s price has been suspiciously flat for a while, the difficulty adjustment came in and registered an all-time high. Do the miners know something we don’t? Or is there a transfer of power going on behind the ... (Read More...)",48.71,50.0,0.029599666595458984,18.755,57.35,3.98104190826416,2022-10-12
323,U.Today,"Charles Hoskinson Wants Nothing More to Do with XRP, Here’s What Happened",Cardano founder has blocked all XRP trolls who have been attacking him and wants to distance himself from XRP army (Read More...),50.0,67.5,0.6167799234390259,18.755,67.5,0.13142824172973633,2022-10-12
324,Finbold,"Supply of Ethereum in circulation drops by 4,000 ETH in 2 days; Price increase ahead?","The cryptocurrency sector is currently stuck in a bearish trading pattern, but some indicators suggest a price increase in the... Continue reading (Read More...)",65.91,50.0,0.04037320613861084,67.53,62.5,6.212511658668518,2022-10-12
325,Forkast,European Parliament agrees on preliminary crypto regulation,"The European Parliament passed a preliminary legal framework for the crypto space on Monday that aims to increase standards and requirements for digital asset companies, ahead of a final vote expected soon. See related article: Europe cancels AML amendment that would have forced identity verifica... (Read More...)",60.114999999999995,50.0,90.20479619503021,88.015,51.87500000000001,0.031012296676635742,2022-10-12
326,CryptoPotato,"Main TransitFinance Hacker Promises to Refund Another 6,500 BNB","The change of heart is the result of a week of friendly deliberation, according to TransitFinance. (Read More...)",69.08999999999999,58.333333333333336,0.009444355964660645,74.695,71.875,96.9691276550293,2022-10-12
327,CryptoSlate,Couple mistakenly paid $10.5M by Crypto.com defends spending spree as contest winnings,Partners Thevamanogari Manivel and Jatinder Singh stand trial in Australia on charges of theft related to a $10.5 million error on the part of Crypto dot com. (Read More...),65.91,50.0,0.03266036510467529,20.705000000000002,62.5,1.6117751598358154,2022-10-12
328,Decrypt,"US Crypto Exchange Coinbase Beats Out Binance, Lands Regulatory Approval in Singapore","Coinbase beat out other large firms to provide crypto services in the city-state, which continues to send mixed messages to crypto firms. (Read More...)",73.83500000000001,50.0,99.7655063867569,50.0,57.36607142857143,97.3133772611618,2022-10-12
329,Finbold,Crypto expert identifies ‘sell signal’ on XRP chart – is a major correction imminent?,"As the majority of the cryptocurrency market transforms into a sea of red, the price of XRP has not been... Continue reading (Read More...)",50.0,53.125,0.4021584987640381,50.0,62.5,94.5355772972107,2022-10-12
