,source,title,excerpt,vader_sentiment_title,tb_sentiment_title,flair_sentiment_title,vader_sentiment_excerpt,tb_sentiment_excerpt,flair_sentiment_excerpt,date
0,Bitcoin.com,"US Lawmakers Push for Urgent Stablecoin Regulation — Fed Warns of Stablecoin Runs, Janet Yellen Cites UST Fiasco","As U.S. lawmakers push for the urgent regulation of stablecoins, the Financial Stability Oversight Council (FSOC) and the Federal Reserve Board warn about the risks of stablecoin runs that threaten the country’s financial stability. Treasury Secretary Janet Yellen brought up the terrausd (UST) fi... (Read More...)",27.98,50.0,0.4005849361419678,31.94,58.333333333333336,8.887946605682373,2022-05-11
1,Decrypt,Terra's LUNA Plummets by 32% in 1 Hour,The price of LUNA continued to spiral downward. (Read More...),50.0,50.0,0.006401538848876953,50.0,75.0,0.01500248908996582,2022-05-11
2,Forbes,"Where Are Bitcoin Prices Heading Next After Falling Below $30,000?",Bitcoin prices fell to their lowest since July yesterday. What's next for the digital currency? Several experts offer their input. (Read More...),42.345,50.0,0.011107325553894043,30.910000000000004,56.25,8.142369985580444,2022-05-11
3,Crypto Briefing,Michael Saylor Defends Bitcoin-Backed Loan,Michael Saylor has weighed in on concerns that his company’s Bitcoin-backed loan from Silvergate could be margin called by stating his willingness to put up even more Bitcoin to maintain... (Read More...),50.0,50.0,21.152013540267944,63.660000000000004,75.0,87.47120499610901,2022-05-11
4,Bitcoinist,"Cardano Founder Says Yes, This Is A Bear Market",The crypto market has taken a beating recently and Cardano has been one of the worst-hit digital assets. This has sparked fear across the market where investors are lamenting that the crypto space is finally headed into another bull market. Cardano Founder Charles Hoskinson has taken to addressin... (Read More...),70.095,50.0,95.40641903877258,9.120000000000001,56.25,0.02835690975189209,2022-05-11
5,CryptoPotato,Thieves Are Targeting UK Investors’ Phones to Steal Crypto: Report,Multiple reports from victims have confirmed a new wave of muggers targeting the phones of crypto investors to steal their assets. (Read More...),12.104999999999999,50.0,0.07179677486419678,20.705000000000002,62.95454545454545,0.05491375923156738,2022-05-11
6,The Block,Terra blockchain token LUNA falls below $15,"The price of LUNA, the governance token of the Terra blockchain ecosystem, fell sharply on Tuesday. (Read More...)",50.0,50.0,0.003248453140258789,50.0,59.375,0.009337067604064941,2022-05-11
7,Decrypt,Ethereum NFT Prices Bounce Back After Crypto Crash—But Azuki Keeps Tanking,"Moonbirds, Bored Apes, and other NFT projects are seeing rising prices after Monday’s dip, but Azuki is only crashing harder. (Read More...)",50.0,50.0,23.511090874671936,42.97,47.75,13.137829303741455,2022-05-11
8,CryptoPotato,LUNA Collapses Below $16 as TerraUSD Remains Unpegged,Terra has nearly fallen out of crypto’s top 20 coins after its price collapsed 63% on the day. (Read More...),35.199999999999996,50.0,0.013527274131774902,28.925,68.33333333333333,0.021794438362121582,2022-05-11
9,AMBCrypto,Shiba Inu [SHIB] whales go sulking; could retail traders drive the prices up,Shiba Inu is criticized by a large part of market participants precisely because of its ‘meme-coin’ nature and also because whales tend to dominate the SHIB market more often. The dominance of whales makes SHIB more susceptible to dumps. It also puts regular investors at risk who jumped onto the ... (Read More...),31.94,50.0,0.7082164287567139,14.079999999999998,67.61904761904762,0.040909647941589355,2022-05-11
10,The Block,"Napster acquired by Hivemind, Algorand at undisclosed price","Napster, once popular in the early 2000s for peer-to-peer audio file sharing, has been acquired by Hivemind and Algorand, the teams announced today. (Read More...)",50.0,50.0,0.11927485466003418,84.04,70.0,80.45719861984253,2022-05-11
11,The Daily Hodl,"Here’s Why Solana (SOL) Is Still the Number One Ethereum (ETH) Competitor, According to InvestAnswers","A popular crypto analyst is highlighting the reasons why he believes Solana (SOL) is still the top Ethereum (ETH) challenger. The anonymous host of InvestAnswers tells his 436,000 YouTube subscribers that his “Day One Thesis” was that SOL was his Ethereum hedge as he considers Solana the only pot... (Read More...)",53.86,50.0,3.693610429763794,81.245,70.0,11.28551959991455,2022-05-11
12,The Daily Hodl,Federal Reserve Says Private Stablecoins Vulnerable to Runs in New Report,"The U.S. Federal Reserve is voicing concerns about the viability of cryptocurrency stablecoins and is suggesting the utility of government-backed alternatives. In a wide-ranging report discussing financial stability across numerous economic sectors, the Fed identifies risks associated with so-cal... (Read More...)",38.685,43.93939393939394,0.5189478397369385,36.34,58.75,77.71989703178406,2022-05-11
13,Bitcoin.com,"Report: Nigerian CBDC Wallet Update to Enable Utility Payments, USSD Functionality to Be Added",The Nigerian central bank digital currency (CBDC) wallet app is set for an update that will see users given the ability to pay for utilities like pay television and for topping up airtime. The addition of the unstructured supplementary service data (USSD) functionality to the wallet app means peo... (Read More...),50.0,50.0,2.350667119026184,72.94,58.333333333333336,0.12910962104797363,2022-05-11
14,Decrypt,Shiba Inu Is Rebounding Faster Than Dogecoin After Crypto Crash,"Both coins fell hard on Monday along with the wider market, but SHIB is fetching speeder returns than its meme rival. (Read More...)",29.905000000000005,50.0,99.96694028377533,47.42,55.208333333333336,97.90643751621246,2022-05-11
15,Blockworks,Coinbase Stock Plummets as Crypto Exchange Posts $430 Million Loss,"Coinbase’s monthly transacting users dropped to 9.2 million, coming in shy of analysts’ estimate of 9.5 million The post Coinbase Stock Plummets as Crypto Exchange Posts $430 Million Loss appeared first on Blockworks. (Read More...)",34.089999999999996,50.0,0.0012874603271484375,24.47,54.166666666666664,0.0013053417205810547,2022-05-11
16,CryptoGlobe,40% of Bitcoin ($BTC) Investors Are Now Sitting on Unrealized Losses,"The price of Bitcoin ($BTC) recently plunged to $31,000 after a series of withdrawals on the Anchor Protocol sled to the largest decentralized stablecoin, UST, losing its peg. Bitcoin’s crash has seen 40% of investors in the cryptocurrency sit on unrealized losses. In response to the UST crisis, ... (Read More...)",29.905000000000005,50.0,0.0015914440155029297,4.89,62.5,0.013026595115661621,2022-05-11
17,CoinGape,New Data Signals Institutional Players Are Offloading Bitcoin,"Institutional investors are reportedly contributing largely to selling pressures on the negative price premium. Negative trading pressures from institutional investors Compared to retail investors, institutional investors do not sell or buy in small quantities. They are often recognised with big ... (Read More...)",50.0,56.81818181818181,8.413505554199219,4.994999999999999,48.86904761904762,0.08594989776611328,2022-05-11
18,Blockworks,Trading Volumes Spike on Azuki NFTs After Creator Admits to Failed Projects,Azuki founder Zagabond revealed he was part of three failed NFT projects within the past year The post Trading Volumes Spike on Azuki NFTs After Creator Admits to Failed Projects appeared first on Blockworks. (Read More...),36.34,25.0,11.757376790046692,17.015,45.0,0.004971027374267578,2022-05-11
19,Decrypt,Crypto Twitter Reacts to UST Collapse and Market Meltdown,"Insights, warnings, and revenge were all on the table as Crypto Twitter watched Terra’s stablecoin plummet in real time. (Read More...)",25.305,50.0,2.9604464769363403,15.960000000000003,67.5,3.09751033782959,2022-05-11
20,CoinGape,"Coinbase Misses First Quarter Revenue, $COIN Shares Plummet",Cryptocurrency exchange Coinbase reported a 35% drop in revenue in the first quarter as volatile market conditions and lower crypto asset prices directly impacted its results. Its total revenue in the quarter fell to $1.17 billion from $1.80 billion in the same quarter last year. Trading volume a... (Read More...),53.86,62.5,0.0028192996978759766,39.885,57.08333333333333,0.011107325553894043,2022-05-11
21,Bitcoin Magazine,The Sky Is Not Falling: Why The Bitcoin Price Doesn’t Matter,"The recent bitcoin price action demonstrates that it’s time for a more grown-up culture of building, development and adoption around Bitcoin. (Read More...)",56.955,50.0,84.21877920627594,50.0,63.74999999999999,99.2040753364563,2022-05-11
22,Decrypt,What Terra's Meltdown Means for Centralized Stablecoins Tether and USDC,Tether's co-founder and DeFi execs weigh in on what the collapse of Terra's UST means for asset-backed stablecoins like USDT and USDC. (Read More...),50.0,50.0,93.33765804767609,41.105000000000004,75.0,91.14468097686768,2022-05-11
23,BeInCrypto,Web 3.0 Startup Jambo Looks to Become WeChat of Africa Following $30M Funding Round,African startup Jambo is looking to emulate the success of Tencent's WeChat in onboarding Africa onto its planned Web3 social and commerce hub. The post Web 3.0 Startup Jambo Looks to Become WeChat of Africa Following $30M Funding Round appeared first on BeInCrypto. (Read More...),50.0,45.0,20.792272686958313,78.595,56.30952380952381,23.035120964050293,2022-05-11
24,Blockworks,European Union Plans Pilot Project on DeFi Supervision,A new DeFi report shows how the brainpower of Brussels’ bureaucracy is looking into Web3 and digital assets The post European Union Plans Pilot Project on DeFi Supervision appeared first on Blockworks. (Read More...),50.0,50.0,10.929358005523682,58.894999999999996,58.86363636363636,14.082229137420654,2022-05-11
25,Cointelegraph,Environmental groups urge US government to take action on crypto miners,"Among the proposals, the group of eight organizations requested the Environmental Protection Agency subject PoW mining firms to “stringent reviews” around operating permits. (Read More...)",50.0,55.00000000000001,0.6336897611618042,50.0,58.333333333333336,2.9963165521621704,2022-05-11
26,CryptoPotato,"KuCoin Bags $150M at $10B Valuation to Focus on Web3, NFT, and DeFi","KuCoin plans to expand to Web 3.0, crypto wallets, GameFi, DeFi, and NFT platforms with the latest financing round. (Read More...)",50.0,50.0,0.511854887008667,65.91,63.33333333333333,97.62146174907684,2022-05-11
27,AMBCrypto,Dogecoin’s 100% spike in trading volume- Here’s what you shouldn’t miss out on,"Do you hold some Dogecoins? Are you an advocate for this meme coin as the ‘future currency of the internet?’ Well, in that case, you should know that in the last 24 hours, the coin recorded a significant spike in its trading volume. At a 200% spike in its trading volume in the last 24 […] (Read More...)",42.345,50.0,99.9094694852829,75.2,58.75,4.0518224239349365,2022-05-11
28,crypto.news,Australia Set to Finally Launch Bitcoin ETF This Week,"After an initial setback last month, Australia is set to release its crypto exchange-traded funds (ETFs). The set of ETFs formally slated to launch last month will be listed on the Cboe exchange this Thursday to track the performance of… (Read More...)",50.0,50.0,99.46211874485016,50.0,56.25,3.9752811193466187,2022-05-11
29,CryptoPotato,Our Ambition is to Become the Amazon of Crypto: Interview with Coinbase’s Guillaume Chatain,"Coinbase's Head of EMEA, Guillaume Chatain, explains how he transitioned to crypto from JPM, the exchange's ambition to become the Amazon of crypto, Coinbase's culture under Brian Armstrong, and the current institutional outlook. (Read More...)",58.894999999999996,50.0,99.08393323421478,58.894999999999996,62.5,95.40382921695709,2022-05-11
30,CryptoPotato,Townsquare Media Purchased $5 Million in Bitcoin During Q1 2022,The digital media is interested in Bitcoin for the long term but is currently down on its investment. (Read More...),50.0,50.0,3.204554319381714,60.72,55.44444444444444,0.07822811603546143,2022-05-11
31,Bitcoin Magazine,Bitcoin Is Venice: Sustaining The Unsustainable,Bitcoin can repair the broken incentive systems created by finance and low interest rates that lead to unsustainable practices. (Read More...),50.0,50.0,99.83940720558167,65.91,51.66666666666666,77.66222655773163,2022-05-11
32,Bitcoin Magazine,"God Is Dead, Bitcoin Lives",A philosophical discussion based on ideas popularized by Friedrich Nietzsche with Bitcoin as a new-world mythology to replace current beliefs. (Read More...),25.305,40.0,0.06644129753112793,72.02,58.333333333333336,86.24523878097534,2022-05-11
33,BeInCrypto,"Talos Reaches Unicorn Status with $1.25B Valuation, Backing includes Citigroup, Wells Fargo, BNY Mellon","A $105 million Series B funding round led by some of the world’s leading banks puts crypto trading tech developer Talos’ valuation at $1.25 billion. The post Talos Reaches Unicorn Status with $1.25B Valuation, Backing includes Citigroup, Wells Fargo, BNY Mellon appeared first on BeInCrypto. (Read More...)",65.91,50.0,99.16286170482635,65.91,59.166666666666664,18.098992109298706,2022-05-11
34,Decrypt,Michael Saylor Says MicroStrategy Could Post ‘Other Collateral’ if Bitcoin Crashes,The Bitcoin believer doesn’t appear to be selling his company’s stockpile anytime soon. (Read More...),50.0,43.75,0.6955206394195557,50.0,75.0,0.07835924625396729,2022-05-11
35,Decrypt,"Coinbase Misses Q1 Revenue Target, Posts $430M Loss",Coinbase missed analyst predictions in terms of both profit and revenue for Q1 of 2022. (Read More...),25.305,50.0,0.023555755615234375,58.894999999999996,75.0,0.022205710411071777,2022-05-11
36,CoinGape,Just-In: English Football Club Arsenal Enters NFT Craze,"English football club Arsenal is partnering with Unagi’s fantasy football game Ultimate Champions, the Premier League team announced on Tuesday. The long-term partnership allows users to play cross-league fantasy football free of cost, with an option to trade player NFTs with other users in the p... (Read More...)",42.345,50.0,78.32121849060059,92.21,53.125,97.59911000728607,2022-05-11
37,CryptoBriefing,“Ethereum Killers” Underwater Against Ethereum,"Amidst a sustained crypto market correction that began last November, many of the Layer 1 smart contract platforms meant to compete with Ethereum have been severely depressed in terms of... (Read More...)",50.0,50.0,3.78686785697937,22.13,65.17857142857143,0.0011801719665527344,2022-05-11
38,The Block,Coinbase posts net loss of $430 million for Q1 2022,Crypto exchange company Coinbase said it incurred a net loss of $430 million during 2022's first quarter. (Read More...),34.089999999999996,50.0,0.004684925079345703,34.089999999999996,62.5,0.006562471389770508,2022-05-11
39,U.Today,Shiba Inu About to Surpass Terra's LUNA After Double-Digit Price Spike,Meme coin Shiba Inu is a hair’s breadth away from surpassing Terra (LUNA) after a 10% spike (Read More...),50.0,50.0,3.665950894355774,50.0,75.0,1.1798441410064697,2022-05-11
40,Cointelegraph,Altcoins stage a relief rally while Bitcoin traders decide whether to buy the dip,"Stocks and altcoin prices bounced as the sell-off in BTC took a pause, but analysts continue to warn that further downside could occur shortly. (Read More...)",73.83500000000001,50.0,1.4457106590270996,26.165,58.333333333333336,0.23682117462158203,2022-05-11
41,Decrypt,Someone Forgot to Tell the Washington Nationals About Terra,The Major League Baseball team is in the basement. So is Terra. (Read More...),50.0,50.0,7.480645179748535,50.0,64.0625,0.5105584859848022,2022-05-11
42,CryptoPotato,Pac-Man Frog: Solana-Based Project Leading Web3 Innovations,"The digital asset industry is evolving at a breakneck pace, and new trends are being formed as developers continue to explore the different use cases of blockchain technology. Crypto trends such as decentralized finance (DeFi), non-fungible tokens (NFTs), GameFi, Web3, and the Metaverse, have rec... (Read More...)",50.0,50.0,99.88912642002106,68.06,56.36363636363636,99.90848898887634,2022-05-11
43,The Daily Hodl,"Institutional Investors Are Accumulating a Top Ethereum Rival and Stockpiling Bitcoin, According to Crypto Asset Firm CoinShares","A leading crypto asset manager says institutional investors bought Bitcoin’s (BTC) low last week, giving digital investment products their first week of inflows since early April. In the latest edition of their weekly Digital Asset Fund Flows Weekly Report, CoinShares finds institutions invested ... (Read More...)",75.53,57.49999999999999,0.6563663482666016,82.43,58.4375,4.702034592628479,2022-05-11
44,Bitcoin.com,Crypto Downturn Shakes Digital Collectible Markets as NFT Sales Slip 42% Lower Than Last Week,"Non-fungible token (NFT) markets are starting to feel the pain from the crypto market carnage that’s taken place during the last week. Over the last seven days, NFT sales have dropped 42.85% lower than the previous week. NFT sales on Ethereum were hit the hardest as the blockchain saw a 44.83% lo... (Read More...)",35.199999999999996,41.66666666666667,0.015056133270263672,16.475,53.333333333333336,0.0015914440155029297,2022-05-11
45,Bitcoinist,"Ricardo Salinas’ Bitcoin Masterclass, Pt 3: Understand Both – w/ Keiser & Herbert","Welcome to the last installment of Ricardo Salinas’ Bitcoin Masterclass. The billionaire and his two hosts already discussed the fiat fraud and sound money, but they have yet to bring it all together so you can “understand both.” In this episode, it all comes full circle. Keiser and Herbert get R... (Read More...)",50.0,50.0,99.96196031570435,44.865,70.5,99.91324245929718,2022-05-11
46,BeInCrypto,Reserve Rights (RSR) Scrambles for Support After 94% Drop Since All-Time High,Reserve Rights (RSR) is trading inside a bullish pattern but has broken down from a long-term support level. The post Reserve Rights (RSR) Scrambles for Support After 94% Drop Since All-Time High appeared first on BeInCrypto. (Read More...),57.655,57.99999999999999,0.3053039312362671,53.86,53.54444444444444,0.1144111156463623,2022-05-11
47,CryptoPotato,AMC CEO Reveals the Total of Crypto Payments Made in Q1,"Digital assets like Bitcoin, Ether, Bitcoin Cash, Litecoin, Dogecoin, and Shiba Inu formed about 35% of AMC's online payments during Q1 2022. (Read More...)",50.0,50.0,0.12979209423065186,74.695,62.5,92.13253557682037,2022-05-11
48,Cointelegraph,"Michael Saylor assuages investors after market slumps hurts MSTR, BTC","As MicroStrategy stock slumps, Michael Saylor remains confident Bitcoin holdings will cover a potential margin-call on BTC-backed loans. (Read More...)",26.165,50.0,13.138729333877563,74.695,66.66666666666666,97.80578911304474,2022-05-11
49,Decrypt,"Square Alums Raise $11M for Highlight, the 'Fan Club of the Future'","Founded by Square veterans, the company seeks to provide an easy-to-use suite of Web3 tools for creators to build up fan bases. (Read More...)",78.595,50.0,92.03079044818878,65.91,75.0,98.75548183917999,2022-05-11
50,Blockworks,FTX Rolls Out Program To Support Underbanked Chicago Communities,The US affiliate of the Bahamas-based crypto exchange names Chicago as its headquarters The post FTX Rolls Out Program To Support Underbanked Chicago Communities appeared first on Blockworks. (Read More...),70.095,50.0,98.85397851467133,70.095,68.75,15.032902359962463,2022-05-11
51,The Block,"Washington’s think tanks and wonks turn to stablecoins, CBDCs","Washington, DC's world of think tanks had been gearing up to address the issue of fiat-backed stablecoins. (Read More...)",50.0,50.0,3.2043546438217163,50.0,75.0,4.941144585609436,2022-05-11
52,The Daily Hodl,"It’s Time for Crypto Traders To Get Greedy, According to Analyst Nicholas Merten – Here’s His Take on Bitcoin and Ethereum","A widely-followed crypto analyst says right now is not the time to be calling for a bear market, despite worrisome price action. DataDash host Nicholas Merten tells his 516,000 YouTube subscribers that the Ethereum to Bitcoin ratio (ETH/BTC) shows that a risk-on sentiment is still proliferating i... (Read More...)",34.089999999999996,50.0,0.4522055387496948,65.445,64.76190476190476,0.16617774963378906,2022-05-11
53,The Daily Hodl,Top Crypto Analytics Firm Says Bitcoin (BTC) Flashing Signs of Notable Bounce As Trader Sentiment Turns Sour,"Crypto market-intelligence platform Santiment says that a gloomy reaction to Bitcoin (BTC) falling below $30,000 to start the week is necessary for a rebound. Santiment says that the purging of traders and investors who exit the market at the first sign of plummeting prices usually leads to a “tr... (Read More...)",60.114999999999995,58.12500000000001,1.1897295713424683,35.199999999999996,56.25,0.0014066696166992188,2022-05-11
54,Bitcoinist,Bitcoin Inflows Continue Steep Rise As Selloff Rages On,"On-chain data shows Bitcoin exchange inflows have continued their recent sharp rise as the price of the crypto drops further. 7-Day MA Bitcoin Exchange Inflow Continues To Point Up As pointed out by an analyst in a CryptoQuant post, BTC inflows are steeply rising as the selloff in the market rage... (Read More...)",26.165,50.0,4.853707551956177,50.0,54.6875,1.1638224124908447,2022-05-11
55,crypto.news,"China Doubles Down on CBDC, Expands Tests for Digital Yuan","In recent times, China has looked towards expanding its digital yuan usage trials by paying the wages of government employees using the currency. There are reports of the e-CNY also gaining adoption in hospitals and other municipal services. China Expands… (Read More...)",55.135,46.11111111111111,0.7055848836898804,71.075,54.6875,14.04564082622528,2022-05-11
56,BeInCrypto,Crypto Exchange KuCoin Hits $10B Valuation Following Latest Funding Round,"Global cryptocurrency exchange KuCoin has clocked a valuation of $10 billion in its latest funding round, the company announced in a statement on Tuesday. The post Crypto Exchange KuCoin Hits $10B Valuation Following Latest Funding Round appeared first on BeInCrypto. (Read More...)",50.0,55.00000000000001,4.181152582168579,50.0,58.4375,1.7929404973983765,2022-05-11
57,Decrypt,You'll Never Guess Which Coin Is Defying the Crypto Crash,"Even in this crypto winter, somewhere a Sun is shining. (Read More...)",29.905000000000005,50.0,0.17232298851013184,50.0,75.0,76.69966220855713,2022-05-11
58,U.Today,Dogecoin Foundation Hiring Web Developer,The Dogecoin Foundation is looking for a skilled web developer (Read More...),50.0,50.0,94.76599097251892,50.0,75.0,2.2706925868988037,2022-05-11
59,CryptoGlobe,Bitcoin ($BTC) Whales in Accumulation Trend as Index Signals ‘Extreme Fear’ in Market,Bitcoin ($BTC) whales are reportedly in an ongoing “accumulation trend” even as the Crypto Fear &amp; Greed Index signals there’s currently “extreme fear” on the market as investors divest of their holdings while prices drop. According to data from on-chain analytics firm Santiment shared on soci... (Read More...),50.0,43.75,0.09545385837554932,15.960000000000003,52.916666666666664,0.024318695068359375,2022-05-11
60,Blockworks,"Cryptocurrency Luna Lurches as Terra USD Volatility Continues, Erasing Billions","Do Kwon claims he’s “close to announcing a recovery plan for $UST” The post Cryptocurrency Luna Lurches as Terra USD Volatility Continues, Erasing Billions appeared first on Blockworks. (Read More...)",50.0,50.0,0.026085972785949707,50.0,68.75,0.06477236747741699,2022-05-11
61,Ethereum World News,"Michael Saylor: MicroStrategy Could Post Some Other Collateral for its Loan Besides its 115k BTC, if Bitcoin Drops below $3,562","Quick take: Michael Saylor has clarified that MicroStrategy can collateralize its $205 million loan from SilverGate bank with its 115,109 Bitcoin holdings He also added that Microstrategy could post ‘some other type’ of collateral if Bitcoin fell below $3,562 There have been a lot of murmurs abou... (Read More...)",50.0,43.75,15.250951051712036,50.0,61.80555555555556,18.14216673374176,2022-05-11
62,The Block,Luna Foundation Guard seeks more than $1 billion to shore up UST stablecoin: sources,The Luna Foundation Guard has held talks with large investors with the aim of raising over $1 billion to shore up UST amid weakening sentiment in the crypto market. (Read More...),50.0,75.0,0.24657845497131348,34.089999999999996,67.85714285714286,0.8353501558303833,2022-05-11
63,AMBCrypto,Here’s why IOTA [MIOTA] seems to be defying the odds in a market crash,"Waking up and checking the crypto market stats this morning must have been like stepping into a crime scene for many. Yet, the market is what it is and investors can do naught but stare at their red portfolios in dismay, wondering when the bears will be gone for good. That being said, there are […] (Read More...)",29.905000000000005,50.0,0.2536952495574951,45.5,71.25,0.8066713809967041,2022-05-11
64,Cointelegraph,The Fed cites worries about stablecoin in its latest Financial Stability Report,"The report points out stablecoin’s possible low stress resistance and overuse in leveraged cyptocurrency trading, reiterates its position on CBDC. (Read More...)",28.925,62.5,4.297316074371338,20.029999999999998,58.333333333333336,7.474836707115173,2022-05-11
65,CryptoPotato,Indian Tax Authorities Mulling Highest 28% GST Slab for Crypto Activities: Report  ,"A GST committee is believed to be studying various crypto activities such as trading, wallet, and staking to formulate appropriate tax provisions. (Read More...)",50.0,50.0,0.09413957595825195,50.0,62.5,0.237274169921875,2022-05-11
