,source,title,excerpt,vader_sentiment_title,tb_sentiment_title,flair_sentiment_title,vader_sentiment_excerpt,tb_sentiment_excerpt,flair_sentiment_excerpt,date
256,CryptoSlate,Here’s what to expect as Vasil readies for Cardano roll out,Input Output tweeted an update on June 7 regarding the up-and-coming Vasil hard fork. (Read More...),50.0,50.0,97.2575694322586,44.865,55.208333333333336,0.03352761268615723,2022-06-09
257,Blockonomi,"Blocto Review: A Cross Chain Wallet, DEX, NFT Marketplace & More","Blocto was recently introduced as a cross-chain crypto wallet. Its is working to build an entire ecosystem that connects blockchain applications (dApps), multiple crypto, NFT assets for both users and developers to easily get in touch with those platforms. What is Blocto Behind Blocto and Blocto ... (Read More...)",50.0,62.5,99.89199042320251,73.83500000000001,54.44444444444444,99.88016784191132,2022-06-09
258,The Block,Kushki hits unicorn status as payments platform raises $100 million,The payments platform based in Ecuador has raised $100 million in Series B financing at a unicorn valuation. (Read More...),50.0,50.0,95.05361020565033,50.0,75.0,96.63265347480774,2022-06-09
259,Feed - Cryptopotato.Com,Solana Raises $100 Million to Support Crypto Projects in South Korea,The $100 million fund will be primarily focused on projects based on Solana and Terra. (Read More...),70.095,50.0,98.91279637813568,69.08999999999999,72.5,85.43436527252197,2022-06-09
260,U.Today,Litecoin (LTC) Gets Delisted from Biggest South Korean Exchanges,Biggest South Korean exchanges decided to terminate Litecoin (LTC) operations (Read More...),50.0,50.0,0.10034441947937012,50.0,75.0,0.007319450378417969,2022-06-09
261,U.Today,Chainlink Announces New Era with Introduction of Staking,Chainlink heralds new era introducing staking to its blockchain (Read More...),50.0,56.81818181818181,99.94074702262878,50.0,65.9090909090909,99.86850619316101,2022-06-09
262,The Block,Marathon CEO explains the 3 key factors that make or break a bitcoin mining company,"In this episode of The Scoop, Fred Thiel — CEO of bitcoin mining firm Marathon — breaks down what it takes to run a successful bitcoin mining operation. (Read More...)",50.0,50.0,94.91685926914215,82.985,61.18055555555555,80.64486086368561,2022-06-09
263,crypto.news,Bitcoin (BTC) Miners Revenue Continues to Decline as its Price Struggles to Stay Above $30K,"According to a Glassnode tweet, Bitcoin miners’ revenue has continued to decline, while the cost of production has also increased due to the market’s current state. Tron DAO also transferred $100 million $USDT to Binance to buy more BTC and… (Read More...)",31.94,50.0,0.017762184143066406,63.660000000000004,60.9375,0.007903575897216797,2022-06-09
264,Blockworks,"Citadel Securities, Virtu Financial Building Crypto Trading Platform","Firms say new marketplace addresses the deficiency in the current crypto market structure that’s holding back wider adoption The post Citadel Securities, Virtu Financial Building Crypto Trading Platform appeared first on Blockworks. (Read More...)",64.8,50.0,99.81496632099152,64.8,57.38636363636363,23.074951767921448,2022-06-09
265,Bitcoinist,Crypto Exchange Phemex Names Manchester City Kevin de Bruyne As Brand Ambassador,"Manchester City football star Kevin de Bruyne has been announced as the official brand ambassador for cryptocurrency exchange, Phemex. The move mirrors that of many others in the crypto space who have ventured into the sports stage and vice versa. As a top-rated footballer, de Bruyne is loved and... (Read More...)",50.0,50.0,15.138885378837585,79.97000000000001,78.33333333333333,99.95233714580536,2022-06-09
266,CoinGape,Starling Bank’s President Calls Cryptocurrencies “Very Dangerous.”,"The president of Goldman Sachs-backed digital bank Starling, Anne Boden, has harshly criticized cryptocurrencies. Starling chief thinks cryptocurrencies are a threat to payment infrastructure. (Read More...)",50.0,10.999999999999998,0.06647109985351562,14.52,55.00000000000001,0.08381307125091553,2022-06-09
267,Decrypt,Chainlink Hits Four-Week High Following Updated Staking Roadmap Release,The price of theLINK token soared to a four-week high following Chainlink's announcement of the staking launch in the second half of 2022. (Read More...),50.0,54.0,8.906060457229614,50.0,54.93333333333334,0.026163458824157715,2022-06-09
268,Cointelegraph,Major South Korean crypto exchanges delist Litecoin,Crypto regulations in South Korea require exchanges to enforce strict KYC and AML guidelines and major crypto exchanges have delisted privacy coins in the past as well. (Read More...),50.0,53.125,85.3197455406189,90.19,55.208333333333336,11.043122410774231,2022-06-09
269,Finbold,"Bitcoin transaction fees at 3-year lows, a signal of bear market?","Although the cryptocurrency market has turned green overall today, some crypto experts are seeing signals that the current bearish trend... Continue reading (Read More...)",39.885,50.0,0.002866983413696289,50.0,53.75,98.60736727714539,2022-06-09
270,The Block,Yuga Labs revokes code that allowed creation of infinite Bored Apes,Twitter users had long warned that Yuga Labs was able to mint as many Bored Apes as it wanted. It has finally fixed the issue. (Read More...),50.0,25.0,1.456618309020996,25.305,58.75,92.45944321155548,2022-06-09
271,BeInCrypto,Checkout.com to Accept Stablecoins as Regulators Look to Impose Tighter Rules,Online payments giant Checkout.com has become the latest financial services firm to accept crypto. The post Checkout.com to Accept Stablecoins as Regulators Look to Impose Tighter Rules appeared first on BeInCrypto. (Read More...),55.135,50.0,0.8437752723693848,72.94,58.75,77.24579870700836,2022-06-09
272,Crypto Daily,Trading Simulation Tool Pollen Virtual Goes Live On Mainnet,"Pollen, a decentralized crypto asset management platform, successfully completed the mainnet launch of Pollen Virtual. Pollen Virtual is Pollen’s first trading simulation product and was deployed after a community vote. The launch lays the groundwork for other upcoming asset-backed Pollen indexes... (Read More...)",50.0,56.81818181818181,17.337292432785034,84.53999999999999,67.1875,99.89133775234222,2022-06-09
273,Cointelegraph,IMF recommends eco-friendly CBDCs and non-PoW mechanisms for payments,"In addition to eco-friendly components, the IMF recommended central banks to include other features in the CBDCs, such as compliance, higher resilience and offline capabilities. (Read More...)",61.315,50.0,99.0638256072998,53.86,56.25,90.56695997714996,2022-06-09
274,CoinGape,Just-In: Ripple Hits Out Against SEC As Case Faces More Delays,Ripple on Wednesday filed a new letter against the in the Securities and Exchange Commission (SEC) in their ongoing lawsuit. The letter chides the SEC for adopting a limited understanding of certain market terms mentioned under Ripple’s recent Request for Admission (RFA). Ripple uncovers SEC’s re... (Read More...),50.0,60.0,87.4697208404541,56.400000000000006,52.995129870129865,0.8217483758926392,2022-06-09
275,The Daily Hodl,"Ethereum (ETH) Next Stop at $2,200? Top Crypto Analyst Explains How ETH Kicks Off Next Rally","A popular crypto analyst is exploring buyer interest at different price levels to see where leading smart contract platform Ethereum (ETH) is headed next. In a new strategy session, the anonymous host of InvestAnswers tells his 440,000 YouTube subscribers that, despite a rough start to 2022, ETH ... (Read More...)",44.865,58.333333333333336,0.2906501293182373,90.88000000000001,59.647495361781075,19.58180069923401,2022-06-09
276,U.Today,ADA Preferred by Investors In This Bear Market: Survey,Recent survey on Twitter has shown that during current bear market a lot of investors prefer ADA to other digital currencies (Read More...),50.0,50.0,1.6068488359451294,50.0,53.75,1.2787312269210815,2022-06-09
277,Decrypt,Caitlin Long's Crypto Bank Custodia Sues Fed Over 'Master Account' Delays,"The suit centers on the Fed’s 19-month delay in reviewing the crypto bank’s application, for a process that typically takes up to a week. (Read More...)",50.0,47.5,0.16357898712158203,34.089999999999996,58.333333333333336,0.16331076622009277,2022-06-09
278,CoinGape,This Blockchain Was Halted After A Crippling Bug Cost It $5 Mln,"Osmosis, a layer-1 blockchain on the Cosmos network, was halted on Wednesday after a new bug threatened to drain the chain’s liquidity. Validators stepped in to halt block production after the discovery of a new bug that allows users to get 50% more when withdrawing their deposits from a liquidit... (Read More...)",50.0,50.0,0.13225674629211426,14.52,65.9090909090909,0.030344724655151367,2022-06-09
279,NewsBTC,Japanese Government Reportedly Set To Freez Stolen Crypto – Assets By Passing New Law,"The decentralized nature of crypto assets ensures that transactions and activities involving the assets have no third parties interference. This has remained a leveraging feature that decentralized finance uses against its centralized counterpart. Yet, most criminal activities relating to cryptoc... (Read More...)",31.94,53.40909090909091,0.24147331714630127,39.97,57.49999999999999,99.99333620071411,2022-06-09
280,CryptoPotato,"Following Extreme Volatility Bitcoin Reclaims $30K, Cardano Soars 7% (Market Watch)","The volatile wild ride continued in the past 24 hours but bitcoin now sits above $30,000. Cardano has gained the most from the alts. (Read More...)",50.0,46.875,2.614906430244446,76.335,58.5,5.8806926012039185,2022-06-09
281,CryptoPotato,Degen Dogs Club: An NFT Project for DeFi and NFT Enthusiasts ,"The non-fungible token (NFT) market is booming, and it is expected to reach about $147 billion by 2026. Factors fueling NFT growth include celebrities’ NFT adoption, growing demand for digital artworks, the metaverse, and play-to-earn games. Interestingly, as NFTs attract mainstream users, blockc... (Read More...)",67.0,50.0,99.52841103076935,89.82,61.25000000000001,98.79941642284393,2022-06-09
282,U.Today,Solana to Help South Korean Projects Hurt by Terra Collapse,Solana to heavily invest in South Korean Web3 projects that revolve around gaming (Read More...),20.029999999999998,50.0,99.42338168621063,50.0,57.49999999999999,2.6734501123428345,2022-06-09
283,CryptoGlobe,$ADA: Hollywood Actor Martin Lawrence Is Working on a Cardano-Powered NFT Collection,"On Tuesday (June 7), American comedian and actor Martin Lawrence explained how he is joining the Cardano ($ADA) community. His comments were made during a conversation on Twitter Spaces with Patrick Tobler, Founder and CEO of NFT-MAKER, and Charles Hoskinson, Co-Founder and CEO of IO Global (aka ... (Read More...)",50.0,50.0,83.88606607913971,69.08999999999999,58.333333333333336,2.1633297204971313,2022-06-09
284,Forkast,"Hold onto your crypto bags, the regulators are coming","Falling prices, an imploding stablecoin, and more reports of hacks have occupied the cryptocurrency headlines in recent weeks, so it’s perhaps no surprise that regulators have noticed and they intend to do something about it. (Read More...)",50.0,50.0,87.9592776298523,37.925,66.66666666666666,0.013050436973571777,2022-06-09
285,Crypto Daily,"Swyftx and Superhero merger brings crypto, shares, and pensions under one roof","Swyftx and Superhero have agreed a $1.5 billion merger and will develop a “super app” where clients can manage cryptocurrencies, shares and superannuation all in one place. According to Alex Harper, co-founder of Swyftx, there are too many apps for everything. He wants to see more “fluidity” for ... (Read More...)",64.8,50.0,98.33984076976776,75.53,70.33333333333334,4.521644115447998,2022-06-09
286,U.Today,"Cardano Treasury Exceeded 900 Million ADA Held, Here's What They Spend It On",Treasury of project is growing exponentially while developers are more than happy to share it with ecosystem contributors (Read More...),60.114999999999995,50.0,0.7705092430114746,91.30499999999999,80.0,99.81014430522919,2022-06-09
287,Bitcoin.com,Unity CEO Predicts Websites Will Mutate to Metaverse Destinations Before 2030,"John Riccitiello, CEO of Unity, one of the leading real-time 3D engine providers, has predicted that the internet will become part of the metaverse in the next several years. The executive predicted that most websites will become metaverse destinations and that this change will be mostly complete... (Read More...)",50.0,50.0,0.14351308345794678,50.0,61.0,96.33171856403351,2022-06-09
288,Chain Debrief,Will The GameFi Bubble Explode? 3 Issues The Crypto Gaming Industry Have To Solve,"Does the gaming market in crypto still have potential today? The bear market has spoken: Projects with massive valuations have plummeted significantly across many sectors in crypto. GameFi, one of the most hot topics in the crypto market, is no exception. But is it over for the gaming industry in... (Read More...)",60.114999999999995,50.0,0.0036776065826416016,42.345,65.17857142857143,0.5275219678878784,2022-06-09
289,CoinTelegraph,Don't click links: Crypto community responds to alleged Telegram ‘exposé’,"Telegram announced that the anonymous account's claims are “baseless” and are made to ""get users to download malware."" (Read More...)",50.0,45.0,3.394255042076111,50.0,75.0,0.001984834671020508,2022-06-09
290,CoinGape,Crypto Community Reacts To Proposed US Crypto Bill,US Senators Cynthia Lummis and Kirsten Gillibrand officially revealed their detailed proposed crypto bill. Crypto community reacts positively to the proposed bill. (Read More...),50.0,50.0,92.6544576883316,76.335,68.78787878787878,98.32188785076141,2022-06-09
291,Cryptomode,Figure out the best ways to Crypto: Gnox Token (GNOX) presale is getting more popular by the day offering a spectacular 20% bonus on each purchase,Crypto is an economic sphere developing at a breakneck pace and it is difficult for even experts to stay up to date with all the happenings. But keeping exactly up to date with everything that is happening is often not necessary and is victim to the law of diminishing returns. The best ways to cr... (Read More...),94.77499999999999,83.75,99.60182011127472,76.335,59.82142857142857,2.9047489166259766,2022-06-09
292,Cryptomode,"Parody Coin (PARO), Chiliz (CHZ), and THORChain (RUNE) Could Be Good Investments for Your Future","Cryptocurrencies are all the rage right now, and for a good reason. They offer a new way to invest and make money. But not all cryptocurrencies are created equal. Some, like Parody Coin (PARO), Chiliz (CHZ), and THORChain (RUNE), could be great investments for your future. Keep reading to learn m... (Read More...)",72.02,67.5,0.09735822677612305,95.055,67.30055658627087,4.849600791931152,2022-06-09
293,Cryptomode,"How to Make a Profit from Different Aspects of RoboApe (RBA), Kishu Inu (KISHU), and Chainlink (LINK)","Are you curious about the latest cryptocurrency trends? Would you like to learn more about the fundamental aspects of RoboApe (RBA), Kisha Inu (KISHU), and Chainlink (LINK)? This blog post will discuss some of the most important things you need to know to get started. Stay tuned for more informat... (Read More...)",72.02,50.0,14.347410202026367,86.97,70.0,20.72434425354004,2022-06-09
294,Cryptomode,"Comparing Akita Inu (AKITA), Vita Inu (VITA) and Logarithmic Finance (LOG)","The world of cryptocurrency has boomed and grown exponentially from what it used to be. While the fundamentals of the market have remained the same, there have been constant innovations and token launches. In fact, the world of cryptocurrencies has grown so much that we now have different categor... (Read More...)",50.0,50.0,88.86702954769135,50.0,56.99999999999999,99.77478981018066,2022-06-09
295,Bitcoinist,Terraform Labs Employee In Hot Water For Stealing Company’s Bitcoin,"Seoul Metropolitan Police Agency launched an investigation against an employee from Terraform Labs, who is allegedly involved in the embezzlement of corporate funds in Bitcoin from the company in May. South Korean police stood by its findings that the employee’s unlawful act was purely personal a... (Read More...)",21.405,62.5,14.3943190574646,56.400000000000006,55.00000000000001,0.17868578433990479,2022-06-09
296,Cointelegraph,Crypto-stock trade pairs in the cards as Swyftx inks $1.5B merger with Superhero,"Speaking to Cointelegraph on Wednesday, Swyftx co-CEO Ryan Parsons revealed that its long-term plans are to explore ways to offer trading between traditional and crypto asset classes. (Read More...)",50.0,50.0,3.731381893157959,68.06,62.5,3.2921254634857178,2022-06-09
297,Bitcoinist,Bank Of Uganda Invites Cryptocurrency Businesses To Discuss Technicalities With Central Bank,The Bank of Uganda has advised members of the Blockchain Association of Uganda to understand more about cryptocurrency sector. The bank has stated that it will be glad to work with crypto platforms in its forthcoming Regulatory Sandbox. It referenced a meeting between both parties early last mont... (Read More...),50.0,50.0,85.48920750617981,84.53999999999999,66.0,99.33193325996399,2022-06-09
298,Blockworks,Latest Crypto Venture Fund Drums Up $110M for Web3 Startups,Early-stage venture fund to invest in startups building a decentralized future for the next billion users The post Latest Crypto Venture Fund Drums Up $110M for Web3 Startups appeared first on Blockworks. (Read More...),50.0,75.0,84.82621014118195,50.0,62.5,5.312103033065796,2022-06-09
299,crypto.news,ETH Developers Are Set to Initiate the Ropsten Merge Test Within the Next Two Days,"Ropsten, Ethereum’s oldest testnet, is about to migrate to proof of stake as one of the final tests before the main Ethereum blockchain merges. While the actual time of the Ropsten integration will vary based on a few factors, it… (Read More...)",50.0,50.0,0.4986584186553955,50.0,54.666666666666664,83.97410213947296,2022-06-09
300,Crypto Daily,Why does digital privacy matter?,"Digital privacy has recently become a contentious topic across Europe and the United States. Major companies like Apple have introduced features to prevent data harvesting, and in 2022, roughly half of U.S. state legislatures sought to pass comprehensive data privacy laws to compensate for the la... (Read More...)",51.29,50.0,3.7308156490325928,81.845,53.95833333333333,11.801797151565552,2022-06-09
301,CoinGape,"Binance Courts Philippine License, To Target Southeast Asia",The world’s largest crypto exchange Binance is currently seeking the Virtual Asset Service Provider (VASP) and Electronic Money Issuer (EMI) licenses in the Philippines. Binance CEO “CZ” met with Philippine officials to discuss regulatory and banking support for expansion in the country. Binance ... (Read More...),50.0,50.0,80.67719042301178,81.845,62.5,6.457129120826721,2022-06-09
302,CryptoPotato,Terra Founder Do Kwon’s Twitter Goes Private as LUNA Plunges 20%,"Almost a month after Terra Classic's freefall, its founder Do Kwon has turned his Twitter private. (Read More...)",50.0,50.0,0.0467151403427124,50.0,61.111111111111114,0.005877017974853516,2022-06-09
303,The Block,Osmosis DEX on Cosmos exploited for $5 million as validators halt the network,The Osmosis team confirmed the bug let malicious users drain about $5 million worth of assets from liquidity pools. (Read More...),27.060000000000002,50.0,0.004106760025024414,69.08999999999999,70.0,0.0027060508728027344,2022-06-09
304,BeInCrypto,Solana Ranks Near Bottom on DeFiSafety Technical Risk Score,Independent ratings organization DeFiSafety had few compliments for Solana following its repeated outages and reliability issues this year. The post Solana Ranks Near Bottom on DeFiSafety Technical Risk Score appeared first on BeInCrypto. (Read More...),36.34,52.5,0.07561445236206055,57.655,54.642857142857146,0.5250632762908936,2022-06-09
305,Cointelegraph,'Can it get any easier?' Bitcoin whales dictate when to buy and sell BTC,"Whale buying and selling has effectively told traders how to position their bids and asks, data reveals. (Read More...)",50.0,50.0,0.03643333911895752,72.02,77.5,99.98400211334229,2022-06-09
306,Feed - Cryptopotato.Com,Former US Solicitor General to Aid Grayscale’s Bitcoin ETF Efforts,"Donald B. Verrilli, who served as Solicitor General of the US during Obama's administration, could help Grayscale achieve its spot Bitcoin ETF mission. (Read More...)",50.0,51.24999999999999,96.99314832687378,70.095,63.74999999999999,5.988702178001404,2022-06-09
307,NewsBTC,Axie Infinity Revenue Continues To Collapse – Here’s Why,"Axie Infinity, a blockchain-based play-to-earn game, generated a measly $988,400 in total revenue the previous week, which is the first time that the popular P2E game that allows you to earn SLP coins, amassed lower than 1 million since February 2021. From an hourly standpoint, AXS price has spir... (Read More...)",25.305,50.0,0.019031763076782227,57.655,48.854166666666664,0.046947598457336426,2022-06-09
308,The Daily Hodl,Trader Who Accurately Predicted 2022 Bitcoin and Crypto Meltdown Says BTC Capitulation Imminent After Recent Rally,"A popular crypto strategist who accurately predicted Bitcoin (BTC) would slice through $30,000 last month says BTC looks poised to capitulate even after its latest rally. Pseudonymous analyst Capo tells his 335,700 Twitter followers he expects Bitcoin to print a fresh 2022 low once BTC bears take... (Read More...)",50.0,60.0,0.06041824817657471,80.62,66.42857142857143,0.017178058624267578,2022-06-09
309,CoinGape,Just-In: Solana Raises $100 Mln Fund To Court Terra Refugees,"The Solana Foundation said on Wednesday that it has raised a $100 million fund to support crypto firms in South Korea. The fund is backed by the Solana treasury, as well as the blockchain’s venture capital arm, Solana Ventures, according to a report by TechCrunch. The move is intended to capitali... (Read More...)",50.0,50.0,86.3769382238388,84.53999999999999,75.0,0.02154409885406494,2022-06-09
310,Forkast,Hyundai Card building its first NFT marketplace and wallet service,"Hyundai Card, Hyundai Motor Group’s credit card arm, announced a joint venture with South Korean tech startup Like Lion to launch a non-fungible token (NFT) marketplace in the second half of this year. See related article: Hyundai Motor drives into metaverse branding with Meta Kongz NFT project F... (Read More...)",50.0,62.5,99.91016387939453,81.245,54.166666666666664,4.443034529685974,2022-06-09
311,Bitcoinist,The Only Cross-Chain DEX you’ll Ever Need – Highest Liquidity and Best Prices,"Decentralized finance, or simply DeFi, is ever-evolving, dynamic, and community-driven. The desire to offer the best options for its global, quality-insistent base distinguishes this sub-sphere from legacy systems. At peaks, the Total Value Locked (TVL) by DeFi protocols spread across various sma... (Read More...)",81.845,75.0,99.99427795410156,94.895,54.37499999999999,99.97026324272156,2022-06-09
312,Bitcoin.com,Myria Has Announced Free-to-Claim Alliance Sigil NFT for All New and Existing Community Members,"PRESS RELEASE. June 8, 2022: Myria Studios, the blockchain gaming division of Myria, announced that the company is rewarding its community members with its inaugural NFT drop — a free-to-claim Alliance Sigil NFT. For a limited time, all new and existing Myria community members can claim the exclu... (Read More...)",50.0,56.81818181818181,98.50680530071259,55.135,63.31168831168832,21.102404594421387,2022-06-09
313,AMBCrypto,Will a new Japanese law allow seizure of your crypto?,"According to reports, Japan’s Justice Ministry is considering revising an asset seizure statute connected to organized crime. This is expected to include a provision allowing crypto to be hijacked in such cases. A possible modification of the Act on Organized Crimes and the Control of Proceeds of... (Read More...)",61.315,53.40909090909091,0.048792362213134766,67.0,55.00000000000001,0.014784932136535645,2022-06-09
314,crypto.news,Myria Announces Free-To-Claim Alliance Sigil NFT Open to Both New and Existing Members,"Since the emergence of blockchain gaming and its rapid acceptance, the industry has been one of the most talked-about sectors. Introducing Myria Previous successful blockchain gaming projects like the Axie Infinity Axies are examples of blockchain gaming integrated with NFT… (Read More...)",50.0,53.40909090909091,86.85148358345032,92.595,69.79166666666667,99.58191812038422,2022-06-09
315,Bitcoinist,Bitcoin Optimism: People In Developing Nations Believe Crypto’s Future Is Bright,"Many in the financial establishment in industrialized economies see bitcoin and other cryptocurrencies with skepticism, as a speculative and highly volatile trend that can only end badly. U.S. and European regulators have issued dire warnings about the perils of crypto trading. In China, regulato... (Read More...)",87.53,67.5,98.76315891742706,8.200000000000001,52.09375000000001,1.442861557006836,2022-06-09
316,The Block,MoonPay builds out celeb concierge service with Meta hire,MoonPay has hired additional staff for its concierge service that helps celebrities like Jimmy Fallon jump on the NFT bandwagon. (Read More...),50.0,50.0,99.85021650791168,81.245,75.0,98.81285429000854,2022-06-09
317,U.Today,New Luna Token Reaches All-Time Low,The new Luna token is already down more than 80% from its record peak less than two weeks since its launch (Read More...),38.685,53.40909090909091,0.0005364418029785156,50.0,58.14141414141414,0.0024437904357910156,2022-06-09
