,source,title,excerpt,vader_sentiment_title,tb_sentiment_title,flair_sentiment_title,vader_sentiment_excerpt,tb_sentiment_excerpt,flair_sentiment_excerpt,date
202,The Block,Bitwise launches web3-focused ETF,"Bitwise has launched a Web3 ETF, which is listed on NYSE Arca. (Read More...)",50,50,98.31614196,56.4,75,6.597912312,05-10-22
203,Decrypt,Dogecoin Pumps as Elon Musk Agrees (Again) to Buy Twitter,The memecoin surged over 8% on news Tuesday that the billionaire is indeed willing to purchase Twitter at $54.20 per share. (Read More...),60.115,50,99.12203252,64.8,68.75,1.004686952,05-10-22
204,Crypto Daily,Crypto Casino of the Year BC.GAME Launches Its All-New Redesigned Website With Better Features,"Willemstad, Curaçao, 4th October, 2022, ChainwireToday, BC.GAME announces the launch of its newly redesigned website with more and better features for its players. This is one of the many efforts of BC.GAME in order to continue giving the best experience and satisfaction to its players around the... (Read More...)",72.02,75,0.090673566,95.66,76.13636364,99.32671785,05-10-22
205,AMBCrypto,Cosmos Hub’s V2 proposal fails to light fireworks for ATOM as…,"How is success measured? Well, different platforms have different measures in place. As far as Cosmos ($ATOM) is concerned though, “success will depend on the changes made to $ATOM and whether that can attract more projects to build.” Ergo, the question – Is that the case? Here’s AMBCrypto’s Pric... (Read More...)",28.925,47.5,0.010415912,91.265,62.14285714,0.73787868,05-10-22
206,Bitcoinist,Why Coinbase Will Launch Crypto Documentary On Amazon,"Crypto is coming to the streaming service Amazon due to a Coinbase initiative. Via his official Twitter handle, the CEO of crypto exchange Coinbase, Brian Armstrong, announced the launch of a documentary focused on the crypto industry. Related Reading: Celsius Network Sets Auction Date, Sale Hear... (Read More...)",58.895,50,6.076574326,75.53,54.6875,89.5822227,05-10-22
207,CryptoBriefing,Bitcoin’s Hashrate Has Hit a New High. What Does That Mean for BTC?,"Bitcoins hashrate has recovered from its summer slump. The top crypto networks hashrate bottomed at around the same time as its price did in 2011, 2018, and 2021, indicating that Bitcoin may have found a floor. Bitcoins hashrate is rising.According to data from Glassnode, the top cryptocurrency n... (Read More...)",50,49.73106061,1.067140698,69.09,68.75,1.311668754,05-10-22
208,Crypto Briefing,Bitcoin’s Hashrate Has Hit a New High. What Does That Mean for BTC?,"Bitcoins hashrate has recovered from its summer slump. The top crypto networks hashrate bottomed at around the same time as its price did in 2011, 2018, and 2021, indicating that... (Read More...)",50,49.73106061,1.067140698,60.115,66.66666667,0.120520592,05-10-22
209,The Block,Bitcoin miner CleanSpark posts 21% hash rate growth in September,Bitcoin miner CleanSpark grew its hash rate by 21% and bitcoin mined by 13.4% in September. (Read More...),69.09,50,4.115957022,50,75,0.146624446,05-10-22
210,CryptoPotato,"Despite Bear Market, Bitcoin Holders are On the Rise",The number of on-chain addresses holding a balance is consistently rising – but is there more to the story? (Read More...),50,50,4.714852571,51.935,70.83333333,10.82203388,05-10-22
211,Ethereum World News,DogeCoin Surges 8% On News That Elon Musk Will Buy Twitter,"Tesla Inc. Chief Executive Elon Musk is proposing to buy Twitter Inc. for $25 billion, or $54.20 a share, Bloomberg and other media outlets have reported. The proposal was submitted in a letter to Twitter’s board of directors, according to people familiar with the matter who asked not to be ident... (Read More...)",50,50,5.953586102,65.91,62.5,0.081703067,05-10-22
212,The Block,Bitcoin miner Riot increases hashrate by 16.7% in September,"Bitcoin miner Riot grew its hash rate in September by 16.7% month-over-month, while producing 355 BTC. (Read More...)",22.13,50,3.131365776,22.13,75,0.02836287,05-10-22
213,Bitcoin.com,NYSE Halts Twitter Trading After Report Says Elon Musk Plans to Follow Through With Acquisition,"According to reports, Tesla’s Elon Musk now plans to purchase Twitter Inc. for the original asking price of $54.20 a share. Twitter’s shares surged following the news and climbed nearly 20% higher and trading was halted twice so far. Report Claims Tesla’s Elon Musk Will Purchase Twitter at the Or... (Read More...)",50,50,0.018578768,84.54,61.04166667,0.019013882,05-10-22
214,BeInCrypto,These Blockchain Firms Are Raising Lots of Cash Despite Crypto Bear Market,Institutional funds continue to flow into the crypto space as traditional and crypto companies look to build strength in the bear market. The post These Blockchain Firms Are Raising Lots of Cash Despite Crypto Bear Market appeared first on BeInCrypto. (Read More...),50,50,96.49814069,74.695,62.5,87.1293664,05-10-22
215,The Daily Hodl,Remittance Company and Additional Firm Request To Join Ripple and XRP Lawsuit With SEC,"Two other companies are hoping to weigh in on the U.S. Securities and Exchange Commission’s (SEC) lawsuit against Ripple. TapJets, which bills itself as the Uber of private jet chartering, and remittance company I-Remit hope to serve as an “amicus curiae” in the case in support of Ripple. Amicus ... (Read More...)",53.86,42.5,5.051800609,91.355,53.4375,0.344836712,05-10-22
216,CoinGape,Dogecoin (DOGE) To Be Twitter’s Native Currency After Elon Musk Takeover?,"After Elon Musk Twitter takeover talks resurface, there is a speculation about Dogecoin (DOGE) potentially becoming Twitter’s official native currency. In a latest development, Musk has reportedly proposed to buy Twitter for the original offer price of $54.20 a share. In this context, Elon Musk’s... (Read More...)",50,50,1.116997004,77.115,72.8125,0.430482626,05-10-22
217,Blockworks,Bitwise Offers New Web3 ETF as Some Crypto Funds Rebound,The new fund will invest in up to 40 companies using blockchain technology to reshape the internet The post Bitwise Offers New Web3 ETF as Some Crypto Funds Rebound appeared first on Blockworks. (Read More...),50,55.90909091,8.628943563,50,61.22727273,21.09324634,05-10-22
218,Coinnounce,How stETH peg was recaptured by the largest Ethereum staking service,"After dropping as low as 7% in mid-June, Lido Staked Ether (stETH) has regained its position and is now trading at 0.997 (1) per ETH. The token associated with Ethereum's largest liquid staking program has regained its 1:1 Peg to ETH. (Read More...)",50,50,0.132322311,36.34,62.5,0.015604496,05-10-22
219,Coinnounce,Are Stricter Regulations of Cryptocurrency Necessary?,"In response to U.S. President Joe Biden's Executive Order (1) ""Ensuring Responsible Development of Digital Assets, the Financial Stability Oversight Council today produced a 124-page report on digital assets. (Read More...)",50,50,0.272402167,85.015,57,90.10903835,05-10-22
220,Coinnounce,Celsius Network sets Sale Hearing and Auction Dates for Crypto Assets,"Following the worst network meltdown in cryptocurrency history, Celsius Network (1) filed for bankruptcy. Having been caught in the crossfire, the lending platform had a $1.2 billion hole in its financial sheet, according to additional reports. (Read More...)",58.895,50,13.35142255,18.755,43.75,0.007230043,05-10-22
221,CryptoBriefing,"Armstrong, Buterin, Saylor, Star in Coinbase Crypto Documentary","Coinbase CEO Brian Armstrong said that the filmmakers had unprecedented access inside the company. Coinbase is releasing a documentary charting the companys rapid growth.Directed by Emmy award winner Greg Kohs, COIN tells the story of Coinbases rise from a startup to a publicly traded company and... (Read More...)",50,50,99.5527178,90.37,63.75,99.97334182,05-10-22
222,Crypto Briefing,"Armstrong, Buterin, Saylor, Star in Coinbase Crypto Documentary",Coinbase CEO Brian Armstrong said that the filmmakers had unprecedented access inside the company. Coinbase Unveils Crypto Documentary Coinbase is releasing a documentary charting the companys rapid growth. Directed by... (Read More...),50,50,99.5527178,69.09,63.75,96.88641429,05-10-22
223,Bitcoin.com,Mastercard Debuts Blockchain Surveillance Tool for Banks and Crypto-Centric Card Issuers,"On Tuesday, the multinational financial services corporation Mastercard revealed that it is launching a new crypto monitoring product called Crypto Secure. The Crypto Secure software aims to leverage artificial intelligence (AI) algorithms in order to help banks and crypto-centric debit card issu... (Read More...)",50,50,99.94212985,93.125,56.96969697,0.364640355,05-10-22
224,Cryptomode,Devaluing British Pound Creates Excellent Bitcoin Buying Opportunity For Britons,"The value of the British Pound has been steadily declining ever since the Brexit vote in June 2016. The Pound is currently at its lowest point since 1985 and appears to be falling even lower than many analysts predicted just a few months ago. However, this drop in value has led to an excellent bu... (Read More...)",91.125,75,93.65305603,59.2,64.04761905,3.63907814,05-10-22
225,BeInCrypto,Crypto Nomads Start to Settle Down as Threat from Pandemic Subsides and Prices Tumble,"Some crypto nomads have decided to settle down following the COVID-19 pandemic, despite the decentralized lifestyle being somewhat conducive to the industry. The post Crypto Nomads Start to Settle Down as Threat from Pandemic Subsides and Prices Tumble appeared first on BeInCrypto. (Read More...)",23.665,42.22222222,0.025016069,23.665,54.38888889,0.047007203,05-10-22
226,BeInCrypto,Crypto Nomads Start to Settle Down as Threat from Pandemic Subsides and Prices Tumble,"Some crypto nomads have decided to settle down following the COVID-19 pandemic, despite the decentralized lifestyle being somewhat conducive to the industry. (Read More...)",23.665,42.22222222,0.025016069,50,55.74074074,1.641699672,05-10-22
227,The Block,Bitcoin futures volume climbed back above $1 trillion in September after August lull,"Bitcoin futures volume recovers after following to 21-month low in August, amid surge in ether derivatives trading. (Read More...)",50,50,0.072154403,36.34,58.33333333,3.911420703,05-10-22
228,CryptoSlate,Research: Grayscale’s GBTC drops to all-time low of $12.5K; conversion to spot ETF could trigger rebound,"Grayscale’s bitcoin trust (GBTC) which started trading at a discount in February 2021 has reached an all-time low of -36% when compared to the spot BTC price of $19,000. (Read More...)",36.34,50,0.00834465,69.09,62.5,0.000411272,05-10-22
229,CoinGape,Mike Novogratz: Bitcoin (BTC) Price Will Surge Soon After This Fed Action,"In the midst of a challenging macroeconomic scenario, Mike Novogratz is optimistic with regards to his Bitcoin price prediction. Novogratz, the chief executive officer of Galaxy Investment Partners, has been a long time supporter of investing in Bitcoin (BTC). However, he does not believe BTC cou... (Read More...)",50,55,7.145649195,80.62,65.83333333,99.32152629,05-10-22
230,Cointelegraph,European Parliament members vote in favor of crypto and blockchain tax policies,The resolution recommended authorities in the parliament's 27 member states consider a “simplified tax treatment” for crypto users involved in occasional or small transactions. (Read More...),70.095,50,9.593132138,60.115,54.16666667,19.00131404,05-10-22
231,CoinGape,This Bullish Pattern Breakout May Surge XRP Price By 22.5%,"In our previous price analysis, we revealed that the XRP coin price follows a rounding bottom pattern. This bullish pattern sets the market sentiment in an upwards direction, leading to a gradual recovery to a higher level. However, amid the ongoing uncertainty in the crypto market, the XRP price... (Read More...)",50,50,0.270646811,33,59.72222222,10.1682812,05-10-22
232,Blockworks,Brevan Howard Pours $40 Million Into Blockchain Gaming Startup,"Morgan Creek Digital, Take-Two Interactive Software, Polygon, Ubisoft, Xsolla and others also participated in the round The post Brevan Howard Pours $40 Million Into Blockchain Gaming Startup appeared first on Blockworks. (Read More...)",50,50,4.255875945,50,56.875,81.98009431,05-10-22
233,FX Street,Bitcoin price sees first October spike above $20K as daily gains hit 5%,"Bitcoin (BTC) saw its first trip above $20,000 on Oct. 4 as traders expected familiar resistance to cap gains. BTC/USD 1-hour candle chart (Bitstamp). (Read More...)",67,54.16666667,0.455325842,67,60.25,7.277774811,05-10-22
234,FX Street,"Shiba Inu price is lagging, unable to make significant highs","Shiba Inu (SHIB) price action is at risk of falling into negative territory as an early fade gets underway, with profit taking after the positive clos (Read More...)",46.14,46.875,0.001949072,51.29,56.27272727,0.580304861,05-10-22
235,FX Street,"Bitcoin price could retest $20,800, but bulls need to be careful [Video]","A brief technical and on-chain analysis on Bitcoin price. Here, FXStreet's analysts evaluate where BTC could be heading next. Please, subscribe to our (Read More...)",61.315,45,0.024211407,65.91,56.25,0.301682949,05-10-22
236,FX Street,"Ethereum price continues to consolidate between $1,420 and $1,200 [Video]","A brief technical and on-chain analysis on Ethereum price. Here, FXStreet's analysts evaluate where ETH could be heading next. Please, subscribe to o (Read More...)",50,50,0.036486983,65.91,56.25,0.431114435,05-10-22
237,FX Street,XRP price can trigger another rally if it stays above this significant level [Video],"A brief technical and on-chain analysis on Ripple price. Here, FXStreet's analysts evaluate where XRP could be heading next. Please, subscribe to our (Read More...)",62.5,59.375,0.274926424,65.91,56.25,1.438385248,05-10-22
238,FX Street,Cardano price ready to kick-start a massive bullish move after this liquidity fractal [Video],"A brief technical and on-chain analysis on Cardano price. Here, FXStreet's analysts evaluate where ADA could be heading next. Please, subscribe to our (Read More...)",68.06,55,0.59838891,65.91,56.25,3.693315387,05-10-22
239,FX Street,"Dogecoin price ready to break multi-year resistance level, kick-starting a 50% rally [Video]","A brief technical and on-chain analysis on Dogecoin price. Here, FXStreet's analysts evaluate where DOGE could be heading next. Please, subscribe to o (Read More...)",68.06,60,0.301027298,65.91,56.25,0.438329577,05-10-22
240,FX Street,ApeCoin price to unwind and catalyze a move that could propel APE to $11.20 [Video],"A brief technical and on-chain analysis on ApeCoin price. Here, FXStreet's analysts evaluate where APE could be heading next. Please, subscribe to our (Read More...)",50,50,0.179934502,65.91,56.25,1.699259877,05-10-22
241,FX Street,Why Joe Biden is speeding up crypto regulation in the US,The Biden administration is working on an accelerated rollout of the regulatory framework for digital assets and crypto currencies as the United Natio (Read More...),50,50,0.219532847,77.115,62.5,82.98968971,05-10-22
242,FX Street,Ethereum price stays in limbo while whales ramp up selling activities,"Ethereum price may have slowed down its downtrend, but it’s still wallowing deeply in murky waters. With robust support between $1,200 and $1,300 in p (Read More...)",50,50,2.150896192,88.42,55.74074074,99.20222163,05-10-22
243,FX Street,Ethereum Classic struggles to maintain its 1% gains for the trading day,Ethereum Classic (ETC) price is still seeing positive numbers on Tuesday – for the second day in a row – and arguing for a positive return for the wee (Read More...),48.71,58.33333333,0.041225553,81.845,61.21212121,1.511210203,05-10-22
244,U.Today,"Here's When Bitcoin Will Take Back Off, According to Mike Novogratz",The cryptocurrency mogul expects the central bank to hike rates a few more times before the Fed slows down the tightening of its policy (Read More...),50,50,0.009945035,50,56.44444444,0.184011459,05-10-22
245,Crypto Daily,OVER ARwards Get Revamped As Over The Reality Unveils Exciting New Contest,"For the longest time, the fashion industry has been a core component of each and every society, irrespective of individual interests based on factors such as culture, ethnic background, and history. This industry, like so many others, must therefore capitalize on the tremendous potential of the v... (Read More...)",74.695,60.90909091,93.09494495,77.115,61.11111111,98.82798195,05-10-22
246,Crypto Daily,Bitcoin Price Analysis: 19701 Resistance Tested - 5 October 2022,"BTC/USD Tests 19701 Resistance: Sally Ho’s Technical Analysis – 5 October 2022 Bitcoin (BTC/USD) maintained some upward momentum early in the Asian session as the pair recently traded above the 19701.82 area, representing the 61.8% retracement of the depreciating range from 20182.72 to 18923.81. ... (Read More...)",50,50,12.76627779,50,55,98.09872508,05-10-22
247,crypto.news,Russia Has Finally Decided To Allow International Trade In Bitcoin and Cryptocurrency for Any Industry Without Restrictions,"Russia is warming up to adopt bitcoin and other cryptocurrencies for financial transactions for any industry without restrictions. The Journey to Crypto Acceptance Before the Ukrainian invasion, Kremlin bureaucrats were against the adoption of cryptocurrency as a legal tender. With… (Read More...)",61.315,50,99.57164526,85.015,57.1875,94.94285882,05-10-22
248,Cointelegraph,"If Credit Suisse collapses, will it bring more volatility to the crypto market? Watch The Market Report","On this week’s episode of The Market Report, Cointelegraph’s resident experts discuss the Credit Suisse situation and what impact it would have on the cryptocurrency market if it did collapse. (Read More...)",55.135,75,6.588962674,42.345,75,24.6213764,05-10-22
249,NewsBTC,"Bitcoin Price Starts Uptober With Record Open Interest Increase, BTC Rally Will Be Short lived?","The Bitcoin price is once again trading above $20,000, its 2017 all-time high, with bullish momentum on low timeframes. The cryptocurrency has been in a similar situation since losing this level early in 2022, leaving many traders to wonder if the bulls will be able to sustain the current price a... (Read More...)",82.43,50,0.29258728,21.405,59.77777778,0.010046363,05-10-22
250,U.Today,SOL and MATIC Price Analysis for October 4,Which coin from top 10 list has biggest growth potential? (Read More...),50,50,77.27721632,76.335,66.66666667,0.951808691,05-10-22
251,crypto.news,SWIFT Completes Blockchain-Based Tokenization Pilot With SETL & Others,"SWIFT has announced the successful completion of the digital asset tokenization pilot it began late last year in collaboration with SETL, Northern Trust, and ClearStream. The project aims to foster interoperability in the asset tokenization ecosystem, according to a press… (Read More...)",68.4,50,99.95659888,96.39,59.5,99.40784276,05-10-22
252,Bitcoin Magazine,Bitcoin Magazine Partners With IBEX As Payment Sponsor For Bitcoin Conferences,IBEX will be the official payments sponsor for Bitcoin Amsterdam and Bitcoin 2023 enabling attendees to transact in bitcoin on and off-chain using Lightning. (Read More...),50,50,98.80915582,50,75,99.43124056,05-10-22
253,U.Today,"XRP Volcano to Blow Soon, Credit Suisse May Cause Another Market Crash, Here’s Why BTC May End Q4 in Green Zone: Crypto News Digest by U.Today",Check out U.Today’s news digest to stay updated on the latest crypto events! (Read More...),48.71,40,0.058636069,50,78.125,6.544193625,05-10-22
254,CryptoPotato,Trading of Centurion Invest’s CIX Token is Officially Live,"Cryptocurrencies have risen to prominence over the past few years, and many retail and institutional investors are seeking direct and indirect exposure to digital assets. But while the industry offers multiple investment options, navigating the market in search of the most profitable opportunitie... (Read More...)",50,56.81818182,1.383391023,79.92,56.94444444,98.142609,05-10-22
255,CryptoPotato,US Regulators Seek More Power From Congress to Address Crypto Regulatory Gaps,"As regulators battle for a bigger pie share to oversee the crypto industry, the US Treasury highlighted the gaps that need to be addressed. (Read More...)",50,75,4.948797822,55.135,62.5,82.09116161,05-10-22
256,CryptoPotato,Ripple Bullish Against Bitcoin as 10-Day Long Correction Wearing Out (XRP Price Analysis),"Ripple is on the verge of breaking the 5-month consolidation range. Doing so could cause the bullish rally we saw last month to resume. Technical Analysis By Grizzly The Daily Chart Although XRP concluded the week with a red candlestick, the daily chart suggests an increase in buying pressure. Th... (Read More...)",50,47.5,0.011000037,51.29,54.16666667,0.005406141,05-10-22
257,Bitcoin.com,"Biggest Movers: MATIC Hits 3-Week High, LINK up Almost 10%","Polygon raced to a three-week high during today’s session, as bullish sentiment returned to cryptocurrency markets. Chainlink was also in the green, as the token surged for a second straight day, rising by almost 10% in the process. Overall, the global crypto market cap is up 3.06% as of writing.... (Read More...)",50,58,99.35674369,61.315,54.71428571,0.011733174,05-10-22
258,BeInCrypto,Bitcoin Dominance (BTCD) Regains Resistance Level as Ethereum (ETH) Falls After Merge,Bitcoin Dominance (BTCD) is in the process of breaking through another resistance level. But will Bitcoin dominate altcoins in the coming weeks? (Read More...),60.115,50,1.930144429,53.86,75,0.261309743,05-10-22
259,Cointelegraph,Grayscale Bitcoin Trust terminates material agreements with Genesis,"Genesis will no longer be involved in GBTC's main operations, but will still act as a liquidity provider. (Read More...)",82.985,50,0.061288476,42.345,66.66666667,77.12216973,05-10-22
260,U.Today,"Rich Dad Poor Dad Author Predicts Dollar's Fall, Might Be Time for Crypto","""Rich Dad Poor Dad"" author predicts dollar's fall by January 2023 will spark crypto rally (Read More...)",56.4,49.375,0.009921193,67,57.91666667,0.015300512,05-10-22
261,crypto.news,Magic Eden Commences Refund for Wallets Affected With Degen Incident,"Magic Eden declared that it has started operating the refunds to wallets affected by the Degen Town wallet drain. The announcement comes amid the complaints raised by Solana users about the hacker’s security breach, looting almost $200 million worth of… (Read More...)",42.345,75,0.704854727,46.605,71.66666667,0.72170198,05-10-22
