,source,title,excerpt,vader_sentiment_title,tb_sentiment_title,flair_sentiment_title,vader_sentiment_excerpt,tb_sentiment_excerpt,flair_sentiment_excerpt,date
126,Bitcoin.com,"Bitcoin, Ethereum Technical Analysis: BTC Falls Below $30,000, Is 55% Below Its Record High","Bitcoin plunged below $30,000 for the first time in eleven months, as bears continued to run rampant in crypto markets. This move came as Luna Foundation Guard was said to be liquidating close to $1.5 billion worth of BTC. Ethereum also fell to multi-month lows, as prices hovered slightly above $... (Read More...)",50.0,54.0,0.006365776062011719,51.29,63.125,0.001913309097290039,2022-05-11
127,Bitcoin Magazine,El Salvador President Nayib Bukele Released Model Of Bitcoin City,"After announcing the purchase of an additional 500 BTC for El Salvador’s balance sheet, the president released images of Bitcoin City. (Read More...)",50.0,50.0,4.3081134557724,50.0,75.0,0.035512447357177734,2022-05-11
128,CryptoSlate,El Salvador buys the dip – picks up 500 BTC worth roughly $15.5M for reserves,"El Salvador just added another 500 Bitcoin (BTC) — worth roughly $15.5 million — to its reserves after the world’s most popular cryptocurrency fell to almost $30,000 on May 9. (Read More...)",61.315,55.00000000000001,0.6342858076095581,80.575,68.0,1.5191763639450073,2022-05-11
129,Crypto Daily,El Salvador Buys The Dip With Another 500 Bitcoins,"As the value of Bitcoin dropped to the $30,000 mark, El Salvador made a purchase of 500 more Bitcoins for a total price of $15.5 million. El Salvador Builds Up BTC Reserves President Nayib Bukele is quite determined to build up the country’s crypto reserves. Most recently, following the drop in p... (Read More...)",50.0,50.0,9.14773941040039,72.88,65.0,3.203943371772766,2022-05-11
130,Crypto Daily,"After Avalanche (AVAX) and Tron (TRX), is Pac-Man Frog (PAC) a Game-Changing Token?","With the introduction of the cryptocurrency market over the last decade, several formerly complex transactions and procedures have become easy and accessible to anybody. This is owing to the unique characteristics of different cryptocurrencies. In this article, we shall examine some of these spec... (Read More...)",50.0,50.0,0.6074517965316772,72.02,58.64583333333333,99.98917877674103,2022-05-11
131,NullTX,Top 3 Metaverse Crypto Coins Below $1 to HODL & DCA in May 2022,"Cryptocurrency and stock markets are showing extreme bearish momentum this week, with Bitcoin hitting rock bottom at $29k after sharply rebounding to the current levels of $32k. Whether this is a bottom or not, Dollar-Cost Averaging (DCA) is one of the best strategies one can employ at this time ... (Read More...)",60.114999999999995,75.0,2.4531126022338867,81.845,62.5,93.03485155105591,2022-05-11
132,U.Today,"Bitcoin Addresses With 1BTC Surpasses 830,000 as Number of Retail Investors Grows","Holding of at least 1 BTC has marked new all-time high of 836,922 (Read More...)",53.86,50.0,3.1757742166519165,50.0,55.96363636363636,99.10750091075897,2022-05-11
133,Decrypt,"Coinbase, PayPal and Other Bitcoin-Exposed Stocks Battered by Crash",The carnage in the crypto markets is leading to the share price of Coinbase and other crypto-exposed stocks taking a beating. (Read More...),29.905000000000005,43.75,0.001531839370727539,39.885,59.375,0.1076042652130127,2022-05-11
134,Ethereum World News,Flow Launches A $725 Million Ecosystem Fund To Boost Web3 Developments,Flow blockchain has announced a new ecosystem fund worth $725 million The fund will help spark innovation among global developers and assist them in developing new apps and games for the Flow blockchain. Leading blockchain Flow has announced a new ecosystem fund worth $725 million to “hypercharge... (Read More...),70.095,50.0,97.55851626396179,92.00999999999999,60.77922077922078,99.52704012393951,2022-05-11
135,Finbold,Bitcoin correlation with the S&P 500 reaches a new all-time high,Bitcoin and its correlation with established asset classes have been explored for years by investors from a wide range of... Continue reading (Read More...),52.580000000000005,57.40909090909091,16.05905592441559,68.06,60.0,96.30926847457886,2022-05-11
136,CryptoPotato,"SHIB Rollercoaster Continues Following 25% Daily Plunge, What’s Next? (Shiba Inu Price Analysis)",Yesterday was one of the most volatile days in the crypto markets for this year and SHIB crashed over 25% only to recover most of those losses today. (Read More...),50.0,50.0,4.72511351108551,27.390000000000004,68.75,0.004786252975463867,2022-05-11
137,The Block,A16z leads $25 million seed round for NFT infrastructure startup Co:Create,"Co:Create, a crypto startup building an infrastructure protocol for NFT projects, has raised $25 million in a seed round led by a16z. (Read More...)",50.0,40.0,99.28200244903564,50.0,57.49999999999999,95.07662355899811,2022-05-11
138,Blockworks,A16z Leads $25M Raise for NFT-focused Co:Create Protocol,The new endeavor aims to enable NFT projects to launch their own native tokens The post A16z Leads $25M Raise for NFT-focused Co:Create Protocol appeared first on Blockworks. (Read More...),50.0,50.0,98.52748215198517,50.0,68.57954545454545,90.13347327709198,2022-05-11
139,Crypto Daily,Huge Potential Crypto Scam Avoided,"Swift Reaction Saved Crypto Users from Losing Millions 10th May 2022, Tallinn: Major cryptocurrency scams have been occurring more and more frequently over the past decade. Large crypto entities like wallets and exchanges are a common target of fraud, with losses reaching millions of dollars per ... (Read More...)",20.705000000000002,60.0,0.05161762237548828,14.079999999999998,58.292410714285715,99.81230199337006,2022-05-11
140,Crypto Daily,"Top Three Metaverse Coins Most Likely to Make You a Millionaire: Sandbox (SAND), THETA Network (THETA), and FIREPIN Token (FRPN)","Investors who bought into the Metaverse early are now reaping the rewards in billions. Interestingly, one of the world's largest technology organizations, Facebook, rebranded to Meta in an attempt to capitalize on the Metaverse. The company's metaverse project, which cost well over $10 billion la... (Read More...)",60.114999999999995,66.66666666666666,99.40404891967773,89.225,68.33333333333333,4.302114248275757,2022-05-11
141,Crypto Daily,"3 CRYPTO’S THAT COULD MAKE YOU MONEY MUSHE (XMU), POLKADOT (DOT), ALGORAND (ALGO)","The year 2022 is set to be a lucrative and beneficial year for crypto users, as analysts and experts predict that this year will be the year of a big pay-out. What is stopping you from being part of this? The global market’s growth has been amazing since Covid-19 hit the world and had a massive i... (Read More...)",50.0,50.0,5.23759126663208,91.355,61.0,95.91414630413055,2022-05-11
142,CryptoPotato,Bitcoin Price Analysis: Was $30K a Local Bottom or is Further Bloodbath Incoming?,"Bitcoin has been on a free fall for the last few days, concluding six consecutive red weeks. The price had recently broken below the $37K level, which had provided solid support for the past months on multiple occasions. This price collapse was initiated after BTC got rejected when trying to brea... (Read More...)",50.0,50.0,0.00629425048828125,27.060000000000002,50.27777777777778,0.0006735324859619141,2022-05-11
143,The Block,Dapper Labs unveils $725 million ecosystem fund for Flow blockchain,Flow's new ecosystem fund will spur the development of applications on the NFT-focused blockchain. (Read More...),50.0,50.0,91.00647568702698,50.0,65.9090909090909,99.85640347003937,2022-05-11
144,U.Today,Cardano Creator Mocks Terra After Price Crash,Cardano's Charles Hoskinson has hit back at Terra after severe price correction (Read More...),15.46,50.0,0.043705105781555176,30.910000000000004,62.5,3.079622983932495,2022-05-11
145,CoinGape,"Binance CEO Stirs Hope As Market Crashes, Here’s His Advise For Investors","Chaopeng Zhao (CZ) encourages crypto traders and investors to put their emotions on check, as fear grips the market. Today, the price of Bitcoin slipped way below $30, 000 for the first time since July 2021. But Binance’s CEO CZ, appears unmoved by the most current crypto market dip. CZ Asks inve... (Read More...)",72.02,50.0,92.13060140609741,48.065000000000005,65.625,6.042143702507019,2022-05-11
146,U.Today,Dogecoin (DOGE) Remains Profitable Despite 30% Market Correction: Details,Dogecoin's profitability is still on a decent level despite most recent market turmoil (Read More...),72.02,50.0,98.93552958965302,41.555,64.58333333333333,99.4633674621582,2022-05-11
147,CoinGape,"Will MicroStrategy, Tesla Sell Their Bitcoins To Avoid Loss?",The Crashing Cryptocurrency market has left every investor worried. The same has happened with the biggest Bitcoin (BTC) holding institutions in the market. Public companies like Microstrategy and EV giant Tesla which owns a huge amount of BTC have also faced some troubles amid the dump. MSTR and... (Read More...),22.884999999999998,50.0,0.18822252750396729,27.060000000000002,57.49999999999999,0.0016808509826660156,2022-05-11
148,Cointelegraph,Go green or die? Bitcoin miners aim for carbon neutrality by mining near data centers,"Bitcoin mining companies must prove carbon neutrality as new regulations come to play, but are carbon offsets enough? (Read More...)",20.029999999999998,47.5,0.1219630241394043,58.894999999999996,60.60606060606061,0.5227237939834595,2022-05-11
149,The Daily Hodl,"U.S. Treasury Sanctions Coin Mixer Allegedly Used by North Korean Hackers To Process Over $20,000,000 in Crypto","The US government is continuing to crack down on illicit crypto activity by targeting a website that it says obfuscates transaction data. In a new press release, the U.S. Department of the Treasury says the Office of Foreign Assets Control (OFAC) is sanctioning Blender.io, a service OFAC claims t... (Read More...)",60.114999999999995,45.0,0.2555638551712036,68.06,54.44760101010101,0.012442469596862793,2022-05-11
150,The Block,"US Treasury Secretary Yellen points to UST slip, asks for new stablecoin legislation by the end of 2022","“A stablecoin known as TerraUSD experienced a run and declined in value. I think that this simply illustrates that this is a rapidly growing product and there are rapidly growing risks,” said Secretary Yellen. (Read More...)",60.114999999999995,56.81818181818181,1.8708765506744385,79.295,71.66666666666667,0.6049990653991699,2022-05-11
151,BeInCrypto,Bitcoin (BTC) on-Chain Analysis: 1-2 Year HODL Wave Increases Considerably,Be[in]Crypto takes a look at Bitcoin (BTC) on-chain indicators that relate to lifespan in order to determine the age of the coins that are currently being transacted. The HODL wave is analyzed in detail. The post Bitcoin (BTC) on-Chain Analysis: 1-2 Year HODL Wave Increases Considerably appeared ... (Read More...),50.0,55.00000000000001,0.9563416242599487,50.0,60.0,0.7328182458877563,2022-05-11
152,Blockworks,Russian-language Journalists Forced off Stripe by Sanctions Turn to Crypto,"Russian-language news outlet Meduza is now relying solely on foreign donations for the first time ever, with crypto as its lifeline The post Russian-language Journalists Forced off Stripe by Sanctions Turn to Crypto appeared first on Blockworks. (Read More...)",27.060000000000002,35.0,0.09445548057556152,27.060000000000002,55.75,0.03103017807006836,2022-05-11
153,Cointelegraph,KuCoin to launch DeFi products in 2022 with fresh $150M raise,"The global crypto exchange KuCoin expects to launch decentralized wallet products later in Q2 2022, also planning to roll out its NFT marketplace Windwave in the near future. (Read More...)",65.91,65.0,99.44453239440918,50.0,56.00000000000001,2.396589517593384,2022-05-11
154,NewsBTC,Hyperdex Launches Mainnet to Introduce Advanced Trading Features For DeFi Users,"Hyperdex, a Swiss-based decentralized exchange (DEX), announced its mainnet is finally going live following the successful period of its testnet. The launch of the mainnet brings along three major advancements on the platform, named “cubes”, enabling users to adjust to the Hyperdex network and un... (Read More...)",62.5,70.0,99.50268864631653,79.295,62.07386363636363,99.87671375274658,2022-05-11
155,U.Today,"678 Million XRP Shoveled By Anon Wallets, 256 Million Moved in Single Lump",Several top exchanges and anonymous wallets have transferred close to 680 million XRP; almost half of it was moved in a single chunk (Read More...),50.0,46.42857142857143,0.13360977172851562,60.114999999999995,57.61904761904761,0.0025153160095214844,2022-05-11
156,Crypto Daily,Russian Free Press affected by economic sanctions: requests crypto donations from international community,"Meduza, an independent Russian news outlet launched a crypto donations page back in April last year after being penalised by the Russian government. Now, with their content blocked in Russia, Meduza is being forced to rely on its international audience for donations, and encouraging payment in cr... (Read More...)",70.095,57.49999999999999,0.8359968662261963,47.42,51.24999999999999,0.03873109817504883,2022-05-11
157,Trustnodes,Ethereum’s Ratio Jumps,Ethereum held better during the mass sell-off on Tuesday with its value against bitcoin rising by more than 6%. (Read More...),50.0,50.0,19.515621662139893,82.43,75.0,3.0207186937332153,2022-05-11
158,The Block,"Bitcoin self-custody company Casa raises $21 million in Series A, launches new API","The US-based company, which specialises in building self-custody wallets, has also announced a new API. (Read More...)",50.0,56.81818181818181,98.8373339176178,50.0,65.9090909090909,16.88079833984375,2022-05-11
159,Bitcoin.com,"UST Rebounds From $0.66 per Coin to $0.93, Crypto Community Assesses Stablecoin’s Damaged Reputation","On Monday, May 9, 2022, the stablecoin terrausd (UST) lost its parity with the U.S. dollar and dropped to an all-time low of $0.66 per unit. The stablecoin has been one of the most topical discussions in crypto during the past 24 hours, as many have been betting on whether it will fail or recover... (Read More...)",27.98,50.0,0.08352100849151611,10.775000000000002,55.35714285714286,0.00680088996887207,2022-05-11
160,Crypto Daily,Tokenized Real-World Asset Market Continues Defying Broader Market Crash,"The ongoing geopolitical tensions, paired with macroeconomic problems and rising inflation, have severely impacted the crypto and stock markets in tandem. In the last month alone, the majority of the cryptocurrencies have cratered, giving back significant value and, in turn, dragging the global c... (Read More...)",47.42,50.0,94.02779638767242,20.705000000000002,58.75,0.019922852516174316,2022-05-11
161,U.Today,DOGE and SHIB Price Analysis for May 10,Has the market faced the local bottom before an upcoming rise? (Read More...),50.0,50.0,3.7439435720443726,50.0,62.5,88.2963478565216,2022-05-11
162,Bitcoin Magazine,Australia’s First Spot Bitcoin ETF To Launch This Week,"On Thursday, two separate bitcoin ETFs will launch, one allowing direct access to bitcoin while the other offers shares in a company that offers spot-bitcoin exposure. (Read More...)",50.0,62.5,96.82793915271759,64.8,56.75,0.21526217460632324,2022-05-11
163,CryptoPotato,UK Prime Minister Empowers Authorities to Seize Crypto ‘More Quickly and Easily’ (Report),Boris Johnson's new legislation will reportedly focus on seizing digital assets from criminals and strengthening the sanctions on the Russian Federation. (Read More...),50.0,71.11111111111111,98.10572564601898,52.580000000000005,57.95454545454546,1.7984837293624878,2022-05-11
164,Bitcoinist,U.S. Recession Fears Cause Crypto Mining Stocks To Suffer,"Bloomberg reported that crypto mining companies’ stocks continued to fall on Monday, following the stock market’s trend on the New York Stock Exchange. The Federal Reserve’s tightening of monetary policy is causing people to worry about the economy, which might lead America into a recession. The ... (Read More...)",7.790000000000003,50.0,0.03161728382110596,15.46,60.60606060606061,0.004518032073974609,2022-05-11
165,Crypto Daily,"All-in-one DeFi protocol, Hyperdex Mainnet Launch Goes Live!","Manfredi Magris, Hyperdex Co-Founder, believes the trio of innovations will ease the complexity of the DeFi ecosystem to “give users exposure to sophisticated products that were once the preserve of pros”. “Our Race Trading cube, for example, contains a simplified derivatives contract that makes ... (Read More...)",50.0,58.52272727272727,99.92589056491852,86.345,75.0,99.84660744667053,2022-05-11
166,crypto.news,Hyperdex Marks Its Mainnet Launch with Three Innovative DeFi Products,"Hyperdex has announced the successful launch of its mainnet, following extensive refinement and third-party auditing. Hyperdex’s initial trio of DeFi products: Fixed Income, Algo Trading, and Race Trading dubbed ‘cubes,’ are designed to enable users to acclimatize to Hyperdex and… (Read More...)",72.02,75.0,99.96851980686188,79.295,61.25000000000001,99.49672520160675,2022-05-11
167,Cointelegraph,Ethereum rises vs. Bitcoin despite crypto market rout — will ETH/BTC gain 50% by June?,ETH/BTC rallies to test its 'ascending triangle' pattern for a bullish breakout. (Read More...),76.335,50.0,1.2698769569396973,50.0,75.0,2.2239327430725098,2022-05-11
168,NullTX,"Did Bitcoin, Ethereum, XRP, Solana Price Hit Bottom?","After the Fed raised interest rates to unprecedented levels last week, the stock and crypto markets experienced significant losses. This week, Bitcoin, Ethereum, XRP, Solana, and other major cryptocurrencies showed double-digit percent price losses. However, after bottoming out at $29k on May 9th... (Read More...)",50.0,50.0,0.023365020751953125,42.345,65.80357142857143,0.0031054019927978516,2022-05-11
169,CoinGape,ETH Price Analysis: Is This An Opportunity To Retest $2800 Amid Bullish Technical Formation?,"ETH price hovers near the multi-month support with a negative bias. ETH opened lower and swiftly recovered to buck the downside momentum. But, the recent downswing pushed it toward a crucial juncture from where the downside in the price weighs more. A bounce back off the immediate support level m... (Read More...)",71.075,50.0,0.026610493659973145,48.065000000000005,55.714285714285715,3.6173105239868164,2022-05-11
170,ZyCrypto,ADA Price Suffers Nauseating Slide Despite Strong Fundamentals — Cardano’s Hoskinson Tells Us Why,The asset’s latest choppy price action comes despite the protocol’s blossoming fundamentals and the soaring number of community members. (Read More...),14.975,45.83333333333333,0.003063678741455078,53.86,61.25000000000001,0.01004636287689209,2022-05-11
171,CoinGape,Big Crypto Investors Pour Millions Into This African Startup,"Democratic Republic of Congo-based crypto startup Jambo has raised $30 million in a Series A funding round with several notable investors. The six-month-old crypto startup has attracted high-profile investors such as Pantera Capital, Delphi Ventures, Kingsway Capital, and Gemini Frontier Fund, wi... (Read More...)",50.0,50.0,86.99201345443726,71.075,57.99999999999999,12.09404170513153,2022-05-11
172,Crypto Daily,"Cross-Chain Decentralized Exchange (Dex), Primex Finance Launches Its Prime Brokerage Alpha Version on Testnet","Primex Finance, a cross-chain decentralized exchange (DEX), is launching its first Alpha release version on its testnet. The release aims to test the utility of the platform for lenders and traders, offering a vast majority of the features that will be available on the mainnet release. The statem... (Read More...)",50.0,50.0,82.45497941970825,50.0,64.375,90.26895463466644,2022-05-11
173,Decrypt,EX Sports’ New NFT Street Football Game is About Much More Than Just Scoring Goals,NFT-powered mobile game Urbanball aims to empower less well-known players and inspire soccer fans across the globe. (Read More...),50.0,53.939393939393945,12.35632598400116,78.595,48.888888888888886,99.695685505867,2022-05-11
174,Protos.com,Coinbase listing hype appears dead as exchange falls 80% from all-time highs,Last week the American crypto exchange saw its share price drop into double digits for the first time when it sank to just over $84. (Read More...),17.570000000000004,40.0,0.0012159347534179688,51.29,57.49999999999999,0.0009953975677490234,2022-05-11
175,CryptoGlobe,Coin Bureau on Cardano ($ADA): “There’s Still Lots of Demand for ADA”,"The host of popular crypto analytics and market commentary show “Coin Bureau” says that Cardona’s demand is surging despite the coin’s recent lackluster price performance. Speaking in a recent YouTube update, Coin Bureau host “Guy” told viewers that Cardano’s adoption has been red hot. He claimed... (Read More...)",43.6,50.0,2.6117146015167236,65.91,61.25000000000001,14.597594738006592,2022-05-11
176,CoinGape,"Tron (TRX) Founder Joins El Salvador In Dip-Buying, Scoops $15 Million In BTC","El Salvador’s president and crypto enthusiast, Nayib Bukele, has stated that his government just recently increased its entire BTC holdings by 500 coins in an investment move aimed at capitalising on the current dip. El Salvador’s Bukele appears to having fun with the dip Bukele revealed via his ... (Read More...)",50.0,50.0,3.1508922576904297,89.225,57.99999999999999,96.05662524700165,2022-05-11
177,CryptoPotato,Metabloxz Brings a Major Swedish Pharmacy Chain Into the Metaverse,"[PRESS RELEASE – Stockholm, Sweden, 10th May 2022] Metabloxz enters into collaboration with one of the largest pharmacy chains in Sweden. Last week Kronans Apotek opened its first demo pharmacy in the Metaverse. The launch took place during SIME, Northern Europe’s leading strategic event on digit... (Read More...)",50.0,53.125,99.76672828197479,50.0,62.5,99.08721148967743,2022-05-11
178,NewsBTC,How Plugin’s Blockchain Technology Helps Industries Adapt To Climate Change,"With the growing threat of climate change, many industries need precise weather forecasting every hour. Plugin’s blockchain solution provides decentralized, verifiable weather data. Problems with existing weather information technology Weather intelligence platforms collect weather-related inform... (Read More...)",69.08999999999999,50.0,99.98848140239716,50.0,73.33333333333333,96.7655599117279,2022-05-11
179,BeInCrypto,Tanzania Looks to Follow Nigeria in Rolling out Digital Currency,The government of Tanzania is looking to launch a central bank digital currency (CBDC) to protect its citizens from cryptocurrency speculators. The post Tanzania Looks to Follow Nigeria in Rolling out Digital Currency appeared first on BeInCrypto. (Read More...),50.0,50.0,4.6692222356796265,69.08999999999999,57.49999999999999,0.029200315475463867,2022-05-11
180,U.Today,MicroStrategy Gives Lowest Bitcoin Price To Avoid Holdings Liquidation,MicroStrategy took out a $205 million Bitcoin-collateralized loan with Silvergate Bank to purchase more Bitcoin (Read More...),20.705000000000002,50.0,99.5037704706192,50.0,75.0,1.0595589876174927,2022-05-11
181,CoinGape,FTT Price Analysis: Oversold RSI Boast FTT Price For $38 Target,"On May 9th, the FTX(FTT) price gave a massive breakdown from the monthly support level of $33.5. This support fallout suggests the sellers are ready for a leg down to the $22.5 mark. However, an unexpected rise in today’s retest candle suggests a possible fakeout. Key points: FTT price responding... (Read More...)",50.0,50.0,0.02676546573638916,89.225,54.6031746031746,0.009492039680480957,2022-05-11
182,Cointelegraph,Decentralization is helping to shape the course of scientific research and business,"Decentralized science, dubbed DeSci, is creating new markets for knowledge and new opportunities on commercial markets. (Read More...)",64.8,50.0,99.93783235549927,79.295,59.65909090909091,95.66692113876343,2022-05-11
183,Crypto Daily,Elrond Network Beefs up Security and Compliance with AnChain.AI Partnership,"Elrond Network, the technology layer capable of internet-level scaling, embraces AnChain.AI. Through this partnership, Elrond's applications and protocols will become more secure and benefit from compliance-oriented aspects. AnChan's AI-driven Web3 analytics have been in high demand lately. Elron... (Read More...)",67.0,50.0,98.73961210250854,89.69500000000001,62.16666666666667,99.72298741340637,2022-05-11
184,CryptoPotato,Rare NFT Fail for the Rare Antiquities Token NFT Fractionalization Marketplace Launch,"[PRESS RELEASE – Please Read Disclaimer] The launch of the Rare Antiquities Token NFT fractionalization marketplace featured an epic fail at Aura Skypool Dubai last month. What promised to be an amazing PR stunt failed when the founder of the Rare Antiquities Token, Ryan Howells poured liquid nit... (Read More...)",22.884999999999998,51.66666666666666,0.1515895128250122,60.114999999999995,55.00000000000001,0.0006735324859619141,2022-05-11
185,CryptoGlobe,$ADA: Charles Hoskinson Says the ‘Massive’ Cardano Treasury Is ‘Only Going To Grow’,"On Tuesday (May 10), Charles Hoskinson, who is Co-Founder and CEO of Input Output Global (aka “IOG”, formerly known as “IOHK”), the company responsible for Cardano’s research and development, provided some reassuring news for $ADA HODLers. Earlier today, Sebastien Guillemot, who is the CTO of blo... (Read More...)",60.114999999999995,50.0,0.9962260723114014,80.62,56.99999999999999,1.328703761100769,2022-05-11
186,CryptoPotato,Bitget Announces Partnership with Revenuebot,"[PRESS RELEASE – Please Read Disclaimer] Singapore, 6 May, 2022 – Leading global derivatives exchange – Bitget, today announced its partnership with Revenuebot, an automated platform for trading on crypto exchanges provided by RBMedia FZC LLC. Launched in 2018, RevenueBot is designed to offer a s... (Read More...)",50.0,50.0,96.53677344322205,71.075,62.5,11.703148484230042,2022-05-11
