,source,title,excerpt,vader_sentiment_title,tb_sentiment_title,flair_sentiment_title,vader_sentiment_excerpt,tb_sentiment_excerpt,flair_sentiment_excerpt,date
256,AMBCrypto,Chiliz [CHZ] investors can profit from these levels if November BTC’s reaction…,"CHZ could lose current support at $0.1330 and fall to $0.0995. If BTC rallies after this year&#8217;s FOMC meeting, it could pull up CHZ. Improved...",72.02,50.0,0.7823795080184937,50.0,50.0,0.1585632562637329,2022-12-14
257,NewsBTC,BNB Price Prediction: Breaking This Barrier Could Spark a Significant Surge,BNB price (Binance coin) found support near $255 against the US Dollar. BNB is rising and might gain pace if it clears the $285 resistance zone. B...,64.8,68.75,96.64432108402252,87.53,55.00000000000001,4.215279221534729,2022-12-14
258,NewsBTC,"Ethereum Price Aim Big After Recent Breakout Above $1,300","Ethereum gained pace for a move above the $1,300 resistance against the US Dollar. ETH is consolidating gains and might eye a fresh increase in th...",50.0,50.0,1.2158960103988647,91.125,57.49999999999999,99.49595928192139,2022-12-14
259,Cointelegraph,Tether to reduce secured loans to zero in 2023 amid battle against FUD,"The move comes in response to a wave of mainstream media attacks and FUD, primarily from the Wall Street Journal.",29.580000000000002,50.0,0.5077779293060303,15.300000000000002,70.0,11.85387372970581,2022-12-14
260,BeInCrypto,Could XRP Whale Movements Shift Prices Above This Key Level?,"There have been significant movements of Ripple XRP coins on-chain over the past week. Prices are approaching a key psychological level, but can t...",50.0,50.0,11.138203740119934,55.135,51.24999999999999,6.380325555801392,2022-12-14
261,AMBCrypto,Assessing Quant’s [QNT] potential to brush aside price decline in coming year,"Quant whale holdings dropped from 80% below 72% after a series of exciting performances.  Nevertheless, QNT showed potential to drive fulfilling p...",50.0,50.0,99.83448386192322,74.695,57.49999999999999,99.52276051044464,2022-12-14
262,CoinGape,The Bahamas Judge Denies Bail to Disgraced FTX Founder,"A day after FTX founder Sam Bankman-Fried was arrested by the Bahamian authorities, SBF has been denied bail by the judge. Soon after his arrest, ...",14.984999999999998,50.0,0.10146200656890869,9.370000000000001,47.5,0.1424640417098999,2022-12-14
263,CoinGape,Here’s Shiba Inu Price Analysis Guide For The Coming Week,The Shiba Inu price has been stuck in a consolidation phase for the past three weeks. Despite multiple attempts to break this range in a volatile ...,50.0,50.0,96.29647433757782,37.5,43.75,0.008872151374816895,2022-12-14
264,CoinGape,"Amid FUD, Binance Tries to Reassure Investors About Reserves, Says Its Debt Free","Earlier this week on Monday, the news break out that the U.S. DoJ is considering the possibility of filing criminal charges against Binance and it...",54.715,57.49999999999999,10.888931155204773,16.475,40.0,0.6497502326965332,2022-12-14
265,Cointelegraph,PayPal has become an episode of Black Mirror: Elon Musk,"The ""PayPal Mafia,"" including co-founders Peter Thiel and Elon Musk, have slammed the payments platform over its ""totalitarian"" d...",50.0,41.66666666666667,0.5537182092666626,50.0,50.0,0.04130899906158447,2022-12-14
266,AMBCrypto,What are the odds of Chainlink [LINK] crossing its near-term high this week?,"Chainlink reached quite a few milestones this week Stochastic was oversold, which was bullish, but other metrics were bearish Chainlink’s [LINK] r...",50.0,57.99999999999999,0.05615055561065674,52.580000000000005,41.875,2.5493592023849487,2022-12-14
267,Cointelegraph,CFTC declares Ether as a commodity again in court filing,The community is hopeful that the assertion by the Commodity Futures Trading Commission will put to bed claims that staked coins ...,50.0,50.0,4.046732187271118,75.53,50.0,5.043184757232666,2022-12-14
268,Cointelegraph,Apple to allow third-party app stores in windfall for NFTs and crypto,"In a win for crypto app developers, incoming EU laws will force Apple to permit alternative app stores and apps without the need ...",61.315,50.0,0.633653998374939,79.295,90.0,99.84870553016663,2022-12-14
269,AMBCrypto,"Polkadot [DOT] sees some respite arrive at $5, but can the bulls hold on?","Disclaimer: The information presented does not constitute financial, investment, trading, or other types of advice and is solely the writer’s opin...",50.0,50.0,0.38101673126220703,50.0,46.875,0.11563897132873535,2022-12-14
270,NewsBTC,"Bitcoin Price Hints At Potential Reversal, Buy The Dip?","Bitcoin price gained pace above the $17,500 resistance after the US CPI release. BTC tested the $18,000 resistance and might correct lower in the ...",50.0,50.0,0.011423230171203613,55.135,50.0,3.2872796058654785,2022-12-14
271,CryptoSlate,Binance sees the largest outflow of stablecoins in 24 hours,"Crypto exchange Binance faced the largest stablecoin (BUSD+USDT+USDC) outflows in 24 hours, amounting to $2.159 billion. The post Binance sees th...",50.0,50.0,78.38848531246185,50.0,50.0,0.0793159008026123,2022-12-14
272,AMBCrypto,ApeCoin’s [APE] price drops even as these metrics see a surge,"APE staking went live on 6 December and the rewards were unlocked on 12 December.  The price of APE, however, did not reflect the hype that came w...",50.0,50.0,2.989897131919861,73.83500000000001,56.81818181818181,0.16798973083496094,2022-12-14
273,NewsBTC,Toncoin (TON) Leads Market Gains With Over 27% In A Week,"Toincoin is trading at $2.30, gaining 10.61% in 24 hours. The price change in this period is 0.3172. The 24-hour low is $2.05, while the 24-hour h...",67.0,50.0,99.87674951553345,58.894999999999996,50.0,0.03496408462524414,2022-12-14
274,The Block,Coinbase CEO says market fear and volatility are a ‘moment to shine’,"“This is our moment to shine,” Coinbase CEO Brian Armstrong told employees in a communication obtained by The Block. ...",25.305,50.0,89.2948567867279,27.98,50.0,23.671087622642517,2022-12-14
275,AMBCrypto,BTC could have a fruitful 2023 thanks to LTHs and the exit of these market players,"2022 remains one of the most chaotic years in the history of Bitcoin Following FTX&#8217;s collapse, LTHs intensifies accumulation ahead of a pric...",72.02,60.0,2.2131770849227905,11.435,62.5,14.541196823120117,2022-12-14
276,Decrypt,"SBF Denied Bail, Will Fight Extradition from The Bahamas",A judge has decided to keep the ex-CEO in custody as his legal team fights to keep him out of the U.S.,16.475,50.0,0.3707617521286011,35.199999999999996,60.0,13.181182742118835,2022-12-14
277,Blockchain News,NFTs And Crypto Will Benefit From Apple Allowing Third-Party App Stores,Apple will allow third-party app stores on its devices to comply with EU anti-monopolistic rules. EU legislation will compel Apple to allow altern...,72.94,50.0,9.943053126335144,71.075,50.0,0.02968311309814453,2022-12-14
278,U.Today,"Everything You Need to Know About Voltaire, New Era of Cardano (ADA)",Learn how latest era of Cardano may influence altcoin’s blockchain,50.0,56.81818181818181,99.96675550937653,50.0,75.0,94.83173787593842,2022-12-14
