,source,title,excerpt,vader_sentiment_title,tb_sentiment_title,flair_sentiment_title,vader_sentiment_excerpt,tb_sentiment_excerpt,flair_sentiment_excerpt,date
0,Bitcoin Magazine,Of Monsters And Maximalism — Bitcoin Culture Is Created By Value Alignment,"If you see evil toxicity oozing from every corner of Bitcoin, it might be a reflection of your own views on the world. (Read More...)",76.335,50.0,98.72137606143951,17.015,51.66666666666666,1.1269867420196533,2022-07-12
1,CryptoPotato,Brazilian Fintech PicPay to Launch a Stablecoin And a Cryptocurrency Exchange,"The brazilian startup PicPay is interested in cryptocurrency, but has no intentions of going slow on its services, launching a stablecoin, an exchange and a crypto unit. (Read More...)",50.0,50.0,92.05731749534607,38.09,57.49999999999999,0.2869904041290283,2022-07-12
2,CryptoSlate,Op-ed: Web3 will revolutionize how fans and artists engage with tickets,"As 2022 continues, the internet stands on the precipice of what has become known as “Web3.” Where Web1 was the original internet of the ‘90s, and Web2 has been defined by streaming entertainment and social media, Web3 promises verifiable digital ownership of services and assets. (Read More...)",67.0,50.0,99.76368248462677,90.63,61.354166666666664,99.91113245487213,2022-07-12
3,CoinTelegraph,GameStop releases public beta NFT marketplace,"American video game, consumer electronics, and gaming merchandise retailer GameStop has launched its NFT marketplace enabling gamers, creators, collectors, and others to buy, sell and trade NFTs. (Read More...)",50.0,50.0,95.00718414783478,56.400000000000006,51.66666666666666,99.64775741100311,2022-07-12
4,Crypto Briefing,GameStop Launches NFT Marketplace,"GameStop has opened its non-fungible token marketplace, according to an announcement from the company today. GameStop Launches Digital Art NFTs GameStop has launched open beta access to its NFT marketplace... (Read More...)",50.0,50.0,99.68641996383667,56.400000000000006,58.333333333333336,96.6235488653183,2022-07-12
5,The Block,Former Meta execs seek $2 billion valuation for crypto venture Mysten Labs: The Information,"Two former Meta crypto executives are building a new blockchain, and seeking a $2 billion valuation for it, according to two sources with knowledge of the matter. (Read More...)",50.0,50.0,10.595545172691345,51.29,60.60606060606061,2.222740650177002,2022-07-12
6,AMBCrypto,CoinFLEX users are not in the clear- Fresh concerns hot off the press,"In a recent announcement dated 9 July, co-founders of CoinFLEX, Sudhu Arumugam and Mark Lamb outlined steps they intend to take in order to help the exchange out of its current liquidity crisis. An unfortunate impact of the general bearish outlook of the cryptocurrency market so far this year has... (Read More...)",51.495000000000005,60.83333333333334,0.008064508438110352,17.015,51.24999999999999,0.07686614990234375,2022-07-12
7,BeInCrypto,Crypto Credit Cards Rise as Traditional Credit Cards Get Ditched,Crypto credit card holders are on the move: traditional credit cards are being ditched in favor of crypto rewards credit cards. (Read More...),81.845,50.0,0.8081018924713135,95.59,62.5,19.002363085746765,2022-07-12
8,CryptoPotato,South Korea’s Largest Mobile Operator to Introduce a Web3 Wallet: Report,SK Telecom partnered with AhnLab Blockchain Company and Atomrigs Labs to design a digital wallet focused on crypto and Web3. (Read More...),50.0,50.0,15.042716264724731,69.08999999999999,62.5,94.49498355388641,2022-07-12
9,Bitcoin.com,"Survey: Investors Expect Bitcoin’s Price to Fall to $10,000","A new survey shows that the majority of nearly 1,000 investors who responded expect bitcoin’s price to drop to $10K. In addition, 28% of respondents expressed strong confidence that cryptocurrencies are the future of finance while 20% said they are worthless. Investors Believe Bitcoin Could Fall ... (Read More...)",50.0,50.0,0.009456276893615723,69.08999999999999,53.08080808080808,0.006669759750366211,2022-07-12
10,NewsBTC,"Wall Street Investors Expect Bitcoin To Hit $10,000, Is This Possible?","The decline of bitcoin over the last several weeks has raised concerns among investors in the space. The digital asset which had peaked at $69,000 had declined as low as $17,600 and continues to struggle to hold $20,000, dragging investor sentiment down with it. This same sentiment was shared by ... (Read More...)",50.0,50.0,0.10755658149719238,56.400000000000006,52.46031746031746,0.010350346565246582,2022-07-12
11,Bitcoinist,Ever Wonder How Dogecoin Investors Are Faring In The Bear Market?,"Dogecoin investors are caught in the middle of the bear market just like all of the other cryptocurrencies. With the downtrend, investors across a number of digital assets have seen their profitability decline with most being in more losses than those who continue to make money. However, for a cr... (Read More...)",50.0,50.0,0.5371540784835815,69.16,61.458333333333336,0.060752034187316895,2022-07-12
12,crypto.news,Ethereum Whales Scoop Up Metaverse Tokens as ETH Liquidations Rise,"Despite the recent decline in ETH‘s price, bulls are still holding on to the key technical level of $1,100. This resistance level represents the peak of the bull run. Due to the sudden decline in its price, many investors have… (Read More...)",57.655,50.0,15.52770733833313,50.0,56.25,86.94535195827484,2022-07-12
13,Blockworks,"Market Wrap: Bitcoin, ETH and DeFi Assets Fall as Investors Focus on Downside","An influential survey shows 60% of respondents thought bitcoin could hit $10,000 before it recovers The post Market Wrap: Bitcoin, ETH and DeFi Assets Fall as Investors Focus on Downside appeared first on Blockworks. (Read More...)",46.14,50.0,0.03755390644073486,69.08999999999999,68.75,0.014415383338928223,2022-07-12
14,BeInCrypto,Playboy Partners With The Sandbox to Create MetaMansion,"Playboy is still relevant, apparently. The Sandbox has partnered with Playboy to create a Playboy-themed social gaming experience. (Read More...)",63.660000000000004,50.0,5.640935897827148,63.660000000000004,62.291666666666664,1.2236475944519043,2022-07-12
15,Decrypt,Axie Infinity NFT Sales Rising Amid 'Play-and-Earn' Transition,"After economic collapse and the massive Ronin bridge hack, crypto’s biggest game is showing fresh signs of life. Will it last? (Read More...)",50.0,50.0,98.64138662815094,38.685,55.00000000000001,99.9052345752716,2022-07-12
16,AMBCrypto,Ethereum’s transaction fee drops below $0.90 but here’s the issue,"Dealing with the constant selling pressure hasn’t been easy for any altcoin. Well, not even for the king alt Ethereum. ETH has been following the broader market cues. In fact, the past week registered around 10% gains but a weekend sell-off saw ETH’s prices cut by more than 3%. A hidden gem? Ethe... (Read More...)",50.0,50.0,0.2682507038116455,49.355,57.26190476190476,0.0029981136322021484,2022-07-12
17,CryptoGlobe,Grayscale Maintains Cardano ($ADA) and Solana ($SOL) as Top Holdings in Smart Contract Fund,Cryptocurrency asset manager Grayscale Investments has maintained both Cardano ($ADA) and Solana ($SOL) as the top holdings in its fund offering investors exposure to smart contract blockchain networks while excluding Ethereum ($ETH). According to data from the Grayscale Smart Contract Platform e... (Read More...),77.115,67.85714285714286,99.64423477649689,91.355,67.85714285714286,99.81696605682373,2022-07-12
18,The Daily Hodl,Ripple Secures Partnership To Launch New NFT Marketplace on the XRP Ledger,"San Francisco-based payments company Ripple is signing a new partnership involving non-fungible tokens (NFTs). In a new announcement, digital assets exchange CrossTower says they are partnering with Ripple to bring XRP Ledger (XRPL) minted NFTs to the CrossTower NFT marketplace. “CrossTower will ... (Read More...)",65.91,56.81818181818181,99.93007481098175,58.894999999999996,59.65909090909091,90.36627411842346,2022-07-12
19,The Daily Hodl,"Institutional Capital Could Flood Bitcoin, Ethereum, Solana and Polygon Under This Condition: Kevin O’Leary","Shark Tank star Kevin O’Leary says that a massive wave of blue-chip capital could flood into the crypto asset space if proper conditions are met. In a new interview with crypto influencer Anthony Pompliano, the venture capitalist says that billions of dollars worth of institutional capital could ... (Read More...)",50.0,50.0,2.697405219078064,76.335,59.36363636363636,0.4683852195739746,2022-07-12
20,NewsBTC,Former BitMEX CEO Arthur Hayes Says “Prepare” For A Massive Bitcoin Rally,"Bitcoin is still stuck in a tight range as it trades around $20,000 to $21,000. The cryptocurrency was rejected at major resistance levels and could re-test its yearly lows close to $17,000. Related Reading | TA: Ethereum Revisits Key Support, Can The Bulls Protect More Losses At the time of writ... (Read More...)",50.0,50.0,21.354523301124573,20.755000000000003,57.36607142857143,0.001329183578491211,2022-07-12
21,Blockworks,Survey: More Investors Say Bitcoin Likely To Hit $10K Instead of $30K,Nearly a quarter of retail investors consider the cryptoasset class “garbage” The post Survey: More Investors Say Bitcoin Likely To Hit $10K Instead of $30K appeared first on Blockworks. (Read More...),50.0,62.5,0.008806586265563965,50.0,63.5,0.0038683414459228516,2022-07-12
22,CryptoGlobe,IOG’s Tim Harrison Explains the Important Benefits Cardano’s Vasil Upgrade Will Deliver,"Recently, Tim Harrison, Vice President Community &amp; Ecosystem at Input Output Global (“IOG”), the company responsible for Cardano’s research and development, told the Cardano community what benefits they could expect from the hotly-anticipated Vasil upgrade (aka “Vasil hard fork” and “Vasil Ha... (Read More...)",76.335,70.0,98.80208969116211,77.115,54.08333333333333,88.53911757469177,2022-07-12
23,Decrypt,Texas Bitcoin Miners Power Down as Heat Wave Threatens Grid With Rolling Blackouts,"The collective move returns over 1% of power in Texas back to retail and commercial users, according to the president of the Texas Blockchain Association. (Read More...)",30.910000000000004,42.22222222222222,1.4329314231872559,50.0,58.333333333333336,99.09538328647614,2022-07-12
24,The Block,"Bitcoin mining stock report: Monday, July 11","Here's how crypto mining companies performed on Monday, July 11. (Read More...)",50.0,50.0,0.010713934898376465,50.0,75.0,0.017243623733520508,2022-07-12
25,CryptoBriefing,Voyager Digital Provides Update on Recovery Plan,"Failing cryptocurrency lending company Voyager Digital announced a recovery plan for users in a blog post today. Voyager Will Pay Out Asset Shares Following its earlier decision to suspend withdrawals,... (Read More...)",50.0,50.0,80.75048327445984,34.089999999999996,56.25,0.35840272903442383,2022-07-12
26,AMBCrypto,Cardano holders will go gaga to know that despite declining 85%…,"Cardano may have lost its investors’ confidence over time. But it did not lose its popularity thanks to its immense potential and roadmap for development. Combined with the efforts of the Cardano development team, the blockchain is gaining an audience in the space it intends to dominate. Cardano ... (Read More...)",50.0,50.0,83.66009593009949,89.09,58.75,99.95177984237671,2022-07-12
27,Cointelegraph,Crypto miners in Texas shut down operations as state experiences extreme heat wave,"ERCOT reported that wind generation in Texas was “generating significantly less,"" potentially leaving the state unable to meet energy demands during triple-digit temperatures. (Read More...)",50.0,42.986111111111114,0.007236003875732422,63.660000000000004,47.91666666666667,0.012496113777160645,2022-07-12
28,The Block,GameStop goes live with public beta of NFT marketplace,GameStop announced on July 11 that it has launched an NFT marketplace. (Read More...),50.0,53.40909090909091,20.61527967453003,56.400000000000006,75.0,90.62010049819946,2022-07-12
29,CryptoBriefing,First Fully-Regulated British Pound Stablecoin Launched,"Poundtoken, the first fully regulated, fully-collateralized stablecoin pegged to the Great British pound, is now being offered by a company located in the Isle of Man. GBPT Available on UniSwap... (Read More...)",56.400000000000006,56.25,99.04652833938599,81.245,69.5,3.4712016582489014,2022-07-12
30,Bitcoinist,"DeFi Loses $678 Million To Hackers In Q2 2022, New Report Reveals","The cryptocurrency market has suffered greatly, particularly since Bitcoin had its worst quarter in 11 years. According to data releasedby Immunefi, a leading bug bounty and security services platform, the Decentralize Finance (DeFi) ecosystem lost $678 million, in the second quarter of 2022. Imm... (Read More...)",34.089999999999996,45.909090909090914,0.10555684566497803,9.899999999999999,45.83333333333333,0.0011682510375976562,2022-07-12
31,Blockworks,Sun Says He May Spend $5B To Save Crypto Even as USDD Fights To Hold Peg,"Tron's Justin Sun says his protocol is “ready to serve” struggling crypto firms, but questions have emerged over his capacity to do so The post Sun Says He May Spend $5B To Save Crypto Even as USDD Fights To Hold Peg appeared first on Blockworks. (Read More...)",56.400000000000006,50.0,0.015926361083984375,48.065000000000005,65.83333333333333,0.35109221935272217,2022-07-12
32,The Block,Twitter declares Musk deal termination bid ‘invalid’ in new letter,"In a letter issued by Twitter's legal representatives this weekend and released Monday, the company said Elon Musk's move to terminate the $44 billion Twitter acquisition is ""invalid and wrongful."" (Read More...)",50.0,56.81818181818181,0.02186000347137451,56.400000000000006,67.5,0.02942681312561035,2022-07-12
33,CoinTelegraph,Analysts say Bitcoin range ‘consolidation’ is most likely until a ‘macro catalyst’ emerges,"BTC on-chain metrics and technical indicators are trading near historical bottoms, but analysts say a new “macro catalyst” could prove the current range is not the bottom. (Read More...)",50.0,62.5,96.11156582832336,50.0,56.13636363636364,90.63497483730316,2022-07-12
34,Decrypt,GameStop Opens Ethereum NFT Marketplace Following Company-Wide Layoffs,The long-promised Ethereum NFT platform is live just days after the video game retailer laid off another round of employees. (Read More...),50.0,50.0,0.9071558713912964,50.0,50.45454545454545,0.0702589750289917,2022-07-12
35,CryptoPotato,GameStop Launches Long-Awaited NFT Marketplace,GameStop has rolled out its NFT marketplace to compete with major players like OpenSea and Coinbase. (Read More...),50.0,50.0,99.36072826385498,68.06,64.0625,99.64127540588379,2022-07-12
36,ZyCrypto,Cardano Whales Filling Their Bags In Bullish Sign As Traders Anticipate ADA Surge On Vasil Upgrade,"After what appears to be a persistent series of dumps, major whale addresses have retained their ADA holdings as... (Read More...)",50.0,50.0,0.5357652902603149,30.910000000000004,64.0625,96.14340364933014,2022-07-12
37,Blockworks,Crypto Increasingly Used To Pay Salaries in Developing Economies,Companies are finding blockchain technology can help them source talent worldwide The post Crypto Increasingly Used To Pay Salaries in Developing Economies appeared first on Blockworks. (Read More...),44.865,50.0,1.0227203369140625,81.245,68.75,97.1229076385498,2022-07-12
38,Decrypt,"BlockFi CEO Doesn’t Want to Be Compared to Voyager, Celsius","A few days after BlockFi’s warrants were downgraded to “worthless,” Zac Prince took to Twitter to ask that his company not be compared to peers. (Read More...)",53.86,50.0,1.7878741025924683,50.0,41.66666666666667,0.006544589996337891,2022-07-12
39,crypto.news,"Fundraising Rounds with Thalex, Li.Fi and DeepNFTValue, Voyager Might not Fully Repay Customers, Celsius Continues to Settle Debts","Fundraising rounds continue with Thalex, Li.Fi, and DeepNFTValue raising millions. Reports indicate that Voyager’s recovery plan does not guarantee refunds to all customers. Celsius, on the other hand, is continually settling its debts as part of its recovery plan. Futures… (Read More...)",50.0,50.0,0.23585259914398193,67.635,59.375,0.6478041410446167,2022-07-12
40,Decrypt,"Three Arrows Capital Office Abandoned, Founders Missing, Say Creditors",3AC filed for Chapter 15 bankruptcy last month. (Read More...),18.154999999999998,40.0,0.034743547439575195,50.0,62.5,0.11872351169586182,2022-07-12
41,CryptoGlobe,"$ADA: Cardano ‘Sharks’ Are Hungry Again, Says Blockchain Analytics Firm","Behavioral analytics firm Santiment says that according to on-chain data Cardano ($ADA) “sharks” addresses have gone into accumulation mode. In a tweet sent out last Saturday (July 9), Santiment noted that “as #Cardano‘s price performance has stayed particularly underwhelming in 2022, addresses h... (Read More...)",50.0,40.0,0.09704530239105225,50.0,55.833333333333336,0.0043332576751708984,2022-07-12
42,The Block,"As Texas grid operator calls for energy conservation, some bitcoin miners paused operations",Bitcoin miners in Texas are powering down amid a heatwave in Texas and as the grid operator asks residents to save energy. (Read More...),63.660000000000004,50.0,0.08434653282165527,82.43,58.611111111111114,0.5112707614898682,2022-07-12
43,Bitcoinist,Crypto Fallout: Voyager Faces User Backlash Over Funds Refund,"Crypto lending firm Voyager posted an update on its “restructuring process” and how it will impact its crypto users. Last week, the company filed for bankruptcy following a default on a $650 million loan issued to investment firm Three Arrows Capital (3AC). Related Reading | Celsius Replaces Its ... (Read More...)",50.0,50.0,0.025960803031921387,50.0,50.83333333333333,0.00661015510559082,2022-07-12
44,Bitcoin.com,100-Year-Old Pennsylvania-Based Bank Approved to Leverage Makerdao’s Stablecoin Vault,"Makerdao, the decentralized autonomous organization (DAO) that issues the stablecoin DAI, approved a governance proposal that provides “collateral integration from a U.S.-based bank.” The Makerdao governance proposal passed by a majority vote of more than 87%, and it gives the U.S. financial inst... (Read More...)",71.075,50.0,24.485835433006287,71.075,67.5,89.560067653656,2022-07-12
45,CryptoPotato,Voyager Can’t Guarantee How Much Crypto Will Be Restored to Customers,The platform’s ability to return crypto to customers will depend on the successful recovery of its claims against Three Arrows Capital (3AC). (Read More...),76.335,60.0,0.13051331043243408,86.345,81.25,0.1551985740661621,2022-07-12
46,Cointelegraph,Lido DAO price moves higher as the Ethereum Merge moves a step closer to completion,LDO price books a 45%+ monthly gain as the Ethereum network moves closer to completing its proof-of-stake upgrade. (Read More...),50.0,62.5,98.13660979270935,76.335,75.0,99.38826560974121,2022-07-12
47,Bitcoinist,Celsius Replaces Its Lawyers And Repays $20 Million Debt To Aave,"Though caught up in the web of the prevailing crypto bear market, Celsius adversely impacted the situation. The crypto lending platform has been struggling to break loose from the effect of insolvency. It suspended customers’ withdrawal from the platform to survive the storm. Also, it had previou... (Read More...)",31.94,50.0,14.616018533706665,8.200000000000001,60.57692307692307,0.03501176834106445,2022-07-12
48,The Daily Hodl,Legendary Bitcoin Analyst Peter Brandt Warns Top Altcoin Is Forming ‘Ugly’ Pattern,"Veteran commodities trader Peter Brandt says that one Ethereum challenger is forming a chart pattern that screams “ugly.” Brandt, known for calling the 2018 crypto collapse, tells his 668,000 Twitter followers that ETH rival Cardano (ADA) looks ready for more pain. Brandt bases his analysis on wh... (Read More...)",55.135,63.33333333333333,0.017249584197998047,14.11,55.00000000000001,0.00909268856048584,2022-07-12
49,Cryptonews,Venezuelan Crime Gang Was ‘Stealing Crypto from Retirees’,A Venezuelan police agency says it has caught criminals who have allegedly stolen cryptoassets from pensioners by misusing the Patria crypto remittance platform.... Read More: Venezuelan Crime Gang Was ‘Stealing Crypto from Retirees’ (Read More...),22.884999999999998,50.0,0.24898648262023926,5.359999999999998,65.0,1.3110458850860596,2022-07-12
50,U.Today,"""Complete Fraud"": Citron Research Founder Lambasts Crypto",Legendary short-seller Andrew Left has lambasted crypto during a recent conference appearance (Read More...),50.0,55.00000000000001,0.01277625560760498,50.0,68.75,0.9239464998245239,2022-07-12
51,The Daily Hodl,Macro Guru Raoul Pal Names Three Conditions That Could ‘Absolutely’ Benefit the Crypto Markets,"Macro guru Raoul Pal is naming the three conditions that could give the crypto markets a healthy boost after enduring months of rocky price action. In a new interview on the Real Vision YouTube channel, the former Goldman Sachs executive says that the Fed’s tight monetary policies are already pri... (Read More...)",72.94,60.0,9.42305326461792,87.53,58.98423005565863,4.082834720611572,2022-07-12
52,Cryptomode,Revolut partners with Polkadot and Gorilix (SILVA) presale sees 225% growth.,"As usual, there is a lot of movement in the world of crypto. Today we will look at the presale of a highly-anticipated new cryptocurrency that has been taking the market by storm and the exciting partnership announcement between one of the world’s largest cryptos and a fintech powerhouse. Gorilix... (Read More...)",69.08999999999999,50.0,99.37781393527985,74.695,58.57954545454545,99.75115656852722,2022-07-12
53,CoinTelegraph,Report urges central banks to work together on digital currency interoperability,"The Bank for International Settlements, International Monetary Fund and World Bank say CBDCs should be programmed in advance to avoid interoperability issues. (Read More...)",50.0,50.0,3.8047611713409424,35.199999999999996,58.333333333333336,10.79658567905426,2022-07-12
54,NullTX,Top 5 AI & Big Data Tokens Below $0.5 to Watch in 2022,"Big data analytics combines and analyzes enormous datasets to find patterns and generate actionable insights. Big data analytics uses techniques and technologies like AI and machine learning. AI is meaningless without data, yet mastering data is impossible without AI; therefore, data and AI are m... (Read More...)",60.114999999999995,62.5,98.31710457801819,44.865,44.44444444444445,99.98377561569214,2022-07-12
55,CoinGape,XTZ Price Analysis: High Momentum Breakout From $1.65 Targets 32% Pump,"The Tezos coin is one of the few top cryptocurrencies that started the new week on a bullish note. While fighting the uncertain market sentiment, the coin price shows a gradual rise in XTZ price. Furthermore, the price has recently breached $1.65, indicating the buyers are ready for another leg u... (Read More...)",50.0,57.99999999999999,2.712509036064148,44.865,59.46969696969697,0.013503432273864746,2022-07-12
56,CoinTelegraph,"Price analysis 7/11: BTC, ETH, BNB, XRP, ADA, SOL, DOGE, DOT, SHIB, AVAX","Bitcoin and select altcoins are discounted and trading close to critical support levels, but will buyers step in? (Read More...)",50.0,50.0,0.5344003438949585,53.86,62.5,0.14846324920654297,2022-07-12
57,NewsBTC,Bitcoin Bearish Signal: Leverage Ratio Is Still Very High,"On-chain data shows the Bitcoin leverage ratio still has a very high value, a sign that has usually proven to be bearish for the crypto in recent months. Bitcoin Exchange Leverage Ratio Has Been Going Up In Recent Weeks As pointed out by an analyst in a CryptoQuant post, the BTC all exchanges lev... (Read More...)",50.0,60.4,0.23472607135772705,69.88,54.58,93.85546743869781,2022-07-12
58,Bitcoinist,Ethereum 2.0 Weekly Deposits Have Slumped Down To Lowest Ever,"Weekly deposits of the Ethereum 2.0 staking contract have been going down recently due to the plunging price of ETH, and are now at the lowest value ever. Ethereum 2.0 Contract Is Now Observing Only 122 32-ETH Deposits Per Day As per a report from analytics firm Glassnode, the ETH 2.0 average dep... (Read More...)",30.910000000000004,42.22222222222222,0.0012755393981933594,47.42,48.91203703703704,0.0005185604095458984,2022-07-12
59,crypto.news,Grayscale Legal Officer: Bitcoin ETF Litigation Might Last Two Years,"Grayscale’s chief legal officer, Craig Salm, recently discussed the asset manager’s legal fight with the SEC regarding the conversion of the Grayscale Bitcoin Trust (GBTC) into a spot Bitcoin ETF. Grayscale Endeavors for a Spot Bitcoin ETF Asset management companies… (Read More...)",46.14,55.00000000000001,0.6323277950286865,88.58500000000001,57.99999999999999,2.0554929971694946,2022-07-12
60,BeInCrypto,"Axie Infinity Sales Hit 2022 Low, Crashing More than $120 Million","Axie Infinity saw a high decline in sales volume in June due to an overall bearish market, which led to decreased investor interest in non-fungible tokens (NFTs). The post Axie Infinity Sales Hit 2022 Low, Crashing More than $120 Million appeared first on BeInCrypto. (Read More...)",36.34,62.5,0.12077093124389648,61.315,55.53125,0.0009953975677490234,2022-07-12
61,Bitcoin Magazine,Fifth Largest Swiss Bank To Enable Bitcoin Trading For Over 2 Million Customers,The banking arm of the Swiss post office and fifth largest Swiss retail bank is set to launch bitcoin trading and custody services by 2024. (Read More...),50.0,50.0,99.95605051517487,50.0,75.0,98.4450250864029,2022-07-12
62,Crypto Briefing,Heatwave Forces Texas Bitcoin Miners to Shut Down,"Bitcoin miners are cooperating with Texan authorities to help alleviate the states energy grid in anticipation of a heatwave; over 1,000 megawatts worth of power allocated for Bitcoin mining is... (Read More...)",50.0,42.22222222222222,1.8162667751312256,86.345,70.0,91.82184040546417,2022-07-12
