,source,title,excerpt,vader_sentiment_title,tb_sentiment_title,flair_sentiment_title,vader_sentiment_excerpt,tb_sentiment_excerpt,flair_sentiment_excerpt,date
190,Cryptomode,LooksRare and OpenSea Likely To Be Beaten By Presale Token Degrain (DGRN),"This article will compare new crypto Degrain (DGRN) with two renowned digital platforms LooksRare and OpenSea and help you understand why LooksRare and OpenSea are Likely to be beaten by Presale Token Degrain (DGRN). LooksRare (LOOKS) The LooksRare (LOOKS) NFT marketplace, which focuses on the co... (Read More...)",28.925,50.0,0.004518032073974609,48.71,57.95454545454546,13.997957110404968,2022-07-12
191,Cryptomode,Payday Loans Online – Cover Emergency Expenses Online,Where can you get money for emergency expenses? How can you do it? These are the most popular questions asked by financially challenged Americans. Many of whom found the answers with payday loans online. These are loans issued by direct lenders. Borrowers usually take this type of loan for a shor... (Read More...),30.910000000000004,50.0,98.01699221134186,55.81,63.92857142857142,0.6129711866378784,2022-07-12
192,CoinTelegraph,Dutch bank ING sells digital asset tool Pyctor to GMEX,GMEX has acquired ING’s Pyctor business to connect CeFi and Defi amid the increasing demand for hybrid finance. (Read More...),68.06,50.0,2.59513258934021,43.6,75.0,99.45776760578156,2022-07-12
193,Finbold,Global crypto regulations set to be presented by G20 watchdog in October,The Financial Stability Board (FSB) which comprises treasury officials and central bankers from the G20 countries is working on unveiling... Continue reading (Read More...),50.0,50.0,17.525461316108704,60.114999999999995,58.333333333333336,15.900975465774536,2022-07-12
194,AMBCrypto,Bitcoin: Decoding if another black swan event is due,"The global crypto market capitalization on 11 July stood at $914.71 billion with a decline of 3.6% over the last day. On the other hand, the total crypto market volume was $55.15 billion with a 2.25% decrease in the last 24 hours. Now, with the broader market reeling under sell pressure, the late... (Read More...)",50.0,42.708333333333336,3.5762012004852295,62.5,50.535714285714285,0.12695789337158203,2022-07-12
195,Bitcoin.com,UN Report: Venezuela Ranks Third Among Countries With Most Crypto Adoption,"Venezuela, one of the first countries in Latam to be considered “crypto-friendly” by some standards, has ranked third in adoption rates, according to a report issued by the United Nations. The report, issued last month, states that the cryptocurrency ecosystem has grown by 2,300% between Septembe... (Read More...)",50.0,62.5,0.30613839626312256,71.075,59.375,2.278473973274231,2022-07-12
196,BeInCrypto,Quant (QNT) Breaks out From 287-Day Resistance Line,"Quant (QNT) is in the process of creating a bullish structure and its first higher low since June 13. Despite the ongoing breakout, the bullish structure is not yet confirmed. (Read More...)",50.0,50.0,0.2002716064453125,51.29,64.0,0.001239776611328125,2022-07-12
197,CryptoGlobe,"$SHIB Lead Dev on L2 Blockchain Shibarium, Stablecoin $SHI, and Reward Token $TREAT","Recently, Shytoshi Kusama, the pseudonymous lead developer of the Shiba Inu ($SHIB) project, provided an update on the status of the work some of the key elements of the Shiba Inu ecosystem. Here is what Binance Academy says about Shiba Inu: “Shiba Inu (SHIB) is a dog-themed meme cryptocurrency n... (Read More...)",78.595,50.0,91.43294394016266,50.0,58.333333333333336,1.9433677196502686,2022-07-12
198,Ethereum World News,"Twitter Hires Law Giant Wachtell, Lipton, Rosen & Katz for Elon Musk Lawsuit","Twitter has hired merger law firm Wachtell, Lipton, Rosen &amp; Katz in its bid to sue Elon Musk. Musk has also hired Quinn Emanuel Urquhart &amp; Sullivan LLP in the case. The billionaire has also been sued by one investor over allegedly running a pyramid scheme. Twitter is stepping up its game ... (Read More...)",38.685,50.0,0.36162734031677246,50.0,47.5,0.008314847946166992,2022-07-12
199,Blockworks,"3AC Co-Founders Remain Silent, Creditors go to Court","Co-founders Zhu Su and Kyle Davies have been uncooperative in legal proceedings so far, lawyers seeking emergency provisional relief said The post 3AC Co-Founders Remain Silent, Creditors go to Court appeared first on Blockworks. (Read More...)",50.0,50.0,1.2364447116851807,62.5,60.5,0.015157461166381836,2022-07-12
200,CoinGape,These Altcoins Performed Better Than Bitcoin In The Recent Crypto Crash,"Bitcoin has lost nearly 30% of its value in the last 30 days, as a series of liquidations of major crypto holders spurred mass dumping of the token. This in turn has severely impacted sentiment towards the crypto market, causing most major altcoins to tumble in tow. The world’s largest cryptocurr... (Read More...)",52.580000000000005,62.5,99.9274879693985,18.154999999999998,60.20833333333333,0.017595291137695312,2022-07-12
201,NewsBTC,Cryptocurrency: This Messaging App Lets You Pay With Crypto,"Messaging apps are commonly used for online communication. However, things have progressed to the point where such apps now include a wide range of integrations. Online communication has gone beyond the mere purpose of messaging to include sharing media, contacts, and documents. The most recent t... (Read More...)",44.865,50.0,99.31582510471344,71.075,50.71428571428571,90.48502147197723,2022-07-12
202,Forkast,Why Bitcoin is still a good investment despite the bear market,"BTC remains a safe haven for investors for the long term amid this year’s soaring inflation and market volatility, writes Josef Tětek of SatoshiLabs. (Read More...)",72.02,85.0,99.56559538841248,72.02,65.83333333333333,24.430710077285767,2022-07-12
203,Crypto Daily,"Crypto Daily - Daily Crypto And Financial News 11/07/2022, Celsius Working On Restructuring With Hiring Spree","In Todays Headline TV CryptoDaily News: Navigating financial fallout Embattled cryptocurrency lender Celsius Network LLC has hired new lawyers for restructuring advice as it navigates the financial fallout from recent turmoil in crypto markets, according to people familiar with the matter. Bitcoi... (Read More...)",50.0,50.0,0.19057095050811768,32.99999999999999,58.4280303030303,2.3490697145462036,2022-07-12
204,U.Today,Here Might Be a Setup for Bitcoin Price as Community Awaits Key Inflation Decisions,Few crypto analysts remain optimistic about Bitcoin's price action (Read More...),53.86,50.0,0.13646185398101807,65.91,56.666666666666664,10.513034462928772,2022-07-12
205,Crypto Daily,"Crypto Daily - Daily Crypto And Financial News 11/07/2022, Celsius Working On Restructuring With Hiring Spree","In Todays Headline TV CryptoDaily News: Navigating financial fallout Embattled cryptocurrency lender Celsius Network LLC has hired new lawyers for restructuring advice as it navigates the financial fallout from recent turmoil in crypto markets, according to people familiar with the matter. Bitcoi... (Read More...)",50.0,50.0,0.19057095050811768,32.99999999999999,58.4280303030303,2.3490697145462036,2022-07-12
206,CryptoPotato,Web3 Product Studio 0xytocin Labs Acquires NFT Project Chain Scouts,"[PRESS RELEASE – Singapore, Singapore, 10th July 2022] The developer team behind Project Godjira, SkyVerse, and many other NFT projects, 0xytocin Labs, has acquired Chain Scouts to enhance their ecosystem and develop exciting NFT products. With a team of over 30 safe NFT drops and over 5000 ETH p... (Read More...)",50.0,50.0,99.2589145898819,86.345,60.62499999999999,99.9620258808136,2022-07-12
207,CoinTelegraph,Terra crash highlights stablecoin risk to financial stability: ECB,A recent ECB report says stablecoins are not practical as a mode of payment and their current form isn't fit for use in the real economy. (Read More...),20.705000000000002,50.0,99.79929625988007,36.224999999999994,61.0,0.019440054893493652,2022-07-12
208,U.Today,Ex-Ripple Executive Proves Bitcoin Maximalists That They Are Wrong,Matt Hamilton argues with Bitcoin maxis about XRP Ledger's decentralization (Read More...),26.165,45.0,0.13238787651062012,30.910000000000004,75.0,1.7534852027893066,2022-07-12
209,CoinTelegraph,Want a compelling use case for privacy blockchains? Look no further than dating,"Businesses are in love with Web3 — but when it comes to this technology being used for dating apps, singletons might want to swipe left. (Read More...)",50.0,57.49999999999999,99.19842481613159,73.39,66.66666666666666,1.399645209312439,2022-07-12
210,Bitcoinist,ViaBTC Capital｜What is the Solution to the DeFi Crisis?,"Following the UST depeg, the crypto market started to crumble: crypto institutions crashed, exchanges suspended withdrawals, and lending protocols suffered from liquidation and runs, presenting a huge liquidity crisis. The domino effect has also fully revealed a DeFi crisis. In 2020, everyone had... (Read More...)",28.925,50.0,4.080656170845032,3.915000000000002,65.0,2.9772520065307617,2022-07-12
211,Decrypt,Yam Finance Safeguards $3.1M Treasury From Governance Attack,The Yam Finance team successfully blocked a malicious proposal attempting to rinse the project’s treasury worth $3.1 million. (Read More...),51.29,50.0,0.3790616989135742,79.295,75.83333333333333,87.83352375030518,2022-07-12
212,Finbold,Crypto analyst identifies key Bitcoin price levels to watch ahead of June’s inflation report,"As the June consumer price index (CPI) data report is approaching, set to be published on July 13, cryptocurrency market... Continue reading (Read More...)",50.0,50.0,94.97467875480652,50.0,62.5,2.8336435556411743,2022-07-12
213,U.Today,"Institutional Whales Are Waiting to ""Buy the Blood"", Messari Report","Messari analysts believe ‌crypto is inevitable and we are going to see massive adoption, when all problems will be solved (Read More...)",50.0,50.0,0.07623732089996338,42.345,58.333333333333336,10.241442918777466,2022-07-12
214,AMBCrypto,Maker DAO continues to outperform Compound- for following reasons,"The DeFi space has some fierce rivals in its different categories ranging from DEXes such as Uniswap and SushiSwap to NFT marketplaces like OpenSea and Magic Eden. In the lending category, AAVE has domination in terms of the Total Value Locked (TVL) on it, holding $6 billion. Following it is Just... (Read More...)",50.0,50.0,0.155678391456604,78.595,58.333333333333336,95.51415741443634,2022-07-12
215,CryptoGlobe,Federal Reserve Vice Chair: ‘Crypto Platforms Are Highly Vulnerable to Deleveraging’,"On Friday (July 8), Dr. Lael Brainard, who “took office as the Vice Chair of the Board of Governors of the Federal Reserve System on May 23, 2022,” spoke at a Bank of England Conference in London, UK. Dr. Brainard has “served as a member of the Board of Governors of the Federal Reserve System […] (Read More...)",35.28,25.0,0.6811708211898804,50.0,75.0,87.89577782154083,2022-07-12
216,BeInCrypto,Uniswap Volume Crashes More Than $25 Billion in June to 10-Month Low,"Uniswap saw a steep decline in trading volume during the month of June, the lowest the decentralized exchange (DEX) has recorded since July 2021. The post Uniswap Volume Crashes More Than $25 Billion in June to 10-Month Low appeared first on BeInCrypto. (Read More...)",36.34,62.5,0.0015676021575927734,21.405,65.625,0.0010788440704345703,2022-07-12
217,CoinGape,"Experts Warn Of Major Trouble For Circle And USDC, Here’s Why","Matt Taibbi, a notable author, and journalist wrote a scathing article warning against investing in USDC. Pointing to the Circle being the sole counterparty to its reserve funds, Taibbi revealed that Circle’s Reserve Fund would belong to the company and not its holders. Taibbi believes that Circl... (Read More...)",26.165,46.5625,7.62803852558136,32.99999999999999,55.00000000000001,0.09514987468719482,2022-07-12
218,Cryptonews,"Majority Expects Bitcoin to Hit USD 10,000 Before Moving Higher - Survey","Bitcoin (BTC) is more likely to fall to USD 10,000 than it is to rise to USD 30,000, the majority of respondents in a new survey by Bloomberg Markets Live believe. According to the survey, 60% of respondents said they believe bitcoin will fall to USD 10,000 before any significant rise in price is... (Read More...)",50.0,62.5,0.009807944297790527,60.114999999999995,63.73106060606061,0.06160438060760498,2022-07-12
219,Finbold,International Organization of Securities Commissions publishes crypto roadmap for 2023,The International Organization of Securities Commissions (IOSCO) has published its framework to govern the sector in the next few years... Continue reading (Read More...),64.8,50.0,89.50533270835876,64.8,53.75,98.0874627828598,2022-07-12
220,The Block,G20 regulators call for new global rules on cryptocurrencies,The Financial Stability Board will submit a report to the G20 Finance Ministers and Central Bank Governors in October on regulatory and supervisory approaches to crypto assets. (Read More...),50.0,53.40909090909091,20.37082314491272,58.894999999999996,58.333333333333336,1.456695795059204,2022-07-12
221,Coinnounce,South Korea Telecom to create “Web3 Wallet”,"SK Telecom announced on 11 July that it had signed an agreement with AhnLab’s blockchain subsidiary, AhnLab Blockchain Company (ABC), and Atomix Lab, a blockchain specialist, for the joint development and operation of the Web3 wallet. Web3 is a generational division of online services; Web1 recei... (Read More...)",63.660000000000004,50.0,22.357383370399475,74.695,75.0,93.48101019859314,2022-07-12
222,Feed - Cryptopotato.Com,CoinFLEX Takes Legal Action to Recover the Missing $84 Million,The co-founders revealed that they have been looking for companies and partners to invest in the exchange and have often been under NDAs with them. (Read More...),41.105000000000004,51.66666666666667,1.1545002460479736,50.0,75.0,2.9490619897842407,2022-07-12
223,CoinGape,Why SEC Hasn’t Sued Ripple Ex CTO For Selling XRP? Lawyer Enquires,"Ripple Labs co-founder and ex-executive, Jed McCaleb has been on a selling spree of XRP tokens since he left the firm. Meanwhile, XRP holders’ lawyer raised an important question over this selling activity as they are involved in the tussle with SEC. Jed McCaleb on a selling spree According to Jo... (Read More...)",50.0,45.0,9.246683120727539,60.114999999999995,56.00000000000001,0.5892395973205566,2022-07-12
224,CryptoBriefing,"Bitcoin, Ethereum Set Up for Potential Rebound",Bitcoin and Ethereum appear to be trading in oversold territory after incurring more than 10% losses over the past three days. Bitcoin and Ethereum Present Buy Signals Bitcoin and Ethereum... (Read More...),50.0,50.0,0.008362531661987305,27.390000000000004,59.375,0.0210493803024292,2022-07-12
225,Crypto Daily,Celsius hires new lawyers - the plot thickens,"Beleaguered crypto lending platform Celsius has seen fit to hire new restructuring lawyers. It is hiring Kirkland &amp; Ellis LLP, the same firm that is currently aiding Voyager Digital with its own restructuring. With at least one other party seeking to provide a financial recovery plan for Cels... (Read More...)",50.0,56.81818181818181,0.03238022327423096,81.845,54.59710743801652,0.018101930618286133,2022-07-12
226,The Block,OKX inks training kit sponsorship deal with Manchester City,The agreement comes as the pace of sponsorship dealmaking between crypto firms and sports teams has slowed. (Read More...),50.0,50.0,96.0304468870163,74.695,75.0,0.7391065359115601,2022-07-12
227,Finbold,"Wall Street sees Bitcoin dropping to $10,000 next rather than $30,000, survey finds","As Bitcoin (BTC) has managed to maintain support above the $20,000 level and climb as high as $22,000, the feeling of... Continue reading (Read More...)",50.0,50.0,0.018143653869628906,74.695,61.0,99.79862868785858,2022-07-12
228,Decrypt,Metaverse Tokens Slump Amid Broader Crypto Market Correction,"Metaverse tokens in Decentraland, The Sandbox, Enjin Coin, and Axie Infinity have all tumbled by roughly 6% over the past 24 hours. (Read More...)",50.0,50.0,0.0057697296142578125,50.0,52.5,0.0073969364166259766,2022-07-12
229,Forkast,"Bitcoin, Ethereum rebound pulls back amid worries of BTC dump from Mt. Gox, Celsius",Gains made by two of the world’s largest cryptocurrencies were partially eroded as speculation of a glut of Bitcoin from Mt. Gox’s debtors and Celsius Network’s payback of its debt circulated over the weekend. (Read More...),17.015,50.0,0.5543619394302368,48.71,60.0,0.057885050773620605,2022-07-12
230,Blockonomi,Ponzi Scheme? KeFi CEO Files Lawsuit Against Crypto Broker Celsius,"Celsius was described as a Ponzi scam and a fraud by its former business partner. What a statement. Let’s go… On July 7, Jason Stone, the CEO of KeyFi Inc., said that he is pursuing legal action against major cryptocurrency lender Celsius in a New York court. The persona behind the yield farming ... (Read More...)",38.685,50.0,0.0490725040435791,10.470000000000002,54.2775974025974,0.00445246696472168,2022-07-12
231,Cryptomode,Is It Worth Running A DeFiChain Masternode?,"Operating a cryptocurrency masternode is often a sensible way of making a passive income. Several projects provide a decent ROI on such operations. DeFiChain, one of the newer entrants, has a viable system that makes running a DeFiChain masternode rather appealing. How To Run A DeFiChain Masterno... (Read More...)",61.315,65.0,7.971608638763428,60.114999999999995,61.66666666666667,99.83028769493103,2022-07-12
232,Blockonomi,Fashion League: A Web3 Female-Centered & Mobile-First Fashion Game,"Fashion League is the first Web3 play-to-earn game that simulates a mobile fashion shop. This game is where gamers, crypto enthusiasts, and brands can meet to design, build, and grow their own shops and design amazing outfits. Fashion League Throughout the journey, you will have the freedom to ex... (Read More...)",50.0,30.0,87.00584173202515,94.30000000000001,59.583333333333336,99.93894398212433,2022-07-12
233,Bitcoin.com,Crypto Exchange Bitso Launches Remittance Service in Colombia,"Bitso, a Mexican-based, Latam operating cryptocurrency exchange, announced it is launching a remittance service in Colombia. The company will now allow its customers in Colombia to send and receive remittances using dollar-pegged stablecoins on the platform. The exchange launched a similar servic... (Read More...)",50.0,50.0,95.6387311220169,67.0,62.5,0.6292074918746948,2022-07-12
234,BeInCrypto,"As Energy Costs Rise and Bitcoin Prices Fall, How Home Miners Are Learning to Adapt","Home and hobbyist miners in the U.S. are finding creative ways to slash their energy bills in the face of increasing prices and the tanking of the crypto market. The post As Energy Costs Rise and Bitcoin Prices Fall, How Home Miners Are Learning to Adapt appeared first on BeInCrypto. (Read More...)",63.660000000000004,50.0,91.62289202213287,80.62,70.83333333333334,13.334551453590393,2022-07-12
235,Decrypt,Crypto-Curious Manchester City Adds OKX Logo to New Training Kit,"As part of a sponsorship deal signed back in March, the OKX logo will now feature on Manchester City's training gear ahead of the new season. (Read More...)",50.0,56.81818181818181,81.18696212768555,50.0,60.60606060606061,79.00171875953674,2022-07-12
236,The Daily Hodl,"Bitcoin Potentially Already in Accumulation Phase, Gearing Up for Next Bull Market, Says Analyst Benjamin Cowen","A popular crypto analyst and trader says that Bitcoin’s (BTC) bear market could be nearing its conclusion. In a new strategy session, Benjamin Cowen tells his 756,000 YouTube subscribers that he’s looking at Bitcoin’s running return on investment (ROI) and comparing its current performance agains... (Read More...)",50.0,50.0,0.055021047592163086,71.075,65.45454545454545,6.813278794288635,2022-07-12
237,Coinnounce,Michael van de Poppe predicts rises for Bitcoin,"Popular Dutch cryptocurrency analyst Michael van de Poppe recently posted on his Twitter account, which has more than 615,000 followers, some predictions regarding the two largest cryptocurrencies of the moment, Bitcoin (BTC) and Ethereum (ETH), while also looking at the popular altcoin Fantom (F... (Read More...)",50.0,50.0,97.30249345302582,84.04,72.0,0.7690519094467163,2022-07-12
238,Cryptonews,"Binance Wash Trading Behind Huge Bitcoin Volume Surge, Incentives Being Removed, CZ Says","The removal of some trading fees on the major crypto exchange Binance is believed to be the reason behind a surge in trading volume on Friday that ended up barely moving the price at all. Now, Binance CEO Changpeng Zhao (CZ) has announced steps to combat so-called wash trading on his exchange. No... (Read More...)",77.86999999999999,50.0,0.8104145526885986,32.99999999999999,52.65625000000001,0.0010251998901367188,2022-07-12
239,CoinTelegraph,Grayscale legal officer says Bitcoin ETF litigation could take two years,Grayscale argues that the differences between futures and spot Bitcoin ETFs have no correlation to approvals because prices are based on the same spot Bitcoin markets. (Read More...),46.14,60.0,0.014695525169372559,20.705000000000002,62.5,0.08462667465209961,2022-07-12
240,Crypto Daily,"Could These Tokens Help You End 2022 As A Millionaire? Gnox (GNOX), Evmos (EVMOS) And DeFiChain (DFI)","Crypto will make a litany of new millionaires in 2022; investors want to know whether they will be one of them and how they can join this list. This article features three crypto projects to help you achieve your dreams of financial independence. When selecting projects to invest in, remember to ... (Read More...)",70.095,50.0,88.51008117198944,89.225,60.60606060606061,95.7857757806778,2022-07-12
241,Crypto Daily,"Grab Your Ticket To Join The Wealthy Elite With Uniglo (GLO), Celo (CELO), And Waves (WAVES)","If you're trying to elevate your status to that of the wealthy elite, you need to know the best projects to invest in. While most of the market still focuses on the successes or failures of Bitcoin, there's loads more to crypto than that. And BTC isn't where the real money is going to be made in ... (Read More...)",78.595,75.0,99.66269433498383,90.36999999999999,76.66666666666666,4.748672246932983,2022-07-12
242,Blockworks,CoinFLEX Takes Legal Action to Recover $84M From Single Customer,"“It is clear to us now that he was wasting time and hoping for a bounce in the market that never materialized,” CoinFLEX’s co-founders said. The post CoinFLEX Takes Legal Action to Recover $84M From Single Customer appeared first on Blockworks. (Read More...)",56.400000000000006,53.80952380952381,1.102834939956665,74.695,58.98809523809524,0.0037729740142822266,2022-07-12
243,CryptoPotato,Crypto Markets Lost $50B in 2 Days as BTC Slumped Towards $20K (Market Watch),"The crypto markets have lost just over $50 billion in the past two days. This comes as bitcoin's recent drop towards $20,000. (Read More...)",34.089999999999996,50.0,0.009885430335998535,23.665000000000003,54.166666666666664,0.11774003505706787,2022-07-12
244,CoinGape,3AC Founders Flee Singapore Amid Bankruptcy,"Voyager founders Su Zhu and Kyle Davies fled Singapore and their current location is unknown, according to the company’s bankruptcy filing. (Read More...)",50.0,50.0,3.4449100494384766,50.0,56.666666666666664,0.9564489126205444,2022-07-12
245,CoinTelegraph,"Crypto needs regulation to mitigate risks, says Bank of England exec","Traditional markets have regulations to protect investors from unrecoverable losses, a Bank of England executive recently noted. (Read More...)",36.34,50.0,1.161155104637146,48.71,58.333333333333336,13.756448030471802,2022-07-12
246,Crypto Daily,Layer-1 Blockchains That Are Expanding The Horizons Of The DeFi Ecosystem,"The crypto market has already borne witness to the tremendous growth and subsequent slide of decentralized finance (DeFi) on second-generation blockchains, spearheaded by none other than Ethereum. To date, Ethereum dominates the DeFi landscape, thanks to its array of Solidity smart contracts. How... (Read More...)",50.0,50.0,99.97629523277283,90.63,59.35515873015873,99.95624125003815,2022-07-12
247,CoinGape,"Celsius Lowers Aave, Compound Debt Amid New Restructuring Plans","Beleaguered crypto lender Celsius continues its strategy to pay off outstanding Aave and Compound loans after it paid off its Maker loan last week. However, the company has now hired Kirkland &amp; Ellis LLP, the law firm Voyager Digital hired for its bankruptcy filing. This has spurred fresh FUD... (Read More...)",27.060000000000002,56.81818181818181,0.07548332214355469,85.48,59.166666666666664,5.155238509178162,2022-07-12
248,Forkast,South Korea’s SK Telecom to build its first Web3 wallet,"SK Telecom has partnered with blockchain firms AhnLab Blockchain Company and Atomrigs Labs to develop and operate a digital wallet for cryptocurrency management and Web3 access, the South Korean telecommunications giant announced on Monday. See related article: South Korea’s second-largest conglo... (Read More...)",50.0,62.5,99.6359646320343,50.0,56.25,20.601704716682434,2022-07-12
249,BeInCrypto,"Bitcoin (BTC) Reaches Weekly Close Above $20,000 But Trouble Could Still Be on the Horizon","Bitcoin (BTC) created a bullish candlestick during the week of July 4-11 but failed to engulf the preceding weekly bearish candlestick and created a long upper wick. The post Bitcoin (BTC) Reaches Weekly Close Above $20,000 But Trouble Could Still Be on the Horizon appeared first on BeInCrypto. (Read More...)",23.270000000000003,45.0,5.184578895568848,15.46,50.0,0.00023245811462402344,2022-07-12
