,source,title,excerpt,vader_sentiment_title,tb_sentiment_title,flair_sentiment_title,vader_sentiment_excerpt,tb_sentiment_excerpt,flair_sentiment_excerpt,date
249,Finbold,"NFT and blockchain-related trademarks filed in the US surpass 6,000 in 2022, 3x 2021 figure",Non-fungible tokens (NFTs) and blockchain technology are at the forefront of a trend that is seeing major parts of the... Continue reading (Read More...),50.0,50.0,1.4590173959732056,50.0,64.0625,99.087655544281,2022-10-06
250,crypto.news,Veteran Blockchain Network Syscoin Launches First Rollup Solution,"Syscoin’s Layer 2, Rollux OPv1, Enters Public Testnet. (Read More...)",65.91,56.25,99.87154304981232,50.0,62.5,3.3757150173187256,2022-10-06
251,Bitcoin Magazine,"EU Agrees On Text Of Landmark Bitcoin, Crypto Bill MiCA: Report","The EU also plans to discuss crypto regulation with the U.S. in a IMF-World Bank meeting, following diplomats’ agreement on the bill’s text. (Read More...)",63.660000000000004,50.0,84.94921326637268,74.695,62.5,3.2475292682647705,2022-10-06
252,Forkast,"CBDCs, tokens can integrate to existing payments systems, SWIFT claims","The Society for Worldwide Interbank Financial Telecommunication (SWIFT) said it had a breakthrough in enabling assets on distributed ledger technology networks, such as central bank digital currencies (CBDC) and tokens on the blockchain, to interact and flow with the existing financial infrastruc... (Read More...)",68.39999999999999,50.0,99.92198050022125,58.894999999999996,54.166666666666664,99.95787143707275,2022-10-06
253,Crypto Daily,"Elliptic: Over $4B Laundered Through DEXs, Swaps, And Bridges",Blockchain analytics and crypto compliance firm Elliptic has laid bare the extent to which decentralized exchanges and bridges are being used to launder funds. The new report published by the firm has stated that cyber criminals have laundered nearly $4 billion through the help of crypto tools su... (Read More...),50.0,50.0,0.06598532199859619,37.5,53.21969696969697,0.6088078022003174,2022-10-06
254,U.Today,"IOTA’s Shimmer Token Records 19,000% Rise in Market Value Shortly After Launch",Shimmer (SMR) has diluted market cap of $221 million (Read More...),67.0,50.0,99.58579242229462,50.0,75.0,0.04337728023529053,2022-10-06
255,Blockworks,Copper Chief Risk Officer Says ‘Cellular Explosion’ Will Accelerate Crypto Usage,TradFi veteran brings real-time payments background at Mastercard to crypto custody firm The post Copper Chief Risk Officer Says ‘Cellular Explosion’ Will Accelerate Crypto Usage appeared first on Blockworks. (Read More...),36.34,50.0,5.326560139656067,36.34,56.875,99.73940849304199,2022-10-06
256,ZyCrypto,Dogecoin Set For Gargantuan Gains As Elon Musk Moves To Proceed With $44B Twitter Purchase Agreement,"Memecoin Dogecoin experienced a marked bullish bump on Tuesday, bolstered by the announcement that Dogefather Elon Musk is reportedly still interested in buying Twitter on the deal’s original terms. (Read More...)",84.04,47.5,1.606208086013794,80.62,70.25,0.0019073486328125,2022-10-06
257,Decrypt,Terra's Do Kown Denies Reports That Authorities Froze $39.6M of His Crypto,"""I don't know whose funds they've frozen, but good for them,"" Terra co-founder Do Kwon wrote on Twitter. (Read More...)",28.925,50.0,0.13872981071472168,79.635,80.0,97.08451330661774,2022-10-06
258,Decrypt,Terra's Do Kwon Denies Reports That Authorities Froze $39.6M of His Crypto,"""I don't know whose funds they've frozen, but good for them,"" Terra co-founder Do Kwon wrote on Twitter. (Read More...)",28.925,50.0,0.3377467393875122,79.635,80.0,97.08451330661774,2022-10-06
259,Bitcoin Magazine,South Carolina State Treasurer Travels To El Salvador To Learn About Bitcoin Adoption,Curtis Loftis and other SC officials spent five days in El Salvador experiencing first-hand the country’s Bitcoin adoption. (Read More...),56.400000000000006,50.0,2.164381742477417,50.0,54.58333333333334,9.005427360534668,2022-10-06
260,U.Today,"Bullish: Institutional Investors' Entry Point Spotted, Analyst Sights Possible Upswing","Current price of Bitcoin is close to estimated entry price of Coinbase institutional clients, who some believe are market drivers, according to CryptoQuant CEO Ki Young Ju (Read More...)",50.0,50.0,1.5490025281906128,50.0,60.0,3.1183630228042603,2022-10-06
261,crypto.news,"Stake Casino Review » Gambling Games, Slots & Sports Betting","Stake.com is one of the most popular online casinos, offering a wide range of gambling games, slots and sports betting options. (Read More...)",50.0,50.0,98.45331907272339,73.77,68.75,98.16945195198059,2022-10-06
262,Trustnodes,Fidelity Buys $5 Million Ethereum,Fidelity adds to crypto buys with $5 million raised by just one client for their Ethereum Index Fund. (Read More...),50.0,50.0,88.97384405136108,50.0,75.0,91.4822667837143,2022-10-06
263,Finbold,Do Kwon responds to ‘falsehood’ reports of South Korea freezing his $40 million in crypto,"The saga of the Terraform Labs, the implosion of which has sent shockwaves across the cryptocurrency market, continues to draw... Continue reading (Read More...)",44.865,50.0,1.3871163129806519,50.0,75.0,99.96335804462433,2022-10-06
264,Finbold,EU agrees on text of the first-ever regulatory Bitcoin framework,The European Union has reached an agreement on the Markets in Crypto Assets Regulation (MiCA) framework that spells out how... Continue reading (Read More...),60.114999999999995,50.0,87.59056329727173,82.43,62.5,95.78031003475189,2022-10-06
265,crypto.news,Stake.com Review 2022: Expert & User Reviews / Ratings,Stake.com is a popular cryptocurrency gambling platform that offers a wide range of games and features. (Read More...),50.0,50.0,99.8154491186142,71.075,63.74999999999999,94.96172070503235,2022-10-06
266,Cryptomode,Talent Protocol supports the next generation of builders through the acquisition of Agora Labs,"Lisbon, Portugal, 5th October, 2022, Chainwire Talent Protocol, the web3 professional community for high-potential builders, has acquired Agora Labs, a social token and NFT infrastructure platform for creators to build and scale their communities. The acquisition will not only integrate Agora’s t... (Read More...)",82.43,50.0,97.77790606021881,71.075,57.91666666666666,99.24563467502594,2022-10-06
267,Cointelegraph,Mainstream NFT adoption will be driven mostly by their utility,"Hype may have been a factor in the rise of NFTs, but the actual utility will be the catalyst for the mainstream adoption of the technology. (Read More...)",50.0,75.0,97.07404375076294,50.0,62.5,75.76391696929932,2022-10-06
268,CryptoPotato,Korean Authorities Freeze $39 Million of Crypto Tied to Do Kwon,South Korean authorities continue freezing assets belonging to or tied to Terraform's Do Kwon. (Read More...),52.580000000000005,50.0,0.1637786626815796,53.86,75.0,0.029200315475463867,2022-10-06
269,NullTX,Top 5 Asset Management Tokens Below $1M Market Cap to Watch in October 2022,"Assets management is holding and piling up one’s funds over a long period, categorically including acquiring, saving, and investing. Assets Management Tokens have a growing total market capitalization of $781,538,977 and a current total trading volume of $39,553,613. Note: The tokens are ordered ... (Read More...)",75.53,75.0,86.909219622612,73.83500000000001,54.50000000000001,97.2064882516861,2022-10-06
270,Cryptomode,"ZoidPay to Launch 1st Shopping Pool Auction, offering Crypto Users a Chance to Own a Web 3.0 Digital Bank","Press Release: Crypto liquidity platform and Chrome extension Zoidpay is launching a Shopping Pool Auction that will enable users to have their very own Web 3.0 Digital Bank. 5th October 2022, Bucharest, Romania — ZoidPay has announced the auction of 50 Shopping Pools that the company will launch... (Read More...)",62.5,65.0,99.83502924442291,50.0,71.33333333333334,81.05048537254333,2022-10-06
271,AMBCrypto,NFTs associated with 3AC have been moved to new address- Details inside,"Blockchain analytics firm Nansen reported that more than 300 NFTs associated with the defunct crypto hedge fund Three Arrows Capital (3AC), have been moved into a new address. Starry Night Capital, the fund launched by 3AC founders to look after the digital art front of their business, transferre... (Read More...)",50.0,56.81818181818181,1.668614149093628,56.400000000000006,59.36363636363636,79.16088402271271,2022-10-06
272,The Block,Two Sigma Securities becomes a Chainlink network data provider,"Two Sigma Securities, a quantitative liquidity provider and market making firm, will become a data provider for Chainlink (Read More...)",64.8,50.0,97.36116826534271,64.8,57.49999999999999,98.29781949520111,2022-10-06
273,The Block,Venture firm Bessemer counts on a decentralized network for deal flow,Bessemer said in March it would commit $250 million to crypto. The firm has now set up a deal-sourcing DAO. (Read More...),50.0,40.0,99.66926276683807,64.8,57.49999999999999,0.004941225051879883,2022-10-06
274,Crypto Daily,Telegram Wallet Bot Now Allows P2P Crypto Exchange,"The Wallet bot on the social messaging app Telegram has launched a feature allowing users to exchange cryptocurrencies. Telegram Launches Crypto Exchange Bot Telegram users were already able to buy crypto without using a bank card, exchange it, and transfer it to other wallets via the Wallet bot ... (Read More...)",50.0,50.0,2.648809552192688,56.400000000000006,61.354166666666664,0.26759207248687744,2022-10-06
275,BeInCrypto,How Will WAN Price React Ahead of Wanchain Network Upgrade?,"Wanchain, a distributed ledger that allows for cross-chain transactions and interoperability of multiple chains, has come up with a new upgrade that may change the fate of its coin, WAN. The post How Will WAN Price React Ahead of Wanchain Network Upgrade? appeared first on BeInCrypto. (Read More...)",50.0,40.0,1.980215311050415,50.0,54.053030303030305,0.7974892854690552,2022-10-06
276,Crypto Briefing,EU Takes Step Toward Crypto Regulation as MiCA Passes,The laws are expected to come into force in early 2024 or later. EU Approves MiCA The European Union is getting ready to regulate the digital assets sector. Members of... (Read More...),50.0,50.0,11.296844482421875,85.48,55.00000000000001,99.1267055273056,2022-10-06
277,CryptoBriefing,EU Takes Step Toward Crypto Regulation as MiCA Passes,"The laws are expected to come into force in early 2024 or later. The European Union is getting ready to regulate the digital assets sector.Members of the European Council approved the text for the Markets in Crypto Assets Regulation (otherwise known as MiCA) framework early Wednesday, in a major ... (Read More...)",50.0,50.0,11.296844482421875,88.58500000000001,54.3125,92.75796413421631,2022-10-06
278,Cointelegraph,Bitcoin repeats key bear market move as $19K becomes key BTC price zone,"Investor cost basis is an important focus for ARK Invest, part of an ongoing ""tug-of-war"" in the 2022 Bitcoin bear market. (Read More...)",50.0,50.0,0.09760260581970215,60.114999999999995,72.5,99.46852326393127,2022-10-06
279,Cointelegraph,The world's cultural heritage is being preserved one NFT at a time,The Monuverse is taking some of the world’s most precious monuments and preserving them forever as NFTs in the digital universe. (Read More...),50.0,55.00000000000001,99.84628856182098,80.575,68.75,99.88934397697449,2022-10-06
280,Decrypt,SEC Cracks Down on Multimillion Crypto Ponzi Targeting Latino Investors,"Mauricio Chavez and Giorgio Benvenuto allegedly scooped $12 million through a crypto Ponzi, spending much of the money on a lavish lifestyle. (Read More...)",50.0,43.611111111111114,0.0042378902435302734,50.0,60.0,0.31054913997650146,2022-10-06
281,Crypto Daily,"XRP price could rally by 50%, Crypto Daily TV 05/10/2022","In Todays Headline TV CryptoDaily News: Mastercard launches new crypto fraud protection tool. The financial service provider Mastercard will launch a new crypto service related to risk management. Mastercard’s new service, Crypto Secure, is aimed to help banks find and prevent fraud on crypto mer... (Read More...)",50.0,50.0,0.0020742416381835938,16.475,59.350649350649356,76.24139189720154,2022-10-06
282,U.Today,"SHIB Burn Rate Spikes 1,017% Ahead of Official “Download Day” For SHIB Game on Oct 6","Burn rate of Shiba Inu soared as community is preparing for ""download day"" of Shiba Eternity game (Read More...)",50.0,30.0,0.025528669357299805,50.0,52.5,3.8376688957214355,2022-10-06
283,Bitcoin.com,"Bitcoin, Ethereum Technical Analysis: BTC Climbs to 2-Week High","Bitcoin continued to trade above $20,000 on Wednesday, as the token remained near a two-week high. Bullish momentum in cryptocurrency markets has been higher this week, with prices surging after a recent downward spell. Ethereum, on the other hand, was largely unchanged in today’s session. Bitcoi... (Read More...)",50.0,54.0,0.0025451183319091797,74.695,56.87053571428571,0.0007808208465576172,2022-10-06
284,Crypto Daily,"Daniel Leon, Co-Founder of Celsius, Resigns","Daniel Leon, the co-founder of the troubled cryptocurrency lender Celsius, has handed in his resignation merely a week after CEO and co-founder Alex Mashinsky stepped down from the firm according to reports from Bloomberg. Daniel Leon, the man who co-founded Celsius along with former CEO Alex Mas... (Read More...)",34.089999999999996,50.0,0.25268495082855225,18.154999999999998,42.87037037037037,0.1108318567276001,2022-10-06
285,Cryptonews,European Regulator Lists What is Needed for 'Responsible Crypto Sector',"More dialogue between the crypto industry and supervisors, consumer education, “rigorous compliance,” and even a “mind shift” for some crypto firms are necessary for creating a “responsible” crypto sector, said José Manuel Campa, chairperson of the European Banking Authority (EBA).... Read More: ... (Read More...)",65.91,55.00000000000001,21.15064561367035,68.06,64.16666666666666,97.057044506073,2022-10-06
286,Finbold,Almost 70% of Shiba Inu (SHIB) holders are in a loss despite solid 7-day performance,"Although Shiba Inu (SHIB) is among the largest losers of the recent slump in the crypto market, the token has... Continue reading (Read More...)",29.469999999999995,50.0,0.029289722442626953,23.665000000000003,55.00000000000001,99.5652824640274,2022-10-06
287,The Block,Coinbase intensifies push into derivative trading with new exec hire from Goldman,Coinbase has hired Usman Naeem as its new head of global derivative sales and agency trading in London. (Read More...),50.0,56.81818181818181,99.77433383464813,50.0,60.60606060606061,83.4309995174408,2022-10-06
288,U.Today,"LUNC, LUNA Prices Drop Following Freeze of Over $40 Million Worth of Terra’s Do Kwon Assets",LUNC and LUNA prices are presently in red (Read More...),58.894999999999996,57.49999999999999,0.11331439018249512,50.0,62.5,0.028577446937561035,2022-10-06
289,The Block,Flashbots product lead addresses concerns over Tornado Cash censorship,The Flashbots product lead says the project open-sourcing more of its infrastructure and knowledge base to foster greater competition. (Read More...),50.0,50.0,18.901321291923523,68.06,58.75,93.45903992652893,2022-10-06
290,Feed - Cryptopotato.Com,Celsius Co-Founder Steps Down Mere Days After CEO Tenders Resignation,Celsius Network Co-Founder Daniel Leon will step down. He has reportedly announced his departure in an internal memo. (Read More...),42.345,33.611111111111114,0.06647109985351562,50.0,55.74074074074073,0.01933276653289795,2022-10-06
291,Crypto Daily,“Assassin’s Creed” Game Director Sheds Light on Blockchain Gaming,"The gaming world is filled with a myriad of pioneering figures who helped shape the industry into what it is today. These are people who are willing to push the boundaries of gaming whilst also understanding and satisfying their audience along the process. One of these figures is Marc Albinet, a ... (Read More...)",50.0,50.0,98.65085482597351,72.94,70.625,99.94587302207947,2022-10-06
292,CryptoSlate,"GMX DEX spikes 35% as Binance, FTX announce listing",The native token of decentralized exchange GMX (GMX) has spiked 35% to $54.11 after two leading crypto exchanges announced they would be listing it on October 5. (Read More...),50.0,50.0,0.06549656391143799,50.0,75.0,0.01582503318786621,2022-10-06
293,Cointelegraph,What is Bitcoin hash rate and why does it matter?,Cryptocurrency’s hash rate measures a blockchain network’s processing power to process transactions. (Read More...),51.29,50.0,0.06776154041290283,50.0,75.0,98.77492487430573,2022-10-06
294,Cryptonews,Billionaire Mike Novogratz Believes Bitcoin Price Will Surge if Fed Makes This Decision,"Mike Novogratz forecasts a bullish takeoff for Bitcoin (BTC) once the US Federal Reserve eases down on its aggressive rate hikes aimed at taming inflation. The current cycle has especially been tough for the firstborn crypto, as it suffers from both an unfavourable outlook, and the effects of gro... (Read More...)",50.0,50.0,1.045122742652893,25.490000000000002,44.62962962962963,0.007855892181396484,2022-10-06
295,AMBCrypto,Shiba Inu investors expecting a metaverse takeover should read this,"The Shiba Inu [SHIB] team working on its metaverse released a new update despite some downturn in its ecosystem. In the blog post published on 4 October, SHIB revealed the Canyon art concept to its community. While the development may have excited a part of its community, some investors may not f... (Read More...)",50.0,50.0,0.5720734596252441,67.0,66.85606060606061,3.94001305103302,2022-10-06
296,BeInCrypto,SWIFT Trial Demonstrates How Global CBDC Network Could Become Reality,Plans to create a global central bank digital currency (CBDC) network are on the horizon following eight months of testing by SWIFT. The post SWIFT Trial Demonstrates How Global CBDC Network Could Become Reality appeared first on BeInCrypto. (Read More...),68.39999999999999,50.0,99.96047616004944,86.62,55.35714285714286,17.974016070365906,2022-10-06
297,crypto.news,"Celsius Co-Founder and Chief Strategist Daniel Leon, Is Resigning ","S. Daniel Leon, co-founder and chief strategy officer of the cryptocurrency lender Celsius Network, quit on Tuesday, based on sources with knowledge of the situation and an internal memo obtained by CNBC. After the now-retired CEO Alex Mashinsky, he is… (Read More...)",38.685,50.0,0.11438727378845215,50.0,62.5,0.17673969268798828,2022-10-06
298,The Block,"The European Council passes MiCA, EU’s comprehensive crypto regulation","If approved, laws will be in place at the start of 2024 at the earliest. (Read More...)",62.5,50.0,13.418823480606079,71.075,75.0,92.6875352859497,2022-10-06
299,U.Today,Ripple Grows Into Second Largest Arab Economy via UK Based 3s Money Club,Persian Gulf remains key region for cross-border payments industry (Read More...),50.0,50.0,97.02732264995575,50.0,62.5,99.48858916759491,2022-10-06
300,crypto.news,"Coinbase Expands Operations to Australia, Focusing On Institutional Investors","The US-based crypto exchange firm, Coinbase has expanded its services to Australia. The company plans to grow a local entity in the area and provide various services for retail investors while focusing on institutional investors in the long term. Coinbase… (Read More...)",55.135,50.0,94.22853291034698,50.0,52.5,94.3299263715744,2022-10-06
301,The Daily Hodl,"Vitalik Buterin Reveals Ethereum’s (ETH) End Game, Names Several Big Visions for Future","Ethereum (ETH) creator Vitalik Buterin is laying out what he hopes the end goals are for the second-largest crypto by market cap. In a new interview with the Bankless podcast, Buterin says Ethereum is guided by values rather than ultra-specific ultimate goals. “Ethereum’s ethos from the beginning... (Read More...)",61.315,45.0,99.81759786605835,83.525,60.60606060606061,89.4806444644928,2022-10-06
302,Crypto Briefing,What Crypto Winter? GMX Soars 34% on Binance Listing,"GMX went live on Binance earlier today. GMX Jumps Amid Binance Hype One of crypto winters outperformers is benefiting from the Binance listing effect. Per CoinGecko data, GMX has jumped... (Read More...)",50.0,50.0,2.08054780960083,50.0,60.60606060606061,4.963439702987671,2022-10-06
303,CryptoBriefing,What Crypto Winter? GMX Soars 34% on Binance Listing,"GMX went live on Binance earlier today. One of crypto winters outperformers is benefiting from the Binance listing effect.Per CoinGecko data, GMX has jumped to $54.20 in Wednesday trading, up 34.2% on the day. It briefly topped $60, falling a whisker short of its $62.10 all-time high recorded at ... (Read More...)",50.0,50.0,2.08054780960083,42.345,56.63636363636364,0.14264285564422607,2022-10-06
304,The Block,Acala restores full operations after users ‘error minted’ 3 billion aUSD,"Polkadot’s DeFi-focused parachain Acala has reopened its services to users, three weeks after a major security incident. (Read More...)",64.8,67.5,82.99637734889984,67.0,64.0625,0.4575669765472412,2022-10-06
305,U.Today,"Bitcoin Whales Smart Tactics Revealed, Here Is How They Act Right Now","Bitcoin whales making big moves again with 46,137 BTC purchased in past few days (Read More...)",70.095,62.5,98.54349493980408,50.0,50.625,78.72256636619568,2022-10-06
306,Bitcoin.com,Binance and Kazakhstan to Share Information About Crypto-Related Crime,Cryptocurrency exchange Binance has agreed to support Kazakhstan in ensuring the safe development of the country’s crypto market. The trading platform and Kazakhstan’s financial regulators intend to inform each other about cases involving the use of digital assets for illicit purposes. Binance Ex... (Read More...),34.089999999999996,50.0,23.751088976860046,92.955,58.75,97.2341001033783,2022-10-06
307,The Block,Fidelity and Citadel-backed exchange EDX Markets taps Paxos for custody,"Charles Schwab, Citadel Securities, Fidelity Digital joint venture EDX Markets chooses Paxos as its custodian. (Read More...)",50.0,50.0,80.26105761528015,64.8,62.5,94.93349492549896,2022-10-06
308,Chain Debrief,Ex-MOE Teacher Takes The Unconventional Route Into Web3; Now Leads Investment Team At Spartan Labs,"Key Takeaways X-To-Earn models might be the next new thing, but it needs to have the right value add and business use case. Tokenomics is important, but it should not be the only thing you premise your judgement upon. Information is always out there, a good investor has to craft her own thesis be... (Read More...)",50.0,50.0,83.5092842578888,92.31,64.56709956709956,99.3981659412384,2022-10-06
309,Bitcoinist,Long Live Bitcoin: BTC Hashrate Records New All-Time Highs,"Bitcoin lost almost 71% of its all-time high price of $69,044 hit in November last year, and trading at $20,100 as of this writing, according to data from CoinGecko. Here’s a quick glance at Bitcoin’s hashrate: BTC hashrate’s new all-time high is 158 exahash per second Hashrate this year is not e... (Read More...)",50.0,53.71212121212121,99.92147386074066,34.089999999999996,59.21212121212122,0.002688169479370117,2022-10-06
310,Finbold,Italy grants regulatory approval to over 70 crypto firms without proper checks,"Despite multiple governments and regulators taking an exceptionally careful and even skeptical approach to the cryptocurrency sector, earning them criticism... Continue reading (Read More...)",80.62,50.0,2.740997076034546,44.775,48.75,21.850451827049255,2022-10-06
311,crypto.news,Crypto․Com Adds Google Pay and Apple Pay Support for Visa Card Users in Canada,"In a tweet released earlier today, Crypto.com has announced that it is adding Google Pay and Apple Pay support for Visa card users in Canada. The Journey to Cryptocurrency Acceptance When the crypto industry first came into the limelight, it… (Read More...)",61.315,50.0,83.29851627349854,79.97000000000001,62.5,4.693970084190369,2022-10-06
312,U.Today,"Here's What Cardano's ""Superpower"" Is, Developer Explains",Developer believes eUTxO model is what's going to make Cardano more attractive to users (Read More...),50.0,50.0,99.90139901638031,74.635,80.0,4.949986934661865,2022-10-06
313,Chain Debrief,NEAR Protocol Announces Partnership With Google To Accelerate Web3.0 Startups,"Key Takeaways: Near Protocol announces partnership with Google Cloud and Near Protocol Google Cloud will assist with infrastructure development for developers NEAR has seen a 4x in developer count recently, according to one report In an announcement today (4th October), the NEAR Foundation announ... (Read More...)",50.0,55.00000000000001,99.5402455329895,50.0,56.42857142857143,93.91877949237823,2022-10-06
314,Bitcoinist,OVER Announces 7th Edition of Creator’s Contest – An Innovation to Drive More Creativity in The Metaverse,"Since the term “metaverse” became popular on the Internet, there has been an ongoing debate about what it means and how it differs from what we already experience. The metaverse is a virtual environment where people can communicate using various technologies. To accomplish this, hardware and soft... (Read More...)",83.485,75.0,76.38828158378601,84.04,65.0,99.57858920097351,2022-10-06
315,U.Today,Is Shiba Inu Finally Ready for Take-off?,Memecoin Shiba Inu (SHIB) rallies 1.65% on back of ecosystem announcement that has turned market sentiment bullish (Read More...),68.06,60.0,89.05392587184906,50.0,62.5,0.01679062843322754,2022-10-06
316,Forkast,Temperatures rise over alleged Celsius withdrawals ahead of bankruptcy,Top blockchain and crypto news: Celsius founder in hot water. European bank woes cast crypto shadow. Will BSN's Chinese roots thwart its global ambitions? (Read More...),50.0,45.0,0.7372885942459106,36.34,60.416666666666664,82.67549872398376,2022-10-06
