,source,title,excerpt,vader_sentiment_title,tb_sentiment_title,flair_sentiment_title,vader_sentiment_excerpt,tb_sentiment_excerpt,flair_sentiment_excerpt,date
198,The Daily Hodl,"Ethereum and Other Risk Assets Setting Up for Trend Reversals, Says Macro Guru Raoul Pal – But There’s a Catch","Macro expert and former Goldman Sachs executive Raoul Pal says Ethereum (ETH) and the rest of the crypto markets could witness wild price swings in the coming weeks. Pal says his DeMark technical indicator, which aims to detect the directional trend of an asset by comparing the most recent maximu... (Read More...)",47.42,43.75,86.40930652618408,68.06,59.166666666666664,13.257864117622375,2022-10-12
199,CoinTelegraph,Crypto Stories: How an entrepreneur raised $10M for her startup during a bear market,Josipa Majic explains what she and her partners did to build a crypto company at a time when investors were fleeing the space. (Read More...),50.0,50.0,22.09056317806244,50.0,75.0,91.82887673377991,2022-10-12
200,The Block,Senior U.S. banking regulator sounds stablecoin concerns,"A senior U.S. banking regulator raised concerns that stablecoins could be seen as a term of “disguise” and that the technology looks much like banking, but without the same rules as the traditional banking sector. “They want to borrow ideas out of bank deposits and this idea that you’ve got somet... (Read More...)",50.0,50.0,95.26492059230804,64.8,58.75,0.6857007741928101,2022-10-12
201,Decrypt,"BNY Mellon Launches Bitcoin, Ethereum Custody Services for Investment Firms",The BNY Mellon crypto custody service means the bank will store clients' private keys and provide bookkeeping on their BTC and ETH. (Read More...),50.0,50.0,96.8412846326828,50.0,62.5,99.07907843589783,2022-10-12
202,The Block,Coinbase shares fluctuate at the open before trading down following Google partnership,"Shares in the crypto exchange see-sawed during early morning trading on Tuesday, following a partnership announcement with Google. (Read More...)",64.8,47.40740740740741,0.2519190311431885,64.8,60.0,0.0037848949432373047,2022-10-12
203,Trustnodes,Bitcoin’s Hashrate Spikes to a New All Time High,"Bitcoin's hashrate has spiked to a new all time high, as has its difficulty, in one of the biggest jump. (Read More...)",50.0,57.40909090909091,20.516884326934814,32.99999999999999,63.272727272727266,85.55541038513184,2022-10-12
204,Finbold,Cardano founder hits back at ‘XRP trolls’ attacking him for views on SEC v. Ripple,Upon receiving numerous attacks after suggesting that the United States Securities and Exchange (SEC) was after Ripple and the XRP... Continue reading (Read More...),27.060000000000002,47.5,0.13429224491119385,63.660000000000004,56.666666666666664,0.24523138999938965,2022-10-12
205,Bitcoin Magazine,BNY Mellon Now Offers Bitcoin Custody Services: Report,"The world’s largest custodian bank can now receive and store customers’ bitcoin and cryptocurrency, following a regulatory approval in New York. (Read More...)",50.0,55.00000000000001,98.04871380329132,73.83500000000001,60.60606060606061,98.69004487991333,2022-10-12
206,Cointelegraph,"Vyper, Solidity and Scrypto: How the smart contract languages compare",A look at three different programming languages for blockchain networks and how they compare. (Read More...),70.095,60.71428571428571,99.96248781681061,50.0,62.5,89.11702930927277,2022-10-12
207,Crypto Daily,"Best NFT investment? The Sandbox (SAND), Starlink (STARL), and The Hideaways (HDWY)","We are nearing an era that's driven by augmented and virtual reality. One of the preparations investors make to ride the upcoming tide is piling on NFT projects with high potential to become Metaverse superstars. Let’s compare The Sandbox (SAND), Starlink (STARL), and The Hideaways (HDWY). All of... (Read More...)",81.845,100.0,99.60970878601074,50.0,61.0,23.722529411315918,2022-10-12
208,BeInCrypto,"Breaking: Bitcoin (BTC) Price Dips Below $19,000, Increasing the Risk of a Sell-Off","Bitcoin (BTC) price appears to be losing the $19,000 support level. On-chain data shows that this downswing could encourage investors to exit their long positions, triggering a sell-off. The post Breaking: Bitcoin (BTC) Price Dips Below $19,000, Increasing the Risk of a Sell-Off appeared first on... (Read More...)",36.34,50.0,0.007915496826171875,65.91,61.66666666666667,0.0027000904083251953,2022-10-12
209,CoinGape,Damien Hirst To Set Fire On Millions of Worth Of NFTs,(Read More...),43.6,65.0,9.809806942939758,50.0,75.0,96.50535881519318,2022-10-12
210,NullTX,Top 5 Binance Launchpool Tokens Below $30M Market Cap to Watch in October 2022,You’ve likely heard of both Binance Launchpad and Binance Launchpool. Both platforms aim to assist the cryptocurrency ecosystem by giving all Binance users early access to promising crypto tokens that returns a significant profit. Comprehensive details on both platforms are found here. Binance La... (Read More...),60.114999999999995,75.0,98.87270629405975,93.445,61.75000000000001,98.65347146987915,2022-10-12
211,Bitcoin.com,Quik․com Releases Update for Its NFT Domains – Web3 Domains Are Now Minting,"The much-anticipated major update to Quik.com has now been made available to users, bringing them brand-new capabilities like the edit feature and the Quik API, along with more that are scheduled for the upcoming weeks and months. Quik.com is a P2P NFT domain marketplace offering NFT top-level do... (Read More...)",50.0,50.0,19.430720806121826,68.06,68.28125,99.75739419460297,2022-10-12
212,Crypto Daily,Is The Hideaways the Next Bitcoin? STEPN (GMT) and World of Farms (WOF) Losing Out,Analysts give a warning to investors eyeing to put a big amount on play-to-earn cryptocurrencies. Tokens like STEPN (GMT) and World of Farms (WOF) can decline big points the more players use their platforms. Crypto investors looking for the next Bitcoin have found a project called The Hideaways. ... (Read More...),30.910000000000004,50.0,16.70958399772644,51.29,60.0,0.04840493202209473,2022-10-12
213,BeInCrypto,CNN Pulls the Plug – Or Should That Be Rug? – On Its NFT Marketplace,CNN has announced it will be shutting down the NFT marketplace it launched last summer leading to accusations of a rug pull. The post CNN Pulls the Plug – Or Should That Be Rug? – On Its NFT Marketplace appeared first on BeInCrypto. (Read More...),50.0,50.0,86.39916479587555,39.885,57.43055555555555,0.0016927719116210938,2022-10-12
214,crypto.news,Ripple Partners With Lemonway To Bring ODL To Sweden And France ,Ripple has partnered with new entities to bring ODL to France and Sweden. This will allow for fast cross-border payment. (Read More...),50.0,50.0,99.7531920671463,61.315,63.93939393939394,98.75964820384979,2022-10-12
215,Cryptonews,Russian Government to Hold Key Crypto Regulation-themed Meeting Today,Russian ministers have tabled a meeting on the thorny matter of crypto regulation today – as the government attempts to finalize its much-delayed attempts to police the sector.... Read More: Russian Government to Hold Key Crypto Regulation-themed Meeting Today (Read More...),50.0,50.0,99.9108225107193,37.5,60.0,12.253126502037048,2022-10-12
216,Chain Debrief,"4000 $ETH Burned in 2 Days, All Thanks To This One Obscure Cryptocurrency","Key Takeaways: Over $1.8 million was spent on interacting with a smart contract This translates to more than 3,700 $ETH in fees burnt With $ETH’s transition to Proof-of-Stake, the “deflationary” narrative could be back again ___________________________________________ Thanks to the merge, the ann... (Read More...)",72.02,60.0,0.0011146068572998047,84.04,59.38775510204082,0.20014643669128418,2022-10-12
217,U.Today,Here’s Why LUNC Dropped to an Intraday Low as USTC Rose: Details,Market experienced another sell-off on October 11 (Read More...),36.34,65.0,0.05302727222442627,50.0,82.5,0.054001808166503906,2022-10-12
218,CoinGape,Just-In: Cardano Founder Charles Hoskinson Cuts Ties With The XRP Community,"Cardano founder Charles Hoskinson cuts ties with the XRP community due to continued criticism from the XRP army after his “conspiracy” comments during a recent online interview. Hoskinson said he has been trolled and harassed by some XRP followers for many days. Meanwhile, XRP influencer XRPcrypt... (Read More...)",35.199999999999996,50.0,8.948761224746704,8.875,60.9375,0.04132688045501709,2022-10-12
219,Cointelegraph,Gitex Global 2022 discusses how to educate mainstream media on crypto,Cointelegraph’s editor-in-chief Kristina Cornèr participated in a panel that discussed the topic of cryptocurrency and the media. (Read More...),50.0,50.0,96.84154689311981,50.0,75.0,24.792703986167908,2022-10-12
220,The Block,Google now showing Ethereum wallet balances,Google is now providing data on Ethereum addresses when searched for. The data is being collected from block explorer Etherscan. (Read More...),50.0,50.0,0.07058084011077881,27.98,75.0,0.8701056241989136,2022-10-12
221,Crypto Daily,"Justin Sun, SBF Deny Involvement In Huobi Global Sale","Both founders have had to deny their involvement in the Huobi Global Sale for the second time as new reports emerged on Wu Blockchain. Wu Blockchain Reports On Huobi Global Sale On Monday, crypto media outlet Wu Blockchain reported that both founders had purchased a majority stake in Huobi Global... (Read More...)",32.99999999999999,50.0,0.04749000072479248,32.99999999999999,55.3030303030303,0.3548353910446167,2022-10-12
222,Finbold,Cardano dips below May’s lows presenting opportunities for ‘interesting longs’,"Cardano’s (ADA) price suggests that there are not enough willing buyers, which has led it to drop below important support... Continue reading (Read More...)",60.114999999999995,75.0,97.62362837791443,46.14,64.375,0.03587901592254639,2022-10-12
223,U.Today,Here’s How Billions of SHIB Can Be Burned Daily: Innovative Burner,This prominent SHIB burner has idea how Shib community could deploy potential to burn billions of SHIB on weekly and daily basis (Read More...),72.02,62.5,99.89688396453857,65.91,62.5,98.85830283164978,2022-10-12
224,Trustnodes,China Starts Easing,China's central bank has injected some liquidity in the banking system following a contraction in the services sector. (Read More...),62.5,50.0,0.1398622989654541,50.0,58.333333333333336,1.5597730875015259,2022-10-12
225,Cryptomode,"SupraOracles Goes Live on Ethereum, Polygon, Aptos and Four Other L1 Blockchain Testnets","Zug, Switzerland, 11th October, 2022, Chainwire Have a blockchain dApp ready to integrate the most state-of-the-art Oracle? Sign up for Supra’s Network Activation Program (SNAP) for the opportunity to receive free oracle and VRF/RNG credits before the list is full. Continuing to unveil their grow... (Read More...)",50.0,50.28409090909091,87.7699762582779,93.895,69.5,85.48150360584259,2022-10-12
226,Protos.com,These six-figure NFTs are down 99%,"Despite previously fetching hundreds of millions of dollars, many NFT collections are now finding it difficult to attract any serious bids. (Read More...)",50.0,42.22222222222222,0.010535120964050293,46.14,50.0,0.06812512874603271,2022-10-12
227,Crypto Daily,"SupraOracles Goes Live on Ethereum, Polygon, Aptos and Four Other L1 Blockchain Testnets","Zug, Switzerland, 11th October, 2022, ChainwireHave a blockchain dApp ready to integrate the most state-of-the-art Oracle? Sign up for Supra’s Network Activation Program (SNAP) for the opportunity to receive free oracle and VRF/RNG credits before the list is full. Continuing to unveil their growi... (Read More...)",50.0,50.28409090909091,87.7699762582779,93.895,69.5,17.3850417137146,2022-10-12
228,Bitcoinist,Darling Crypto: Shiba Inu Reclaims Top Spot As ETH Whales’ Favorite,"Shiba Inu is making all the right kinds of noise these days. It is becoming the darling of the whales. Even though the project’s game, Shiba Eternity, was released 5 days ago, SHIB has been falling behind. The value of Shiba Inu was reported to have fallen thanks to the game, and its practical ap... (Read More...)",91.125,75.0,99.9761164188385,85.92,51.683673469387756,0.04037916660308838,2022-10-12
229,Bitcoin.com,"Polygon Launches zkEVM Testnet — Defi Projects Uniswap, Lens, Aave Join Testing","The blockchain project Polygon has announced the launch of the zkEVM public testnet, a layer two (L2) scaling solution announced in July that aims to reduce fees and inherit the security of the Ethereum blockchain. Polygon considers the testnet “the first open-source zkEVM network,” and developer... (Read More...)",64.8,50.0,94.10455226898193,78.595,62.5,98.90892803668976,2022-10-12
230,U.Today,BTC and XRP Price Analysis for October 11,Which altcoins can remain more powerful than Bitcoin (BTC)? (Read More...),50.0,50.0,2.94705331325531,73.77,71.66666666666667,1.9612282514572144,2022-10-12
231,Finbold,"Veteran investor warns ‘we are in the end game of fiat money’, says Bitcoin will take the stage","Lawrence Lepard, the founder of investment management firm Equity Management Associates, has suggested that following the Federal Reserve’s (Fed) recent... Continue reading (Read More...)",44.865,40.0,0.5065977573394775,50.0,53.75,6.365886330604553,2022-10-12
232,Bitcoin Magazine,"Google To Accept Bitcoin, Crypto For Cloud Services In Coinbase Partnership",Google will start accepting bitcoin and cryptocurrency payments for its cloud services in a partnership with U.S. exchange Coinbase. (Read More...),69.08999999999999,50.0,98.22211861610413,69.08999999999999,75.0,9.280645847320557,2022-10-12
233,Decrypt,"Google Cloud to Let Users Pay With Bitcoin, Ethereum, Dogecoin via Coinbase","Google will let a ""handful"" of customers pay for its cloud services using cryptocurrencies like Bitcoin and Ethereum via Coinbase Commerce. (Read More...)",44.865,50.0,4.575243592262268,63.660000000000004,75.0,0.013437867164611816,2022-10-12
234,Cryptonews,Portugal Makes U-Turn On Crypto-Friendly Taxes,"Though widely considered to be one of the most crypto-friendly countries, Portugal is increasingly shifting its position on taxing cryptoasset gains – and now plans to tax gains on crypto held for less than a year.... Read More: Portugal Makes U-Turn On Crypto-Friendly Taxes (Read More...)",50.0,50.0,0.05161166191101074,79.295,62.33333333333333,0.03974735736846924,2022-10-12
235,CryptoBriefing,BNY Mellon Will Hold Bitcoin and Ethereum for Clients. Here’s Why It Matters,"BNY Mellon has taken several steps to embrace digital assets this year. Americas oldest bank just got the green light to start receiving crypto on behalf of customers, The Wall Street Journal has reported.According to a Tuesday report, BNY Mellon will start receiving certain clients Bitcoin and E... (Read More...)",51.29,50.0,98.67842495441437,81.245,57.61904761904761,97.49826192855835,2022-10-12
236,Crypto Briefing,BNY Mellon Will Hold Bitcoin and Ethereum for Clients. Here’s Why It Matters,BNY Mellon has taken several steps to embrace digital assets this year. BNY Mellon Offering Crypto Custody Americas oldest bank just got the green light to start receiving crypto on... (Read More...),51.29,50.0,98.67842495441437,72.94,56.99999999999999,87.66699731349945,2022-10-12
237,U.Today,Shiba Inu Price Drop Makes This Whale Buy Another 70 Billion SHIB,Shiba Inu price drop makes this investor spend hundreds of thousands on SHIB (Read More...),36.34,50.0,4.481321573257446,36.34,75.0,0.2656519412994385,2022-10-12
238,CoinGape,Russia Labels Meta (Facebook) As A Terrorist Organization,"Russia’s war with the west has escalated to a new level. The Rosfinmonitoring or Federal Financial Monitoring Service has labeled the social media company Meta as a terrorist and extremist organization. Meta, previously known as Facebook, has been added to a list of organizations involved in terr... (Read More...)",15.46,50.0,0.018471479415893555,6.874999999999998,55.03030303030303,0.5471736192703247,2022-10-12
239,Feed - Cryptopotato.Com,BNY Mellon Is Now the First US Bank to Provide Crypto Custody,"Thus, America's oldest bank has become the first one to interact with the crypto industry in such a manner. (Read More...)",50.0,62.5,98.77488315105438,50.0,62.5,89.07342255115509,2022-10-12
240,Decrypt,Enormous Multi-Sig Transaction Briefly Crashes Bitcoin’s Lightning Network,"A validation bug caused by a complex multi-sig transaction temporarily crashed LND, a popular implementation of Bitcoin’s Lightning Network. (Read More...)",50.0,50.0,0.45762062072753906,71.075,63.33333333333333,0.0046193599700927734,2022-10-12
241,Blockworks,Coinbase Stock Pops On Google Deal to Accept Crypto for Cloud,Coinbase and Google have partnered to allow some Web3 customers to pay for cloud services in crypto — and markets are into it The post Coinbase Stock Pops On Google Deal to Accept Crypto for Cloud appeared first on Blockworks. (Read More...),69.08999999999999,50.0,0.1459866762161255,73.83500000000001,68.75,5.395209789276123,2022-10-12
242,U.Today,Cardano Investor Loses ADA Worth More Than $25 Million to Celsius Freeze,Information appears to have been made public under standard bankruptcy practice (Read More...),47.42,58.333333333333336,0.006854534149169922,50.0,58.333333333333336,3.4634947776794434,2022-10-12
243,Bitcoin.com,"Bitcoin, Ethereum Technical Analysis: ETH Falls to 9-Day Low Below $1,300","Ethereum fell to a nine-day low during Tuesday’s session, as the U.S. dollar rose to a two-week high. The decline comes ahead of this week’s U.S. inflation report, which is expected to show consumer prices falling by 0.2% month-on-month. Bitcoin was also in the red during today’s session, moving ... (Read More...)",36.34,50.0,0.0027418136596679688,29.905000000000005,59.66666666666667,0.00047087669372558594,2022-10-12
244,Cointelegraph,Polkadot: How parachains are changing a blockchain-centric ecosystem,Parity chief marketing officer Peter Ruchatz discusses the ins and outs of Polkadot’s focus on interoperability at Token2049. (Read More...),50.0,50.0,97.84386157989502,50.0,75.0,3.8621336221694946,2022-10-12
245,NullTX,Top 5 Avalanche Ecosystem Tokens Below $20M Market Cap to Keep on Your Radar in Q4 2022,Avalanche’s open-source technology boasts nearly instantaneous transaction finality. It was developed for the scale of global banking and is described in the Avalanche Documentation as ideal for establishing decentralized applications and business blockchain installations. With top players in the... (Read More...),60.114999999999995,75.0,94.29327547550201,81.845,67.5,99.97601509094238,2022-10-12
246,Crypto Daily,Why Moshnake Could Be Your Best Crypto to Buy Today Alongside Ethereum and Ellipsis,"Moshnake (MSH), Ethereum (ETH), and Ellipsis (EPS) are some of the best cryptocurrencies with the potential to help their holders survive the current crypto winter. This article discusses what makes these cryptos worth holding and why they could be your best buy-ins, considering the condition of ... (Read More...)",81.845,100.0,99.99626278877258,95.93,73.33333333333333,99.93643462657928,2022-10-12
247,Crypto Daily,Portugal Introduces a 28% Crypto Tax in Its 2023 Budget,"The Portuguese government released its budget for 2023 on Monday and included a 28% income tax on cryptocurrencies. Portugal has long been considered a cryptocurrency tax haven, but the country has now moved forward to change this, and this attempt will be the first time such a tax regime is pass... (Read More...)",50.0,50.0,0.2436518669128418,50.0,58.75,0.00903308391571045,2022-10-12
248,Cryptonews,OECD Presents Crypto Tax Reporting Framework,"The Organisation for Economic Co-operation and Development (OECD), an intergovernmental organization that seeks to stimulate economic progress, has published a global framework for crypto tax reporting. According to a press release, the framework, dubbed the Crypto-Asset Reporting Framework (CARF... (Read More...)",50.0,50.0,21.936172246932983,78.595,61.25000000000001,5.346429347991943,2022-10-12
249,Crypto Daily,Big Eyes Coin: The Next Crypto To Explode Like Polkadot & Axie Infinity,"Animal-themed crypto projects are becoming widespread in the meme coin market. Most of those projects are famous dog-themed tokens: Dogecoin (DOGE), Dogelons (ELON), Floki Inu (FLOKI), Shiba Inu (SHIB), and so on. For a change, Big Eyes Coin (BIG) intends to build its unique crypto project around... (Read More...)",68.06,50.0,9.637284278869629,50.0,66.60714285714286,98.4871506690979,2022-10-12
250,crypto.news,"Celsius Investors Lost Millions of Dollars, Records Show","Celsius investors lost millions of dollars according to a new report. Jacob Benjamin Fite topped the list, losing $40 million. (Read More...)",34.089999999999996,50.0,0.0034689903259277344,20.029999999999998,65.9090909090909,0.004708766937255859,2022-10-12
251,BeInCrypto,"ARK Crypto Fund Sinks to New Lows; Get the Fed on the Phone, Says Cathie Wood","Before the Fed's next policy decision, Ark Invest's Catherine Wood said the bank was making a policy mistake that would result in deflation. The post ARK Crypto Fund Sinks to New Lows; Get the Fed on the Phone, Says Cathie Wood appeared first on BeInCrypto. (Read More...)",39.885,50.90909090909091,0.0038504600524902344,25.305,57.86363636363636,0.0019073486328125,2022-10-12
252,Crypto Daily,"Coinbase Gets Singapore License, Crypto Daily TV 11/10/2022","In Todays Headline TV CryptoDaily News: After Ethereum Merge, GPU prices may stabilize. After the conclusion of the Ethereum upgrade, the value of numerous sought-after GPUs has dropped quite drastically. For example, reports indicate that the value of Nvidia’s highly popular RTX 3080 has dipped ... (Read More...)",50.0,50.0,86.16483807563782,89.205,68.33333333333333,0.0035703182220458984,2022-10-12
253,Ethereum World News,USTC ‘Stablecoin’ Soared 40% Post a Terra Classic Repeg Proposal,"TerraClassic USD (USTC) has soared by nearly 40%. The coin is valued at $0.059 at the time of publishing, but still far from its $1 peg. The fully diluted market cap of USTC is at $561 million, with a 24-hour trading volume of $355 million. A possible reason behind the surge in price could be a p... (Read More...)",50.0,58.333333333333336,94.38011050224304,61.91,53.0,4.697972536087036,2022-10-12
254,The Block,Google and Coinbase partner on plan to offer crypto payments for cloud services,Google will work with Coinbase to allow certain customers payment for cloud services from early 2023. (Read More...),50.0,50.0,97.3986804485321,72.94,63.57142857142857,2.824684977531433,2022-10-12
255,Forkast,Top Ethereum gas guzzler XEN Crypto is crunching ETH supply,"Ethereum’s supply growth entered a deflationary state on Saturday, a first for the blockchain since The Merge upgrade that shifted the network to a proof-of-stake consensus mechanism in September. See related article: Scalability is Ethereum’s post-Merge focus: Vitalik Buterin Fast facts Ether’s ... (Read More...)",60.114999999999995,75.0,99.97844398021698,69.08999999999999,61.875,0.016003847122192383,2022-10-12
256,NewsBTC,XRP Takes The Lead Among Altcoins – Will It Drop Before Climbing?,"XRP has maintained a daily calmness but emerged as the week’s top performer. The token took to the north with 18% weekly gains as the price crossed the $0.5 mark before falling. Also, other altcoins have been making slight losses daily in the past week. The crypto market is witnessing a drastic t... (Read More...)",36.34,50.0,0.4187047481536865,58.894999999999996,53.273809523809526,5.607473850250244,2022-10-12
257,FX Street,Ripple builds new partnerships in France and Sweden despite crypto bear market,"Cryptocurrency payments company Ripple Labs has formed new partnerships in France and Sweden, continuing its march into Europe despite the current win (Read More...)",50.0,56.81818181818181,99.53278005123138,26.415,67.95454545454545,78.78824770450592,2022-10-12
258,FX Street,"JUST IN: Crypto giant Coinbase licensed to operate in Singapore, major move for COIN",Coinbase hit a key milestone obtaining a license from the central bank of Singapore for operating as a digital asset provider. In late 2021 the world’ (Read More...),50.0,51.5625,99.83700215816498,68.06,52.0,97.4877268075943,2022-10-12
259,Crypto Daily,Orbs Focuses on The Open Network with Call For Grant Proposals,"Orbs, the first execution Layer-3 solution inside the crypto arena, has opened up its grant program for teams and developers to work on TON-based apps. TON, a fully decentralized layer-1 blockchain, which was designed by the team behind Telegram and now community-led, focuses on onboarding billio... (Read More...)",68.06,50.0,98.07634651660919,79.295,55.833333333333336,99.86720383167267,2022-10-12
260,BeInCrypto,Terra LUNA Boss Faces Deportation as South Korea Moves To Invalidate Passport,"The passport of Terraform Labs CEO Do Kwon will expire on Oct. 19, meaning he will become an illegal alien wherever he is currently living. The post Terra LUNA Boss Faces Deportation as South Korea Moves To Invalidate Passport appeared first on BeInCrypto. (Read More...)",50.0,50.0,0.01666545867919922,22.13,50.0,0.001245737075805664,2022-10-12
261,Crypto Daily,Central bankers want stablecoin regulation similar to banking,"The Financial Stability Board (FSB) has just published two reports that contain recommendations for frameworks to comprehensively govern crypto-assets, and stablecoins. The Financial Stability Board is composed of central bankers who are putting the word out that the crypto sector can reach the p... (Read More...)",53.86,50.0,13.281232118606567,51.29,56.25,2.153828740119934,2022-10-12
