,source,title,excerpt,vader_sentiment_title,tb_sentiment_title,flair_sentiment_title,vader_sentiment_excerpt,tb_sentiment_excerpt,flair_sentiment_excerpt,date
122,CoinGape,Ethereum Merge Update: ETH Testnet Kiln To Be Shutdown During Merge Week,"Ethereum Foundation on Friday announced the shutdown of the Ethereum Merge testnet Kiln during the week of September 12. Moreover, Ropsten and Rinkeby testnets will also deprecate and shut down after the Merge in Q4 2022 and Q3 2023, respectively. As per Ethereum co-founder Vitalik Buterin, the M... (Read More...)",50.0,50.0,0.03063678741455078,67.0,55.74074074074073,0.0044286251068115234,2022-09-11
123,Cointelegraph,MicroStrategy to reinvest $500M stock sales into Bitcoin: SEC filing,"Buying the dip is essential for MicroStrategy as the company’s reserve of nearly 129,699 BTC currently suffers an aggregated value loss of over $1 billion. (Read More...)",50.0,45.0,0.4944413900375366,27.060000000000002,50.0,0.8418232202529907,2022-09-11
124,Feed - Cryptopotato.Com,Bitcoin Rallies into the Weekend as MicroStrategy May Raise $500M to Buy BTC,"Even without Michael Saylor as CEO, MicroStrategy seems determined to continue purchasing BTC. (Read More...)",50.0,50.0,0.752606987953186,67.0,75.0,5.147901177406311,2022-09-11
125,AMBCrypto,AXS and RON lurk in red shadows despite seizing 10% of Ronin hack funds,"Blockchain data platform, Chainalysis, in a new report confirmed the seizure of $30 million worth of cryptocurrency stolen by North Korean Lazarus group. Of the $622 million in crypto lost due to the Ronin Bridge and Axie Infinity hack in March, the seized assets represent approximately 10% of th... (Read More...)",39.885,50.0,2.01910138130188,27.98,56.76136363636364,0.592312216758728,2022-09-11
126,The Daily Hodl,Cardano Creator Charles Hoskinson Warns That the White House’s New Crypto Proposals Pose Grave Threat to Bitcoin,Cardano (ADA) creator Charles Hoskinson is warning that new recommendations by the US government do not bode well for Bitcoin (BTC) and other crypto assets. Taking issue with the recommendations of a new White House Office of Science and Technology Policy report that calls for the involvement of ... (Read More...),12.469999999999997,53.40909090909091,0.045800209045410156,31.795,56.477272727272734,0.020453333854675293,2022-09-11
127,crypto.news,Redefining the Value of Currency: An analysis of METAVERSE PRO Mechanism,METAVERSE PRO Mechanism is redefining the value of currency. (Read More...),67.0,50.0,98.00783097743988,67.0,75.0,4.585713148117065,2022-09-11
128,Bitcoin.com,Russia’s Sberbank to Allow Users to Issue NFTs on Its Blockchain Platform,"Recognizing existing demand for non-fungible tokens, or NFTs, one of the largest banks in Russia, Sberbank, now intends to allow users to issue them on its blockchain platform. The financial institution also plans to cooperate with art sites and galleries across the country. Sberbank to Give Clie... (Read More...)",61.315,50.0,89.93900418281555,55.135,62.5,93.12734603881836,2022-09-11
129,CoinTelegraph,Ethereum ready for The Merge as last shadow fork completes successfully,The successful completion of the last shadow fork signaled the readiness of the Ethereum network for migrating to a proof-of-stake consensus mechanism. (Read More...),84.53999999999999,65.83333333333333,99.65511560440063,85.015,70.83333333333334,99.27379190921783,2022-09-11
130,CoinGape,Bitcoin Price Turns Bullish As MicroStrategy Files With The SEC To Buy More BTC,"Bitcoin (BTC) price gained momentum yesterday as it skyrocketed over 10% to break above the $21,000 level. The Bitcoin BTC price jumped from $19,310 to $21,575. Now, MicroStrategy’s filing with the SEC to sell $500 million in MSTR stocks to buy more Bitcoin has spurred bullish sentiment in the ma... (Read More...)",50.0,60.0,0.015175342559814453,69.08999999999999,61.25000000000001,0.006735324859619141,2022-09-11
131,Cryptonews,Developer Activity on Bitcoin and Ethereum Plummeted in 2022,"Blockchain developers have slowed down their contributions to top crypto projects amid the lingering market downturn, with Bitcoin and Ethereum experiencing a decline of over 30% in developer activity over the past three months. ... Read More: Developer Activity on Bitcoin and Ethereum Plummeted ... (Read More...)",50.0,50.0,0.004595518112182617,60.114999999999995,60.94444444444444,0.0021278858184814453,2022-09-11
132,CoinGape,Wedge Pattern Breakout Sets Apecoin For A 10% jump,"The Apecoin price cushioned at the $4.17 level and showed a recovery signal with a three-day rally. Thus, the bull run breached the immediate resistance of the falling wedge pattern and the $4.85 mark. Today, we are going through a retest phase to validate whether the breakout is genuine. Key poi... (Read More...)",50.0,50.0,10.635924339294434,61.315,65.0,0.007319450378417969,2022-09-11
133,CryptoGlobe,Top Crypto Analyst Points to ‘Good Opportunities’ in DeFi Tokens $AAVE and $COMP,"A popular cryptocurrency analyst has highlighted potential trading opportunities for the native tokens of two decentralized finance (DeFi) projects, Aave and Compound, as both of these have managed to hold their positions throughout the bear market. According to the pseudonymous cryptocurrency an... (Read More...)",60.114999999999995,80.0,99.96675550937653,82.985,68.33333333333333,96.55309617519379,2022-09-11
134,Bitcoinist,What Do We Know About Crypto Exchange FTX And Skybridge’s Recent Deal,"Crypto exchange FTX’s venture arm has planned on buying a 30% stake in Skybridge Capital. Skybridge Capital is a hedge fund which was founded by Anthony Scaramucci. The amount for which the deal was closed has not been disclosed as of yet. As per reports, SkyBridge will be utilising $40 million f... (Read More...)",50.0,50.0,90.10476171970367,50.0,60.0,0.3049790859222412,2022-09-11
135,Bitcoin.com,Indian Finance Minister Urges IMF to Lead in Regulating Crypto — Georgieva Says IMF Ready to Work With India,"India’s finance minister, Nirmala Sitharaman, has urged the International Monetary Fund (IMF) to take “a lead role” in regulating crypto assets. IMF Managing Director Kristalina Georgieva says the global organization stands ready to work with India on climate change, crypto regulation, and other ... (Read More...)",68.06,60.0,1.4142870903015137,74.695,55.75,82.53345489501953,2022-09-11
136,The Daily Hodl,Gensler’s Move Towards CFTV Regulation Is Welcome Sign but Industry Deserves Long-Term Vision,"Yesterday, at an industry conference, the Securities and Exchange Commission chairman Gary Gensler said that he looked forward to working with legislators on Capitol Hill to move ahead with plans to give the Commodity Futures Trading Commission additional oversight powers over cryptocurrencies. G... (Read More...)",77.115,90.0,99.06525313854218,64.8,75.0,3.1127244234085083,2022-09-11
137,AMBCrypto,Bitcoin: Can miners survive this double-edged combat?,"Bitcoin [BTC] miners have been faced with harsh realities lately. The worst part is that it doesn’t seem to get any easier as these difficulties look too strong to handle. According to CryptoQuant, BTC miners have faced the hurdle of not selling their holdings for crumbs. However, the dwindling s... (Read More...)",32.99999999999999,50.0,0.008255243301391602,26.165,44.333333333333336,0.0053882598876953125,2022-09-11
138,Bitcoin Magazine,Bitcoin's Accumulated Momentum Is Going To Be Hard To Stop,"While ""the smartest people in the room"" scan the horizon, bitcoiners are out there actually building the future they want to live in. (Read More...)",30.910000000000004,35.416666666666664,77.75234878063202,82.43,57.95454545454546,76.6753613948822,2022-09-11
139,CryptoGlobe,"$SHIB Is Most Googled Altcoin in Europe, $ADA Was Most Googled Crypto in 3 EU Countries, Says Report","A newly released study has shown that the meme-inspired cryptocurrency Shiba Inu ($SHIB) and smart contract platform Cardano ($ADA) are among the most ‘Googled’ cryptocurrencies throughout Europe, surpassing competitors with larger market capitalization. While the top five cryptocurrencies by mar... (Read More...)",50.0,75.0,11.587327718734741,77.115,65.42207792207793,99.25140738487244,2022-09-11
140,Decrypt,MicroStrategy Is Considering Buying Even More Bitcoin,The firm filed with the SEC to sell up to $500 million in Class A stock. Guess what it may want to spend the proceeds on. (Read More...),50.0,75.0,77.54136621952057,53.86,53.333333333333336,0.2937138080596924,2022-09-11
141,Bitcoin.com,Canadian Crypto Exchange Sues Users for Return of Bitcoin Misappropriated During Software Glitch,"Canadian crypto exchange Coinberry, part of Kevin O’Leary’s Wonderfi, has sued 50 customers for the return of the bitcoin they obtained without paying during a software glitch. “Coinberry contacted all of the said 546 affected registered users by email and demanded the return of the misappropriat... (Read More...)",50.0,50.0,0.24108290672302246,31.94,75.0,0.02765357494354248,2022-09-11
142,The Block,Bolt backs off $1.5 billion Wyre deal: Axios,Bolt backs off its $1.5 billion deal to buy Wyre. (Read More...),47.42,50.0,0.39190948009490967,47.42,75.0,0.03466010093688965,2022-09-11
