,source,title,excerpt,vader_sentiment_title,tb_sentiment_title,flair_sentiment_title,vader_sentiment_excerpt,tb_sentiment_excerpt,flair_sentiment_excerpt,date
135,AMBCrypto,Litecoin’s ‘daily active addresses surge’ has these tips for intraday traders,"Litecoin’s [LTC] hashrate clinched an all-time high of 531.4427 TH/s on 22 September as per data from CoinWarz. In the last 30 days, data from Santiment also showed that LTC ranked third on the list of cryptocurrency assets with the most daily active addresses. With 269,540 daily active addresses... (Read More...)",70.095,46.66666667,99.1677314,88.44,54.96296296,1.185244322,05-10-22
136,The Block,Price of crypto token promoted by Kim Kardashian spiked 126% after SEC charge unveiled,"While not a substantial price jump, the spike shows some amount of interest in the token following the star's SEC charge. (Read More...)",71.075,45,0.022995472,67.085,56.66666667,0.244560838,05-10-22
137,Crypto Briefing,Daily Briefing: Blood in the Streets,"Amid rumors of a Credit Suisse default and further disruptions to geopolitical stability, a modest shift in sentiment seems to be unfolding in the crypto market. Unfazed This week, rumors... (Read More...)",50,50,2.192178369,52.58,60,0.773397088,05-10-22
138,CoinTelegraph,Coinbase CEO announces documentary on cryptocurrency and exchange,"Armstrong said that the documentary will capture “the good, bad, and ugly” of building a tech start-up from the ground up. (Read More...)",50,50,90.34377933,42.345,48,99.97875392,05-10-22
139,CryptoBriefing,Why Is Bitcoin Surging Against the Odds?,"Bitcoin has posted surprising gains today. Stocks are also performing well for the second day in a row. Despite a worrying macro landscape, Bitcoin, stocks, and other equities are enjoying gains on the week thus far.The moves are surprising considering recent hawkishness from the Federal Reserve,... (Read More...)",50,50,1.035127044,96.325,66.25,99.78898764,05-10-22
140,Crypto Briefing,Why Is Bitcoin Surging Against the Odds?,"Bitcoin has posted surprising gains today. Stocks are also performing well for the second day in a row. Ironic Markets Despite a worrying macro landscape, Bitcoin, stocks, and other equities... (Read More...)",50,50,1.035127044,86.495,62.75,99.80914891,05-10-22
141,NullTX,"Bitcoin Surpassed $20K, Ethereum Rises Above $1,350, Kim Kardashian Is Fined by the SEC for Endorsing a Cryptocurrency Security","After holding support throughout the weekend, Bitcoin and Ethereum are displaying positive momentum today. Bitcoin is trading above the $20k mark, and Ethereum has surpassed $1,350. At $961 billion, the market capitalization of all cryptocurrencies is inching toward the $1 trillion level. As long... (Read More...)",67,47.5,0.095400214,87.15,58.46590909,99.33734536,05-10-22
142,Decrypt,"Coinbase 'Very Supportive' of Giving CFTC Exclusive Jurisdiction Over Bitcoin, Ethereum",Coinbase Head of U.S. Policy Kara Calvert says the exchange is supportive of two bills in Congress that would allow the CFTC to take the reins on crypto regulation. (Read More...),84.325,82.5,96.03119493,73.835,75,92.25263298,05-10-22
143,CryptoBriefing,Another Celsius Exec Is Out as Auction Looms,"Celsius executive S. Daniel Leon has resigned as the bankrupt company prepares to auction off its assets. Another Celsius executive is leaving the company.According to a report from CNBC, Celsius Network co-founder S. Daniel Leon has stepped down from his role as the firm's strategy chief. His re... (Read More...)",42.345,50,0.263506174,20.03,52.40740741,0.025218725,05-10-22
144,Crypto Briefing,Another Celsius Exec Is Out as Auction Looms,Celsius executive S. Daniel Leon has resigned as the bankrupt company prepares to auction off its assets. Strategy Chief Leaves Celsius Another Celsius executive is leaving the company. According to... (Read More...),42.345,50,0.263506174,20.03,75,0.062102079,05-10-22
145,The Block,"Bitcoin mining stock report: Tuesday, October 4","Here's how crypto mining companies performed on Tuesday, Oct. 3. (Read More...)",50,50,0.009217858,50,75,0.032666326,05-10-22
146,Decrypt,Fidelity Reveals $5 Million Ethereum Index Fund,"Unlike Exchange Traded Funds (ETFs), Index Funds only trade after hours at fixed prices. (Read More...)",50,50,82.42577016,50,60,96.13292813,05-10-22
147,The Daily Hodl,Crypto Analyst Says Bitcoin About to Squeeze Higher for Green October As BTC Shows Strength Against Stocks,"A popular crypto analyst is predicting an unexpected breakout for Bitcoin as BTC and equities markets start to show strength. Pseudonymous analyst Kaleo tells his 535,000 Twitter followers that Bitcoin is inches away from breaking through a nearly year-long diagonal resistance line. According to ... (Read More...)",74.695,51.25,0.158545375,85.92,66.25,0.374683738,05-10-22
148,Cointelegraph,M31 Capital launches $100M Web3 investment fund with $50M in commitments so far,"The investment fund, which was founded by an early Bitcoin investor, said the current market cycle is the first time in a decade where prices and fundamentals have diverged so wildly. (Read More...)",56.4,55,22.58437276,50,59.5,1.577547193,05-10-22
149,Blockworks,Cardano Price Plunges to 2017 Levels Following Crypto’s 5th Birthday,"The veteran top-10 crypto has been chugging along since 2017, but with little adoption to show for it The post Cardano Price Plunges to 2017 Levels Following Crypto’s 5th Birthday appeared first on Blockworks. (Read More...)",50,50,0.029075146,50,55.625,0.083521008,05-10-22
150,Bitcoin.com,"Pro-Russian Groups Raised $400,000 in Crypto Since Ukraine Invasion, Report Reveals","Groups supporting Russia’s war effort in Ukraine have been actively collecting cryptocurrency to fund paramilitary operations and evade sanctions, researchers say. According to a new report, these organizations use Telegram to raise money then used to pay for equipment and training. Paramilitary ... (Read More...)",50,50,0.5666852,48.71,59.41287879,0.208672881,05-10-22
151,AMBCrypto,This Tether update may finally bear some good results in the weeks to come,"Tether, the firm behind USDT, the largest stablecoin made some key changes to its asset reserves. On 3 October, Chief Technology Officer (CTO) Paolo Ardoino informed the Tether community about the changes to its portfolio. #tether portfolio update. Tether as of 30 September 2022 holds ~58.1% of i... (Read More...)",72.02,67.5,99.10052121,68.06,48.75,89.17948604,05-10-22
152,The Block,Musk renews bid for Twitter as he looks to avoid trial,A letter filled with the U.S. Securities and Exchange Commission shows Elon Musk still wants to buy Twitter. (Read More...),35.2,50,0.014069676,64.8,68.33333333,0.034284592,05-10-22
153,U.Today,"XRP May Make Everyone Cry, This Trader Says",The XRP price might be on the cusp of another significant rally after soaring in September (Read More...),26.165,50,1.779577136,60.115,71.875,11.43738329,05-10-22
154,CoinGape,Can This Bullish Pattern Assist Polygon Coin To Reach $1?,"The Polygon coin chart shows the formation of the Flag pattern in the daily time frame chart. In theory, the ongoing correction is responsible for stabilizing the aggressive buying from the previous rally. Furthermore, a bullish breakout from the pattern’s resistance trendline triggers this conti... (Read More...)",51.29,50,0.700166821,58.895,56.66666667,0.149059296,05-10-22
155,Blockworks,"MasterCard Is Tracking Where, and How, Cardholders Buy Crypto","Mastercard is using data from CipherTrace to allow card issuers to assess risk profiles of over 2,400 virtual asset service providers The post MasterCard Is Tracking Where, and How, Cardholders Buy Crypto appeared first on Blockworks. (Read More...)",50,50,6.570988894,65.91,68.75,96.82938755,05-10-22
156,Blockworks,Nexo Co-founder: There Is Such Thing as Too Much Transparency,Nexo leaders took to YouTube Tuesday to debunk the myths going around about the lender The post Nexo Co-founder: There Is Such Thing as Too Much Transparency appeared first on Blockworks. (Read More...),50,55,0.015312433,50,61.875,0.023299456,05-10-22
157,NewsBTC,"Ren Protocol Breaks Out, Is This Be A Relief Bounce?",REN price could be ready to break out from the downtrend as price gears up for a short-term recovery creating more bullish sentiment. REN looks strong on both low and high timeframes. The price of REN breaks out on the daily timeframe after forming an descending triangle. Ren Protocol (REN) has r... (Read More...),73.835,50,0.105208158,85.48,62.80952381,0.057369471,05-10-22
158,The Daily Hodl,"Mark Cuban Says He’s ‘Really Bullish’ on Crypto, Compares Industry Evolution to Early Days of Internet","Billionaire Shark Tank investor Mark Cuban says he’s still bullish on crypto despite the ongoing bear market. In a new interview with Forbes, Cuban compares the crypto sector to the early days of streaming in the 1990s, when the now-common technology was hard to use and ignored by mainstream cons... (Read More...)",50,57.5,15.50621986,29.905,55.55871212,0.438955426,05-10-22
159,Crypto Daily,EU regulator writes report on crypto risk for financial stability,The European Securities and Markets Authority has just published a report on the perceived risks to financial stability posed by crypto. The European Securities and Markets Authority (ESMA) is the European regulatory agency that oversees the securities market. In its report on crypto it analyses ... (Read More...),36.34,50,84.61650908,81.245,55,5.801218748,05-10-22
160,The Daily Hodl,U.S. Treasury Watchdog Suggests Crypto Activities Could Threaten Financial Stability,"The Treasury Department’s Financial Stability Oversight Council (FSOC) is weighing in on crypto assets and their potential to affect the traditional financial structure of the US. The council, which was formed by the Dodd-Frank Act to help identify financial stability risks in the United States, ... (Read More...)",39.885,50,0.253039598,85.48,54.16666667,16.70874953,05-10-22
161,ZyCrypto,Extreme Bullish Wave For Bitcoin On The Horizon As BTC Accumulation Level Hits 7-Year High,Bitcoin (BTC) accumulation is seeing a massive surge as it rises to levels last seen in 2015. (Read More...),50,50.875,0.62301755,50,58.33333333,20.52894831,05-10-22
162,CoinGape,"Elon Musk Twitter Takeover Finally A Done Deal With SEC Filing, What Next?","The Elon Musk Twitter Takeover could finally come to an end soon with the latest SEC filing over the purchase. Musk’s team mentioned that it intends to proceed to closing of the transaction contemplated by the merger agreement for Twitter. In a latest development, Twitter representatives expresse... (Read More...)",50,48.33333333,6.263181567,74.695,64,0.097134709,05-10-22
163,CoinGape,Just-In: European Parliament Votes For Crypto Tax System,"The European Parliament has voted in favour of a more coordinated and fair taxation system for cryptocurrencies, and to utilize blockchain technology in facilitating a more robust approach towards mitigating instances of tax evasion. Over 80% Members of the European Parliament vote in favor of re... (Read More...)",50,50,16.09161198,93.535,68.33333333,96.63262069,05-10-22
164,Blockworks,"You Can Now Buy Your Big Mac With Crypto in Lugano, Switzerland","Plan ₿ wants to scale bitcoin and stablecoin adoption in the city The post You Can Now Buy Your Big Mac With Crypto in Lugano, Switzerland appeared first on Blockworks. (Read More...)",50,50,96.35911584,50,61.875,87.42432594,05-10-22
165,BeInCrypto,"Say Goodbye to Your Stolen Cryptos, They May Never Be Found","According to crypto forensics firm Elliptic, investigators are ill-equipped to deal with the evolving cross-chain movement of illicit crypto. The post Say Goodbye to Your Stolen Cryptos, They May Never Be Found appeared first on BeInCrypto. (Read More...)",25.305,50,3.240084648,25.305,59.16666667,0.002872944,05-10-22
166,CryptoPotato,Michael Saylor Fights Back Against Peter Schiff’s Accusations of Pumping Bitcoin,"Peter Schiff, known for his anti-Bitcoin stance, said that the SEC should have targeted Michael Saylor instead of Kim Kardashian. (Read More...)",19.38,50,8.810526133,50,60,0.043949485,05-10-22
167,Cointelegraph,"CFTC can issue summons through Ooki DAO's help chat box, says judge",A federal judge said the court’s decision was based on the CFTC effectively serving the Ooki DAO by providing the necessary documents in its Sept. 22 lawsuit. (Read More...),70.095,50,23.20657969,62.5,68.33333333,95.03110647,05-10-22
168,Blockworks,"SushiSwap ‘Head Chef’ Election Settled by GoldenTree, Cumberland","Blockworks exclusive: TradFi’s GoldenTree Asset Management and longtime crypto firm Cumberland overwhelmingly carried the vote for DeFi protocol SushiSwap’s next chief executive The post SushiSwap ‘Head Chef’ Election Settled by GoldenTree, Cumberland appeared first on Blockworks. (Read More...)",50,50,10.66037416,68.06,60.5,97.48709202,05-10-22
169,Blockworks,Leaked EU Docs Warn Members to Clamp Down on Crypto Mixers,Blockworks Exclusive: A final draft of incoming EU regulation reveals bloc regulators are increasingly concerned about crypto privacy (Read More...),29.905,42.22222222,0.042414665,56.4,62.5,94.61179674,05-10-22
170,CoinGape,Dogecoin Price Is Set For A Sharp Rally If It Breaks This Barrier,"Like many major cryptocurrencies facing high volatility during the last few weeks, the Dogecoin price has resonated between $0.655 and $0.566 for nearly five weeks. This narrow range accentuates uncertainty in coin holders but reveals a well-known technical setup to take a trade. Key points: The ... (Read More...)",43.6,43.75,2.051857114,50.645,54.6125,19.42566037,05-10-22
171,Cryptonews,Cardano Price Prediction – Is ADA Preparing for a 100% Move?,"Given the current state of the cryptocurrency market, Cardano price prediction is bullish above a triple bottom level of $0.4180. On the daily timeframe, Cardano has closed a strong green candle, indicating a strong possibility of a bullish reversal. However, a hybrid of mixed fundamentals is lim... (Read More...)",50,50,0.152483582,88.25,55.92592593,0.013807416,05-10-22
172,NewsBTC,What Does Puell Multiple Say About Current Bitcoin Bear?,"Puell multiple is an indicator that has historically given hints about previous Bitcoin cycles, here’s what it says about the current bear market. Bitcoin Puell Multiple Has Been Going Up During The Last Couple Of Months According to the latest weekly report from Glassnode, miners are currently r... (Read More...)",50,50,17.54676104,50,54.62962963,0.230300426,05-10-22
173,Bitcoinist,Bitcoin Miner Selling Eased By 50% Over Past Month,"Data shows Bitcoin miners have eased up their dumping over the past month, now selling only at a 50% rate compared to in early September. Bitcoin Miner Net Position Change Now Has A Value Of 4.4k BTC Per Month As per the latest weekly report from Glassnode, the BTC miners were selling at a rate […] (Read More...)",64.8,37.5,0.042152405,65.91,57.08333333,0.008606911,05-10-22
174,AMBCrypto,Can MakerDAO’s latest development drive MKR towards its next bull rally,MKR holders that aped in towards the end of September are pleased with their decision considering the healthy run-up in the last two weeks. The Maker DAO native token earned its way into the list of top gainers after a 43% upside from its September lows. MKR’s current upside was aided by Maker DA... (Read More...),50,62.5,99.7310102,84.04,66.66666667,99.53818619,05-10-22
175,The Daily Hodl,Hedge Fund CEO Anthony Scaramucci Predicts Decoupling of Crypto From Stocks – Here’s When,"Skybridge Capital founder Anthony Scaramucci says stocks and cryptos like Bitcoin (BTC), Solana (SOL) and Avalanche (AVAX) are bound to decouple from stocks on the back of one critical catalyst. In a new interview with CNBC, the former White House Director of Communications says that the Federal ... (Read More...)",50,50,0.789001584,52.58,55.3030303,5.871027708,05-10-22
176,The Block,"Fidelity reveals Ethereum index fund with $5,000,000 in sales in new filing","Fidelity filed its Ethereum Index Fund targeting ETH with the U.S. Securities and Exchange Commission, and reported over $5,000,000 in sales. (Read More...)",50,56.81818182,92.51109064,64.8,75,89.35915828,05-10-22
177,Crypto Daily,McDonalds and Other Businesses in Lugano to Accept Bitcoin,"Mcdonald's and other businesses have started accepting Bitcoin and Tether as payment methods in the Swiss town of Lugano. Following a decision from the mayor of Lugano to make Bitcoin and Tether “de facto legal” tender in the city, residents can now pay with these two cryptocurrencies at both bra... (Read More...)",69.09,43.75,0.620985031,64.8,57.1875,97.41295278,05-10-22
178,U.Today,SEC Slams Ripple-Friendly Firms for Attempting to Help Defendants,"The SEC wants to prevent I-Remit and TapJets from filing their amicus briefs, arguing that the outcome of the lawsuit will not prevent them from using the XRP token (Read More...)",70.095,45,9.055021405,21.405,60,0.012847781,05-10-22
179,The Daily Hodl,"Celsius Founder Alex Mashinsky Withdrew $10,000,000 Worth of Crypto Prior to Bankruptcy Filing: Report",A Financial Times report claims Celsius Network founder Alex Mashinsky withdrew millions of dollars in digital assets from the platform weeks before the bankrupt crypto lender froze customer accounts as its position worsened. The report says Mashinsky withdrew $10 million worth of digital assets ... (Read More...),61.315,57.5,0.105172396,25.305,58,0.031921268,05-10-22
180,The Daily Hodl,"Andreessen Horowitz Leads $40,000,000 Capital Raise for New Decentralized Data Protocol","Andreessen Horowitz (a16z) is leading a $40 million series B funding round into Golden, a decentralized protocol that aims to aggregate information on billions of topics. In a statement, Golden says Solana (SOL) co-founder Raj Gokal, Protocol Labs, OpenSea Ventures and Farcaster founder Dan Romer... (Read More...)",50,56.81818182,99.05461967,50,61.25,22.76955247,05-10-22
181,Bitcoinist,"Bitcoin Beats September Stock Market Performance, Return Of Digital Gold?","Ever since losing around 80% of its value from its all-time high, Bitcoin has been questioned as a store of value and a digital equal to gold. The digital currency still records the best performance for any asset across the last decade, but critics are fast to point out past year’s losses. Relate... (Read More...)",50,50,1.346391439,30.91,58.94444444,1.282000542,05-10-22
182,AMBCrypto,"Institutions are hesitant about investing in Bitcoin, cryptos – Here’s why","The latest insights into digital asset investment products (DAIP) and their weekly numbers highlight a troubling trend. Needless to say, such a trend is bound to come to the attention of investors too. The report, published by CoinShares, found that last week marked the third consecutive one with... (Read More...)",37.5,50,0.896766782,55.135,53.75,0.742074847,05-10-22
183,Bitcoin.com,"Bankrupt Crypto Lender Celsius’ Asset Sale Is Scheduled, Sources Say FTX CEO May Bid","According to a filing published by the U.S. Bankruptcy Court for the Southern District of New York, the crypto lending firm Celsius has been given a final bid deadline of October 17, 2022. Following the bankruptcy court’s final bid deadline, a sale hearing is scheduled for November 1. A report pu... (Read More...)",36.34,50,0.06750524,50,53.11688312,0.098273158,05-10-22
184,Cointelegraph,Basel Committee: Banks worldwide reportedly own €9.4 billion in crypto assets,The study found that banks mostly held volatile cryptocurrencies and had little exposure to stablecoins. (Read More...),58.895,80,18.38846505,50,63.54166667,0.027772784,05-10-22
185,Bitcoin Magazine,The First Africa Bitcoin Conference Begins On December 5th,"The event will be hosted in Ghana and is expected to have over 800 attendees including bitcoiners, industry and thought leaders, and will host a hackathon. (Read More...)",50,62.5,91.22664332,50,60,24.03354049,05-10-22
186,Decrypt,"Ubisoft, Take-Two Back Ethereum NFT Game Maker Horizon in $40M Round",Skyweaver game developer Horizon just raised a Series A round with a pair of Web3-friendly video game giants onboard. (Read More...),50,40,91.26233459,50,43.75,13.81931007,05-10-22
187,Cointelegraph,Bitcoin miner profitability under threat as hash rate hits new all-time high,"Analysts say Bitcoin miners’ worst days are probably behind them, but the network's soaring hash rate and the uptick in difficulty are weighing on profit margins. (Read More...)",34.09,57.40909091,10.93931794,39.885,35,1.778018475,05-10-22
188,Cryptonews,XRP Price Prediction as Bullish Breakout Gains Momentum,"XRP price prediction for Tuesday remains bullish above $0.4700 as the coin has already crossed and closed above the 50-day moving average. After falling for three consecutive sessions, the week began positively, and the XRP/USD pair started to recover their losses from the previous week. ... Read... (Read More...)",67,50,94.75594759,51.29,52.21861472,0.006663799,05-10-22
189,NullTX,"Buy Oryen (ORY), Cosmos Hub (ATOM) And Cronos (CRO) To See Massive Profits By 2023","Cryptocurrency investors are not having the best year. With inflation and other macroeconomic factors, the crypto market has been bearish. However, investors can start profiting again in 2023. The solution? Invest in crypto projects that are projected to see massive profits next year. These proje... (Read More...)",72.02,50,12.64554262,76.59,63.75,0.038665533,05-10-22
190,The Block,"Block, stock and barrel: crypto-stocks surge as markets tick higher",Crypto-related stocks benefited from the bump in equities as markets perked up following a sluggish Q3. (Read More...),27.98,62.5,81.72211349,29.905,62.5,93.90645921,05-10-22
191,Bitcoin Magazine,"McDonald’s And Other Businesses Now Accept Bitcoin Payments In Lugano, Switzerland","In partnership with Go Crypto, Plan ₿ Foundation is enabling bitcoin payments for the city of Lugano, Switzerland, including McDonald’s. (Read More...)",69.09,43.75,85.93713939,50,75,98.28201532,05-10-22
192,BeInCrypto,Elon Musk to Proceed With Twitter Buyout – Does That Mean 0.1 DOGE per Tweet?,"Tesla CEO Elon Musk reportedly proposes buying Twitter for $54.20 per share, sending Dogecoin (DOGE) price soaring 10%. The post Elon Musk to Proceed With Twitter Buyout – Does That Mean 0.1 DOGE per Tweet? appeared first on BeInCrypto. (Read More...)",50,34.375,0.072729588,64.8,57.29166667,0.004905462,05-10-22
193,CryptoSlate,DOGE up 8% as Elon Musk makes new acquisition offer for Twitter,Trading has halted on Twitter as Elon Musk has reportedly reissued his original offer of $54.20 per share to buy the company. (Read More...),50,56.81818182,82.88616538,77.115,71.875,0.006920099,05-10-22
194,The Daily Hodl,"Ethereum (ETH), Chainlink (LINK) and One DeFi Altcoin Set for Rallies, According to Crypto Analyst","A popular crypto trader is forecasting rallies for Ethereum (ETH), Chainlink (LINK) and an altcoin from the decentralized finance (DeFi) sector. The pseudonymous analyst known as Altcoin Sherpa tells his 184,100 Twitter followers that he expects ETH to at least break through the $1,500 level, abo... (Read More...)",50,50,0.089675188,71.075,63.33333333,0.021293759,05-10-22
195,The Block,More than 300 NFTs moved out of 3AC’s Starry Night Capital address for the first time in four months,"It’s the first time NFTs changed wallet addresses in four months, when trouble with Starry Night Capital founder Three Arrows Capital began. (Read More...)",50,68.75,75.54299533,29.905,59.16666667,0.010696054,05-10-22
196,CryptoPotato,Elon Musk Renews Plans to Buy Twitter for Originally Agreed Price,Musk has reportedly returned to his original plan to buy out Twitter for $44 billion. (Read More...),63.66,68.75,1.54940486,65.91,71.875,0.072926283,05-10-22
197,CryptoBriefing,Elon Musk Renews Twitter Buyout Offer,"Tesla and SpaceX CEO Elon Musk has reportedly written to Twitter with an offer to buy the company at the price both parties agreed upon back in April. Elon Musks Twitter buyout deal may not be dead after all.According to a Tuesday Bloomberg report citing sources familiar with the matter, the Tesl... (Read More...)",50,50,7.259637117,90.48,58.4375,0.200602412,05-10-22
198,Crypto Briefing,Elon Musk Renews Twitter Buyout Offer,Tesla and SpaceX CEO Elon Musk has reportedly written to Twitter with an offer to buy the company at the price both parties agreed upon back in April. Musk Reconsiders... (Read More...),50,50,7.259637117,79.295,62.5,0.383165479,05-10-22
199,The Block,"‘Please mom!’ Kids enticed by web3 projects with plush toys, adorable avatars","In recent months, a slew of announcements has heralded a concerted effort to bring NFTs and other web3 projects into the mainstream. Major retailers like Walmart and Macy’s and storied children's brands Mattel and Nickelodeon are among those joining forces in the hopes of convincing kid consumers... (Read More...)",77.055,75,99.63614047,89.53,59.375,89.89619613,05-10-22
200,The Block,Hedge fund titan Ray Dalio steps down as co-CIO of Bridgewater Associates,"Dalio announced on Tuesday that he was stepping down as co-CIO, after more than a decade since he first lined out his succession plan. (Read More...)",50,42.22222222,1.466324925,60.115,63.68055556,2.766361833,05-10-22
201,BeInCrypto,How WAX and HIVE Are at the Forefront of GameFi?,"Investments in the blockchain and Web 3 space have been spasmodic despite the sector’s overall growth. While a bear market and macroeconomic conditions have halted growth across sectors, GameFi is a sector that continues to grow. The post How WAX and HIVE Are at the Forefront of GameFi? appeared ... (Read More...)",50,50,1.025116444,81.845,62.5,0.010755658,05-10-22
