,source,title,excerpt,vader_sentiment_title,tb_sentiment_title,flair_sentiment_title,vader_sentiment_excerpt,tb_sentiment_excerpt,flair_sentiment_excerpt,date
0,Bitcoinist,International Monetary Fund Says Crypto Assets Have Mainstream Presence,"The crypto ecosystem is evolving very rapidly. Regulators are now finding it hard to keep up with the regulation strategies. In the sight of this, the International Monetary Fund (IMF) published a report titled ‘Regulating Crypto: The right rules could provide safe space for innovation.’ The repo... (Read More...)",58.894999999999996,50.0,99.70661103725433,68.06,59.95039682539682,0.040724873542785645,2022-09-07
1,Bitcoin.com,"Russia Can’t Do Without Cross-Border Crypto Payments, Consensus Reached",Key government institutions have agreed that Russia needs to legalize crypto payments for international settlements. The proposal has been gaining support in the past few months since Moscow’s decision to invade Ukraine was met with wave after wave of Western sanctions. Financial Authorities in R... (Read More...),55.135,50.0,99.13578033447266,88.25,50.357142857142854,93.18801164627075,2022-09-07
2,AMBCrypto,Cardano [ADA] investors should closely monitor this new development,"Cardano [ADA] has been on the radar of the crypto community lately. While the much-anticipated Vasil upgrade has been something to look forward to, other developments have followed. First, it was ADA flipping Ripple [XRP] to become the seventh most valued cryptocurrency in market capitalization. ... (Read More...)",50.0,56.81818181818181,98.14430475234985,74.635,58.25,88.0613386631012,2022-09-07
3,crypto.news,Solv Protocol Counts Authorization for the Anticipated ERC-3525 Semi-Fungible Token Standard,"At the end of last year, Solv Protocol, the creator of financial non-fungible tokens (NFTs), unveiled the Initial Voucher Offering (IVO). By implementing this change, the company became the first Web3-based project to incorporate the idea of the semi-fungible token… (Read More...)",50.0,50.0,99.87335205078125,50.0,57.49999999999999,23.760312795639038,2022-09-07
4,Bitcoin Magazine,What Do Bitcoin Core Contributors Do?,"There are different types of Bitcoin Core contributors playing different roles, and understanding the process is critical for all Bitcoiners. (Read More...)",50.0,50.0,6.071898341178894,43.6,56.25,99.75215196609497,2022-09-07
5,Decrypt,David Bowie on the Blockchain Ethereum NFTs Trigger Backlash,The star’s estate engaged artists to make Bowie-inspired art to fundraise for the fight against hunger. (Read More...),50.0,50.0,0.22881925106048584,38.685,75.0,99.6876209974289,2022-09-07
6,NewsBTC,OpenSea Weekly Chart Records Ethereum Domains Getting More Hype,"With the increased adoption and attention to non-fungible tokens, several platforms like OpenSea emerged as trading hubs. As a result, people needed suitable grounds to interact and transact with the numerous NFTs available in the space. Hence, some platforms have been trying to bridge the gap an... (Read More...)",50.0,75.0,1.4716148376464844,77.86999999999999,64.5,3.552737832069397,2022-09-07
7,crypto.news,NFT Fans Reddit’s Non-Fungible Avatars on Opensea Marketplace Prices Heighten,"The recently launched Reddit NFT avatars see a massive rise in prices on secondary sales in Opensea Marketplace after NFT maniacs go wild post-launch. Reddit and Non-fungible Tokens Earlier this year (July 2022), Reddit announced its plans to indulge in… (Read More...)",50.0,50.0,0.05695819854736328,41.105000000000004,52.5,0.6367087364196777,2022-09-07
8,crypto.news,Aave DAO Halts Ether Borrowing as Ethereum Merge Draws Nearer,"Ahead of Ethereum’s anticipated transition, the decentralized lending and borrowing platform, Aave, has announced that it would cease loaning Ether to others. The decision came following the Aave community’s overwhelming vote in favor of the suspension. Aave to Stop Loaning… (Read More...)",50.0,50.0,0.23531615734100342,56.400000000000006,66.66666666666666,0.054079294204711914,2022-09-07
9,Crypto Daily,Polkadot (DOT) and Uniswap (UNI) Investors Hurry to Purchase High Potential Flasko (FLSK),"Although new, Polkadot (DOT) and Uniswap (UNI) have made noteworthy achievements. However, despite their positive growth, they are associated with significant downsides, which is why many investors are switching to cryptocurrencies like Flasko which have potential for huge growth. As an independe... (Read More...)",50.0,54.0,0.16803741455078125,41.205000000000005,65.27597402597402,0.02258121967315674,2022-09-07
10,Bitcoin Magazine,How Bitcoin Educates The World About Finance,Bitcoin brings financial education to the forefront of people’s minds in a world which has lost interest in the topic. (Read More...),50.0,50.0,96.97555005550385,58.894999999999996,62.5,98.65149259567261,2022-09-07
11,CoinGape,$BTC Is Currently In A Discounted Bull Market – Bloomberg Intelligence,"Bitcoin (BTC) is experiencing an extensive bear market in tandem with the rest of the crypto markets; this has been the general consensus. Nonetheless, Bloomberg begs to differ. The media firm recently mentioned that, contrary to popular belief, BTC is still currently in a bull market, but tradin... (Read More...)",75.53,50.0,0.014021992683410645,61.315,56.785714285714285,1.687958836555481,2022-09-07
12,AMBCrypto,Binance delists major stablecoins in favor of BUSD but here’s the catch,"In a recent announcement, Binance stated that existing USDC, USDP and TUSD balances in user accounts will be delisted on 29 September. These balances on user accounts will be then automatically converted to BUSD. Additionally, Binance will end the trading pairs of these stablecoins against BUSD a... (Read More...)",60.72,53.125,7.284632325172424,50.0,62.5,0.011494755744934082,2022-09-07
13,Chain Debrief,$33 Million Worth of stETH Removed from Curve by Three Arrows Capital,"According to on-chain data, the wallet associated with insolvent crypto hedge fund Three Arrows Capital has removed nearly 20,946 stETH worth around USD $33.7 million from the Curve liquidity pool on September 6. During the same period, the hedge fund also removed 203 WBTC worth USD $4.02 million... (Read More...)",61.315,65.0,0.32452642917633057,71.075,62.0,0.00699162483215332,2022-09-07
14,CryptoPotato,Former Brazilian Economy Minister Joins Binance’s Advisory Board (Report),The ex President of Brazil's central bank - Henrique Meirelles - became the newest member of Binance's Advisory Board. (Read More...),50.0,50.0,99.49401617050171,50.0,62.5,97.0760852098465,2022-09-07
15,NewsBTC,"Top Exchanges Mark Readiness For Vasil, Can Cardano Rally To $1?","The Cardano Vasil hard fork is currently the second most anticipated upgrade in the crypto space, right behind the Ethereum Merge. This hard fork is just as important to the Cardano network as it not only improves the experience of developing on the network, it also strengthens the security of th... (Read More...)",71.075,75.0,99.91135895252228,73.55000000000001,53.51190476190476,99.9802976846695,2022-09-07
16,Bitcoinist,Are Reddit NFTs Really Making Bank On OpenSea?,"NFTs are now one of the biggest ways of taking advantage of the opportunities of the crypto market. This is why various brands have looked to get into the market, and one of those is social media giant Reddit. After the platform had announced its very own NFTs, word quickly spread, and these Redd... (Read More...)",50.0,60.0,0.04108846187591553,77.86999999999999,63.72222222222222,96.06483280658722,2022-09-07
17,crypto.news,CVM Prohibits ByBit From Operating in Brazil,The Brazilian Securities and Exchange Commission (CVM) barred Singapore-based crypto exchange Bybit from operating in securities brokerage on September 6. This is not the first time a foreign crypto exchange seeking to operate in Brazil has been publicly warned about… (Read More...),50.0,50.0,0.3937065601348877,65.91,57.8125,0.057375431060791016,2022-09-07
18,crypto.news,Ethereum Successfully Activates Bellatrix Upgrade Ahead of Merge,"Ethereum, the second-largest blockchain by market cap, is about to undergo the biggest transformation to its network known as “the Merge.” The Ethereum team successfully conducted its final upgrade on the Merge known as the ‘Bellatrix Upgrade,’ on September 6,… (Read More...)",74.695,87.5,99.73381757736206,74.695,70.83333333333334,78.6660373210907,2022-09-07
19,Bitcoin Magazine,Will El Salvador’s Bitcoin Bet Pay Off?,The country has gone long on Bitcoin adoption as it attempts to overcome the monetary reigns of the IMF and United States. (Read More...),44.865,50.0,0.19174814224243164,71.075,61.25000000000001,83.51338803768158,2022-09-07
20,Decrypt,Bitcoiner Dan Held: Ethereum Merge Will 'Add Pressure to Bitcoin's Energy Consumption',"Switching to proof-of-stake “opens up attack vectors the Bitcoin community does not want to take on,"" Held told Decrypt during a podcast interview. (Read More...)",48.71,50.0,0.7344245910644531,24.29,75.0,0.3633081912994385,2022-09-07
21,The Block,Coinbase releases governance proposal that could increase MakerDAOs revenue by $24 million,"Coinbase put forth a proposal on MakerDAO’s governance forum that would transfer 33% of Maker’s $1.6 billion Peg Stability Module (PSM) into a Coinbase Prime custody account, increasing Maker’s revenue by roughly $24 million. (Read More...)",65.91,50.0,2.6141703128814697,50.0,60.0,1.1956900358200073,2022-09-07
22,NewsBTC,"Avalanche Plays A Game Of Bounce Or Die, Can Bulls Win This Fight?","Avalanche (AVAX) price continues to hold key support against tether (USDT) as price finds itself amid death or survival. The crypto market has become promising as most altcoins appear bullish coming out of their shells, but the likes of Avalanche (AVAX) price continue in their struggle to survive... (Read More...)",41.105000000000004,60.0,14.754533767700195,62.5,65.0,99.8210608959198,2022-09-07
23,Bitcoin.com,Trezor and Wasabi to Implement a Coinjoin Mixing Scheme Into Hardware Wallets,"This week, the hardware wallet manufacturer Trezor, and the non-custodial bitcoin wallet with a built-in Coinjoin mixer, Wasabi, revealed the two teams are working together to introduce Coinjoin mixing into hardware wallets. On Sunday, Wasabi tweeted “hardware wallet Coinjoins are coming next yea... (Read More...)",50.0,50.0,99.74795579910278,50.0,62.5,1.847723126411438,2022-09-07
24,Bitcoinist,Embattled Three Arrows Moves Funds From Liquidity Pool,One of the wallets linked to the struggling cryptocurrency hedge firm Three Arrows Capital has moved money for the first time in about ten days. Three Arrows Moves From Wallet On-chain data shows that a wallet associated with the bankrupt cryptocurrency hedge fund Three Arrows Capital removed sta... (Read More...),50.0,50.0,0.07939338684082031,12.469999999999997,56.875,0.009313225746154785,2022-09-07
25,Bitcoinist,Indian Police Arrests Crypto Fraudster Accused Of $31 Million Scam,"Notably, the cryptocurrency industry expanded its boundaries in India in recent years. But unfortunately, cybercriminals and crypto fraudsters also ramped up their efforts to loot investors’ hard-earned money in this sector. As a result, it put the law-enforcement forces on their toes and led gov... (Read More...)",4.6899999999999995,50.0,0.21224617958068848,8.645000000000003,56.25,22.942495346069336,2022-09-07
26,The Daily Hodl,"Bank With $489,000,000,000 in Assets Explains How Crypto Can Reach the Mainstream Public: Report","The largest bank in Singapore is backing cryptocurrency and blockchain tech despite the regulatory uncertainty and market downturn. According to a new report from the Financial Times, DBS CEO Piyush Gupta says the recent crypto slump shows the need for regulated financial institutions to offer di... (Read More...)",60.114999999999995,50.0,11.037203669548035,64.07499999999999,56.36363636363636,19.0012127161026,2022-09-07
27,The Daily Hodl,"Here’s the Ultimate Goal for Chainlink (LINK), According to Its Creator Sergey Nazarov","Chainlink (LINK) creator Sergey Nazarov is detailing his vision for the future of the decentralized oracle network, as well as the future of the crypto industry at large. In a new interview with Bankless, Nazarov says the crypto industry is still in its early days. He points to Chainlink’s succes... (Read More...)",50.0,50.0,99.84330236911774,73.83500000000001,57.92207792207792,79.7736257314682,2022-09-07
28,Decrypt,Ethereum Devs Dismiss Early Hiccups as Bellatrix Kicks Off the Merge,"The network’s “missed block rate” spiked by around 1,700% today following the Bellatrix upgrade. (Read More...)",50.0,55.00000000000001,0.07059872150421143,27.98,62.5,0.12826621532440186,2022-09-07
29,The Block,Binance conversions will lead to more USDC flowing into the exchange: Circle CEO,"Binance’s move to automatically convert USDC and two other stablecoins may lead to more USDC flowing into the exchange, according to the CEO of Circle, which issues the coin. “Binance is trying to consolidate dollar liquidity w cash equivalent stables. That’s good for liquidity and market depth,”... (Read More...)",50.0,75.0,76.83302462100983,72.02,69.6875,0.019821524620056152,2022-09-07
30,CryptoPotato,"Core Scientific Sold Over 1,100 BTC in August for $26 Million","US crypto miner Core Scientific produced 1,334 BTC in August and sold 1,125 BTC of that amount for around $26 million. (Read More...)",50.0,50.0,9.28250253200531,50.0,75.0,0.21056830883026123,2022-09-07
31,The Block,Law firms seek to replace Roche Freedman as lead counsel in Tether case,Two law firms have filed a letter requesting to replace Roche Freedman as lead counsel in the Tether class action. (Read More...),63.660000000000004,50.0,23.455435037612915,63.660000000000004,65.0,4.131492972373962,2022-09-07
32,Cointelegraph,"Trademark applications for crypto, NFTs, and metaverse surge in 2022: Report","Data from March reportedly showed the largest number of U.S. trademark filings in 2022, with 1,078 for NFTs, 604 for cryptocurrencies, and 759 for the metaverse. (Read More...)",50.0,50.0,99.36949014663696,53.86,75.0,0.324895977973938,2022-09-07
33,Bitcoinist,"Binance Will Keep Supporting USDC, Says Circle CEO","The largest crypto exchange Binance announced that it will be converting stablecoin USD Coin (USDC), Pax Dollar, and True USD into its native stablecoin BUSD. This sparked a debate in the crypto community as many started speculating about the reasons behind this measure. Related Reading: Report: ... (Read More...)",72.02,62.5,98.87415170669556,71.075,59.5,5.405333638191223,2022-09-07
34,CryptoBriefing,What’s Going On With y00ts?,"Waitlisted applicants for the y00ts mint will not be able to get their NFTs today, the official y00ts Twitter account stated. A 24-hour notice will be given before the mint goes live. NFT minting processes are complex as ever, and one hotly-anticipated project has hit a few snags.The official Twi... (Read More...)",50.0,50.0,0.2336442470550537,50.0,56.36363636363636,0.6933629512786865,2022-09-07
35,Crypto Briefing,What’s Going On With y00ts?,"Waitlisted applicants for the y00ts mint will not be able to get their NFTs today, the official y00ts Twitter account stated. A 24-hour notice will be given before the mint... (Read More...)",50.0,50.0,0.2336442470550537,50.0,75.0,0.03954470157623291,2022-09-07
36,Feed - Cryptopotato.Com,Why is Trading Volume for ENS Domains Surging?,"The Ethereum Name Service is having its moment, rallying in volume while other NFTs sink. (Read More...)",50.0,50.0,22.276759147644043,50.0,59.375,81.20576739311218,2022-09-07
37,ZyCrypto,"Solana Sees Meteoric Growth Against ADA, ETH Even As Founder Cites ‘Curse’ Following Network Outages",Solana’s founder concedes that frequent network outages have been its bane over the last 12 months. (Read More...),69.08999999999999,50.0,0.14316439628601074,50.0,60.0,12.012094259262085,2022-09-07
38,CoinTelegraph,New finance minister Kwasi Kwarteng leaves crypto policy in the UK unclear,"While serving as the secretary of state for business, energy and industrial strategy, Nadhim Zahawi was part of a department suggesting support for blockchain technology in 2021. (Read More...)",37.5,56.81818181818181,0.03535747528076172,79.295,75.0,13.654595613479614,2022-09-07
39,Blockworks,"Miners Hive Blockchain Technologies, Hut 8 Prep for Ethereum Merge","Hive exploring other coins to mine while Hut 8 ready to “pivot” ether-focused machines to offer AI and other services The post Miners Hive Blockchain Technologies, Hut 8 Prep for Ethereum Merge appeared first on Blockworks. (Read More...)",50.0,50.0,96.39528393745422,68.06,56.99999999999999,83.50691795349121,2022-09-07
40,Decrypt,Bitcoin Falls Below $19K for the First Time In 2 Months,The biggest cryptocurrency’s sell-off is intensifying amid broader market turmoil. (Read More...),50.0,62.5,0.002115964889526367,31.94,75.0,85.1172924041748,2022-09-07
41,The Daily Hodl,Crypto Analyst Weighs In As Helium (HNT) Tumbles After Proposal To Migrate to Solana (SOL),"A popular crypto analyst is still bullish on Helium’s (HNT) long-term prospects despite the project’s recent steep correction. In a new YouTube video, the anonymous host of InvestAnswers tells his 443,000 subscribers that Helium, a decentralized wireless network for the Internet of Things (IoT), ... (Read More...)",50.0,50.0,0.002682209014892578,80.62,65.45454545454545,0.13212263584136963,2022-09-07
42,AMBCrypto,"NFT market has a savior, and no it’s not ‘Apes’ or ‘Birds’ this time","The last few weeks have not only been a tough time for the crypto market, but also for the NFT market as a whole. With sales and floor prices plummeting to new lows, some of the best-performing NFT groups were at their lowest. A sad sob story here? In a strange turn of events, that […] (Read More...)",35.199999999999996,50.0,89.78331089019775,3.870000000000001,48.319304152637486,1.5465348958969116,2022-09-07
43,The Block,"Bitcoin mining stock report: Tuesday, September 6","Here's how crypto mining companies performed on Tuesday, Sept. 6. (Read More...)",50.0,50.0,0.011482834815979004,50.0,75.0,0.017815828323364258,2022-09-07
44,CoinGape,"$LUNC Is A Lottery Ticket With No Utility, Founder Of Gokhshtein Media Says","Terra Classic (LUNC) is initiating a strong comeback against all odds. Amidst the failing crypto markets, LUNC has surged by over 140% in the past 7 days at the time of reporting. Despite these auspicious movements, most crypto proponents remain skeptical about the asset. In particular, the found... (Read More...)",35.199999999999996,50.0,0.0024259090423583984,52.580000000000005,57.26190476190476,99.859419465065,2022-09-07
45,crypto.news,"Web 3 Platform, tomi, Set Out To Build A Totally Decentralized Computing & Mining Service",tomi launches in a bid to do away with the centralization of services in the blockchain space. (Read More...),50.0,50.0,98.64336252212524,50.0,75.0,21.696466207504272,2022-09-07
46,CoinTelegraph,Bitcoin price falls under $19K as data shows pro traders avoiding leverage longs,"BTC nose-dived to its lowest level since July 13, but data shows pro traders remain skeptical of a quick recovery. (Read More...)",32.99999999999999,50.0,0.007593631744384766,21.055,55.55555555555556,0.017017126083374023,2022-09-07
47,Blockworks,KPMG Predicts Crypto Slowdown for Remainder of 2022,Crypto and blockchain investments are not on track so far this year to hit a record The post KPMG Predicts Crypto Slowdown for Remainder of 2022 appeared first on Blockworks. (Read More...),50.0,50.0,0.034236907958984375,50.0,64.16666666666666,0.1249164342880249,2022-09-07
48,Cointelegraph,PraSaga awarded U.S. patent for placing computer operating system onto the blockchain,The patent protects claims for processing non-singular message passage transactions on the blockchain. (Read More...),70.095,50.0,97.40197956562042,65.91,75.0,89.76683914661407,2022-09-07
49,Bitcoin.com,Publicly-Listed Miner Hive Plans to Transfer ETH Hashrate to Other GPU Mineable Coins Ahead of Merge,"While the cryptocurrency community prepares for The Merge, the Nasdaq-listed, Hive Blockchain Technologies, revealed in the company’s August 2022 production update that it plans to re-distribute its hashpower dedicated to Ethereum toward “other GPU mineable coins.” Hive’s Technical Team Researche... (Read More...)",50.0,43.75,0.24980604648590088,72.94,56.25,0.4932910203933716,2022-09-07
50,The Block,Crypto lending platforms react to high ETH borrowing by traders ahead of The Merge,Traders are borrowing ETH to try to game a potential fork at the time of The Merge. Crypto lending platforms are seeking to address this. (Read More...),50.0,57.99999999999999,17.897751927375793,50.0,51.66666666666666,0.2980172634124756,2022-09-07
51,BeInCrypto,"Investors Continue Buying Bitcoin Dip as Price Drops Below $19,000","The number of BTC wallets holding between one and ten BTC has risen to an all-time high as bitcoin drops below $19K. The post Investors Continue Buying Bitcoin Dip as Price Drops Below $19,000 appeared first on BeInCrypto. (Read More...)",50.0,50.0,0.9177863597869873,53.86,61.375,0.07125139236450195,2022-09-07
52,U.Today,"Ethereum Price Performance Could Guide Other Altcoins, Bloomberg's McGlone Says","Bloomberg’s Mike McGlone believes that the largest altcoin may start guiding the broader market, replacing Bitcoin (Read More...)",50.0,43.75,85.06425619125366,50.0,75.0,83.60479474067688,2022-09-07
53,Cryptomode,Analysts Find Hidden Gem That Looks Set To Overtake Solana (SOL) and DogeCoin (DOGE),"We have insider knowledge that top analysts in the crypto world have found a hidden gem that they think will give investors over 9,000% gains in 2022. If you’re looking for DogeCoin (DOGE) price prediction, Solana (SOL) price prediction and want to find a hidden crypto gem before anyone else does... (Read More...)",50.0,41.66666666666667,13.251769542694092,77.115,58.333333333333336,92.04626679420471,2022-09-07
54,Cryptomode,"Cardano, Polygon And Fortrex: Colors Duel — Profitable Proof-Of-Stake Cryptocurrencies","Let’s discuss proof-of-stake (POS) cryptocurrencies, Cardano (ADA), Polygon (MATIC), and Fortrex: Colors Duel (MAGG). You might be wondering: Why proof-of-stake cryptocurrencies? Why should you be interested? What’s so special about them? Let’s relax your curiosity. Proof-of-stake (POS) cryptocur... (Read More...)",72.02,50.0,97.70594835281372,92.27499999999999,68.45238095238095,21.48635685443878,2022-09-07
55,Blockworks,Former ING Crypto Lead To Helm Investcorp’s First Blockchain Fund,"Hervé François to work on $42B alternative investments firm’s fund focused on NFTs, DeFi and more The post Former ING Crypto Lead To Helm Investcorp’s First Blockchain Fund appeared first on Blockworks. (Read More...)",50.0,56.25,99.60248172283173,69.08999999999999,60.83333333333334,90.52989184856415,2022-09-07
56,U.Today,"Another Rugpull? Cornerchain (CNR) Tanks to Nearly Zero Hours After Rallying 149,000%",CNR token plunged 99.5% to virtually zero shortly after reaching new all-time high of $0.27 (Read More...),50.0,55.00000000000001,0.0011682510375976562,60.114999999999995,59.95454545454546,0.0015079975128173828,2022-09-07
57,The Daily Hodl,Arthur Hayes Says Ethereum Merge Could Trigger ‘Free Money’ Opportunity for Crypto Traders,"BitMEX co-founder Arthur Hayes is detailing his outlook on the crypto landscape after the Ethereum (ETH) merge is executed. In a new interview on the Unchained Podcast, Hayes analyzes the potential success of a forked Ethereum token backed by proof-of-work miners whose business model will be aban... (Read More...)",71.075,70.0,0.8504629135131836,79.295,61.70454545454545,82.01245665550232,2022-09-07
58,Crypto Briefing,Russia to Explore Cross-Border Stablecoin Settlements,"Russia is considering stablecoins as an option for cross-border settlements, according to the country’s finance minister. Russia Could Use Stablecoins Russia could use stablecoins for international settlements. On September 6,... (Read More...)",50.0,50.0,97.25010693073273,50.0,62.5,0.010010600090026855,2022-09-07
59,The Daily Hodl,Mid-Cap Ethereum Rival Selected by Electronics Giant LG for NFT Partnership,"South Korea-based LG Electronics has chosen the enterprise blockchain Hedera (HBAR) to power its non-fungible token (NFT) platform for smart TVs. LG’s newly launched NFT platform, LG Art Lab, allows users to buy, sell and trade NFTs on their LG smart TVs running webOS 5.0 or later. Chris Jo, seni... (Read More...)",50.0,50.0,9.357351064682007,85.48,60.64935064935065,99.55782294273376,2022-09-07
60,crypto.news,Sushi Products Now Available on the Boba Network,"Sushi, one of the biggest providers of DeFi tools like SushiSwap, has announced a partnership with Boba Network. (Read More...)",50.0,70.0,99.90854859352112,68.06,75.0,88.27261328697205,2022-09-07
61,Cointelegraph,Basketball star for a crypto launderer? Alexander Vinnik's lawyers considers prisoner swap: Report,"Though political tensions may be high between the U.S. and Russia, authorities still negotiated a prisoner swap of Trevor Reed for drug smuggler Konstantin Yaroshenko in April. (Read More...)",22.884999999999998,50.0,0.17670392990112305,7.405,61.0,2.603006362915039,2022-09-07
62,CoinTelegraph,Basketball star for a crypto launderer? Alexander Vinnik's lawyers considers prisoner swap: Report,"Though political tensions may be high between the U.S. and Russia, authorities still negotiated a prisoner swap of Trevor Reed for drug smuggler Konstantin Yaroshenko in April. (Read More...)",22.884999999999998,50.0,0.17670392990112305,7.405,61.0,2.603006362915039,2022-09-07
