,source,title,excerpt,vader_sentiment_title,tb_sentiment_title,flair_sentiment_title,vader_sentiment_excerpt,tb_sentiment_excerpt,flair_sentiment_excerpt,date
0,Bitcoin Magazine,A History Of Bitcoin Hard Forks,"A lively conversation and response to Jameson Lopp’s recent article that researches the answer to the question, “Has Bitcoin Ever Hard Forked?” (Read More...)",44.865,35.416666666666664,99.88485872745514,68.06,54.308712121212125,99.95465874671936,2022-06-21
1,Blockworks,BTC Markets Gets Financial Services License in Australian First,"The license will help BTC Markets shelter the coming regulatory storm for crypto in Australia, CEO Caroline Bowler said The post BTC Markets Gets Financial Services License in Australian First appeared first on Blockworks. (Read More...)",50.0,54.166666666666664,98.81495535373688,70.095,60.0,97.74880707263947,2022-06-21
2,Decrypt,CryptoPunk Sale Raises $100K in Ethereum to Support Ukraine War Effort,"The NFT was valued at almost three times that amount when it was donated in March, before the latest crash. (Read More...)",35.199999999999996,50.0,8.250880241394043,52.580000000000005,75.0,83.78026187419891,2022-06-21
3,CryptoSlate,Web3 browsers are a gateway to the decentralized world,"Almost unheard of until last year, the term “Web3” has quickly become the world’s favorite buzzword. (Read More...)",50.0,50.0,99.96898174285889,72.94,66.66666666666666,99.87322688102722,2022-06-21
4,Bitcoinist,DeFi Total Value Locked (TVL) Declines 35% In One Month To 15-Month Lows,The decentralized finance (DeFi) market has taken a massive hit with the recent crypto market downtrend. The space which had been the breakout star of 2021 had quickly begun losing all of the value accrued during the bull market. This has been a result of major events that have triggered the vari... (Read More...),57.655,50.0,0.006449222564697266,47.42,58.958333333333336,0.02416372299194336,2022-06-21
5,Brave New Coin,Gamma - the marketplace for Bitcoin NFTs powered by Stacks,"Gamma is the leading marketplace for creators and digital collectors to find, list, and sell NFTs, secured by the Bitcoin blockchain. Gamma also provides a minting platform for creators to launch their NFT collections without any code, and a social platform built to become a hub for the world's w... (Read More...)",50.0,50.0,99.2890328168869,70.095,58.88888888888889,99.8787373304367,2022-06-21
6,Crypto Daily,Emergent Games Launches Prologue Game for Resurgence and ‘Invite Only’ Drop of Gen 0 Cryotag NFT,"First generation of Resurgence Cryotag NFTs offered by invite only mint ‘The End’ is the ARG, prologue to the MMORPG game Resurgence ‘AAA’ game team with more than 40 developers from top gaming companies, including PlayStation, Sumo Digital and Codemasters Roadmap announced to deliver multiple dr... (Read More...)",36.34,40.0,99.17871952056885,67.0,55.27777777777778,99.92589056491852,2022-06-21
7,crypto.news,Unstable Market Conditions Force Bancor (BNT) to Pause Impermanent Loss Protection,"Bancor, a decentralized exchange on Ethereum, has paused the Impermanent Loss Protection to protect liquidity providers (LPs) as the crypto market slump continues. The DeFi protocol cited large sales of Bancor (BNT) tokens for its action. Deposits and withdrawals will… (Read More...)",20.705000000000002,50.0,0.6093382835388184,53.86,63.57142857142857,0.10971128940582275,2022-06-21
8,CryptoPotato,South Korean Authorities Impose Departure Ban on One of Terra’s Main Designers: Report,"More troubles are brewing for the founding members of Terra. South Korean authorities reportedly issued a departure ban on one of the company's ""main designers."" (Read More...)",14.984999999999998,58.333333333333336,0.725632905960083,10.794999999999998,69.44444444444444,0.01913905143737793,2022-06-21
9,Bitcoin.com,SEC Chair Warns of ‘Too Good to Be True’ Crypto Products — US Treasury Calls for Urgent Regulation,"The chairman of the U.S. Securities and Exchange Commission (SEC), Gary Gensler, has warned the public about crypto investments that seem “too good to be true.” Meanwhile, the U.S. Treasury Department says that the recent crypto market turmoil underscores the urgent need for regulatory frameworks... (Read More...)",81.245,65.83333333333333,1.142767071723938,73.83500000000001,62.083333333333336,0.39145946502685547,2022-06-21
10,CryptoPotato,ONDA: Web 3 Data Marketplace on Ocean Protocol to Redefine Data Monetization,"The cryptocurrency industry has changed fundamentally over the past years with new protocols developing tools designed to explore previously unchartered horizons. Data has been at the forefront of blockchain protocols for a long while, but now, with the advent of narratives such as non-fungible t... (Read More...)",50.0,50.0,94.37412917613983,50.0,51.41414141414141,99.75316226482391,2022-06-21
11,The Daily Hodl,"Bitcoin (BTC) May Have Further To Fall Until One Catalyst Triggers Reversal, Says Crypto Analyst Benjamin Cowen","Crypto analyst Benjamin Cowen says that one macroeconomic signal may be what triggers a trend reversal in Bitcoin (BTC). In a new strategy session, Cowen tells his 754,000 YouTube subscribers that he’s got his eye on the rate of US inflation and its correlation with equity markets and Bitcoin. Co... (Read More...)",50.0,50.0,2.2917836904525757,50.0,65.9090909090909,97.28517830371857,2022-06-21
12,The Daily Hodl,"Elon Musk Reiterates Support for Dogecoin After Facing $258,000,000,000 Crypto Lawsuit",Tesla CEO Elon Musk is once again confirming his support for popular meme token Dogecoin (DOGE) despite getting hit with a multimillion-dollar lawsuit that alleges he promoted the dog-themed crypto asset as a pyramid scheme. The business magnate tells his 99 million Twitter subscribers that he wi... (Read More...),60.114999999999995,50.0,5.713316798210144,91.8,77.5,0.055223703384399414,2022-06-21
13,Bitcoinist,Why Vitalik Buterin Is Not Worried About Ethereum Crashing,"The inventor of Ethereum Vitalik Buterin and his father Dmitry “Dima” Buterin talked about the crypto market, volatility, and speculators. In an interview with Fortune Magazine Buterin claimed he is unbothered by ETH’s price downside action. Related Reading | Glassnode: $7B In Bitcoin Losses Real... (Read More...)",61.175000000000004,50.0,14.702433347702026,21.405,60.0,0.009784102439880371,2022-06-21
14,NewsBTC,"VeChain Heads For Consensus Update, Can VET Price Lessen Bearish Pressure?",VeChain follows the general sentiment in the market and has experienced some relief across low timeframes. The crypto market trended below the critical support zone during the weekend but saw it bounce during today’s trading session. Related Reading | Over $250 Million In Liquidations As Bitcoin ... (Read More...),35.199999999999996,50.0,1.5019476413726807,58.894999999999996,61.25000000000001,0.05194544792175293,2022-06-21
15,Crypto Briefing,Celsius Repays $10M DAI to Compound,Celsius made a significant payment to Compound today as it transferred $10 million of DAI to the latter service. Celsius Pays Back $10 Million Celsius has sent $10 million worth... (Read More...),50.0,50.0,0.013902783393859863,60.114999999999995,61.75000000000001,0.48358142375946045,2022-06-21
16,CryptoGlobe,"CNBC’s Jim Cramer Sees Bitcoin ($BTC) Drop to $12,000 Level It Had Before ‘Fiasco’ Began","Former hedge fund manager Jim Cramer, who has in the past said he directly owned Ethereum ($ETH) and told viewers to consider investing in Coinbase stock (NASDAQ: COIN) in August 2021, has said he sees the price of Bitcoin ($BTC) drop to $12,000 in the future. Cramer, the host of CNBC show “Mad M... (Read More...)",36.34,50.0,0.2858370542526245,36.34,47.70833333333333,0.042748451232910156,2022-06-21
17,BeInCrypto,On-Chain Analysis: Realized Loss of BTC Investors Reaches New ATH,"During the past week, Bitcoin investors decided to sell their coins with the biggest loss in history. BeInCrypto takes a look at on-chain indicators, according to which the last 6 days led to a loss of $19.121 billion in Bitcoin. (Read More...)",36.34,56.81818181818181,1.6472071409225464,22.13,54.166666666666664,0.0008463859558105469,2022-06-21
18,Decrypt,"Decrypt Co-Sponsoring NFT NYC Events With BeetsDAO, Unstoppable Domains",Don’t miss GRAVITY by BeetsDAO and the 90s Forever NFT NYC after party. (Read More...),39.885,50.0,3.4649670124053955,63.660000000000004,75.0,98.74807000160217,2022-06-21
19,ZyCrypto,Why This Might Be Crypto’s Worst Year Yet,Six months into 2022 and the crypto industry has been hit by several blows. (Read More...),18.755,0.0,0.0003457069396972656,50.0,62.5,0.008058547973632812,2022-06-21
20,CryptoPotato,"Bitcoin Corrections Not Over Yet, Arthur Hayes Sees More Losses Incoming","Even as Bitcoin and several cryptocurrencies regained some ground after a tumultuous week, the market remains fairly volatile. (Read More...)",27.12,75.0,0.24895668029785156,50.0,70.0,0.7438153028488159,2022-06-21
21,CoinTelegraph,Chinese court invalidates 2019 car sale made using now worthless crypto token,"It appears that not only was the sales contract invalidated, but the buyer paid for the car with a questionable digital token in the first place. (Read More...)",27.98,30.0,0.00889599323272705,28.925,52.5,0.10077953338623047,2022-06-21
22,Decrypt,Bitcoin Investors Lose Record $7.3 Billion in Three Days,How close is Bitcoin to finally bottoming out? (Read More...),29.905000000000005,50.0,0.004500150680541992,50.0,62.5,0.5935519933700562,2022-06-21
23,crypto.news,South Korean Authorities Place Departure Ban on Key Terra Designer,"South Korean authorities continue to intensify their investigation into troubled Terraform Labs, with recent reports stating that police have banned one of Terra’s chief designers from leaving the country. Current and Former Terraform Labs Employees Under Travel Ban According to… (Read More...)",22.13,50.0,0.24261176586151123,6.874999999999998,50.0,1.6307622194290161,2022-06-21
24,BeInCrypto,"Luxury Brands Continue to Push NFTs, Metaverse Adoption","The marriage between fashion and crypto is being consummated, with leading brands making a renewed push into the industry. Balmain and Burberry are the latest fashion houses to explore the metaverse and Non-Fungible Tokens (NFTs). (Read More...)",50.0,50.0,92.13073551654816,50.0,75.0,99.94295835494995,2022-06-21
25,CoinTelegraph,HM Treasury changes course on collecting data around unhosted crypto wallets,"“There is not good evidence that unhosted wallets present a disproportionate risk of being used in illicit finance,” said the Treasury update. (Read More...)",60.114999999999995,50.0,0.37906765937805176,29.845,52.5,0.028783082962036133,2022-06-21
26,Blockworks,Woman-powered Web3 Startup Gives NFT Holders Hollywood Access,"Spotlight on women in Web3: Amanda Archer, founder of Women of the Metaverse The post Woman-powered Web3 Startup Gives NFT Holders Hollywood Access appeared first on Blockworks. (Read More...)",50.0,50.0,99.73259568214417,50.0,68.75,99.82881844043732,2022-06-21
27,Bitcoinist,Marcy Residents React Poorly To Jay-Z And Jack Dorsey’s The Bitcoin Academy,"In time, The Bitcoin Academy will probably be remembered as Jay-Z’s biggest contribution to Marcy, the neighborhood that saw him grow. Believe it or not, financial literacy is the most needed resource for low-income zones and people. Does that mean that those areas’ lucky residents will be immedi... (Read More...)",50.0,30.0,0.06743967533111572,71.075,60.20833333333333,99.31053221225739,2022-06-21
28,U.Today,"Here's How Crypto Market Could Recover Faster, According to FTX U.S. President Brett Harrison","These are the key factors that could potentially accelerate the cryptocurrency recovery, according to Brett Harrison (Read More...)",50.0,50.0,6.570076942443848,50.0,58.333333333333336,99.46991801261902,2022-06-21
29,AMBCrypto,Here’s Bitcoin miners’ plan to survive the crypto-crisis (to make ends meet),"Bitcoin [BTC]‘s ongoing bearish streak has significantly affected not just holders, but even miners. Bitcoin miners turned into net sellers of Bitcoin, with miner inventories dropping to new lows. Miners might not necessarily turn bearish “en masse,” although some did look to offload excess inven... (Read More...)",50.0,50.0,10.518461465835571,31.94,60.11363636363636,0.22630393505096436,2022-06-21
30,CryptoSlate,"BitOasis joins layoff spree, firing 5% of staff","Crypto exchange platform BitOasis joined in the firing spree and let go of 9 employees, representing 5% of its staff. (Read More...)",32.99999999999999,50.0,0.10574758052825928,32.99999999999999,75.0,0.15635788440704346,2022-06-21
31,BeInCrypto,The Sandbox (SAND) Weekly RSI Falls to New All-Time Low,The Sandbox (SAND) has reached a long-term horizontal support level and broken out from a descending resistance line shortly afterward. The post The Sandbox (SAND) Weekly RSI Falls to New All-Time Low appeared first on BeInCrypto. (Read More...),36.34,53.40909090909091,0.0008344650268554688,36.34,54.053030303030305,6.556510925292969e-05,2022-06-21
32,CoinTelegraph,Bitcoin futures enter backwardation for the first time in a year,Risk-averse BTC derivatives traders throw in the towel after futures contracts trade below the spot market price. (Read More...),50.0,62.5,0.08249282836914062,50.0,75.0,4.463467001914978,2022-06-21
33,Bitcoin Magazine,ProShares To Release ETF That Allows Investors To Short Bitcoin,ProShares will release a new ETF allowing investors to short bitcoin during harsh market conditions enabling institutions to legally bet against the asset. (Read More...),50.0,50.0,90.88266491889954,50.0,56.36363636363636,0.5511492490768433,2022-06-21
34,The Daily Hodl,"Here’s What’s Ahead for Binance Coin (BNB) in 2022, According to Coin Bureau","The host of Coin Bureau is speculating on what could happen to Binance Coin (BNB) after the U.S. Securities and Exchange Commission (SEC) launched an investigation into the crypto asset last week over possible violations of securities law. In a new video update, the pseudonymous crypto analyst kn... (Read More...)",50.0,50.0,97.17943966388702,72.94,55.36363636363636,0.0423431396484375,2022-06-21
35,crypto.news,Crypto Market Slump Continues After a Week of Consequent Lows,"This past weekend, large-cap cryptocurrencies such as Bitcoin and Ethereum experienced another decline to $17,708 and $896, respectively. For Bitcoin, this marked its lowest level since early 2020, while for Ethereum, it was its lowest level since early 2021. Synthetix… (Read More...)",39.885,50.0,0.0021219253540039062,28.925,58.4375,0.006467103958129883,2022-06-21
36,The Daily Hodl,Macro Guru Lyn Alden Says Only Bitcoin Can Solve Global Monetary Problems – Here’s Why,"Macro strategist Lyn Alden is giving her followers a BTC crash course, shedding light on the blockchain’s potential to shape the future. In a series of tweets, Alden lays out her argument for why she believes only BTC can solve global monetary problems. She begins by detailing how Bitcoin founder... (Read More...)",38.685,50.0,86.04777157306671,21.405,57.49999999999999,7.429072260856628,2022-06-21
37,CryptoPotato,"Kevin O’Leary is Not Selling, Despite the Recent Crypto Collapse","Kevin O'Leary does not see the digital asset market's decrease as a concern, pledging not to sell any of his cryptocurrency holdings. (Read More...)",25.305,50.0,0.013962388038635254,68.06,62.5,1.6319304704666138,2022-06-21
38,CryptoGlobe,European Financial Institution KBC Group Launches Its Own Digital Coin,"Brussels-headquartered KBC Group, which is “a leading European financial group with a focus on providing bank-insurance products and services to retail, SME and mid-cap clients”, has announced the launch of “Kate Coin”. According to KBC’s press release, KBC is “the first financial institution in ... (Read More...)",50.0,57.49999999999999,77.19548344612122,50.0,57.49999999999999,90.06132781505585,2022-06-21
39,Decrypt,UK Scraps Plan to Monitor Unhosted Digital Wallets,The EU Parliament voted to approve a similar measure about three months ago. (Read More...),50.0,50.0,0.06274580955505371,50.0,62.5,8.791488409042358,2022-06-21
40,Bitcoin.com,"Cleveland Fed President Loretta Mester Is ‘Not Predicting a Recession,’ Says Inflation Will Move Down","Cleveland Federal Reserve Bank president Loretta Mester doesn’t think a recession will take place in the United States but believes it will take two years to get inflation back down to 2%. While speaking during an interview on Sunday, Mester explained that while it will take two years, inflation ... (Read More...)",50.0,42.22222222222222,0.07072091102600098,50.0,55.74074074074073,0.055727362632751465,2022-06-21
41,BeInCrypto,ProShares to Launch New Short-Bitcoin Strategy ETF,ProShares will introduce a short-Bitcoin futures exchange-traded fund tomorrow on the New York Stock Exchange to track the inverse behavior of the S&amp;P CME Bitcoin Futures Index. (Read More...),50.0,56.81818181818181,97.14182019233704,50.0,65.9090909090909,86.94502115249634,2022-06-21
42,Cryptomode,"The Crypto Black Hole Paradox, Centralized Crypto Cancer","The crypto world is no stranger to market manipulation. In fact, it’s something that happens on a regular basis. The most recent example is the story of BitConnect, which promised guaranteed returns of up to 40% per month. Of course, this was too good to be true and the platform eventually collap... (Read More...)",14.984999999999998,41.66666666666667,0.09416341781616211,79.295,67.08333333333333,7.515361905097961,2022-06-21
43,NullTX,"The Crypto Black Hole Paradox, Centralized Crypto Cancer","The crypto world is no stranger to market manipulation. In fact, it’s something that happens on a regular basis. The most recent example is the story of BitConnect, which promised guaranteed returns of up to 40% per month. Of course, this was too good to be true and the platform eventually collap... (Read More...)",14.984999999999998,41.66666666666667,0.09416341781616211,79.295,67.08333333333333,7.515361905097961,2022-06-21
44,The Daily Hodl,ADI Whitelist – A Universal Identity Layer by Accumulate,"June 20, 2022 – Miami, Florida Accumulate is announcing a whitelist for 10,000 Web 3.0 enthusiasts to join in order to gain early access to claim a unique Accumulate Digital Identifier (ADI), which users will be able to use once the Accumulate mainnet launches. What are ADIs ADIs refer to a syste... (Read More...)",50.0,50.0,99.59228336811066,89.53,64.75,24.542155861854553,2022-06-21
45,CryptoBriefing,United Kingdom Will Not Require KYC for Unhosted Wallets,"The U.K. Treasury has decided to rescind its requirement for crypto companies to compile the personal information of self-custodied wallet users, citing privacy concerns. Unhosted Wallets for Legitimate Purposes The... (Read More...)",71.075,50.0,12.61354684829712,60.114999999999995,62.5,0.325089693069458,2022-06-21
46,Blockworks,ProShares To Launch First US ETF That’s Bearish on Bitcoin,Products seeking the inverse performance of the S&amp;P CME Bitcoin Futures Index are expected to list on the NYSE Tuesday The post ProShares To Launch First US ETF That’s Bearish on Bitcoin appeared first on Blockworks. (Read More...),50.0,62.5,95.64218819141388,50.0,61.25000000000001,0.258404016494751,2022-06-21
47,CoinTelegraph,"Price analysis 6/20: BTC, ETH, BNB, ADA, XRP, SOL, DOGE, DOT, LEO, AVAX","Bitcoin and select altcoins attempted a relief rally, but most breakouts are being capped-off well below the 20-day moving average. (Read More...)",50.0,50.0,80.47489821910858,78.595,64.16666666666666,0.01106560230255127,2022-06-21
48,Bitcoinist,"Glassnode: $7B In Bitcoin Losses Realized In Just Three Days, Highest In BTC History","Data from Glassnode shows more than $7 billion in Bitcoin losses was realized within three consecutive days, the most in the history of the crypto. Highest Ever Bitcoin Loss Realization Took Place During The Last Few Days Latest on-chain data released by Glassnode shows BTC investors took a heavy... (Read More...)",29.905000000000005,50.0,0.01977980136871338,19.379999999999995,61.42857142857143,0.13279616832733154,2022-06-21
49,crypto.news,Iran Cuts Power to All Licensed Crypto Miners,"Iran will shut off electricity to all its 118 authorized crypto mining facilities this month. Authorities in the country have taken similar measures earlier, citing the increased need for electricity during the summer. Iran Cuts Power to Crypto Mines Iran’s… (Read More...)",35.199999999999996,50.0,8.000513911247253,48.71,58.333333333333336,0.029706954956054688,2022-06-21
50,The Daily Hodl,"Tether Faces Ransom Demand and Massive Denial of Service Attack, According to CTO Paolo Ardoino","The chief technology officer of stablecoin issuer Tether says the firm was hit with a ransom demand amid a distributed denial of service attack (DDoS). Tether executive Paolo Ardoino says that the company received a ransom note to stop the denial of service attacks, but highlights the assault was... (Read More...)",22.13,50.0,0.012436509132385254,6.1750000000000025,57.49999999999999,0.006556510925292969,2022-06-21
51,BeInCrypto,"Avalanche (AVAX) Generates Bullish Divergence Inside Bullish Pattern, Next Resistance at $28","Avalanche (AVAX) has been gradually decreasing inside a descending wedge since May 12, and possibly initiated a reversal on June 19. (Read More...)",50.0,50.0,0.1097649335861206,50.0,62.5,0.05208253860473633,2022-06-21
52,Decrypt,ProShares Launches First ETF to Short Bitcoin,BITI gives investors “an opportunity to potentially profit or to hedge their cryptocurrency holdings” should prices fall. (Read More...),50.0,56.25,96.49028778076172,84.53999999999999,62.5,97.29290306568146,2022-06-21
53,The Daily Hodl,Crypto Firm Celsius Addresses Community As Top Investor Details Potential Recovery Plan,"Crypto lending firm Celsius (CEL) is reaching out to users in hopes of touching base after the platform halted withdrawals last week. In a new blog post, Celsius claims they are focusing on stabilizing their abruptly-tumultuous operations. “It has been one week since we paused withdrawals, swap, ... (Read More...)",60.114999999999995,55.00000000000001,99.0820586681366,77.86999999999999,51.13636363636363,0.003165006637573242,2022-06-21
54,AMBCrypto,"‘Expect pockets of forced BTC, ETH selling as market figures who’s swimming naked’","The crypto-market is finally at the end of much-needed relief after an intense sell-out period, or rather months. In the last 24 hours, Ethereum [ETH] rose by 14%, Bitcoin [BTC] rose by 11%, and the liquidation amount did fall to around $315 million. This uptick comes after a significant loss per... (Read More...)",27.060000000000002,42.5,0.027111172676086426,72.02,66.25,0.0026106834411621094,2022-06-21
55,CryptoSlate,Op-Ed: The latest trends in hacker attacks and how to deal with them,"As the DeFi sector continues to attract money and users, bad actors from around the world continue to view it as an attractive target that is ripe for the picking and poorly protected. (Read More...)",27.98,75.0,93.42584013938904,79.295,52.5,0.19067227840423584,2022-06-21
56,U.Today,Dogecoin Co-Founder Says Crypto Is House of Cards,"The Australian entrepreneur claims that some cards have already started to tumble, referring to the downfall of prominent cryptocurrency companies (Read More...)",50.0,50.0,24.719712138175964,65.91,66.66666666666666,0.006645917892456055,2022-06-21
57,The Block,"European crypto ETN and ETP report: Monday, June 20","Here's how crypto investment vehicles performed in Europe on Monday, June 20. (Read More...)",50.0,50.0,10.964685678482056,50.0,75.0,0.0996321439743042,2022-06-21
58,Feed - Cryptopotato.Com,DeFi Protocol Bancor Pauses Impermanent Loss Protection Feature Amid Liquidity Crisis,Bancor reassured its users that the IL protection feature will be reactivated as soon as possible. (Read More...),12.469999999999997,50.0,0.315210223197937,70.095,62.5,0.13940632343292236,2022-06-21
59,CoinTelegraph,Iranian government to cut power supply for the country's legal crypto mining rigs,"For years, the country has heavily subsidized its electricity production leading to extremely low prices. It claims that this has now become unsustainable. (Read More...)",42.345,60.0,7.391119003295898,33.08,55.00000000000001,0.09151697158813477,2022-06-21
60,The Block,UK government walks back from controversial crypto data collection plan,British government no longer plans to require senders share the personal information of beneficiary's when making a crypto transfer. (Read More...),39.885,63.74999999999999,0.3569751977920532,50.0,58.333333333333336,94.56366002559662,2022-06-21
61,The Daily Hodl,"Analyst Who Saw 2022 Bitcoin Crash Coming Updates BTC and Ethereum Forecast, Issues Fresh Alert for Crypto Traders","A popular crypto strategist who has accurately sounded the alarm on crashing crypto prices this year is now updating his forecast for the top two digital assets. The pseudonymous crypto trader known as Capo says that Bitcoin (BTC) has been experiencing a pattern of support/resistance flips, where... (Read More...)",60.114999999999995,65.0,1.589486002922058,72.02,70.0,5.627775192260742,2022-06-21
62,Bitcoinist,Profit From Bitcoin’s Collapse? New ProShares ETF Makes It Possible,"Per a press release, investment giant ProShares will launch a new Bitcoin-linked Exchanged Traded Fund (ETF) in the United States. The firm behind the first BTC ETF in this country, under the ticker BITO, will launch the Short Bitcoin Strategy under the ticker BITI. Related Reading | Cryptocurren... (Read More...)",46.14,53.40909090909091,94.63064968585968,71.075,51.789772727272734,4.020431637763977,2022-06-21
