,source,title,excerpt,vader_sentiment_title,tb_sentiment_title,flair_sentiment_title,vader_sentiment_excerpt,tb_sentiment_excerpt,flair_sentiment_excerpt,date
256,BeInCrypto,"Last Week [in] Crypto: Rough Times for the Biggest Crypto Firms, Crypto Prices Plummet, Crypto Adoption on the Rise","Be[in]Crypto has scoured the ends of the crypto ecosystem to curate the most important stories for you from the Celsius freezing withdrawals, Jake Paul’s jibe at President Biden, BlockFi and Crypto.com’s firing spree, rising adoption in the U.S and Canada, and Russian oil giant’s deal with BitRiv... (Read More...)",50.0,47.5,0.3567218780517578,41.02,64.0,99.74461197853088,2022-06-21
257,CryptoGlobe,French Postal Service Brings Its First NFT Collection to Binance NFT Marketplace,"On Friday (June 17), France’s Groupe La Poste announced that it had chosen the “Binance NFT” marketplace for the sale of its first ever NFT collection. The Binance NFT marketplace launched on 24 June 2021. Here is how Binance France announced this news: And this is the Binance CEO’s tweet about t... (Read More...)",50.0,56.25,99.94282126426697,56.400000000000006,68.75,13.184544444084167,2022-06-21
258,Blockworks,Celsius Says it Needs More Time to Recover Financial Position,"Celsius has addressed its recent financial turmoil in a blog post, in which the firm said stabilizing its liquidity ""will take time"" The post Celsius Says it Needs More Time to Recover Financial Position appeared first on Blockworks. (Read More...)",50.0,62.5,0.00209808349609375,31.94,57.49999999999999,0.02262890338897705,2022-06-21
259,The Block,New Solend vote invalidates governance decision to take over whale account,"A new governance vote has passed that invalidates yesterday's move, with 99% of the votes supporting the new decision. (Read More...)",50.0,56.81818181818181,0.36649107933044434,72.02,62.78409090909091,0.7973670959472656,2022-06-21
260,CryptoPotato,"BTC Taps $20K, ETH Soars 16% Daily and Reclaims $1K (Market Watch)","The crypto markets have finally seen some relief, with bitcoin jumping above $20,000 and ether reclaiming $1,000. (Read More...)",50.0,50.0,1.234358549118042,73.83500000000001,58.333333333333336,81.03882968425751,2022-06-21
261,Cointelegraph,Synthetix racks up over $1M in daily fees as SNX token value surges 100%,"L2 scaling solution Synthetix collaborated with Curve Finance to create Curve pools for sETH/ETH, sBTC/BTC and sUSD/3CRV, allowing investors to convert synths into tokens. (Read More...)",67.0,50.0,90.22603929042816,76.335,75.0,99.2098718881607,2022-06-21
262,Coinnounce,El Salvador President tells Bitcoin investors to be patience,"After the market crash, a statement is coming from big investors. El Salvador, the country that has adopted it as its official currency for the first time, has broken its silence. President Nayib Bukele has shown his confidence in Bitcoin. This year, the crypto market saw its biggest collapse. Th... (Read More...)",50.0,50.0,0.08953213691711426,15.46,54.37499999999999,0.013688206672668457,2022-06-21
263,U.Today,Arthur Hayes Expecting More Forced Selling,"Bitcoin bulls may not be out of woods just yet, according to former BitMEX CEO Arthur Hayes (Read More...)",24.525000000000002,55.00000000000001,0.01614689826965332,50.0,62.5,11.383864283561707,2022-06-21
264,Cryptomode,"How to Weather the Crypto-Storm: Invest in PAX Gold (PAX), Chiliz (CHZ), and Mushe Token (XMU)","A cryptocurrency price plunge this week has incurred more negative headlines for the cryptoverse. While some crypto projects will inevitably fold under the strain, disappearing without a trace, it is a very different story for those cryptocurrencies with the steely determination and resilience to... (Read More...)",50.0,50.0,13.185632228851318,32.015,56.99999999999999,4.431316256523132,2022-06-21
265,Cryptomode,Cryptocurrency For Beginners: Helium (HNT) And Mehracki (MKI),"The crypto prices have not been this low since December 2020. What is unfolding in the cryptocurrency market, and how can long-term crypto investments be secured? Recently, the cryptosphere has undergone a market crisis. Cryptocurrency markets are notoriously volatile, which means that digital cu... (Read More...)",50.0,50.0,75.16235709190369,20.88,56.25,2.532711625099182,2022-06-21
266,Cryptomode,Three Coins to Keep Your Portfolio Stable Amidst the Crypto Crash,"Today, the cryptocurrency market is gloomy, and for obvious reasons. Bigger coins have witnessed severe price shocks, keeping investors’ portfolios in the red. But this doesn’t always have to be your lot. Coins like the FirepinToken (FRPN), Tezos (XTZ) and KuCuin (KCS) are giving hope to holders.... (Read More...)",43.6,50.0,98.6630231142044,90.36999999999999,56.25,0.09229481220245361,2022-06-21
267,U.Today,Last 3 Days Bring Largest Realized Loss for Bitcoin Investors in History of Cryptocurrency Market,Crypto market faced one of worst weekends in its history (Read More...),34.089999999999996,50.0,0.02982616424560547,18.755,37.5,0.0007152557373046875,2022-06-21
268,Ethereum World News,Dogecoin Soars Despite The Volatile Crypto Market Conditions,"Elon Musk’s tweet has made Dogecoin soar 5% in the last 24 hours Musk had asserted that he will continue to Doge despite volatile market conditions Elon Musk’s tweet has done wonders for Dogecoin, as the meme-inspired crypto has soared 5% in the last 24 hours. The internet’s Dogefather has bought... (Read More...)",50.0,50.0,99.96039569377899,50.0,58.333333333333336,99.85727369785309,2022-06-21
269,Cryptomode,"Gnox (GNOX) Price Jump Earns It A Reputable Place Amongst Top Cryptos Such As Polygon (MATIC), Chainlink (LINK), And Litecoin (LTC)","Gnox (GNOX) has been on a roll lately, and its price jump has earned it a reputable place among top cryptos such as Polygon (MATIC), Chainlink (LINK), and Litecoin (LTC). While Gnox isn’t quite as established as some other top cryptos, it has nonetheless made a name for itself in the space. Gnox ... (Read More...)",60.114999999999995,66.66666666666666,99.98233914375305,69.08999999999999,61.25000000000001,99.99147653579712,2022-06-21
270,Crypto Daily,ChangeHero releases crypto app for iOS,Instant cryptocurrency exchange platform ChangeHero comes to iOS smartphones in the form of a mobile application. The new application comes with quality service of the main platform and new features. App users will enjoy new opportunities: viewing transaction history and saving favorite addresses... (Read More...),50.0,50.0,98.567995429039,91.58,62.34848484848485,99.93318319320679,2022-06-21
271,CoinGape,Here’s When Binance CEO “CZ” Thinks Bitcoin Could Bottom Out,"At a time when crypto analysts and Bitcoin evangelists are trying to predict a bottom, Binance CEO “CZ” has come up with his opinion on Bitcoin’s bottom. He believes Bitcoin (BTC) bottoms out when there are “bitcoin is dead” headlines. So, historically anyone who bought Bitcoin when there was suc... (Read More...)",50.0,50.0,0.11188387870788574,50.0,55.00000000000001,0.41379034519195557,2022-06-21
272,Coinnounce,Bitcoin recovers above US$20K after a weekend slump,"The world’s biggest and best-known cryptocurrency, Bitcoin, recovers 7.6% to pass $20,400 after hitting its lowest price since November 2020. Bitcoin (BTC) fell below the $18,500 price level for the first time Saturday, now perched back over $20k to $20,580 a coin, a 16.9%gain off its Saturday lo... (Read More...)",50.0,50.0,0.4938393831253052,30.910000000000004,62.5,0.38301944732666016,2022-06-21
273,CoinTelegraph,'Worst quarter ever' for stocks — 5 things to know in Bitcoin this week,"Bitcoin manages a weekly close above $20,000, but the market is on a knife edge — can miners hold out this week? (Read More...)",18.755,0.0,0.0005900859832763672,50.0,62.5,1.00477933883667,2022-06-21
274,NewsBTC,"Bitcoin Climbs Back Above $20K, A Bit Of A Relief To The Sinking Crypto Market","Bitcoin reached a new 18-month low of $17.5K on Sunday before quickly recovering above $20K in the hours that followed, providing some breather to the heavily stressed out bear market. According to data from CoinMarketCap, Bitcoin has rebounded by little over 15 percent in the last 24 hours, risi... (Read More...)",73.83500000000001,50.0,0.6415247917175293,26.165,53.63873106060606,84.2344731092453,2022-06-21
275,Crypto Daily,The Metaverse Founders Club Aims to Unlock Cross-Metaverse Building And Interactivity,Cross-metaverse interoperability is one o the crucial frontiers of Web3 development. Metametaverse and Anitya.space will join forces to achieve this goal through the Metaverse Founders Club. It is a crucial step forward for metaverse-oriented development and the broader blockchain industry. The M... (Read More...),50.0,50.0,99.872687458992,64.8,58.333333333333336,99.98761713504791,2022-06-21
276,Cointelegraph,Solend invalidates Solana whale wallet takeover plan with second governance vote,"If Solend is unable to take over the account, some believe that it could cause a meltdown, driving Solana’s price to zero. (Read More...)",50.0,50.0,0.742676854133606,50.0,50.0,0.4569411277770996,2022-06-21
277,The Block,Celsius says it’s determined to find a resolution a week after halting withdrawals,"The crypto lending firm froze withdrawals and paused transfers between accounts on June 12, citing 'extreme market conditions.' (Read More...)",67.0,50.0,0.45176148414611816,50.0,52.916666666666664,0.014972686767578125,2022-06-21
278,Bitcoin.com,Meta Launches Metaverse Digital Clothing Store,Meta announced that it was launching a designer digital clothing store that will allow users to purchase pieces of clothing for their avatars in its metaverse. The company believes that clothing and other accessories will become an important part of the users’ identity expression and that this wi... (Read More...),50.0,50.0,1.5919476747512817,70.095,59.68750000000001,9.227699041366577,2022-06-21
279,BeInCrypto,El Salvador’s President Urges Bitcoin Investors to Be Patient,El Salvador's president has attempted to inject a little hopium into the battered crypto community following another weekend of heavy losses. The post El Salvador’s President Urges Bitcoin Investors to Be Patient appeared first on BeInCrypto. (Read More...),50.0,50.0,0.05799829959869385,29.905000000000005,53.625,0.006848573684692383,2022-06-21
280,Crypto Daily,New Blockchain Reports Almost 100% Lower Energy Usage Than Bitcoin,"Blockchain has disrupted not only the traditional financial system but also international trade, commerce, and supply chain management industries with its innovative ways to maintain a secure and decentralised record of transactions and build trust among users without a trusted intermediary. Alth... (Read More...)",48.9,56.81818181818181,0.02696216106414795,92.15,60.0,18.687111139297485,2022-06-21
281,CryptoPotato,"Celsius Network Pauses AMAs and Twitter Spaces, Wants More Time to Find a Solution","While the crypto community anticipates a solution from Celsius Network, the team said it will pause AMAs and Twitter Spaces. (Read More...)",65.91,67.5,0.0005304813385009766,65.91,75.0,0.015056133270263672,2022-06-21
282,CoinGape,"As USDD Depeg Deepens, What Is Justin Sun’s Plan?","The Tron ecosystem had a major blow last week when the USDD stablecoin lost its $1 peg. This led to concerns among traders as USDD was launched last month as a rival to Terra’s UST, an algorithmic stablecoin. Another depegging of a similar asset also meant that TRX’s price also dropped for a bit ... (Read More...)",50.0,50.0,0.35320818424224854,58.894999999999996,55.625,0.00514984130859375,2022-06-21
283,The Daily Hodl,"Bitcoin (BTC) Will Whipsaw Traders to $100,000 This Year, Says Blockstream CEO Adam Back – Here’s How","The chief executive officer of blockchain technology company Blockstream says that leading digital asset Bitcoin (BTC) could see a 5x increase in price by the end of the year. Adam Back tells his 481,600 Twitter followers that he expects the U.S. Federal Reserve to reverse its tight monetary poli... (Read More...)",50.0,50.0,0.9918123483657837,79.295,54.01785714285714,0.019744038581848145,2022-06-21
284,CoinGape,FTX CEO Blames Federal Reserve For This Crypto Crash,"According to the crypto billionaire Sam Bankman, the core reason for this crypto downturn has been the Federal Reserve. The Fed has aggressively raised interest rates to fight inflation. (Read More...)",17.015,50.0,0.04246830940246582,38.685,75.0,0.01767873764038086,2022-06-21
285,AMBCrypto,Assessing the state of SOL after Solana’s latest ‘real solutions’ release,"Solana Labs has released its latest upgrade on the network. The network upgrade has been well received by many in the community. Interestingly, despite the ongoing market correction, Solana [SOL] has managed to stay afloat as far as general price movement is concerned. However, several questions ... (Read More...)",50.0,67.5,99.90289509296417,79.295,63.4375,99.7926115989685,2022-06-21
286,Chain Debrief,NFT.NYC: All You Need To Know About The Most Anticipated NFT Event In 2022,"“Diversity Of NFTS” NFT.NYC started off as a small group of meetings in 2019 and it is now the leading NFT conference in the world. The fourth annual NFT.NYC 2022 welcomes more than 1,500 crypto experts to speak on NFT gaming, film, music, blockchain technology, and more. “NFT.NYC is the Superbow... (Read More...)",50.0,75.0,91.46596491336823,70.095,62.5,99.93974566459656,2022-06-21
287,CoinTelegraph,Marathon Digital keeps on mining despite BTC price slump,"Earlier this month, Marathon said it has been accumulating or “hodling” its Bitcoin since October 2020. As of June 1, 2022, the firm held approximately 9,941 BTC. (Read More...)",50.0,50.0,85.28929352760315,50.0,48.75,0.1652240753173828,2022-06-21
288,Quartz,The global crash has come as a double whammy for India’s crypto industry,India's cryptocurrency ecosystem has witnessed a 90% drop in trade volumes since March. (Read More...),29.905000000000005,50.0,21.11853063106537,36.34,75.0,0.10877251625061035,2022-06-21
289,Coinnounce,Elon Musk claims he will still buy DOGECOIN,"Billionaire Elon Musk admits that he will continue to support Dogecoin despite the declining cryptocurrency market. After tweeting on Twitter that “he will keep supporting Dogecoin,” the popular cryptos price spiked 8% to $0.058 on Monday. I will keep supporting Dogecoin — Elon Musk (@elonmusk) J... (Read More...)",50.0,50.0,9.061333537101746,95.5,70.0,4.3245285749435425,2022-06-21
290,Cointelegraph,"Nifty News: Christie’s NFT expert to lead CryptoPunks, fake heiress launches NFT collection","Noah Davis, the NFT expert for the auction house Christie’s, said he’s not looking to change the plan for CryptoPunks when he leads the project and has invited holders to a one-on-one chat. (Read More...)",44.865,25.0,99.71711039543152,50.0,75.0,11.191549897193909,2022-06-21
291,U.Today,Circle’s USDC Flips Tether’s USDT in Daily Transaction on Ethereum,USDT has surpassed Ethereum-based USDT by the number of transactions (Read More...),50.0,50.0,11.802938580513,53.86,75.0,99.8652696609497,2022-06-21
292,CoinGape,"Celsius To “Pause” Twitter Spaces, When Will Withdrawals Resume?","Crypto lender Celsius said on Monday it is “pausing” its Twitter and Reddit spaces to focus on its debt restructuring, as withdrawals remain suspended. The lender said in a blog post that it is in open dialogue with regulators and officials over when it could possibly resume withdrawals. On that ... (Read More...)",50.0,50.0,0.004953145980834961,15.960000000000003,58.333333333333336,0.12865960597991943,2022-06-21
293,CryptoGlobe,Bill Gates on BAYC: ‘Expensive Digital Images of Monkeys’ Will ‘Improve the World Immensely’,"Microsoft Co-Founder Bill Gates, who is — according to Forbes — currently the world’s fourth richest person with an estimated fortune (as of 20 June 2022) of $121 billion, does not seem to be able to see the attraction of non-fungible tokens (NFTs), such as the very popular Bored Ape Yacht Club (... (Read More...)",50.0,41.66666666666667,18.30688714981079,89.86000000000001,59.14285714285714,0.004303455352783203,2022-06-21
294,Forkast,Bitcoin investments will grow ‘immensely’: El Salvador president,"El Salvador President Nayib Bukele took to Twitter on Sunday to reassure Bitcoin investors, claiming such investments are safe and will grow “immensely” after the bear market. See related article: El Salvador’s Bitcoin adoption, one week on Fast facts “My advice: stop looking at the graph and enj... (Read More...)",50.0,50.0,99.63244497776031,73.83500000000001,60.0,0.41300058364868164,2022-06-21
295,CoinGape,Bitcoin (BTC) Long-Term Holders Are Finally Giving Up: Report,"The world’s largest cryptocurrency Bitcoin witnessed another major weekend of a bloodbath as the BTC price took a dive under $18,000 for the first time. There have been major liquidations taking place with long-term Bitcoin holders dropping the towel and giving up. As per on-chain data Glassnode,... (Read More...)",67.0,50.0,0.025284290313720703,67.0,60.9375,0.0032186508178710938,2022-06-21
296,Cointelegraph,SBF and Alameda step in to prevent crypto collapse contagion,"SBF also rejected rumors that Alameda played a part in jeopardizing the stability of Celsius, noting that “this is definitely false. We want to help those we can in the ecosystem, and have no interest in hurting them.” (Read More...)",13.655000000000001,50.0,99.94850754737854,72.02,52.5,0.34173429012298584,2022-06-21
297,NewsBTC,TA: Ethereum Recovery Could Gain Pace If It Clears This Resistance,"Ethereum dived towards the $880 support against the US Dollar. ETH is recovering and eyeing an upside break above the $1,150 resistance zone. Ethereum started a decent recovery wave from the $880 support zone. The price is now trading above $1,000 and the 100 hourly simple moving average. There w... (Read More...)",78.595,50.0,7.443919777870178,82.985,54.30555555555555,0.0671088695526123,2022-06-21
298,BeInCrypto,OKX Continues Hiring But BitOasis to Cut Jobs; Crypto Industry’s Disjointed Reactions to Market Turmoil,"OKX announced that it will 'continue to hire top talent,' while BitOasis has stated that it has laid off nine staffers owing to the market downturn. The post OKX Continues Hiring But BitOasis to Cut Jobs; Crypto Industry’s Disjointed Reactions to Market Turmoil appeared first on BeInCrypto. (Read More...)",8.31,50.0,0.04226565361022949,9.244999999999997,70.83333333333334,0.003945827484130859,2022-06-21
299,Bitcoin.com,McKinsey: The Metaverse Could Generate $5 Trillion by 2030 — ‘Simply Too Big to Be Ignored’,"Global consulting firm McKinsey &amp; Company has forecasted that the metaverse may generate up to $5 trillion by 2030. In addition, more than 80% of commerce could be impacted by activities in the metaverse. Metaverse Could Generate $5 Trillion by 2030 Global management consulting firm McKinsey ... (Read More...)",50.0,50.0,12.631595134735107,50.0,55.00000000000001,1.641508936882019,2022-06-21
300,CoinGape,Solana-based lending Platform Solend Steps Back from Controlling the Whale Account,"The broader crypto lending and the staking markets have been undergoing one of the worst crises in history amid a wave of liquidations recently. On Sunday, Solana-based “decentralized” lending platform Solend initiated an SNLD1 proposal to take over a whale account with emergency powers and avoid... (Read More...)",50.0,50.0,0.22811591625213623,11.414999999999997,41.66666666666667,0.014057755470275879,2022-06-21
301,BeInCrypto,Russia Develops Blockchain System to Replace Swift,Russia seems to be getting around the Swift ban using blockchain tech. (Read More...),60.114999999999995,50.0,97.87245392799377,28.925,75.0,0.23047924041748047,2022-06-21
302,CoinGape,Canada’s Purpose Bitcoin (BTC) ETF Liquidates 50% Holding In A Single Day,"Over the last weekend, Bitcoin (BTC) witnessed heavy selling as the BTC price took a dive all the way to $18,000. Since then, Bitcoin has recovered by more than 10% and is currently flirting around the $20,000 level. Citing data from Coinglass, Arthur Hayes, co-founder of crypto exchange 100x wri... (Read More...)",50.0,46.42857142857143,0.16117990016937256,60.114999999999995,57.99999999999999,0.010254979133605957,2022-06-21
303,BeInCrypto,Tether Market Cap Slashed by More Than $10B in May,Tether market capitalization was slashed by more than $10 billion in May due to the market crash that was led by the failure of UST of the Terra ecosystem. (Read More...),38.685,75.0,0.014960765838623047,10.775000000000002,56.97916666666667,0.020518898963928223,2022-06-21
304,CoinTelegraph,Celsius recovery plan proposed amid community-led short-squeeze attempt,BnkToTheFuture co-founder Simon Dixon has proposed a recovery plan similar to the solution offered to Bitfinex after its Bitcoin hack in August 2016 – allowing customers to be compensated for their losses through tokens tied to the platform’s recovery. (Read More...),50.0,50.0,0.17722249031066895,44.865,62.5,10.351219773292542,2022-06-21
305,Forkast,S. Korea’s 20% crypto tax delayed by two more years,"South Korea is delaying its planned crypto tax on digital assets for another two years, Ministry of Economy and Finance tax policy chief Ko Kwang-hyo announced on Thursday. See related article: S.Korea finance minister nominee wants to delay crypto tax for two years Fast facts A 20% tax on crypto... (Read More...)",38.685,75.0,0.2490997314453125,42.345,59.0,0.10496973991394043,2022-06-21
306,Forkast.News,Elon Musk pumps Dogecoin amid lawsuit,"Dogecoin (DOGE) has gained 11% since billionaire Elon Musk said that he would continue to support and buy the cryptocurrency. See related article: Bitcoin, crypto return to red after rate hike rally wears off Fast facts According to CoinMarketCap data, the memecoin was up more than 12% in the pas... (Read More...)",38.685,50.0,4.068639874458313,82.43,62.0,0.0885993242263794,2022-06-21
307,AMBCrypto,"Musk speaks for Dogecoin [DOGE] again, but is that enough for push to 10 cents","The DOGEfather is back to pushing the memecoin up again after weeks of bearishness. Reassuring the community recently, Elon Musk tweeted his support for Dogecoin. As expected, the same triggered bullishness for DOGE. DOGE-y takes a leap Trading at $0.05 or 5 cents, DOGE hasn’t shown a lot of prom... (Read More...)",50.0,50.0,0.18709301948547363,82.985,54.0,0.015550851821899414,2022-06-21
308,NewsBTC,"TA: Bitcoin Recovery Stalls Near Key Juncture, Key Resistance Intact","Bitcoin started an upside correction from the $17,600 zone against the US Dollar. BTC is now facing a strong resistance near $20,500 and $21,000. Bitcoin was able to recover losses from the $17,600 support zone. The price is now still below the $20,000 level and the 100 hourly simple moving avera... (Read More...)",60.114999999999995,51.66666666666667,0.009045004844665527,75.53,65.33333333333333,0.12049674987792969,2022-06-21
309,Forkast,JD.com tops US$60 mln in digital yuan sales in 618 shopping festival,"Chinese online retail platform JD.com reported 400 million yuan (US$60 million) in digital yuan sales at the “618” shopping festival, accounting for about 1% of the event’s total sales. See related article: Double Eleven: 240,000 orders by e-CNY on top e-commerce platform Fast facts China’s centr... (Read More...)",87.895,50.0,99.61446821689606,80.62,57.49999999999999,2.201804518699646,2022-06-21
310,Forkast,"Binance didn’t buy US$2B worth of Bitcoin, founder Changpeng Zhao says","Binance did not buy US$2 billion worth of Bitcoin as reported by media over the weekend, its founder and chief executive officer Changpeng Zhao said on Monday in a tweet. See related article: Bitcoin recovers above US$20K after weekend slump Fast facts At least two news sites reported that Binanc... (Read More...)",61.315,65.0,0.012895464897155762,61.315,55.833333333333336,0.006073713302612305,2022-06-21
311,CoinGape,Litecoin Price Analysis: Reversal Pattern May Push LTC Price Beyond $60,"The multiple lower price rejection candles reflected the failed attempts from sellers to break the $40 psychological support. However, the price action hovering above the $40 mark shaped into a double bottom pattern, whose breakout indicates a recovery opportunity for Litecoin(LTC) holders. Key p... (Read More...)",50.0,50.0,4.112446308135986,22.884999999999998,50.625,0.0834733247756958,2022-06-21
312,BeInCrypto,Crypto Miners in Iran to Face Blackout as Mining Becomes Unprofitable,Authorities in Iran have announced that crypto miners operating in the country would have their access to electricity cut off by June 22. The post Crypto Miners in Iran to Face Blackout as Mining Becomes Unprofitable appeared first on BeInCrypto. (Read More...),50.0,50.0,0.06774365901947021,36.34,68.75,0.002205371856689453,2022-06-21
313,BeInCrypto,Elon Musk Buys DOGE Despite Its Crashing Price and the Crypto Winter,"Elon Musk admits that he will continue to support the Dogecoin project, despite the crypto market being in a widespread decline. (Read More...)",50.0,50.0,93.2932436466217,79.97000000000001,75.0,99.4606763124466,2022-06-21
314,Chain Debrief,🏊‍♂️ Is this the bottom? 📉,"Hey Chain Debrief Community, What a crazy week! The crypto market took a nosedive and we are seeing blood everywhere. Both BTC and ETH is down bad with BTC hitting the US$20,000 range and ETH touching a low of US$1,074. The market downturn was triggered by two major incidents. The first trigger w... (Read More...)",50.0,50.0,0.03578364849090576,9.649999999999997,48.16840277777778,0.12737810611724854,2022-06-21
