,source,title,excerpt,vader_sentiment_title,tb_sentiment_title,flair_sentiment_title,vader_sentiment_excerpt,tb_sentiment_excerpt,flair_sentiment_excerpt,date
126,Blockworks,Want an Innovative Crypto Future? It Takes Regulation.,Protecting users and investors — while taking actions to guarantee financial stability — can only help Web3’s long-term viability The post Want an Innovative Crypto Future? It Takes Regulation. appeared first on Blockworks. (Read More...),74.695,62.5,0.08336007595062256,89.225,60.416666666666664,0.37286877632141113,2022-10-06
127,Cointelegraph,South Carolina treasurer goes on Bitcoin 'fact-finding trip' to El Salvador,"The state official reportedly used his own funds to pay for the trip, which included discussing Bitcoin with government officials and exploring financial literacy programs. (Read More...)",56.400000000000006,50.0,0.18818676471710205,44.865,68.33333333333333,0.3514975309371948,2022-10-06
128,NewsBTC,"Bitcoin Bulls Snap Back With The Bollinger Bands | BTCUSD Analysis October 5, 2022","In this episode of NewsBTC’s daily technical analysis videos, we look at the latest move up in Bitcoin price using the Bollinger Bands across a variety of timeframes and explain why a close above the upper band could lead to a larger move to the upside. Take a look at the video below: VIDEO: Bitc... (Read More...)",50.0,50.0,0.13270676136016846,50.0,57.14285714285714,4.932832717895508,2022-10-06
129,U.Today,Shiba Inu Team Hypes Up New Collectible Card Game,Shiba Inu’s much-anticipated game is on track to be released tomorrow (Read More...),50.0,37.272727272727266,96.20456099510193,50.0,52.5,99.72050487995148,2022-10-06
130,U.Today,Shiba Inu Team Hypes Up New Collectible Card Game,Shiba Inu’s much-anticipated game is on track to be released tomorrow (Read More...),50.0,37.272727272727266,96.20456099510193,50.0,52.5,99.72050487995148,2022-10-06
131,CryptoSlate,DeFiYield REKT list reveals 18% decrease in lost DeFi funds during September totaling $170M,"DefiYield, the DeFi investing and yield farming platform, tracks exploited projects across the DeFi ecosystem through its REKT database. (Read More...)",34.089999999999996,50.0,0.038999319076538086,27.060000000000002,75.0,96.69150412082672,2022-10-06
132,BeInCrypto,US Job Openings Plummet- What Does It Mean for Bitcoin?,The number of new job openings in the US markets decreased by 6.2%. What is in store for the U.S. markets and Bitcoin? The post US Job Openings Plummet- What Does It Mean for Bitcoin? appeared first on BeInCrypto. (Read More...),50.0,34.375,0.04158616065979004,58.4,51.73863636363636,0.00826716423034668,2022-10-06
133,Bitcoin.com,Bitcoin’s Total Network Hashrate Hits an All-Time High at 321 Exahash per Second,"According to statistics on October 5, the total computational power backing the Bitcoin network tapped a fresh all-time high reaching 321.15 exahash per second (EH/s). Just after the record high, the network’s total hashrate was coasting along above the 300 EH/s on Wednesday afternoon (ET) at aro... (Read More...)",50.0,52.666666666666664,93.89022588729858,74.695,57.00000000000001,1.3584554195404053,2022-10-06
134,The Daily Hodl,Mastercard Launches New Crypto Fraud Prevention Service for Banking Institutions: Report,"Financial services giant Mastercard is launching a software tool aimed at assisting banks in identifying and preventing fraudulent transactions emanating from crypto exchanges. According to a new CNBC report, the Crypto Secure software uses artificial intelligence to build a risk profile for cryp... (Read More...)",20.705000000000002,56.81818181818181,95.53330838680267,51.29,53.63636363636364,8.531025052070618,2022-10-06
135,The Daily Hodl,Coinbase CEO Brian Armstrong Announces Soon-To-Be-Released Documentary About Crypto Exchange Giant,"A new documentary about crypto exchange Coinbase and the digital assets industry will be released on popular video streaming platforms on Friday. Coinbase chief executive Brian Armstrong says that over the last three years, the company has been working with 10-time Emmy award-winning director Gre... (Read More...)",50.0,50.0,0.5181342363357544,77.115,60.303030303030305,98.1862485408783,2022-10-06
136,Decrypt,Russia Blocks Access to Crypto Exchange OKX,The move continues Russia's history of mixed signals on crypto. (Read More...),38.685,50.0,0.010034441947937012,50.0,62.5,99.94832873344421,2022-10-06
137,AMBCrypto,These Bitcoin observations suggest that a range change might be…,"Bitcoin [BTC] is back above $20,000 once again but this time there is a notable lack of enthusiasm about it. This is because the cryptocurrency had been bouncing back and forth between the $17,000 to $22,000 range. The king coin has been shuffling within the same range for the last few weeks. BTC... (Read More...)",50.0,50.0,11.37290894985199,61.315,55.00000000000001,0.0003159046173095703,2022-10-06
138,U.Today,Leading Cardano DEX Just Performed Major Upgrade,"MuesliSwap, the first decentralized exchange on the Cardano blockchain, has dramatically improved its efficiency with a new upgrade (Read More...)",50.0,53.125,93.05404424667358,84.04,64.77272727272727,99.92073774337769,2022-10-06
139,BeInCrypto,Are Monero Developers Behind the Latest Zcash Attack?,An unidentified spammer has wreaked havoc with Zcash node operators by filling transaction blocks with myriad shielded transaction outputs. The post Are Monero Developers Behind the Latest Zcash Attack? appeared first on BeInCrypto. (Read More...),26.165,52.5,0.00858306884765625,4.89,60.62499999999999,0.009778141975402832,2022-10-06
140,CryptoPotato,A 10-Year Macro Tailwind: The Long-Term Bull Case for Bitcoin (Opinion),"Bitcoin has traded range-bound for over a quarter now. Hovering between key support and resistance around the important $20,000 level, investors would like to know what's next, a rally or another sell-off? (Read More...)",50.0,50.0,17.575743794441223,85.92,61.25000000000001,0.09533464908599854,2022-10-06
141,NewsBTC,XRP Price Could Get A 23% Boost From This Bullish Formation Breakout,"XRP is looking good, as Ripple once again scores a procedural victory in its lawsuit battle against the U.S. Securities and Exchange Commission (SEC) that has been ongoing for almost two years now. XRP gains another key victory in its ongoing legal battle with SEC Altcoin is up by 8.5% for the pa... (Read More...)",70.095,50.0,3.819289803504944,61.315,60.0,97.74122536182404,2022-10-06
142,The Block,Circle removed $9 billion from USDC supply in the last three months,The stablecoin issuer has burned $9 billion worth of USD Coin (USDC) from its total supply in the last three months. (Read More...),50.0,50.0,0.5172550678253174,61.315,60.0,0.0022172927856445312,2022-10-06
143,Bitcoinist,Why Bitcoin Miner Revenues Are The Biggest Bear Market Loser,"Data shows the Bitcoin miner revenues have plunged down by around 81% since the October peak, here’s why. Bitcoin Miner Revenues Have Lost Big During Bear Market According to the latest weekly report from Arcane Research, the BTC miners’ hashprice is now just down to $0.077 per TH/s. The relevant... (Read More...)",23.665000000000003,50.0,0.00489354133605957,34.089999999999996,59.074074074074076,0.004136562347412109,2022-10-06
144,Cointelegraph,Will bulls take charge now that Bitcoin price trades above a long term trendline resistance?,"Bitcoin bulls celebrated BTC’s push through a long term trendline resistance, but has anything actually changed? (Read More...)",50.0,48.75,0.18745362758636475,66.455,60.0,0.04401504993438721,2022-10-06
145,The Daily Hodl,"$4,500,000,000,000 Asset Management Giant Fidelity Begins Sales for New Ethereum (ETH) Index Fund","One of the largest financial services giants in the world has begun offering exposure to Ethereum through a new ETH index fund. According to a recent filing with the U.S. Securities and Exchange Commission (SEC), Fidelity, a firm with over $4.5 trillion in assets under management, is launching to... (Read More...)",68.06,53.40909090909091,98.23441803455353,72.02,52.803030303030305,17.92227327823639,2022-10-06
146,CoinTelegraph,"Warner Music Group partners with OpenSea: Nifty Newsletter, Sept 28–Oct 4",Tennis legend Maria Sharapova sat down with Cointelegraph senior reporter Rachel Wolfson at the Binance Blockchain Week in France. (Read More...),70.095,50.0,95.36436200141907,50.0,58.611111111111114,16.444680094718933,2022-10-06
147,The Daily Hodl,"Digital Asset Firm NYDIG Raises Over $719,000,000 From Dozens of Institutional Investors Despite Crypto Winter","The Bitcoin (BTC) investment firm NYDIG says it raised nearly $720 million for its profitable company, despite the bear market. According to a new filing with the United States Securities and Exchange (SEC), NYDIG raised $719,990,866 in funds from 59 different unnamed investors for its registered... (Read More...)",68.06,45.0,86.61890029907227,89.225,53.63636363636364,0.6814509630203247,2022-10-06
148,The Daily Hodl,"Digital Asset Firm NYDIG Raises Over $719,000,000 From Dozens of Institutional Investors Despite Crypto Winter","The Bitcoin (BTC) investment firm NYDIG says it raised nearly $720 million for its profitable company, despite the bear market. According to a new filing with the United States Securities and Exchange (SEC), NYDIG raised $719,990,866 in funds from 59 different unnamed investors for its registered... (Read More...)",68.06,45.0,86.61890029907227,89.225,53.63636363636364,0.6814509630203247,2022-10-06
149,The Daily Hodl,Bankrupt Crypto Lender Celsius Co-Founder Resigns Days After Alex Mashinsky: Report,"Another top executive of crypto lender Celsius Network has reportedly decided to leave his post following the resignation of the embattled company’s former CEO, Alex Mashinsky. Bloomberg reports that Celsius co-founder and chief strategy officer Daniel Leon stepped down this week just days after ... (Read More...)",14.52,50.0,0.025278329849243164,42.345,58.44444444444444,0.10017454624176025,2022-10-06
150,ZyCrypto,"SEC Seemingly Fears Ripple’s ‘Gigantic Win’ In XRP Suit, Takes Shot At Firms Supporting Ripple",The U.S. Securities and Exchange Commission (SEC) has opposed efforts by two firms to submit amici briefs to court in support of Ripple in the drawn-out $1.3bn XRP securities lawsuit. (Read More...),51.29,65.83333333333333,0.4650980234146118,81.845,60.0,2.4481743574142456,2022-10-06
151,Cryptomode,Crypto arbitrage: how to make money?,"Cryptocurrency is the hottest thing in finance, and it’s not likely to be cooling off anytime soon. But for those who aren’t traders by trade, there are still ways to make money from cryptocurrency by other means. For example, many beginners have turned a profit through crypto arbitrage—buying lo... (Read More...)",50.0,50.0,0.352439284324646,79.635,60.9375,99.29696321487427,2022-10-06
152,AMBCrypto,Polkadot: How soon can traders expect DOT to go up in Q4,"Polkadot [DOT] has been in the headlines for all the right reasons in the last few weeks. The updates regarding the partnerships and collaborations have played in favor of the blockchain. Thus, inviting investors’ interest. The latest integration was the launch of the KILT Protocol on the Polkado... (Read More...)",50.0,50.0,76.20536088943481,92.775,60.857142857142854,98.97381961345673,2022-10-06
153,Trustnodes,The Dawn of Energy Diplomacy: Can US Take on the Russia-Saudi Oil Alliance?,"OPEC has surprised by deciding to cut production by two million barrels. Can EU, US and China take them on? (Read More...)",63.660000000000004,50.0,99.18835759162903,47.42,65.0,2.1147549152374268,2022-10-06
154,CoinTelegraph,Russia blocks OKX website for alleged unreliable financial information: Reports,"The cryptocurrency exchange’s website was said to contain information about pyramid schemes, although no details were given; similar bans have been imposed before. (Read More...)",38.685,47.5,0.044408440589904785,31.94,62.5,0.014594197273254395,2022-10-06
155,The Daily Hodl,"Bitcoin, Ethereum and Altcoins Are About To Outperform Most Major Asset Classes, According to Bloomberg Analysts","Commodity analysts from Bloomberg say that crypto assets are gearing up to outperform the rest of the financial markets. In the latest Bloomberg Intelligence: Crypto Outlook report, analysts Mike McGlone and Jamie Douglas Coutts argue that Bitcoin (BTC), Ethereum (ETH), and altcoins within the Bl... (Read More...)",70.865,64.0625,3.0470728874206543,67.0,66.66666666666666,82.84679055213928,2022-10-06
156,Bitcoin.com,Yuga Labs Launches Bored Ape and Mutant Ape Yacht Club Community Council,The non-fungible token (NFT) and blockchain firm Yuga Labs has announced a community council will be representatives of the Bored Ape Yacht Club (BAYC) and Mutant Ape Yacht Club (MAYC) NFT collections. Yuga Labs has chosen seven community members with “a proven track record” to represent the NFT ... (Read More...),36.34,25.0,7.9891204833984375,36.34,46.666666666666664,99.37134385108948,2022-10-06
157,The Block,"Despite call for Congress to act, new crypto laws look unlikely this year",Cryptocurrency advocates and regulators can agree on one thing: Congress should pass new laws for crypto. Whether Congress can agree on what those laws look like remains to be seen. (Read More...),50.0,40.90909090909091,10.832691192626953,87.895,65.9090909090909,3.165498375892639,2022-10-06
158,BeInCrypto,"Polkadot (DOT) and Kusama (KSM) Fall to Historic Lows, but Increase Decentralization","Despite the bearish price action, the Polkadot (DOT) network continues to grow rapidly. Today, data was published on staking improvements and the so-called Nakamoto coefficient. The latter measures the level of blockchain decentralization, which remains higher in Polkadot than in Ethereum (ETH), ... (Read More...)",68.58,50.0,95.6546425819397,65.91,60.62499999999999,99.13177490234375,2022-10-06
159,Cryptonews,Bitcoin Billionaire Michael Saylor Gets Into Twitter Spat with Gold Bug Peter Schiff,"Bitcoin (BTC) bull and former IT firm MicroStrategy CEO Michael Saylor got into a bit of an argument with the arch-bitcoin skeptic Peter Schiff on Twitter on Monday over the former’s support for the world’s number one crypto. Schiff has become infamous in the world of crypto Twitter, where he reg... (Read More...)",50.0,50.0,0.027450919151306152,44.865,48.0,0.027123093605041504,2022-10-06
160,Crypto Daily,Top analyst says Flasko (FLSK) could be best investment in 2022 over Monero (XMR) and Solana (SOL),"As a novice, you were undoubtedly taught that starting a crypto portfolio is as simple as engaging in your first Ethereum or Bitcoin buy. But, as time passed, we all understood how false that was. One of the most important aspects to consider when developing a crypto portfolio is asset allocation... (Read More...)",85.92,87.5,6.367245316505432,88.21,60.3125,0.028279423713684082,2022-10-06
161,Decrypt,Three Arrows’ CryptoPunks and Other 'Starry Night' Ethereum NFTs Set to Be Liquidated,"The Starry Night Capital NFT fund is now in the hands of liquidators, which plan to sell off the assets to cover Three Arrows’ obligations. (Read More...)",50.0,43.75,0.00680088996887207,58.894999999999996,75.0,0.03864169120788574,2022-10-06
162,Use The Bitcoin,Crypto Rand: Crypto Purchases Could be Possibly Enabled on Twitter,"Could Twitter enable crypto purchases? According to Crypto Rand, there is a large possibility of this happening. In a recent tweet, the Investment Group shared a list of […] (Read More...)",50.0,50.0,1.7180472612380981,67.0,61.904761904761905,0.019374489784240723,2022-10-06
163,AMBCrypto,Blockchain Associations Forum asks Nigeria to review anti-crypto directive,The Blockchain Technology Association of Nigeria (SiBAN) has urged the Central Bank of Nigeria (CBN) to reconsider its current anti-crypto policy that restricts commercial banks and other financial institutions from processing crypto-related transactions. SiBAN is a founding member of Blockchain ... (Read More...),50.0,50.0,16.82608425617218,34.089999999999996,53.125,19.62084472179413,2022-10-06
164,BeInCrypto,Terra LUNA Do Kwon Lashes out at Fake Reports About Frozen Funds,Korean prosecutors have reportedly frozen $40 million of funds Kwon had attempted to conceal on crypto exchanges KuCoin and OKX. The post Terra LUNA Do Kwon Lashes out at Fake Reports About Frozen Funds appeared first on BeInCrypto. (Read More...),26.165,25.0,0.0386655330657959,26.165,54.166666666666664,0.02079308032989502,2022-10-06
165,Crypto Daily,Solana (SOL) and Dogecoin (DOGE) investors rush to buy the remaining tokens in Flasko (FLSK) presale,"Investors should look for cheap cryptocurrency projects that will rebound when the market cycle shifts to get the most out of their portfolios. To uncover these initiatives, investors must spend a lot of time exploring and investigating crypto ideas. Solana (SOL), Dogecoin (DOGE), and Flasko are ... (Read More...)",50.0,50.0,2.6615500450134277,50.0,73.33333333333333,90.72951674461365,2022-10-06
166,Crypto Daily,MEGATECH AIMS TO KEEP THE LIGHTS ON IN MILLIONS SOUTH AFRICAN HOMES BY 2024.,"The energy crisis in South Africa has been a long-standing issue, however, it is currently at its worst. The country is now facing a severe energy crisis; widespread national-level blackouts become more frequent as electricity supply falls behind electricity demand, threatening to destabilize the... (Read More...)",50.0,50.0,99.32589828968048,2.5749999999999993,47.5,0.020328164100646973,2022-10-06
167,Protos.com,Five ridiculous claims from the latest SafeMoon court battle,The ongoing court case between John Karony and his mother is just the latest crazy controversy to hit SafeMoon since its 2021 inception. (Read More...),18.755,54.166666666666664,0.265735387802124,32.99999999999999,56.666666666666664,1.0811001062393188,2022-10-06
168,Crypto Daily,European Council Passes Markets in Crypto Assets Regulation,"The European Union (EU) today agreed on the full text of its landmark Markets in Crypto Assets (MiCA) Regulation, along with an additional law to reveal the identity of persons making cryptocurrency payments. The EU’s landmark MiCA regulation passed in the European Council on Wednesday morning. T... (Read More...)",58.894999999999996,50.0,6.849411129951477,76.335,60.62499999999999,88.22965919971466,2022-10-06
169,CryptoSlate,"SWIFT shows CBDCs, tokenized assets can be integrated into global financial system",Global financial messaging provider SWIFT has developed an infrastructure to facilitate the integration of different central bank digital currencies (CBDCs) and tokenized assets into the global financial system. (Read More...),74.97500000000001,50.0,99.84473586082458,74.97500000000001,53.333333333333336,99.9100387096405,2022-10-06
170,CryptoPotato,Leading Asset Manager Fidelity Introduces $5 Million Ethereum Index Fund,"Ever since the first sales began on September 26, Fidelity Ethereum Index Fund raised about $5 million. (Read More...)",68.06,50.0,99.70282316207886,50.0,68.75,88.19257616996765,2022-10-06
171,CoinTelegraph,Bitcoin derivatives data reflects traders’ belief that $20K will become support,"Declining interest in margin shorts and a balanced risk perception in options markets highlight a possible path to $21,500 for BTC price. (Read More...)",70.095,50.0,2.0763248205184937,75.53,62.5,0.6096690893173218,2022-10-06
172,NewsBTC,Solana Spikes 4% After Recent Recurring Glitches – A Little Shine For SOL?,"There has been some criticism about Solana since it was established in March of 2020. Through a thread he created, Cyber Capital founder Justin Bons exposed the network’s recent “anomalies.” and how it violated decentralization in the sense of DeFi. The native token of the network had a bullish p... (Read More...)",50.0,45.3125,24.324488639831543,15.960000000000003,62.5,0.0007510185241699219,2022-10-06
173,The Daily Hodl,Blockchain Twitter App Launches To Bring Decentralized Social to the Masses,"October 5, 2022 – Los Angeles, California Today, content is hosted on centralized platforms like Twitter, TikTok or Instagram. Many thought leaders like Elon Musk and even Twitter founder Jack Dorsey call for an alternative. Takeaways A novel Web 3.0 social platform called Diamond is launching on... (Read More...)",50.0,51.66666666666667,91.20891690254211,91.355,67.22222222222221,0.3229379653930664,2022-10-06
174,CoinTelegraph,Reversible blockchain transactions would improve cryptocurrency,"For some users, reversibility runs up against the idea of the blockchain. However, it could be a critical tool for fighting hackers and encouraging the mass adoption of cryptocurrency. (Read More...)",72.02,50.0,86.10607385635376,44.865,62.5,1.2682139873504639,2022-10-06
175,Bitcoinist,By The Numbers: Crypto Winter Mergers And Acquisitions,"Crypto mergers and acquisitions are up significantly in the last 2 years, and the exchanges have been leading the charge in this regard. These crypto exchanges have taken to buying out the competition in a bid to not only expand their operations but to stay one step ahead of their competitors. Th... (Read More...)",50.0,50.0,1.249799132347107,43.84,60.9375,99.70450103282928,2022-10-06
176,NullTX,Uniglo.io (GLO) Launching At Avalanche (AVAX) And Fantom (FTM) Lows Could Be Very Bullish,"The crypto market could be described as choppy for the past weeks and might continue this pattern till the end of the year. However, this is also the best time to make investments. While major cryptos like Avalanche (AVAX) and Fantom (FTM) are trading at low valuations, analysts are increasingly ... (Read More...)",39.885,60.0,0.0010371208190917969,84.04,59.27083333333334,99.71435964107513,2022-10-06
177,Cryptonews,"Biggest Crypto Gainers Today 5 October – DOGE, BCH, GMX, BNB, XRP","The crypto market surpassed the $1 trillion capitalization mark yesterday. Although it has slipped below the price peg, the broader crypto market appears to be consolidating. Several assets are very attractive today. In this article, we’ll consider the biggest crypto gainers. Dogecoin is one of t... (Read More...)",50.0,50.0,99.8111367225647,79.92,75.0,99.85250234603882,2022-10-06
178,Cryptonews,Bitwise Launches New Web3 ETF as Crypto Markets Rebound,"Hoping to capitalize on the rebounding crypto markets, San Francisco-based crypto index fund provider Bitwise has rolled out BWEB, a new Web3 exchange-traded fund (ETF). ETFs are financial instruments that trade on an exchange like stock, but track a specific market or asset, such as bitcoin (BTC... (Read More...)",50.0,56.81818181818181,84.25983190536499,85.48,56.36363636363636,1.2637913227081299,2022-10-06
179,Crypto Daily,"Big Eyes Coin will go on to CEX Tier 1 Platform after Presale, Stage 3, Selling Out Fast!","The Big Eyes Coin’s (BIG) success is mounting as the meme coin celebrates a record 500K raised in one day. On top of this success, Big Eyes Coins will be on the CEX platform, which is Tier One. Once their presale is over, their coins will be available to trade on a centralised platform ranked hig... (Read More...)",50.0,56.25,99.93825554847717,95.845,62.5,99.6119737625122,2022-10-06
180,The Daily Hodl,"Here’s What ‘Max Pain’ Could Look Like for Bitcoin (BTC) Holders, According to On-Chain Analyst Willy Woo",A popular on-chain analyst claims the current bear market hasn’t yet sent as many Bitcoin (BTC) underwater as previous bear markets. BTC analyst Willy Woo notes that showing how many coins are at a lower value compared to their purchase price is “one way of visualizing maximum pain.” “Past cycles... (Read More...),84.04,50.0,2.4750113487243652,86.345,62.023809523809526,0.0021398067474365234,2022-10-06
181,The Daily Hodl,Abu Dhabi To Host Inaugural Middle East Blockchain Awards,"October 5, 2022 – Dubai, United Arab Emirates The first edition of the Middle East Blockchain Awards will be held in Abu Dhabi in November 2022 to recognize and reward outstanding efforts within the fields of blockchain and Web 3.0 innovations. Hoko Agency Middle East will host the awards in asso... (Read More...)",72.94,50.0,99.63045418262482,97.385,62.5,99.628347158432,2022-10-06
182,The Block,House Republicans seek central bank digital currency opinion from Department of Justice,Republicans on the House Financial Services Committee requested a central bank digital currency assessment from the Department of Justice. (Read More...),76.335,50.0,1.9248872995376587,76.335,56.25,0.4699587821960449,2022-10-06
183,CoinTelegraph,"EU Council approves MiCA text, proposal moves to Parliament for vote","The Council's Permanent Representatives’ Committee chair confirmed that the MiCA framework would go through “should the European Parliament adopt its position at first reading."" (Read More...)",70.095,50.0,78.80670428276062,58.894999999999996,64.375,9.823843836784363,2022-10-06
184,Cryptomode,4 reasons not to use your NFT on Facebook or Instagram Profiles,"Have you ever wanted to show your crypto portfolio on Facebook or Instagram? There’s nothing like getting a bunch of likes from your friends when they see you have all these fancy digital assets! But maybe you should think twice about this plan. After all, there are several reasons why using an N... (Read More...)",50.0,50.0,84.23124253749847,73.275,58.333333333333336,0.6872773170471191,2022-10-06
185,BeInCrypto,Why Composability is the Heart of Web3,"In the early days of the Internet, companies like AOL and Prodigy built closed networks that were incompatible with any other network. This meant that users could only access content and services within those siloed ecosystems. (Read More...)",50.0,50.0,99.74853694438934,68.06,53.75,89.63848352432251,2022-10-06
