,source,title,excerpt,vader_sentiment_title,tb_sentiment_title,flair_sentiment_title,vader_sentiment_excerpt,tb_sentiment_excerpt,flair_sentiment_excerpt,date
66,CoinTelegraph,Musk's deal for Twitter looks set to go with original $44B price tag,"Twitter appears ready to move forward with the deal for Elon Musk to buy Twitter, announcing in an Oct. 4 post they intend to close the transaction at $54.20 per share. (Read More...)",65.91,68.75,1.375254989,78.595,67.5,0.006490946,05-10-22
67,Forkast.News,Privacy vs. security: an international debate on Tornado Cash,Panelists at Forkast’s live-streamed event 'Crypto Rising: The Role of Law: An International Debate post Tornado Cash' co-hosted by Crypto Council for Innovation (CCI) said the significance of the sanctions could not be understated. (Read More...),67,50,94.0656662,78.595,62.5,0.771263242,05-10-22
68,BeInCrypto,"AI Music: Bots Can Now Write Songs, and Created a New Kurt Cobain Hit","AI Music: Bots can now write lyrics, music and even produce a stunning video. Is this the death of the human musician as we know it? The post AI Music: Bots Can Now Write Songs, and Created a New Kurt Cobain Hit appeared first on BeInCrypto. (Read More...)",62.5,56.81818182,95.28743625,46.14,63.86363636,95.38742304,05-10-22
69,BeInCrypto,High Profile NFT Collection Moved from 3AC Wallet Amid Bankruptcy Proceedings,"Last year, a non-fungible token (NFT) fund created by Three Arrows Capital co-founders has now seen many of its digital art assets moved to another wallet. The post High Profile NFT Collection Moved from 3AC Wallet Amid Bankruptcy Proceedings appeared first on BeInCrypto. (Read More...)",50,58,86.21949852,70.095,61.75,0.314280391,05-10-22
70,Bitcoin.com,Billionaire Hedge Fund Founder Ray Dalio Steps Down as Co-CIO of Bridgewater Associates,"Billionaire hedge fund founder Ray Dalio has stepped down as chief executive of Bridgewater Associates, according to a transfer of voting rights on September 30. Bridgewater’s co-chief executive explained on Tuesday that “Ray no longer has the final word,” in regard to the hedge fund’s future. He... (Read More...)",50,42.22222222,1.563999057,35.2,54.30555556,0.478491187,05-10-22
71,AMBCrypto,Solana holders need to know this before they decide to cut losses,"Solana’s [SOL] probation period may be up if the team behind the project does nothing to solve its recurring challenges. Recall that Solana had been the victim of several exploits, and network issues, with some occurring repeatedly between June and September 2022. The latest outage could be proof... (Read More...)",20.705,50,91.68787301,20.76,55.25,0.031355023,05-10-22
72,CoinTelegraph,‘New frontier’ of crypto laundering involves cross-chain bridges and DEXs: Elliptic,"Curve, Uniswap, 1inch, and the Ren bridge were the top platforms of choice for laundering illicit crypto, according to Elliptic. (Read More...)",50,56.81818182,97.54093885,60.115,75,94.47207451,05-10-22
73,Cointelegraph,Coinbase expands to Australia with focus on institutions in 'months to come’,"With an expanded Australian offering, Coinbase’s VP of international and business development said the exchange faced “tough questions” from regulators and policymakers about its services. (Read More...)",55.135,50,98.99516404,50,51.38888889,10.07010639,05-10-22
74,CoinTelegraph,"Insolvency not in 'Nexo's reality,' says co-founder during AMA","Co-founder Kalin Metodiev stated that comparisons between Celsius, Voyager and Nexo are “very far from reality” and that the firm is focused on building in a sustainable way. (Read More...)",50,50,0.167059898,69.09,57.16666667,22.85891473,05-10-22
75,The Daily Hodl,Three Challenges of Institutional Crypto Adoption Left Unsolved by the Merge,"Crypto market players, as well as analysts at Bank of America and Bernstein, expect the merge to boost institutional adoption for Ethereum (ETH) and the digital asset industry. Although their arguments are true to a certain extent – especially how a greener ETH could attract ESG investments – the... (Read More...)",53.86,50,11.74540222,93.75,60.64285714,6.464216113,05-10-22
76,BeInCrypto,Ethereum Name Service: Here Are the 5 Most Expensive ENS Domains,"Ethereum Name Service (ENS) domains have seen a sharp rise in interest over the last six months. New registrations hit 437,000 in September alone. The post Ethereum Name Service: Here Are the 5 Most Expensive ENS Domains appeared first on BeInCrypto. (Read More...)",50,50,81.2259376,62.5,55.43831169,2.722561359,05-10-22
77,CryptoGlobe,"$XRP Will Be Adopted by the ‘Entire World’, Says Popular US Music Producer","The founder and CEO of Sound Alive Records Eric Finnerud, known as E. Smitty, has recently revealed he believes that the $XRP token will be adopted by the “entire world” as it’s a cryptocurrency with fast settlement times and low transaction fees. In a tweet the music producer shared with his ove... (Read More...)",71.075,65,4.789039493,72.02,58.57142857,5.303165317,05-10-22
78,FX Street,Crypto.com price parades bullish move after Band Protocol's VRF testnet integration,Crypto.com price appears to be gaining momentum after stepping above a crucial falling trend line. The native exchange token's strides to the north st (Read More...),50,50,0.02296567,64.8,58.33333333,93.21077466,05-10-22
79,FX Street,"Top 3 Price Prediction Bitcoin, Ethereum, Ripple: Turbulence en route to the moon","The crypto market ascends what some traders would refer to as noisy behavior. At the current time, the next trend is more of a guessing game than a su (Read More...)",60.115,75,99.90270734,41.105,56,0.370085239,05-10-22
80,FX Street,Chainlink set for a price fall despite conducting $6.18 trillion worth of transactions in 2022,"Chainlink’s oracle networks and data feeds have pushed the project’s presence in the crypto space, which is only improving with every passing day. How (Read More...)",61.315,65,0.012853742,71.075,62.5,0.144314766,05-10-22
81,FX Street,"XRP Price: Binance announces new XRP investment product, fuels rally in the altcoin","Binance, the world’s largest exchange by volume, added XRP to its list of Dual Investment products. The exchange announced the launch of the product o (Read More...)",50,56.81818182,94.34172213,50,75,89.59246278,05-10-22
82,FX Street,Bulls latch on to Polygon's MATIC price as a 25% rally unfolds,"MATIC price has rallied 10% to start the month of October. The Relative Strength Index shows an influx of momentum, supporting an uptrend bias. Inval (Read More...)",50,50,1.080495119,84.54,62.5,2.234515548,05-10-22
83,FX Street,"Starbucks leads the way in Web3, launches NFT rewards program",Starbucks recently introduced an NFT-based loyalty program on top of its existing rewards program. The giant aims at including Web3-savvy individuals (Read More...),73.835,50,99.21499193,90.63,62.5,88.43987882,05-10-22
84,FX Street,Dogecoin jumps by 7.3% as Elon Musk revives $44 billion Twitter deal to prevent trial,"Elon Musk’s proposal to buy the social media giant, Twitter, has been one of the most talked about acquisitions in the last few years. While the Space (Read More...)",70.095,50,0.914138556,50,56.94444444,22.69202769,05-10-22
85,FX Street,Ethereum breaches 11-month-old resistance as Fidelity raises $5 million with its new ETH Index Fund,"While the broader market has been up following news of Elon Musk’s revival of the $44 billion Twitter deal, Ethereum also has another external develop (Read More...)",50,56.81818182,0.276511908,50,58.33333333,21.2051332,05-10-22
86,FX Street,ApeCoin price is likely to fall flat towards $4 for these reasons,ApeCoin price is in a tough spot for bulls in the market. A countertrend scalp would be more favorable after a breach of the lows. ApeCoin price is in (Read More...),50,49.375,0.009378791,63.58,60.18518519,0.0251472,05-10-22
87,FX Street,Why patience will help provide a better entry for XRP investors,XRP price should pull back once more before the real rally occurs. Key levels have been identified. XRP price has cushions pace to fall XRP price curr (Read More...),84.04,75,0.071683526,50,62,0.498366356,05-10-22
88,FX Street,European Parliament approves crypto tax policy and the use of blockchain for collecting tax,"Crypto regulation is undoubtedly one of the bigger concerns for governments worldwide, with crypto taxation equally a grave concern. While many other (Read More...)",70.095,50,97.88233638,30.91,58.75,11.70343161,05-10-22
89,FX Street,First Mover Asia: Bitcoin upbeat above $20k as investors grow optimistic that steep rate hikes will soon end,"Crypto and other markets responded favorably to a surprisingly large decline in U.S. job openings, which offer the latest evidence of economic slowing (Read More...)",65.91,56.25,13.71967494,79.295,62.89285714,90.59070647,05-10-22
90,FX Street,Federal regulators are preparing to pass judgment on Ethereum,The Securities and Exchange Commission is moving to take action against Ethereum that reaches far beyond America’s borders. Are regulators with the U. (Read More...),50,50,0.091835856,67,61.66666667,4.755485058,05-10-22
91,AMBCrypto,"Evaluating the Q3 performance of BTC, ETH, and BNB","Although the broader financial market experienced a downturn in the last quarter, data from CoinGecko showed that the global cryptocurrency market capitalization rose by 9% within the 90-day period. Interestingly, despite the growth in the global cryptocurrency market capitalization, the leading ... (Read More...)",50,50,96.35151327,56.605,65,4.064890742,05-10-22
92,Forkast,"Celsius cofounder, chief strategy officer resigns: report","Bankrupt crypto lender Celsius’ cofounder and chief strategy officer S. Daniel Leon has resigned, a week after the company’s CEO Alex Mashinsky stepped down, according to an internal company memo viewed by CNBC. See related article: Alex Mashinsky steps down as Celsius CEO Fast facts The company’... (Read More...)",34.09,50,0.052064657,15.96,53.24074074,0.080490112,05-10-22
93,CryptoSlate,TON Network launches Telegram wallet bot for P2P crypto trading,Telegram users can now buy and sell cryptocurrency within the app due to a new update for the @wallet bot. (Read More...),50,50,0.099259615,50,58.52272727,2.439853549,05-10-22
94,Bitcoin Magazine,Why It’s Important To Build Stablecoins On Bitcoin,Lightning Labs is building the ability to use stablecoins on the Lightning Network using the new Taro protocol due to demand in emerging markets. (Read More...),60.115,70,85.91637909,60.115,58.52272727,99.70437884,05-10-22
95,NewsBTC,"TA: Bitcoin Price Reclaims $20K, Why This Could Be The Start of Larger Rally","Bitcoin price gained pace for a move above $20,000 against the US Dollar. BTC is showing positive signs and might rise further above $20,500. Bitcoin started a steady increase above the $19,200 and $19,500 resistance levels. The price is trading above $20,000 and the 100 hourly simple moving aver... (Read More...)",50,50,0.031593442,90.88,54.96632997,0.648882985,05-10-22
96,Decrypt,"Balcony DAO Co-Founder: There Are Clear Rules, People in Crypto Just Don't Like Them",John Belitsky says Balcony DAO is simply complying with existing regulations to get its security token approved. (Read More...),56.275,55,0.01192987,81.845,62.5,24.99936223,05-10-22
97,Cointelegraph,Anchorage co-founder sees 'tons of opportunity' as it expands into Asia,"Anchorage Digital has marked its plans for expansion into the Asian crypto market, with co-founder Diogo Mónica noting that Singapore is just a starting point. (Read More...)",74.695,50,99.89000261,50,56,96.95976079,05-10-22
98,Forkast.News,Japan’s PM announces NFT and metaverse expansion,Japan’s Prime Minister Fumio Kishida announced plans to expand investments in non-fungible tokens (NFTs) and the metaverse in a policy speech on Monday. See related article: Japan plans new crypto transfer rules to combat money laundering Fast facts Kishida says the country will further its inves... (Read More...),50,50,99.39347208,48.71,58.36363636,0.789228082,05-10-22
99,Bitcoin.com,SEC Chair Gensler Insists Most Crypto Tokens Are Securities — Says ‘the Law Is Clear’,"The chairman of the U.S. Securities and Exchange Commission (SEC), Gary Gensler, has reiterated that most crypto tokens are securities, emphasizing that “the law is clear on this.” However, the Commodity Futures Trading Commission (CFTC) has asked Congress for authority over crypto spot markets a... (Read More...)",64.8,58.33333333,18.34233701,87.15,62.5,5.158814788,05-10-22
100,CoinTelegraph,Federal regulators are preparing to pass judgment on Ethereum,The Securities and Exchange Commission is moving to take action against Ethereum that reaches far beyond America’s borders. (Read More...),50,50,0.091835856,67,61.66666667,13.29298317,05-10-22
101,Forkast,Mastercard launches crypto exchange risk assessment tool,"Financial services company Mastercard Inc. has launched Crypto Secure, a technology solution designed to help banks identify fraud-prone crypto exchanges, the company announced in a press release. See related article: Binance partners Mastercard to launch card in Argentina for bill payment, every... (Read More...)",36.34,50,86.36242151,89.225,61.25,87.73154616,05-10-22
102,Bitcoin Magazine,How Nation-States Will Use Bitcoin In The Power Projection Game,Bitcoin miners are the next level of power projection as they reinforce an incorruptible network that cannot be usurped by a single entity. (Read More...),50,30,86.61677837,50,61.60714286,89.95423317,05-10-22
103,CryptoSlate,Mastercard launches new product to help banks combat crypto-related crime,"Mastercard announced it would debut a software product that helps banks detect and block fraudulent transactions from going through crypto exchanges, according to a report on October 4, 2022. (Read More...)",25.305,56.81818182,99.12140667,22.885,75,19.46794689,05-10-22
104,Cointelegraph,Three Arrows Capital fund moves over 300 NFTs to a new address,"According to blockchain provider Nansen, hundreds of NFTs have been moved from the 3AC-linked fund to a Gnosis Safe address. (Read More...)",50,56.81818182,97.85473645,72.02,75,1.265725493,05-10-22
105,CoinTelegraph,Three Arrows Capital fund moves over 300 NFTs to a new address,"According to blockchain provider Nansen, hundreds of NFTs have been moved from the 3AC-linked fund to a Gnosis Safe address. (Read More...)",50,56.81818182,97.85473645,72.02,75,1.265725493,05-10-22
106,The Block,Anchorage makes push into Asia with five new partnerships,"Anchorage Digital partnered with Bitkub, Antalpha and others as it made a major push into the Asia region. (Read More...)",50,56.81818182,99.98049438,50,59.375,98.6420989,05-10-22
107,Forkast,"Markets: Bitcoin rises above US$20,000, gaining with Ether and rest of crypto top 10 as U.S. equities surge","Bitcoin was trading above US$20,000 in Wednesday morning trading in Asia after struggling to break that resistance level for much of the past three weeks. The world’s largest cryptocurrency rose along with Ether and the rest of the crypto top 10 by market capitalization, with Dogecoin posting the... (Read More...)",77.87,62.5,90.6355232,37.5,62.91666667,24.09431934,05-10-22
108,CryptoPotato,"Horizon Blockchain Games Raises $40 Million From Ubisoft, Take-Two and Other Investors","Last year, Horizon Games raised $4.5 million. Today it got 10X more money from big fishes like Ubisoft and Take-Two Interactive. (Read More...)",50,43.75,88.62353861,68.06,62.5,1.55145824,05-10-22
109,Bitcoin.com,Top US Regulators Urge Congress to Pass Legislation on Crypto Assets,"The U.S. Financial Stability Oversight Council (FSOC), a group of the country’s top financial regulators, has urged Congress to pass legislation for the regulation of crypto assets. Treasury Secretary Janet Yellen said: “Crypto-asset activities could pose risks to U.S. financial stability if thei... (Read More...)",68.06,75,76.87072456,64.8,60,4.075026512,05-10-22
110,CryptoGlobe,Crypto Community’s Cardano Price Predictions See $ADA Surge Over 30% This Month,"The cryptocurrency community has set a bullish price target for smart contract platform Cardano ($ADA) this month, presumably taking into account the network’s improved performance after the Vasil hard fork. The estimates come from CoinMarketCap’s prime estimates feature, which saw over 10,800 us... (Read More...)",50,50,4.611760378,82.985,57.04365079,0.026151538,05-10-22
111,Bitcoin Magazine,How A $5 Bitcoin Purchase Cascaded Into A $1.5 Million Viral Movement,"A brief description of the founding and subsequent purchases within Stackchain, a Bitcoin-stacking subculture. (Read More...)",50,50,0.204232335,50,58.33333333,19.02316809,05-10-22
112,U.Today,"Ethereum Aims At Big Market Return If Breaks This Level Successfully: Crypto Market Review, October 4",XRP might bring investors volatile surprises if this pattern plays out (Read More...),74.695,68.75,14.98982906,72.02,75,1.04663074,05-10-22
113,CryptoPotato,Beeple Discord Server Exploited by Hackers Attempting to Drain Wallets,The latest attempt at exploiting unsuspecting users attacked Beeple’s community via Discord. (Read More...),15.46,50,0.022760034,8.875,75,0.004684925,05-10-22
114,Bitcoinist,Mastercard Unveils Secure Tool To Fight Growing Crypto Fraudulent Activities,"Amid the growing frauds in the crypto sector, the multinational financial service organization, Mastercard, has unveiled a new feature to prevent and detect crypto-related fraud operations within its network. Cryptocurrency’s broad adoption by the mainstream has pushed global business platforms t... (Read More...)",29.905,70,99.85513389,12.85,56.98863636,99.88577962,05-10-22
115,Bitcoinist,Mayweather Continues To Fight Ethereum Max Lawsuit Following Kim Kardashian’s Settlement,"Back at the beginning of the year, some notable celebrities had been named in a lawsuit over the alleged Ethereum Max (EMAX) scam. These celebrities included reality star Kim Kardashian, boxing legend Floyd Mayweather, as well as former professional athletes Paul Pierce and Antonio Brown. The cla... (Read More...)",22.885,50,79.62566912,22.885,58.33333333,5.833485723,05-10-22
116,AMBCrypto,Assessing reasons for a profitable DeFi industry despite the ongoing crypto winter,"The ongoing crytpo winter has led to investors bearing severe losses in the industry. However, the decentralized finance (DeFi) sector is showing positive returns for investors. Furthermore, the returns also managed to show how mature the DeFi market is becoming. According to a fresh analysis cre... (Read More...)",72.02,50,13.8800025,76.335,65.77272727,86.7169708,05-10-22
117,NewsBTC,Why The Shiba Inu Price Could See Some Major Upside This Week,"Meme coin Shiba Inu has held up better than expected, but the digital asset is still down considerably from its all-time high. However, this has not stopped the development that has been going on behind the scenes, and now SHIB developers have begun to share the products that they have been worki... (Read More...)",50,53.125,0.482010841,92.005,53.77777778,98.71899486,05-10-22
118,NewsBTC,Short Relief Bounce For Altcoins? If Crypto Marketcap Can Do This,Cryptocurrency market capitalization could be ready to break out from the downtrend as price gears up for a short-term recovery creating more bullish sentiment for the altcoins. Cryptocurrency market capitalization looks strong on both low and high timeframes. Cryptocurrency market capitalization... (Read More...),73.835,50,0.083228946,85.48,64.94444444,0.221931934,05-10-22
119,BeInCrypto,NFT Domains Make Transacting in Crypto Easier,NFT domains: Users of the 1inch Network can now use human-readable addresses to transact in 1inch's product ecosystem. The post NFT Domains Make Transacting in Crypto Easier appeared first on BeInCrypto. (Read More...),71.075,50,99.94317889,71.075,68.75,99.80754852,05-10-22
120,CryptoPotato,New Fed Governor Says Combating Inflation is Still Top Priority,"While concerns over the Fed’s hawkish policy swell, the central bank shows no signs of stopping its fight against inflation. (Read More...)",60.115,65.90909091,21.06385231,17.015,62.5,1.384198666,05-10-22
121,Bitcoin.com,NFT Collection Veefriends Physical Collectibles to Debut at Macy’s and Toys’R’Us,"In recent times, non-fungible tokens (NFTs) and their physical counterparts have started to debut at well known retail stores and luxury boutiques. On October 4, the NFT project called Veefriends revealed that the team is launching its limited edition series of collectible characters exclusively ... (Read More...)",50,50,99.86237586,52.58,49.28571429,80.11462688,05-10-22
122,CryptoSlate,CryptoSlate Wrapped Daily: Elon Musk seeks to move ahead with $44B Twitter deal; Justin Sun wants to buy Credit Suisse’s assets,"The biggest news in the cryptoverse for October 4 includes Elon Musk making a new offer for Twitter, Celsius planning to auction assets, Justin Sun offering to buy Credit Suisse’s assets, and Charles Hoskinson calling for an end to Bitcoin mining. (Read More...)",75.53,55,0.140532851,80.62,65.90909091,0.02399087,05-10-22
123,The Daily Hodl,"Charles Hoskinson Says There’s ‘Humongous Appetite’ for Cardano Strategy, Outlines Path for Mass Adoption","Cardano (ADA) co-creator Charles Hoskinson says they have built a community and an ecosystem primed for mass adoption. In an interview with Messari founder Ryan Selkis, Hoskinson reiterates the importance of taking an academic and scientific approach to the development of the Cardano blockchain. ... (Read More...)",50,50,7.941675186,68.06,62.5,99.60039258,05-10-22
124,The Daily Hodl,Former SEC Chair Jay Clayton Says Crypto Regulation Must Start With Stablecoins,"The former head of the U.S. Securities and Exchange Commission (SEC) says the best place to start regulating crypto is the stablecoin sector. In a new CNBC interview, former SEC chair Jay Clayton discusses what regulations could look like when applied to the nascent field of crypto technology. “I... (Read More...)",50,47.5,17.58001447,91.8,60.25974026,22.21818566,05-10-22
125,AMBCrypto,Another warning shot? ESMA report cautions against future crypto-crashes,"The European Securities &amp; Markets Authority (ESMA) has warned about the risks of increasing consumer rip-offs and operational failures as cryptocurrency adoption grows over time. In its ‘Crypto-assets and their risks for financial stability’ report published today, the ESMA stated that future... (Read More...)",33,50,0.020566583,14.985,56.25,83.86591375,05-10-22
126,CryptoGlobe,"Solana ($SOL) Could Attract Over 1 Billion Users to the Crypto Space, Popular Analyst Says","The host of the popular InvestAnswers YouTube channel has revealed that he believes Ethereum ($ETH) rival Solana ($SOL) could bring over 1 billion users to the cryptocurrency space over its low transaction fees and large throughput. In a video shared with the channel’s over 400,000 subscribers, J... (Read More...)",82.43,80,99.21114743,73.835,66.42857143,13.96821737,05-10-22
127,Decrypt,Actor Scott Eastwood Is Giving Away Ethereum NFTs for Charity—If You Chug a Beer,The “Suicide Squad” star and son of Clint Eastwood shared why he was hesitant to jump into crypto—and what changed his mind. (Read More...),67,50,1.359459758,55.135,75,78.18760276,05-10-22
128,Decrypt,Three Arrows Capital’s Premium Ethereum NFT Collection Is on the Move,The insolvent crypto hedge fund’s Starry Night Capital NFT collection is being transferred into a new Ethereum wallet. (Read More...),50,50,95.97524405,50,65.90909091,0.129804015,05-10-22
129,CoinTelegraph,Celsius’ co-founder Daniel Leon follows Mashinsky out as crypto exec flight continues,Leon is at least the eighth crypto sector executive who has resigned in recent months; Celsius CEO Alex Mashinsky resigned a week ago. (Read More...),50,50,82.42920935,27.06,53.33333333,3.84798944,05-10-22
130,Cryptonews,Dogecoin Price Predictions Now Bullish as Elon Musk Twitter Takeover Back On?,The Dogecoin price is up almost 10% today as Elon Musk's Twitter acquisition is back on the table. Will Dogecoin recover to its 2021 highs though? A letter sent to Twitter's lawyers from 'the Musk parties' on the sec.gov website states:... Read More: Dogecoin Price Predictions Now Bullish as Elon... (Read More...),50,50,0.230431557,70.095,66.66666667,0.012633204,05-10-22
131,Decrypt,Near Protocol Founder: Ukraine Shows How Crypto 'Delivers Help Directly to People',Millions in cryptocurrency have flooded into the region since the Russian invasion. (Read More...),70.095,55,96.49983346,50,62.5,0.23239851,05-10-22
132,CryptoPotato,Mastercard Launches New Crypto Product to Help Banks Battle Fraud,"Mastercard joined forces with CipherTrace to launch a feature called ""Crypto Secure."" (Read More...)",21.405,56.81818182,97.97787964,50,72.5,78.16365361,05-10-22
133,Cointelegraph,DataVault requests US election agency's advice to send NFTs as a campaign fundraising incentive,"The firm planned to market NFTs “in a manner akin to a campaign hat or souvenirs,” intending to have political committees offer them to high-volume low-dollar donors. (Read More...)",68.06,50,0.185135007,50,55,0.114560127,05-10-22
134,The Block,Celsius co-founder Daniel Leon steps down: Bloomberg,Celsius co-founder Daniel Leon stepped down from his position amid the crypto lender's bankruptcy proceedings. (Read More...),50,42.22222222,1.638683677,50,58.61111111,0.385385752,05-10-22
