,source,title,excerpt,vader_sentiment_title,tb_sentiment_title,flair_sentiment_title,vader_sentiment_excerpt,tb_sentiment_excerpt,flair_sentiment_excerpt,date
85,Decrypt,"Bitcoin Back Above $18,000 for First Time Since FTX Collapse","It may feel like a lifetime ago, but Bitcoin was above $21,000 as recently as early November.",25.305,54.166666666666664,0.044605135917663574,59.504999999999995,52.5,1.3100743293762207,2022-12-14
86,BSCnews,BSC News to Host Learn and Earn Event with FEG Token,BSC News to begin a week-long Learn and Earn campaign with FEG Token on Dec 15.,50.0,50.0,99.68604445457458,50.0,50.0,19.177016615867615,2022-12-14
87,Crypto Daily™,Gaming survey finds that gamers are keen to earn crypto rewards,"Despite the ongoing crypto winter, a new survey reveals that the integration of blockchain and gaming is far from dead. According to the survey, g...",84.04,50.0,99.84039962291718,17.570000000000004,50.60606060606061,21.12710177898407,2022-12-14
88,Bitcoin Magazine,"Visiting El Salvador’s Slums, It’s Clear Bitcoin Country Must Go Further","A visit to Soyapango, one of El Salvador’s most impoverished slums, shows that the Bitcoin experiment isn’t reaching those who need it most.",69.08999999999999,52.5,5.711859464645386,60.114999999999995,75.0,0.0020563602447509766,2022-12-14
89,Cointelegraph,"Reaching the Bitcoin price bottom is a process, says The Wolf of All Streets, Scott Melker","“People love to point at a specific price in hindsight as the bottom of an asset, but bottoming is a process,” Melker says during...",60.114999999999995,50.0,94.84081864356995,75.935,62.5,21.202895045280457,2022-12-14
90,crypto.news,More crypto is lost with self-custody than exchanges: Binance CEO,"Changpeng Zhao, the CEO of major cryptocurrency exchange Binance, suggested that there are better solutions for crypto users than self-custody. Du...",31.279999999999998,75.0,80.71313202381134,77.86999999999999,64.0625,0.006496906280517578,2022-12-14
91,BSCnews,How to Handle the Current Market Fear and Uncertainty Around Binance: Five Steps,Here we give five steps to handle the current market fear and remind users to consistently take these precautions.,15.960000000000003,50.0,99.6023416519165,25.305,56.25,99.89387392997742,2022-12-14
92,CryptoSlate,"Bitcoin outperforms Layer 1s SOL, ETH, DOT, BNB, ATOM in December","In December, Bitcoin outperformed the native tokens of the Solana, Ethereum, Polkadot, Binance, and Cosmos ecosystems, according to data analyzed ...",50.0,50.0,0.0073015689849853516,50.0,50.0,0.0034809112548828125,2022-12-14
93,Seeking Alpha,U.S. Senators introduce bipartisan bill to bust digital asset money laundering,U.S. Senators Elizabeth Warren (D-MA) and Roger Marshall (R-KS) unveiled a bipartisan legislation Tuesday that takes aim at money laundering as we...,68.06,50.0,6.528109312057495,50.0,50.0,5.116686224937439,2022-12-14
94,CryptoSlate,Kevin O’Leary says Binance put FTX out of business,Shark Tank investor Kevin O&#8217;Leary said at the December 14 Senate Banking Committee on FTX&#8217;s collapse that Binance put the crypto excha...,50.0,50.0,0.012359023094177246,25.305,50.0,0.14322996139526367,2022-12-14
95,AMBCrypto,Synthetix releases V3 governance module update but is this enough to boost SNX,We can expect SNX to achieve more recovery if the overall market conditions improve. SNX dropped in November to retest its June lows. Synthetix ha...,77.495,50.0,98.24093282222748,63.660000000000004,62.5,0.016295909881591797,2022-12-14
96,BSCnews,Five BNB Chain NFTs to Gift Someone Over the Holiday Season,Here we give you 5 BNB Chain NFTs worth buying in the holiday season! Each one brings cool utility!,84.04,50.0,95.16788125038147,87.84,70.3125,99.96466040611267,2022-12-14
97,CoinGape,FTX Hearing: Kevin O’Leary Attacks Binance Calling It An “Unregulated Monopoly”,The discussion surrounding the demise of what was once one of the biggest crypto exchanges in operation has grown courtesy of the Senate Banking C...,27.98,50.0,1.0236471891403198,68.06,50.0,94.15558874607086,2022-12-14
98,CryptoSlate,SEC charges eight in $100M social media securities fraud,The United States Securities and Exchange Commission (SEC) has charged eight individuals with a $100 million securities fraud scheme involving maj...,21.405,48.333333333333336,0.07227957248687744,57.655,45.0,0.7244586944580078,2022-12-14
99,Decrypt,Senator Warren Introduces New Crypto Bill Targeting Self-Custody Wallets,"Critics say that the bill, which would expand KYC requirements for crypto network participants, is “opportunistic” and “unconstitutional.”",50.0,56.81818181818181,0.1506596803665161,51.29,50.0,7.047662138938904,2022-12-14
100,The Block,WisdomTree launches nine new blockchain-enabled funds,The new additions come ahead of WisdomTree's digital wallet launch next year.,50.0,56.81818181818181,93.69982481002808,50.0,52.27272727272727,99.8929888010025,2022-12-14
101,CryptoSlate,SushiSwap Head Chef discloses $5.2M budget for DAO operation in 2023,"SushiSwap Head Chef Jared Grey has disclosed that the DAO will spend about $5.2 million for its operating costs in 2023, with over 80% of the budg...",50.0,50.0,1.1420458555221558,52.580000000000005,47.5,5.535280704498291,2022-12-14
102,Bitcoinist,Bulls Take The Lead As Bitcoin Investor Sentiment Recovers,Bitcoin investor sentiment had wavered following the implosion of the FTX crypto exchange. This had sent market sentiment to one of its lowest poi...,50.0,50.0,2.0673811435699463,30.910000000000004,50.0,0.0665128231048584,2022-12-14
103,Cointelegraph,"Bitcoin traders await FOMC, Powell as BTC price hits new 1-month high",Bitcoin keeps up the gains in U.S. stocks with hours to go until a decision on rate hikes and comments from Fed Chair Powell. ...,55.135,57.40909090909091,0.10802745819091797,67.0,50.0,0.3604114055633545,2022-12-14
104,Cardano Twitter,RT @Cardano_CF: Stablecoins: What Cardano needs to bridge the gap between traditional finance and DeFi Vineeth Bhuvanagiri explains why t…,,50.0,50.0,92.44524836540222,50.0,50.0,0.0,2022-12-14
105,AMBCrypto,"USDT issuer Tether would stop making secured loans in 2023, thanks to FUD",USDT has been battling FUD around it in recent months as a result of its exposure to collapsed projects like FTX. Tether has made a move to reduce...,57.245000000000005,60.0,12.364387512207031,22.634999999999998,50.0,0.16501843929290771,2022-12-14
106,Seeking Alpha,"H.C. Wainwright cuts Argo Blockchain to Neutral on debt concerns, crypto headwinds",H.C. Wainwright on Wednesday downgraded Argo Blockchain (OTCQX:ARBKF) to Neutral from Buy over debt concerns and broader headwinds in the cryptoc...,21.405,50.0,7.076352834701538,31.94,50.0,0.01894235610961914,2022-12-14
107,BSCnews,SafePal CEO Warns of New ‘Zero Transfer Scam’ for Crypto Wallets,"The CEO of SafePal alerts users to a scam on EVM chains and Tron where scammers initiate ""Zero Transfers"" to confuse users into compromising their...",44.865,56.81818181818181,0.07642805576324463,15.960000000000003,50.0,0.03243386745452881,2022-12-14
108,The Block,"Bitcoin trades around $18,000, US dollar sinks as all eyes are on the Fed",Crypto markets swelled ahead of the Fed's final interest rate decision of the year — a 50 basis point hike is expected. ...,50.0,45.0,0.004065036773681641,72.94,47.5,0.3383636474609375,2022-12-14
109,Seeking Alpha,Silvergate Capital stock rises as BTIG sees eventual short squeeze,Silvergate Capital (NYSE:SI) stock drifted up 2.1% in Wednesday morning trading as BTIG analyst Mark Palmer expects short traders to eventually co...,50.0,50.0,0.2229243516921997,50.0,50.0,0.0022470951080322266,2022-12-14
110,Finbold,AllianceBlock launches privacy-focused programmable smart crypto wallet,"AllianceBlock, the decentralized finance (DeFi) infrastructure center that creates seamless bridges between decentralized and traditional finance,...",70.095,60.71428571428571,95.70558667182922,63.660000000000004,50.0,99.97552037239075,2022-12-14
111,Cointelegraph,Comic-Con guru says storytelling is the key component for successful NFT projects,Kumite NFT founder Gareb Shamus chats with NFT Steez about how NFT projects can engage with their respective communities through ...,79.295,68.75,99.98371601104736,81.845,50.0,94.30850148200989,2022-12-14
112,Crypto Daily™,Nexera ID To Revolutionize Web3 Privacy With  On-Chain Identities,"Cryptocurrency and DeFi users now have a better way to protect their identities and ensure they won&rsquo;t lose access to their crypto assets, an...",50.0,50.0,99.97914135456085,86.345,75.0,96.82551920413971,2022-12-14
113,BSCnews,"Binance, CZ Mark 12 Years Since Satoshi’s Disappearance","Binance paid tribute to Satoshi Nakamoto on the 12th anniversary since the Bitcoin founder disappeared. CEO CZ said, ""We are all Satoshi.""",50.0,50.0,99.93563890457153,38.685,50.0,99.65456128120422,2022-12-14
114,The Block,Maple Finance releases version 2.0 after $36 million default on platform,Uncollateralized lender Maple Finance has updated its protocol to a second version aimed at opening up the lending platform to a wide...,50.0,50.0,0.08820891380310059,50.0,47.5,0.26009678840637207,2022-12-14
115,BSCnews,Binance NFT Marks Day 1 of Ape Staking; Users Question Dropping APRs,"Users can stake their Bored Ape Yacht Club and Mutant Ape Yacht Club NFTs at Binance NFT, with current APRs of about 60%, down from the max of 199%.",50.0,50.0,0.09899735450744629,36.34,39.07407407407407,0.1390397548675537,2022-12-14
116,Bitcoinist,From A Penthouse To No Bed: FTX Founder Sent to Prison Unfit for Humanity,"The co-founder and former CEO at failed crypto exchange FTX, Sam Bankman-Fried (SBF), was taken into custody by Bahamian authorities. According to...",16.475,50.0,0.007963180541992188,24.47,37.5,0.07920265197753906,2022-12-14
117,Crypto Daily™,Bitcoin Price Analysis: 17999 Paid - 15 December 2022,BTC/USD Upside Momentum Rallies:&nbsp; Sally Ho&rsquo;s Technical Analysis &ndash; 15 December 2022 Bitcoin (BTC/USD) worked to sustain recent ups...,50.0,50.0,20.169955492019653,50.0,50.0,23.541158437728882,2022-12-14
118,AMBCrypto,Cardano [ADA] could offer short-selling opportunities at these levels,ADA had hit a significant supply zone and could face more selling pressure. The selling pressure could drive ADA’s price down to $0.3102. A move b...,69.08999999999999,50.0,0.24303197860717773,25.675000000000004,61.99074074074073,0.19660592079162598,2022-12-14
119,NewsBTC,VanEck’s Bitcoin Prediction Stands At $10K-$12K By Q1 2023,VanEck is one of a handful of companies that continues to fight for the approval of a Bitcoin Spot ETF. The U.S. investment management firm receiv...,50.0,50.0,1.6597896814346313,56.400000000000006,40.0,1.2611746788024902,2022-12-14
120,NewsBTC,Polkadot (DOT) Can Rally Provided It Breaches This Vital Level,The Polkadot (DOT) price has finally managed to break above the $5.07 support line after registering a 3% appreciation over the last 24 hours. Pol...,64.8,55.00000000000001,79.98850047588348,85.92,50.0,86.31625771522522,2022-12-14
121,The Block,"Warren, Marshall introduce bill to tighten money laundering rules for crypto","If made law, the bill would require digital asset service providers, miners, and network participants to follow know-your-customer ru...",50.0,50.0,98.33167493343353,68.06,50.0,0.7401704788208008,2022-12-14
122,Seeking Alpha,FTX lawsuits shed light on how U.S. regulators can police overseas crypto exchanges,The Securities and Exchange Commission and the Commodity Futures Trading Commission each filed charges against FTX (FTT-USD) founder Sam Bankman-F...,42.345,70.0,6.945306062698364,51.29,50.0,0.5002319812774658,2022-12-14
123,Cointelegraph,Gemini allegedly suffers data breach; 5.7 million emails leaked,"Users' emails, account numbers, and partial phone numbers were allegedly leaked.",17.015,20.0,0.01322925090789795,34.089999999999996,45.0,0.049886107444763184,2022-12-14
124,Cointelegraph,Gemini allegedly suffered data breach; 5.7 million emails leaked,"Users’ emails, account numbers and partial phone numbers were allegedly leaked.",16.475,45.0,0.012698769569396973,34.089999999999996,45.0,0.05717277526855469,2022-12-14
125,Cointelegraph,'Third-party incident' impacted Gemini with 5.7 million emails leaked,"Users’ emails and partial phone numbers were leaked in what Gemini claimed to be a ""third-party"" incident.",34.089999999999996,50.0,0.007826089859008789,34.089999999999996,45.0,0.02097785472869873,2022-12-14
126,AMBCrypto,"Australia is set to tighten crypto regulation in 2023, here’s how","In light of the worrying events that have transpired in the crypto market over the past few weeks, the government of Australia has moved to ramp u...",50.0,50.0,11.130806803703308,32.99999999999999,49.16666666666667,0.30222833156585693,2022-12-14
127,Bitcoinist,Stablecoin Exit Of 2022: $14.3 Billion Redeemed Since March,2022 has been the year of mass exit from stablecoins as more than $14.3 billion has been redeemed from these tokens since March. Total Stablecoin ...,65.91,50.0,10.01773476600647,65.91,62.5,0.01571178436279297,2022-12-14
128,CoinGape,Breaking: SEC Charges 8 Social Media Influencers In $100 Mn Stock Manipulation Scam,The Securities and Exchange Commission (SEC) has just announced that it will be filing charges against eight online influencers in connection with...,10.470000000000002,48.333333333333336,0.06679892539978027,51.29,45.0,0.7560938596725464,2022-12-14
129,Crypto Daily™,Planet Mojo’s First Charity Tournament A Smashing Success,"Boston, United States, 14th December, 2022, ChainwireMojo Melee Charity Smackdown Tournament Brought Together The Biggest Names In Web3 Gaming For...",87.895,63.74999999999999,99.89655017852783,84.04,50.0,99.47490692138672,2022-12-14
130,CoinGape,This Could Be Bitcoin (BTC) New Support Price If Fed Hikes Rate By 50 BPS,"New Bitcoin (BTC) Price: In view of the last Federal Open Market Committee (FOMC) meeting on the rate hike, Bitcoin (BTC) price is one of the most...",70.095,56.81818181818181,0.12029707431793213,50.0,57.95454545454546,1.493138074874878,2022-12-14
131,Finbold,Machine learning algorithm sets TRON (TRX) price for Christmas Day 2022,"As the final month of 2022 rolls in, the cryptocurrency market, along with TRON (TRX), is trying to offset the … Continued",50.0,50.0,98.73267114162445,50.0,50.0,0.21393299102783203,2022-12-14
132,Cointelegraph,Will FTX’s ill wind reach the Global South? Maybe not,"In Latin America, ""crypto is functional, it has a real utility."" It can hedge inflation, provide access to dollars and internatio...",29.905000000000005,37.5,0.7924497127532959,50.0,60.0,86.71853840351105,2022-12-14
133,Finbold,Will Powell bring a relief rally for Bitcoin? Here’s what to expect,The Federal Reserve chair Jerome Powell is expected to release the latest update on the interest rate hikes as part … Continued,73.83500000000001,50.0,4.13738489151001,72.94,60.0,85.42167842388153,2022-12-14
134,Decrypt,‘99% of People' Will Lose Crypto Storing in Self-Custody: Binance CEO Changpeng Zhao,"“Holding your own crypto in your wallet is not risk-free,” said Binance CEO Changpeng Zhao today during a Twitter spaces.",29.905000000000005,50.0,8.415785431861877,50.0,60.0,0.11134445667266846,2022-12-14
135,CryptoSlate,Binance Proof of Reserves fall by $3.5B in 24 hours,"Over the last 24 hours, the Binance USD (BUSD) and Bitcoin (BTC) Proof of Reserves (PoR) have fallen by $3.45 billion, and $472.86 million respect...",50.0,50.0,0.016826391220092773,31.94,50.0,0.0028073787689208984,2022-12-14
136,Trustnodes,Binance Converts All USDc to bUSD Paxos Confirms,"Paxos has confirmed that Binance turns all USDc into fiat, minting bUSD for 1:1. Is there a risk?",50.0,50.0,99.20531213283539,36.34,70.0,0.05409717559814453,2022-12-14
137,CryptoSlate,"Swissborg collects over 3,800 investors in 24 hours","Swissborg (CHSB)&#8217;s Series A funding round started on December 13, and a total of 3,839 investors have already participated in the funding. ...",50.0,50.0,99.70637559890747,50.0,45.0,95.82825005054474,2022-12-14
138,CryptoSlate,"SwissBorg collects over 3,800 investors in 24 hours","SwissBorg (CHSB)&#8217;s Series A funding round started on December 13, and 3,839 investors have already participated in the funding. The post Sw...",50.0,50.0,99.70637559890747,50.0,40.0,8.661690354347229,2022-12-14
139,AMBCrypto,"MakerDAO increases its DAI Savings Rate, thanks to competitive DeFi landscape",An executive proposal has been implemented to increase DAI Savings Rate to 1%. MakerDAO was momentarily displaced as the DeFi protocol with the la...,77.86999999999999,60.0,99.27277863025665,65.91,50.0,0.20655393600463867,2022-12-14
140,The Block,Valhalla and Cockpunch NFTs hit $18 million transaction volume in the past seven days,"Coming in at third and fourth on NFT charts respectively, the projects earned ample sales volume despite depressed market conditions....",50.0,37.5,6.7254215478897095,81.255,50.0,99.93106126785278,2022-12-14
141,CryptoSlate,"CZ discusses FUD, rumors, and more in latest Twitter Space",Changpeng Zhao (CZ) addressed a number of concerns in the latest Twitter space surrounding the potential impact of regulatory compliance policies ...,28.610000000000003,75.0,89.4661009311676,53.86,62.5,84.37991738319397,2022-12-14
142,Protos,Explained: Binance’s beef with crypto trader CoinMamba,Social media influencer CoinMamba picked a big fight with Binance but it's not clear that he could ever have won. The post Explained: Binance’s be...,50.0,50.0,0.24123787879943848,67.78500000000001,49.72222222222222,0.2100914716720581,2022-12-14
143,Cointelegraph,Fonbnk’s Michael Kimani sorts out facts on crypto adoption in Africa,"The first episode of Hashing It Out features Cointelegraph’s Elisha Owusu Akyaw (GhCryptoGuy) and Michael Kimani, Fonbnk’s co-fou...",50.0,50.0,97.92164266109467,50.0,62.5,2.4345368146896362,2022-12-14
144,The Block,Arca invests in Spaceport’s $3.6 million raise,"Web3 IP protocol Spaceport raised $3.6 million in pre-seed round co-led by Arca, Decasonic and Crit Ventures.",50.0,50.0,99.39233958721161,50.0,40.0,92.02449917793274,2022-12-14
145,AMBCrypto,Japanese power company to utilize excess power for crypto mining,"A major Japanese utility company, Tokyo Electric Power Grid (TEPCO), is working with local mining rig manufacturer TRIPLE-1 to capitalize on exces...",50.0,50.0,2.392074465751648,43.6,51.041666666666664,3.462493419647217,2022-12-14
146,The Block,Susquehanna bets on decentralized sports prediction market Frontrunner,"Decentralized sports prediction market Frontrunner raised $4.75 million from investors including Susquehanna, SOMA Capital and WAGMI ...",50.0,50.0,1.290905475616455,50.0,50.0,99.13434684276581,2022-12-14
147,Bitcoinist,"Apple To Permit Third-Party iOS Apps, How This Could Benefit NFTs And Crypto","Multinational tech giant, Apple is planning to allow the installation of iOS apps from third-party sources. The move has been considered in reacti...",72.94,50.0,0.6549865007400513,61.315,50.0,3.0976444482803345,2022-12-14
148,Cointelegraph,"As DEXs struggle, new approaches kindle hope","Despite their popularity, DEXs have a number of drawbacks that may be preventing growth. A new approach, however, has offered a w...",57.655,56.81818181818181,99.33249056339264,53.169999999999995,56.81818181818181,0.11194944381713867,2022-12-14
149,CoinGape,"Bitcoin, Ethereum Price Gains In Anticipation Of 50 Bps Rate Hike By US Fed",Bitcoin and Ethereum prices record modest gains on Wednesday ahead of the Federal Reserve rate hike decision. Bitcoin (BTC) price rallied over 5% ...,71.075,50.0,3.6921799182891846,67.0,55.00000000000001,11.41357421875,2022-12-14
150,Crypto Daily™,Bumpy road ahead for Binance and for crypto,Binance CEO Changpeng Zhao warns that the next few months will be a bumpy road for crypto. Confidence undermined As well as suffering a year-long ...,50.0,50.0,13.216015696525574,42.345,45.0,0.002199411392211914,2022-12-14
151,Cointelegraph,Nasdaq warns Bitcoin mining firm Bitfarms about share price deficiency,"Bitfarms has an initial period of 180 calendar days to have its shares trading above $1 for at least 10 days before June 12, 2023...",60.114999999999995,40.0,0.1025766134262085,64.8,45.0,0.01876354217529297,2022-12-14
152,CoinGape,What Is The Share Of Recent Binance Withdrawals Out Of Total Assets?,"Binance Withdrawals News: The crypto prices continue to be on an upward curve after the Consumer Price Index (CPI) fell to 7.1%. In this context, ...",72.02,50.0,0.10708868503570557,50.0,50.0,1.1576294898986816,2022-12-14
153,CryptoSlate,Elizabeth Warren working on bipartisan bill to tackle crypto money laundering,United States Democratic Senator Elizabeth Warren is teaming up with Republican Senator Roger Marshall to work on a bipartisan bill that will intr...,50.0,50.0,99.06964600086212,71.075,50.0,99.33086037635803,2022-12-14
154,Bitcoinist,Italy To Use Algorand Blockchain For Banking And Insurance Guarantees,Algorand has been selected as the blockchain to support an innovative digital guarantee platform for Italy&#8217;s banking and insurance markets. ...,50.0,50.0,99.80331361293793,88.25,62.5,99.96179342269897,2022-12-14
155,CryptoSlate,"Crypto stocks plunge to record lows, GBTC at 50% discount despite Bitcoin uptick",Several crypto-related stocks have seen their values plunge to new record lows despite Bitcoin&#8217;s (BTC) value gaining upward momentum over th...,39.885,50.0,0.0016510486602783203,69.74000000000001,53.40909090909091,0.28561651706695557,2022-12-14
156,Crypto Daily™,"YES WORLD launches Crypto Utility, Now use YES WORLD Token in 80 Countries","Singapore, -&nbsp;Leading blockchain based climate tech startup, operated by YES WORLD Climate Tech Pte Ltd based out of Singapore, launches Utili...",89.12,50.0,98.8615870475769,76.595,50.0,99.31318163871765,2022-12-14
157,AMBCrypto,The Central Bank of Brazil is planning to launch a CBDC in this year,Nations around the globe are scrambling to explore how blockchain technology can be employed to help their economies. The growing adoption of cryp...,50.0,50.0,91.06182157993317,76.335,50.0,98.81492853164673,2022-12-14
158,Cointelegraph,The Netherlands tops new survey as the most metaverse-ready country,"A new study by Uswitch revealed which countries are ready to embrace the metaverse by more technical standards, such as fixed bro...",75.53,65.9090909090909,99.69834685325623,79.295,57.8030303030303,14.97998833656311,2022-12-14
159,CoinGape,XRP News: 411 Million XRP On The Move; XRP Reclaims 6th Spot,"XRP News: XRP, the Native crypto of Ripple has turned out to be the most profitable token among the top 10 digital assets over the past 30 days. X...",50.0,50.0,96.39100432395935,84.50500000000001,59.375,99.3599146604538,2022-12-14
160,AMBCrypto,"FTX saga: Audited Proof of Reserves is a great welcome, but here’s the risk","Binance, Crypto.com, and KuCoin have released audited Proof of reserves (PoR). The audits followed the same procedure (AUP). The AUP procedure has...",61.315,90.0,4.488414525985718,50.0,50.0,0.01844167709350586,2022-12-14
161,AMBCrypto,"FTX saga: Audited Proof of Reserves is welcome, but here’s the risk","Binance, Crypto.com, and KuCoin have released audited Proof of reserves (PoR). The audits followed the same procedure (AUP). The AUP procedure has...",41.725,90.0,1.493862271308899,50.0,50.0,0.01844167709350586,2022-12-14
162,Crypto Daily™,"Coinbase Stock Takes A Dive, Crypto Daily TV 14/12/2022",In Todays Headline TV CryptoDaily News: US prosecutors look to charge Binance and executives. US prosecutors are considering criminal charges aga...,50.0,50.0,0.0039577484130859375,16.475,30.0,0.47996342182159424,2022-12-14
163,Seeking Alpha,Tether to wind down lending of its stablecoins in response to media attacks,"In response to a round of mainstream media attacks on its ability to meet redemptions in the event of financial stress, Tether Holdings, the compa...",27.98,42.22222222222222,0.6402581930160522,23.665000000000003,45.0,8.401870727539062,2022-12-14
164,CoinGape,Crypto Expert Predicts Ethereum (ETH) Price; Time To Buy?,The price of Ethereum (ETH) is continuing to swing sideways as traders continue to be confused about whether or not the cryptocurrency market has ...,50.0,50.0,0.23242831230163574,34.089999999999996,30.0,0.003236532211303711,2022-12-14
165,CoinGape,Goldman Sachs Lowers Tesla Price Target,,43.6,50.0,0.09630322456359863,50.0,50.0,0.0,2022-12-14
166,CoinGape,Japanese Power Giant To Mine Bitcoin,"The utility firm of Japan, Tokyo Electric Power Grid (TEPCO), is working with TRIPLE-1. Bitcoin mining and to capitalize on the excess power in it...",50.0,50.0,99.98205304145813,50.0,40.0,0.287821888923645,2022-12-14
167,CryptoSlate,CryptoSlate Daily wMarket Update – Dec. 13: Bitcoin nears $18K following CPI data release,The total cryptocurrency market cap saw net inflows of $15.74 billion and currently stands at $871.87 billion — up 26% over the past 24 hours. Th...,50.0,50.0,0.011333823204040527,50.0,46.875,2.3248106241226196,2022-12-14
168,Finbold,Machine learning algorithm sets Litecoin price for Christmas Day 2022,The declining price pattern for the majority of the cryptocurrency sector has finally slowed down after months filled with challenges … Continued,50.0,50.0,99.59632754325867,53.86,54.074074074074076,0.8284986019134521,2022-12-14
169,CryptoSlate,Craig Wright vs Hodlonaut trial could go to second round,Crypto influencer Hodlonaut has updated the community regarding his legal quarrel with Craig Wright and said that Wright appealed his loss and cal...,50.0,45.0,2.7357906103134155,39.885,60.0,96.0676521062851,2022-12-14
