,source,title,excerpt,vader_sentiment_title,tb_sentiment_title,flair_sentiment_title,vader_sentiment_excerpt,tb_sentiment_excerpt,flair_sentiment_excerpt,date
249,Blockworks,Alleged Bitcoin Launderer’s Lawyer Seeks Prisoner Swap With Russia,"The only hope for Vinnik is Russia entering into negotiations with the US over the exchange of prisoners, his lawyer said The post Alleged Bitcoin Launderer’s Lawyer Seeks Prisoner Swap With Russia appeared first on Blockworks. (Read More...)",22.884999999999998,45.0,0.08922815322875977,20.029999999999998,58.12500000000001,0.009301304817199707,2022-09-07
250,Cryptonews,"#LUNAClassic Trending on Twitter as (LUNC) Up Over 1,000% since June","Terra Luna Classic (LUNC) is outshining the rest of the crypto market at the moment as it is now up over 80% in September due to the token burn news. It seems Terra Luna Classic is having a bull market of its own at the moment, and has already risen over 1,000% since June 2022. ... Read More: #LU... (Read More...)",50.0,50.0,88.68662714958191,50.0,65.06944444444444,2.4798691272735596,2022-09-07
251,CryptoBriefing,Ethereum Completes Bellatrix in Final Pre-Merge Update,"Bellatrix is Ethereums final upgrade before the Merge. Ethereum just completed its final update ahead of the Merge.https://twitter.com/terencechain/status/1567115533233049606?s=20&amp;t=X26k0deIWCC8lv0SLxSY3AThe number two blockchains latest hardfork, dubbed Bellatrix, launched at epoch 144,896 T... (Read More...)",50.0,50.0,96.09245955944061,60.114999999999995,62.5,22.83356487751007,2022-09-07
252,Crypto Briefing,Ethereum Completes Bellatrix in Final Pre-Merge Update,"Bellatrix is Ethereums final upgrade before the Merge. Ethereum Bellatrix Live Ethereum just completed its final update ahead of the Merge. The number two blockchains latest hardfork, dubbed Bellatrix, launched... (Read More...)",50.0,50.0,96.09245955944061,53.86,61.36363636363637,5.85448145866394,2022-09-07
253,Cryptomode,Cardano-based projects Empowa and World Mobile launch collab NFT,"The joint NFT will finance the construction of affordable housing and decentralized internet in Africa Empowa, a project providing decentralised, affordable home loans for the financially excluded, has partnered with World Mobile, the world’s first blockchain-based mobile network based on the sha... (Read More...)",50.0,50.0,99.70478415489197,32.99999999999999,62.5,99.3868350982666,2022-09-07
254,CryptoPotato,IMF Pitches for Comprehensive Global Regulatory Policy for Cryptocurrencies,"Strict regulation and a level-playing field for all crypto actors and activities are possible under certain conditions, IMF said. (Read More...)",62.5,50.0,99.93292093276978,63.660000000000004,61.904761904761905,89.44579660892487,2022-09-07
255,The Block,Ethereum activates Bellatrix upgrade as last step before The Merge,"Ethereum developers have activated Bellatrix, a key upgrade that will prepare the Beacon Chain for The Merge. (Read More...)",50.0,50.0,97.1730649471283,50.0,62.5,90.36242663860321,2022-09-07
256,Cryptomode,Digital Arms Partners with Metalands to Offer Exclusive Access with Unique Firearm NFT,"Sydney, Australia, 6th September, 2022, Chainwire Digital Arms, a unique platform for owning digital firearm NFTs, is partnering with Metalands, a blockchain P2E first person shooter. The collaboration is enabling the world’s first gaming integration of IP licensed NFT firearms. Laying the pathwa... (Read More...)",56.400000000000006,59.375,99.93623197078705,50.0,61.458333333333336,99.93638098239899,2022-09-07
257,Ethereum World News,"Bellatrix, First of Two Ethereum Upgrades in Final Phase of The Merge, Goes Live","The Bellatrix upgrade, one of the final stages in Ethereum Proof-of-Stake transition, has gone live. The Merge will take place with the Paris upgrade, expected around September 15. Some exchanges and platforms are suspending Ether deposits during this time. The Bellatrix upgrade for Ethereum, one... (Read More...)",50.0,56.439393939393945,98.35731983184814,50.0,56.70454545454545,19.07259225845337,2022-09-07
258,crypto.news,Contour Blockchain Trade Finance Platform Acquires We.Trade ,"Contour blockchain-based trade finance firm on September 5, 2022, announced the acquisition of We.Trade, as part of the latter’s insolvency process. Distributed ledger technology (DLT) is gaining traction in the trade financing sector. Contour Takes Over We.Trade Contour, a firm… (Read More...)",50.0,50.0,97.89404273033142,71.075,55.00000000000001,78.89004945755005,2022-09-07
259,The Daily Hodl,Crypto Analyst Warns Ethereum (ETH) Merge May Trigger Short-Term Price Disaster,"A popular crypto analyst is forecasting Ethereum’s (ETH) potential price trajectory once the platform officially switches to a proof-of-stake consensus model. In a new market report to his 275,000 YouTube subscribers, Jason Pizzino says the price of ETH may hit a brick wall in the short and mid-t... (Read More...)",16.475,50.0,0.05736947059631348,71.075,62.36363636363637,0.14431476593017578,2022-09-07
260,Cryptonews,Lawyer For Alleged Russian Crypto Launderer Seeks Prisoner Swap With U.S.,"As the relations between the U.S. and Russia remain stringent due to the latter country’s invasion of Ukraine, a lawyer for a Russian citizen accused of laundering more than USD 4bn worth of crypto has called on the Kremlin to facilitate a prisoner exchange involving his client with Washington...... (Read More...)",22.884999999999998,47.5,1.2022525072097778,20.705000000000002,59.791666666666664,0.3425091505050659,2022-09-07
261,The Block,Harry Styles and Adele’s record label files trademarks for NFT-backed media,"Sony Music, whose Columbia Records label represents artists such as Adele, Lil Nas X and Harry Styles, made the filing at the end of August. (Read More...)",50.0,50.0,99.60074424743652,50.0,62.5,0.10607242584228516,2022-09-07
262,Cryptomode,"New Governance Token, MetaCryp Network, with High Return Prospect like Sandbox, And Litecoin","The new blockchain project, MetaCryp Network (MTCR), features a governance token that allows the holders the chance and authority to decide on issues affecting the blockchain project’s spread, operations, and development. The governance model assures users that they are crucial to the project’s p... (Read More...)",78.595,57.40909090909091,99.80641603469849,77.86999999999999,60.60606060606061,99.85292553901672,2022-09-07
263,Cryptomode,"Will Tom Holland Join Other Gamers To Invest in Felixphere, The Sandbox, and Decentraland?","We don’t know yet, but we know that the gaming industry has merged with blockchain technology to create the most revolutionary concept of all time, blockchain gaming. Blockchain gaming seeks to incentivize the gaming sector and provide financial opportunities for gamers. Using the play-and-earn m... (Read More...)",64.8,43.75,0.12402832508087158,86.135,66.66666666666666,88.13140094280243,2022-09-07
264,Cryptomode,Zeerozone and The Sandbox Are Two Gaming Coins That Can Be Great!,"Cryptocurrency investment is a rapidly-growing industry, with many new currencies and platforms to choose from. In this article, we’ll take a look at three of the most promising ones: Zeerozone (ZEZO), The Sandbox (SAND), and STEPN (GMT). Each has its own unique features that could make it a succ... (Read More...)",82.94,100.0,99.95881617069244,72.88,70.08116883116882,99.63763952255249,2022-09-07
265,Cryptomode,"PROMISING BINANCE SMART CHAIN CRYPTOCURRENCIES IN 2022: RUNFY, ELLIPSIS, AND METACRAFT","The growth of cryptocurrencies is one of the most exciting developments in the financial world in recent years. While there are many different cryptocurrencies, they all have one thing in common: they are based on blockchain technology. Blockchain is a distributed database that allows for secure,... (Read More...)",89.12,60.357142857142854,99.76251125335693,86.32,60.55555555555555,99.97952282428741,2022-09-07
266,Cryptomode,YOU CAN AVAIL $100 WORTH OF FREE METACRYP (MTCR) TOKENS IF YOU PURCHASE THEM RIGHT NOW!,"Introduction Making money is now a lot easier with cryptocurrencies. It is making headlines worldwide about making people overnight millionaires and massive adoption worldwide. It is a new trendsetter in the financial market, making millions of dollars for its long-term holders because of the spe... (Read More...)",89.405,67.6190476190476,86.9771808385849,71.075,57.95454545454546,99.37866032123566,2022-09-07
267,CryptoSlate,Charles Hoskinson calls Ethereum Classic ‘dead project with no purpose’,Cardano (ADA) founder Charles Hoskinson said Ethereum Classic (ETC) is a “dead project with no purpose or compelling argument to exist outside of spite.” I love how a sustainable development fund turns into a miner tax. (Read More...),35.199999999999996,49.166666666666664,0.058141350746154785,67.0,60.55555555555555,0.008764863014221191,2022-09-07
268,Bitcoin.com,Renault Inks Partnership With The Sandbox to Bring Automotive Experiences to the Metaverse,"The Korean subsidiary of Renault, a historic brand in the automotive industry, is establishing a partnership with The Sandbox, an Ethereum-based metaverse platform, to enter the metaverse space. With this partnership, Renault Korea’s objective is to establish its brand presence in the metaverse a... (Read More...)",50.0,50.0,99.97901022434235,50.0,58.333333333333336,99.78711307048798,2022-09-07
269,BeInCrypto,y00ts NFTs Finally Go Live Despite Last Minute Hitch,The much anticipated y00ts non-fungible token (NFT) collection by Dust Labs has gone live after an initial blocker bug delay. The post y00ts NFTs Finally Go Live Despite Last Minute Hitch appeared first on BeInCrypto. (Read More...),50.0,53.40909090909091,99.86226558685303,34.089999999999996,58.73376623376624,1.2503474950790405,2022-09-07
270,Crypto Daily,Caduceus Blockchain‍ Announces Incubator Program M4TTER,"London, United Kingdom, 6th September, 2022, ChainwireThe M4TTER incubator will see successful projects awarded a $10,000 grant in funding Today, Caduceus Foundation announces the launch of M4TTER, an incubator to promote DeFi, NFT, GameFi, and other blockchain projects. The incubator provides ac... (Read More...)",50.0,50.0,11.981523036956787,96.22999999999999,68.75,99.67832863330841,2022-09-07
271,Cryptomode,Caduceus Blockchain‍ Announces Incubator Program M4TTER,"London, United Kingdom, 6th September, 2022, Chainwire The M4TTER incubator will see successful projects awarded a $10,000 grant in funding Today, Caduceus Foundation announces the launch of M4TTER, an incubator to promote DeFi, NFT, GameFi, and other blockchain projects. The incubator provides a... (Read More...)",50.0,50.0,11.981523036956787,96.22999999999999,68.75,99.59013164043427,2022-09-07
272,Decrypt,HIVE Blockchain to Explore Mining Ethereum Alternatives Ahead of Merge,"HIVE Blockchain is reportedly mining nearly $350,000 in crypto every day and plans to diversify its operations after the merge. (Read More...)",50.0,50.0,98.95550906658173,50.0,65.0,0.19375383853912354,2022-09-07
273,Bitcoin.com,EtherMail Offers a Lifeline to Web3 Projects Stranded by MailChimp,"PRESS RELEASE. MailChimp’s recent decision to suspend newsletter services for crypto businesses expresses the widening chasm between web2 and web3 and the pronounced importance of a robust communications bridge between both realms. In recent weeks, many crypto and NFT projects were abruptly infor... (Read More...)",50.0,55.00000000000001,87.08695471286774,69.08999999999999,58.75,23.42553734779358,2022-09-07
274,crypto.news,IMF Says Crypto Has Greater Potential as a Payment Method Over Weak Currencies,"The International Monetary Fund (IMF) released a report stating that cryptocurrencies have greater potential as a form of payment compared to weak currencies. According to the IMF, crypto hedges significantly better against weaker currencies and has developed a greater presence… (Read More...)",44.865,52.083333333333336,0.6741762161254883,63.660000000000004,60.78125,89.13747668266296,2022-09-07
275,Crypto Daily,Ambire's Ivo Georgiev Talks Future of Ethereum and Stablecoins,"Episode 7 of Ambire Wallet’s Twitter Spaces brings an outlook on the Ethereum space and the role that stablecoins will play in the future. That’s right, Ambirers, our short break is over and we’re back with a new season of our ‘Smart Wallet’ series: new look, new guests, fresh topics and twice th... (Read More...)",50.0,50.0,99.6849536895752,78.595,58.54545454545455,99.84672665596008,2022-09-07
276,Crypto Daily,"AdirizeDAO, Cardano, and Shiba Inu Give Investors Maximum Returns","The best part of crypto blockchains is the censorship-resistant characteristic they carry. Practically anyone can use the blockchains, copy the codes, build decentralized applications and carry out financial activities. This is starkly opposite to the traditional finance system, where barriers pr... (Read More...)",50.0,50.0,99.8575359582901,81.845,61.94444444444444,99.77634847164154,2022-09-07
277,Crypto Briefing,Ethereum to Bitcoin Ratio Hits 2022 High in Merge Run-Up,"The ETH:BTC ratio hit 0.084 Tuesday. Ethereum Rallies Against Bitcoin With the Merge now days away, Ethereum is surging against Bitcoin. TradingView data shows that the ETH:BTC ratio climbed to... (Read More...)",50.0,57.99999999999999,84.87308025360107,50.0,75.0,0.09251832962036133,2022-09-07
278,CryptoBriefing,Ethereum to Bitcoin Ratio Hits 2022 High in Merge Run-Up,"The ETH:BTC ratio hit 0.084 Tuesday. With the Merge now days away, Ethereum is surging against Bitcoin.[caption id=""attachment_121194"" align=""aligncenter"" width=""782""] ETH/BTC year-to-date (Source: TradingView)[/caption]TradingView data shows that the ETH:BTC ratio climbed to a 2022 high early Tu... (Read More...)",50.0,57.99999999999999,84.87308025360107,50.0,62.66666666666667,0.15627741813659668,2022-09-07
279,Cryptonews,Battle Infinity Fantasy Sports P2E Platform Has Found the Sweet Spot,"Play-to-earn (P2E) games like Axie Infinity have been in something of a slump recently with players getting tired of long grinds and repetitive earning mechanics. However, that's not to say P2E gaming is dead, the focus simply needs to shift toward gameplay. Play-to-earn gaming has become incredi... (Read More...)",55.135,67.5,99.97120499610901,11.414999999999997,47.14285714285714,0.06402134895324707,2022-09-07
280,U.Today,September 13 Is Crucial Date For Cryptocurrency Market And Not Only Because of Ethereum Merge,"Massive volatility spike is what majority of cryptocurrency market expects, but there's another thing besides Merge that will cause it (Read More...)",50.0,50.0,83.76562595367432,50.0,62.5,11.64655089378357,2022-09-07
281,Bitcoin.com,Report: Saudi Arabia’s Central Bank Hires Virtual Assets and Digital Currency Program Lead,The Saudi Arabian central bank has reportedly appointed Mohsen Al Zahrani as the lead of the bank’s virtual assets and digital currency project. The emergence of the United Arab Emirates (UAE) as the regional crypto hub is believed to have forced authorities in Saudi Arabia to consider formally r... (Read More...),58.894999999999996,50.0,3.640758991241455,56.400000000000006,52.5,1.0315537452697754,2022-09-07
282,Chain Debrief,"Earn 86% On Your USDT With DeFiGa, It’s Probably A Rug Tho","“Do You Know You Can Earn Up 86% APR On USDT During This Bear Market?” At first sight, this got me excited, wanting to find out more. I even calculated what earning 84% from my current portfolio would like. Not gonna lie, the temptation was real. But in the back of my head, I was […] (Read More...)",50.0,50.0,2.2499531507492065,67.53,63.035714285714285,96.82451486587524,2022-09-07
283,U.Today,Mysterious Bitcoin Whale Cashes out $95 Million in Gains After Years of “Hodling”,"This is 2,800% increase at current price (Read More...)",67.0,50.0,7.5805991888046265,65.91,62.5,99.52199459075928,2022-09-07
284,Feed - Cryptopotato.Com,Netflix Won’t Run Crypto Promotions When it Rolls Out Ad Services (Report),"Netflix might ban cryptocurrency, political, and gambling adverts on its platform. (Read More...)",50.0,50.0,0.1394718885421753,22.13,62.5,0.046122074127197266,2022-09-07
285,BeInCrypto,PancakeSwap Makes Fifth Attempt at Breakout Following CAKE Burn,"PancakeSwap (CAKE) is trading inside a long-term bullish pattern, but it has yet to confirm that it will break out from it. The post PancakeSwap Makes Fifth Attempt at Breakout Following CAKE Burn appeared first on BeInCrypto. (Read More...)",50.0,50.0,0.03058910369873047,50.0,62.5,0.00133514404296875,2022-09-07
286,U.Today,"Here’s Who Is Buying LUNC Instead of SHIB and Why, David Gokhshtein Explains",CEO of PAC Protocol shares his view as to who is currently buying LUNC and what for (Read More...),50.0,50.0,3.2012492418289185,64.8,62.5,23.489856719970703,2022-09-07
287,Forkast.News,Crypto exchange Bybit barred from brokering securities in Brazil,"The Securities and Exchange Commission of Brazil (CVM) has banned Singapore-based cryptocurrency exchange Bybit from brokering “securities” within the country. See related article: Thailand mandates warnings on crypto ads Fast facts The CVM released a declaratory act, in an announcement on Monday... (Read More...)",64.8,50.0,0.15702247619628906,27.060000000000002,61.66666666666667,0.05443096160888672,2022-09-07
288,Crypto Daily,21.co raises $25 million - Switzerland’s largest crypto unicorn,"21.co, a crypto investment product company, said on Tuesday that it had raised $25 million in a funding round, which valued it at $2 billion, making it Switzerland’s biggest crypto unicorn. The $25 million funding round was led by Marshall Wace, with investments from Collab+Currency, Quiet Ventur... (Read More...)",50.0,50.0,90.0434285402298,72.02,51.24999999999999,18.158572912216187,2022-09-07
289,Cointelegraph,Vitalik reminds node operators to update client before the Bellatrix upgrade,"The Bellatrix hard-fork is the final update on the Beacon chain that will prepare it for the Merge, and if node operators are not updated to the latest client, they risk syncing to the pre-fork chain. (Read More...)",50.0,50.0,75.94330608844757,36.34,66.66666666666666,0.0031828880310058594,2022-09-07
290,U.Today,"Cardano Creator Calls Ethereum Classic a Dead Project, while ETC Price Grows 30%","Ethereum Classic (ETC) has no argument in support of its existence, says Charles Hoskinson (Read More...)",17.570000000000004,49.166666666666664,0.04462301731109619,37.5,66.66666666666666,1.0295301675796509,2022-09-07
291,The Block,Crypto investment app Bitpanda adds commodities trading,"Crypto investment platform Bitpanda has launched the ability for users to trade commodities such as oil, natural gas, aluminum and wheat. (Read More...)",50.0,50.0,10.641440749168396,82.43,60.0,22.283262014389038,2022-09-07
292,CoinGape,"Coinbase Big Reveal About The Merge, How Will This Impact Ethereum","The Ethereum Merge is just about a week away. The merge will be one of the largest events in crypto’s history. As a result, it has many ramifications. One such scenario is regarding the censorship issues after the merge. Fortunately for ETH, Coinbase may be solving this biggest concern. The chief... (Read More...)",50.0,50.0,23.019373416900635,67.0,67.5,0.9577691555023193,2022-09-07
293,Cointelegraph,Reddit NFT avatars selling for a premium on OpenSea,Reddit’s launch of limited edition NFT avatars has led to a large premium on secondary sales on OpenSea. (Read More...),50.0,50.0,2.90033221244812,38.685,54.285714285714285,16.03526473045349,2022-09-07
294,Blockonomi,Bybit Brings USDC-Based Options for ETH & SOL to Clients,"Leading exchange ByBit was the first to bring USDC options to the markets, now the exchange is expanding its offerings, by adding Ether (ETH) and Solana (SOL) contracts. It already offered USDC-based BTC options. As a way of celebrating this momentous occasion, ByBit has opted to cut trading fees... (Read More...)",50.0,50.0,99.8945564031601,69.08999999999999,68.75,93.42282116413116,2022-09-07
295,BeInCrypto,Ethereum Mining Revenue Outperforms Bitcoin in Last Full Month of PoW Before Merge,Ethereum mining revenue surpassed Bitcoin again in August in the last full month before it becomes a proof-of-stake (PoS) asset in September. The post Ethereum Mining Revenue Outperforms Bitcoin in Last Full Month of PoW Before Merge appeared first on BeInCrypto. (Read More...),50.0,58.75,0.7098257541656494,68.06,62.083333333333336,0.1288294792175293,2022-09-07
296,Crypto Daily,"The Leap For Freedom - The EOS Hard Fork, Antelope","To those inside the Web3 arena, the EOS story is well known. It’s a story about how EOS founders, Block.one raised a huge amount of funding for what was meant to be an incredible POS blockchain, with everything going for it, and then completely neglected it. Rather than investing the raised funds... (Read More...)",79.295,35.416666666666664,99.95718598365784,46.23,73.75,78.08705866336823,2022-09-07
297,CoinGape,"Terra Classic (LUNC) Price Skyrockets 70%, Here’s Why More Rally Is Expected","All Terra tokens witness a massive rally as the community aims to recover prices through burning, staking, project building, ecosystem education, and governance. Especially, Terra Classic (LUNC) has grabbed significant interest from investors with the daily trading volume jumping over $2 billion.... (Read More...)",50.0,59.44444444444444,0.23025572299957275,79.295,58.68055555555556,99.75127875804901,2022-09-07
298,Blockworks,Binance To Rename All Stablecoin Holdings to BUSD,"User balances in USDC, USDP and TUSD will be converted into the exchange’s Binance USD stablecoin on Sept. 29 The post Binance To Rename All Stablecoin Holdings to BUSD appeared first on Blockworks. (Read More...)",50.0,50.0,0.8982270956039429,50.0,68.75,0.0015556812286376953,2022-09-07
299,Cryptonews,Ethereum Classic Pumps 26% as Miners Make Switch ahead of ETH Merge,Ethereum Classic has pumped 26% in the last 24hrs as miners continue to make the switch from Ethereum ahead of The Merge. With Ethereum (ETH) switching from a Proof-of-Work to a Proof-of-Stake (PoS) consensus - scheduled for September 19 - there has been a marked increase in the network hashrate ... (Read More...),50.0,58.333333333333336,99.70217049121857,65.91,59.583333333333336,76.96488499641418,2022-09-07
300,Cryptomode,Kryptomon to Launch an Exclusive Physital NFT Collection on Binance NFT,"Amsterdam, Netherlands, 6th September, 2022, Chainwire The blockchain game Kryptomon, a living-NFT-powered Metaverse project combining Play-and-Earn gaming with nostalgic charm, announced today its official sale on Binance NFT, the NFT marketplace of Binance, the world’s leading blockchain ecosys... (Read More...)",56.400000000000006,50.0,98.80917966365814,70.095,43.333333333333336,99.99551773071289,2022-09-07
301,CoinGape,Binance BUSD Trading Volume Skyrockets By 70%; Here’s Why,"Binance USD (BUSD), the world’s third largest stablecoin’s 24 hour trading volume recorded a whooping surge of 70% on Tuesday. This jump came in accordance with the recent big announcement made by the Binance. BUSD to replace USDC? In a post, Binance announced that it introducing BUSD Auto conver... (Read More...)",50.0,50.0,0.21139681339263916,50.0,56.25,0.13442039489746094,2022-09-07
302,Forkast.News,"Markets: Bitcoin, Ether, Solana, Cardano, XRP extend gains on the day","Prices of Bitcoin, Ethereum, Cardano, XRP and Solana rose on Tuesday afternoon in Asia. See related article: Markets: Bitcoin rises slightly, Ether and Ethereum Classic gain amid price run for alternatives Fast facts Bitcoin rose 0.77% in the past 24 hours as of 4 p.m. in Hong Kong to US$19,906.8... (Read More...)",73.83500000000001,50.0,99.10936951637268,76.335,60.3125,0.41899681091308594,2022-09-07
303,Bitcoinist,How Acquire.Fi Is Bridging Investing And Web3 To Create Inclusive Wealth Building Tools,"The creation of wealth in Web3 is at the forefront of investors’ minds from the moment they first interact with the space. Unfortunately, the creation of sustainable wealth has not been the case so far. As was seen with collapses like the Terra network, it is now more critical than ever that ther... (Read More...)",82.43,50.0,99.64097440242767,85.50999999999999,57.08333333333333,80.88808357715607,2022-09-07
304,Crypto Daily,Kryptomon to Launch an Exclusive Physital NFT Collection on Binance NFT,"Amsterdam, Netherlands, 6th September, 2022, ChainwireThe blockchain game Kryptomon, a living-NFT-powered Metaverse project combining Play-and-Earn gaming with nostalgic charm, announced today its official sale on Binance NFT, the NFT marketplace of Binance, the world’s leading blockchain ecosyst... (Read More...)",56.400000000000006,50.0,98.80917966365814,70.095,43.333333333333336,99.99415278434753,2022-09-07
305,Cointelegraph,Exiled Myanmar democratic leaders want to issue CBDC to fund the revolution,The National Unity Government is considering using the country’s frozen reserves as a backing for the digital currency. (Read More...),53.86,50.0,3.8796961307525635,51.29,62.5,0.7448971271514893,2022-09-07
306,Crypto Daily,"Uniglo (GLO) Shows Deflationary Qualities with Ultra-Burn, Making it a Better Investment than Dogecoin (DOGE) and Eos (EOS)","Dogecoin (DOGE) and Eos (EOS) are some of the mainstay players in the cryptocurrency world. They each have a strong following of advocates and users and are considered a relatively good investment. However, a new decentralized project called Uniglo (GLO) could be a better investment than these tw... (Read More...)",72.02,75.0,0.44113993644714355,92.21,68.91414141414141,96.74187004566193,2022-09-07
