,source,title,excerpt,vader_sentiment_title,tb_sentiment_title,flair_sentiment_title,vader_sentiment_excerpt,tb_sentiment_excerpt,flair_sentiment_excerpt,date
250,Crypto Daily,How Diamonds Can Make it Impossible to Copy and Paste NFTs,"Diamonds continue to shimmer in the digital world. Already one of nature's most beautiful creations, diamonds continue to gain popularity as one of the most-desired NFT assets. Crypto and diamonds already have a storied history. A mystery buyer paid $12.3 million in virtual currency for a diamond... (Read More...)",50.0,16.666666666666668,87.89036870002747,96.785,73.125,99.98755156993866,2022-08-24
251,Coinnounce,Celsius CFO Denies Claims He Cannot Fund Operations,"Celsius Network continues to fight bankruptcy, and there have been some interesting findings in the court filings as the cases progressed. The most recent of these was the company’s struggle to finance its day-to-day operations. After current CFO Chris Ferraro withdrew his motion to repurchase fo... (Read More...)",28.925,50.0,0.01836419105529785,35.199999999999996,65.0,0.3041297197341919,2022-08-24
252,Ethereum World News,Hodlnaut Says It’s Not Being Investigated Singapore Police,Hodlnaut said that it was not the subject of an investigation by the Singapore Police Force. It offered a summary of events in the judicial review case. The company paused withdrawals earlier this month and is facing a $193 million financial deficit. Crypto firm Hodlnaut has announced that it is ... (Read More...),50.0,50.0,0.33718347549438477,29.905000000000005,51.33333333333333,0.021210312843322754,2022-08-24
253,AMBCrypto,Ethereum overtakes reigning champion Cardano in terms of…,"The developers of a blockchain network play a critical role in the growth and expansion of the network. From designing and maintaining the architecture to building smart contracts — developers do it all. And, in light of recent developments, Ethereum [ETH] has come out on top to have the maximum ... (Read More...)",79.97000000000001,50.0,82.21182227134705,86.75500000000001,63.45238095238095,99.97451305389404,2022-08-24
254,Crypto Daily,How NFTs are Helping Bring More Diversity and Inclusion to Web3.0,"Throughout the ages, traditional art spaces have often lacked diversity, with US museum collections comprising 85% white and 87% male artists. With the emergence of NFTs, though, a more diverse range of artists are able to gain exposure without having to face the exclusion faced from traditional ... (Read More...)",64.8,75.0,99.96215105056763,64.8,60.71428571428571,99.9024510383606,2022-08-24
255,BeInCrypto,"Bitcoin (BTC) Struggles to Initiate Bounce From $21,000","Bitcoin (BTC) is still trading in the lower portion of a corrective pattern that has been in place since June 18. The direction of the trend is still undetermined. The post Bitcoin (BTC) Struggles to Initiate Bounce From $21,000 appeared first on BeInCrypto. (Read More...)",31.94,50.0,0.008529424667358398,21.405,68.75,0.0008702278137207031,2022-08-24
256,Crypto Daily,"Samsung To Launch Crypto Exchange, Crypto Daily TV 23/08/2022","In Todays Headline TV CryptoDaily News: Australia’s government signals its crypto regulation stance. Australia’s new government has signaled its first moves to regulate the crypto industry, with a “token mapping” exercise to be conducted by the Treasury by the end of the year. Samsung to launch a... (Read More...)",50.0,50.0,91.4417028427124,60.114999999999995,64.77272727272727,1.5348225831985474,2022-08-24
257,Chain Debrief,Avium Secures $2M In Funding To Build An Entertainment Brand For Production Studio Behind Marvel Comics & Netflix,"Securing US$2M in funding Web3 media start-up Avium has secured a $2M pre-seed from strategic investors to help greenlight stories by South East Asia’s studios in producing original content that has developed Marvel Comics, Valve (Dota), Netflix, Prime Video, Tencent and more. The recent pre-seed... (Read More...)",89.225,30.0,99.3655800819397,94.78500000000001,64.75,99.57023859024048,2022-08-24
258,Finbold,DBS bank-owned exchange reports surge in crypto trading volume despite market volatility,"Despite volatility in the cryptocurrency markets over the past few months, Singapore’s DBS bank’s brokerage arm DBS Digital Exchange (DDEx),... Continue reading (Read More...)",50.0,50.0,97.40784764289856,50.0,50.625,10.862365365028381,2022-08-24
259,CoinGape,"Bitcoin Energy Consumption To Decline As It Hit $100K, $500k, $2M By 2040, Here’s Why","Bitcoin energy consumption in the future depends massively on the future Bitcoin (BTC) price, according to an analysis by Arcane Research. If the BTC price reaches $2 million by 2040, Bitcoin energy consumption may hit 894 TWh per year. However, if the BTC price reaches $500,000 by 2040, Bitcoin ... (Read More...)",63.660000000000004,50.0,0.023227930068969727,77.86999999999999,56.25,0.029665231704711914,2022-08-24
260,U.Today,"XRP Is One Of Best Looking Charts on Crypto, Here's Why",XRP's NVT shows bullish divergence as asset's market cap dives deeper (Read More...),81.845,100.0,99.9868780374527,50.0,75.0,2.8202325105667114,2022-08-24
261,Cointelegraph,One-third of estimated 115M Indian crypto users concerned about regulations,"A KuCoin survey estimates that some 115 million Indian citizens are invested in cryptocurrencies, while many are still concerned about the government's stance towards the sector. (Read More...)",50.0,50.0,3.254365921020508,50.0,75.0,0.36382973194122314,2022-08-24
262,Forkast,More than half of Indian crypto investors want to increase investments: report,"Over 50% of Indian crypto investors intend to increase their investments over the next six months as they view the asset class as a long-term investment rather than hype, according to a report by cryptocurrency exchange Kucoin. See related article: Most Indian traders impacted by India’s crypto t... (Read More...)",69.08999999999999,58.333333333333336,0.6714969873428345,79.295,62.5,0.029158592224121094,2022-08-24
263,crypto.news,Tencent Granted Patent for a Blockchain-Based Missing Persons Tracing Posters,"Chinese technology giant Tencent recently secured a novel patent for a blockchain-based unknown person’s poster, according to local media outlet. Tencent Gets Approval for a Missing Person Poster on the Blockchain From the initial filing in December 2019 until the… (Read More...)",47.42,40.0,12.461638450622559,85.48,51.24999999999999,0.12218952178955078,2022-08-24
264,CryptoGlobe,$ETH: ConsenSys Highlights 5 Misconceptions About Ethereum’s “Merge” Upgrade,"On Monday (August 22), blockchain technology company ConsenSys said that there are still five common misconceptions about Ethereum’s upcoming “Merge” upgrade, which marks the transition from proof-of-work (PoW) to proof-of-stake (PoS). Here is how ConsenSys describes what it does: “ConsenSys is t... (Read More...)",50.0,50.0,86.72933280467987,50.0,55.00000000000001,0.01322925090789795,2022-08-24
265,The Block,DeFi Kingdoms to leave Harmony for metaverse-focused blockchain,Blockchain-based game DeFi Kingdoms (DFK) has found a new home for the Serendale-based part of its game on the metaverse-focused blockchain Klaytn. (Read More...),68.06,50.0,1.022973656654358,50.0,47.95454545454545,99.03991520404816,2022-08-24
266,CryptoPotato,This Indicator Suggests There Might Be More Pain to Come for Bitcoin,"Bitcoin's price might be in for further declines, at least according to this indicator. (Read More...)",22.185,75.0,2.0423471927642822,50.0,53.333333333333336,0.013753771781921387,2022-08-24
267,Decrypt,"Near’s Rainbow Bridge Blocks Another Attack, Costing Hackers 5 Ethereum","The Rainbow Bridge hack over the weekend saw funds returned in 31 seconds with no harm to users, but the attackers lost 5 Ethereum in the process. (Read More...)",19.379999999999995,55.00000000000001,0.5250930786132812,5.159999999999998,75.0,0.015854835510253906,2022-08-24
268,CoinGape,Just In: India Launches Blockchain Forum To Boost Web 3.0 Adoption,"India as a nation has faced multiple regulatory challenges over the dealing and trading of digital assets. However, in order to keep up with evolving global industry, a group of key influencers launched India Blockchain Forum. Will blockchain forum boost Web 3.0 adoption? According to reports, Of... (Read More...)",70.095,50.0,96.93803489208221,81.845,55.00000000000001,13.33152949810028,2022-08-24
269,Cointelegraph,Bitcoin addresses in loss hit 1-month high as BTC price retests $21K,There are now more than 17.5 million Bitcoin wallets underwater with little faith in a rebound coming from analysts in the face of a surging dollar. (Read More...),34.089999999999996,57.99999999999999,0.001239776611328125,68.13,63.541666666666664,0.019791722297668457,2022-08-24
270,Crypto Daily,Market strategist calls next 50% fall for bitcoin,"Gareth Soloway calls for another leg down for bitcoin which could take it to the depths of $12,000. Gareth Soloway is the Chief Market Strategist for IntheMoneyStocks.com, and he correctly called Bitcoin’s fall from its highs last year, giving a target of $20,000. In a recent interview with David... (Read More...)",50.0,50.0,0.02523660659790039,67.0,54.30555555555555,0.048983097076416016,2022-08-24
271,Bitcoin.com,Latest Ghana Benchmark Rate Hike the Largest on Record — President Promises Action Against ‘Unacceptable Depreciation of the Cedi’,"After seeing Ghana’s inflation rate surge to 31.7% in July, the Bank of Ghana responded by hiking the benchmark interest rate by 300 basis points. In addition to the rate hike, the central bank said it will gradually raise banks’ primary reserve requirements. One expert has said President Nana Ak... (Read More...)",69.08999999999999,65.0,9.103366732597351,72.94,65.0,0.054907798767089844,2022-08-24
272,Cryptonews,Argentinian Presidential Hopeful Reportedly Faces Crypto Scam Promotion Wrap,"A group of Argentine crypto investors have launched a lawsuit against Javier Milei, an outspoken MP and bitcoin (BTC) advocate who wants to run for president. The media outlet Clarín reported that a lawyer named Juan Pablo Chiesa, who is representing the group, says that the investors lost around... (Read More...)",44.865,50.0,0.01634955406188965,29.905000000000005,67.5,0.012996792793273926,2022-08-24
273,BeInCrypto,Iran Continues Clamp Down on Illegal Crypto Mining,"Authorities in Iran have seized over 9,000 illegal crypto mining rigs in Tehran in the last five months. The post Iran Continues Clamp Down on Illegal Crypto Mining appeared first on BeInCrypto. (Read More...)",22.13,33.611111111111114,0.22630393505096436,9.899999999999999,46.620370370370374,0.2453625202178955,2022-08-24
274,Crypto Daily,"Gnox (GNOX) Adds $50,000 In Start Up Capital To DeFi Treasury, Outpacing Solana (SOL), Bitcoin (BTC), And Xrp (XRP)","Gnox, a decentralized finance platform, has added $50,000 in start-up capital to its treasury. The move comes as Gnox looks to bolster its position in the burgeoning DeFi space. The $50,000 will be used to help Gnox invest in more high-yield opportunities that will generate passive income for its... (Read More...)",60.114999999999995,50.0,1.017463207244873,90.03999999999999,75.0,13.191381096839905,2022-08-24
275,U.Today,"Peter Schiff Expects Bitcoin Price to Dump Soon, Here's Why","Vocal regular Bitcoin critic, economist Schiff, believes BTC is bound to resume dropping soon, giving his reason for it (Read More...)",30.910000000000004,50.0,0.04836916923522949,53.86,62.5,0.028339028358459473,2022-08-24
276,Forkast,"Markets: Bitcoin edges up, Ether posts biggest gain among top 10 tokens","Bitcoin made up some ground, while Ethereum posted the largest gain among the top 10 coins by market capitalization in Tuesday afternoon trading in Asia. Dogecoin was the second-largest gainer among the top 10. See related article: Markets: Bitcoin, Ether mixed; Solana hit six-week low overnight,... (Read More...)",81.845,75.0,0.058206915855407715,79.97000000000001,62.5,0.2670496702194214,2022-08-24
277,Finbold,"Ethereum is currently the most actively developed crypto, Polkadot ranks 2nd","As the cryptocurrency sector navigates through a bear market, different projects appear unfazed by the conditions accelerating development activities on... Continue reading (Read More...)",69.02000000000001,57.49999999999999,99.83274340629578,50.0,62.5,4.091843962669373,2022-08-24
278,Decrypt,"Metaverse, NFT Tokens Have Plummeted More Than 20% This Week","Amid a market-wide rout, significant gaming and metaverse tokens are falling harder than most. (Read More...)",50.0,75.0,0.003355741500854492,52.580000000000005,65.9375,0.2435743808746338,2022-08-24
279,CoinTelegraph,Iran Impart Association demands regulatory clarity to use crypto in foreign trade,Corporate lobbyists urge the government to create a proper infrastructure and avoid the emergence of business rent. (Read More...),70.095,43.75,3.574395179748535,48.71,58.333333333333336,0.5320847034454346,2022-08-24
280,The Daily Hodl,Analyst Who Called 2018 Bitcoin Bottom Predicts Strong Ethereum Rally by End of 2022 – But There’s a Catch,"The crypto strategist who nailed Bitcoin’s (BTC) 2018 bear market bottom is predicting a strong year-end performance for Ethereum (ETH). The pseudonymous analyst known in the industry as Smart Contracter tells his 210,600 Twitter followers that while he sees Ethereum rallying nearly 70% in Q4, he... (Read More...)",64.23,71.66666666666667,15.685799717903137,85.92,65.5952380952381,1.3584673404693604,2022-08-24
281,Crypto Daily,Uniglo (GLO) Has Investors Confidence To Yield Better Returns Than Shiba Inu (SHIB) And Solana (SOL),"When making investment in crypto right now, it can be good to look at what other investors are doing. When something has the confidence of the market, it could be set up for massive gains. And confidence is a little harder to find in crypto right now, because of overall market conditions. But the... (Read More...)",86.75500000000001,75.0,99.358731508255,85.7,57.54960317460317,2.8116554021835327,2022-08-24
282,U.Today,XRP and Cardano (ADA) Managed to Attract Positive Flows Last Week Despite Crypto Market Drop,XRP and ADA among few who finished last week with positive values of fund flows (Read More...),89.27000000000001,55.68181818181818,99.17194545269012,87.14999999999999,56.59090909090909,22.629714012145996,2022-08-24
283,crypto.news,"IoTeX outperforms blockchain IoT competition, is poised for increased adoption, says Messari",IoTeX is an all-encompassing IoT-focused blockchain that's currently outperforming competition as per a Messari Research report. (Read More...),73.83500000000001,50.0,90.66566526889801,50.0,62.5,6.808143854141235,2022-08-24
284,Chain Debrief,S.Korea Takes Another Step Into Web3.0 With Samsung Launching Crypto Exchange,"South Korean multinational manufacturing conglomerate, Samsung, is planning to launch its own Cryptocurrency Exchange. Samsung Securities among several others filed paperwork to seek preliminary approval to establish a crypto exchange in South Korea. If successful, the companies will obtain their... (Read More...)",50.0,50.0,9.992715716362,92.21,73.125,1.2414902448654175,2022-08-24
285,crypto.news,Celsius Update: Depositors Hire Lawyers to Recover $14 Million,Celsius Network has seen yet another set of claimants join together and hire a lawyer as the firm’s bankruptcy becomes increasingly messy and fractious. Celsius Withhold Accounts Gets Legal Representation The new group called “Celsius Withhold Accounts” claims about $14.5… (Read More...),50.0,50.0,0.01347959041595459,52.580000000000005,54.36363636363636,0.14591515064239502,2022-08-24
286,Crypto Daily,CoinLoan’s fifth anniversary marked with a special edition NFT Token for customers,"23 August 2022, Tallinn: CoinLoan, the leading EU-regulated crypto company, is celebrating its fifth anniversary by giving back to the customers that have helped make it one of the fastest-growing crypto exchanges in the industry. The company is releasing a limited number of special edition NFTs ... (Read More...)",70.095,61.42857142857143,99.63907301425934,90.10000000000001,59.82142857142857,99.62785840034485,2022-08-24
287,Cointelegraph,Bitcoin mining to cost less than 0.5% of global energy if BTC hits $2M: Arcane,"Bitcoin may be a significant energy consumer in 2040, but only if its price reaches several million dollars, according to new estimates by Arcane Research. (Read More...)",63.660000000000004,45.83333333333333,0.003725290298461914,65.35499999999999,60.11363636363636,0.11789798736572266,2022-08-24
288,CryptoPotato,"Bitcoin Price Struggles at $21K, EOS Soars 20% (Market Watch)","EOS has gained the most from the altcoins, followed by ATOM. Bitcoin currently stands above $21,000. (Read More...)",31.94,50.0,0.035578012466430664,69.08999999999999,62.5,98.5451340675354,2022-08-24
289,Ethereum World News,The Price Of TONCOIN Surges After Telegram Founder Floats The Idea Of “NFT Like Smart Contracts” To Auction Usernames,"Founder of Telegram Pavel Durov teases creating a new marketplace to auction usernames. Durov’s idea seems to have been inspired by the TON DNS auction conducted by the open network earlier in July Pavel Durov, the founder of the instant messaging application Telegram has suggested a new idea tha... (Read More...)",81.845,60.71428571428571,3.4730762243270874,74.695,56.439393939393945,0.0573575496673584,2022-08-24
290,Crypto Daily,"NEAR Rainbow Bridge Turns Tables On Hacker, Foils Weekend Attack","Aurora Labs CEO Alex Shevchenko revealed on Monday that the NEAR-ETH Rainbow bridge was the target of a hacking attempt over the weekend. However, protocols put in place successfully defended the bridge against the hacker while user funds remained secure. A Foiled Attack The Aurora Labs CEO revea... (Read More...)",26.165,55.00000000000001,18.616488575935364,68.06,77.49999999999999,0.9412586688995361,2022-08-24
291,Blockonomi,Samsung To Launch Crypto Exchange In 2023 Says New Report,"A Korea-based news outlet reported on Monday that seven securities companies in South Korea are seeking approval to enter the crypto ecosystem with trading platforms in 2023. Two notable names on the list are Samsung Securities, a financial-focused subsidiary of Samsung Group, and Mirae Asset Sec... (Read More...)",50.0,56.81818181818181,76.64295732975006,92.00999999999999,65.0,0.71677565574646,2022-08-24
292,BeInCrypto,"Euro Falls Below US Dollar for Second Time Since 2002, Reaching 20-Year Low","The euro has fallen below the U.S. dollar for the second time in 20 years, also hitting a 20-year low. The currency is now priced at 0.990 to 1 USD. The post Euro Falls Below US Dollar for Second Time Since 2002, Reaching 20-Year Low appeared first on BeInCrypto. (Read More...)",46.14,50.0,0.014188885688781738,20.029999999999998,56.25,0.0007212162017822266,2022-08-24
293,U.Today,Ethereum PoW Receives Extremely Important Update,Pre-Merge Ether can be used safely now as important update rolls out (Read More...),63.580000000000005,70.0,0.6919682025909424,80.62,73.33333333333333,99.67814087867737,2022-08-24
294,Chain Debrief,You May Now Have To Pay For Your Telegram Handle – Thanks To Web3.0,"Did you know that Telegram has their own blockchain? Named “The Open Network (TON)”, it was developed by the Telegram team and launched for testnet in 2018. However, the popular messaging application withdrew from the project in 2020, following litigation with the United States Securities and Exc... (Read More...)",68.06,60.0,0.28855204582214355,87.895,65.0,0.04756152629852295,2022-08-24
295,Forkast,Australia’s crypto industry split on Treasury’s ‘token mapping’ scheme,"Australia’s government has come up with a buzz word “token mapping” to describe how it plans to manage cryptocurrencies, a procedure that aims to plug gaps in regulations, set licensing and custody rules, and protect investors. Not everyone in the crypto industry is cheering. Australia’s Treasury... (Read More...)",50.0,50.0,4.890242218971252,85.48,75.0,0.8298248052597046,2022-08-24
296,Finbold,AMC stock drops over 40% – here’s what we know,"On August 22, AMC Entertainment (NYSE: AMC) stock plunged by 41.59%, making for a miserable trading day for shareholders. AMC’s... Continue reading (Read More...)",50.0,50.0,0.04858970642089844,44.865,37.5,0.00042319297790527344,2022-08-24
297,Cointelegraph,AMM protocol SudoRare disappears from the internet with 519 ETH,"SudoRare suddenly shut down its services and social media accounts after reportedly making away with 519 Ether, worth roughly $815,000. (Read More...)",32.99999999999999,50.0,0.002592802047729492,61.315,54.81481481481482,0.0068187713623046875,2022-08-24
298,U.Today,Mark Cuban Slams SEC's Approach to Crypto Regulation,Billionaire wants SEC to publish comprehensive guidelines for cryptocurrencies (Read More...),50.0,45.0,22.488513588905334,62.5,60.0,1.1571615934371948,2022-08-24
299,CoinGape,Billionaire Mark Cuban Blasts SEC Chair Over Crypto Regulations,(Read More...),50.0,45.0,0.8564651012420654,50.0,75.0,96.50535881519318,2022-08-24
300,Cryptomode,Millions Lost in Private Keys Hack: 3 New Ways To Prevent An Attack,"Earlier this month, over $5 million was drained from thousands of wallets that interacted with the Solana blockchain. This unprecedented attack resulted from faulty software wallets that compromised users’ private keys. Previously, many believed this kind of hack was impossible, but now crypto ho... (Read More...)",17.570000000000004,60.60606060606061,0.0962972640991211,23.270000000000003,60.952380952380956,0.0007450580596923828,2022-08-24
301,CryptoPotato,Phemex: The One-Stop Crypto Solution,"Within the vast cryptoverse, there are many things to learn about. Understanding all the various elements of the industry can seem like an enormous task because new trends are constantly emerging. While there is no way to truly learn everything, there is to know about cryptocurrencies, doing your... (Read More...)",65.91,50.0,99.90113377571106,74.695,58.11688311688311,99.89537596702576,2022-08-24
302,Cryptomode,"Gnox (GNOX) Is $50,000 On The Way To Showing LidoDAO (LDO) And MakerDAO (MKR) How To Multiply A Treasury","Treasury management is an essential function for the success of DeFi (decentralised finance) protocols. A new yield farming as a service protocol, Gnox (GNOX), launching imminently on the Binance Smart Chain, is leading the way with its growth specialised treasury fund. The Gnox team have injecte... (Read More...)",60.114999999999995,50.0,2.6862651109695435,94.55,61.50649350649351,99.91863071918488,2022-08-24
303,Cryptomode,"Rumour Has It, Uniglo (GLO) Headhunted Team Members From Cardano (ADA) and Fantom (FTM)","It’s a traditional practice in crypto for developers and team members of DeFi platforms to remain anonymous. While this might seem like a counterintuitive practice, it protects these people from being the target of crypto hackers, thieves, blackmailers, and wackos. However, all respectable DeFi p... (Read More...)",50.0,50.0,0.0117570161819458,76.335,66.66666666666666,19.87697184085846,2022-08-24
304,Feed - Cryptopotato.Com,Scaramucci Predicts When Bitcoin Will Become a Hedge Against Inflation,"BTC wallets need to reach a billion, so the primary cryptocurrency could be considered a hedge against inflation, Scaramucci said. (Read More...)",50.0,50.0,3.0357271432876587,51.29,72.5,4.574516415596008,2022-08-24
305,Forkast.News,Tencent gets patent nod to use blockchain for missing persons’ notices,"Chinese tech giant Tencent has received a patent for blockchain-based notices for missing persons, as the tech firm continues to explore blockchain applications despite shutting one of its non-fungible token (NFT) platforms recently. See related article: Tencent’s Huanhe allows NFT refunds, halts... (Read More...)",35.199999999999996,40.0,99.48013722896576,35.199999999999996,50.71428571428571,21.25381827354431,2022-08-24
306,Bitcoinist,"The EFF Calls Out OFAC, Asks For Clarity Around The Tornado Cash Situation","It’s time for the EFF to speak out on the Tornado Cash situation. The OFAC sanctioning a smart contract might’ve been going a step too far, they stepped into the Electronic Frontier Foundation’s turf. We could summarize the EFF’s case with this sentence: “for decades, U.S. courts have recognized ... (Read More...)",70.095,50.0,3.775376081466675,73.615,63.57142857142857,0.9218692779541016,2022-08-24
307,Cryptonews,"Rainbow Bridge Resists Another Hack, Attacker Loses ETH 5","The Rainbow Bridge, which facilitates the transfer of cryptographically provable data between Near (NEAR) and Ethereum (ETH), has survived another hack, with the hacker losing ETH 5 (USD 7,878) in the process. In an August 22 blog post, Aurora Labs CEO Alex Shevchenko said that an attack on the b... (Read More...)",14.079999999999998,35.0,0.021395087242126465,32.99999999999999,61.66666666666667,0.005376338958740234,2022-08-24
308,BeInCrypto,Former OpenSea Executive Seeks Dismissal of Insider Trading Charges,"A former OpenSea executive, has submitted a filing calling for the dismissal of charges because he claims NFTs are not securities or commodities. The post Former OpenSea Executive Seeks Dismissal of Insider Trading Charges appeared first on BeInCrypto. (Read More...)",36.34,50.0,0.6956934928894043,18.830000000000002,59.375,0.0052869319915771484,2022-08-24
309,Blockworks,"It’s Over 9,000: Crypto Mining Rigs Seized in Iran This Year","Iran has faced rolling blackouts and water shortages due to heatwaves, often pointing to crypto mining as a major cause of surging demand The post It’s Over 9,000: Crypto Mining Rigs Seized in Iran This Year appeared first on Blockworks. (Read More...)",50.0,50.0,0.5722731351852417,36.34,58.59375,0.45894086360931396,2022-08-24
