,source,title,excerpt,vader_sentiment_title,tb_sentiment_title,flair_sentiment_title,vader_sentiment_excerpt,tb_sentiment_excerpt,flair_sentiment_excerpt,date
134,Crypto Daily,World’s largest custodian bank launches crypto custody platform,"BNY Mellon announced today that its Digital Asset Custody platform has just been launched in the U.S. With a history going back 238 years, BNY Mellon is the oldest bank currently still operating in the U.S. Having decided to take the plunge into digital asset custody back in 2021 the bank has wor... (Read More...)",50.0,50.0,96.21859192848206,83.525,54.166666666666664,89.13006484508514,2022-10-12
135,The Daily Hodl,Spritz Finance Activates Crypto Bill Pay With Any Token on Polygon,"October 11, 2022 – Greenwich, Connecticut Spritz Finance, which recently launched its beta for US residents, has expanded its bill pay capabilities to support payments with any token on the Polygon network. This is a major step forward in realizing the company’s mission of making crypto useful in... (Read More...)",44.865,50.0,1.8579035997390747,84.53999999999999,60.78125,99.86283481121063,2022-10-12
136,Protos.com,Coinbase: A Boring Story,"A Founder’s Story is centered around the rise of Coinbase and its CEO Brian Armstrong. Unfortunately, it contains little of any interest. (Read More...)",34.089999999999996,0.0,0.0031948089599609375,54.325,46.875,0.010976195335388184,2022-10-12
137,Bitcoinist,Temple DAO Exploited For $2M,"Hackers strike again this week, this time at the expense of an available exploit within Temple DAO’s code. Temple’s “STAX Finance” protocol, which provided a liquidity pool of TEMPLE and FRAX tokens was exploited early Tuesday, resulting in $2.3M worth of tokens seized by the hacker. Let’s look a... (Read More...)",27.060000000000002,50.0,0.03467202186584473,27.060000000000002,66.25,0.016301870346069336,2022-10-12
138,Blockworks,TempleDAO Loses $2 Million in Latest Exploit,Funds were converted to ether and moved to a new wallet The post TempleDAO Loses $2 Million in Latest Exploit appeared first on Blockworks. (Read More...),29.905000000000005,55.00000000000001,0.011208653450012207,29.905000000000005,60.86363636363637,0.014916062355041504,2022-10-12
139,The Daily Hodl,"SupraOracles Goes Live on Ethereum, Polygon, Aptos and Four Other Layer One Blockchain Testnets","October 11, 2022 – Zug, Switzerland Have a blockchain DApp ready to integrate the most state-of-the-art oracle? Sign up for Supra’s Network Activation Program (SNAP) for the opportunity to receive free oracle and VRF/RNG credits before the list is full. Continuing to unveil their growing technolo... (Read More...)",50.0,50.28409090909091,18.682977557182312,94.78500000000001,69.5,87.90370225906372,2022-10-12
140,Bitcoin.com,Ethereum’s Average Gas Fee Jumps More Than 80% Higher Nearing $5 per Transfer,"26 days ago, Ethereum transitioned from a proof-of-work (PoW) network to a proof-of-stake (PoS) blockchain and after the change, the network’s fees remained low. This week, however, Ethereum’s gas fees have increased as data from October 10 shows the average fee tapped a high of $4.75 per transac... (Read More...)",50.0,60.0,0.5479246377944946,50.0,56.375,0.1160651445388794,2022-10-12
141,Cryptomode,Gemini vs Coinbase: A Detailed Comparison,"Gemini and Coinbase are two of the world’s most popular cryptocurrency exchanges. They offer various digital assets, including Bitcoin, Ethereum, Litecoin, and others. In this article, we’ll take a detailed look at Gemini and Coinbase to determine the better choice for your crypto trading needs. ... (Read More...)",50.0,70.0,93.3193176984787,88.565,67.85714285714286,99.02498424053192,2022-10-12
142,AMBCrypto,BNB long-term holders can expect this in the weeks to come,"Positive developments around the BNB Chain helped BNB coin climb the ladder during the last month. However, things seemed to have changed as BNB’s performance in the last few days did not look promising. The altcoin registered over a 5% seven-day decline in its price and at press time, it was tra... (Read More...)",50.0,50.0,99.23180937767029,66.36999999999999,56.060606060606055,0.06737411022186279,2022-10-12
143,BeInCrypto,"One of America’s Oldest Banks Joins the Crypto Revolution, Alongside Hundreds of Institutions","Bank of New York Mellon is now the first large American bank to safeguard customers’ cryptocurrency assets alongside traditional investment assets. The post One of America’s Oldest Banks Joins the Crypto Revolution, Alongside Hundreds of Institutions appeared first on BeInCrypto. (Read More...)",50.0,50.0,99.2366224527359,80.62,59.647495361781075,99.38303232192993,2022-10-12
144,CoinGape,XRP Price Update: Whales Move 152 Million XRP; Price Up By 40%,"XRP, Ripple’s native cryptocurrency seems to be holding the fort among the biggest of the cryptocurrencies amid increased selling pressure in the market. However, Whales’ interest has also spiked in favor of the XRP which has helped the coin to the registered recent price surge. XRP price up by 4... (Read More...)",50.0,50.0,0.0868767499923706,84.04,62.5,88.86745572090149,2022-10-12
145,The Block,SEC rejects WisdomTree’s latest spot bitcoin ETF proposal,"The SEC rejected WisdomTree's most recent attempt to list a spot bitcoin ETF, citing insufficient protection from fraud and manipulation. (Read More...)",25.305,60.0,0.12914538383483887,7.405,61.25000000000001,0.06318390369415283,2022-10-12
146,CoinGape,"Crypto Price Today October 11: Bitcoin, Ethereum Tumble Further","Crypto Price Today October 11 Latest Updates: The crypto market continues to struggle as the macroeconomic conditions remain hawkish. The Fed continues to take a restrictive monetary policy to curb inflation levels. As a result, the crypto market is crashing hard. Bitcoin fell by 1.16% in the las... (Read More...)",50.0,50.0,0.0037550926208496094,29.905000000000005,61.80555555555556,0.010260939598083496,2022-10-12
147,The Block,Bitcoin mining facility ordered to shut down as new ordinance goes into effect,A facility hosting Bit Digital mining machines in Niagara Falls has been ordered to shut down due to a zoning ordinance. (Read More...),50.0,49.52020202020202,0.12254416942596436,50.0,52.74305555555555,0.05990266799926758,2022-10-12
148,Cointelegraph,DAOs are in era 3.0 thanks to an infrastructure renaissance: Report,"There are over 4,000 active DAOs, with treasuries totaling around $20 billion, which has many speculating that DAOs may still be a growing trend. (Read More...)",72.02,60.0,99.64024722576141,82.43,64.44444444444444,90.74252843856812,2022-10-12
149,CoinTelegraph,DAOs are in era 3.0 thanks to an infrastructure renaissance: Report,"There are over 4,000 active DAOs, with treasuries totaling around $20 billion, which has many speculating that DAOs may still be a growing trend. (Read More...)",72.02,60.0,99.64024722576141,82.43,64.44444444444444,90.74252843856812,2022-10-12
150,CryptoPotato,QANX Token Collapses 90% After $1 Million Bridge Hack,Nearly half of the token’s entire supply was claimed by the hacker. (Read More...),35.199999999999996,50.0,0.0004589557647705078,50.0,55.55555555555556,0.007271766662597656,2022-10-12
151,U.Today,Axie Infinity Launches Mini Game Raylights: Details,"Axie Infinity, flagship blockchain-based gaming ecosystem, releases in-browser ""light game"" (Read More...)",50.0,30.0,93.87329816818237,55.135,58.333333333333336,20.623373985290527,2022-10-12
152,Ethereum World News,Crypto Exchange Bittrex Fined $30 Million For Breaking US Sanctions,Bittrex will be remitting $30 million to the OFAC in its bid to settle the allegations levied by the US watchdog. OFAC had claimed that Bittrex had violated sanctions imposed by the US by engaging with customers from sanctioned jurisdictions. Crypto exchange Bittrex has settled with the US Treasu... (Read More...),50.0,50.0,0.0577390193939209,34.089999999999996,72.5,0.02186000347137451,2022-10-12
153,Cryptonews,Shiba Inu Price Prediction – Can SHIB Reach $1 Before Dogecoin?,"Shiba Inu suffered a dramatic sell-off on Monday evening, with the coin dropping almost 10% in just two hours. SHIB fell from $0.00001074 to a 24hr low of $0.000009976 in the early hours before a small recovery. Currently trading at $0.00001031, SHIB is still more than 4% down on the 24hr chart a... (Read More...)",51.29,50.0,0.3323793411254883,17.570000000000004,51.63194444444444,0.0007331371307373047,2022-10-12
154,NewsBTC,"Solana Forms A Bilateral Signal For Traders, Will Price Hold Above $30?",SOL price continues to trend downwards as price remains bearish with price trading on key support. SOL trades below 50 and 200-day Exponential Moving Average as price struggles to regain bullish signs. The price of SOL needs to break and hold above the key resistance of $45 to resume bullish pric... (Read More...),50.0,50.0,20.9121972322464,52.580000000000005,53.5,0.14298558235168457,2022-10-12
155,Bitcoin.com,"Biggest Movers: ETC, NEAR at 3-Month Lows on Tuesday","Ethereum classic remained close to a three-month low in today’s session, as the token continued to extend recent declines. The token is now trading almost 15% lower in the last seven days. Near protocol was also lower, with it also falling to its lowest point since July. Ethereum Classic (ETC) Et... (Read More...)",39.885,55.00000000000001,0.010713934898376465,12.309999999999999,56.666666666666664,0.000476837158203125,2022-10-12
156,Crypto Daily,Bitcoin Price Analysis: Downside Risks Deepen - 12 October 2022,BTC/USD Downside Risks Deepen: Sally Ho’s Technical Analysis – 12 October 2022 Bitcoin (BTC/USD) plumbed lower lows early in the Asian session as the pair sank below the 19000 figure and traded as low as the 18950.01 level before reversing some recent losses. Selling pressure accelerated when BTC... (Read More...),26.165,50.0,0.6245523691177368,4.89,55.00000000000001,0.018423795700073242,2022-10-12
157,Cointelegraph,$25K or $15K BTC — CPI and US inflation data coming out on Thursday: Watch The Market Report,"On this week’s episode of The Market Report, Cointelegraph’s resident experts discuss the new CPI data and U.S. inflation rate to be announced on Thursday, Oct. 13. (Read More...)",50.0,50.0,0.30178725719451904,50.0,65.9090909090909,21.1035817861557,2022-10-12
158,U.Today,Stellar Blockchain Gets Extended Support For USDC Thanks to This Collaboration,USDC support expands further on Stellar Network thanks to Wirex (Read More...),84.04,61.25000000000001,99.82371032238007,85.92,61.875,98.55770766735077,2022-10-12
159,BeInCrypto,"Sweat Economy (Sweat) Price May Be About to Work up a Head of Steam, but What Is It?","Sweat Economy (SWEAT) is the new move-to-earn platform currently riding high on the download charts, but is it the stuff of chumps, or of champions? The post Sweat Economy (Sweat) Price May Be About to Work up a Head of Steam, but What Is It? appeared first on BeInCrypto. (Read More...)",50.0,50.0,0.3445148468017578,85.745,60.46363636363636,3.0641555786132812,2022-10-12
160,crypto.news,Multiverse Labs Unveils Government-Backed Metaverse City in UAE,"Multiverse Labs, an artificial intelligence ecosystem, has launched a new metaverse city dubbed Sharjahverse in the United Arab Emirates (UAE). (Read More...)",50.0,50.0,79.25974428653717,87.53,50.60606060606061,23.96491765975952,2022-10-12
161,U.Today,Crypto Exchange Bittrex Slapped with Massive Fine for Sanctions Violations,"Bittrex's fine could have been much higher, but OFAC determined that its violations were ""non-egregious"" (Read More...)",30.910000000000004,60.416666666666664,0.02492070198059082,36.34,69.44444444444444,1.3150781393051147,2022-10-12
162,CoinTelegraph,Bitcoin prepares for CPI showdown as BTC price dips below $19K cost basis,BTC price performance declines in line with U.S. equities ahead of classic volatility engendered by CPI data. (Read More...),50.0,50.0,0.06244778633117676,50.0,66.66666666666666,0.0360339879989624,2022-10-12
163,Feed - Cryptopotato.Com,The BNB Smart Chain Hard Fork Tomorrow: What You Need to Know,The BNB Smart Chain will go through a hard fork tomorrow. Here's what you need to know about it. (Read More...),65.91,48.06547619047619,95.63945233821869,65.91,57.04365079365079,3.5089492797851562,2022-10-12
164,U.Today,MATIC and SOL Price Analysis for October 11,How great are chances to see bounce back of popular altcoins? (Read More...),50.0,50.0,85.64844727516174,91.355,73.75,87.61486113071442,2022-10-12
165,Crypto Daily,Google Partners With Coinbase To Accept Crypto for Cloud Services,Google has announced a new partnership with Coinbase which will allow a select set of customers to pay for its Cloud services using cryptocurrencies such as Bitcoin and Ether. Google announced on Tuesday that it will rely on Coinbase to allow some of its customers to pay for cloud storage service... (Read More...),69.08999999999999,50.0,97.15006053447723,62.5,60.60606060606061,0.0922471284866333,2022-10-12
166,Bitcoinist,"Stratum v2: After 10 Years, The Most Used Bitcoin Mining Software Gets Facelift","Mark the Stratum v2 release as a victory for the open-source bitcoin community. For a decade, it has been the software of choice for miners to interact with pools and with the bitcoin protocol per se. While still necessary, bitcoin mining pools have a centralizing effect. With Stratum v2, miners ... (Read More...)",50.0,75.0,99.89206194877625,50.0,62.5,99.98285174369812,2022-10-12
167,Bitcoinist,Coinbase Gets License To Operate In Singapore – Good Days Ahead For Crypto?,"Coinbase is now in a good position to help cryptocurrencies have a little breathing room in Singapore where the government is maintaining a hard stance on the asset class. Following events that put the nation’s image in question as a safe hub for the highly volatile digital currencies, the Moneta... (Read More...)",72.02,85.0,82.06099271774292,93.125,58.630208333333336,99.69562888145447,2022-10-12
168,The Block,FTX’s dollar spot index perpetual future hasn’t quite taken off,"Volumes initially came in over $1 million but fell as low as $52,600 on Saturday, recovering to around $368,000 on Monday. (Read More...)",50.0,50.0,0.035634636878967285,30.404999999999998,58.333333333333336,0.8700668811798096,2022-10-12
169,Trustnodes,Devcon Begins in Colombia,Devcon VI has opened in Colombia with a dance and animated intro as coders take to the stage. (Read More...),50.0,50.0,84.34456884860992,50.0,75.0,99.89506006240845,2022-10-12
170,CryptoPotato,Ripple (XRP) Skyrockets 20% in 14 Days: Here Are The Reasons Why,Ripple's price increased by a whopping 20% in the past two weeks. Here are some of the possible reasons why. (Read More...),50.0,50.0,0.08087754249572754,63.660000000000004,54.166666666666664,0.012513995170593262,2022-10-12
171,Crypto Briefing,Bittrex Fined $30M for Sanctions Violations,Bittrex has been fined $30 million for sanctions violations. Enforcement Action Bittrex will pay $30 million in fines and penalties for violating U.S. Treasury sanctions as early as 2014. According... (Read More...),23.665000000000003,50.0,0.0768423080444336,12.104999999999999,61.66666666666667,0.007432699203491211,2022-10-12
172,CryptoBriefing,Bittrex Fined $30M for Sanctions Violations,"Bittrex has been fined $30 million for sanctions violations. Bittrex will pay $30 million in fines and penalties for violating U.S. Treasury sanctions as early as 2014.According to an enforcement release from the Treasury, between March 28, 2014, and December 31, 2017, Bittrex facilitated crypto ... (Read More...)",23.665000000000003,50.0,0.0768423080444336,15.46,65.0,0.048410892486572266,2022-10-12
173,NullTX,"FTX Partners With Visa For Crypto Debit Card, Uniglo.io Deflationary Tokenomics Would Make Suitable Payment Token","Bahamas-based cryptocurrency exchange FTX announced it would be teaming up with Visa to roll out crypto debit cards across 40 new countries. FTX successfully introduced a Visa debit card in the US earlier this year and will now be focussing the rollout on South America, Europe, and Asia. These de... (Read More...)",50.0,77.5,0.683090090751648,74.695,67.32954545454545,92.55471229553223,2022-10-12
174,Blockworks,"BNY Mellon Moves To Let Institutions Hold Bitcoin, Ether","Select institutional clients of America’s oldest bank to be able to hold and transfer bitcoin and ether The post BNY Mellon Moves To Let Institutions Hold Bitcoin, Ether appeared first on Blockworks. (Read More...)",50.0,50.0,0.4314124584197998,50.0,70.83333333333334,99.23885464668274,2022-10-12
175,CryptoPotato,Phemex Launching New Copy Trading – Trade Like an Expert with a Single Click,"[PRESS RELEASE – Please Read Disclaimer] Copy trading is a trading strategy that enables investors on various financial markets to automatically open positions and execute trades in accordance with the portfolio of another trader. It can be automatic or manual, depending on how the user prefers t... (Read More...)",68.06,51.62337662337663,99.21284019947052,65.91,56.25,82.93472230434418,2022-10-12
176,CoinGape,"Terra Classic (LUNC) Price Soars 8% After Correction, Here’s Why",Terra Classic (LUNC) price jumped over 8% after a dump as Terra Rebels launches the official subReddit on Tuesday. The group behind the Terra Classic Revival Roadmap looks to engage the community to utilize and interact on Reddit where it all started. Terra Rebels Announces Official SubReddit Ter... (Read More...),50.0,58.333333333333336,0.14725327491760254,28.925,55.41666666666667,0.03125965595245361,2022-10-12
177,Cryptomode,"Coinbase-Backed DeSo Disrupts Telegram, WhatsApp, and Signal","Los Angeles, CA, 11th October, 2022, Chainwire Takeaways: DeSo, a new blockchain that has raised $200 million from Coinbase, Sequoia, and Andreessen Horowitz, just launched decentralized on-chain end-to-end encrypted group chats, a first-of-its-kind innovation. On-chain messages are resistant to ... (Read More...)",50.0,50.0,0.007688999176025391,73.83500000000001,65.9090909090909,91.11343324184418,2022-10-12
178,CryptoPotato,Blockchain Technology Company Tradestrike Launches Innovative Crypto Wallet,"[PRESS RELEASE – London, United Kingdom, 11th October 2022] The mobile wallet will enable millions of crypto investors worldwide to manage their portfolio of digital assets The digital app comes with fiat on and off-ramp, an intuitive portfolio tracker, and an industry-leading interface tailored ... (Read More...)",72.02,75.0,96.83831930160522,77.115,58.333333333333336,99.85679388046265,2022-10-12
179,The Block,Sky Mavis to stake over 11 million AXS tokens,"Sky Mavis will stake over 11 million AXS in an effort to ""reinforce our long-term commitment to the Axie Infinity ecosystem."" (Read More...)",50.0,50.0,16.450682282447815,69.08999999999999,75.0,18.084177374839783,2022-10-12
180,Finbold,America’s oldest bank to be first mainstream lender to roll out crypto services,"The oldest bank in the United States, BNY Mellon, has received regulatory approval to offer cryptocurrencies to its select customers... Continue reading (Read More...)",50.0,62.5,99.7397392988205,85.48,75.0,80.75307309627533,2022-10-12
181,Crypto Daily,"Coinbase-Backed DeSo Disrupts Telegram, WhatsApp, and Signal","Los Angeles, CA, 11th October, 2022, ChainwireTakeaways: DeSo, a new blockchain that has raised $200 million from Coinbase, Sequoia, and Andreessen Horowitz, just launched decentralized on-chain end-to-end encrypted group chats, a first-of-its-kind innovation. On-chain messages are resistant to c... (Read More...)",50.0,50.0,0.007688999176025391,73.83500000000001,65.9090909090909,79.94036972522736,2022-10-12
182,CoinGape,Celsius Ex CEO Dumping CEL Tokens Amid Increasing Legal Troubles,"Alex Mashinsky, former CEO of the bankruptcy ridden digital asset lending firm reportedly on the Celsius (CEL) token selling spree. However, Mashinsky is under inspection since his firm filed for bankruptcy and halted the withdrawal. Earlier, it was alleged that Celsius’s top executives withdrew ... (Read More...)",20.705000000000002,60.0,0.009325146675109863,76.335,53.125,0.015062093734741211,2022-10-12
183,CryptoPotato,"Ethereum Slips Below $1,300 as Bears Dominate Market Momentum (ETH Price Analysis)",Ethereum is not out of the woods despite closing last week’s candle in green. The mid-term uptrend is threatened by increasingly high selling pressure. Technical Analysis By Grizzly The Daily Chart The daily chart remains bearish. The diagonal support (in green) has so far kept the price from fal... (Read More...),43.6,50.0,0.10136663913726807,31.94,52.0,5.187264084815979,2022-10-12
184,U.Today,"100 Million XRP Moved by FTX Behemoth, Here's What It Means for Market","Astounding amount of XRP has been sent from FTX giant to ""unknown"" wallet; here's who owns this crypto address (Read More...)",50.0,50.0,11.313146352767944,71.075,62.5,81.8961888551712,2022-10-12
185,crypto.news,Polygon (MATIC) Launches zkEVM Public Testnet,"Polygon (MATIC) has announced the launch of the public testnet of its zkEVM, the first open-source zk-Rollup scaling solution. (Read More...)",50.0,50.0,5.5929213762283325,65.91,62.5,99.57261085510254,2022-10-12
186,BeInCrypto,3 Reasons Your Crypto Investment Is at Risk for the Rest of October,"Oct. could play out at the mercy of BTC, and with Bitcoin price at crucial crossroads, that could have a cascade effect on top cryptos. (Read More...)",36.34,50.0,0.01080334186553955,84.53999999999999,66.66666666666666,1.6864240169525146,2022-10-12
187,Bitcoin Magazine,River Financial Releases New Lightning Integration Currently Used By El Salvador,River’s Lightning service is the backbone for Chivo Wallet in El Salvador and removes the need for developers to have their own Lightning infrastructure. (Read More...),50.0,52.27272727272727,99.93910491466522,50.0,77.5,99.934783577919,2022-10-12
188,Forkast,"Google Cloud partners Coinbase for crypto payments, data services","Coinbase, the largest cryptocurrency exchange in the U.S., has formed a strategic Web 3.0 partnership with Google Cloud, the Nasdaq-listed exchange said in a statement on Tuesday. See related article: Coinbase gets nod from Dutch central bank to offer crypto services Fast facts As part of the par... (Read More...)",50.0,50.0,99.91017580032349,50.0,58.75,79.35991287231445,2022-10-12
189,The Block,U.S. Treasury fines crypto exchange Bittrex $29 million over years-long sanctions violations,The Treasury has been increasingly vocal about crypto exchanges' need to comply with sanctions since the summer of ransomware attacks last year. (Read More...),30.910000000000004,50.0,0.1015394926071167,36.34,62.5,0.8457809686660767,2022-10-12
190,U.Today,BNY Mellon Officially Enters Cryptocurrency Custody Business,Bank of New York Mellon has become first major U.S. banking institution to act as cryptocurrency custodian (Read More...),50.0,50.0,15.97457230091095,50.0,61.86079545454546,98.43148291110992,2022-10-12
191,Cryptonews,Grace “Ori” Kwan on Solana-Based DeFi and Orca | Ep. 168,"In an exclusive interview with cryptonews.com, Grace “Ori” Kwan, Co-Founder of Orca, talks about Solana-based DeFi, Orca Finance, measuring climate footprints, and design fundamentals.... Read More: Grace “Ori” Kwan on Solana-Based DeFi and Orca | Ep. 168 (Read More...)",71.075,50.0,99.74782168865204,86.345,75.0,88.27645778656006,2022-10-12
192,CryptoPotato,XRP Jumps 7% in Seven Days but Worrying Signs Start to Pop (Ripple Price Analysis),"The good news for Ripple is that we are finally seeing some bullish sentiment in the market. Although trading volume is progressively declining, the possibility of breaking out of the 5-month consolidation phase remains alive. Technical Analysis By Grizzly The Daily Chart On the daily chart, the ... (Read More...)",26.165,50.0,2.200639247894287,83.525,59.285714285714285,93.81007552146912,2022-10-12
193,U.Today,"“Rich Dad, Poor Dad” Author Says It’s Time for BTC, SHIB Finally Listed on BitMex, This Could Reduce Ripple’s Chance to Win SEC: Crypto News Digest by U.Today",Keep an eye on the latest updates in the crypto industry with U.Today’s news digest! (Read More...),70.095,56.75,0.311201810836792,50.0,78.125,4.260632395744324,2022-10-12
194,The Block,HUSD loses dollar peg after Huobi’s delisting of 21 trading pairs,"HUSD, a centralized stablecoin issued by Hong Kong-based Stable Universal, has fallen below its intended dollar peg. (Read More...)",34.089999999999996,35.0,0.019791722297668457,46.14,62.5,0.006592273712158203,2022-10-12
195,CoinGape,Breaking: First Ever Major U.S. Bank Launches Crypto Custody Service,"In a landmark development in the traditional financial service industry, a major U.S. bank announced launch of crypto custody services. The move makes the bank the first one to store crypto besides traditional investments. Earlier this year, New York’s financial regulator gave approval to the ban... (Read More...)",50.0,57.8125,0.1476973295211792,76.335,55.27146464646464,84.05179381370544,2022-10-12
196,U.Today,XRP Might Be in Serious Trouble as Ominous Signal Appears on Chart: Details,XRP price dipped in line with other cryptocurrencies' drops (Read More...),17.015,36.66666666666667,2.982819080352783,50.0,59.375,0.0031769275665283203,2022-10-12
197,ZyCrypto,XRP Poised To Erupt In Parabolic Rally As Ripple Unveils ODL Service In Sweden And France,The XRP price could demonstrate considerable strength in the near term as Ripple strides to strengthen its presence in Europe despite the current bitter crypto winter. (Read More...),62.5,50.0,14.808714389801025,89.015,56.00000000000001,99.78859722614288,2022-10-12
