,source,title,excerpt,vader_sentiment_title,tb_sentiment_title,flair_sentiment_title,vader_sentiment_excerpt,tb_sentiment_excerpt,flair_sentiment_excerpt,date
66,NullTX,Bitcoin Price Prediction – BTC in Recovery After Bloodbath,"One of the most common questions about Bitcoin’s price is whether or not this is the bottom for cryptocurrency and if this is a good time to buy the dip. According to Wall Street analysts, the Cboe Volatility Index (VIX) fear gauge signals that the bottom may not be so near. Since Bitcoin has bee... (Read More...)",50.0,50.0,13.72571885585785,46.14,65.0,0.21082758903503418,2022-05-11
67,BeInCrypto,Saylor Pledges More Bitcoin to Back Loan From Silvergate Following Price Drop,"Michael Saylor, CEO, and co-founder of MicroStrategy reassures lender Silvergate Bank that the company will post alternative collateral for a $205M loan should BTC dip below $3,562. The post Saylor Pledges More Bitcoin to Back Loan From Silvergate Following Price Drop appeared first on BeInCrypto. (Read More...)",36.34,58.333333333333336,0.38678646087646484,55.135,62.5,0.0057697296142578125,2022-05-11
68,Decrypt,Cardano's Hoskinson Claps Back at Terra's Kwon Over 'Negative Correlation' Tweet,The jab comes as the Terra network's native cryptocurrencies are getting crushed in the market. (Read More...),21.405,42.5,0.17415881156921387,28.925,60.0,0.04278421401977539,2022-05-11
69,The Daily Hodl,"After TerraUSD (UST) Depegging, Macro Guru Raoul Pal Says Stablecoin Regulation Could Be Coming","Macro guru and Real Vision CEO Raoul Pal says the recent issues with Terra’s algorithmic stablecoin, UST, may lead to new stablecoin regulation. In a new interview with Bankless, the former Goldman Sachs executive says UST’s recent loss of its US dollar (USD) peg is part and parcel of most financ... (Read More...)",50.0,50.0,24.003872275352478,46.14,59.20454545454545,0.5019962787628174,2022-05-11
70,Bitcoin.com,"Erratic Bond Yields, Lockdowns, and War — 3 Reasons Why Economic Recovery Won’t Happen Quickly","The global economy looks bleak as inflation continues to rise, and a wide array of financial investments continue to shudder in value. Since May 2, 2022, the crypto economy has dropped more than 15% from $1.83 trillion to today’s $1.54 trillion. The price of gold has lost 5% in 30 days, and major... (Read More...)",20.029999999999998,63.33333333333333,0.27153491973876953,51.29,49.73214285714286,0.01818537712097168,2022-05-11
71,The Daily Hodl,Cake DeFi Enters Into Esports With Competitive Gaming Platform FACEIT,"May 10, 2022 – Singapore, Singapore FACEIT, the world’s leading platform for competitive online gaming, has today announced a multi-million dollar partnership with Cake DeFi, one of the world’s fastest-growing crypto fintech platforms, which allows users to earn cash flow from their crypto. Facil... (Read More...)",58.894999999999996,50.0,96.52818739414215,58.894999999999996,75.0,96.6629832983017,2022-05-11
72,Cointelegraph,Polygon reaches level that last time triggered a 275% MATIC price rally — will history repeat?,"MATIC has rebounded sharply after testing the July 2021 support level, borrowing further upside cues from Polygon's partnership with Meta. (Read More...)",52.580000000000005,50.0,13.635137677192688,70.095,56.25,19.787636399269104,2022-05-11
73,CryptoSlate,Avalanche founder claims only one algorithmic stablecoin can succeed – defends Terra’s UST,"The founder of Ava Labs, Emin Gün Sirer, has offered his opinions on the crash of Terra’s algorithmic stablecoin, UST. According to Gün Sirer, there is a need for decentralized algorithmic stablecoins in the ecosystem due to the censorship vulnerability of fiat-backed stablecoins. (Read More...)",74.695,50.0,0.037351250648498535,22.13,59.375,0.1599729061126709,2022-05-11
74,Decrypt,"FTX US Opens Chicago HQ, Will Sponsor Supplemental Income Pilot",The crypto exchange will support eligible low-income Chicago residents with monthly payments and free banking services. (Read More...),50.0,50.0,95.3335165977478,85.92,72.5,92.15291142463684,2022-05-11
75,Bitcoin.com,"Biggest Movers: LUNA Loses 50% of Its Value, While XMR and AXS Declines Continue","LUNA was down by over 50% in today’s session as markets continued to react to UST losing its parity with USD. As such traders lost faith in the stablecoin founded by Do Kwon, which dropped to its lowest point since September. Whilst LUNA stole the headlines, XMR and AXS also saw recent losses ext... (Read More...)",51.29,35.0,0.004023313522338867,12.469999999999997,54.30555555555555,0.004124641418457031,2022-05-11
76,ZyCrypto,LUNA Nosedives A Staggering 60% As Binance Disables Terra Withdrawals — What’s Next For UST?,TerraUSD (UST) is the market’s leading algorithmic stablecoin that works with LUNA to maintain a $1 price using Terra’s dual token mechanism. (Read More...),50.0,50.0,2.170759439468384,50.0,75.0,99.77513253688812,2022-05-11
77,Bitcoin Magazine,NYDIG Partners With Jack Henry & Associates To Offer Bitcoin Services To Banks,Jack Henry &amp; Associates has partnered with NYDIG to offer bitcoin services to legacy financial institutions in software as a service model. (Read More...),50.0,50.0,98.97783994674683,50.0,62.5,99.67346787452698,2022-05-11
78,BeInCrypto,Binance Coin (BNB) Breaks Down From 348-Day Support Line,Binance Coin (BNB) is approaching a long-term support level close to $280 but has yet to show any clear bullish reversal signs. The post Binance Coin (BNB) Breaks Down From 348-Day Support Line appeared first on BeInCrypto. (Read More...),70.095,42.22222222222222,0.40801167488098145,91.58,56.94444444444444,0.003325939178466797,2022-05-11
79,Cryptomode,5 Essential Takeaways From The UST Stablecoin Situation,"UST Has proven to be an intriguing stablecoin, even if it fails badly at sustaining its peg these days. While the currency is on the cusp of surpassing $0.91 again, it can as easily top below $0.85. There are some key takeaways from the current situation that need to be taken into account for the... (Read More...)",50.0,50.0,99.98515546321869,29.905000000000005,50.71428571428571,5.883920192718506,2022-05-11
80,Ethereum World News,KuCoin Raises $150M in Pre-Series B Funding at a $10B Valuation,"Quick take: KuCoin has raised $150 million in a pre-series B funding round at a $10 billion valuation The funding round was led by Jump Crypto with additional participation by Circle Ventures, IDG Capital, and Matrix Partners KuCoin plans to expand beyond trading and into Web 3.0, including crypt... (Read More...)",50.0,50.0,97.06645905971527,65.91,55.41666666666667,99.75466728210449,2022-05-11
81,NewsBTC,Polkadot’s 16th Parachain Slot Secured in Crowdloan Round,"On the 6th of May, Polkadot’s most recent auction round came to an end, generating over $13.8 million and bringing a new platform to the system. The winner of this auction, Polkadex, put up 973,324 DOTs across over 6000 community member donations, demonstrating the incredible community push that ... (Read More...)",70.095,40.0,95.74854075908661,79.295,65.30303030303031,93.73220205307007,2022-05-11
82,Bitcoin Magazine,"Bitcoin Company Casa Raises $21M, Launches API For Third-Party Integrations",Casa simultaneously announced a new API designed to help its users interact with third-party services and the closing of a $21 million series A round. (Read More...),50.0,50.0,17.914855480194092,70.095,57.27272727272727,0.8871972560882568,2022-05-11
83,Blockworks,NBA Top Shot Creator Raises $725M Fund To Grow Flow Blockchain Usage,"Capital to focus on support for gaming, infrastructure, decentralized finance, content and creators The post NBA Top Shot Creator Raises $725M Fund To Grow Flow Blockchain Usage appeared first on Blockworks. (Read More...)",60.114999999999995,75.0,94.61871385574341,77.115,70.83333333333334,81.9661796092987,2022-05-11
84,The Daily Hodl,"Introducing YUSE, the Ultimate Multi-Utility Token","May 10, 2022 – Lisbon, Portugal Yuse ecosystem is launching its own wallet. Yuse protocol, an ecosystem of digital products backed by blockchain technology, is taking a big step forward with the release of its non-custodial wallet. From May 19, 2022, onward, members of the Yuse community will be ... (Read More...)",50.0,50.0,99.98415112495422,51.29,63.74999999999999,99.84987378120422,2022-05-11
85,Bitcoinist,Altcoin Discount: What Ethereum Whales Are Buying Through The Dip,"With the market currently in peril, Ethereum whales are taking this as an opportunity to add more coins to their portfolios. Altcoins have taken the biggest hit in the market and as such have been the focus of these whales who obviously see these tokens as being on discount. They have been focusi... (Read More...)",50.0,50.0,90.7804399728775,51.29,60.0,90.47127366065979,2022-05-11
86,NewsBTC,Crypto Liquidations Reach $1 Billion As Sentiment Falls To 10-Month Lows,"The crypto market has been subject to large liquidation following the price crash. Coming out of the weekend, the market had recorded one of its worst crashes which saw bitcoin fall below the $30,000 territory for the first time this year. With this had come hundreds of millions in short liquidat... (Read More...)",41.105000000000004,50.0,0.01964867115020752,11.085,48.554421768707485,0.0016629695892333984,2022-05-11
87,crypto.news,Bitcoin Hits the Lowest Since July as Its Profitability Goes Down,"Bitcoin has been on a losing streak for the past few days, with its prices hitting the lowest ever experienced since July 2021. Bitcoin Profitability Goes Low The general crypto market has followed suit with significant losses that have led… (Read More...)",43.6,42.22222222222222,0.024634599685668945,13.655000000000001,59.10714285714286,0.028979778289794922,2022-05-11
88,Ethereum World News,Avalanche Founder: I’m Bullish on UST Once the Dust Settles Down,Summary: The Founder of Avalanche and CEO of Ava Labs is bullish on TerraUSD (UST) ‘once the dust settles down’ He explained that only active teams could defend algorithmic stablecoins against destabilizing bank runs Decentralized stablecoins are necessary as fiat-backed stablecoins are subject t... (Read More...),50.0,42.22222222222222,11.854252219200134,70.095,50.37037037037037,0.010839104652404785,2022-05-11
89,Decrypt,Treasury’s Yellen Highlights Terra Collapse in Call for Stablecoin Legislation,"The run on Terra's UST illustrates that stablecoins are a ""rapidly growing product and there are rapidly growing risks,"" said Yellen. (Read More...)",25.305,50.0,20.595231652259827,67.0,75.0,1.03512704372406,2022-05-11
90,Crypto Daily,Madonna Collaborates With Beeple For NFT Collection,Pop diva Madonna has launched her own NFT collection in collaboration with popular American digital artist Beeple. Beeple’s Latest NFT Collab Madonna has finally acted upon her fascination with non-fungible tokens by launching her own collection. The legendary pop superstar has collaborated with ... (Read More...),50.0,50.0,99.05734062194824,87.895,71.11111111111111,99.66234564781189,2022-05-11
91,The Daily Hodl,"Analyst Issues Solana and Avalanche Warnings, Says Traders Should Not Underestimate Altcoin Bear Market",A popular crypto trader is cautioning digital asset investors about the fate of altcoins as the markets take a tumble to start the new week. The analyst known as Altcoin Sherpa follows up on a May 6th tweet where he warned that it could be “lights out” for many altcoins if certain price levels we... (Read More...),45.985,50.0,0.12680292129516602,82.43,66.25541125541126,0.0090867280960083,2022-05-11
92,CryptoPotato,MicroStrategy Gives Lowest Possible Bitcoin Price to Require Maintenance Collateral,"The company’s loan doesn’t risk liquidation unless Bitcoin’s price falls to $21,000, at which point they can post more Bitcoin collateral. (Read More...)",30.910000000000004,50.0,99.99387860298157,36.34,75.0,0.6650805473327637,2022-05-11
93,The Block,Visa’s global head of fintech and crypto leaves to take CEO role at DriveWealth,"Visa’s global head of fintech and crypto, Terry Angelos, is leaving the financial services company to take over as CEO of mobile trading tech company DriveWealth. (Read More...)",50.0,50.0,5.425769090652466,50.0,58.333333333333336,5.19682765007019,2022-05-11
94,Forbes,Unstable Stablecoin: How Crypto’s Crash Broke The Buck For TerraUSD,"A popular token pegged to the dollar dramatically collapsed on Monday, causing the crypto market capitalization to lose a staggering $300 billion. (Read More...)",10.470000000000002,50.0,14.462518692016602,37.5,77.5,0.002855062484741211,2022-05-11
95,The Daily Hodl,HUMAN Protocol Foundation Awards Grant to VeritaTrust To Build On-Chain Rewards for Reviews,"May 10, 2022 – Georgetown, Cayman Islands Today, HUMAN Protocol has announced that it has awarded a grant to VeritaTrust to power on-chain reviews. Following the announcement of HUMAN Protocol’s $10 million funds dedicated to grants, this work with VeritaTrust represents their very first grant aw... (Read More...)",91.125,50.0,97.80307710170746,94.55,58.25,95.8487719297409,2022-05-11
96,CoinTelegraph,What are the top social tokens waiting to take off? | Find out now on The Market Report,"On this week’s episode of “The Market Report,” Cointelegraph’s resident experts discuss the top social tokens a the moment. (Read More...)",60.114999999999995,63.33333333333333,9.080886840820312,60.114999999999995,67.22222222222221,88.33229839801788,2022-05-11
97,The Daily Hodl,NUS Computing Joins Forces With TZ APAC To Develop Singapore’s Next Generation of Tech Innovators,"May 10, 2022 – Singapore, Singapore Today, TZ APAC, the leading Asia-based blockchain adoption entity supporting the Tezos ecosystem, announced a partnership with the National University of Singapore School of Computing (NUS Computing) to set up the Center for Nurturing Computing Excellence. Led ... (Read More...)",50.0,50.0,99.73669648170471,93.75,60.83333333333334,82.56210088729858,2022-05-11
98,CoinGape,MATIC Price Analysis: 25% Discount on MATIC Price Offer Dip Opportunity,The Polygon(MATIC) traders actively selling on a descending trendline tumbled the coin price by 53.5% from the $1.73 high. Last weekend the MATIC price breached $1 physiological support suggesting the sellers are preparing for another leg down. Can the evident bullish divergence on indicators bol... (Read More...),71.075,50.0,1.3372302055358887,80.62,55.17592592592593,0.0005125999450683594,2022-05-11
99,CoinGape,$UST Decline: Here’s U.S. Government’s Quick Response,"The UST stablecoin’s dramatic decline in value featured in U.S. Treasury Secretary Janet Yellen’s testimony before the committee on banking, housing, and urban affairs, U.S. Senate, on Tuesday. Yellen stated that the stablecoin’s turbulence clearly illustrates risks associated with crypto assets ... (Read More...)",50.0,66.66666666666666,0.8515745401382446,83.525,52.083333333333336,0.17941296100616455,2022-05-11
100,Cointelegraph,US Treasury Secretary reaffirms need for stablecoin regulation following UST crash,"Janet Yellen said it would be “highly appropriate” to aim for “a consistent federal framework” on stablecoins by the end of 2022 in the U.S., given the growth of the market. (Read More...)",38.685,50.0,98.12479615211487,69.08999999999999,70.83333333333334,1.4773011207580566,2022-05-11
101,Crypto Briefing,Yellen Echoes Stablecoin Warning Citing UST Crash,"U.S. Treasury Secretary Janet Yellen has called on Congress to pass stablecoin legislation, referencing UST’s recent depeg event. Yellen Highlights Stablecoin Risks Stablecoins are facing increased scrutiny from the U.S.... (Read More...)",18.755,50.0,4.4271767139434814,60.114999999999995,62.5,76.50986313819885,2022-05-11
102,Ethereum World News,"UST Depegging Catches the attention of US Treasury Secretary Yellen, Who Calls for Stablecoin Regulation by EOY",Summary: UST’s depegging sage over the last 72 hours has caught the attention of US Treasury Secretary Yellen US Treasury Secretary Yellen has pointed out the risks of stablecoins such as UST and has called for their regulation by the end of 2022 Terra’s Do Kwon has Tweeted that he will announce ... (Read More...),60.114999999999995,50.0,0.2538830041885376,56.400000000000006,58.333333333333336,0.28150975704193115,2022-05-11
103,BeInCrypto,Western Sanctions Force Russian Journalists to Solicit Crypto Donations,Western sanctions have forced beleaguered Russian journalists to turn to cryptocurrencies to keep their operations running. The post Western Sanctions Force Russian Journalists to Solicit Crypto Donations appeared first on BeInCrypto. (Read More...),50.0,50.0,0.18201768398284912,27.060000000000002,53.214285714285715,0.04127919673919678,2022-05-11
104,Bitcoin Magazine,"MicroStrategy Will Never Sell Its Bitcoin, Saylor Suggests","Michael Saylor said that in addition to 115,109 BTC, MicroStrategy could pledge ‘some other collateral’ if needed. (Read More...)",50.0,50.0,0.2969413995742798,50.0,59.375,79.50806319713593,2022-05-11
105,CryptoPotato,"Ripple Price Analysis: Following the 18% Daily Collapse, Here Are the Important Levels for XRP","Yesterday marked one of Ripple’s biggest red candles in 2022. Bears were able to push the price down 18% and instill more fear in the market. Technical Analysis By Grizzly The Daily Chart On the daily timeframe, after XRP ended last week in the range between $0.55- $0.65, the price experienced a ... (Read More...)",32.99999999999999,56.666666666666664,1.9675880670547485,22.935,60.2020202020202,0.3492295742034912,2022-05-11
106,Protos.com,A new crypto trading hamster is here to close the banks,Mr Goxx Jr. has a swankier set up than his predecessor but so far the latest crypto trading hamster has had to battle a Bitcoin downturn. (Read More...),50.0,56.81818181818181,0.2924710512161255,23.665000000000003,68.33333333333333,19.08259093761444,2022-05-11
107,CryptoSlate,Azuki floor price tanks after founder reveals link to 3 failed NFT projects in 2021,"The founder of the Azuki non-fungible token (NFT) project, Zagabond, has revealed that he was behind three unsuccessful NFT projects before creating Azuki. In a blog post titled “A Builders Journey,” he pointed out that the lessons he learned from the three projects helped him build Azuki into wh... (Read More...)",24.47,25.0,0.023233890533447266,46.14,52.5,20.977526903152466,2022-05-11
108,U.Today,"BTC Drops to $30,000, SHIB Gains 7,000 More Holders, New Updates on XRP Case Shared by James K. Filan: Crypto News Digest by U.Today",Stay tuned for the latest events in the industry with U.Today’s crypto news digest! (Read More...),79.295,65.9090909090909,0.13028383255004883,50.0,78.125,21.134832501411438,2022-05-11
109,The Block,Haun Ventures leads $11 million round for web3 community platform Highlight,"Highlight, which lets creators design and mint NFTs and create a community around them, has raised $11 million in funding. (Read More...)",67.0,40.0,99.6247410774231,77.115,75.0,99.33376014232635,2022-05-11
110,Bitcoin.com,Bitcoin Cash to Include Bigger Integers and Native Introspection in Upcoming Upgrade,"Bitcoin Cash is preparing to include two significant improvements in its upcoming upgrade. Programmed to happen on May 15, the Bitcoin Cash Improvement Proposals (CHIPs) approved to be included are CHIP-2021-03, which brings bigger script integers to the chain, and CHIP-2021-02, which has to do w... (Read More...)",50.0,50.0,0.5669653415679932,91.8,64.58333333333334,0.19143521785736084,2022-05-11
111,Crypto Daily,BTC/USD Sharply Sinks to Lowest Level Since July: Sally Ho's Technical Analysis 11 May 2022 BTC,"Bitcoin (BTC/USD) extended its recent sharp slide early in the Asian session as the pair depreciated to its weakest level since July 2021, trading as low as the 29735.05 area. Stops were elected below several price objectives and downside retracement levels, including the 32648, 32246, 31942, 317... (Read More...)",30.910000000000004,47.5,0.015175342559814453,10.470000000000002,53.39285714285714,0.008577108383178711,2022-05-11
112,U.Today,Janet Yellen Says UST's Collapses Illustrates Risks to Financial Stability,Terra imbroglio has gone all the way to a congressional hearing (Read More...),24.47,50.0,8.877059817314148,50.0,75.0,6.273677945137024,2022-05-11
113,Blockworks,Secretary Yellen: Stablecoins Pose Significant Risk to Financial Stability,"The Treasury will issue a “comprehensive report” on cryptocurrencies and stablecoins “shortly,” Yellen said The post Secretary Yellen: Stablecoins Pose Significant Risk to Financial Stability appeared first on Blockworks. (Read More...)",46.14,59.375,99.7672826051712,56.400000000000006,61.25000000000001,0.39652585983276367,2022-05-11
114,Bitcoin Magazine,New York Based Townsquare Media Purchased $5 Million Worth Of Bitcoin,"During Q1 2022, Townsquare Media, a digital media company, purchased $5 million of bitcoin stating that the company believes in bitcoin’s “long-term potential.” (Read More...)",61.315,60.909090909090914,0.5805701017379761,50.0,58.333333333333336,0.526273250579834,2022-05-11
115,CryptoBriefing,Crypto Market Rebounds With More Pain Ahead,"Panic has struck the cryptocurrency market as Bitcoin and Ethereum enter freefall. Although the correction appears to have paused, investors are still selling their holdings en masse. Fear and Despair... (Read More...)",22.185,75.0,0.19480586051940918,9.120000000000001,75.0,0.05867183208465576,2022-05-11
116,The Block,Hacked stablecoin Beanstalk seeks to borrow $77 million to revive itself,The Beanstalk DAO is using a debt capital raise to bring the stablecoin back to life following a large hack in April. (Read More...),46.14,50.0,0.002282857894897461,31.94,58.92857142857143,0.4431188106536865,2022-05-11
117,Bitcoinist,Will ESG Be Behind The Next Bullish Bitcoin Narrative?,"It might be hard to find a bullish narrative for Bitcoin currently. The inflation hedge has plummeted during the worst inflation in 40 years. It hasn’t acted as a safe haven during war, a pandemic, or anything else. In fact, given the recent price action, few would argue in the favor of cryptocur... (Read More...)",50.0,40.0,0.05130171775817871,13.245000000000001,47.552083333333336,0.0035583972930908203,2022-05-11
118,Blockworks,Meta Trials NFT Display Feature for Instagram Creators and Collectors,"Head of Instagram shared initial details of the test run via Twitter, stating that more will be revealed next week The post Meta Trials NFT Display Feature for Instagram Creators and Collectors appeared first on Blockworks. (Read More...)",50.0,50.0,99.90374445915222,67.0,62.5,4.797014594078064,2022-05-11
119,CoinGape,Avalanche Price Analysis: AVAX Price Jumps 19% In A Sharp Bounce Back; Is Correction Over?,AVAX price is enjoying a relief rally following a massive sell-off. The recent price action advocates for an extension of the upside momentum owing to the overall market mood and the way technicals are aligned. The coin tested record lows with high trading volumes. AVAX price surges 19% on Tuesda... (Read More...),50.0,46.875,0.08362829685211182,84.53999999999999,57.875,22.42215871810913,2022-05-11
120,BeInCrypto,Binance Suspends Withdrawals of LUNA and UST,"Binance has temporarily suspended withdrawals of the two major Terra blockchain tokens including LUNA, the native token of Terra, and Terra USD (UST), Terra's flagship algorithmic stablecoin. The post Binance Suspends Withdrawals of LUNA and UST appeared first on BeInCrypto. (Read More...)",50.0,50.0,0.13698935508728027,29.905000000000005,63.541666666666664,0.0017344951629638672,2022-05-11
121,Crypto Daily,Galaxy Arena raises 600K in private sale before launching IEO on top ten exchange,"Galaxy Arena raises 600K in private sale before launching IEO on top ten exchangeInnovative new metaverse venue promises endless entertainment, paid fitness and real estate opportunities TORONTO, ON (May 10, 2022) All roads lead to the Galaxy Arena: a virtual play-to-earn intergalactic coliseum w... (Read More...)",60.114999999999995,58.333333333333336,96.47141993045807,93.6,58.65259740259741,99.8106986284256,2022-05-11
122,Finbold,Number of Ethereum addresses in profit drops to 21-month low with over half in a loss,"While most of the cryptocurrency market participants continue to struggle with bearish days, holders of its second-largest asset by market... Continue reading (Read More...)",47.42,45.83333333333333,0.0035703182220458984,52.580000000000005,75.0,7.449120283126831,2022-05-11
123,CryptoPotato,Kraken’s Jesse Powell to Go All-In on Bitcoin if it Drops to $20K,"Jesse Powel invested half of its capital in bitcoin last year as if the asset plunges to $20,000 he will allocate the other half. (Read More...)",50.0,50.0,19.90576982498169,68.06,50.416666666666664,0.012722611427307129,2022-05-11
124,Cointelegraph,UK government targets crypto in latest legislative agenda,"The Queen’s Speech for the State Opening of Parliament included bills supporting “the safe adoption of cryptocurrencies"" as well as authority to ""seize and recover crypto assets.” (Read More...)",50.0,75.0,0.17875134944915771,90.10000000000001,70.83333333333334,19.881901144981384,2022-05-11
125,Crypto Briefing,NFT Blockchain Flow Launches $725M Ecosystem Fund,"Dapper Labs, the company behind the NFT and gaming-focused blockchain Flow, has raised $725 million to support the growth of its blockchain ecosystem. Flow Announces $725 Million Ecosystem Fund Dapper... (Read More...)",50.0,50.0,76.88069939613342,82.43,52.5,95.55851817131042,2022-05-11
