,source,title,excerpt,vader_sentiment_title,tb_sentiment_title,flair_sentiment_title,vader_sentiment_excerpt,tb_sentiment_excerpt,flair_sentiment_excerpt,date
64,The Block,New York’s financial regulator issues new guidance on dollar-backed stablecoins,The New York Department of Financial Services introduced new policies aimed at protecting stablecoin investors. (Read More...),50.0,54.54545454545454,0.6932467222213745,50.0,59.65909090909091,1.2071847915649414,2022-06-09
65,CoinGape,Breaking: Biggest Regulatory Action On Stablecoin Security,"After the Terra crash erupted last month, all the focus was on stablecoins. Many people called for regulatory control over this category of cryptocurrencies. On Wednesday, a step forward on stablecoin regulation came in the form of regulatory guidance from a New York regulator. Foundational Crite... (Read More...)",67.0,55.00000000000001,3.345504403114319,29.905000000000005,64.20454545454545,0.5445003509521484,2022-06-09
66,The Daily Hodl,Veteran Trader Peter Brandt Unveils Big Downside Target for Ethereum in New ETH Forecast Update,"A closely followed veteran crypto trader thinks Ethereum (ETH) could drop lower to $1,268 before rebounding back up. Peter Brand tells his 647,800 Twitter followers ETH may be in a descending triangle, a pattern indicative of further downside risk for the second-largest cryptocurrency by market c... (Read More...)",37.5,52.27272727272727,4.020532965660095,12.469999999999997,56.25,0.009557604789733887,2022-06-09
67,The Daily Hodl,"Financial Titans Fidelity, Citadel and Charles Schwab Building New Crypto Trading Platform: Report","A consortium of financial giants are working to build a new crypto trading platform that could be available by the end of this year or early 2023. According to a report from Bloomberg, multinational financial services titans Charles Schwab, Fidelity and Virtu Financial, along with hedge fund gian... (Read More...)",50.0,53.40909090909091,99.75865185260773,50.0,58.11688311688311,79.1718065738678,2022-06-09
68,Decrypt,Crypto Exchanges Delist Litecoin Over Privacy Feature Concerns,Two major exchanges in South Korea said they will delist Litecoin due to new privacy features enabled by the protocol. (Read More...),50.0,50.0,2.810540795326233,50.0,57.17329545454546,0.019073486328125,2022-06-09
69,Bitcoin.com,Checkout.com Reveals Merchants Can Accept and Make Payments in USDC,"On Tuesday, the financial technology company Checkout.com announced that it will allow merchant settlements using the stablecoin USDC via a partnership with the crypto firm Fireblocks. Checkout.com further detailed that in a beta test with select clients, the company settled $300 million in trans... (Read More...)",69.08999999999999,50.0,5.528455972671509,61.315,56.99999999999999,0.05297362804412842,2022-06-09
70,AMBCrypto,Is EGLD [Elrond] due for a major comeback after retesting structural support,"EGLD just concluded the first week of June on a bearish note, after dropping by roughly 25% from end-of-May levels. A close look at its price action reveals that it is now trading at a critical support level that might be critical in the next few weeks. The first week of June turned out to […] (Read More...)",70.095,48.4375,84.5421314239502,38.685,54.44444444444444,0.0034093856811523438,2022-06-09
71,Cointelegraph,‘Data DAO’ Delphia raises $60M Series A led by Multicoin Capital,"Decentralized autonomous organizations continue to gain traction. In the case of Delphia, retail traders will be rewarded for contributing their personal data. (Read More...)",50.0,50.0,5.4726362228393555,88.25,65.0,99.46573972702026,2022-06-09
72,Decrypt,Salesforce Launching Platform for Brands to Mint and Sell NFTs,"The cloud software giant is expecting the new platform, launching now with a pilot program, to be widely available by October. (Read More...)",50.0,50.0,99.87845718860626,50.0,62.95454545454545,6.619611382484436,2022-06-09
73,CoinGape,FTX Price Analysis: Trendline Breakout Calls Recovery Rally In FTT Price,"Today, the (FTX)FTT price is up by 4% and strikes a two-month-old resistance trendline. Thus, this breakout opportunity may trigger a recovery rally with a long target of $53.11. However, the technical chart shows the coin price may face multiple resistance that can stall the expected bull run. K... (Read More...)",50.0,50.0,93.88329684734344,43.6,53.5,0.0106126070022583,2022-06-09
74,U.Today,Two-Time Oscar Winner Anthony Hopkins Wants to Buy His First NFT,Legendary actor Anthony Hopkins has faced backlash on Twitter after asking his followers for NFT recommendations (Read More...),79.295,61.25000000000001,80.19809126853943,50.0,87.5,0.08622407913208008,2022-06-09
75,Ethereum World News,Terra’s Do Kwon Reportedly Rejected an Initial 3.6% Interest Rate on the Anchor Protocol,"Key takeaways: Terra’s Do Kwon allegedly rejected an initial 3.6% interest rate on the Anchor protocol. Anchor’s interest rate was reportedly increased to 20% one week before the protocol went live. According to the designers of LUNA, the collapse of Terra was visible from the beginning. The foun... (Read More...)",46.14,50.0,0.03554821014404297,57.655,55.36363636363636,0.03465414047241211,2022-06-09
76,The Block,DOE-backed researchers propose a solution to a stablecoin paradox: an electricity peg,"New, peer-reviewed research from scientists at Lawrence Livermore National Laboratory puts forward a radical, if theoretical, new design for an asset-backed stablecoin. (Read More...)",61.315,50.0,4.848825931549072,50.0,59.65909090909091,99.96711909770966,2022-06-09
77,CryptoPotato,Ethereum Proof of Stake Merge Goes Live on Ropsten Testnet ,"Ethereum’s oldest testnet is now using a proof of stake consensus mechanism to generate blocks, rather than mining. (Read More...)",50.0,56.81818181818181,84.88935232162476,38.685,75.0,99.75640177726746,2022-06-09
78,The Daily Hodl,Little-Known Altcoin Built on Ethereum Explodes 407% As Coinbase Adds It to Listing Roadmap,"One decentralized finance (DeFi) altcoin is surging as top US crypto exchange Coinbase puts four new crypto assets on the path to joining its roster. In an announcement, Coinbase says it plans to add DeFi Yield Protocol (DYP), along with three other altcoins to the trading platform in the future.... (Read More...)",50.0,50.0,0.023543834686279297,68.06,60.11363636363636,99.24739897251129,2022-06-09
79,Cryptomode,New Details of “French Family NFT.” New Hype NFT Collection of French Montana,"Rap star French Montana recently announced the release of an exclusive NFT collection, temporarily called the “French Family NFT.” In conversation with the “French Family’s” Metaverse team, NullTX was able to discover more details of this collection that will be unprecedented in the crypto market... (Read More...)",50.0,53.40909090909091,85.11110544204712,56.400000000000006,63.125,96.43436670303345,2022-06-09
80,BeInCrypto,Citadel & Virtu Team up to Make Crypto-Trading Ecosystem,Cryptocurrencies are writhing in the throes of declining prices but firms are braving the storms to introduce new products for users. The duo of Citadel and Virtu are working together to offer retail brokerages an ingenious way to gain crypto exposure. (Read More...),50.0,50.0,99.9483585357666,84.04,68.93939393939394,95.80552279949188,2022-06-09
81,CoinGape,Just-In: Japan’s Prime Minister Aids Abolition Of Country’s Strict Crypto Rules,"‪According to Bloomberg, Fushio Kishida, Japan’s Prime Minister, has indicated his disapproval of the stringent rules currently guiding the country’s cryptocurrency industry, this has therefore led to discussions for new and better policies. Recommendations for a better listing system In May, Kis... (Read More...)",50.0,50.0,75.94212293624878,85.015,66.36363636363636,0.14460384845733643,2022-06-09
82,CoinTelegraph,"Price analysis 6/8: BTC, ETH, BNB, ADA, XRP, SOL, DOGE, DOT, AVAX, SHIB",Bitcoin and altcoins are losing bullish momentum and persistent selling at overhead resistance suggests that the current consolidation is far from over. (Read More...),50.0,50.0,82.45730400085449,30.910000000000004,60.0,2.0389407873153687,2022-06-09
83,Blockworks,"After TerraUSD’s Collapse, Will DAI Expand Into Cosmos?","Umee, a cross-chain borrowing and lending DeFi hub, advocates for tighter integration between Cosmos and MakerDAO The post After TerraUSD’s Collapse, Will DAI Expand Into Cosmos? appeared first on Blockworks. (Read More...)",38.685,50.0,77.41985619068146,38.685,68.75,5.504843592643738,2022-06-09
84,Bitcoinist,Ethereum Sees Successful Deployment Of The Merge On Testnet Ropsten,"On a historic day in the history of Ethereum, the network’s oldest testnet Ropsten was able to complete “The Merge”. According to core developer Tim Beiko, the testnet has begun including blocks and operational. This marks one of the most important milestones in ETH’s migration to a Proof-of-Stak... (Read More...)",79.295,87.5,99.88069534301758,52.49,66.66666666666666,99.98790919780731,2022-06-09
85,CoinGape,"Litecoin (LTC) Upgrade Spells Doom For Asset, Major Exchanges Withdraw Support","The discontinuation of Upbit’s support for Litecoin (LTC), brought about mixed reactions for the Twitter space earlier today. The South Korean cryptocurrency exchange platform published their delisting of LTC earlier on their website. Upbit claim action is for investor’s protection In the report ... (Read More...)",68.06,53.125,0.15976428985595703,70.095,56.00000000000001,0.01652240753173828,2022-06-09
86,CoinGape,“Bitcoin Is Going To A Million Dollar”-Michael Saylor,"Michael Saylor, founder and CEO of American cloud-based company, Microstrategy, in his tweet sharing his interview with CNBC Squawk Box, predicts a massive upward price movement for world’s leading cryptocurrency, Bitcoin. Bitcoin Is Better Than Gold And What It Wants To Be In replying to a quest... (Read More...)",50.0,50.0,0.6327599287033081,84.53999999999999,62.0,8.369547128677368,2022-06-09
87,Coinnounce,Secure your identity on web 3.0 with an NFT domain name from Quik.com,"The internet is changing. The way we connect is about to alter dramatically, and we3 is one of those words you can’t avoid using when the subject comes up. So, what exactly is the web3? Ironically, the web3 is a simple yet complex shift of how the internet operates, how we consume info in many […] (Read More...)",67.0,70.0,1.4470428228378296,35.199999999999996,56.52777777777778,14.628615975379944,2022-06-09
88,Coinnounce,A blockchain-based construction monitoring system developed by The University of Hong Kong,"As per the press release, the technology, dubbed E-Inspection 2.0, aids in managing construction quality inspection papers by ensuring that construction site images and back-and-forth approved inspection files are all “accountable, traceable, and immutable.” How does the system work? “The core of... (Read More...)",50.0,55.00000000000001,94.84387934207916,79.97000000000001,75.0,99.7650682926178,2022-06-09
89,Coinnounce,Japan passes a historic bill to regulate crypto stablecoins,"Japan recently made history by becoming the first to approve legislation governing stablecoins. The decision is an important step toward safeguarding investors, especially in light of Terra’s UST and LUNA catastrophe. Since 2021, Japan has been wary about stablecoins, according to Edul Patel, CEO... (Read More...)",50.0,50.0,84.19058620929718,31.94,63.57142857142857,96.65655493736267,2022-06-09
90,The Block,Bit Digital mined about 30% less bitcoin in May,"Bit Digital produced 53.4 bitcoin in May, according to an operational update released Wednesday. (Read More...)",50.0,45.83333333333333,0.01563429832458496,50.0,62.5,0.0071048736572265625,2022-06-09
91,ZyCrypto,LTC Risks Epic Sell-Off As Leading Korean Crypto Exchanges Delist Litecoin,Several exchanges in South Korea have announced that they have removed Litecoin from their listings. (Read More...),36.34,55.00000000000001,0.8270800113677979,50.0,62.5,0.041681528091430664,2022-06-09
92,Crypto Daily,US Department of Justice urges president Biden to close regulatory gaps and strengthen international cooperation,"The office of the Attorney General of Washington DC, has urged President Biden to strengthen regulation of the crypto industry, in a joint report In response to the recent Executive Order on Ensuring Responsible Development of Digital Assets The report outlines the steps the Department of Justice... (Read More...)",84.53999999999999,50.0,98.13611209392548,87.53,57.49999999999999,88.67529332637787,2022-06-09
93,CoinTelegraph,"Despite bearish trend, hedge funds are dipping their toes in crypto: PwC","Although traditional fund managers remain hesitant about investing in Bitcoin and Ether, their exposure to digital assets appears to be growing. (Read More...)",50.0,50.0,0.12449026107788086,55.135,58.333333333333336,99.90664422512054,2022-06-09
94,Blockworks,"Japan Revisits Organized Crime Law, Considers Seizures of Illicit Cryptoassets","The Japanese Justice Ministry will be having conversations with the Legislative Council to discuss revisions to the law later this month The post Japan Revisits Organized Crime Law, Considers Seizures of Illicit Cryptoassets appeared first on Blockworks. (Read More...)",22.884999999999998,47.5,95.96130847930908,48.71,56.99999999999999,0.05494356155395508,2022-06-09
95,Ethereum World News,Ethereum Developers Successfully Activate the Merge on the Ropsten Testnet,Key takeaways: Ethereum developers have successfully merged the Ropsten Testnet to the proof-of-stake beacon chain. The Merge of the Ropsten Testnet is meant to be a test run for the final Merge on the Ethereum mainnet. Transactions have successfully been included in the post-merge Ropsten blocks... (Read More...),74.695,87.5,99.949511885643,87.53,70.0,99.95196759700775,2022-06-09
96,Bitcoin.com,"New NFT Marketplace, myNFT, Seals $7m in Funding to Make NFTs Accessible to All","PRESS RELEASE. New London-based NFT marketplace platform, myNFT, has announced its upcoming launch with the news that it has received Series A funding from some of the most prominent investors in the blockchain industry. myNFT believes that the current NFT industry is filled with barriers, blocki... (Read More...)",50.0,62.78409090909091,99.76383447647095,69.02000000000001,66.96969696969697,1.1034339666366577,2022-06-09
97,Bitcoinist,"Bitcoin ETPs Buck Crypto Winter Trend, Boast New ATH","With the rise of bitcoin in 2021 had come more institutional interest in the digital asset. Funds quickly adapted to the changing landscape, offering new ways for their clients to get exposure to the blossoming crypto market. This accelerated adoption by institutional investors has continued even... (Read More...)",50.0,56.81818181818181,91.87097549438477,84.915,64.6969696969697,99.96043741703033,2022-06-09
98,NewsBTC,Bitcoin Miner Revenues Stay Low As Price Decline Continues,"Bitcoin miners have been one of the worse-hit following the decline in the price of the digital asset. After what can be said to be a wonderful run towards the end of 2021, the miners have now hit a rough patch where their revenues have been dropping. The previous week would prove to be no differ... (Read More...)",36.34,50.0,0.08681714534759521,80.62,60.27777777777777,0.004696846008300781,2022-06-09
99,BeInCrypto,Custodia Bank Sues Federal Reserve for Delaying Application for Master Account,"Bitcoin bank Custodia is suing the Federal Reserve, claiming the central bank has “unlawfully” delayed its application for a master account. The post Custodia Bank Sues Federal Reserve for Delaying Application for Master Account appeared first on BeInCrypto. (Read More...)",50.0,50.0,0.5025863647460938,27.060000000000002,62.5,0.003826618194580078,2022-06-09
100,crypto.news,Osmosis DEX Chain Temporarily Ceases Operations After $5M Hack,"Osmosis, a well-known DEX on the Cosmos ecosystem, was compromised today as losses hit $5 million. The network’s validators had to halt its services abruptly to save the residual liquidity. A Reddit User First Reported the Issue According to the… (Read More...)",50.0,50.0,0.011834502220153809,56.400000000000006,60.416666666666664,0.0077784061431884766,2022-06-09
101,The Daily Hodl,"Bitcoin Short-Term Holders Approaching Peak Pain As BTC Trades Below $30,000: Analytics Firm Glassnode","Analytics firm Glassnode is revealing short-term Bitcoin (BTC) holders are sitting on losses as the flagship crypto asset trades below a key psychological level. Glassnode says nearly all the short-term holders (STH), or those who have held Bitcoin for a period of fewer than 155 days, are countin... (Read More...)",24.47,45.0,0.018197298049926758,52.580000000000005,54.0,0.03967583179473877,2022-06-09
102,Finbold,New York authorities release three key guidelines for stablecoin management,The New York State Department of Financial Services is the latest agency to release guidelines relating to the issuance and... Continue reading (Read More...),50.0,53.40909090909091,85.37393808364868,50.0,64.20454545454545,4.321983456611633,2022-06-09
103,Bitcoin Magazine,Fintech Startup Edge Release First Confidential Bitcoin Mastercard,Edge’s new card will not collect KYC data used to determine a person’s identity giving complete privacy and instant transfers with no fees. (Read More...),50.0,62.5,96.53848707675934,52.580000000000005,59.20454545454545,0.011518597602844238,2022-06-09
104,CoinGape,Breaking: Twitter Finally Obliges Elon Musk Demand In Takeover Deal,"According to a report by Washington Post, Twitter’s board is planning to comply with Elon Musk’s demands as part of the takeover deal. Musk’s demand for internal data and offering access to its full firehose is likely to be provided as part of the Elon Musk Twitter takeover. Firehose is the massi... (Read More...)",43.6,50.0,21.839281916618347,43.6,60.62499999999999,0.7653236389160156,2022-06-09
105,Bitcoin.com,Circle Announces the Stablecoin USDC Is Now Supported by the Polygon Network,"Circle, the issuer of the stablecoin usd coin (USDC), announced that the project is now supported on the Polygon network. The stablecoin with the second-largest market capitalization can now be withdrawn via a Circle Account and Circle APIs without the need for manual cross-chain bridge technolog... (Read More...)",65.91,50.0,95.02318799495697,65.91,75.0,98.74005615711212,2022-06-09
106,Protos.com,Here are some of Boris Johnson’s crypto-loving Conservative MPs,"Several Conservative MPs have pinned their flag to crypto's mast urging parliamentary colleagues to establish ""Blockchain Britain."" (Read More...)",50.0,50.0,82.99124836921692,50.0,62.5,0.5014121532440186,2022-06-09
107,U.Today,"Crypto Bear Market Bottom Might Be Close, Eccentric Indicator Says",Seasoned blockchain analyst shared eccentric chart that shows correlation between Bitcoin (BTC) price and search trends (Read More...),50.0,50.0,0.5106091499328613,67.0,62.5,99.87246096134186,2022-06-09
108,Crypto Briefing,Ethereum’s Ropsten Testnet Successfully Merges,"The Ropsten Proof-of-Work testnet has merged with its Proof-of-Stake beacon chain, finalizing one of the last rehearsals before the Ethereum mainnet transition. Ropsten Testnet Completes Merge Ethereums Ropsten Testnet successfully... (Read More...)",74.695,87.5,99.87516701221466,50.0,70.83333333333334,99.82385337352753,2022-06-09
109,CryptoPotato,Senator Cynthia Lummis’ Bill and What Does it Mean for Bitcoin,What would be the impact on bitcoin from Lummis' recently-proposed crypto bill that aims to categorize the asset as a commodity? (Read More...),50.0,34.375,18.01258623600006,68.06,75.0,0.38213133811950684,2022-06-09
110,Crypto Daily,BTC/USD Reclaims Some Lost Ground on Rebound: Sally Ho's Technical Analysis 9 June 2022 BTC,"Bitcoin (BTC/USD) worked to reclaim recent lost ground early in the Asian session as the pair appreciated to reach the 31549.21 level, regaining most of its recent sell-off from the 31745 area. Traders encountered technical resistance at this area earlier this week, right around the 78.6% retrace... (Read More...)",34.089999999999996,50.0,90.68409502506256,63.660000000000004,57.92857142857143,5.332154035568237,2022-06-09
111,Trustnodes,Ethereum’s Ropsten Testnet Merges Successfully,"Ethereum's longest running Proof of Work testnet, Ropsten, has upgraded to full on Proof of Stake in a merge. (Read More...)",74.695,87.5,99.8674213886261,50.0,71.25,23.049312829971313,2022-06-09
112,Trustnodes,Ropsten Merges Successfully,"Ethereum's longest running Proof of Work testnet, Ropsten, has upgraded to full on Proof of Stake in a merge. (Read More...)",74.695,87.5,99.69090521335602,50.0,71.25,23.049312829971313,2022-06-09
113,The Block,Ethereum’s Ropsten proof-of-stake ‘test merge’ goes live,Developers merged Ropsten's proof-of-work chain with its beacon chain. (Read More...),50.0,56.81818181818181,94.30765509605408,50.0,75.0,96.8309611082077,2022-06-09
114,U.Today,Mike Novogratz Says Most Crypto Hedge Funds Will Go Bust,Mike Novogratz has gloomy prediction for cryptocurrency-oriented hedge funds (Read More...),50.0,75.0,0.6735861301422119,42.345,75.0,0.03954470157623291,2022-06-09
115,Blockworks,Valkyrie Raises $11M in Push To Offer More Crypto Funds,BNY Mellon participated in the strategic round as the fund group seeks to expand headcount The post Valkyrie Raises $11M in Push To Offer More Crypto Funds appeared first on Blockworks. (Read More...),50.0,75.0,1.4974623918533325,65.91,63.125,95.3900694847107,2022-06-09
116,U.Today,"56 Million SHIB Burned, Ripple Expands to Europe Luxury Market, Here’s Who Dumps BTC on Crypto Market: Crypto News Digest by U.Today",Read U.Today’s news digest to find out what’s going on in the industry! (Read More...),34.089999999999996,50.0,0.08012950420379639,50.0,75.0,10.39040982723236,2022-06-09
117,CoinGape,Just In: Galaxy’s Mike Novogratz Indicates This Due To Crypto Crash,"For the second time in less than three weeks, Mike Novogratz, CEO of digital asset manager Galaxy Digital, has spoken on the ongoing cryptocurrency crash. On May 21, Novogratz warned against trying to predict a bottom to the crypto crash. Crypto Hedge Funds Will Fail In a latest, Novogratz said t... (Read More...)",29.905000000000005,43.75,0.04334747791290283,9.120000000000001,52.38095238095239,0.01569986343383789,2022-06-09
118,U.Today,"BTC, ETH, XRP, BNB and ADA Price Analysis for June 8",How long is the current rise of the market going to last? (Read More...),50.0,50.0,78.31379473209381,50.0,55.625,80.33908307552338,2022-06-09
119,Finbold,Bitcoin declared ‘dead’ 52% less in 2022 despite bear market vibes,"The cryptocurrency market has turned green once again after weeks of volatile price movement, with Bitcoin (BTC) leading the recovery... Continue reading (Read More...)",50.0,40.833333333333336,0.013449788093566895,50.0,57.49999999999999,7.234206795692444,2022-06-09
120,Ethereum World News,Ethereum’s Merge on the Ropsten Testnet Triggers Investor Optimism on Lower Fees and a Sustainable Future for ETH,Key takeaways: Ethereum’s Merge will happen today on the Ropsten Testnet. A successful Merge of the Beacon Chain and the Ropsten testnet will be the first signal of a potentially successful launch on the Ethereum mainnet. Investors look forward to the transition of Ethereum to a Proof-of-stake al... (Read More...),65.91,50.0,98.1270045042038,91.125,72.5,99.20299649238586,2022-06-09
121,Bitcoin.com,"Biggest Movers: LINK Remains Near 1-Month High, as ADA Extends Bull Run","LINK remained close to a one-month high earlier in today’s session, as crypto markets shook off some of Tuesday’s volatile moves. Although price volatility remained, bulls returned to show force, with ADA continuing to climb higher this week. Chainlink (LINK) LINK was trading around a one-month h... (Read More...)",56.400000000000006,56.49999999999999,0.49380362033843994,44.865,61.375,2.3283272981643677,2022-06-09
122,BeInCrypto,Project Galaxy (GAL) Creates Bullish Pattern – Multi-Coin Analysis,"Be[in]Crypto takes a look at the price movement for seven different cryptocurrencies, including Project Galaxy (GAL), which might have created a double bottom pattern. The post Project Galaxy (GAL) Creates Bullish Pattern – Multi-Coin Analysis appeared first on BeInCrypto. (Read More...)",63.660000000000004,50.0,5.544838309288025,73.83500000000001,59.375,0.05075037479400635,2022-06-09
123,Bitcoin Magazine,"Financial Behemoths Partner For New Bitcoin, Crypto Trading Platform: Report","The new trading platform from Fidelity, Citadel Securities, Virtu Financial and Charles Schwab will enable wide access to bitcoin and other cryptocurrencies. (Read More...)",50.0,53.40909090909091,99.62897598743439,64.8,54.11363636363637,99.32240843772888,2022-06-09
124,Finbold,"Ethereum adds 500,000 new addresses per week despite sluggish market","Despite the cryptocurrency market alternating between red and green, struggling to hit a bullish streak, one of its major assets... Continue reading (Read More...)",65.445,56.81818181818181,18.532544374465942,28.925,54.53125,16.5885329246521,2022-06-09
125,U.Today,"Ethereum’s Price Returns Toward $1,800 as This Metric Indicates Next Direction of Trend","Ethereum's price returns toward $1,800, this metric indicates next direction of trend (Read More...)",50.0,50.0,90.33591449260712,50.0,62.5,15.027067065238953,2022-06-09
126,Finbold,U.S. Senator Lummis: America has “crossed the chasm” Bitcoin will not be banned,"Wyoming senator Cynthia Lummis has acknowledged that the United States has crossed the chasm concerning Bitcoin (BTC), maintaining that the... Continue reading (Read More...)",67.85,50.0,0.20643770694732666,71.075,75.0,87.07640469074249,2022-06-09
