,source,title,excerpt,vader_sentiment_title,tb_sentiment_title,flair_sentiment_title,vader_sentiment_excerpt,tb_sentiment_excerpt,flair_sentiment_excerpt,date
121,Forkast,Bitcoin has been mounting in DBS Digital Exchange in volatile June,Bitcoin custodied by Singapore-based DBS Digital Exchange (DDEx) grew by 30% from April 30 to June 30 this year while Ethereum under custody grew by 3% during the same period. See related article: DBS Bank slams brakes on retail crypto trading Fast facts Bitcoin bought on DDEx in June was nearly ... (Read More...),50.0,50.0,0.0043392181396484375,50.0,56.666666666666664,0.03335773944854736,2022-08-24
122,CryptoBriefing,U.S. Lawmaker Questions Treasury Over Tornado Cash Sanctions,"The U.S. Treasurys decision to sanction a piece of software presents a divergence from previous OFAC precedent, claims Rep. Tom Emmer (R-MN). A U.S. lawmaker is questioning the U.S. Treasurys decision to sanction Tornado Cash.Congressman Tom Emmer (R-MN) published a letter today addressed to Trea... (Read More...)",60.114999999999995,50.0,4.370471835136414,44.865,58.333333333333336,0.3960222005844116,2022-08-24
123,Crypto Briefing,U.S. Lawmaker Questions Treasury Over Tornado Cash Sanctions,"The U.S. Treasurys decision to sanction a piece of software presents a divergence from previous OFAC precedent, claims Rep. Tom Emmer (R-MN). Sanctions Questioned A U.S. lawmaker is questioning the... (Read More...)",60.114999999999995,50.0,4.370471835136414,39.885,58.333333333333336,2.631741762161255,2022-08-24
124,CryptoPotato,NFT Platform SudoRare Rug Pulled for $850K Hours After Launching,The AAM protocol for ERC-721 to ERC-20 swaps made away with over $800K in ETH. (Read More...),50.0,50.0,0.0031769275665283203,50.0,75.0,15.107855200767517,2022-08-24
125,U.Today,"BTC, ETH, XRP, SOL, and MATIC Price Analysis for August 23",Are bulls ready for midterm rise from current levels? (Read More...),50.0,50.0,23.88184666633606,68.06,61.66666666666667,13.30062747001648,2022-08-24
126,CoinGape,Coinbase Subscription Model Is The Future: CEO Hints At Revenue Sources,Coinbase chief executive officer Brian Armstrong said crypto related services would eventually be commoditized. He spoke about his company’s plans of making revenue from subscription models. Armstrong indicated that the company could get a major share of revenue from the subscription model. Howev... (Read More...),50.0,50.0,76.14760398864746,64.8,59.375,0.0597536563873291,2022-08-24
127,Decrypt,"Bitfinex Preps for Merge Eventualities, Offering Ethereum 'Chain Split Tokens'",Bitfinex is courting the possibility of a proof-of-work Ethereum network after the merge and is now offering both ETHW and ETHS tokens. (Read More...),50.0,50.0,86.6280734539032,50.0,75.0,75.74240565299988,2022-08-24
128,CoinGape,CRV Price Analysis: Bullish Reversal From $1 Mark Offers A 25% Upswing,"An ascending trendline assisted buyers during the recent recovery rally and pushed the CRV price to the $1.5 mark. This bull run accounted for a 173% growth in the past two months. However, from Mid July to August, the price showed multiple attempts to breach this local top. Thus, after these fai... (Read More...)",50.0,55.00000000000001,0.20335614681243896,76.335,55.35714285714286,0.03368258476257324,2022-08-24
129,Decrypt,NFT Project SudoRare Disappears With Roughly 520 Ethereum in User Funds,"Despite warnings on Crypto Twitter, NFT project SudoRare has disappeared from social media along with more than $800,000 in user funds. (Read More...)",32.99999999999999,45.0,0.01004040241241455,49.845,67.22222222222221,0.005716085433959961,2022-08-24
130,The Block,Congressman demands answers from Yellen on Tornado Cash sanctions,Rep. Tom Emmer wants answers from the Treasury on the fallout from the Tornado Cash sanctions. (Read More...),50.0,50.0,0.7208585739135742,60.114999999999995,67.5,2.6067137718200684,2022-08-24
131,AMBCrypto,Bitcoin’s thorough on-chain analysis to help you sail through ennui,"Bitcoin [BTC] is in the news, and things seemed to have gone awry once again. Following a momentary rally in July, BTC witnessed a decline in network activity that has culminated in a series of sell-offs in the last 22 days, as per Glassnode’s report. When Bitcoin [BTC] registered its all-time hi... (Read More...)",56.400000000000006,50.0,99.8721718788147,50.0,58.333333333333336,0.025254487991333008,2022-08-24
132,BeInCrypto,WazirX Co-Founder Seeks Funding For New Venture Valued at $220M,"Nischal Shetty, co-founder of Indian crypto exchange WazirX, is raising capital for a new venture, despite his previous one coming under scrutiny from authorities. The post WazirX Co-Founder Seeks Funding For New Venture Valued at $220M appeared first on BeInCrypto. (Read More...)",72.02,56.81818181818181,3.117033839225769,72.02,58.560606060606055,0.0055730342864990234,2022-08-24
133,U.Today,Binance Launches Zero-Fee Trading for Ethereum (ETH),"Price of Bitcoin could drop to as low as $18,300 in near future, according to Katie Stockton (Read More...)",50.0,50.0,8.315563201904297,25.305,57.49999999999999,0.16956329345703125,2022-08-24
134,The Block,Crypto lending platforms increase rates due to higher borrowing demand,"Despite the collapse of prominent lending firms, interest rates offered to customers have been increasing across the industry. (Read More...)",60.114999999999995,53.125,85.43885052204132,89.31,75.0,96.42378091812134,2022-08-24
135,Finbold,"Crypto community sets Bitcoin price for September 30, 2022 – Survey","After initially showing signs of a breakout, Bitcoin (BTC) is beginning to display bearish sentiment, with the flagship cryptocurrency facing... Continue reading (Read More...)",50.0,50.0,0.17647743225097656,55.135,62.5,1.6150325536727905,2022-08-24
136,Decrypt,Weekly Ethereum Staking Deposits Hit Record Low Just Weeks Before Merge,The number of weekly deposits to Ethereum’s Beacon Chain is at its lowest level ever with just a few more weeks until the merge event. (Read More...),36.34,50.0,0.02111494541168213,34.089999999999996,63.33333333333333,1.1893212795257568,2022-08-24
137,U.Today,SHIB Burn Rate Spikes 256.13% as 176 Million Tokens Gets Burned,Recent amount of SHIB burned by community has led to spike in burn rate (Read More...),50.0,50.0,0.0007212162017822266,50.0,62.5,0.4316657781600952,2022-08-24
138,U.Today,DOGE & SHIB Have Never Been So Close to Losing Their Places At the Market Cap Top,Shiba Inu and Dogecoin positions in market cap top at great risk (Read More...),36.760000000000005,75.0,98.94464015960693,79.295,80.0,18.05686056613922,2022-08-24
139,Cointelegraph,"Certain regulatory clarity could be 'hugely detrimental' for crypto, says former CFPB director","Some players in the industry could find U.S. regulators making a ""big overreach"" if agencies like the SEC listed specific criteria for cryptocurrencies as securities. (Read More...)",79.295,60.238095238095234,0.45522749423980713,78.595,55.00000000000001,8.360081911087036,2022-08-24
140,Cryptonews,‘7 South Korean Securities Firms Will Launch Crypto Exchanges in 2023’ – Report,"A slew of major South Korean securities companies – many of which may be affiliated with major commercial banks and business groups – could be set to launch crypto exchange platforms as early as next year. Per Newspim, “seven large domestic securities companies” have already applied to financial ... (Read More...)",64.8,50.0,10.6690913438797,76.335,57.19642857142857,0.26836395263671875,2022-08-24
141,crypto.news,NFT Interest Spikes as Companies Believe It’s a Phenomenal Revenue Stream,"NFTs have generated millions of dollars for companies like Nike, Dolce &amp; Gabbana, Tiffany, Gucci, and Adidas. Non-fungible tokens (NFTs) are a fascinating new source of revenue for companies. Firms worldwide have incorporated NFTs as a significant component of their… (Read More...)",72.94,75.0,95.59644162654877,88.915,71.39204545454545,97.29757905006409,2022-08-24
142,Bitcoin Magazine,"Over Half Of Indian Bitcoin, Crypto Investors Say It Is The Future Of Finance: Survey",KuCoin’s Into The Cryptoverse survey showcases Indian adoption of bitcoin and crypto with 56% of respondents saying the asset class is the future of finance. (Read More...),50.0,45.83333333333333,17.54479706287384,68.06,62.5,79.01267111301422,2022-08-24
143,NewsBTC,Why Bitcoin And Ethereum Saw A Spike In Correlation With Asian Equities,"The International Monetary Fund (IMF) published a study on the spike in positive correlation with Bitcoin (BTC), Ethereum (ETH), and Asian equities. The financial organization claims digital assets began an accelerated integration with the region during the pandemic as more people traded them loo... (Read More...)",50.0,50.0,1.5144050121307373,82.43,58.76623376623377,9.821295738220215,2022-08-24
144,CoinGape,Twitter Bots: Whistleblower Reveals Key Details After Musk Cancels Deal,"Twitter landed into another big controversy as a whistleblower disclosed that the social media giant misled regulators over spam accounts. Earlier, Elon Musk accused Twitter of hiding crucial details in the $44 billion deal. Twitter hiding vital stats? According to Reuters, Twitter’s Ex security ... (Read More...)",38.685,50.0,0.10946094989776611,22.884999999999998,54.52380952380952,0.015348196029663086,2022-08-24
145,CoinGape,Binance Announces Zero Fee Trading For Ethereum With BUSD Pairing,"Ahead of the Ethereum Merge, Binance announced zero-fee trading for the ETH and BUSD trading pair. The much anticipated Merge is set to happen around September 15, subject to technical changes. As the crypto market anticipates elevated interest in ETH in the coming days, Binance announced fee on ... (Read More...)",50.0,50.0,3.084331750869751,72.94,56.666666666666664,2.8190165758132935,2022-08-24
146,U.Today,This Bitcoin Indicator Flashes Once Again; Will BTC Price Weakness Continue?,Bitcoin may continue to come under pressure (Read More...),28.925,50.0,0.030618906021118164,35.199999999999996,75.0,0.006967782974243164,2022-08-24
147,Cointelegraph,Bitcoin price eyes $22K as US PMI data hits lowest since May 2020,BTC price bounces and the U.S. dollar falls from fresh twenty-year highs as PMI numbers reignite talk of recession. (Read More...),30.910000000000004,50.0,0.16186833381652832,43.6,70.0,0.3249913454055786,2022-08-24
148,U.Today,Binance Launches Zero-Fee Trading for Ethereum (ETH),Binance has now introduced zero-fee trading for Ethereum after testing waters with Bitcoin earlier this year (Read More...),50.0,50.0,8.315563201904297,50.0,62.5,97.73980677127838,2022-08-24
149,Finbold,"Crypto community predicts Ethereum to trade above $2,000 by end of September 2022",The cryptocurrency market is experiencing high levels of volatility as it struggles to hold above the $1 trillion market capitalization... Continue reading (Read More...),50.0,50.0,0.04961192607879639,31.94,61.0,0.1494765281677246,2022-08-24
150,The Daily Hodl,Crypto Attorney Predicts Tidal Wave of Evidence in Ripple and XRP Suit When Summary Judgment Motions Go Public,"Attorney and XRP supporter John Deaton believes new evidence will be revealed in the U.S. Security and Exchange Commission’s lawsuit against Ripple. The SEC filed its lawsuit against Ripple Labs in late December 2020, declaring XRP a security and accusing the San Francisco payments company of sel... (Read More...)",50.0,50.0,6.228557229042053,67.0,52.95454545454545,0.16495287418365479,2022-08-24
151,Bitcoinist,GameSwift Partners With Polygon To Become A Gaming Ecosystem For Web3 Games,"GameSwift – a Web3 gaming solution, has announced a strategic partnership with the Polygon network to build a comprehensive Gaming Ecosystem. GameSwift partnered up with Polygon and is going to launch its own chain built on the Polygon Edge framework. The platform is tailored to gamers and gaming... (Read More...)",50.0,50.0,99.62950944900513,75.53,77.5,99.3639588356018,2022-08-24
152,Cointelegraph,Tornado Cash saga highlights legal issues affecting the crypto market,"As support for Tornado Cash developer Alexey Pertsev mounts, questions regarding the legality of his arrest and the future of DeFi innovation continue to come to the forefront. (Read More...)",56.400000000000006,60.0,99.35007691383362,72.02,57.49999999999999,99.11175966262817,2022-08-24
153,The Block,Daphne Kwon joins Flipside Crypto as General Manager of DAO Initiatives,Blockchain analytics firm Flipside Crypto hires new General Manager to lead DAO strategy. (Read More...),50.0,52.5,93.64036321640015,50.0,56.07954545454545,79.02950048446655,2022-08-24
154,CryptoPotato,ETH Must Hold This Level to Prevent Another Crash (Ethereum Price Analysis),"The market has calmed down a bit in the past few days, even though it seems clear that the bears are in the driving seat. This happened as the bulls managed to defend the $1,500 level and are currently trying to recoup. Even though the negative momentum decreased, it’s still early to weave the po... (Read More...)",30.910000000000004,50.0,99.92829263210297,56.400000000000006,46.635802469135804,0.18777847290039062,2022-08-24
155,The Block,"Coinbase faces class action for crashing during volatility, listing securities",A new class-action lawsuit is asking for $5 million in damages from Coinbase over the exchange's habit of crashing during market volatility. (Read More...),64.8,55.00000000000001,0.24950504302978516,20.705000000000002,65.9090909090909,0.018018484115600586,2022-08-24
156,U.Today,"Shiba Inu (SHIB) Has Undiscovered Price Potential: Crypto Market Review, August 23",Shiba Inu's potential is still high as asset does not have any issues with holding against selling pressure on market (Read More...),50.0,50.0,94.88748013973236,53.86,61.0,99.97662305831909,2022-08-24
157,Bitcoinist,Nike Just Did It With A Record $185 Million In NFT Sales – Swoosh!,"As Nike would say – just do it – and it did. The athletic brand takes it a notch higher with millions of bucks in NFT sales. Despite non-fungible tokens’ second-quarter trading volume falling 40% as interest in NFTs begins to fade, Nike has set a record by becoming the world’s highest-earning bra... (Read More...)",50.0,50.0,87.08640933036804,67.0,70.0,99.81212615966797,2022-08-24
158,CryptoSlate,El Salvador’s Bitcoin policy could lead the change in global monetary system – Simon Dixon,Famous investor Simon Dixon recently described El Salvador’s Bitcoin policy as “very responsible” and said it could be the first domino to fall in bringing down the International Monetary Fund’s (IMF) “fiat-based Ponzi scheme” debt mechanism if it succeeds. (Read More...),50.0,50.0,97.28011786937714,58.894999999999996,62.84027777777778,7.350122928619385,2022-08-24
159,The Block,Digital Currency Group backs DAO tooling startup Mural in $5.6 million seed round,"Digital Currency Group, which owns CoinDesk, Genesis Global Trading and Grayscale Investments, has backed DAO tooling startup Mural. (Read More...)",47.42,45.0,78.27377319335938,51.29,58.333333333333336,0.37938058376312256,2022-08-24
160,The Block,Thorswap launches cross-chain swaps for majority of Ethereum tokens,Users can now swap native crypto assets on the Thorswap platform without needing to use a third-party bridge. (Read More...),50.0,50.0,96.50545418262482,58.894999999999996,75.0,15.706509351730347,2022-08-24
161,Bitcoin.com,Australia to Stocktake Crypto Holdings Ahead of Regulation,"Australia intends to do a virtual stocktake of cryptocurrency assets held by its citizens, the new executive power in Canberra announced this week. The move is viewed as an indication that the center-left government plans to regulate the country’s crypto space. Treasury Embarks on ‘Token Mapping’... (Read More...)",50.0,50.0,95.708167552948,68.06,65.9090909090909,6.800386309623718,2022-08-24
162,crypto.news,Ronin Hackers Have Moved Some Stolen Funds From Ether to Bitcoin Network,The hackers behind the $625 million Ronin bridge exploit in March have moved the majority of their funds from Ether (ETH) to Bitcoin (BTC) using renBTC and Bitcoin privacy tools Blender and ChipMixer. (Read More...),25.305,50.0,0.19791722297668457,44.865,52.5,0.022038817405700684,2022-08-24
163,Crypto Daily,Mark Cuban frustrated by SEC Gensler’s intransigence,"Billionaire investor Mark Cuban responded on Twitter to Gary Gensler’s Tweet that crypto companies just need to follow the rules that have been around for decades. The same head-butting around crypto and the Howey securities test has been going on for years now. Gary Gensler, Chairman of the SEC ... (Read More...)",23.665000000000003,30.000000000000004,0.03317296504974365,64.8,56.666666666666664,0.058391690254211426,2022-08-24
164,NullTX,Top 5 Polkadot Ecosystem Tokens Below $160 Million Market Cap to Watch in August 2022,"Polkadot Ecosystem is remarkable for its multi-chain application platform. Some top players in the Ecosystem include Polkadot (DOT), with a market cap of over $8 billion, and ChainLink (LINK), with a market cap of over $3 billion. Polkadot Ecosystem tokens generally have a market cap of around $1... (Read More...)",60.114999999999995,75.0,7.709595561027527,82.985,72.5,99.97701644897461,2022-08-24
165,Cointelegraph,Bitfinex offers new chain split tokens ahead of Ethereum Merge,ETHW and ETHS are the two newly introduced chain split tokens that will allow users to trade on the fork event. (Read More...),50.0,55.90909090909091,98.71847927570343,61.315,65.9090909090909,88.61777484416962,2022-08-24
166,Crypto Daily,"Post Voyager Announces the Launch of Jellyme, MOOI Network’s NFT Marketplace","Singapore, Singapore, 23rd August, 2022, ChainwirePOST VOYAGER, a blockchain arm of a Japanese mobile game powerhouse Cocone and a developer of the MOOI Network, announced on Monday the launch of its non-fungible token (NFT) marketplace, Jellyme. Jellyme is described as a “decentralized NFT marke... (Read More...)",50.0,50.0,98.73357117176056,50.0,51.66666666666666,18.035954236984253,2022-08-24
167,U.Today,Ripple Sells Millions of USD in XRP as It Partakes in Shifting 318 Million XRP,Ripple has again sold large amount of XRP as it joined exchanges in wiring nearly 320 million XRP (Read More...),50.0,50.0,20.250731706619263,50.0,63.57142857142857,99.92859363555908,2022-08-24
168,Cointelegraph,Crypto City Guide to Prague: Bitcoin in the heart of Europe,(Read More...),50.0,50.0,90.68235754966736,50.0,75.0,96.50535881519318,2022-08-24
169,Cryptomode,RadioCACA Seals off New Partnership With Venus Protocol,"A recent tweet from @RadioCacaNFT announces a partnership deal with Venus Protocol, a decentralized finance (DeFi) algorithmic money market protocol on BNB Chain. According to the announcement, #RACA will support Venus Protocol’s presence in @USMverse. We’re excited to announce our partnership wi... (Read More...)",50.0,56.81818181818181,18.293437361717224,81.245,64.58333333333334,15.498098731040955,2022-08-24
170,The Block,BendDAO fixing NFT liquidations could lead to Bored Apes selling at a discount,"A vote has passed that will enable BendDAO to carry out major protocol changes, incentivizing healthy NFT liquidation auctions. (Read More...)",36.34,25.0,0.01710057258605957,70.095,67.70833333333334,82.29491114616394,2022-08-24
171,Cryptomode,Looki NFT Records Over $250K in Trading Volume Within 4 Days on OpenSea,"The Looki Avatar, as a collection of PFP NFTs, can be used as a profile photo on social media platforms, including Twitter and Instagram. Looki NFTs further describes itself as an exclusive NFT collection developed for the Web3 community and not just an artistic work for decoration or so. Looki N... (Read More...)",50.0,50.0,6.532388925552368,56.400000000000006,59.66666666666667,76.95516049861908,2022-08-24
172,CoinTelegraph,Malaysian regulators add Huobi to investor alert list,The Securities Commission of Malaysia says Huobi is operating without official registration from local regulators. (Read More...),64.8,50.0,96.74558937549591,64.8,62.5,0.2837836742401123,2022-08-24
173,Crypto Briefing,"NFT Exchange SudoRare Goes Dark After $820,000 Rug Pull","SudoRare was live for only six hours before executing the rug pull and taking down its website and all affiliated social media accounts. SudoRare Disappears With $820,000 After numerous warnings... (Read More...)",50.0,42.5,0.01976191997528076,32.99999999999999,54.28451178451178,0.0020563602447509766,2022-08-24
174,CryptoBriefing,"NFT Exchange SudoRare Goes Dark After $820,000 Rug Pull","SudoRare was live for only six hours before executing the rug pull and taking down its website and all affiliated social media accounts. After numerous warnings that SudoRare could be a scam did the rounds on Crypto Twitter, the anonymous team behind the decentralized NFT exchange has pulled the ... (Read More...)",50.0,42.5,0.01976191997528076,14.52,50.81529581529581,0.0007867813110351562,2022-08-24
175,ZyCrypto,Investors Take Bitcoin Off Crypto Exchanges ‘Like Never Before’. A Reason To Cheer?,"Arcane Research, a cryptocurrency analysis firm, notes that bitcoin holders have been pulling their BTC off exchanges hysterically in a newly released report. (Read More...)",75.53,50.0,16.798651218414307,50.0,57.27272727272727,0.050011277198791504,2022-08-24
176,Finbold,"The Merge’s initial success is key to driving Ethereum much higher, Nexo CEO reiterates","Antoni Trenchev, the co-founder of crypto lending platform Nexo, has maintained that there is no guarantee the Merge upgrade will... Continue reading (Read More...)",78.595,56.875,97.04594910144806,47.42,75.0,11.450579762458801,2022-08-24
177,CoinGape,Amid Market Correction EOS Price Rising At Full Throttle; Is $2 next Target?,"In the big picture, the EOS/USDT pair chart shows an evident rounding bottom recovery in the daily time frame. This pattern usually appears at the market bottom to indicate a new uptrend. Thus, under the influence of this pattern, the altcoin should steadily rise, breaking through the in-between ... (Read More...)",50.0,58.75,0.2701908349990845,50.0,55.73593073593074,81.1250776052475,2022-08-24
178,AMBCrypto,What will it take for Bitcoin to be the ‘perfect inflationary hedge’,"Many believe that Bitcoin remains a desirable asset. However, according to Anthony Scaramucci, CEO of Skybridge Capital, it has not yet attained the “wallet bandwidth” necessary to qualify as an inflation hedge. On CNBC’s Squawk Box, the exec claimed that Bitcoin is still too much of “an early ad... (Read More...)",50.0,100.0,0.1542806625366211,79.295,63.74999999999999,0.03241598606109619,2022-08-24
179,BeInCrypto,EOS (EOS) Pumps by More Than 30% in a Day,"While EOS (EOS) is still trading inside a crucial long-term resistance level, there are several signs in various time frames that suggest a breakout is expected. The post EOS (EOS) Pumps by More Than 30% in a Day appeared first on BeInCrypto. (Read More...)",50.0,75.0,97.79089689254761,50.0,58.214285714285715,0.006777048110961914,2022-08-24
180,BeInCrypto,PayPal Partners With Coinbase TRUST Network to Ensure Banking Compliance,"PayPal has joined Coinbase's Travel Rule Universal Solution Technology (TRUST) network, which aims to ""protect the security and privacy"" of customers while complying with the banking industry's Travel Rule. The post PayPal Partners With Coinbase TRUST Network to Ensure Banking Compliance appeared... (Read More...)",88.36,50.0,98.53966236114502,95.875,62.5,13.80205750465393,2022-08-24
181,U.Today,Shiba Inu Large Holders Might Be Timing the Market as Transactions Suddenly Spike 84%,Massive spike in large transactions had lead-up to Shiba Inu's impressive rise earlier (Read More...),50.0,55.35714285714286,5.207312107086182,75.53,67.14285714285715,9.236890077590942,2022-08-24
182,CryptoPotato,Explore COSMOS With 1xBit,"[PRESS RELEASE – Please Read Disclaimer] 1xBit continues to onboard projects and develop features to create a better user experience. Based on this commitment, COSMOS is now on 1xBit, and bettors can utilize this cryptocurrency for their payments, stake, and withdrawals. What is Cosmos? COSMOS bi... (Read More...)",50.0,50.0,99.98311400413513,92.595,75.0,98.59585762023926,2022-08-24
183,CryptoPotato,Argentina Presidential Candidate Sued for Promoting a Crypto Ponzi Scheme,"A group of harmed investors want Javier Milei to reimburse them with approximately $300,000 for promoting a cryptocurrency fraudulent scheme. (Read More...)",68.06,50.0,0.04230141639709473,22.884999999999998,52.5,0.00845193862915039,2022-08-24
184,CoinGape,Breaking: Bugs Found In Ethereum Clients’ Mainnet Merge Releases,"The long-awaited Ethereum Merge has finally started as Ethereum clients release updates in preparations for the Merge on September 15. However, the Go Ethereum and Nethermind have found bugs in their Mainnet updates Geth v1.10.22 (Promavess) and v1.14.0, respectively. Still, the bugs are unlikely... (Read More...)",50.0,50.0,0.7071018218994141,67.0,50.0,0.0915229320526123,2022-08-24
185,CoinGape,Chingari Announces Its First Ever Video NFT Marketplace,(Read More...),50.0,62.5,99.69709813594818,50.0,75.0,96.50535881519318,2022-08-24
186,Cryptomode,Impact of Blockchain Technology on the Payment System,"By using blockchain, businesses, including the gambling industry, can automate their payment processes while maintaining straightforwardness and top safety. Some of the sectors that have witnessed a massive transformation thanks to innovation are the finance and payments industry. Today, the glob... (Read More...)",50.0,50.0,99.96529221534729,92.21,65.0,99.57942068576813,2022-08-24
