,source,title,excerpt,vader_sentiment_title,tb_sentiment_title,flair_sentiment_title,vader_sentiment_excerpt,tb_sentiment_excerpt,flair_sentiment_excerpt,date
0,The Block,Crypto exchanges finish 2022 with the lowest volumes in two years,"Crypto exchanges finished off the year with volumes close to that of December of 2020, when bitcoin first broke past $20,000.  ...",30.910000000000004,50.0,1.5189558267593384,28.925,50.0,10.470649600028992,2022-12-31
1,AMBCrypto,"Uniswap [UNI] defends $4.95, but bulls are slowly losing ground. Here’s why…","The information presented does not constitute financial, investment, trading, or other types of advice and is solely the writer’s opinion Until pr...",23.665000000000003,35.0,0.14381110668182373,50.0,46.875,3.101181983947754,2022-12-31
2,The Block,Bored Ape Yacht Club ends 2022 with 69 ETH floor price,"Despite the bear market, BAYC maintained the highest floor price among NFT projects for nearly the whole year.",36.34,25.0,2.369898557662964,50.0,57.49999999999999,99.95910227298737,2022-12-31
3,CryptoSlate,SushiSwap CEO proposes new tokenomics to survive liquidity crunch,"SushiSwap&#8217;s CEO, Jared Grey, introduced a proposal on December 30 to alter the tokenomics of the SUSHI token in an attempt to revive the pro...",50.0,56.81818181818181,5.2254438400268555,69.08999999999999,47.5,2.028051018714905,2022-12-31
4,AMBCrypto,Going long on AVAX? Here is the “but” to this possible trend reversal,"Disclaimer: The information presented does not constitute financial, investment, trading, or other types of advice and is solely the writer’s opin...",50.0,48.75,0.7043749094009399,50.0,46.875,0.11563897132873535,2022-12-31
5,CryptoSlate,"BTC performed better than ARKK, MSTR, COIN despite 65% fall in 2022",CryptoSlate looked into Glassnode data representing year-to-date (YTD) reviews of leading assets and currencies and revealed that Bitcoin (BTC) pe...,72.02,75.0,99.25729036331177,58.894999999999996,50.0,6.5770357847213745,2022-12-31
6,Decrypt,This Week on Crypto Twitter: Did SBF Move Money? Man Utd NFTs Under Fire. Eisenberg Arrested!,"SBF returns to Twitter, Avraham Eisenberg is busted, and Manchester United gets accused of NFT art plagiarism.",15.02,50.0,0.018322467803955078,57.655,50.0,0.01609325408935547,2022-12-31
7,Cointelegraph,Top crypto funding stories of 2022,"2022 was a record-breaking year for blockchain and crypto VCs. Depending on who you ask, that's either a good thing or a bad thin...",60.114999999999995,75.0,99.91068840026855,42.345,43.333333333333336,99.632927775383,2022-12-31
8,AMBCrypto,Crypto winter to exceed 2023? This CEO predicts another “tough year”,"Marcus Lightspark CEO David Marcus believed that the crypto winter would not be over before 2024. Bitcoin [BTC] is trading at more than $16,500 at...",50.0,30.555555555555557,0.05238652229309082,50.0,75.0,0.009456276893615723,2022-12-31
9,Cointelegraph,"SBF to enter plea deal, Mango’s exploiter arrested, and Celsius news: Hodler’s Digest, Dec. 25-31",,26.165,50.0,1.7751812934875488,50.0,50.0,0.0,2022-12-31
10,AMBCrypto,Dogecoin Foundation adds another bag as DOGE fails to hold support,"The Dogecoin ecosystem received five million DOGE in a bid to improve the project. DOGE briefly increased, but it might not last. Dogecoin [DOGE] ...",48.71,25.0,0.012007355690002441,68.06,50.0,0.010147690773010254,2022-12-31
11,Cointelegraph,2023 will see the death of play-to-earn gaming,"Developers have been focusing more on tokens than on making fun games. As a result, GameFi has been dying.",20.029999999999998,50.0,0.005757808685302734,75.53,70.0,0.005227327346801758,2022-12-31
12,AMBCrypto,Taking a look at Bitcoin’s historic low volatility periods to find what 2023 holds,"Volatility, or the lack of it, can serve as a tool for analyzing market trends The downtrend of Bitcoin is mostly done, but one more leg downward ...",36.34,50.0,7.6446980237960815,41.725,75.0,0.22928118705749512,2022-12-31
13,CoinGape,Will This Pattern Crash XRP Or Is A Bullish Revival Set for 2023?,"The XRP market has been exhibiting a head and shoulder pattern for the second half of 2022, which is often seen as a bearish signal indicating a p...",29.905000000000005,50.0,0.0018894672393798828,50.0,45.83333333333333,0.046318769454956055,2022-12-31
14,NewsBTC,Solana Continues Its Freefall – Will The FUD Ever Stop?,"Solana has been on a freefall since the collapse of FTX and has not been able to move upwards because of the FUD (fear, uncertainty and doubt) sur...",19.169999999999998,50.0,94.75752413272858,9.284999999999998,75.0,0.04458725452423096,2022-12-31
15,BSCnews,Binance Completes BUSD Integration to TRON Network,BUSD stablecoin is open for deposits and withdrawals on Justin Sun's TRON Network.,50.0,50.0,99.99174475669861,50.0,50.0,2.8740912675857544,2022-12-31
16,AMBCrypto,"All there is to know about QNT’s 40% drop, especially after its 2022 performance","QNT saw 23.4% of its total supply taken off exchanges in 2022. While this is a bullish sign, the nature of the market caused its price to drop by ...",36.34,50.0,0.0721663236618042,36.34,50.0,0.02504587173461914,2022-12-31
17,Bitcoinist,"A Crypto Holiday Special: Past, Present, And Future With Material Indicators","2022 is coming to an end, and our staff at Bitcoinist decided to launch this Crypto Holiday Special to provide some perspective on the crypto indu...",82.985,51.33928571428571,98.72725903987885,82.985,67.85714285714286,99.61130023002625,2022-12-31
18,BSCnews,"Security Review Could Block Binance.US Voyager Acquisition, Filings Say",The review by the National Security body could stall or block the deal entirely.,43.6,50.0,0.25351643562316895,34.089999999999996,50.0,0.4154801368713379,2022-12-31
19,BSCnews,"Security Review Could Block Binance US Voyager Acquisition, Filings Say",The review by the National Security body could stall or block the deal entirely.,43.6,50.0,0.5680501461029053,34.089999999999996,50.0,0.4154801368713379,2022-12-31
20,Cointelegraph,US lawmakers under pressure following FTX collapse: Report,"In response to FTX’s fall, United States lawmakers are reevaluating the crypto industry’s regulatory needs for 2023.",17.015,50.0,7.4298858642578125,71.075,50.0,2.7170121669769287,2022-12-31
21,CryptoSlate,OpenSea’s dominance shrank 23% in 2022,CryptoSlate looked into Glassnode data to evaluate OpenSea&#8217;s performance in 2022 and revealed that the marketplace&#8217;s dominance fell to...,60.114999999999995,50.0,0.10291635990142822,60.114999999999995,50.0,0.0034332275390625,2022-12-31
22,CoinGape,"Bitcoin (BTC) Price Forming A Super-Bearish Pattern, But There’s A Catch","The price of Bitcoin (BTC) has, for the most part, continued to trend horizontally without exhibiting any notable volatility as the year comes to ...",50.0,50.0,1.681336760520935,50.0,75.0,1.5896856784820557,2022-12-31
23,AMBCrypto,"Yes, Uniswap [UNI] was king in 2022, but at what cost?","This year, the cryptocurrency market saw a significant decrease in value, losing over $1.4 trillion. This decline was due to various issues faced ...",60.72,50.0,0.13899803161621094,57.655,54.166666666666664,0.05422830581665039,2022-12-31
24,BSCnews,Huobi Announces Intent to Monitor CoreDAO Mainnet Launch,Huobi will seek to list the project as soon as possible after launch.,50.0,50.0,0.26689469814300537,50.0,50.0,0.1191556453704834,2022-12-31
25,CryptoSlate,27 stats about NFTs in 2022 – who are the big winners?,"At the beginning of the year, when the crypto market was red hot, it was extremely tough to understand what was going on in the NFT industry. The...",73.83500000000001,50.0,1.1744171380996704,39.97,47.68518518518518,0.0016450881958007812,2022-12-31
26,CoinGape,Curve Dao Coin Price Aims 30% Upswing In Early 2023,"The Curve dao coin price showed a steady downfall over the past five months. From the high of $1.6, this downfall tumbled the prices 66% down to c...",50.0,55.00000000000001,10.80111563205719,50.0,49.01388888888889,0.003224611282348633,2022-12-31
27,BSCnews,"Chainlink Weekly Roundup: Blueberry, Magpie, Galileo, Fuse Gold",Smart contract oracle network Chainlink caps off the year by partnering with DeFi protocols and physical asset tokenization platforms.,50.0,50.0,99.57529008388519,81.845,55.35714285714286,13.568422198295593,2022-12-31
28,CryptoSlate,Ex-Meta crypto head expects crypto winter to drag through 2024,"David Marcus, founder of Bitcoin (BTC) payments firm Lightspark, disappointed crypto bulls hoping for a quick crypto market recovery, as he predic...",38.685,45.0,0.04296302795410156,46.14,39.72222222222222,0.016671419143676758,2022-12-31
29,AMBCrypto,Ethereum changed allegiance but will the proceeds of the transition reflect in 2023,"The Ethereum Merge was successful, with follow-up upgrades expected in 2023 Staking withdrawals are expected to begin in the first quarter after O...",50.0,50.0,5.70068359375,79.295,60.0,8.660989999771118,2022-12-31
30,Crypto Daily™,Bitcoin Price Analysis: 64% Decline in 2022 - 1 January 2023,BTC/USD Finishes 2022 Off 64%:&nbsp; Sally Ho&rsquo;s Technical Analysis &ndash; 1 January 2023 Bitcoin (BTC/USD) capped a very bearish year with ...,50.0,50.0,0.027182698249816895,50.0,55.00000000000001,0.005733966827392578,2022-12-31
31,CryptoSlate,Only 0.39% of Elon Musk’s $200B loss is due to BTC volatility,"Elon Musk became the first person ever to lose $200 billion according to Bloomberg News, while Tesla lost $783 million to Bitcoin (BTC) volatility...",34.089999999999996,46.875,2.512720227241516,19.379999999999995,62.5,0.6727248430252075,2022-12-31
32,Cointelegraph,Bitcoin stays put with yearly close set to seal 60% YTD BTC price loss,"Little fresh BTC price action greets traders in the final hours of 2022, with Bitcoin avoiding any form of last-minute trend chan...",34.089999999999996,50.0,99.52864348888397,52.669999999999995,52.65625000000001,92.86395609378815,2022-12-31
33,BSCnews,Weekly Article Recap: 12/26-12/30,A recap of notable news from the week.,50.0,50.0,80.40327727794647,50.0,75.0,98.1117993593216,2022-12-31
34,CoinGape,"Bitcoin, Ethereum Price Prediction- This Range Breakout May Clear Uncertainty In Crypto Market","Bitcoin, Ethereum price prediction: the BTC and ETH price prolong consolation has created a sense of indecisiveness among market participants. How...",52.580000000000005,55.00000000000001,2.114415168762207,46.14,50.0,17.88329780101776,2022-12-31
35,AMBCrypto,"With Bitcoin [BTC] mirroring 2019 price plummet, will 2023 see panic-driven investors","  BTC ends 2022 at the $16,500 price range. On-chain data points to a further depreciation in BTC&#8217;s value in the coming year. Despite closin...",50.0,50.0,1.0221481323242188,67.0,50.0,0.248757004737854,2022-12-31
36,CryptoSlate,Research: Nearly $9B worth of ETH was burned in 1.4 years,"The second largest cryptocurrency by market cap, Ethereum (ETH), implemented a token burn mechanism on August 5, 2021, through the Ethereum Improv...",61.315,65.0,0.010630488395690918,50.0,50.0,0.5169689655303955,2022-12-31
37,AMBCrypto,This is what the future holds for bankrupt crypto lender Voyager Digital,CFIUS will review transactions made by bankrupt crypto lender Voyager Digital Holdings Binance.com recently agreed to buy Voyager&#8217;s assets f...,22.13,50.0,94.45325434207916,39.885,50.0,0.7302075624465942,2022-12-31
38,Decrypt,"Bitcoin and Ethereum Flat in Final Week of 2022, Solana and Dogecoin Down Bad",Bitcoin and Ethereum slid less than 2% in the final week of a brutal year for crypto prices; SOL and DOGE fell much harder.,22.884999999999998,38.99305555555556,0.0011444091796875,18.755,35.729166666666664,0.0019669532775878906,2022-12-31
39,Cointelegraph,Winners and losers of 2022: A disastrous year that saw few winners among a sea of losers,"2022 was an eventful year for the crypto world but not everyone came on top of it, we look at some of the biggest winners and los...",16.475,33.75,0.002378225326538086,87.345,75.0,15.63672423362732,2022-12-31
40,CoinGape,3 Reasons Why Dogecoin May Offer Great Returns In 2023; Buy Now?,"Amid the ongoing selling pressure in the crypto market, the dogecoin price shows a substantial breakdown from the monthly support of $0.073-$0.071...",81.245,90.0,79.91350293159485,65.91,50.0,0.010523200035095215,2022-12-31
41,The Block,Three crypto stories you might have missed this week,Here are three stories you might have missed while tucking into festive leftovers or trying to keep tabs on the many threads of the F...,35.199999999999996,50.0,0.5783945322036743,60.114999999999995,75.0,17.339998483657837,2022-12-31
42,AMBCrypto,Polkadot (DOT) Price Prediction 2025-2030: Shorting DOT could turn out to be…,Disclaimer: The datasets shared in the following article have been compiled from a set of online resources and do not reflect AMBCrypto’s own rese...,50.0,50.0,0.8956044912338257,67.0,65.0,0.043210387229919434,2022-12-31
43,AMBCrypto,"With Litecoin steady at $68.23, can the LTC bulls breach this critical resistance?","Disclaimer: The information presented does not constitute financial, investment, trading, or other types of advice and is solely the writer’s opin...",30.654999999999998,54.166666666666664,0.2685636281967163,50.0,46.875,0.11563897132873535,2022-12-31
44,Crypto Daily™,Bahamian Regulators Say It Seized $3.5B of FTX Assets,The Securities Commission of The Bahamas announced that it seized $3.5 billion worth of cryptocurrency assets from the now-bankrupt and collapsed ...,58.894999999999996,50.0,5.223914980888367,70.095,65.0,0.11346638202667236,2022-12-31
45,Crypto Daily™,MicroStrategy sold its Bitcoin for good reason,"Some eyebrows were raised when Microstrategy sold a part of its Bitcoin holdings, even though the company then bought more. A tax loophole was the...",72.02,85.0,0.7565081119537354,50.0,75.0,1.1427611112594604,2022-12-31
46,AMBCrypto,Binance Coin (BNB) Price Prediction 2025-2030: Will 2023 see BNB find its bottom?,Disclaimer: The datasets shared in the following article have been compiled from a set of online resources and do not reflect AMBCrypto’s own rese...,50.0,50.0,21.497291326522827,67.0,65.0,0.043210387229919434,2022-12-31
47,buzzsprout,"CMC 50 — part seven: The biggest 50 crypto stories of 2022! Celsius, Meta, Twitter, LUNA, The Merge","<p>Welcome to the CMC 50 — CoinMarketCap's guide to the 50 biggest crypto stories of 2022. Today, Connor and Molly Jane are counting down from 8 t...",50.0,50.0,99.8824805021286,50.0,42.22222222222222,99.93956983089447,2022-12-31
48,CoinGape,Breaking: FTX Founder SBF’s Crypto Wallets To Be Investigated By U.S. Authorities,"According to latest reports, federal prosecutors are investigating a string of cryptocurrency transactions that online analysts have linked to dig...",50.0,50.0,0.4720449447631836,50.0,75.0,0.21786093711853027,2022-12-31
49,CoinGape,Bitcoin Price Prediction: Complete Report On What To Expect In 2023,Bitcoin price is likely to end the year above the crucial support level of $16.5K. The crypto market witnessed sluggish price action due to limite...,50.0,55.00000000000001,87.57306933403015,50.0,49.75,0.024515390396118164,2022-12-31
50,AMBCrypto,Polygon (MATIC) Price Prediction 2025-2030: Why next year could be THE year for MATIC,Disclaimer: The datasets shared in the following article have been compiled from a set of online resources and do not reflect AMBCrypto’s own rese...,50.0,50.0,96.9065397977829,67.0,65.0,0.043210387229919434,2022-12-31
51,CoinGape,XRP Lawsuit: XRP Holders Are Biggest Loser In Ripple Case? Attorney Suggests This,"XRP Lawsuit News: XRP, Ripple’s native crypto&#8217;s price has been stagnant due to the uncertainty caused by the long running case pulled by the...",17.570000000000004,50.0,0.7799237966537476,24.47,45.625,0.3606528043746948,2022-12-31
52,AMBCrypto,Cardano (ADA) Price Prediction 2025-2030: Assessing if $10-target is on the cards,Disclaimer: The datasets shared in the following article have been compiled from a set of online resources and do not reflect AMBCrypto’s own rese...,50.0,50.0,93.91145408153534,67.0,65.0,0.043210387229919434,2022-12-31
53,Cointelegraph,Sam Bankman-Fried to reportedly plead not guilty to criminal charges,"Following a court hearing on Dec. 22, SBF was released on bail and is slated to appear in court on Jan. 3 before U.S. District Ju...",73.015,46.25,5.758717656135559,50.0,50.0,93.08415353298187,2022-12-31
54,Crypto Daily™,Ex Meta exec says crypto winter to end in 2025,"David Marcus, advocate of the Bitcoin Lightning Network, thinks there is more pain to come in 2023 as market tries to recover from bad actors.&nbs...",50.0,50.0,11.604052782058716,10.199999999999998,45.0,0.1262456178665161,2022-12-31
55,CoinGape,Year Ender: Top 5 Web3 Security Companies In 2022,Web3 Security Companies: Web 3.0 (Web3) is the third generation of web technology evolution. Web3 companies aim to improve user experiences by ass...,74.695,75.0,99.51098263263702,82.43,50.0,99.3302971124649,2022-12-31
56,AMBCrypto,VeChain (VET) Price Prediction 2025-2030: Can $50-target be more than a projection?,Disclaimer: The datasets shared in the following article have been compiled from a set of online resources and do not reflect AMBCrypto’s own rese...,50.0,75.0,6.9956570863723755,67.0,65.0,0.043210387229919434,2022-12-31
57,The Block,Animoca Brands allowed deadline extension for filing results,"As has previously been shown by centralized exchanges including Binance and Kraken, auditing crypto firms is no mean feat. ...",50.0,50.0,3.1325459480285645,35.199999999999996,49.73958333333333,99.71548318862915,2022-12-31
58,CoinGape,SBF To Plead Not Guilty Next Week: Report,"Founder and former CEO of the collapsed exchange FTX, SBF is likely to plead not guilty, next week, to the charges against him as per a report by ...",66.25999999999999,56.25,3.853777050971985,39.065,53.125,0.2880990505218506,2022-12-31
59,crypto.news,"Nic Carter examines recent crypto proof-of-reserves, ranks exchanges","Nic Carter, a co-founder of Metrics, examined how well-known centralised exchanges are doing at supplying Proof of Reserves (PoR) in 2022",50.0,50.0,99.28229749202728,50.0,50.0,77.66730487346649,2022-12-31
60,CoinGape,Explained: How To Secure Your Crypto Wallet?,One of the reasons many people have been hesitant to engage in cryptocurrency is the security risk. Hackers can steal cryptocurrency by stealing o...,67.0,70.0,0.3956109285354614,13.245000000000001,75.0,6.3188254833221436,2022-12-31
61,CoinGape,What Is FTX Solana Connection? Will SOL Recover In 2023?,,50.0,50.0,0.8604317903518677,50.0,50.0,0.0,2022-12-31
62,crypto.news,"Bitcoin long-term holders do not lose their grip, on-chain data shows",Bitcoin (BTC) long-term holders are not afraid of the current volatility. Distrust towards centralized crypto service providers continues to drive...,65.445,50.0,99.78355765342712,28.925,57.49999999999999,5.3307026624679565,2022-12-31
63,Cointelegraph,'Crypto winter' won't end in 2023 — Bitcoin advocate David Marcus,"It will be ""another tough year"" for crypto in the wake of the FTX scandal, suggests the former Meta executive turned Bitcoin Ligh...",50.0,50.0,0.12751519680023193,23.665000000000003,40.27777777777778,0.06197094917297363,2022-12-31
64,Cointelegraph,‘Crypto winter’ won't end in 2023 — Bitcoin advocate David Marcus,"It will be “another tough year” for crypto in the wake of the FTX scandal, suggests the former Meta executive turned Bitcoin Ligh...",50.0,50.0,0.9429454803466797,23.665000000000003,40.27777777777778,0.15420913696289062,2022-12-31
65,CoinGape,"Breaking: Dogecoin Foundation Announces Development Fund, DOGE Price Jumps",Dogecoin Foundation on Saturday announces exciting news for the Dogecoin community. The foundation has formed a new community Dogecoin Core develo...,50.0,50.0,0.020238757133483887,74.695,60.909090909090914,93.44324767589569,2022-12-31
66,BSCnews,WAAA - Cryptory Launches New PFP NFT Project Amid Bear Market,"With $1,000,000 raised in early seed investment and an experienced team, WAAA has the right recipe for success.",50.0,56.81818181818181,14.572709798812866,78.595,68.57142857142857,99.94282126426697,2022-12-31
67,CoinGape,5 Ways To Spot Fake NFT Collection,A non-fungible token (NFT) is a special identifier that can be used to assign and prove ownership of digital goods using cryptography. NFTs for di...,26.165,25.0,98.33823144435883,70.095,58.92857142857143,9.505674242973328,2022-12-31
68,CoinGape,Binance-Voyager Deal Could Go On Hold: US Reviewer,,50.0,50.0,5.888432264328003,50.0,50.0,0.0,2022-12-31
69,Crypto Daily™,Valkyrie Submits Proposal To Manage Grayscale’s Bitcoin Trust,Crypto Assets Manager Valkyrie Investments has unveiled a proposal to become the sponsor and manager of the Grayscale Bitcoin Trust.&nbsp; The Gra...,75.53,50.0,6.284236907958984,58.894999999999996,50.0,81.62476122379303,2022-12-31
70,CoinGape,Fidelity Writes Off Twitter Stake By 56% Amid Musk Controversies,,50.0,50.0,0.2833247184753418,50.0,50.0,0.0,2022-12-31
71,CoinGape,Crypto News Live Updates Dec 31: Grayscale Troubled Bitcoin Trust Up For Grabs?,Crypto News Today Live Updates December and Latest News: (31 December 2022) The global cryptocurrency market looked stagnant over the past week. T...,53.86,40.90909090909091,0.00896155834197998,50.0,46.36363636363636,0.5702614784240723,2022-12-31
72,CoinGape,Elon Musk Sets A New World Record,,50.0,56.81818181818181,99.98658001422882,50.0,50.0,0.0,2022-12-31
73,CoinGape,"Shiba Inu Coin: SHIB Burn Jumps 13,198% In 24Hrs, Is It Shibarium Related?","Shiba Inu&#8217;s burn rate skyrockets 13,198% in the last 24 hours, as per the SHIB burn tracker Shibburn. The massive burn rate is linked to the...",50.0,50.0,0.005125999450683594,50.0,50.0,2.6457369327545166,2022-12-31
74,CoinGape,"Cryptocurrency Price Today: Terra Classic, Dogecoin, Polygon Slips; XRP, Solana Up",Cryptocurrency Price Today: The market is not showing any major development despite being the last day of the year. Terra Classic sees a drastic d...,50.0,58.333333333333336,98.33394289016724,50.0,53.81944444444444,0.12641549110412598,2022-12-31
75,CoinGape,Top 5 Reasons To Attend Metaverse Summit In 2023,"A metaverse is a shared, communal virtual environment made possible by the fusion of virtually enhanced physical reality and digital reality. The ...",60.114999999999995,75.0,99.96367990970612,67.0,50.0,99.89806413650513,2022-12-31
76,CoinGape,Rich Dad Poor Dad Author Is Stashing More Bitcoin,,56.400000000000006,57.91666666666666,0.05756020545959473,50.0,50.0,0.0,2022-12-31
77,NewsBTC,Is Polkadot (DOT) A Must-Have For Your 2023 Portfolio?,The year 2023 is said to be huge for Polkadot (DOT) as it is one of the cryptocurrencies to watch out for. Many crypto experts are very optimistic...,50.0,50.0,99.72471296787262,65.91,68.33333333333333,99.91128146648407,2022-12-31
78,Cointelegraph,"Proof of reserves is becoming more effective, but not all its challenges are technical","PoR is benefitting from intense development efforts, but in the final analysis good conduct requires good regulation and a cultur...",60.88,69.375,98.3582615852356,93.445,70.0,4.21069860458374,2022-12-31
79,CryptoSlate,Bahamas Security Commission told SBF to surrender $300 million,FTX and its associated debtors said on December 30 that nearly $300 million seized by the Bahamas&#8217; main securities regulator was transferred...,67.0,50.0,0.5459755659103394,64.8,56.666666666666664,0.9009510278701782,2022-12-31
80,Cointelegraph,New research indicates boomers make better crypto investors,"Boomers do significantly more research before investing in cryptocurrency than their younger counterparts, which puts them in a s...",72.02,65.9090909090909,0.004351139068603516,50.0,62.5,4.09177839756012,2022-12-31
