,source,title,excerpt,vader_sentiment_title,tb_sentiment_title,flair_sentiment_title,vader_sentiment_excerpt,tb_sentiment_excerpt,flair_sentiment_excerpt,date
127,CryptoPotato,Reasons Why Synthetix (SNX) Skyrocketed by Over 100%,"Synthetix is leading the relief rally after a remarkable comeback, following massive trading volumes. (Read More...)",50.0,50.0,0.02759397029876709,88.58500000000001,65.625,99.44586753845215,2022-06-21
128,U.Today,"Bitcoin, Ethereum Recover Following Market Rout, but Caution Remains",Bitcoin and Ethereum remain down 35.30% and 41.87% this month (Read More...),50.0,50.0,0.1820772886276245,50.0,58.611111111111114,0.003540515899658203,2022-06-21
129,Crypto Daily,Space Coin Project is Bringing Space Tourism to the Masses through a Decentralized System on Ethereum,"Space exploration sates our curiosity. Humans can authoritatively begin to answer fundamental questions about their origins by traveling to space. What's more? People will have a better understanding of the solar system. However, the inspiration to push the limits of space exploration comes about... (Read More...)",50.0,50.0,99.71292018890381,92.21,72.5,99.71937835216522,2022-06-21
130,The Block,ProShares launches first US ETF to bet on bitcoin’s decline,ProShares is set to launch the first short bitcoin-linked exchange traded fund in the US on Tuesday. (Read More...),50.0,62.5,0.647050142288208,50.0,62.5,11.120754480361938,2022-06-21
131,CoinGape,Crypto Unicorn Babel Finance Moves To Solve Liquidity Crisis,"Crypto lender Babel Finance on Monday said it has signed preliminary agreements with several counterparties on the repayment period of some debts. The preliminary agreements will help ease the company’s short-term liquidity pressure. Moreover, the firm will continue to seek liquidity support from... (Read More...)",24.47,50.0,2.191650867462158,91.8,55.00000000000001,0.27393102645874023,2022-06-21
132,CoinGape,Aave Price Analysis: Reversal From Support Trendline Hints 18% Jump,"For more than two months, the AAVE price has been lowering under the influence of a falling wedge pattern. On June 19th, the altcoin rebounded from the combined support of $50 and support trendline, triggering a new bull cycle within the pattern. Can the upcoming bull run breach the overhead resi... (Read More...)",70.095,50.0,0.034356117248535156,71.075,68.93939393939394,0.004929304122924805,2022-06-21
133,U.Today,Cryptocurrencies Show Up to 35% Gains After Majority of Traders Capitulate,Cryptocurrencies are slowly recovering after worst weekend of trading in industry's history (Read More...),67.0,50.0,5.937862396240234,18.755,36.66666666666667,3.0463427305221558,2022-06-21
134,Decrypt,Tron’s USDD Stablecoin Still Hasn’t Recovered its Dollar Peg,"After almost a week trading below a dollar, Tron’s stablecoin has yet to reclaim parity with the greenback. (Read More...)",50.0,50.0,0.03692805767059326,50.0,75.0,0.029331445693969727,2022-06-21
135,Blockworks,Podcast: The Crypto Renaissance Has Begun | Josh Rosenthal,Josh Rosenthal joins Jason to discuss the parallels between the Renaissance and today's crypto movement. The post Podcast: The Crypto Renaissance Has Begun | Josh Rosenthal appeared first on Blockworks. (Read More...),50.0,50.0,99.8375654220581,50.0,68.75,90.90588092803955,2022-06-21
136,Cryptomode,"Rh!noX Changing the Dynamics of the Metaverse, Gaming, and NFTs","Rh!noX, a project based on digital Rhinos, offers a collection of 10,000 unique NFTs with an eye toward design and numerous utilities. With a unique algorithm and a dose of originality, Rh!noX transcends similar NFT projects without significant utility. Instead, it is challenging the paradigms of... (Read More...)",66.91,50.0,99.96076226234436,57.555,62.361111111111114,94.89725828170776,2022-06-21
137,Crypto Daily,Luxury Brand VERTU Paris Partners with Binance for Launch Of New Smartphone NFT Collection ,"To celebrate the brand's 22nd anniversary, VERTU Paris has unveiled they’ve partnered with Binance to launch the new VERTU Constellation X Ulm smartphone through an exclusive sales process. 1,000 NFTs will be on sale on the Binance NFT platform. The rest of the NFTs will be available for purchase... (Read More...)",50.0,56.81818181818181,99.86866116523743,81.845,67.27272727272727,99.39372837543488,2022-06-21
138,The Daily Hodl,Pro-BTC Commissioner Hester Peirce Slams SEC for ‘Almost Legendary’ Resistance To Spot Bitcoin ETF,"A high-ranking official from the U.S. Securities and Exchange Commission (SEC) is criticizing the regulatory body for its fierce reluctance to approve a spot-based Bitcoin (BTC) exchange-traded fund (ETF). In a new speech, Commissioner Hester Peirce says that the SEC’s consistency in rejecting sp... (Read More...)",50.0,72.5,94.83521580696106,15.46,55.45454545454545,0.16645491123199463,2022-06-21
139,Cryptomode,Visit 1xBit for BTC sports betting right now,"More and more companies offer betting with cryptocurrencies. However, you can’t trust every such brand. Visit 1xBit for BTC sports betting and evaluate all the advantages on your own experience. The company has been on the market for many years. In fact, it started its activities when cryptocurre... (Read More...)",50.0,64.28571428571428,14.45748507976532,85.015,71.66666666666667,3.287029266357422,2022-06-21
140,Trustnodes,DXY Topping?,"The dollar strength index may have double topped after retreating twice from 105, potentially easing pressure on bitcoin and stocks. (Read More...)",50.0,50.0,0.9277313947677612,72.94,58.333333333333336,0.21576881408691406,2022-06-21
141,U.Today,Michael Saylor Urges Regulators to Tame Crypto,"MicroStrategy CEO Michael Saylor is waiting for industry to grow up, claiming that ""wildcat ecosystem"" has to go away (Read More...)",50.0,39.166666666666664,7.67083466053009,50.0,75.0,0.25767087936401367,2022-06-21
142,U.Today,Binance to Temporarily Suspend Tron Deposits and Withdrawals in 3 Days,Binance has announced that it plans to conduct Tron wallet maintenance (Read More...),34.089999999999996,50.0,0.0659257173538208,50.0,75.0,18.932923674583435,2022-06-21
143,Finbold,Russian Ministry of Finance dismisses selling oil for Bitcoin,The use of cryptocurrency as a payment method for international transactions is being considered for small private business contracts in... Continue reading (Read More...),50.0,50.0,0.07005035877227783,50.0,53.125,9.69020128250122,2022-06-21
144,Decrypt,"PlayStation, Google Vets to Co-Create New Franchises Via Solana DAOs","Web3 startup Luda is focused on “create-to-own” experiences through new IP shaped by DAO communities, starting with Neo Fairies. (Read More...)",50.0,56.81818181818181,87.9918783903122,69.08999999999999,60.60606060606061,94.5206344127655,2022-06-21
145,Bitcoin.com,Digital Collectible Downturn — NFT Sales Slid More Than 74% Lower Than the Month Prior,"While digital currencies suffered this past month, non-fungible token (NFT) sales dropped by 74.44% during the last 30 days. Data shows that during the last seven days, NFT sales have slipped 17.33% lower than the sales recorded the week prior. NFT floor values for popular collections have reboun... (Read More...)",32.325,50.0,0.047150254249572754,51.29,56.07142857142857,0.018334388732910156,2022-06-21
146,Decrypt,How Arbitrageurs Are Making Money in the Crypto Crash,"There are a few different strategies helping traders eke out profits during the downturn, from straight forward to atomic arbitrage. (Read More...)",29.905000000000005,50.0,1.5514105558395386,85.92,56.25,83.73990952968597,2022-06-21
147,NullTX,"Bitcoin, Ethereum, XRP, Solana Prices Show Bullish Momentum After Weekend Selloff","As recession fears pushed stock markets and cryptocurrencies to two-year lows last week, things are looking better this Juneteenth, as a federal holiday observes the end of slavery in the United States. Stock markets are closed today, which provides an extra day for cryptocurrencies to show bulli... (Read More...)",50.0,50.0,0.021663308143615723,20.705000000000002,59.0,96.15760445594788,2022-06-21
148,CryptoPotato,"After Coinbase and CryptoCom, Bybit Lays Off Employees Amid Market Pullback","Without disclosing how many, Bybit has confirmed the rumors that it had to lay off a number of its employees. (Read More...)",50.0,50.0,0.03464818000793457,53.86,73.33333333333333,0.33654868602752686,2022-06-21
149,Trustnodes,Gas Falls Below $7,"Gas is finally falling, raising hopes inflation and rate hikes follow too while pressure on stocks and crypto eases. (Read More...)",50.0,50.0,0.029265880584716797,65.91,62.5,0.567135214805603,2022-06-21
150,Bitcoinist,South Korea Blocks Terra’s Employees From Leaving The Country Amid Investigation,"As investigations into Terra’s LUNA and UST death spiral continue, prosecutors in South Korea have imposed travel limits on Terra developers and former devs, according to JTBC News. South Korea Places Travel Ban On Terraform’s Developer The travel ban was announced by the Financial and Securities... (Read More...)",38.685,50.0,0.37193000316619873,4.594999999999999,58.333333333333336,0.38309991359710693,2022-06-21
151,Cointelegraph,Record stablecoin market share points to crypto upside: JPMorgan,"Despite the FUD around stablecoins, the percentage of stablecoins in the total market cap has been growing recently, hitting new all-time highs. (Read More...)",64.8,50.0,95.81133127212524,73.44999999999999,57.95454545454546,98.94644916057587,2022-06-21
152,BeInCrypto,FTX CEO Says Fed Interest Rate Hike Main Reason for Market Crash,FTX CEO Sam Bankman-Fried said the Federal Reserve’s decision to aggressively increase interest rates was the main reason behind the market crash. The post FTX CEO Says Fed Interest Rate Hike Main Reason for Market Crash appeared first on BeInCrypto. (Read More...),53.86,58.333333333333336,0.09182393550872803,57.655,56.833333333333336,0.007361173629760742,2022-06-21
153,Finbold,Chinese messaging app WeChat bans accounts involved in crypto,"After the widely publicized crackdown by the Chinese government on anything that has to do with cryptocurrency, one of China’s... Continue reading (Read More...)",50.0,50.0,0.11372268199920654,50.0,56.666666666666664,22.112244367599487,2022-06-21
154,U.Today,Cardano (ADA) Builders Launch Platform’s First Light Wallet,One-stop shop wallet solution from Cardano finally here (Read More...),50.0,66.25,99.96910095214844,65.91,62.5,98.57565760612488,2022-06-21
155,Coinnounce,California Man Paid a Killer in Bitcoin to kill his Ex-girlfriend,"Bitcoin at the Scene of the Crime As per the news, The California man and his mystery girlfriend met online in 2020 and started dating a few months later. However, the woman soon tried to quit the relationship, stating that Berkett was “sexually aggressive.” The man did everything he could to kee... (Read More...)",6.25,50.0,3.5090982913970947,22.884999999999998,60.0,0.04569292068481445,2022-06-21
156,CoinGape,"Just-In: Tether Defends USDT Reserves, Plans To Undergo Full Audit","Tether’s CTO Paolo Ardoino on Monday said Tether (USDT) has survived short selling and redemptions amid the crypto market crash. Moreover, Paolo Ardoino believes Tether has always been more transparent about its reserves. Tether reserves are validated quarterly by accounting firm MHA. In fact, Te... (Read More...)",50.0,67.5,93.89795064926147,68.06,60.0,0.7518887519836426,2022-06-21
157,Cryptomode,Inholdex Wallet – is it Safe? – Short Review | inholdex.com,"Today we are going to give you a short review of Inholdex Wallet to learn a little bit more about it. A little spoiler: if you haven’t used Inholdex.com yet, we encourage you to check it out because it has one of the highest security scores of any wallet today. We’ve never done paid advertisement... (Read More...)",72.02,62.5,0.9845167398452759,84.53999999999999,56.25,11.213022470474243,2022-06-21
158,CoinTelegraph,South Korean prosecutors ban Terra employees from exiting the country: report,Employees of Terra have reportedly been prohibited to exit South Korea as investigations by the prosecutors continue. (Read More...),22.13,50.0,1.9851058721542358,50.0,75.0,0.9828656911849976,2022-06-21
159,Cryptomode,Digital Arms Partners With AFKDAO To Bring Real-World DeFi Utility To Firearms NFTs,"Sydney, Australia, 20th June, 2022, Chainwire Digital Arms, an NFT trading platform that’s reimaging the world of firearms for gamers and hunters, has announced a key collaboration with AFKDAO that intends to unlock the liquidity value of its unique gaming assets. Digital Arms has established key... (Read More...)",50.0,50.0,99.94595050811768,73.83500000000001,56.25,99.93919432163239,2022-06-21
160,U.Today,"Shiba Inu Now Largest Held Asset After USDC for Ethereum Whales, Price Adds 4%",Number of Shiba Inu holders has seen immense growth in recent months (Read More...),68.06,50.0,99.81227815151215,72.02,58.333333333333336,99.76009130477905,2022-06-21
161,The Block,Bancor DEX pauses impermanent loss protection amid market instability,The Bancor team noted large centralized entities have recently sold large amounts of Bancor tokens. (Read More...),34.089999999999996,50.0,0.9753376245498657,50.0,61.60714285714286,19.219809770584106,2022-06-21
162,Bitcoin.com,"Bitcoin, Ethereum Technical Analysis: BTC Back Above $20,000 as Cryptos Rebound","Following a weekend trading below $20,000, bitcoin rallied by over 10% on Monday to recapture this level. Cryptocurrencies were mainly in the green to start the week, as bulls seemingly bought the weekend’s dip. ETH was almost 15% higher in today’s session. Bitcoin Bitcoin rebounded from recent d... (Read More...)",50.0,50.0,0.49376487731933594,50.0,55.97222222222222,3.80365252494812,2022-06-21
163,Cryptomode,XELS Positions NFT-Based Platform as Future of Corporate Climate Action Disclosure,"Press Release: Corporate climate action disclosure platform Xels uses NFT-based platform to promote a greener, healthier planet. June 20th, 2022, Tokyo, Japan – Eco-technology platform Xels is positioning itself as the future of decentralized climate action disclosure for corporations seeking tra... (Read More...)",50.0,51.66666666666667,76.2262761592865,69.08999999999999,55.833333333333336,87.82771825790405,2022-06-21
164,Crypto Daily,Attention FPS Gamers:  You Can Soon Own and Move Your Kit to Different Games,"Players can spend days, weeks, or even months of in-game time grinding for a skin within a traditional FPS. Now, that time investment can be worth it, few things compare to getting that 0.01% drop chance, or the best skin for your favorite rifle. However, what doesn’t sit quite as well with most ... (Read More...)",50.0,65.0,99.76352155208588,94.27,68.57142857142857,16.76650643348694,2022-06-21
165,Crypto Daily,President Bukele says bitcoin investment will grow immensely - have patience,"El Salvador’s President Bukele is playing down the extremely bearish sentiment for bitcoin and is telling his people to be patient, saying that they should stop worrying and enjoy life. He says that the value of the country’s investment will grow immensely after the bear market. President Nayib B... (Read More...)",50.0,50.0,17.771556973457336,71.075,56.19444444444445,0.9130120277404785,2022-06-21
166,Cryptomode,"Why outsourcing is causing unemployment to fall in the Philippines, according to BruntWork CEO Winston Ong","Tech giant Microsoft stated that 46% of Filipino Millennials are considering taking career shifts this year, and many are considering moving into the highly lucrative BPO/outsourcing market. Microsoft’s 2022 Work Trend Index explained that this trend may be due to evolving views toward the hybrid... (Read More...)",27.98,50.0,0.2709537744522095,50.0,60.35,3.4966975450515747,2022-06-21
167,CoinGape,WeChat To Prohibit NFT Accounts Under New Announced Rules,"China’s largest messaging application, WeChat has come forward to introduce rules to strengthen supervision over non-fungible tokes (NFT). As per reports, the platform has prohibited the NFT related public accounts in order to comply with new rules. WeChat issues new rules WeChat, which has more ... (Read More...)",50.0,56.81818181818181,0.04111826419830322,65.91,60.60606060606061,0.5584567785263062,2022-06-21
168,Trustnodes,Ethereum Longs Spike,Ethereum longs have risen to their highest level since November 2021 as the market starts to think price is at the lower range. (Read More...),50.0,50.0,97.11889922618866,35.199999999999996,75.0,99.68335330486298,2022-06-21
169,CoinGape,"Circle’s USDC Surpasses Tether’s USDT, Here’s How","Circle’s stablecoin USDC has overtaken Tether’s USDT for the first time in the number of daily transactions on Ethereum, Nansen.AI CEO Alex Svanevik highlighted on Twitter. This news is the latest in a series of bad events for Tether. USDT still holds the lead in market value and daily trading vo... (Read More...)",50.0,50.0,98.55028688907623,39.885,54.58333333333334,0.0009655952453613281,2022-06-21
170,Crypto Briefing,Synthetix Surges 70% as Trading Volumes Explode,"The decentralized synthetic asset platform Synthetix led a relief rally in the cryptocurrency market today, surging around 100% from $1.57 to $3.16 before correcting to $2.88. Synthetix Surges on Market... (Read More...)",50.0,50.0,98.8391250371933,84.04,75.0,98.89775216579437,2022-06-21
171,CoinGape,Dogecoin Price Analysis: Range Breakout May Pump DOGE Price by 18%,"The Dogecoin(DOGE) price has been stuck between the $0.05 and $0.063 barriers for a week now. The consolidation may bring a directional rally once it breaks out from either of its extreme levels. Anyhow, the RSI indicator suggests growth in bullish momentum, indicating a better possibility of a $... (Read More...)",50.0,50.0,0.16630887985229492,77.115,64.58333333333334,0.0010073184967041016,2022-06-21
172,Coinnounce,New Blockchain System Developed by Russia to Replace SWIFT,The Rostec Group is a government-owned corporation that owns several technology enterprises in Russia. They’ve revealed that they’ve built a blockchain platform to create a digital system for international transactions that might eventually replace the global Swift system. Due to sanctions by Wes... (Read More...),68.39999999999999,55.90909090909091,99.20278191566467,72.02,53.125,1.313754916191101,2022-06-21
173,CryptoBriefing,Ethereum Outpaces Bitcoin in Crypto Market Rebound,"Ethereum took the lead in the latest cryptocurrency market revival, outperforming Bitcoin. Still, both assets appear to have more room to ascend. Bitcoin and Ethereum Rise The two largest cryptocurrencies... (Read More...)",50.0,50.0,0.37082433700561523,58.894999999999996,75.0,99.16809499263763,2022-06-21
174,Crypto Daily,VERTU Paris announces new smartphone available only through the purchase of an NFT,"Paris, France, 20th June, 2022, ChainwireTo celebrate the brand's 22nd anniversary, VERTU Paris is unveiling the new VERTU Constellation X Ulm™ smartphone through an exclusive sales process. For this occasion, VERTU will set up a unique launch operation on Monday, June 20th. Only 10,555 smartphon... (Read More...)",50.0,58.93939393939394,1.9220322370529175,81.845,58.4280303030303,99.87189769744873,2022-06-21
175,Cryptomode,VERTU Paris announces new smartphone available only through the purchase of an NFT,"Paris, France, 20th June, 2022, Chainwire To celebrate the brand’s 22nd anniversary, VERTU Paris is unveiling the new VERTU Constellation X Ulm™ smartphone through an exclusive sales process. For this occasion, VERTU will set up a unique launch operation on Monday, June 20th. Only 10,555 smartpho... (Read More...)",50.0,58.93939393939394,1.9220322370529175,81.845,58.4280303030303,99.95007812976837,2022-06-21
176,AMBCrypto,Identifying if Tron [TRX] is actually far from falling to its mid-week bottom again,"Tron [TRX] has made its way into the market’s top-15 cryptos, with TRX ranked 13th on the charts. The altcoin managed to ward off market bears on 18 and 19 June, rallying by as much as 32% since its recent low on 15 June. In fact, this was despite the extended sell-off that took place […] (Read More...)",42.345,55.00000000000001,0.33590197563171387,36.34,56.99999999999999,92.82660484313965,2022-06-21
177,Feed - Cryptopotato.Com,"The Largest Investors’ Realized Loss in Bitcoin History Just Happened, But There’s Good News","Investors realized over $7 billion in losses during the weekend's crash, Glassnode said, but there could be good news right around the corner. (Read More...)",74.695,85.0,96.63587808609009,64.23,74.76190476190476,8.602505922317505,2022-06-21
178,Decrypt,Sam Bankman-Fried: FTX Has 'Responsibility' to Step In and Stem Crypto Contagion,The FTX CEO said that the “core driver” of the current crypto recession is the Federal Reserve's tightening fiscal policy. (Read More...),27.060000000000002,50.0,99.95859861373901,28.925,62.5,1.8577873706817627,2022-06-21
179,Cryptomode,"What is USDT (Tether)? How does it work, and what gives USDT value?","Tether is a cryptocurrency that is pegged to the value of fiat currencies. The digital token is issued by Tether Limited, an organization incorporated in the British Virgin Islands (BVIs). It can be stored in any wallet that supports ERC20 tokens. Tether allows users to keep their cryptocurrency ... (Read More...)",70.685,50.0,10.75102984905243,72.94,55.35714285714286,10.595086216926575,2022-06-21
180,CoinGape,"Grayscale Bitcoin Trust (GBTC) Trades At 34% Discount, Should You Buy?","Bitcoin prices have plummeted this year, pulling down the valuations of several equity instruments that track the token. But the Grayscale Bitcoin Trust (GBTC)- an equity instrument that tracks Bitcoin- has fared even worse than the token it is based on. While Bitcoin is down about 55% so far thi... (Read More...)",75.53,50.0,0.03968179225921631,53.86,49.074074074074076,0.0007867813110351562,2022-06-21
181,U.Today,Bitcoin Critic Peter Schiff Says There Are No Signs of Bear Market Bottom Now,"Goldbug Peter Schiff believes that $20,000 is new $30K for Bitcoin (Read More...)",24.47,50.0,3.598335385322571,50.0,65.9090909090909,0.6759583950042725,2022-06-21
182,Blockworks,Solana Lending Protocol Faces Governance Conundrum,"Solend, a Solana-based lending protocol, may implement special margin requirements for one user The post Solana Lending Protocol Faces Governance Conundrum appeared first on Blockworks. (Read More...)",50.0,50.0,1.2775629758834839,70.095,68.45238095238095,4.870840907096863,2022-06-21
183,Finbold,Key levels to watch for Bitcoin’s bullish continuation; Here’s what to expect next,"After Bitcoin (BTC) plunged below the crucial $20,000 level, the market is focused on the cryptocurrency’s next price movement, with... Continue reading (Read More...)",50.0,50.0,99.55275654792786,69.08999999999999,58.333333333333336,3.450608253479004,2022-06-21
184,The Block,Forgotten Runes Wizard’s Cult launches ‘create-to-earn’ metaverse demo,Metaverse game developer and publisher Bisonic launched the first playable demo of its Forgotten Runiverse on Monday. (Read More...),38.685,50.0,99.35884177684784,44.865,55.833333333333336,0.44655799865722656,2022-06-21
185,The Block,"Metaverse building company LandVault, gaming advertiser Admix announce merger","According to a statement from the company, the new entity has been valued at $300 million. (Read More...)",50.0,50.0,75.55979192256927,72.02,65.9090909090909,96.0084468126297,2022-06-21
186,The Block,NFT.NYC organizers talk NFT adoption as conference gets under way,"In this episode of The Scoop, NFT.NYC conference founders Jodee Rich and Cameron Bale discuss details of the upcoming conference, its origins, and analyze the boom and cultural adoption that NFTs have witnessed over the last few years. (Read More...)",50.0,50.0,95.99715173244476,81.845,57.75,87.90025115013123,2022-06-21
187,crypto.news,Layer 1 Blockchain Minima Chosen to Partner with MobilityXlab to Foster Innovative Mobility Solutions,Decentralized blockchain protocol Minima today announced that it is one of the eleven global start-ups chosen by MobilityXlab to create innovative mobility solutions with industry leaders in Vehicle and mobile communication. MobilityXlab Chooses Minima to Create Innovative Mobility Solutions For… (Read More...),77.86999999999999,75.0,92.81328022480011,94.30000000000001,68.75,98.97678196430206,2022-06-21
188,crypto.news,Crypto Gibraltar Festival to Take Place From 22nd to 24th September 2022,"Crypto Gibraltar 2021 was the first major crypto event following the pandemic and delivered a fantastic combination of informative discussions, productive networking and banging parties. Amazingly, it’s time to do it all again only bigger and even better! Crypto Gibraltar… (Read More...)",74.695,50.0,98.29918444156647,92.94,63.541666666666664,99.93046522140503,2022-06-21
189,crypto.news,AMAZY App Creates International Fitness Project for Crypto Enthusiasts,"NFTs are hugely popular. Every week, if not every day, many new NFT projects appear. It is therefore difficult to know which NFTs are the best to invest in. Many have already heard about a new project called AMAZY, which… (Read More...)",84.04,50.0,99.84762668609619,84.985,67.95454545454545,94.87259089946747,2022-06-21
190,crypto.news,Digital Wealth Pioneer Yield App Unveils Mobile App for Ios and Android,"Yield App, a global FinTech company and digital wealth platform which has attracted more than 80,000 customers since its launch in February 2021, is now taking on the mobile world with the launch of its iOS and Android app, as… (Read More...)",74.695,50.0,99.40034747123718,85.92,62.5,98.70589673519135,2022-06-21
