,source,title,excerpt,vader_sentiment_title,tb_sentiment_title,flair_sentiment_title,vader_sentiment_excerpt,tb_sentiment_excerpt,flair_sentiment_excerpt,date
65,Bitcoinist,Bitcoin Hashrate Plateaus After Slow And Steady Climb,"Data shows the Bitcoin mining hashrate seems to have hit a plateau since the beginning of March, after observing a steady rise for many months. Bitcoin Mining Hashrate Has Mostly Moved Sideways In The Past Month According to the latest weekly report from Arcane Research, the BTC hashrate has brok... (Read More...)",50.0,46.666666666666664,0.5251914262771606,50.0,65.97222222222221,0.0010728836059570312,2022-04-20
66,Cryptomode,Rainmaker Games Launches The First Blockchain Gaming Discovery Platform,"Austin, US, 19th April, 2022, Chainwire Rainmaker Games launches the first discovery platform for blockchain games, providing a much-needed single-source of gaming data the industry was missing. Rainmaker’s beta platform includes over 150 blockchain games, expert reviews, technical details, earni... (Read More...)",50.0,62.5,99.73631799221039,35.199999999999996,56.875,99.56756234169006,2022-04-20
67,crypto.news,WazirX Founders Relocate to Dubai Amid Harsh Crypto Regulations in India,"Co-founders of Indian cryptocurrency exchange WazirX, Nischal Shetty and Siddharth Menon, have reportedly moved to Dubai, as regulatory uncertainties in India continue to stifle the country’s cryptocurrency industry. Nischal Shetty and Siddharth Menon Reportedly Move to Dubai According to a… (Read More...)",27.98,40.0,0.9150564670562744,32.99999999999999,75.0,0.1988053321838379,2022-04-20
68,BeInCrypto,Australia’s Largest Bank Falls Victim to Crypto News Scam,The largest lender in Australia has warned that a story claiming that it has partnered with a cryptocurrency trading platform is false. The post Australia’s Largest Bank Falls Victim to Crypto News Scam appeared first on BeInCrypto. (Read More...),14.984999999999998,46.25,0.030601024627685547,10.775000000000002,53.43750000000001,0.01570582389831543,2022-04-20
69,Coinnounce,"US-Based Trading App Robinhood Acquired Ziglu, Aims to Expand Globally","On Tuesday, Robinhood announced its new acquisition Ziglu and it is subject to regulatory approvals and various other closing conditions. The company, however, didn’t disclose the terms of the acquisition. A spokesperson for Robinhood mentioned, “Even though we have acquired Ziglu, nothing will c... (Read More...)",65.91,50.0,78.18352580070496,50.0,53.446969696969695,0.003999471664428711,2022-04-20
70,CryptoPotato,"Framework Ventures Raises $400M to Fund Blockchain Gaming, Web 3, and Defi","The firm expects blockchain gaming to take off this year, despite struggles to compete with the mainstream market until now. (Read More...)",50.0,50.0,76.67758464813232,63.775000000000006,57.49999999999999,4.545658826828003,2022-04-20
71,CoinDesk,DeFi Developer Andre Cronje Teases New Regulation-Focused Crypto Projects,The mercurial “Godfather of DeFi” is now pivoting to compliant crypto after abruptly quitting decentralized finance in early March. (Read More...),35.199999999999996,56.81818181818181,19.595596194267273,50.0,57.91666666666666,4.772499203681946,2022-04-20
72,The Daily Hodl,Crypto Analyst Who Nailed 2018 Bitcoin Bottom Predicts Swift Bounce for BTC – But There’s a Catch,"The widely tracked crypto strategist who accurately predicted the Bitcoin (BTC) bear market lows in 2018 says that a strong BTC bounce is in sight. Pseudonymous analyst Smart Contracter tells his 207,200 Twitter followers that Bitcoin is in the midst of a five-wave downtrend in the lower timefram... (Read More...)",55.135,50.0,76.35505497455597,72.94,64.47619047619048,12.371227145195007,2022-04-20
73,CoinDesk,Bitcoin Price Rises for Second Day on Hopes for Soft Landing,The largest cryptocurrency continues to rebound from a five-week low. (Read More...),71.075,52.5,0.075531005859375,36.34,62.5,0.09832680225372314,2022-04-20
74,The Daily Hodl,Institutional Investors Turn Cautious As Crypto Markets See Second Straight Week of Capital Outflows: CoinShares,"According to a leading crypto asset manager, institutional investments in digital asset products have been declining for the second week in a row, suggesting investors are getting cautious. In the latest edition of the Digital Asset Fund Flows Weekly report, CoinShares finds that crypto investmen... (Read More...)",56.400000000000006,55.00000000000001,0.018656253814697266,86.345,60.0,0.004601478576660156,2022-04-20
75,Ethereum World News,Robinhood Acquires London-based Digital Assets Firm Ziglu For European Expansion,Robinhood acquires UK digital currency company Ziglu as part of European expansion efforts shortly after listing Shiba Inu and 3 other crypto tokens. (Read More...),58.894999999999996,46.666666666666664,90.6037449836731,50.0,53.75,91.58838987350464,2022-04-20
76,CryptoPotato,"FBI, US Treasury Department Warn About North Korean-Backed Crypto Hackers",North Korean-sponsored hackers steal crypto assets from US exchanges and firms to support Kim Jong-un’s dictatorship regime. (Read More...),55.135,50.0,0.686866044998169,52.580000000000005,75.0,0.16832053661346436,2022-04-20
77,Ethereum World News,Leaked Report Allegedly Shows How Much Twitter Influencers are Getting Paid to Shill Crypto Projects,Quick take: A spreadsheet has been shared on Twitter allegedly showing how much Twitter influencers get paid to shill crypto projects Twitter influencers with higher followers are paid more to shill a tweet and retweet Shilling of crypto projects has been around for several years Celebrities have... (Read More...),34.089999999999996,52.5,0.04418790340423584,67.0,62.023809523809526,0.11950135231018066,2022-04-20
78,The Block,Talent agency UTA to represent NFT project DeadFellaz,"UTA will help Deadfellaz broaden its opportunities in gaming, live events, merchandising and partnerships. (Read More...)",71.075,50.0,99.15251433849335,82.43,65.9090909090909,98.98317158222198,2022-04-20
79,The Daily Hodl,"Ethereum-Based Payments Altcoin Explodes 126% in Matter of Days As Bitcoin Breaks Above $41,000","An Ethereum-based altcoin project designed to bring crypto payments to the mainstream is soaring after announcing a new milestone. The Metal Pay wallet app allows people to buy, sell and trade cryptocurrencies as well as send capital to acquaintances. The project’s central crypto asset, Metal (MT... (Read More...)",51.29,50.0,0.02008378505706787,74.695,60.60606060606061,20.061108469963074,2022-04-20
80,CoinGape,NEAR Price Prediction: Range Breakout Eyes NEAR Price Above $20.6 mark,"Over the last few weeks, the Near protocol(NEAR) price has impressively endured the broader market correction. As a result, the price hibernated under an accumulation range between the $15 and $17.69 marks. However, the recent increase in bullish momentum projects a possibility of the trend surpa... (Read More...)",50.0,53.333333333333336,2.8766632080078125,82.43,61.66666666666667,0.3863006830215454,2022-04-20
81,Bitcoinist,"Danger In The Crypto Space, U.S. Warn Of Surge In Attacks By North Korean Sponsored Hackers","Several U.S. federal agencies issued a joint warning about an increase in crypto-related hackings. Posted as an alert by the Cybersecurity and Infrastructure Security Agency (CISA), the Federal Bureau of Investigation (FBI), and the Treasury Department. Related Reading | Could Musk Fix This? Blue... (Read More...)",11.414999999999997,50.0,9.181573987007141,82.43,56.25,0.0021338462829589844,2022-04-20
82,CryptoSlate,Germany world’s most crypto-friendly country but averse to DeFi,"Germany moved up three places on an annual basis and took the top spot as the most crypto-friendly country in the world, according to Coincub’s most recent quarterly report. However, the country is not open to decentralized finance (DeFi). (Read More...)",50.0,75.0,0.8886486291885376,60.114999999999995,66.66666666666666,79.9403965473175,2022-04-20
83,Cryptomode,Radio Caca (RACA) Announces Updates for Play-To-Earn Metaverse Game Metamon,"Radio Caca (RACA) has announced updates to its play-to-earn game, Metamon. Several updates introduce many new game mechanics. Players will be able to form their squads and participate in group battles and other unique features such as training and earning achievements. Valhalla Points At the Hall... (Read More...)",50.0,30.0,2.181309461593628,30.910000000000004,55.43181818181818,99.92620050907135,2022-04-20
84,BeInCrypto,Binance Coin (BNB) Trading Volume Falls More than $64 Billion,Binance Coin (BNB) recorded a first quarterly volume in 2022 that was $64 billion less than the trading volume recorded in Q1 of 2021. The post Binance Coin (BNB) Trading Volume Falls More than $64 Billion appeared first on BeInCrypto. (Read More...),50.0,75.0,0.006318092346191406,50.0,63.33333333333333,0.0037670135498046875,2022-04-20
85,Decrypt,Framework Ventures to Invest Half of New $400 Million Fund in Blockchain Gaming,"The San Francisco-based firm, which now manages $1.4 billion in assets, also plans to continue investing in DeFi and Web3. (Read More...)",50.0,49.24242424242424,4.253718256950378,58.894999999999996,57.49999999999999,1.089218258857727,2022-04-20
86,NullTX,Is ETH worth investing in?,"Ethereum is a decentralized, open-source technology that powers much of the crypto-verse. Everything from DeFi applications and NFTs to enterprise solutions rely on Ethereum’s technology. While early cryptocurrencies, especially Bitcoin, mainly acted as globally transferable stores of value, Ethe... (Read More...)",61.315,65.0,97.83723950386047,73.83500000000001,58.05555555555556,99.9908834695816,2022-04-20
87,CryptoBriefing,Framework Ventures Announces $400M Web3 Fund,(Read More...),50.0,50.0,81.82693123817444,50.0,75.0,96.50535881519318,2022-04-20
88,NullTX,DeFi Insurance Platform Uno Re Launches Cover Portal,"Uno Re, a decentralized insurance platform, launched its Cover Portal on April 21st, 2022. Accessible through Uno Re’s dApp, the Cover Portal addresses an underemphasized need in DeFi space: easy access to insurance. For the first time, DeFi users can insure their crypto-assets in a few simple st... (Read More...)",50.0,50.0,14.379796385765076,76.335,59.70238095238095,99.35043752193451,2022-04-20
89,Bitcoin.com,Australia to List Bitcoin ETF After 4 Clearinghouse Participants Commit to Meet Stringent Margin Terms,"Australia is set to get its first bitcoin exchange-traded fund (ETF) after a report suggested the country’s clearinghouse, ASX Clear, confirmed that four market participants agreed to meet its stringent margin requirements. ASX Clear’s Margin Requirements An Australian clearinghouse controlling a... (Read More...)",64.8,50.0,8.097493648529053,78.595,61.25000000000001,95.8962231874466,2022-04-20
90,CoinDesk,Bitcoin Stabilizes Above $40K; Resistance at $43K-$46K,"Bitcoin (BTC) is back above $40K, albeit within a wide trading range. The cryptocurrency could face initial resistance at $43K, which could stall the current upswing in price. (Read More...)",50.0,50.0,4.705831408500671,39.885,53.333333333333336,0.039967894554138184,2022-04-20
91,Trustnodes,Crypto SPAC Raises $100 Million,"One of the first crypto focused special purpose acquisition company (SPAC), has raised $115 million in an Initial Public Offering (IPO). Aura FAT Projects Acquisition Corp. debuted on Nasdaq under... (Read More...)",50.0,50.0,20.260390639305115,82.43,61.07142857142858,99.44438636302948,2022-04-20
92,Bitcoin Magazine,IMF Publishes Global Financial Stability Report Discussing Bitcoin,"The International Monetary Fund published a report detailing how Bitcoin disrupts the world order, enables sovereignty amid sanctions, and demands regulatory action. (Read More...)",50.0,50.0,24.812662601470947,50.0,60.0,0.5582541227340698,2022-04-20
93,CoinDesk,‘Great Time to Be a Bitcoin Banker’: Silvergate CEO Alan Lane,Silvergate Capital on Tuesday reported better-than-expected Q1 earnings this morning and shares are up nearly 12%. (Read More...),50.0,90.0,99.85017478466034,64.8,65.0,87.0339184999466,2022-04-20
94,Decrypt,How DAOs Have Evolved—And What’s Next,Decentralized autonomous organizations are changing how we collaborate—but to realize their potential they need to become easier to set up and use. (Read More...),50.0,50.0,99.6315062046051,71.075,65.0,94.96941864490509,2022-04-20
95,CoinDesk,Crypto Funds See Outflows as Bitcoin Gets More 'Interest-Rate Sensitive',Some $97 million flowed out of digital asset funds in the week through April 15 as investors adjusted to a hawkish Fed discussion on shrinking the central bank's balance sheet. (Read More...),50.0,65.0,0.2626687288284302,68.06,58.333333333333336,0.1699894666671753,2022-04-20
96,The Block,Binance.US obtains money transmitter license in Puerto Rico,"The Puerto Rico Office of the Commissioner of Financial Institutions has granted Binance.US a money transmitter license, the company announced on April 19. (Read More...)",50.0,50.0,0.6637632846832275,62.5,62.5,0.01704692840576172,2022-04-20
97,CoinDesk,EU Crypto Firms Protest ‘Alarming’ Anti-Money Laundering Laws,European industry is joining forces as it seeks to limit the impact of new proposals to cut the privacy of online payments and regulate stablecoins. (Read More...),37.5,45.0,1.4492243528366089,36.34,60.60606060606061,92.07473695278168,2022-04-20
98,Bitcoin.com,Bittrex Global’s IEO Platform Starting Block Gears up for YellowHeart Debut,"PRESS RELEASE. Bittrex Global, a leading digital asset exchange, welcomes the YellowHeart Protocol, an NFT platform poised to disrupt the ticketing and music industries, to its Initial Exchange Offering (IEO) platform, Bittrex Global Starting Block. By using blockchain technologies, the YellowHea... (Read More...)",27.98,50.0,99.7352808713913,75.53,54.166666666666664,11.717361211776733,2022-04-20
99,Bitcoinist,"Terra Becomes A Top 10 Contender After Beating Cardano, Avalanche",Terra (LUNA) might not be new to the crypto space but its recent rise to the top has no doubt taken the market by surprise. Not only has this growth seen the value of its token soar but it has also put its market cap on an accelerated growth rate. This has propelled it to […] (Read More...),41.105000000000004,75.0,99.95444416999817,93.6,61.36363636363637,99.95873272418976,2022-04-20
100,CryptoPotato,"Indian Crypto Exchange CoinDCX Raises $135 Million, Valuation Reaches $2.15 Billion","The company plans to spend the money on new product offerings, hiring, and compliance issues. (Read More...)",52.580000000000005,50.0,24.94971454143524,50.0,65.9090909090909,0.0030815601348876953,2022-04-20
101,crypto.news,"Top 7 Altcoins in DeFi, Crypto Gaming, NFTs, and the Metaverse","As of mid-April 2022, the cryptocurrency market was north of $1.8 trillion. Bitcoin still retains the lead being the first crypto project. However, crypto and blockchain have been increasing in sophistication over the years. With smart contracting and the expansion… (Read More...)",60.114999999999995,75.0,99.97234642505646,70.095,66.07142857142857,99.60687458515167,2022-04-20
102,BeInCrypto,Coffeezilla Drops 20 Plus Allegations On SafeMoon’s ‘Billion Dollar Fraud’,"Coffeezilla has fired a laundry list of allegations at SafeMoon and its founders, alleging SafeMoon founders siphoned off tokens. The post Coffeezilla Drops 20 Plus Allegations On SafeMoon’s ‘Billion Dollar Fraud’ appeared first on BeInCrypto. (Read More...)",50.0,50.0,0.12734830379486084,22.13,68.75,0.004470348358154297,2022-04-20
103,crypto.news,FLUID (FLD) Taps Polygon for Speed and Ultra-Low Transaction Fees,"FLUID (FLD) has announced its adoption of Polygon (MATIC) as its primary decentralized finance (DeFi) network to enable it to offer its users cost-efficient and superfast transactions. Polygon is now home to more than 7,000 decentralized applications (dApps) and counting.… (Read More...)",50.0,50.0,99.9850332736969,50.0,67.5,99.93612468242645,2022-04-20
104,crypto.news,$135M Series D Funding Pushes CoinDCX to $2.15B Valuation,"Indian cryptocurrency exchange CoinDCX’s latest funding comes as investors reaffirm their belief in India’s ability to become the world’s leading cryptocurrency market despite official disinterest. CoinDCX Raises $135M in Latest Series D Funding CoinDCX, an Indian cryptocurrency exchange, has rai... (Read More...)",50.0,50.0,11.071151494979858,65.91,75.0,98.59156608581543,2022-04-20
105,Cointelegraph,Silvergate Bank revenue soar in Q1 as institutional crypto trading activity falls,The bank facilitated $142 billion worth of transfers between crypto exchanges and financial institutions in Q1. (Read More...),50.0,50.0,1.0825902223587036,61.315,63.33333333333333,98.07198643684387,2022-04-20
106,The Daily Hodl,"Bitcoin (BTC) Net Outflows Hit $500,000,000 Last Week Amid Eager Investor Accumulation: IntoTheBlock","Crypto analytics platform IntoTheBlock says that Bitcoin (BTC) is potentially experiencing significant levels of accumulation amid price dips. In a new report, IntoTheBlock says that it is following Bitcoin’s exchanges netflows metric, tracking the total outflows of BTC from crypto exchanges minu... (Read More...)",68.06,50.0,0.04270672798156738,60.114999999999995,58.4280303030303,0.048154592514038086,2022-04-20
107,CryptoBriefing,"Cosmos, Elrond Prepare to Bounce",(Read More...),50.0,50.0,99.97174441814423,50.0,75.0,96.50535881519318,2022-04-20
108,CoinGape,Decentraland Price prediction: MANA Price Seeks 20% Jump Amid Bullish Formation,MANA price undergoes a downward trend as the bulls face rejection near swing highs. The ADA buyers failed to hold on to gains causing headwinds that weigh on any positive bullish sentiment. MANA price extends the gains for the second session in a row on Tuesday. A ‘hammer’ formation on the daily ... (Read More...),50.0,50.0,0.1307159662246704,63.660000000000004,52.72727272727272,0.004881620407104492,2022-04-20
109,CryptoSlate,Zachxbt’s investigation of Project Shura’s $1.7M rug pull leads to public wallet,Onchain detective Zachxbt has revealed details about another NFT rug pull involving Project Shura. (Read More...),50.0,50.0,2.239513397216797,50.0,75.0,96.6378390789032,2022-04-20
110,Coinnounce,Dollar Breaks Multi-Year Bearish Trendline While Bitcoin Struggles to Maintain $40K,"Crypto investors worldwide are fighting cut-throat inflation, geopolitical crisis, and the new monetary policies formed by the Federal Reserve. The Fed’s meeting, which was held last week, showed a new plan to combat the growing inflation by shrinking its balance sheet to $95 billion each month. ... (Read More...)",31.94,50.0,0.025469064712524414,9.629999999999999,59.65909090909091,0.43300092220306396,2022-04-20
111,Cointelegraph,"Solana's STEPN hits record high as GMT price skyrockets 34,000% in over a month",Strong hype around move-to-earn tokens could offset the bearish technicals emerging for GMT. (Read More...),50.0,57.99999999999999,5.716174840927124,75.53,73.33333333333334,21.199029684066772,2022-04-20
112,CryptoGlobe,$SHIB: You Can Now Pay for a Porsche With Cryptocurrency Shiba Inu,"On Tuesday (April 19), it was announced that Porsche Towson now accepts highly popular meme-based cryptocurrency Shiba Inu ($SHIB) as a means of payment. Porsche Towson is a Porsche dealer in Towson, Maryland, United States that sells both brand new and pre-owned Porsche cars. Here is an example ... (Read More...)",44.865,50.0,0.8313983678817749,90.08,70.60606060606061,92.67879724502563,2022-04-20
113,U.Today,"1.17 Trillion SHIB Whale Buys $4 Million in APE, $1.5 Million in SAND",Large Ethereum investor who has been buying a lot of SHIB recently has laid his hands on substantial amounts of ApeCoin and SAND (Read More...),50.0,50.0,0.12797117233276367,60.114999999999995,61.904761904761905,14.034804701805115,2022-04-20
114,CryptoGlobe,"Cardano ($ADA) Network Adds 100,000 Wallets in a Month Amid ERC-20 Converter Tool Launch","The Cardano ($ADA) network has added around 100,000 new wallets in roughly a month at the time of the launch of its ERC-20 converter tool, which allows Ethereum tokens to be run on the Cardano blockchain. As first reported by Finbold, Cardano blockchain insights shared on Google’s Data Studio by ... (Read More...)",50.0,50.0,77.8227150440216,67.0,59.82954545454545,99.00246858596802,2022-04-20
115,Cryptomode,Bitcoin DeFi Continues To Grow But Not On The BTC Network,"It is a well-known fact that most people will not look at bitcoin for DeFi purposes. The network has a few DeFi solutions, although its TVL remains minimal compared to other networks. Even so, there are a few good opportunities to earn yield with BTC and without dealing with custodians. Bitcoin D... (Read More...)",50.0,50.0,0.2926051616668701,86.75500000000001,57.67857142857142,99.37486052513123,2022-04-20
116,Blockworks,Crypto Exchange Uniswap Hit With Class Action Lawsuit Alleging Wrongdoing,"Developers can embed a Uniswap trading window in any app with one line of code, while a class action lawsuit alleges the exchange promotes unregistered securities The post Crypto Exchange Uniswap Hit With Class Action Lawsuit Alleging Wrongdoing appeared first on Blockworks. (Read More...)",38.685,55.00000000000001,0.24401545524597168,60.114999999999995,61.875,0.0073909759521484375,2022-04-20
117,The Daily Hodl,"Ahead of Kentucky Derby, Game of Silks Secures $2 Million in Funding To Bring the Thoroughbred Horse Racing Industry to the Metaverse","April 19, 2022 – Boca Raton, Florida Game of Silks (Silks), the first derivative play-to-earn metaverse that mirrors the real world of thoroughbred horse racing, today announced that it has raised $2 million in funding and plans to secure substantial additional funding in the following months thr... (Read More...)",65.91,30.0,99.62372481822968,74.695,57.91666666666666,80.6561529636383,2022-04-20
118,Cointelegraph,Cointelegraph’s experts reveal their crypto portfolios | Watch now on The Market Report,"On this week’s episode of “The Market Report,” Cointelegraph’s resident experts reveal their personal portfolios. (Read More...)",50.0,50.0,16.856101155281067,50.0,62.5,8.794748783111572,2022-04-20
119,Crypto Daily,Nestle Launches NFTs,"The food and beverages giant has introduced an exclusive limited series of only two NFTs available for bidding, with 100% of the proceeds going to charity. First Cereal NFTs It is not uncommon to find a physical collectible in a cereal box. However, this will be the first time a digital collectib... (Read More...)",50.0,50.0,23.369652032852173,67.0,51.94805194805194,1.604500412940979,2022-04-20
120,The Block,Hut 8 reveals plan to become fully focused on in-house mining after deal to buy ASICs,Crypto miner Hut 8 closed a deal to buy all ASIC machines from its hosting client TAAL. (Read More...),71.955,50.0,99.66380596160889,50.0,60.0,0.5662500858306885,2022-04-20
121,ZyCrypto,Dogecoin Offline Transactions Via Elon Musk’s Starlink Could Be The Next Big Thing For DOGE,The Dogecoin Foundation is working towards utilizing Elon Musk's Starlink satellites to conduct DOGE's offline transactions. (Read More...),43.6,50.0,0.5514860153198242,43.6,75.0,89.90038633346558,2022-04-20
122,U.Today,Beer Giant Anheuser-Busch Joins Metaverse Bandwagon,"Beer Giant Anheuser-Busch wants to launch its own ""Budverse"" (Read More...)",50.0,50.0,0.08882582187652588,50.0,66.25,4.414606094360352,2022-04-20
123,CoinTelegraph,Half of assessed jurisdictions don't have 'adequate laws and regulatory structures' — FATF,The organization reported that only 9% of countries were “substantially effective” in areas including having banks and VASPs verify users’ information. (Read More...),41.525,54.166666666666664,0.5535274744033813,50.0,68.33333333333333,0.21289288997650146,2022-04-20
124,Protos.com,Ireland to ban election crypto donations amid Russian meddling fears,The proposed new measures are intended to block foreign meddling in Ireland's political funding and will be guided by a soon-to-be-established Electoral Commission. (Read More...),12.469999999999997,50.0,0.060051679611206055,27.98,56.39204545454546,1.2854516506195068,2022-04-20
125,Bitcoin.com,"Fed’s Bullard Wants to Raise Bank Rate to 3.5% by Year’s End, Hints at 75 Basis Point Rate Hike","The 12th president of the Federal Reserve Bank of St. Louis, James Bullard, thinks the U.S. central bank can increase the benchmark bank interest rate by 75 basis points this year. Bullard believes the Fed could raise rates to 3.5% by the fourth quarter of 2022 to combat the red hot inflation pla... (Read More...)",50.0,60.0,0.04023611545562744,72.02,57.49999999999999,0.22670626640319824,2022-04-20
126,BeInCrypto,Cannabis Company Fund Turns to Crypto to Raise Capital,A cannabis company fund is raising capital through the issuance of security tokens rather than a traditional offering of shares. The post Cannabis Company Fund Turns to Crypto to Raise Capital appeared first on BeInCrypto. (Read More...),50.0,50.0,0.013145804405212402,77.86999999999999,62.5,0.0031948089599609375,2022-04-20
127,Crypto Daily,BTC/USD Dominated by Key Technical Levels: Sally Ho's Technical Analysis 20 April 2022 BTC,Bitcoin (BTC/USD) continued to experience trading activity dominated by technical levels early in the Asian session as the pair sought fresh technical sentiment to see if it could break free from its ongoing orbit around the psychologically-important 40000 figure. Recent selling pressure below so... (Read More...),50.0,50.0,21.4485764503479,76.335,58.12500000000001,0.34885406494140625,2022-04-20
