,source,title,excerpt,vader_sentiment_title,tb_sentiment_title,flair_sentiment_title,vader_sentiment_excerpt,tb_sentiment_excerpt,flair_sentiment_excerpt,date
0,Decrypt,NBA Announces 'Dynamic' Ethereum NFTs for Playoffs,"The 18,000 NBA NFTs have traits that will change based on athlete performance. (Read More...)",50.0,50.0,99.71108138561249,50.0,75.0,97.0460295677185,2022-04-20
1,CryptoGlobe,Axie Infinity: What Are the Minimum Android Phone Requirements to Play on Mobile,"The popular Ethereum-powered monster-battle and non-fungible token (NFT) based game Axie Infinity took the world by storm late last year by allowing players to earn tokens for playing. As it has official mobile applications, many wonder what are the minimum phone requirements to play. Sky Mavis, ... (Read More...)",67.0,50.0,97.93801605701447,85.92,57.49999999999999,83.83889496326447,2022-04-20
2,Bitcoin Magazine,Bitcoin Is The Modern Monetary Defense Protocol,Bitcoin is a contender to replace inferior monetary defensive protocols in order to maximize the protection of individual rights. (Read More...),56.400000000000006,60.0,3.4409940242767334,36.34,62.5,83.85811448097229,2022-04-20
3,CryptoPotato,Japan’s Central Bank Will Test Digital Yen Cautiously,"The Bank of Japan will explore the digital Yen cautiously, preferring Sweden's approach over China's quick expansion of experiments. (Read More...)",50.0,50.0,1.3945966958999634,50.0,63.888888888888886,0.19393861293792725,2022-04-20
4,crypto.news,StreamCoin (STRM) Listing: 100+ Exchanges Starting From May,"After nearly three months of a public sale full of progress and new announcements, StreamCoin is about to cap off its ICO with a colossal 100+ exchanges listing for its STRM token. Starting from the first week of May, the… (Read More...)",50.0,50.0,99.94398057460785,71.075,60.22727272727273,0.8852243423461914,2022-04-20
5,crypto.news,"Sandbox Sets $4 Billion Valuation, Seeking to Raise $400 million","According to sources privy to the matter, Metaverse startup Sandbox is on the verge of starting a fresh round of raising capital at a valuation of $4B. The company aims to raise approximately $400 million, targeting both existing and new… (Read More...)",50.0,50.0,6.842502951622009,67.0,52.0,10.485619306564331,2022-04-20
6,crypto.news,"CoolMining NFT Marketplace, the World’s First BTC NFT Mining On-Chain Game, Is Now Live","CoolMining, the world’s first on-chain simulation game that is built upon real-life hash power and the world’s only GameFi that rewards players with actual BTCs, announces that its NFT marketplace has gone live. CoolMing’s hashrate and governance token CoolHash (COOHA)… (Read More...)",50.0,49.77272727272727,98.98220896720886,73.83500000000001,54.053030303030305,99.71008598804474,2022-04-20
7,CoinDesk,First Mover Asia: Is Germany Really the Most Crypto-Friendly Jurisdiction? Maybe Not: Bitcoin Gains,German flag (Getty Images) (Read More...),37.08,65.83333333333333,80.59724867343903,50.0,62.5,1.798674464225769,2022-04-20
8,Bitcoin.com,"Robinhood Begins European Expansion, Acquiring Regulated UK-Based Crypto Firm Ziglu","Nasdaq-listed trading platform Robinhood is acquiring Ziglu, a London-based electronic money institution and crypto asset firm. The acquisition is part of Robinhood’s international expansion plan. Robinhood “sees a big opportunity in serving customers across the globe.” Robinhood Acquiring Regula... (Read More...)",50.0,45.0,22.63108193874359,82.43,53.75,81.785187125206,2022-04-20
9,Forbes,"‘Single Dumbest Thing They Could Do’—‘SPAC King’ Issues Stark Visa And Mastercard Crypto Warning As The Price Of Bitcoin, Ethereum, BNB, XRP, Solana And Cardano Surge","Chamath Palihapitiya, a former Facebook executive who runs the venture capital fund Social Capital, has warned there's ""a swarm of activity [coming] to dismantle"" Visa and Mastercard... (Read More...)",15.46,43.214285714285715,0.00565648078918457,36.34,58.88888888888889,0.005322694778442383,2022-04-20
10,BeInCrypto,Real Estate: Purchases in Spain Soar Amidst Macroeconomic Uncertainty,"Real estate: In Spain, the real estate market has been booming since November 2021. It grew 400% as the stock market falters under pressure from the pandemic, inflation, and Russia's invasion of Ukraine. The post Real Estate: Purchases in Spain Soar Amidst Macroeconomic Uncertainty appeared first... (Read More...)",32.99999999999999,60.0,99.50370788574219,22.13,63.5,95.88423371315002,2022-04-20
11,Bitcoinist,Inside The Ethereum Foundation Treasury: What Does It Hold?,"The Ethereum Foundation has been around for a while and is in charge of funds that get distributed to projects on the Ethereum network. In its treasury, there is a large amount of ETH among other crypto investments that help to fund projects. Recently, the Ethereum Foundation released a report th... (Read More...)",60.114999999999995,50.0,9.199318289756775,77.115,57.36607142857143,97.79193699359894,2022-04-20
12,Bitcoin.com,Gensokishi Online Project Announces Decision to List MV Token on KuCoin and Campaign,"PRESS RELEASE. GensoKishi are excited to announce that $MV ( MV(Polygon)/USDT trading pair) will list on KuCoin at 2022-04-20 18:00 (UTC), a leading cryptocurrency exchange in the world. GensoKishi are going to have various campaigns to celebrate the trading pair listing. Know more details. Pleas... (Read More...)",50.0,50.0,2.8648316860198975,86.345,67.1875,91.48563146591187,2022-04-20
13,crypto.news,"North Korean Hacking Groups Now Targeting Crypto Platforms, US Government Warns","The United States government through the Federal Bureau of Investigation (FBI), the Cybersecurity and Infrastructure Security Agency (CISA), and the United States Treasury, on April 18, 2022, have advised cryptocurrency companies based in the U.S. to beef up their security… (Read More...)",44.865,50.0,0.10530650615692139,91.58,75.0,0.1367807388305664,2022-04-20
14,crypto.news,MetaMask Advises Against Automatic iCloud Backups of Wallet Data to Prevent Hacks,"Sunday, 17th, Metamask posted a series of tweets warning users to disable the automatic iCloud backups feature to protect them from hacking. This is after one Metamask user lost about $670k worth of assets from a phishing attack using the iCloud feature. (Read More...)",51.29,50.0,81.24809563159943,30.910000000000004,70.0,0.0007987022399902344,2022-04-20
15,BeInCrypto,Robinhood Renews European Expansion With UK Crypto Acquisition,Robinhood's eventual plans to integrate Ziglu marks the expansion of its operations into Europe and its second attempt in the U.K. The post Robinhood Renews European Expansion With UK Crypto Acquisition appeared first on BeInCrypto. (Read More...),50.0,50.0,99.85732734203339,50.0,59.375,98.47234785556793,2022-04-20
16,Decrypt,El Salvador’s Bid for Bitcoin Bonds Sinking as IMF Deal 'Practically Dead': Former Central Bank President,"The promise of a Volcano-powered, tax-free city built with Bitcoin-backed bonds may sound exciting, but experts have their doubts. (Read More...)",50.0,46.666666666666664,0.09219348430633545,49.355,70.0,4.4898271560668945,2022-04-20
17,CryptoPotato,Animoca Brands Acquires Aussie Digital Agency (Report),Animoca Brands doubled down on its acquisition spree as this time it purchased the Australian digital agency - Be Media. (Read More...),50.0,50.0,6.83007538318634,50.0,54.30555555555555,0.13061463832855225,2022-04-20
18,Decrypt,Bitcoin Outflows From Crypto Funds Top $73 Million Amid 'Hawkish' Fed Policy: Report,"Month-to-date, Bitcoin outflows now total $196 million. (Read More...)",60.114999999999995,75.0,0.09980499744415283,50.0,62.5,14.341023564338684,2022-04-20
19,Bitcoin Magazine,Bitcoin's Promise For The Fourth Industrial Revolution,The evolution of finance that Bitcoin represents will bring impacts comparable to the Industrial Revolution. (Read More...),65.91,50.0,98.20843040943146,50.0,75.0,97.96324670314789,2022-04-20
20,CoinDesk,FTX Plan Said to Face CFTC Roundtable Next Month,The proposal from FTX.US on directly clearing its customers' derivatives is said to be the focus of a May 23 public roundtable hosted by the Commodity Futures Trading Commission. (Read More...),50.0,50.0,95.96180319786072,50.0,60.0,0.29328763484954834,2022-04-20
21,The Daily Hodl,"Ethereum (ETH) Rival Solana (SOL) and One Low-Cap Altcoin Flashing Bottom Signals, According to Crypto Analyst","A closely tracked crypto strategist says that Ethereum (ETH) challenger Solana (SOL) and one low-cap crypto asset are starting to show signs of bottoming out. Pseudonymous trader Altcoin Sherpa tells his 173,100 Twitter followers that smart contract platform Solana appears to be carving out a low... (Read More...)",50.0,50.0,0.02372264862060547,84.53999999999999,58.92857142857143,0.0016093254089355469,2022-04-20
22,The Daily Hodl,"Bitcoin (BTC) on the Edge of Entering Another Multi-Month Dip, According to Crypto Analyst","One popular crypto analyst thinks Bitcoin (BTC) could be in for a rough couple of months before igniting new rallies. In a new tweet, Kevin Svenson tells his 103,000 Twitter followers that Bitcoin was showing a bit of weakness at the point of its weekly close on Sunday, particularly because it ha... (Read More...)",50.0,50.0,0.011542439460754395,50.0,61.994949494949495,0.01086890697479248,2022-04-20
23,Bitcoinist,"Crypto Correlation With Gold, S&P 500 Increasing, Asset Class Going Mainstream",The crypto and legacy markets are increasing their correlation levels. The new asset class has been trading like a big tech stock for a while as the global markets seem to brace for the beginning of a tightening cycle. Related Reading | $240 Million In Crypto Futures Liquidates As Bitcoin Slips B... (Read More...),68.06,50.0,97.66380190849304,80.62,56.36363636363636,1.467004418373108,2022-04-20
24,NewsBTC,"Can RUNE Sustain Its 20% Rally?, Why This Analyst Doubts It","THORChain (RUNE) has seen an important rally in the past month. The native token of this decentralized cross-chain bridge rose from its 2022 low at around $3 with 30% intra-day rallies to its current levels. Related Reading | THORChain Activates Feature, 30% Spike Follows, Can Bulls Sustain It? A... (Read More...)",35.199999999999996,50.0,0.1759052276611328,46.14,58.92857142857143,19.99187171459198,2022-04-20
25,BeInCrypto,India Crypto Exchange Founders Decamp to Dubai. Will Mass Exodus Ensue?,"While India struggles to figure out its crypto policy, two co-founders of cryptocurrency exchange WazirX have moved to the Middle East. The post India Crypto Exchange Founders Decamp to Dubai. Will Mass Exodus Ensue? appeared first on BeInCrypto. (Read More...)",50.0,50.0,0.22628605365753174,31.94,62.5,0.11125504970550537,2022-04-20
26,Blockworks,"First Australian Spot Bitcoin, Ether ETFs to Go Live Next Week","21Shares and ETF Securities team up to bring crypto exposure to the country while American regulators drag their feet The post First Australian Spot Bitcoin, Ether ETFs to Go Live Next Week appeared first on Blockworks. (Read More...)",50.0,54.82954545454546,18.621644377708435,53.86,56.477272727272734,6.471946835517883,2022-04-20
27,CryptoGlobe,"Cardano ($ADA) Now Has Over 900 Projects Building on It, Input Output Reveals","The Cardano ($ADA) network now has over 900 projects building on it, according to its developer Input Output, which also shared a number of developments occurring on the cryptocurrency’s blockchain. These include the launch of an ERC-20 converter and the launch of WingRiders. According to a tweet... (Read More...)",50.0,50.0,99.97776448726654,70.095,75.0,99.7363418340683,2022-04-20
28,ZyCrypto,"After Shiba Inu Listing, Robinhood Acquires UK Crypto Platform Ziglu to ‘Rev Up Expansion Plans’","Robinhood, a popular stock and crypto trading app, has agreed to purchase London-headquartered crypto firm Ziglu. The acquisition comes as Robinhood dips its toes further into the crypto waters amid growing interest. (Read More...)",50.0,50.0,10.750481486320496,91.125,61.25000000000001,24.85489845275879,2022-04-20
29,CoinTelegraph,Framework Ventures allocates half of $400M fund to Web3 gaming,"Like DeFi in 2020, gaming is considered by many to be the next major growth play for the blockchain industry in 2022. (Read More...)",50.0,41.66666666666667,1.8595188856124878,87.895,63.28125,96.63797914981842,2022-04-20
30,CryptoPotato,BlockchainCom Negotiates IPO Terms With Banks to Go Public in 2022: Report,BlockchainCom has reaffirmed its plans to go public this year following the recent expansion developments. (Read More...),50.0,50.0,97.30488955974579,50.0,56.25,82.75521993637085,2022-04-20
31,Bitcoin.com,"Jack Dorsey Claims if ‘You’re Building on Ethereum You Have at Least One, if Not Many, Single Points of Failure’","The internet entrepreneur and former CEO of Twitter, Jack Dorsey, claims if developers are building on Ethereum they have “at least one, if not many, single points of failure.” The statement was in response to Vitalik Buterin’s commentary concerning Elon Musk running Twitter. Former Twitter CEO C... (Read More...)",50.0,38.27380952380952,0.11591911315917969,50.0,46.87074829931973,0.01748204231262207,2022-04-20
32,The Block,"IMF calls for coordinated effort, capital controls for crypto",The International Monetary Fund (IMF) is encouraging global policymakers to develop standards for crypto in response to growing concerns highlighted by the war in Ukraine. (Read More...),50.0,50.0,23.598304390907288,52.580000000000005,58.333333333333336,99.25529956817627,2022-04-20
33,Blockworks,Crypto Exchange Binance.US Secures Money Transmitter License in Puerto Rico,"The exchange has secured licenses in three states this year: Connecticut, West Virginia and Wyoming The post Crypto Exchange Binance.US Secures Money Transmitter License in Puerto Rico appeared first on Blockworks. (Read More...)",65.91,50.0,91.62024259567261,80.62,68.75,99.51789081096649,2022-04-20
34,CryptoBriefing,Leaked Data Reveals Twitter Shills’ Alleged Profits,(Read More...),57.655,45.0,1.0182470083236694,50.0,75.0,96.50535881519318,2022-04-20
35,Decrypt,Deadfellaz Ethereum NFT Collection Lands Exclusive Deal with UTA: Report,"Deadfellaz joins CryptoPunks, Meebits, and Autoglyphs on UTA’s growing roster of digital talent. (Read More...)",56.400000000000006,50.0,99.06197786331177,77.115,62.5,99.79434907436371,2022-04-20
36,Blockworks,"Framework Ventures Launches $400M DeFi Fund Targeting Gaming, Web3 Startups","Framework Ventures, known for early-stage DeFi investments, said blockchain gaming could see ""significant growth"" over the next five years The post Framework Ventures Launches $400M DeFi Fund Targeting Gaming, Web3 Startups appeared first on Blockworks. (Read More...)",50.0,50.0,24.87063705921173,76.335,64.0625,2.555495500564575,2022-04-20
37,The Daily Hodl,Rainmaker Games Launches The First Blockchain Gaming Discovery Platform,"April 19, 2022 – Austin, Texas Rainmaker Games launches the first discovery platform for blockchain games, providing a much-needed single-source of gaming data the industry was missing. Rainmaker’s beta platform includes over 150 blockchain games, expert reviews, technical details, earning potent... (Read More...)",50.0,62.5,99.73631799221039,35.199999999999996,60.5,99.91904497146606,2022-04-20
38,Bitcoinist,U.S Secret Service Seizes $102 Million Of Crypto Assets Linked To Criminals,"In a crackdown against illicit transactions of digital assets linked to cybercrimes, the U.S. Secret Service has seized more than $102 million worth of digital assets, reported CNBC. Per the stats provided by the security agency, the seized crypto wealth is recovered from 254 cases targeted since... (Read More...)",27.060000000000002,30.0,1.8832385540008545,91.8,57.49999999999999,5.3930968046188354,2022-04-20
39,AMBCrypto,"SHIB, ETH twerking as Reddit attributed buy calls look for new resistance level","After days of floundering in the red after Bitcoin fell below the $40k mark, the crypto market finally turned green once more. Naturally, many investors are wondering if now is a good time to stack some stats, collect some more diamonds, or add new dogs to their kennel. Greener on the other side?... (Read More...)",50.0,56.81818181818181,1.1307775974273682,72.02,62.55681818181817,0.090828537940979,2022-04-20
40,Decrypt,"Bitcoin Is Trading Like a Tech Stock, Not 'Digital Gold'",BTC's 30-day correlation with the Nasdaq is at its highest level since July 2020. Its correlation with gold is at a low point. (Read More...),68.06,50.0,0.0494539737701416,36.34,62.5,76.0049819946289,2022-04-20
41,CoinTelegraph,"IMF global financial stability report sees complex roles for cryptocurrency, DeFi","Decentralized finance offers a mix of risks and benefits as it forms interconnections with traditional finance, the International Monetary Fund finds in a new report. (Read More...)",50.0,45.0,99.28606748580933,56.400000000000006,57.36363636363636,99.58388805389404,2022-04-20
42,BeInCrypto,Balancer (BAL) Generates Bullish Divergences Over Multiple Time Frames,"BAL has created a short-term bullish pattern, which could lead to an increase. However, the direction of the long-term trend is unclear. The post Balancer (BAL) Generates Bullish Divergences Over Multiple Time Frames appeared first on BeInCrypto. (Read More...)",50.0,50.0,0.10620355606079102,65.91,62.5,0.006926059722900391,2022-04-20
43,Bitcoin Magazine,Bitcoin Is Venice: A Capital Renaissance,"Bitcoin is the next advancement in the governance of money, an advancement set to spark a new Renaissance. (Read More...)",50.0,50.0,5.379444360733032,61.315,60.60606060606061,16.8709397315979,2022-04-20
44,CoinTelegraph,US Air Force files trademark application for 'SpaceVerse' initiative,"SpaceVerse was defined as “a secure digital metaverse that converges terrestrial and space physical and digital realities"" as well as provides a simulated environment for training. (Read More...)",50.0,50.0,84.45427715778351,77.115,57.49999999999999,99.74264204502106,2022-04-20
45,CoinDesk,Market Wrap: Altcoins Outperform as Sentiment Improves; Bitcoin Within 'Value Zone',"Bitcoin (BTC) and other cryptos rose on Tuesday, indicating a greater appetite for risk among traders. Some analysts suggest bitcoin is entering a value zone, which typically precedes strong breakouts or breakdowns in price. (Read More...)",81.845,50.0,0.05817115306854248,86.345,64.51388888888889,0.09857714176177979,2022-04-20
46,CoinGape,"Bitcoin Price Prediction: BTC Price Bounces Back Near $41,000; Time To Enter?","BTC price extends the gains for the second session in a row. The recent price action suggests the bulls attempt to make a comeback. BTC tested the lows seen in March, double support that could propel the price to swing highs. BTC price trades higher with decent gains as bounces back from the supp... (Read More...)",50.0,52.5,0.005376338958740234,86.75500000000001,56.35416666666666,6.380587816238403,2022-04-20
47,The Block,Enterprise blockchain provider BlockApps raises $41 million,"BlockApps, an enterprise blockchain provider, has raised $41 million in funding to grow its development team and accelerate its go-to-market strategy, the company announced today. (Read More...)",50.0,50.0,78.07120978832245,50.0,75.0,91.8863594532013,2022-04-20
48,CryptoPotato,Ireland Bans Crypto Donations for Political Parties Fearing Russian Intervention (Report),Irish Government Minister Darragh O'Brien wants local political parties to be forbidden to receive cryptocurrency donations. (Read More...),37.5,50.0,0.07520318031311035,48.71,56.99999999999999,0.3319203853607178,2022-04-20
49,U.Today,Ripple vs. SEC: Defendants' Attempt to Block Supplemental Expert Report Fails,SEC has been allowed to to file a supplemental report in the Ripple case (Read More...),15.46,35.0,0.030553340911865234,50.0,60.0,1.0733336210250854,2022-04-20
50,The Daily Hodl,"Mysterious Bitcoin Whale Accumulates Over $117,000,000 in BTC in Just One Week","The third-biggest Bitcoin whale in the world has entered accumulation mode with huge purchases of BTC over the last week as the leading crypto by market cap hovers around the $40,000 mark. The whale is ranked number three but is the largest non-exchange entity and has accumulated 2,822 BTC in the... (Read More...)",50.0,50.0,0.05569159984588623,60.114999999999995,65.0,7.026836276054382,2022-04-20
51,BeInCrypto,Monero Rallies 11% on the Back of Major Hard Fork Announcement,"Monero, the privacy coin of choice for the darknet, has surged in price in the last 24 hours, although the jury is still out as to the cause. The post Monero Rallies 11% on the Back of Major Hard Fork Announcement appeared first on BeInCrypto. (Read More...)",44.865,46.18055555555556,0.30639171600341797,44.865,54.34027777777778,0.15118122100830078,2022-04-20
52,The Daily Hodl,"IMF Says Adoption of Crypto Could Undermine Political Power, Urges ‘Global Standards’","The International Monetary Fund (IMF) is warning against the dangers of unregulated crypto in a newly released report. In the new Global Financial Stability Report, the IMF suggests that domestic policymakers should develop globally-minded regulations of the disruptive but growing blockchain fina... (Read More...)",35.199999999999996,50.0,0.32944977283477783,32.99999999999999,55.519480519480524,0.8052974939346313,2022-04-20
53,Decrypt,First Bitcoin and Ethereum ETFs to Debut in Australia,U.S. investors are still waiting for the SEC to approve a Bitcoin exchange-traded fund. (Read More...),50.0,62.5,99.4014024734497,50.0,60.0,0.19297897815704346,2022-04-20
54,Cointelegraph,Blockchain.com co-founder thinks the EU and UK are 'progressive' crypto regulators,"In a conversation on stage at Paris Blockchain Week Summit and in an exclusive interview afterwards, Nicolas Cary shared his insights on inflation, regulation and Web3. (Read More...)",50.0,50.0,0.39887428283691406,72.02,75.0,92.38765239715576,2022-04-20
55,Blockworks,"Blockchain Tech Is Key to Combating Climate Change, Report Says","Smart contracts boost transparency of clean energy projects, according to the report The post Blockchain Tech Is Key to Combating Climate Change, Report Says appeared first on Blockworks. (Read More...)",50.0,50.0,99.8114675283432,92.405,63.30952380952382,94.78890895843506,2022-04-20
56,Bitcoin.com,"Privacy-Centric Monero Plans for July Hard Fork, Plans Include Ring Signature, Bulletproof Upgrade","According to a recent update on Monero’s Github repository, the privacy-centric crypto network plans to hard fork in July, at block height 2,668,888. Monero is the largest privacy crypto asset in terms of market capitalization and during the last seven days, monero climbed 13.4% against the U.S. ... (Read More...)",44.865,35.416666666666664,11.260378360748291,39.885,52.604166666666664,0.06425976753234863,2022-04-20
57,Forbes,Robinhood Shares Jump 4% After Deal To Buy UK Crypto App Ziglu,Robinhood said the deal would “help accelerate” its expansion into the UK and Europe. (Read More...),64.8,50.0,0.29810070991516113,50.0,75.0,81.09761476516724,2022-04-20
58,ZyCrypto,Massive SHIB Burn Expected As Shiba Inu’s Metaverse Gathers Pace Following Huge Traction On Robinhood,The forthcoming Shib burn program under ShibaSwap 2.0 in addition to other avenues of burning tokens including community burns and other burn projects could see hundreds of trillions of SHIB tokens destroyed “in a bad year” according to... (Read More...),65.91,53.75,91.92656576633453,11.414999999999997,44.375,0.002086162567138672,2022-04-20
59,Crypto Daily,IMF still trying to pin Russian sanctions evasion on crypto,"The IMF has doggedly continued to accuse the crypto sector as a place where Russia can dodge the sanctions imposed on it by the Western alliance. From anonymising tools to crypto mining, the IMF appears desperate to use crypto as a scapegoat for Russian sanctions evasion. Even though it is with g... (Read More...)",50.0,50.0,0.032129883766174316,13.655000000000001,48.75,0.05087554454803467,2022-04-20
60,The Block,Citi stalwart joins Franklin Templeton Institute to spearhead digital asset research,"Kaul had been with Citi since 2009, where she produced primary research on the evolution of the hedge fund and alternatives investment industry. (Read More...)",68.06,50.0,94.94732022285461,50.0,72.5,95.05317211151123,2022-04-20
61,Decrypt,IMF Warns Russia Could Use Bitcoin Mining to Evade Sanctions,"Russia has significant energy resources to put toward cryptocurrency mining, according to the report. (Read More...)",44.865,50.0,0.0347137451171875,72.02,71.875,2.415493130683899,2022-04-20
62,CoinDesk,Elon Musk Shouldn't Lead Twitter,"Elon Musk, chief executive officer of Tesla. (Al Drago/Bloomberg via Getty Images) (Read More...)",50.0,50.0,0.06225705146789551,50.0,75.0,15.464875102043152,2022-04-20
63,U.Today,Shiba Inu and Dogecoin Now Accepted by Porsche Dealer,Baltimore-based Porsche dealer Porsche Towson has announced a partnership with BitPay (Read More...),63.660000000000004,50.0,99.62417185306549,50.0,75.0,90.50431847572327,2022-04-20
64,NewsBTC,Bitcoin SOPR Suggests Market Nowhere Near The Bottom,"According to on-chain data, current Bitcoin SOPR trend suggests the market may be nowhere near the price bottom. Bitcoin SOPR Still Some Distance Above The “One” Level As pointed out by an analyst in a CryptoQuant post, the BTC SOPR hints there may be some ways to go still before a bottom forms. ... (Read More...)",50.0,55.00000000000001,0.01774430274963379,50.0,57.49999999999999,0.8775681257247925,2022-04-20
