,source,title,excerpt,vader_sentiment_title,tb_sentiment_title,flair_sentiment_title,vader_sentiment_excerpt,tb_sentiment_excerpt,flair_sentiment_excerpt,date
0,AMBCrypto,NEAR under sell pressure – Buying opportunities may be found at these levels,"Disclaimer: The information presented does not constitute financial, investment, trading, or other types of advice and is solely the writer’s opin...",55.135,55.00000000000001,24.140620231628418,50.0,46.875,0.11563897132873535,2023-04-06
1,Decrypt,Unreleased David Bowie Recording to Debut as Music NFT,"The never-before-heard version of Bowie's hit ""Let’s Dance"" will be sold via pay-what-you-want NFTs from Gala Music and benefit charity.",50.0,50.0,1.6158044338226318,85.015,50.0,0.21859407424926758,2023-04-06
2,Cointelegraph,"Zhu Su’s exchange did $13.64 in volume akshually, Huobi in crisis: Asia Express","Huobi Global’s token crash and ongoing layoffs, 3AC founders deny reports of $1.26 in day 1 volume on new exchange and claim $373 on day 2.",18.755,50.0,1.3669312000274658,18.755,53.40909090909091,0.00597834587097168,2023-04-06
3,Decrypt,"Meta Launches AI Tool That Can Identify, Separate Items in a Picture","Meta unveils ""Segment Anything"" AI image identification tool, but the scale of the dataset used by the social giant raises privacy concerns.",50.0,50.0,93.63635778427124,50.0,50.83333333333333,0.995248556137085,2023-04-06
4,NewsBTC,"Grayscale Discount Continues To Recover, Good News For Bitcoin?","The Grayscale Bitcoin Trust (GBTC), the largest Bitcoin trust in the world, saw a rocky end to the year 2022 after its sister company Genesis Trad...",72.02,85.0,0.029265880584716797,88.25,50.0,0.13045072555541992,2023-04-06
5,Bitcoinist,Travel Company Launches New Program To Help Shiba Inu Holders Earn Commissions,Shiba Inu is seeing increasing adoption in Web2 as companies look to take advantage of its massive supporter base. One of these companies is Trava...,70.095,56.81818181818181,98.8957405090332,73.83500000000001,30.0,98.14226031303406,2023-04-06
6,crypto.news,Solana NFT minting now cheaper with new technology,"The Solana Foundation has revealed that minting 1 million NFTs on Solana now costs much less, owing to a new technology.",50.0,56.81818181818181,96.33190929889679,50.0,49.24242424242424,4.316645860671997,2023-04-06
7,crypto.news,US Treasury warns DeFi poses a threat to national security,"The U.S. Department of Treasury issued a stark warning, stating that the rise of decentralized cryptocurrency markets poses a significant threat t...",42.345,50.0,0.40147900581359863,25.305,54.37499999999999,0.8766382932662964,2023-04-06
8,Finbold,Crypto and the Microsoft mastermind: Is Bill Gates invested in Bitcoin?,As cryptocurrencies become more widely adopted around the world and blockchain is touted as one of the most important technological achievements o...,50.0,50.0,3.6721795797348022,61.23499999999999,66.25,99.95884001255035,2023-04-06
9,Finbold,Robert F. Kennedy Jr.’s presidential bid could lead to greater Bitcoin adoption,"Environmental lawyer Robert F. Kennedy Jr. has filed paperwork with the Federal Election Commission to run for president in 2024 as a Democrat, wi...",68.06,75.0,0.5389779806137085,50.0,50.0,1.966482400894165,2023-04-06
10,Finbold,"Bitcoin outperforms top five major indexes by 170% in Q1, 2023","After a tumultuous 2022, Bitcoin (BTC) is on the rebound in 2023, emerging as a potentially lucrative investment option, surpassing traditional fi...",60.114999999999995,64.0625,89.54837322235107,50.0,50.0,99.55056309700012,2023-04-06
11,Finbold,Crypto-related US trademark filings nosedive in 2023,"Although 2022 was an exceptionally successful year in terms of trademark applications related to the cryptocurrency industry in the United States,...",50.0,50.0,0.03517866134643555,89.205,68.75,93.19283366203308,2023-04-06
12,Finbold,Verified: Your Apple computer is hosting the Bitcoin white paper,The Bitcoin white paper was found buried deep inside Apple’s (NASDAQ: AAPL) system files on computers running macOS Catalina or later. The documen...,50.0,50.0,6.968027353286743,50.0,50.0,0.006681680679321289,2023-04-06
13,crypto.news,Arbitrum Foundation presents new governance proposals following backlash,"Arbitrum Foundation, the Ethereum layer 2 network, has introduced two new proposals with significant changes after its initial governance proposal...",50.0,53.40909090909091,2.5140762329101562,60.114999999999995,58.52272727272727,93.8090980052948,2023-04-06
14,AMBCrypto,Singapore banks form new alliances for vetting crypto clients,Singapore banks are working with the country&#8217;s Central Bank and police to develop a vetting process for crypto clients. The collaboration co...,50.0,56.81818181818181,99.72144365310669,50.0,50.0,99.67338144779205,2023-04-06
15,NewsBTC,Solana’s New Innovation Paves The Way For Affordable NFTs,"Solana, a highly scalable blockchain network, has been making waves in the crypto world as an “Ethereum-killer.” However, recent failures have put...",69.08999999999999,56.81818181818181,99.94100034236908,27.060000000000002,54.0,1.261088252067566,2023-04-06
16,crypto.news,MKR rallies amid new proposals on the network,"MKR is on for a bull run as the asset looks to cross the $730 mark. Trading at $722, the crypto had recorded an increase in price valuation of 7% ...",50.0,56.81818181818181,2.5271743535995483,79.295,50.0,0.09054243564605713,2023-04-06
17,Decrypt,Dogecoin Drops Sharply After Twitter Blue Bird Returns,Doge had a very short run as Twitter's new mascot.,50.0,46.875,0.003337860107421875,50.0,53.40909090909091,0.12103021144866943,2023-04-06
18,The Block,Robinhood settles with state securities regulators for $10 million,Robinhood will pay $10.2 million in penalties after its March 2020 platform outages.,64.8,50.0,7.218083739280701,44.865,50.0,0.022301077842712402,2023-04-06
19,Tokenist,Dogecoin Plummets 7%+ As Twitter Returns to Its Iconic Bird,"Just as Monday’s change to a Shiba Inu sent DOGE surging, Thursday’s switch back to the bird sent the token plummeting. The post Dogecoin Plummets...",50.0,75.0,0.028622150421142578,50.0,50.0,0.005692243576049805,2023-04-06
20,Shido,Shido AMA w/ Pitbull - Live Recording [06.04.23],Shido AMA w/ Pitbull - Live Recording [06.04.23]Tune in and listen to the latest Shido AMA w/ Pitbull Token! We have uploaded the live recording o...,50.0,56.81818181818181,99.89264011383057,50.0,64.96212121212122,98.94620478153229,2023-04-06
21,Qtum_Foundation,March Development and Community Updates,This month&#39;s community updates highlight the numerous exciting events and news that unfolded in the Qtum ecosystem. With our presence at ETH D...,50.0,50.0,92.67174005508423,84.04,57.49999999999999,99.64759051799774,2023-04-06
22,The Block,Dogecoin dives as Twitter dumps Shiba Inu for the blue bird,Dogecoin quickly dived on Thursday after Twitter appeared to revert back to its normal blue bird logo.,29.905000000000005,50.0,0.022402405738830566,50.0,56.041666666666664,0.0012755393981933594,2023-04-06
23,Decrypt,"ChatGPT Picks Gold Over Bitcoin, Says Crypto Critic Peter Schiff","ChatGPT chooses to include gold, not Bitcoin, as part of its ""recession-proof"" portfolio.",36.34,50.0,99.828439950943,50.0,50.0,0.15685558319091797,2023-04-06
24,AMBCrypto,"Bitcoin will trade like gold or treasury bonds in the future, Bloomberg strategist predicts",Senior macro strategist at Bloomberg Intelligence believes that the Bitcoin network has never been more secure than it is now. McGlone predicts th...,75.53,50.0,0.12554526329040527,60.685,72.5,4.063040018081665,2023-04-06
25,AMBCrypto,Dogecoin [DOGE] exists as Twitter bird makes a comeback,Twitter has removed the Dogecoin [DOGE] logo just days after giving it the position of the famous bird. The sudden removal has resulted in the coi...,50.0,50.0,85.70337295532227,67.0,62.5,0.002849102020263672,2023-04-06
26,Bitcoinist,From Crypto Craze To Currency King: Bitcoin’s Potential To Replace The Dollar As The Global Reserve,"Bitcoin is often pitched as a possible contender to become the next global reserve currency. However, it faces many hurdles, none more significant...",42.345,50.0,23.548918962478638,56.400000000000006,61.458333333333336,2.540537714958191,2023-04-06
27,Cointelegraph,"Paxful co-founders’ litigation cites misappropriation of funds, money laundering, U.S. sanctions evasion",A bitter dispute between Paxful's co-founders in Delaware courts may have led to the crypto marketplace's sudden closure.,39.885,50.0,0.292322039604187,16.475,47.5,0.14079511165618896,2023-04-06
28,Tokenist,CA Financial Watchdog Joins Multi-State $10M Settlement With Robinhood,California’s DFPI announced a $10 million settlement with Robinhood over allegedly harming investors in 2020. The post CA Financial Watchdog Joins...,50.0,50.0,5.047121644020081,22.13,47.5,0.16174912452697754,2023-04-06
29,CoinGape,Just-In: Robinhood To Pay $10.2 Million For Halting Trade During Pandemic Days,"Robinhood, a leading fintech firm behind the cryptocurrency and stock trading platform, is projected to pay more than $10 million in fines accordi...",44.865,50.0,76.35917365550995,44.865,48.333333333333336,0.02593100070953369,2023-04-06
30,Seeking Alpha,"Bitcoins, ethereum tread water in runup to jobs report","Bitcoin (BTC-USD) fell slightly in Thursday late afternoon trading ahead of the highly anticipated March nonfarm payrolls report. Even so, cryptoc...",50.0,50.0,0.1982182264328003,50.0,44.888888888888886,0.007408857345581055,2023-04-06
31,"CoinDesk: Bitcoin, Ethereum, Crypto News and Price Data",Dogecoin Drops After Elon Musk's Twitter Stops Using Its Logo,,42.345,50.0,0.0015437602996826172,50.0,50.0,0.0,2023-04-06
32,Goldenball,📣 Golden Ball | Future Decentralized Cryptocurrency Payment Gateway Provider 📊 | Burned 20.3 B GLB and Renounced Ownership |,We have burn 20.3 B GLB Tokens About 33.8% of Total Supply and Renounced OwnershipBurn Proof Ownership Proof Ball is the next generation BSC token...,50.0,57.49999999999999,0.04563331604003906,50.0,50.0,0.12370049953460693,2023-04-06
33,CryptoSlate,CZ emphasizes Binance’s MENA presence in AMA,Binance CEO Changpeng Zhao discussed his company&#8217;s MENA presence in an ask-me-anything (AMA) session published on April 6. CZ discusses MENA...,50.0,50.0,99.20426607131958,50.0,50.0,77.44052410125732,2023-04-06
34,"CoinDesk: Bitcoin, Ethereum, Crypto News and Price Data",Venture Capital Bitkraft Raises $220.6M for Second 'Token Fund',"The firm didn’t comment on whether the fund has a Web3 angle, but did outline their crypto investment strategy.",50.0,50.0,13.093039393424988,50.0,40.0,0.9845495223999023,2023-04-06
35,Cointelegraph,Washington state DFI warns Eucoinotrade may be engaging in ‘advanced fee fraud’,"One user claims they were defrauded out of more than $50,000 by the website, which authorities are now referring to as an “alleged cryptocurrency ...",62.5,70.0,0.15794038772583008,50.0,60.0,0.02619326114654541,2023-04-06
36,"CoinDesk: Bitcoin, Ethereum, Crypto News and Price Data",Ether Holds Near $1.9K as Shanghai Fork Approaches,"ETH’s price slid 1.7% on Thursday, the day after reaching its nine-month high. The Ethereum upgrade is scheduled to occur April 12.",50.0,55.00000000000001,0.6683230400085449,60.114999999999995,57.99999999999999,0.0057697296142578125,2023-04-06
37,AMBCrypto,AVAX may be facing a potential 19% price reversal – What should you know?,"Disclaimer: The information presented does not constitute financial, investment, trading, or other types of advice and is solely the writer’s opin...",50.0,50.0,0.2002418041229248,50.0,46.875,0.11563897132873535,2023-04-06
38,Cointelegraph,GMX and dYdX go head-to-head for the top decentralized derivatives position,"Decentralized derivatives platforms GMX and dYdX battle for the top DEX spot, with each planning significant improvements for this year.",60.114999999999995,75.0,99.49774146080017,65.91,71.875,99.85945522785187,2023-04-06
39,Cointelegraph,Solana reveals cost-cutting solution for on-chain storage,"Known as state compression, the technology promises to drastically reduce the cost of on-chain storage.",65.91,50.0,99.99106824398041,69.08999999999999,50.0,99.47668612003326,2023-04-06
40,Blockworks,"75% of Crypto Holders Own NFTs, Survey Says",Nearly 30% said they got their hands on their first NFT within the last year,50.0,80.0,9.226614236831665,50.0,55.833333333333336,99.81243312358856,2023-04-06
41,Decrypt,"Lawyer Says He’s Called the FBI on Bitboy Over Threatening Emails, Calls and Tweets","After weeks of threatening messages, lawyer Adam Moskowitz says he fears that one of Bitboy’s followers might try to harm him and his family.",23.665000000000003,50.0,0.6173968315124512,6.709999999999999,50.0,0.0353395938873291,2023-04-06
42,Puli Token,Puli Token - Tax Free Buys!,Buy taxes have been removed!Hey everyone!We have set buy taxes to 0% until the full version of Puli Astro is released on both Android and iOS! We ...,77.81,75.0,88.04545104503632,50.0,71.875,8.121052384376526,2023-04-06
43,"CoinDesk: Bitcoin, Ethereum, Crypto News and Price Data",From Nakamigos to Magamigos: The Tricky Relationship Between the Meme Economy and NFTs,,42.345,50.0,99.63598847389221,50.0,50.0,0.0,2023-04-06
44,NewsBTC,"Woes For Bitcoin And Ethereum As Price Weakens, Which Direction Will Prevail?","The two largest cryptocurrencies by market capitalization, Bitcoin and Ethereum, are slowing down after weeks of trending to the upside. The marke...",18.154999999999998,50.0,0.007623434066772461,50.0,42.22222222222222,0.03680288791656494,2023-04-06
45,Cointelegraph,Euler team denies on-chain sleuth was a suspect in hack case,The investigator claimed to be targeted as a suspect because they maintained a crypto security repo on GitHub.,19.379999999999995,50.0,0.15208125114440918,52.580000000000005,50.0,1.0039478540420532,2023-04-06
46,Crypto Daily™,Australian Regulator Revokes Binance's Derivatives License,"Binance's derivatives license has been revoked by ASIC, affecting the crypto exchange's operations in Australia. The Australian Securities and Inv...",50.0,50.0,1.002734899520874,64.8,50.0,0.28024911880493164,2023-04-06
47,TheNewsCrypto,Musk Hype Fizzles Out: DOGE Records 5.80% Decrease in Value,Dogecoin (DOGE) experienced a surge in value earlier this week.Dogecoin has experienced a 5.80% decrease in value in the past 24 hours.The decline...,67.0,50.0,0.4164576530456543,79.295,66.875,0.09383857250213623,2023-04-06
48,Bitcoinist,"DeFi Vulnerabilities Exploited By Illicit Actors, Says US Treasury Report",A new report by the United States Treasury Department highlights the growing concern of the US regulatory agencies regarding “illicit” actors expl...,28.925,50.0,0.25208890438079834,82.43,56.81818181818181,84.77970957756042,2023-04-06
49,Spheroid Universe,Spheroid to launch AI avatars in augmented reality using ChatGPT,"Spheroid Universe, a futuristic Metaverse platform that augments the real world in every part of the Earth, has announced the upcoming launch of a...",50.0,50.0,95.50504386425018,50.0,60.0,99.698007106781,2023-04-06
50,CryptoSlate,Blockchain gaming UAW decreased 8% in Q1 2023,"The number of unique active wallets (UAW) recorded an 8.58% decrease in the first quarter of 2023, as the recent DappRadar report revealed. The av...",50.0,30.0,0.008004903793334961,72.94,56.14583333333334,0.08352100849151611,2023-04-06
51,TheNewsCrypto,Ethereum Enters Consolidation Phase: Decoding ETH Price Analysis,"The April 12 rollout of the Shanghai and Capella upgrades, together known as the Shapella, is eagerly anticipated by the ETH community. Investors ...",50.0,50.0,6.196612119674683,69.08999999999999,50.0,99.82970654964447,2023-04-06
52,TheNewsCrypto,Cosmos (ATOM) Continues Bullish Pattern While Staking Yield is 20% Up,"Atom’s trading price increased by 1.12% in the last 24 hours.The Cosmos staking yield is still more than 20%.Atom, the native token of the Cosmos ...",50.0,50.0,0.028148293495178223,63.660000000000004,62.5,3.1081318855285645,2023-04-06
53,AMBCrypto,"Can ETH hit $2,000 before the Shanghai upgrade? This dataset suggests that…",ETH’s upcoming Shanghai upgrade encourages more block trades ETH can robust demand but sell pressure and high leverage may undermine its $2000-tar...,50.0,50.0,87.35983371734619,17.59,66.5,1.2245476245880127,2023-04-06
54,Cointelegraph,What will be the outcome of the Ethereum Shanghai upgrade?,Join us as we discuss the potential outcomes of the upcoming Ethereum Shanghai upgrade and other important developments in DeFi.,50.0,50.0,0.4218965768814087,72.94,54.58333333333334,99.87098574638367,2023-04-06
55,Cointelegraph,Trader Joe joins top 5 DEX list as Liquidity Book model thrives on Arbitrum,JOE surges as Trader Joe’s Liquidity Book model sees it climb to become a top five DEX.,60.114999999999995,75.0,97.97833561897278,60.114999999999995,75.0,99.58576261997223,2023-04-06
56,BlockchainReporter,Titano Crypto: A Comprehensive Guide and Rebranding to Swych.finance,"IntroductionTitano cryptocurrency, also known as Titano token, is an emerging digital asset in the ever-expanding crypto ecosystem. As a decentral...",62.5,50.0,78.07286083698273,68.06,50.0,99.99200105667114,2023-04-06
57,Tokenist,Magic Eden Announces its BTC Ordinals Launchpad for April 7th,Magic Eden’s (Dead)jira Legacy mint is set to launch already on April 7th. The post Magic Eden Announces its BTC Ordinals Launchpad for April 7th ...,50.0,75.0,98.1678158044815,50.0,75.0,1.2133270502090454,2023-04-06
58,NewsBTC,Chainlink Presents Potential Buy Opportunities Despite Moving Sideways,"Over the past few days, the Chainlink price gained momentum. At the time of writing, however, it encountered selling pressure. The coin lost 0.7% ...",69.08999999999999,50.0,95.06275355815887,38.685,38.75,0.001531839370727539,2023-04-06
59,Cointelegraph,US state regulators announce $10M settlement with Robinhood 'for failing investors',"The investigation looked into complaints of Robinhood's system outages, causing users to miss out on trades while many of the platform's services ...",24.47,50.0,0.08813142776489258,24.47,75.0,18.96568238735199,2023-04-06
60,Finbold,"Machine algorithm sets Terra Classic price for April 30, 2023","Despite the majority of digital assets in the cryptocurrency market demonstrating renewed strength in 2023, this has not been the case for Terra C...",50.0,58.333333333333336,99.20287430286407,79.97000000000001,50.0,23.511528968811035,2023-04-06
61,CoinGape,Solana Claims Breakthrough In Lowering NFT Minting Costs; SOL Price Poised To Rally?,Solana which is often regarded as an Ethereum-killer had been under the limelight for all the wrong reasons this year. With rampant outages and te...,50.0,50.0,0.9892642498016357,26.165,25.0,0.005143880844116211,2023-04-06
62,Decrypt,Treasury Says Crooks Prefer Fiat to Crypto in DeFi Risk Report,"The Treasury Department said in a Thursday report that criminals do indeed use DeFi tools and apps, but most criminal activity still opts for fiat.",46.14,50.0,0.025606155395507812,10.504999999999997,52.5,0.646507740020752,2023-04-06
63,Decrypt,"Lawyers Claim Shaq Is Hiding From FTX Lawsuit, Seek Alternative Method to Serve Him","Shaquille O'Neal is a defendant in a lawsuit for promoting FTX, including Tom Brady and Larry David.",26.165,50.0,0.12331604957580566,57.655,50.0,1.4679491519927979,2023-04-06
64,HODL Official,HODL Announces Successful Partnership and Audits with RugFreeCoins,Exceptional Results Cement $HODL and $HODLX as Secure and Reliable InvestmentsHODL is thrilled to announce a fruitful partnership with RugFreeCoin...,79.295,87.5,94.57741379737854,82.43,77.77777777777777,99.92181360721588,2023-04-06
65,AMBCrypto,Germany paves way for “crypto shares” with this new regulation,"Germany, one of Europe&#8217;s most crypto-friendly countries, approved to digitize stocks as &#8220;crypto shares.&#8221; Germany announced the F...",50.0,56.81818181818181,9.84184443950653,73.515,75.0,4.067346453666687,2023-04-06
66,Tokenist,DPRK Stole an Estimated $1B In Crypto in 2022,"According to the UN, North Korea more than doubled its crypto theft proceeds between 2021 and 2022. The post DPRK Stole an Estimated $1B In Crypto...",50.0,50.0,0.21311640739440918,50.0,75.0,0.26390552520751953,2023-04-06
67,Cointelegraph,White House hopeful RFK Jr. says instant payments may lead to ‘financial slavery’,President John F. Kennedy’s nephew also worries that the government will seize the public’s Bitcoin.,75.53,50.0,1.9518524408340454,28.925,50.0,0.21398961544036865,2023-04-06
68,Crypto Daily™,"Influencer Alleges Bitget Of Scam, Exchange Responds To FUD","Tech entrepreneur and serial crypto investor Evan Luthra has accused Bitget, a leading cryptocurrency exchange, of being involved in a widespread ...",11.985000000000001,50.0,5.885815620422363,35.199999999999996,50.0,0.10764002799987793,2023-04-06
69,Cointelegraph,"$1.12B in Bitcoin options expire this week, and bulls appear to be at a disadvantage","Commodities rallied as the United States Treasury struggled with the banking crisis, but Bitcoin bulls also overplayed their hand in this week’s o...",28.925,50.0,0.005054473876953125,75.935,50.0,1.3289302587509155,2023-04-06
70,CryptoSlate,Ethereum’s distribution problem: over 50% of tokens held by wealthy addresses,Definition The relative supply distribution across addresses with specific balance bands. Only supply in Externally Owned Addresses (EOAs) is incl...,47.42,75.0,0.009879469871520996,50.0,50.0,95.83073854446411,2023-04-06
71,NewsBTC,XRP Bullish Streak Comes To A Halt With 8% Dip,"XRP, the digital currency associated with Ripple, started off strong on Wednesday with a promising gain of nearly 2%, holding steady above the saf...",50.0,50.0,0.04780590534210205,92.775,57.49999999999999,98.72277975082397,2023-04-06
72,"CoinDesk: Bitcoin, Ethereum, Crypto News and Price Data","Ethereum's Shanghai Upgrade Will Help Layer 2 Networks, Crypto Investor Says","Max Williams, chief operating officer at Runa Digital Assets, says secondary blockchains are “already trending well” and the upgrade will spur mor...",70.095,50.0,95.40514647960663,58.894999999999996,42.5,0.5901545286178589,2023-04-06
73,"CoinDesk: Bitcoin, Ethereum, Crypto News and Price Data",Avalanche’s Cortina Upgrade Goes Live on Protocol’s Testnet; AVAX Token Rallies,"The change improves support for exchanges and may bring faster development, Avalanche says.",50.0,56.81818181818181,16.275465488433838,83.525,50.0,99.83858168125153,2023-04-06
74,"CoinDesk: Bitcoin, Ethereum, Crypto News and Price Data","Uniswap Topped Coinbase’s Trading Volume in March During USDC Depeg, U.S. Crackdown","The DEX, however, has been unable to maintain elevated periods of trading volumes in the past, CCData noted.",50.0,50.0,0.036534667015075684,50.0,31.25,0.5479007959365845,2023-04-06
75,DappRadar,State of Blockchain Gaming in Q1 2023,"Although there has been a slight decline in on-chain gaming activity in Q1 2023, games continue to hold a significant position in the dapp industr...",50.0,50.0,16.091302037239075,60.114999999999995,55.208333333333336,99.67469274997711,2023-04-06
76,Cointelegraph,"Germany plans to issue electronic shares on blockchain, boost startups","Under the Future Finance Act, the German government is pushing for more welcoming regulations for startups working with financial innovation.",79.97000000000001,50.0,4.692515730857849,84.985,56.25,0.6578117609024048,2023-04-06
77,Injective,Notifi Integrates Injective to Bring User Notifications to Web3 Finance,"Notifi has officially integrated with Injective, enabling dApps built on Injective to provide instant user notifications and alerts. Ecosystem dAp...",50.0,50.0,99.46838915348053,50.0,50.0,99.50436055660248,2023-04-06
78,DappRadar,Polygon’s Rise as a Gaming Chain: Second Only to Wax with 138k Daily Gaming Wallets,"While on-chain gaming activity decreased slightly in March, games still make up a significant portion of the dapp industry activity. DappRadar’s l...",50.0,50.0,99.91171360015869,60.114999999999995,46.80555555555556,8.195599913597107,2023-04-06
79,Bitcoinist,Reddit Rolls Out Gen 3 NFT Avatar Contracts On Polygon Network,"Reddit&#8217;s latest announcement unveils the deployment of Gen 3 NFT &#8220;Reddit Avatars&#8221; on the Polygon blockchain network, ushering in...",50.0,50.0,1.138824224472046,50.0,75.0,99.36026930809021,2023-04-06
80,NewsBTC,Ethereum Shapella Upgrade Expected To Boost Liquid Staking Protocols,"In decentralized finance (DeFi), Ethereum (ETH) liquid staking has become a significant market valued at over $15 billion. This market is set to s...",70.095,45.0,14.209792017936707,78.595,68.75,0.008794665336608887,2023-04-06
81,Decrypt,Apple's Hidden Bitcoin White Paper the Latest in a Long List of Easter Eggs,The seminal document behind Bitcoin has been lurking in an innocuous file on Apple computers for years. Here's how to find it.,50.0,53.541666666666664,9.591186046600342,43.6,30.0,97.73338735103607,2023-04-06
82,CryptoSlate,Tether USDT supply reaches $80B for 1st time in almost a year,"Tether&#8217;s USDT supply crossed $80 billion for the first time in 11 months earlier today, nearing its all-time high of $83.13 billion. In 2023...",52.580000000000005,50.0,99.29948449134827,50.0,56.833333333333336,98.05862605571747,2023-04-06
83,Technext,TECNO unveils the revolutionary PHANTOM V FOLD at glamourous event in Lagos,"On a night of great significance, celebrities, industry titans, and other blue blood converged to witness the dawn&#8230;",72.94,50.0,99.26588237285614,86.75500000000001,61.25000000000001,99.94188845157623,2023-04-06
