,source,title,excerpt,vader_sentiment_title,tb_sentiment_title,flair_sentiment_title,vader_sentiment_excerpt,tb_sentiment_excerpt,flair_sentiment_excerpt,date
84,AMBCrypto,SOL take a cue from Bitcoin’s sideway structure – Here are the levels to watch out for,"Disclaimer: The information presented does not constitute financial, investment, trading, or other types of advice and is solely the writer’s opin...",50.0,50.0,98.2222855091095,50.0,46.875,0.11563897132873535,2023-04-06
85,Crypto Daily™,Arbitrum Backtracks On Controversial Proposal After Backlash,Ethereum Layer-2 solution provider Arbitrum has backtracked on its proposed governance voting system. This comes after a huge backlash from the co...,39.885,77.5,1.0528087615966797,77.86999999999999,70.0,0.007909536361694336,2023-04-06
86,Cointelegraph,Bitcoin 'faces headwinds' as US money supply drops most since 1950s,Research from Bloomberg Intelligence argues that liquidity conditions still do not favor a continuation of the Bitcoin rally.,50.0,75.0,0.030666589736938477,40.395,50.0,0.06421208381652832,2023-04-06
87,Cointelegraph,Aragon and Polygon Labs collaborate to boost DAO accessibility,"The collaboration is set to allow users to build decentralized autonomous organizations quickly and securely, for less than 50 cents, with no codi...",70.095,50.0,99.17207658290863,63.660000000000004,62.083333333333336,91.58917963504791,2023-04-06
88,AMBCrypto,Australia cancels crypto exchange Binance’s derivatives license amid regulatory review,"The ASIC cancelled Binance Australia’s derivatives license, a day after it received a cancellation request from the exchange. It was only the last...",38.685,50.0,0.19811391830444336,37.5,50.0,0.024938583374023438,2023-04-06
89,Nano Foundation,"Nano Digest: V24 release, new Community Programme members, growing adoption, and more!","The excitement in the nano community is amazing! Where is it coming from? Well, from all the great things that have been going on recently in the ...",62.405,69.0340909090909,99.95220601558685,96.295,75.83333333333333,99.95356798171997,2023-04-06
90,Blockworks,‘BitBoy’ Ben Armstrong Faces Legal Action From FTX Class Action Lawyers,"Ben ‘BitBoy’ Armstrong is alleged to have used emails, phone calls and social media to send ‘daily violent threats’ to an attorney in the FTX clas...",56.400000000000006,56.666666666666664,18.436965346336365,20.029999999999998,39.166666666666664,0.9309530258178711,2023-04-06
91,PHOENIXCHAIN,Phoenix Chain Mainnet Launch,"The Phoenix Chain Mainnet Launch marks the official release of the Phoenix Chain blockchain network, which is designed to provide a secure and sca...",50.0,50.0,99.58696365356445,67.0,70.0,97.16237187385559,2023-04-06
92,Crypto News Flash,Is the Ripple lawsuit filed because JP Morgan wants to push Ethereum? This is going on behind the scenes,The FOIA request by an XRP community member hints that JPMorgan pushed the SEC to file a lawsuit against Ripple Labs and XRP. The SEC has responde...,58.065,45.0,2.2278130054473877,38.685,45.0,0.8824288845062256,2023-04-06
93,Crypto Briefing,Binance to Shut Down its Australian Derivatives Services,"Binances Australian financial services license is being terminated, meaning that Australian residents will no longer be able to open derivatives p...",50.0,46.11111111111111,0.06804764270782471,35.199999999999996,55.00000000000001,0.19179582595825195,2023-04-06
94,Crypto Daily™,Tether Accessed US Banks Through Signature Bank,"The stablecoin provider, however, did use the bank&rsquo;s proprietary software to access the U.S. financial system.&nbsp; Signature And Signet Te...",50.0,50.0,81.67008757591248,50.0,50.0,3.710353374481201,2023-04-06
95,CryptoSlate,US Treasury sees ‘potential benefits’ of DeFi following risk assessment,"The US Department of the Treasury has released the world&#8217;s first DeFi Illicit Finance Risk Assessment, which analyzes decentralized finance ...",46.14,50.0,12.591972947120667,46.14,62.5,7.289022207260132,2023-04-06
96,Crypto News Flash,"Bitcoin: Congress introduces ‘Gold Standard Bill’ to stabilize USD value – Can it drive BTC price to $30,000?","Three US lawmakers have introduced the Gold Standard Bill. Should the bill pass, it will make a shift in the economics underpinning the handling o...",67.0,50.0,0.11749565601348877,50.0,50.0,19.165384769439697,2023-04-06
97,Technext,Nigerian crypto foreign investment reaches new low,"Nigerian cryptocurrency foreign investment hits a record low, as it faces a major foreign investment problem despite the&#8230;",38.685,50.189393939393945,0.05588829517364502,20.705000000000002,47.65625,0.11916160583496094,2023-04-06
98,AMBCrypto,"Bitcoin presents a ‘generational investment opportunity,’ but do the whales disagree",Bitcoin&#8217;s price and energy costs indicate a positive outlook for BTC in the long run Large addresses and whales do not share the same sentim...,23.665000000000003,50.0,1.6104161739349365,79.375,54.89448051948052,81.7712277173996,2023-04-06
99,NewsBTC,LUNC: Unveiling Terra Classic NFTs That Could Spark A Price Resurgence,"Terra Classic is a community-run revival of the Terra Luna ecosystem that collapsed in a spectacular fashion in 2022. Since then, LUNC, the ecosys...",61.315,58.333333333333336,99.87646043300629,36.34,69.16666666666667,99.00096654891968,2023-04-06
100,CryptoSlate,Jeremy Hogan: SEC vs. Ripple lawsuit could continue beyond 2026,"Lawyer Jeremy Hogan said the SEC vs. Ripple lawsuit could run beyond 2026, depending on the outcome of the current case. In Nov. 2022, James Filan...",38.685,45.0,8.569341897964478,38.685,47.5,1.3439655303955078,2023-04-06
101,Technext,Forex Trading: A Guide for Beginner Traders by OctaFX,"If you're new to trading, navigating the Forex market can be challenging. However, with thoughtful guidance and resources, you can overcome this h...",50.0,50.0,90.6883180141449,74.695,67.27272727272727,97.77275919914246,2023-04-06
102,Callisto Network,Opening The Callisto Network,"Sometimes you have to remodel a house to expose its real value.To that end, we continue to remodel Callisto Network to expose the hidden value and...",50.0,50.0,99.88743364810944,52.580000000000005,50.83333333333333,97.20918238162994,2023-04-06
103,Seeking Alpha,Binance Australia gets OK for cancellation of its derivatives license,"Binance Australia, a unit of cryptocurrency exchange Binance, got the green light from the Australian Securities and Investments Commission for th...",72.33000000000001,75.0,2.246713638305664,64.8,53.333333333333336,6.473100185394287,2023-04-06
104,The Block,Solana NFT minting costs could get cheaper with new technology,New technology could potentially impact the NFT market and Solana-based web3 projects.,50.0,56.81818181818181,1.670190691947937,50.0,53.40909090909091,95.77834904193878,2023-04-06
105,NEARWEEK,"🗒 Daily Newsletter | Thursday, April 06, 2023",Welcome to another daily digest of what&#39;s been moving in the #NEAR ecosystem on April 06th Check out the highlights below to not miss out on...,50.0,50.0,22.514283657073975,76.685,65.0,97.83848822116852,2023-04-06
106,Crypto News Flash,Is Elon Musk the biggest Dogecoin whale in history and will DOGE be the native currency of Twitter? Report,"If Twitter integrates Dogecoin as a form of payment, over 200 million users could potentially become DOGE customers indirectly. Dogecoin has gaine...",50.0,50.0,0.08987188339233398,50.0,50.0,15.79100489616394,2023-04-06
107,Posschain,Mutual Consensus on Blockchain Sustainability,"Blockchain technology is an exciting new technology with many unexplored potentials. Since the technology’s inception in Bitcoin in 2009, the appl...",50.0,50.0,99.97151792049408,74.695,65.6060606060606,99.93376433849335,2023-04-06
108,Crypto Daily™,Could U.S. anti-crypto stance spread to Europe?,"Now that the U.S. government has fully thrown off the veil and is openly hostile to crypto, could it use its vast power to influence governments i...",50.0,50.0,0.6034046411514282,30.910000000000004,50.0,5.396035313606262,2023-04-06
109,crypto.news,Reddit positions the contracts for Gen 3 NFT avatars on Polygon,"Online chat arena Reddit has announced the deployment of its third-generation NFT avatar agreements on the Polygon network, anticipating the offic...",50.0,50.0,0.02434849739074707,63.660000000000004,50.0,0.25682151317596436,2023-04-06
110,Posschain,Blockchain Universe,The rise of blockchain technology has increased the number of blockchain and cryptocurrency projects on the market. Each project focuses on a spec...,50.0,50.0,81.32928013801575,67.0,50.0,99.98445510864258,2023-04-06
111,"CoinDesk: Bitcoin, Ethereum, Crypto News and Price Data",The Ripple Effect,"Ripple has spent over $100 million fighting the SEC. Financial advisors should pay attention to Ripple’s trial, as it could have significant conse...",50.0,50.0,89.14317488670349,36.34,52.1875,4.607182741165161,2023-04-06
112,"CoinDesk: Bitcoin, Ethereum, Crypto News and Price Data",Ripple's Effect on Financial Advisors,"Ripple has spent over $100 million fighting the SEC. Financial advisors should pay attention to Ripple’s trial, as it could have significant conse...",50.0,50.0,98.80543053150177,36.34,52.1875,4.607182741165161,2023-04-06
113,Decrypt,Magic Eden Bitcoin NFT Launchpad Debuts as Ordinals Total Nears 1 Million,"Interest in Ordinals is going strong, and now NFT marketplace Magic Eden looks to further capitalize on the latest Bitcoin craze.",50.0,62.5,11.091601848602295,84.53999999999999,67.91666666666667,96.76176011562347,2023-04-06
114,AMBCrypto,Shanghai/Shapella Upgrade: Will it sink or swim Ethereum’s market valuation?,"Over 18 million ETH are currently staked, representing over 15% of the entire circulating ETH supply While some metrics pointed to a potential dow...",50.0,50.0,0.027868151664733887,50.0,50.0,75.87177455425262,2023-04-06
115,MOBIXWALLET,Welcome to Dr. Kerem Al's Acupuncture Clinic on the West Coast of Turkey,Experience a new level of natural healing at Dr. Kerem Al&#39;s Acupuncture Clinic in Urla - our newest addition to the MOBIX Market Partnership. ...,72.94,90.0,99.91759657859802,68.06,55.90909090909091,99.98657405376434,2023-04-06
116,crypto.news,"PancakeSwap v3 is live on BNB Chain and Ethereum, could boost presale tokens like digitoads",This article develops on the significance of the PancakeSwap v3 listing and its impact on presale tokens like digitoads (TOADS),81.845,56.81818181818181,94.88452076911926,77.86999999999999,50.0,99.88427758216858,2023-04-06
117,"CoinDesk: Bitcoin, Ethereum, Crypto News and Price Data",Multicoin Leads $4M Strategic Round for Web3 Co-Ownership Platform Lore,"The platform, now in public beta, allows groups of people to share non-fungible tokens (NFT) for expanded access and utility.",50.0,40.0,99.49032962322235,64.8,50.0,95.67556083202362,2023-04-06
118,"CoinDesk: Bitcoin, Ethereum, Crypto News and Price Data",Magic Eden Rolls Out Bitcoin Ordinals NFT Creator Launchpad,"After releasing a Bitcoin NFT marketplace in March, the company is expanding its resources for creators to securely mint their inscriptions before...",50.0,75.0,99.80771243572235,67.0,70.0,95.21258473396301,2023-04-06
119,CryptoSlate,"Bitcoin futures, options markets remain fairly neutral before US jobs report","Quick Take Bitcoin continues to hover around $28,000, with minimal price movement over the past week. Many macro updates have occurred this week, ...",50.0,85.0,7.722252607345581,50.0,56.041666666666664,0.21969377994537354,2023-04-06
120,CoinGape,Breaking: U.S. Treasury Seeks Stricter Regulations On DeFi; Used For Illegal Proceeds,"According to a statement issued by the United States Department of Treasury on Thursday, Decentralized Finance (DeFi) has become the epicenter of ...",28.925,25.0,0.04738271236419678,77.86999999999999,50.0,76.45720839500427,2023-04-06
121,MOBIXWALLET,MOBIX Stories – Pedaling for a Purpose in Munich,"Get to know Thomas M. - the fearless cyclist from Munich who never backs down from a challenge, rain or shine. With MOBIX, he&#39;s revolutionizin...",50.0,50.0,97.37007319927216,75.92,42.22222222222222,99.99577403068542,2023-04-06
122,crypto.ro global,"Revolut launches Crypto Collections, a new way to buy, experience, and learn about cryptos","London, April 6, 2023 – Revolut, the global financial superapp with more than 28 million customers worldwide and 2.7 million in Romania, is taking...",50.0,56.81818181818181,99.95029866695404,50.0,58.333333333333336,96.6428130865097,2023-04-06
123,Bitcoinist,Australian Authority Cancels Binance’s Derivative License,"Australian Securities and Investment Commission (ASIC) have canceled Binance’s derivatives license, a crypto exchange platform that has offered de...",42.345,50.0,0.377693772315979,64.8,50.0,0.05847513675689697,2023-04-06
124,CoinGape,Breaking: SEC Officials Losing Hope In Grayscale Spot Bitcoin ETF Case?,Crypto Market News: After the U.S. Securities and Exchange Commission&#8217;s (SEC) grilling on its decision on the Grayscale spot Bitcoin ETF app...,53.86,45.0,0.059294700622558594,64.8,45.0,0.9191006422042847,2023-04-06
125,Crypto News Flash,Shiba Inu: Billion-$-hotel chain Radisson accepts SHIB as payment method of the future – Report,"Georgia citizens can now make SHIB and crypto payments at the Radisson Hotel through Binance Pay. Binance Pay has partnered with CityPay, for offe...",65.91,50.0,75.5912572145462,39.885,50.0,76.7486184835434,2023-04-06
126,Technext,#SurvivingTerdoo; a new movement that seeks to end the digital culture of voyeurism,This week Twitter users had mixed feelings after different women came online to lament their experience with the&#8230;,50.0,53.40909090909091,96.97892665863037,27.060000000000002,50.0,0.02605617046356201,2023-04-06
127,crypto.news,Coinbase supports legal challenge to US Tornado Cash ban,Crypto exchange Coinbase is throwing its support behind plaintiffs seeking to remove sanctions imposed by the United States government on Tornado ...,46.14,60.0,90.17919301986694,81.845,30.0,95.1388955116272,2023-04-06
128,Micky,FTX Exchange’s collapse jeopardizes $1B in donations for prestigious universities’ projects,"In November 2022, when the collapse of FTX exchange and its philanthropic arm, FTX Future Fund happened, many scholars and researchers were left i...",25.305,50.0,0.011935830116271973,25.305,58.333333333333336,0.20141303539276123,2023-04-06
129,U.Today,Cardano (ADA) Holders Are Going to Be Heavily Rewarded but No Guarantees: Dan Gambardello,"Founder of Crypto Capital Venture remains bullish on ADA, believing in approaching high gains for holders",41.105000000000004,40.0,99.49536323547363,67.0,54.0,0.0561445951461792,2023-04-06
130,Seeking Alpha,Iris Energy lands Buy rating at B. Riley as bitcoin miner scales quickly,B. Riley analyst Lucas Pipes started coverage of Iris Energy (NASDAQ:IREN) with a Buy rating on Thursday as the bitcoin (BTC-USD) miner rapidly sc...,63.660000000000004,66.66666666666666,79.53041791915894,63.660000000000004,50.0,3.9255857467651367,2023-04-06
131,Micky,China Pacific Insurance partners Waterdrip Capital to launch crypto funds,"CPIC Investment Management, a subsidiary of China Pacific Insurance (CPI), has reportedly partnered with investment firm Waterdrip Capital to laun...",50.0,50.0,3.6271780729293823,50.0,40.0,0.06836354732513428,2023-04-06
132,CoinJournal,Jim Cramer on Coinbase stock: ‘I wouldn’t touch this thing at all’,Famed investor Jim Cramer shares his view on Coinbase stock. BofA analyst reiterates his underperform rating on COIN. Coinbase stock is down nearl...,50.0,50.0,0.00010132789611816406,64.8,42.22222222222222,0.12428760528564453,2023-04-06
133,Cointelegraph,Tether supply hits $80B for the first time since May 2022 — stablecoin rivals stumble,"Tether supply across cryptocurrency exchanges has dropped 28% in 2023, however, hinting at an overall decline in demand for stablecoins.",50.0,55.00000000000001,5.786806344985962,43.6,50.0,0.3197133541107178,2023-04-06
134,BlockchainReporter,"Solana Introduces State Compression to Accelerate NFT Storage, Brings Down Minting Cost Further","As the NFT market has witnessed a noticeable rise in the past few years, it attracts a wide range of crypto communities to dive deeper into the se...",50.0,46.11111111111111,99.75591897964478,70.095,40.833333333333336,87.72173523902893,2023-04-06
135,Micky,Will the Credit Suisse bank crisis affect cryptocurrencies?,One topic seems to rule over financial news lately: the presently-unfolding Credit Suisse bank crisis. But what exactly is the problem the Swiss b...,31.94,50.0,0.4414856433868408,17.570000000000004,49.16666666666667,0.16159415245056152,2023-04-06
136,ItsBitcoinWorld,New York Regulator Confirms Crypto Did Not Sink Signature Bank,"On March 5, NYDFS Superintendent Adrienne Harris revealed at a crypto industry conference that crypto was not the reason of the shutdown. Signatur...",50.0,56.81818181818181,7.346856594085693,50.0,50.0,0.11392533779144287,2023-04-06
137,ItsBitcoinWorld,Peru Considering CBDC to Improve Payment System: Former IMF Adviser,"According to John Kiff, research director of the Sovereign Official Digital Association, the Central Reserve Bank of Peru (CRBP) has issued the fi...",72.02,50.0,8.229619264602661,50.0,50.0,0.10887384414672852,2023-04-06
138,ItsBitcoinWorld,"Huobi Is on the Market, But Buyers Shy Away","According to an unidentified source, Binance, the world&#39;s largest cryptocurrency exchange, has turned down an offer to purchase Justin Sun&#39...",31.94,25.0,3.0713289976119995,50.0,42.22222222222222,0.16951560974121094,2023-04-06
139,StrikeX,StrikeX — The RWA Revolution is here….,"The tokenisation of RWAs is becoming a major narrative in the cryptocurrency industry, and here at StrikeX, we are positioning ourselves to be at ...",50.0,50.0,95.04595398902893,50.0,62.81250000000001,99.72366988658905,2023-04-06
140,ItsBitcoinWorld,XRP Leads Altcoin Comeback As Community Cites Ripple’s Feasible Groundbreaking Win In SEC Case,"Santiment, an on-chain market intelligence tool, has turned to Twitter to announce that the Ripple network has achieved a significant comeback thi...",79.295,67.5,99.76699352264404,79.97000000000001,68.75,97.04614877700806,2023-04-06
141,Cointelegraph,North Korea and criminals are using DeFi services for money laundering — US Treasury,"Despite the warnings on DeFi, the Treasury noted that “most money laundering, terrorist financing, and proliferation financing” occurred using fia...",27.98,50.0,2.089551091194153,26.949999999999996,75.0,0.554424524307251,2023-04-06
142,ItsBitcoinWorld,North Carolina County Advances Temporary Crypto Mining Ban,"According to that information, on April 4, the Buncombe County Board of Commissioners approved a one-year ban on cryptocurrency mining. The morato...",22.13,50.0,4.074501991271973,39.885,50.0,0.008606910705566406,2023-04-06
143,Crypto News Flash,Polygon: Billion-$-bank launches BTG Dol stablecoin on MATIC blockchain to serve millions of people and companies,"The largest bank in Latin America has announced the launch of its very first stablecoin. Backed by the U.S. Dollars, the stablecoin will run on th...",50.0,50.0,92.76511669158936,54.675,66.25,17.852187156677246,2023-04-06
144,Micky,Germany embraces crypto: New law allows companies to issue crypto shares,Germany&#8217;s pro-crypto stance continues to gain momentum with the introduction of a new law that allows companies to issue crypto shares.&#160...,64.8,56.81818181818181,81.11253082752228,76.335,56.81818181818181,97.68213331699371,2023-04-06
145,Tokenist,Minting Costs for Solana NFTs Substantially Lowered with New Feature,New state compression technology slashes costs of 1M NFTs on Solana to just $110. The post Minting Costs for Solana NFTs Substantially Lowered wi...,39.97,56.81818181818181,99.93166029453278,30.979999999999997,56.81818181818181,0.725129246711731,2023-04-06
146,ItsBitcoinWorld,"Ethereum’s Upcoming Update Raises Fears Of A Massive Sell-Off, But Is It Justified?","Following its release, Ethereum users were able to withdraw their ETH stakes from the ""Beacon Chain,"" the infrastructure that previously allowed t...",69.59500000000001,60.0,19.14447844028473,50.0,55.55555555555556,0.04514455795288086,2023-04-06
147,ItsBitcoinWorld,"AI Fears Grow as Germany, France, Sweden, and Canada Voice Concerns","OpenAI's ChatGPT release opened a Pandora's box of powerful artificial intelligence, making some nations nervous. Even as they consider laws, it's...",28.925,50.0,1.8797814846038818,79.295,42.5,99.11815524101257,2023-04-06
148,ItsBitcoinWorld,Workout Optimization and Motivation Boost – AI and Crypto Adding Value to Fitness,AI-based fitness applications have become a convenient alternative to traditional training techniques in recent years. The American Geriatrics Soc...,94.035,50.0,99.23157691955566,63.660000000000004,50.0,99.7334748506546,2023-04-06
149,AMBCrypto,DigiToads: Announces stage 1 of presale and consult audit with 20% price hike,The DigiToads project has been making waves in the cryptocurrency world with its recent announcement of selling out stage 1 of the presale and a 2...,50.0,50.0,98.33966195583344,50.0,50.0,97.02622294425964,2023-04-06
150,AMBCrypto,"Criticism forces ArbitrumDAO’s hand as new AIPs, documentation go live",Arbitrum announced changes after receiving negative feedback from the community Daily activity finally surged after the previous slump Over the la...,53.86,56.81818181818181,2.4860262870788574,21.405,44.166666666666664,9.810623526573181,2023-04-06
151,NewsBTC,BNB Remains Under Pressure As Regulators Crack Down On Binance,"BNB, the native currency of the Binance ecosystem, remains under pressure as regulators continue questioning the exchange&#8217;s operations and c...",35.199999999999996,42.22222222222222,5.693721771240234,30.910000000000004,50.0,0.44350624084472656,2023-04-06
152,ItsBitcoinWorld,Arbitrum Foundation Offers Crypto Governance Concessions After ARB Holder Uproar,"With two resolutions aimed at turning the page on last weekend's crypto governance disaster, the Arbitrum Foundation proposed on Wednesday to incr...",50.0,55.00000000000001,95.14491260051727,18.755,50.0,0.1798570156097412,2023-04-06
153,"CoinDesk: Bitcoin, Ethereum, Crypto News and Price Data",Avalanche’s New Subnet to Offer Blockchain Customization for Financial Institutions,The protocol said the subnet will be a suite of institutional blockchain deployments and tooling specifically designed for financial services.,50.0,53.40909090909091,99.74474608898163,50.0,50.0,13.028329610824585,2023-04-06
154,Crypto Daily™,"Japan Embraces Web3, Publishes Whitepaper On Crypto Adoption","In a progressive move towards crypto adoption, Japan's ruling Liberal Democratic Party's Web3 project team has published a whitepaper detailing re...",50.0,50.0,99.53198432922363,50.0,50.0,5.257889628410339,2023-04-06
155,Crypto Daily™,Bitcoin Price Analysis: 27726 Support Tested - 7 April 2023,BTC/USD Tests 27726 on Downside:&nbsp; Sally Ho&rsquo;s Technical Analysis &ndash; 7 April 2023 Bitcoin (BTC/USD) extended its downturn early in t...,70.095,50.0,82.52236545085907,50.0,52.5,0.3237426280975342,2023-04-06
156,Cointelegraph,Avalanche introduces ‘Evergreen’ subnets to connect institutions on blockchain,"Ava Labs has introduced its new Evergreen subnets, aiming to help institutions improve control and intercompany communication on the blockchain.",50.0,50.0,99.42429661750793,84.04,56.81818181818181,99.74404573440552,2023-04-06
157,Cointelegraph,15 ways crypto companies can manage costs in the current economy,Balancing cost-cutting efforts with smart efficiency strategies can help crypto companies weather current macroeconomic conditions.,50.0,50.0,98.61485660076141,89.225,55.35714285714286,99.85246360301971,2023-04-06
158,ItsBitcoinWorld,Arbitrum Poses New Governance Proposals after Community Furor,"The Arbitrum Foundation has issued a slew of additional reform ideas in the aftermath of its first failed effort at governance. Arbitrum, an Ether...",50.0,56.81818181818181,18.41227114200592,24.47,43.75,4.020240902900696,2023-04-06
159,The Block,‘We made close to $1 million’: Inside the murky world of airdrop farming,"Crypto airdrops are again providing big rewards, largely to those gaming the system. That's as long as they don’t get caught.",50.0,50.0,75.50449967384338,73.83500000000001,52.73809523809524,99.57035779953003,2023-04-06
160,CoinGape,Breaking: U.S. Initial Jobless Claims Drop To 228K; Crypto Market Tanks,"According to the weekly statistics that were released by the United States Department of Labor (DOL) on Thursday, there were around 228,000 initia...",36.34,50.0,0.031372904777526855,71.075,50.0,0.8862823247909546,2023-04-06
161,The Block,U.S. Treasury publishes DeFi-focused illicit finance risk assessment,The U.S. Treasury Department published an illicit finance risk assessment report focused specifically on DeFi. ,46.14,50.0,0.8663207292556763,65.91,50.0,0.5525827407836914,2023-04-06
162,Goldenball,♠️ Become Liquidity Share Holder (PancakeswapV3 ) and earn 5% Fee on each transaction ♠️,Golden Ball is the next generation BSC token aiming to improve and bring the online betting &amp; gambling transaction system to a decentralized l...,64.8,50.0,0.13574957847595215,72.02,57.49999999999999,99.90765154361725,2023-04-06
163,Crypto News Flash,Innovation and Long term utility are what make Polygon (MATIC) and RenQ Finance (RENQ) stand out from all the other cryptos,"Cryptocurrencies have come a long way since the inception of Bitcoin in 2009. The digital asset class has seen explosive growth, with new coins an...",69.08999999999999,45.625,99.99159574508667,81.245,51.43939393939394,99.96117949485779,2023-04-06
