,source,title,excerpt,vader_sentiment_title,tb_sentiment_title,flair_sentiment_title,vader_sentiment_excerpt,tb_sentiment_excerpt,flair_sentiment_excerpt,date
0,Crypto Daily™,"NFT Collection Playboy Rabbitars Official Price, Stats, and Review",What is an Playboy Rabbitars Official? Playboy Rabbitars Official are a non-fungible tokens collection built on the Ethereum network launched in 2...,50.0,50.0,99.10869598388672,56.400000000000006,50.0,0.13432204723358154,2023-02-18
1,AMBCrypto,How Polygon’s DeFi space is fueling MATIC’s uptrend,Polygon’s DeFi ecosystem registered growth with multiple new integrations and partnerships. MATIC’s response to these developments was positive an...,50.0,50.0,9.35555100440979,86.75500000000001,56.060606060606055,99.84847009181976,2023-02-18
2,Crypto Daily™,"NFT Collection META KONGZ OFFICIAL Price, Stats, and Review","What is an META KONGZ OFFICIAL? META KONGZ OFFICIAL are a non-fungible tokens collection built on the Ethereum network launched in 12 June, 2022. ...",50.0,50.0,99.39621090888977,56.400000000000006,50.0,1.445278525352478,2023-02-18
3,Crypto Daily™,"NFT Collection The Project URS Price, Stats, and Review","What is an The Project URS? The Project URS are a non-fungible tokens collection built on the Ethereum network launched in 10 September, 2021. 9,9...",50.0,50.0,99.70539212226868,56.400000000000006,50.0,0.017690658569335938,2023-02-18
4,Crypto Daily™,"NFT Collection The Space Bulls TSB Price, Stats, and Review","What is an The Space Bulls TSB? The Space Bulls TSB are a non-fungible tokens collection built on the Ethereum network launched in 6 January, 2022...",50.0,50.0,99.98892843723297,56.400000000000006,50.0,0.04684627056121826,2023-02-18
5,Crypto Daily™,"NFT Collection The Alien Boy Price, Stats, and Review","What is an The Alien Boy? The Alien Boy are a non-fungible tokens collection built on the Ethereum network launched in 12 June, 2021. 9,988 items ...",50.0,37.5,99.8557984828949,56.400000000000006,37.5,0.8092015981674194,2023-02-18
6,Crypto Daily™,"NFT Collection Exosama Price, Stats, and Review","What is an Exosama? Exosama are a non-fungible tokens collection built on the Ethereum network launched in 21 September, 2022. 10,000 items of the...",50.0,50.0,97.77559340000153,56.400000000000006,50.0,23.28893542289734,2023-02-18
7,AMBCrypto,Arbitrum records impressive network growth: What’s coming next?,Arbitrum recorded impressive growth in its DEX trading volume. The daily active users on Arbitrum skyrocketed in February. Arbitrum added another ...,85.48,75.0,99.84113574028015,91.125,64.44444444444444,0.9741067886352539,2023-02-18
8,Crypto Daily™,"NFT Collection Unemployables Price, Stats, and Review","What is an Unemployables? Unemployables are a non-fungible tokens collection built on the Ethereum network launched in 13 April, 2022. 5,000 items...",50.0,50.0,4.695618152618408,56.400000000000006,50.0,13.32135796546936,2023-02-18
9,Crypto Daily™,"NFT Collection Space Poggers Price, Stats, and Review","What is an Space Poggers? Space Poggers are a non-fungible tokens collection built on the Ethereum network launched in 8 August, 2021. 12,418 item...",50.0,50.0,99.9768316745758,56.400000000000006,50.0,2.8266847133636475,2023-02-18
10,Crypto Daily™,"NFT Collection Society of Degenerate Apes (SODA) Price, Stats, and Review",What is an Society of Degenerate Apes (SODA)? Society of Degenerate Apes (SODA) are a non-fungible tokens collection built on the Ethereum network...,50.0,50.0,84.0223103761673,50.0,50.0,0.0367969274520874,2023-02-18
11,Crypto Daily™,"NFT Collection Obits Official Price, Stats, and Review","What is an Obits Official? Obits Official are a non-fungible tokens collection built on the Ethereum network launched in 27 September, 2021. 7,124...",50.0,50.0,22.436726093292236,56.400000000000006,50.0,5.21608293056488,2023-02-18
12,AMBCrypto,What Uniswap’s network growth can teach us about the current market,"Uniswap experiences a sudden drop in network volume as the bulls take a breather. Assessing UNI’s latest demand, where it is headed, and what to e...",69.08999999999999,50.0,99.94043111801147,30.910000000000004,62.5,7.5188905000686646,2023-02-18
13,Cointelegraph,"SEC sues Do Kwon, Paxos ready to litigate, SBF’s VPN: Hodler’s Digest, Feb. 12-18",Top Stories This Week Paxos ‘categorically disagrees’ with the SEC that BUSD is a security The United States Securities and Exchange Commission (S...,68.06,52.5,1.0500133037567139,90.10000000000001,60.0,94.88297402858734,2023-02-18
14,Crypto Daily™,"NFT Collection Space Riders NFT Price, Stats, and Review","What is an Space Riders NFT? Space Riders NFT are a non-fungible tokens collection built on the Ethereum network launched in 17 March, 2022. 8,888...",50.0,50.0,99.99447464942932,56.400000000000006,50.0,11.529302597045898,2023-02-18
15,The Daily Hodl,"SEC Puts Crypto-Friendly Celebrities on Notice, Fines NBA Legend Paul Pierce $1,400,000 for Plugging EthereumMax",The U.S. Securities and Exchange Commission (SEC) has its radar locked on celebrities endorsing crypto projects. The regulator announced on Friday...,50.0,45.0,0.20450353622436523,64.8,45.0,0.30077993869781494,2023-02-18
16,Crypto Daily™,"NFT Collection Bunny Buddies Price, Stats, and Review","What is an Bunny Buddies? Bunny Buddies are a non-fungible tokens collection built on the Ethereum network launched in 21 February, 2022. 8,885 it...",50.0,50.0,99.91995394229889,56.400000000000006,50.0,0.8150458335876465,2023-02-18
17,Crypto Daily™,"NFT Collection Psychedelics Anonymous Component 2 Price, Stats, and Review",What is an Psychedelics Anonymous Component 2? Psychedelics Anonymous Component 2 are a non-fungible tokens collection built on the Ethereum netwo...,50.0,50.0,93.74000132083893,50.0,50.0,0.04951953887939453,2023-02-18
18,Cointelegraph,Platypus to work on compensation plan after $8.5M attack,"According to the DeFi protocol, different parties, including legal enforcement officials, are currently involved in the funds’ recovery process.",26.165,50.0,0.1734018325805664,74.695,53.333333333333336,4.859885573387146,2023-02-18
19,AMBCrypto,Can CAKE sustain its January highs throughout Q1? Analyzing…,PancakeSwap’s January recap highlighted quite a few notable achievements. Price action and on-chain metrics looked bullish for CAKE. PancakeSwap [...,50.0,50.0,8.377665281295776,50.0,56.666666666666664,3.6246508359909058,2023-02-18
20,Crypto Daily™,"NFT Collection HAKI NFT Price, Stats, and Review","What is an HAKI NFT? HAKI NFT are a non-fungible tokens collection built on the Ethereum network launched in 9 April, 2022. 5,000 items of the HAK...",50.0,50.0,99.75003898143768,56.400000000000006,50.0,6.91734254360199,2023-02-18
21,Crypto Daily™,"NFT Collection Hashflow (Official) Price, Stats, and Review","What is an Hashflow (Official)? Hashflow (Official) are a non-fungible tokens collection built on the Ethereum network launched in 15 September, 2...",50.0,50.0,99.32980835437775,56.400000000000006,50.0,0.13036131858825684,2023-02-18
22,Crypto Daily™,"NFT Collection Bullrun Babes Price, Stats, and Review","What is an Bullrun Babes? Bullrun Babes are a non-fungible tokens collection built on the Ethereum network launched in 16 February, 2021. 2,727 it...",50.0,50.0,99.97260868549347,56.400000000000006,50.0,0.1763671636581421,2023-02-18
23,crypto.news,Tyler Winklevoss: US SEC proposed rules recognize Gemini crypto custody platform,"Tyler Winklevoss, the co-founder of Gemini, a cryptocurrency exchange, in a tweet, claims that their crypto custody service is recognized by the U...",50.0,45.0,99.11731779575348,50.0,50.0,0.6655722856521606,2023-02-18
24,BSCnews,Taboo Token Continues to Trend Following Valentine’s Day,Taboo Token continues notable growth into 2023 while aiming for more mainstream success.,50.0,50.0,83.45817625522614,88.175,71.66666666666667,75.46832263469696,2023-02-18
25,AMBCrypto,"Polygon: Short-term investors outperform long-term holders, here’s how","Disclaimer: The information presented does not constitute financial, investment, trading, or other types of advice and is solely the writer’s opin...",50.0,50.0,19.732409715652466,50.0,46.875,0.11563897132873535,2023-02-18
26,Crypto Daily™,"NFT Collection Goblin Grlz Price, Stats, and Review","What is an Goblin Grlz? Goblin Grlz are a non-fungible tokens collection built on the Ethereum network launched in 24 May, 2022. 4,976 items of th...",50.0,50.0,99.89700019359589,56.400000000000006,50.0,16.809657216072083,2023-02-18
27,Crypto Daily™,"NFT Collection Mutant Kongz & G.rilla Official Price, Stats, and Review",What is an Mutant Kongz &amp; G.rilla Official? Mutant Kongz &amp; G.rilla Official are a non-fungible tokens collection built on the Ethereum net...,50.0,50.0,99.91101324558258,50.0,50.0,0.0014603137969970703,2023-02-18
28,BSCnews,Miidas NFT Reveals Mega Airdrop Reward Program,Miidas NFT will share more details about the reward campaign on February 20th.,78.595,50.0,99.36446249485016,85.48,62.5,19.872719049453735,2023-02-18
29,Crypto Daily™,"NFT Collection Ninja Squad Official Price, Stats, and Review","What is an Ninja Squad Official? Ninja Squad Official are a non-fungible tokens collection built on the Ethereum network launched in 19 November, ...",50.0,50.0,99.91392493247986,56.400000000000006,50.0,0.687137246131897,2023-02-18
30,AMBCrypto,Binance USD [BUSD] maintains its peg even as outflow increases,BUSD has been able to maintain the $1 peg despite its FUD. Binance&#8217;s BUSD reserve has declined to around 12.4 billion. The regulatory hammer...,50.0,50.0,94.39590573310852,66.525,75.0,0.46775341033935547,2023-02-18
31,Crypto Daily™,"NFT Collection Notorious Frogs Price, Stats, and Review","What is an Notorious Frogs? Notorious Frogs are a non-fungible tokens collection built on the Ethereum network launched in 8 September, 2021. 10,0...",27.98,50.0,97.03989326953888,17.570000000000004,50.0,0.05677342414855957,2023-02-18
32,ZyCrypto,"Cardano and XRP Massively Overvalued? Pundit Torches ‘Completely Utterly Useless’ ADA, XRP Markets",Drogen torched Cardano’s ADA and Ripple’s XRP as “completely utterly useless” tokens.,50.0,37.5,0.004941225051879883,50.0,25.0,0.001329183578491211,2023-02-18
33,Protos,"The Weekend Shift: Crypto, Apes, and Ordinals","The most interesting reads, podcasts, charts, and opinions from the internet this weekend — curated for you by the Protos newsroom. The post The W...",50.0,50.0,97.98734784126282,72.88,75.0,89.97891545295715,2023-02-18
34,The Daily Hodl,New Research Examines Impact of Incoming Ethereum Update That Will Enable Staked ETH Withdrawals,New research is examining the possible impacts of investors having the ability to withdraw their staked Ethereum (ETH) next month. Binance Researc...,50.0,56.81818181818181,89.558345079422,65.91,52.27272727272727,80.68408966064453,2023-02-18
35,Cointelegraph,"No businesses are for sale, says Blockchain.com",Financial services firm Blockchain.com doesn’t deny recent efforts to raise capital but disputes claims about selling assets.,35.199999999999996,50.0,0.0033855438232421875,34.089999999999996,46.666666666666664,2.351045608520508,2023-02-18
36,Decrypt,"'NFT Art Is Fairly Silly’, Says Casa CTO Jameson Lopp on Bitcoin Ordinals Rise",The rise of Bitcoin NFTs has sparked new outrage within the maximalist community. But for Casa’s CTO it’s time to grow up and move on.,50.0,25.0,0.14292895793914795,35.77,56.81818181818181,90.6935840845108,2023-02-18
37,Decrypt,'NFT Art Is Fairly Silly’ Says Casa CTO Jameson Lopp on Bitcoin Ordinals Rise,The rise of Bitcoin NFTs has sparked new outrage within the maximalist community. But for Casa’s CTO it’s time to grow up and move on.,50.0,25.0,0.23716390132904053,35.77,56.81818181818181,90.6935840845108,2023-02-18
38,Decrypt,DAI Finds Its Spark With Spark Lend,A new lending platform spun up by protocol engineers at MakerDAO is looking to get the decentralized stablecoin DAI into more hands.,71.075,50.0,99.95240867137909,50.0,65.9090909090909,20.10326087474823,2023-02-18
39,Cointelegraph,How the Ordinals movement will benefit the Bitcoin blockchain,"The increasing popularity of Bitcoin NFTs, or Ordinals, will positively impact the Bitcoin network’s security and attract developers to the ecosys...",72.94,50.0,99.2567628622055,94.30000000000001,61.36363636363637,99.9580979347229,2023-02-18
40,Crypto Daily™,"NFT Collection Crazy Lizard Army Price, Stats, and Review","What is an Crazy Lizard Army? Crazy Lizard Army are a non-fungible tokens collection built on the Ethereum network launched in 27 July, 2021. 6,25...",32.99999999999999,20.0,99.35347437858582,24.47,20.0,0.0432819128036499,2023-02-18
41,Crypto Daily™,"NFT Collection Women Tribe NFT Price, Stats, and Review","What is an Women Tribe NFT? Women Tribe NFT are a non-fungible tokens collection built on the Ethereum network launched in 15 February, 2022. 9,99...",50.0,50.0,99.82609152793884,56.400000000000006,50.0,1.1687040328979492,2023-02-18
42,AMBCrypto,Decoding Cardano’s [ADA] weekly report for you to avoid losses,Cardano’s weekly development report went live highlighting the necessary updates. ADA’s performance on both the price and metrics front remained p...,20.029999999999998,50.0,83.28920006752014,50.0,53.40909090909091,11.6708904504776,2023-02-18
43,Crypto Daily™,"NFT Collection Big Cats Official Collection Price, Stats, and Review",What is an Big Cats Official Collection? Big Cats Official Collection are a non-fungible tokens collection built on the Ethereum network launched ...,50.0,50.0,99.7366189956665,56.400000000000006,50.0,0.22678673267364502,2023-02-18
44,Crypto Daily™,Blockchain company NvirWorld signs MOU with World Vision: Donate to the earthquake in Turkey-Syria,"Singapore, Singapore, 18th February, 2023, ChainwireNvirWorld - a blockchain technology innovation company, and World Vision - a non-governmental ...",62.5,50.0,97.95429706573486,77.86999999999999,50.0,96.26030027866364,2023-02-18
45,Crypto Daily™,"NFT Collection Migrating Do not buy Price, Stats, and Review","What is an Migrating Do not buy? Migrating Do not buy are a non-fungible tokens collection built on the Ethereum network launched in 10 December, ...",50.0,50.0,0.012931227684020996,56.400000000000006,50.0,0.0022172927856445312,2023-02-18
46,Crypto Daily™,Bitcoin Price Analysis: Holding 24388 - 19 February 2023,BTC/USD Holding 24388:&nbsp; Sally Ho&rsquo;s Technical Analysis &ndash; 19 February 2023 Bitcoin (BTC/USD) continued to experience reduced upward...,50.0,50.0,93.26539933681488,50.0,50.0,0.39352476596832275,2023-02-18
47,AMBCrypto,"OpenSea makes major changes in its marketplace policy, thanks to Blur","OpenSea slashed marketplace fees temporarily, and royalties were made optional. Its competitor Blur captured almost half of the total volume acros...",72.02,56.56250000000001,93.58749091625214,38.685,45.83333333333333,1.1929064989089966,2023-02-18
48,Cointelegraph,DeFi security: How trustless bridges can help protect users,"Trustless bridges enable cross-chain transfers without needing a centralized custodian, potentially making it a safer option for interoperability.",76.335,50.0,98.03203642368317,43.6,50.0,99.98470544815063,2023-02-18
49,BSCnews,Weekly Article Recap: 2/13-2/17,A recap of notable news from the week.,50.0,50.0,10.425373911857605,50.0,75.0,98.1117993593216,2023-02-18
50,AMBCrypto,TRON traders facing obstacles at $0.07161 can look to book gains here,"Disclaimer: The information presented does not constitute financial, investment, trading, or other types of advice and is solely the writer’s opin...",47.42,47.5,94.85284090042114,50.0,46.875,0.11563897132873535,2023-02-18
51,The Block,"This week in markets: Bitcoin advances, briefly breaks through $25,000",The crypto market broke out of a flat trend from the previous week with Bitcoin reaching an eight-month high.,50.0,50.0,0.3242671489715576,37.5,49.47222222222222,0.020948052406311035,2023-02-18
52,Decrypt,Polygon Labs President Ryan Wyatt: 'The Next Jeff Bezos Will Come From Web3',The former YouTube Gaming head joins Decrypt’s gm podcast to reflect on his path into crypto and how it can all go mainstream.,50.0,50.0,1.5039175748825073,50.0,50.0,79.17226850986481,2023-02-18
53,Cointelegraph,"The economics of cryptocurrency mining: Costs, revenues and market trends",Explore the economics of cryptocurrency mining and the challenges and opportunities that exist in this rapidly evolving industry.,50.0,50.0,98.66293370723724,72.02,50.0,99.98345971107483,2023-02-18
54,Crypto Daily™,"YouTube Appoints New CEO, Sets Out For Web3 Integrations","Roughly over a year after the video platform announced that it is integrating&nbsp;Web3 features into its products, YouTube has announced that it ...",50.0,56.81818181818181,98.20876121520996,50.0,45.0,14.694356918334961,2023-02-18
55,Decrypt,"This Week in Coins: Bitcoin and Ethereum Recover Modestly as Polygon, Filecoin, OKB See Blistering Gains",Crypto also caused a lot of consternation among regulators in Washington this week.,67.0,55.00000000000001,1.0893255472183228,50.0,50.0,0.1828402280807495,2023-02-18
56,Finbold,‘Rich Dad’ R. Kiyosaki responds to billionaire Charlie Munger’s call for Bitcoin ban,"Robert Kiyosaki, a prominent investor and author of the best-selling personal finance book “Rich Dad, Poor Dad,” has shared his … Continued",22.13,68.75,7.4684858322143555,57.655,55.93749999999999,23.114493489265442,2023-02-18
57,BSCnews,Defi Maximizer: Level-Up Your Capital Efficiency,Learn about using the power of Tarot to optimize yields on liquidity pairs from Velodrome. This example boosts earnings from 19.63% to 59.82% APY!,68.06,50.0,98.27955961227417,84.98,50.0,99.97374713420868,2023-02-18
58,AMBCrypto,Terra LUNA Classic [LUNC] Price Prediction 2025-2030: LUNC balances recovery and relapse,Disclaimer: The datasets shared in the following article have been compiled from a set of online resources and do not reflect AMBCrypto’s own rese...,50.0,58.333333333333336,99.76294338703156,67.0,65.0,0.043210387229919434,2023-02-18
59,AMBCrypto,Terra (LUNA) Price Prediction 2025-2030: LUNA oscillates between $2 as…,Disclaimer: The datasets shared in the following article have been compiled from a set of online resources and do not reflect AMBCrypto’s own rese...,50.0,50.0,0.06324946880340576,67.0,65.0,0.043210387229919434,2023-02-18
60,AMBCrypto,"Polkadot (DOT) Price Prediction 2025-2030: DOT pushes past $6, but bears lurk",Disclaimer: The datasets shared in the following article have been compiled from a set of online resources and do not reflect AMBCrypto’s own rese...,35.199999999999996,37.5,0.008088350296020508,67.0,65.0,0.043210387229919434,2023-02-18
61,AMBCrypto,SafeMoon (SFM) Price Prediction 2025-2030: SFM continues to plummet as…,Disclaimer: The datasets shared in the following article have been compiled from a set of online resources and do not reflect AMBCrypto’s own rese...,50.0,50.0,0.26237964630126953,67.0,65.0,0.043210387229919434,2023-02-18
62,AMBCrypto,"Assessing Bitcoin, Ethereum derivative side with changing market dynamics","Bitcoin and ETH derivatives register healthy recovery alongside spot demand. However, demand is still relatively low as traders proceed cautiously...",63.660000000000004,50.0,95.34206092357635,44.865,62.5,8.234649896621704,2023-02-18
63,AMBCrypto,"Solana (SOL) Price Prediction 2025-30: SOL recovers, aims for this level next",Disclaimer: The datasets shared in the following article have been compiled from a set of online resources and do not reflect AMBCrypto’s own rese...,50.0,50.0,92.9375171661377,67.0,65.0,0.043210387229919434,2023-02-18
64,Blockchain News,Alabama Senator Tommy Tuberville reintroduces legislation allowing United States 401k,"Senator Tommy Tuberville proposed legislation to reverse Department of Labor regulation on 401(k) investments, including crypto. (Read More)",71.075,50.0,1.802206039428711,50.0,75.0,1.4550507068634033,2023-02-18
65,Blockchain News,Bankrupt crypto lender Celsius Network has chosen NovaWulf Digital Management as sponsor,Celsius Network submitted a restructuring plan to a U.S. Bankruptcy Court. (Read More),22.13,50.0,0.05748271942138672,50.0,75.0,0.24588704109191895,2023-02-18
66,Blockchain News,The European Commission Announces the Launch of the European Blockchain Regulatory Sandbox,The European Blockchain Regulatory Sandbox helps 20 projects each year obtain legal and regulatory support from the European Commission. (Read More),50.0,50.0,14.893972873687744,85.015,58.75,99.60150718688965,2023-02-18
67,Blockchain News,The identities of the guarantors who signed on as sureties,"Judge Lewis Kaplan approved multiple news outlets' plea to reveal two of Sam Bankman-bail Fried's guarantors, who signed for $200,000 and $500,000...",65.91,50.0,90.18281698226929,71.075,50.0,91.14434719085693,2023-02-18
68,Blockchain News,Hub71+ Digital Assets Initiative Aims to Advance Web3-Based innovations,Hub71 will invest $2 billion in Web3 startups in Abu Dhabi. (Read More),58.894999999999996,50.0,99.92519021034241,50.0,75.0,77.24476754665375,2023-02-18
69,BSCnews,LFGSwap celebrates IDO Success With Massive Giveaway,"LFGSwap is giving the community $10,000 worth of USDT following a massive IDO success. The achievement also illustrates the huge interest in the C...",90.63,57.49999999999999,99.78457391262054,95.31,60.0,99.57468509674072,2023-02-18
70,Cointelegraph,"Bitcoin faces do-or-die weekly, monthly close with macro bull trend at stake",Bitcoin monthly RSI provides a window of hope as BTC bulls battle multiple long-term resistance trend lines in February.,50.0,50.0,2.0083248615264893,53.86,50.0,86.68510317802429,2023-02-18
71,AMBCrypto,Former FTX executive Nishad Singh reportedly plans to plead guilty,Former FTX executive Nishad Singh is reportedly planning to plead guilty to criminal charges. Singh may face separate charges filed by the SEC and...,28.925,37.5,2.1821171045303345,7.224999999999998,37.5,3.2945871353149414,2023-02-18
72,Cointelegraph,"Crypto investors under attack by two new malware, reveals Cisco Talos","Since Dec. 2022, the two malicious files — MortalKombat ransomware and Laplas Clipper malware threats — have been actively scouting the Internet f...",26.165,56.81818181818181,0.0736534595489502,43.6,43.333333333333336,1.715657114982605,2023-02-18
73,Crypto Daily™,Bank Of Russia Set To Roll Out Pilot CBDC As Early As April,"The Bank of Russia is all set to roll out the first consumer pilot of the country&rsquo;s Central Bank Digital Currency (CBDC), with the pilot set...",50.0,55.00000000000001,2.1061480045318604,50.0,54.166666666666664,95.07847726345062,2023-02-18
74,Cointelegraph,"Crypto investors under attack by new malware, reveals Cisco Talos","Since December 2022, the two malicious files — MortalKombat ransomware and Laplas Clipper malware — have been actively scouting the internet and s...",26.165,56.81818181818181,0.09645521640777588,65.91,43.333333333333336,2.019864320755005,2023-02-18
75,AMBCrypto,Stellar (XLM) Price Prediction 2025-30: XLM continues coursing sideways,Disclaimer: The datasets shared in the following article have been compiled from a set of online resources and do not reflect AMBCrypto’s own rese...,50.0,62.5,0.032529234886169434,67.0,65.0,0.043210387229919434,2023-02-18
76,The Block,Biggest crypto stories this past week: Blur airdrop and more SEC action,This past week was another eventful period in the crypto news circuit with sweeping enforcement actions by the SEC and a major airdrop.,50.0,53.125,0.38645267486572266,50.0,45.208333333333336,95.09672522544861,2023-02-18
77,AMBCrypto,"Shiba Inu Coin (SHIB) Price Prediction 2025-2030: Despite bullish intent, SHIB havers",Disclaimer: The datasets shared in the following article have been compiled from a set of online resources and do not reflect AMBCrypto’s own rese...,50.0,50.0,0.05208849906921387,67.0,65.0,0.043210387229919434,2023-02-18
78,crypto.news,Binance CEO says crypto exchange will withdraw from potential US investments,"As US financial regulators intensify their crackdown on crypto companies, Binance CEO Changpeng ""CZ"" Zhao has stated that his company will hold of...",50.0,50.0,0.010630488395690918,50.0,50.0,23.861151933670044,2023-02-18
79,Bitcoinist,Bitcoin Price Consolidates After Failing To Break Through Key Resistance Level,"Bitcoin price is consolidating after finding strong resistance at the $25,000 level. This year, the primary cryptocurrency&#8217;s price resurgenc...",24.47,50.0,0.0015735626220703125,75.53,70.83333333333333,99.90948140621185,2023-02-18
80,AMBCrypto,Dogecoin (DOGE) Price Prediction 2025-2030: Will DOGE break out of Musk’s shadow?,Disclaimer: The datasets shared in the following article have been compiled from a set of online resources and do not reflect AMBCrypto’s own rese...,50.0,50.0,79.35078740119934,67.0,65.0,0.043210387229919434,2023-02-18
81,Blockchain News,Former Tmon CEO faces arrest for taking bribes to promote Terra Classic,"According to South Korean authorities, advertising raised the price of Terra Classic token LUNC. (Read More)",52.580000000000005,51.94444444444445,0.42288899421691895,50.0,66.66666666666666,0.009015202522277832,2023-02-18
82,crypto.news,Jump Trading is the center of the ongoing SEC-Terra suit,"Jump Trading is the masked ""U.S. trading firm"" that the United States Securities and Exchange Commission (SEC) accused of helping sustain the Terr...",50.0,45.0,2.3746877908706665,80.62,42.5,0.5659520626068115,2023-02-18
83,Blockchain News,El Salvador is Opening a Bitcoin Embassy in the United States,"El Salvador, the first nation to legalize Bitcoin, is opening a Texas Bitcoin Embassy to promote BTC. (Read More)",71.075,50.0,3.449171781539917,69.08999999999999,68.75,1.0372251272201538,2023-02-18
