,source,title,excerpt,vader_sentiment_title,tb_sentiment_title,flair_sentiment_title,vader_sentiment_excerpt,tb_sentiment_excerpt,flair_sentiment_excerpt,date
0,NewsBTC,"Aptos (APT) Gains 55% In 24 Hours, Maintaining Its Bullish Form For The Year","The crypto market has been remarkably bullish since the turn of the new year. In the last three weeks, several assets have experienced price ralli...",67.0,80.0,98.23699295520782,58.894999999999996,66.86363636363637,0.0015497207641601562,2023-01-21
1,BSCnews,A Look at Pi Network’s Background,Pi Network was initiated following the team’s plans to give users blockchain accessibility and wide distribution of cryptocurrency.,50.0,50.0,99.56180453300476,50.0,47.5,99.79726374149323,2023-01-21
2,Cointelegraph,"Genesis files for bankruptcy, FTX explores a reboot, and Bitzlato news: Hodler’s Digest: Jan. 15-21",,50.0,50.0,9.493517875671387,50.0,50.0,0.0,2023-01-21
3,CoinGape,DOGE Fan Elon Musk Announces New Feature For Twitter,"On Saturday, Elon Musk tweeted that his recently acquired Twitter would provide a new but &#8220;higher priced&#8221; Blue subscription that will ...",65.91,56.81818181818181,86.11460328102112,50.0,52.27272727272727,0.6948083639144897,2023-01-21
4,BSCnews,Bubblemaps Analyzes 10% of Shiba Token Wallets Worth Over $1 Billion,Let's see how these thirteen wallets came to hold 10% of the $SHIB supply with the help of Bubblemaps.,61.315,65.0,8.490124344825745,70.095,50.0,24.73348081111908,2023-01-21
5,AMBCrypto,"Bitcoin hits four-month high as whales step in, but is there trouble incoming?","Addresses holding 1,000-10,000 BTC have been stepping up in the accumulation. BTC price hit over $22,000, the first time in four months. Several i...",22.504999999999995,49.0,0.22040903568267822,50.0,56.25,0.0019073486328125,2023-01-21
6,CoinGape,"Bitcoin, Ethereum Price Prediction- Will They Extend Price Recovery For The Coming Week?","Bitcoin, Ethereum price prediction: the market leaders, Bitcoin and Ethereum, showed sluggish price behavior earlier this week. With no significan...",58.894999999999996,50.0,0.055655837059020996,20.029999999999998,50.0,0.0003159046173095703,2023-01-21
7,AMBCrypto,Filecoin remained in investors’ favor with these updates: Will FIL rally?,"Chainstack collaborated with Filecoin for the FVM Space Warp Initiative. Market indicators were bullish, while the metrics supported the sellers. ...",70.095,50.0,0.04781186580657959,65.91,50.0,2.639228105545044,2023-01-21
8,BSCnews,Electric Capital Developer Report: Crypto Only Has 23k Active Developers,Developer communities across the blockchain indsutry continued to grow in 2022 and pushed the building emphasis in the bear market.,70.095,46.666666666666664,0.1739501953125,50.0,50.0,95.80274522304535,2023-01-21
9,U.Today,"2.5 Trillion Shiba Inu (SHIB) Grabbed by Top Whales Overnight, Here's What Happened",SHIB whales continue aggressive accumulation of their favorite meme cryptocurrency,60.114999999999995,75.0,0.8175909519195557,67.0,75.0,0.21378397941589355,2023-01-21
10,ZyCrypto,"XRP Lawsuit: Ripple Will Emerge Victorious In Case With SEC, Attorney Explains Why",XRP adherents remain confident that Ripple will trump the US Securities and Exchange Commission (SEC) in the ongoing legal brawl.,38.685,45.0,99.78010058403015,85.48,60.0,86.08213365077972,2023-01-21
11,CoinGape,This Bullish Pattern Sets Solana Coin Price To Hit $38.5; Buy Now?,"The Solana coin price has witnessed a remarkable recovery since the beginning of the new year. Within the past three weeks, the coin price surged ...",50.0,50.0,0.6383240222930908,77.86999999999999,60.60606060606061,98.8443911075592,2023-01-21
12,The Daily Hodl,"Miami Mayor Is Still Receiving Bitcoin Paychecks, Says His Salary ‘Is Actually Up’ Despite Ongoing Crypto Winter",Miami Mayor Francisco Suarez says he’s still receiving his paychecks in Bitcoin (BTC) despite the king crypto’s precipitous fall from all-time hig...,50.0,50.0,0.44014453887939453,50.0,50.0,10.524150729179382,2023-01-21
13,The Block,"This week in markets: bitcoin climbs, Coinbase stock shrugs off Moody’s downgrade","Bitcoin jumped over $23,000 going into the weekend.",50.0,50.0,17.731907963752747,50.0,50.0,0.5982786417007446,2023-01-21
14,CryptoGlobe,Bitcoin Up 34% Since Jim Cramer Said It Was a Good Time ‘To Get Out of Crypto’,"Former hedge fund manager Jim Cramer has not been having much luck with his buy and sell calls on crypto, and his latest one has not been any diff...",72.02,85.0,0.7865548133850098,72.94,61.66666666666667,0.08258819580078125,2023-01-21
15,AMBCrypto,"GMX retains spot as the leading protocol on Arbitrum, here’s why",GMX has the highest TVL on Arbitrum. Its native token might see a price drawdown with buyers&#8217; starting to experience exhaustion. Despite the...,50.0,50.0,99.79663789272308,31.94,50.0,0.005942583084106445,2023-01-21
16,BSCnews,Boink Social Experiment Comes to BNB Chain,The new social experiment awards users for tweeting about BNB Chain NFTs. Can it build the hype it needs?,50.0,51.66666666666667,83.70231986045837,72.94,54.24242424242425,0.7666826248168945,2023-01-21
17,ZyCrypto,Cardano Is Buzzing With Super Bullish Activity As ADA Adoption Expands To New Realms,"Cardano’s ADA is one of the major cryptocurrencies that led gains this week, rising 9% to an intraday high of $0.377 with weekly gains of 22%, per...",82.43,61.74242424242424,1.298213005065918,79.295,55.5625,99.70279932022095,2023-01-21
18,AMBCrypto,Hedera [HBAR] prices increase as on-chain metrics rise… Details inside,HBAR saw a 100% increase in volume as stocks rose. HBAR&#8217;s recent price movement represents its highest in four months. The price of Hedera [...,65.91,50.0,86.34526431560516,65.91,65.0,98.85371029376984,2023-01-21
19,BSCnews,Rinse and Repeat: Venture-Based Money Laundering in Web3,Learn key takeaways from CertiK's expert about how to maintain financial integrity as a Web3 entity.,50.0,50.0,0.8006811141967773,69.08999999999999,50.0,99.57112967967987,2023-01-21
20,Cointelegraph,U.S. home-loan banks lent billions of dollars to crypto banks: Report,Signature Bank and Silvergate reportedly borrowed over $13 billion from the federal home loan system.,50.0,50.0,0.9033858776092529,50.0,50.0,4.649946093559265,2023-01-21
21,AMBCrypto,PancakeSwap: Decoding what lies ahead for CAKE holders in long term,CAKE’s price increased by 5% in the last 24 hours. Metrics looked bearish while the market indicators supported the bulls. PancakeSwap [CAKE] rece...,28.925,47.5,99.84893202781677,76.335,50.0,0.00438690185546875,2023-01-21
22,Cryptonews,"UAE Minister Says Crypto Will Play a ""Major Role for UAE Trade Going Forward""","The United Arab Emirates plans to use crypto for trade in the future and also set up a working regulatory framework, according to the country's mi...",67.0,53.125,7.980015873908997,71.075,50.0,5.47233521938324,2023-01-21
23,BSCnews,Wen Solana? Wen Helium? Latest Updates on Migration Set for Q1,The Helium Foundation said in an AMA that the IoT platform's migration to Solana is still on track for the first quarter of 2023.,50.0,75.0,0.12439489364624023,50.0,62.5,96.16405367851257,2023-01-21
24,CoinGape,Here’s Why Sandbox Coin Could Hit $1 In Coming Weeks,"On January 17th, the Sandbox coin price gave a massive breakout from the long coming resistance trendline of the parallel channel pattern. In theo...",50.0,50.0,0.011578202247619629,50.0,49.166666666666664,0.05239248275756836,2023-01-21
25,AMBCrypto,Assessing Fantom’s new vault launch and its effects on FTM,"Fantom launched an Ecosystem Vault on 20 January. FTM has seen increased demand since the beginning of the year. Fantom [FTM], the open-source sma...",50.0,56.81818181818181,99.9820351600647,63.660000000000004,50.0,98.42807352542877,2023-01-21
26,Decrypt,Hot DAO Time Machine,A Ukrainian entrepreneur is trying to use a DAO to fund a Thai professor’s design for a time machine.,50.0,62.5,98.5711395740509,50.0,50.0,0.43779611587524414,2023-01-21
27,CryptoSlate,"Bitcoin up 50% from bear market low outperforming SPY, Gold","The bear market rally that perplexed much of the crypto industry continued into the weekend as Bitcoin hit $23,230 for the first time since August...",36.34,50.0,90.7401591539383,34.089999999999996,64.16666666666667,2.6272475719451904,2023-01-21
28,Crypto Daily™,Bitcoin Price Analysis: 23300 Objective Tested - 22 January 2023,BTC/USD Near 5-Month Highs:&nbsp; Sally Ho&rsquo;s Technical Analysis &ndash; 22 January 2023 Bitcoin (BTC/USD) continued its recent strong apprec...,50.0,50.0,2.370724081993103,75.53,56.666666666666664,84.2767983675003,2023-01-21
29,Trustnodes,Ethereum’s Ratio Dives,"The ping pong is back with bitcoin taking the show from ethereum, sending the ratio down by 0.005 BTC, or $114.",50.0,50.0,0.03943443298339844,50.0,46.11111111111111,0.013062357902526855,2023-01-21
30,Cointelegraph,Bitcoin due new 'big rally' as RSI copies 2018 bear market recovery,"There is plenty to be optimistic about when it comes to further BTC price gains, RSI analysis concludes.",50.0,50.189393939393945,94.36543583869934,78.595,50.0,89.7384762763977,2023-01-21
31,U.Today,Cardano (ADA) Might Become 10x More Resource-efficient With This Release,New programming language Aiken is set to make Cardano (ADA) development more efficient than ever before,50.0,75.0,0.5763500928878784,73.77,65.9090909090909,99.95972812175751,2023-01-21
32,BSCnews,Keter Network AI-Powered Blockchain: Revolutionizing the Future of Secure Transactions,"With the presale already in its second stage, the Keter Network currency (KTR) offers user benefits such as token staking, NFT farming, and more.",67.0,60.0,99.9815046787262,69.08999999999999,57.49999999999999,99.7475266456604,2023-01-21
33,CoinGape,"After Bitcoin’s Surge to $23K, Can Ethereum (ETH) Price Hit $2000?","Over the course of the past three weeks, the price of Ethereum (ETH) has seen a meteoric rise. Despite the fact that are a few bearish indications...",50.0,50.0,0.01913309097290039,50.0,38.75,0.08785724639892578,2023-01-21
34,The Daily Hodl,"Ripple CTO Weighs In on Upcoming Ruling in SEC Lawsuit, Says XRP Fits the Definition of a ‘Commodity’",Ripple’s chief technology officer David Schwartz says the company’s XRP token is a “commodity” despite an ongoing legal dispute over its status. S...,38.685,45.0,99.82531368732452,26.43,60.0,79.05435562133789,2023-01-21
35,AMBCrypto,"Litecoin attempts to steal Bitcoin’s thunder, but a pullback might be in the works","Litecoin may be headed for a cliff as price to RSI divergence manifests. LTC metrics still highlight strong demand, but some whales are taking pro...",36.34,50.0,0.3625422716140747,69.08999999999999,71.66666666666667,2.7746975421905518,2023-01-21
36,U.Today,"Bitcoin (BTC) Price Over $23,300, but Market Is Not Overheated, Two Indicators Say","Dan Lim, seasoned trader and author on CryptoQuant analytical platform, is sure that Bitcoin (BTC) is not oversold yet",50.0,50.0,83.64996910095215,65.91,68.75,98.2897400856018,2023-01-21
37,CryptoSlate,Differentiating Bitcoin from the rest of the crypto market: Part 1,"Initially, the term “crypto asset” meant bitcoin and nothing else. The post Differentiating Bitcoin from the rest of the crypto market: Part 1 ap...",50.0,50.0,99.91406798362732,50.0,50.0,97.95832931995392,2023-01-21
38,CoinGape,"Race Between XRP, ADA Among Top 100 BSC Whales Getting Intense","XRP News: Ripple’s native crypto, XRP community and Cardano founder Charles Hoskinson have been involved in a Twitter banter over the US SEC Vs Ri...",63.660000000000004,67.5,99.96247589588165,50.0,45.0,0.8140265941619873,2023-01-21
39,CoinGape,Can This New Bullish Pattern Prolong Price Recovery In MANA?,"Following a brief break earlier week, the bullish momentum continues of the majority of major cryptocurrencies. As a result, the MANA coin price r...",50.0,56.81818181818181,0.6487667560577393,50.0,50.78125,0.1308530569076538,2023-01-21
40,AMBCrypto,Algorand (ALGO) Price Prediction 2025-2030: ALGO holders can go long if…,Disclaimer: The datasets shared in the following article have been compiled from a set of online resources and do not reflect AMBCrypto’s own rese...,50.0,47.5,99.76524114608765,67.0,65.0,0.043210387229919434,2023-01-21
41,Crypto Daily™,TABOO Kick Starts the Bull Market with a 300% Price Increase,"Amidst mutterings of the crypto market starting it&rsquo;s road to recovery in 2023, following one of the worst downturns in many years, some toke...",65.91,50.0,78.41263711452484,18.755,43.75,1.6097307205200195,2023-01-21
42,Trustnodes,Bitcoin Breaks Through the 200-Day Moving Average,"Bitcoin has crossed $23,000 and for the first time in a year, it has also risen above the 200-day moving average.",50.0,42.5,0.08998513221740723,50.0,51.66666666666667,7.895451784133911,2023-01-21
43,NewsBTC,"Bitcoin Hits $23,000 As Crypto Market Cap Revisits $1 Trillion Mark","Bitcoin, the king of cryptocurrencies, has been crossing multiple crucial resistances since the start of the year. According to CoinGecko, the coi...",50.0,50.0,1.4066427946090698,50.0,50.0,1.4992177486419678,2023-01-21
44,BSCnews,Weekly Article Recap: 1/16-1/20,A recap of notable news from the week.,50.0,50.0,81.08275234699249,50.0,75.0,98.1117993593216,2023-01-21
45,AMBCrypto,Polygon: Are more gains likely for long-term MATIC holders?,"Disclaimer: The information presented does not constitute financial, investment, trading, or other types of advice and is solely the writer’s opin...",70.025,62.5,0.46226680278778076,50.0,46.875,0.11563897132873535,2023-01-21
46,Decrypt,$4.6 Billion in Ethereum Up in Flames Since EIP-1559,"NFT and DeFi on the Ethereum network, in particular via OpenSea and Uniswap, are fueling the fire of ETH burning.",50.0,50.0,0.1449793577194214,32.99999999999999,58.333333333333336,13.88670802116394,2023-01-21
47,AMBCrypto,"Ethereum (ETH) Price Prediction 2025-2030: Will ETH cross $3,000 soon?",Disclaimer: The datasets shared in the following article have been compiled from a set of online resources and do not reflect AMBCrypto’s own rese...,50.0,50.0,2.6153236627578735,67.0,65.0,0.043210387229919434,2023-01-21
48,CoinGape,"Miami Mayor Gets Salary In Bitcoin, Know More",,50.0,75.0,11.255991458892822,50.0,50.0,0.0,2023-01-21
49,Cointelegraph,Going cashless: Norway's digital currency project raises privacy questions,"At this point, the test network for the Norwegian CBDC uses not the public Ethereum ecosystem, but a private version of the enter...",50.0,50.0,78.41249406337738,50.0,50.0,16.25632345676422,2023-01-21
50,U.Today,"Cardano DEX, Djed Stablecoin Builder Hint at Major Announcement",Users took turns trying to guess what big announcement it is,50.0,53.125,21.636280417442322,50.0,50.0,0.15232563018798828,2023-01-21
51,Decrypt,"This Week in Coins: Bitcoin and Ethereum Rise, Solana Rises Most","All of the top 20 coins were in the green again—and nothing rose bigger than Solana, which is rebounding from its FTX-triggered losses.",50.0,75.0,80.31313717365265,38.685,61.25000000000001,0.0022292137145996094,2023-01-21
52,AMBCrypto,Bitcoin (BTC) Price Prediction 2025-2030: What BTC holders should keep in mind,Disclaimer: The datasets shared in the following article have been compiled from a set of online resources and do not reflect AMBCrypto’s own rese...,50.0,50.0,99.11254346370697,67.0,65.0,0.043210387229919434,2023-01-21
53,AMBCrypto,BNB Chain records solid network growth; but why should investors stay wary?,Daily active users on the BNB chain eclipsed other popular chains. The number of dApps integrated into BNB was the highest among all chains. Binan...,63.660000000000004,37.5,89.19598460197449,85.015,54.270833333333336,99.6638685464859,2023-01-21
54,NewsBTC,What Is SingularityNET And Why Is Its AGIX Token Exploding By 116%?,The popularity of artificial intelligence applications has been growing as popular platforms like SingularityNET and ChatGPT become mainstream. Wi...,50.0,50.0,0.022336840629577637,95.21,50.0,99.83250796794891,2023-01-21
55,Protos,"The Weekend Shift: Bitcoin, Bankruptcy, Bored Apes","The most interesting reads, podcasts, charts, and opinions from the internet this weekend — curated for you by the Protos newsroom. The post The W...",36.34,25.0,0.008356571197509766,72.88,75.0,89.97891545295715,2023-01-21
56,AMBCrypto,Cardano (ADA) Price Prediction 2025-2030: Can ADA holders buy a LAMBO in 2030?,Disclaimer: The datasets shared in the following article have been compiled from a set of online resources and do not reflect AMBCrypto’s own rese...,50.0,50.0,3.329363465309143,67.0,65.0,0.043210387229919434,2023-01-21
57,Bitcoinist,CoinDesk Might Have Cardano Founder Charles Hoskinson As Potential Buyer,"Charles Hoskinson, co-founder of the blockchain network Cardano, is interested in purchasing CoinDesk, DCG&#8217;s media arm, despite the company&...",50.0,50.0,0.7929354906082153,70.095,62.5,0.06488561630249023,2023-01-21
58,CoinGape,XRP Lawyer John Deaton Responds To Jim Cramer Tweet,,50.0,50.0,0.048667192459106445,50.0,50.0,0.0,2023-01-21
59,AMBCrypto,Binance Coin (BNB) Price Prediction 2025-2030: What could be in store for BNB?,Disclaimer: The datasets shared in the following article have been compiled from a set of online resources and do not reflect AMBCrypto’s own rese...,50.0,50.0,21.94540500640869,67.0,65.0,0.043210387229919434,2023-01-21
60,CryptoSlate,"How the top 5 AI tokens, AGIX, FET, OCEAN, RLC, and NMR fared during 2022","Artificial Intelligence (AI) crypto tokens are riding a wave of interest that began with the release of chatbot ChatGPT, which has captured the im...",60.114999999999995,75.0,23.02703857421875,86.345,20.0,92.29671657085419,2023-01-21
61,AMBCrypto,"Crypto will have a major role to play in UAE, believes Foreign Trade Minister",UAE&#8217;s Minister of State for Foreign Trade believed that crypto was the way forward for the country. The country could become the next hub fo...,67.0,48.4375,96.5658187866211,50.0,46.875,91.82209074497223,2023-01-21
62,AMBCrypto,Ripple (XRP) Price Prediction 2025-2030: XRP to the moon next?,Disclaimer: The datasets shared in the following article have been compiled from a set of online resources and do not reflect AMBCrypto’s own rese...,50.0,50.0,5.930006504058838,67.0,65.0,0.043210387229919434,2023-01-21
63,Crypto Daily™,The next bull market leaves base camp,"It&rsquo;s certainly not official, but the green shoots of the beginning of a new crypto bull market are beginning to be seen. The FUDish news has...",50.0,30.0,1.2843281030654907,58.894999999999996,47.15367965367965,0.3028959035873413,2023-01-21
64,CryptoSlate,Nearly $400M in crypto liquidations over 24 hours pushes Bitcoin above $23k,Quick Take: The crypto market has recorded nearly $400 million in liquidations in the past 24 hours. The post Nearly $400M in crypto liquidations...,50.0,52.5,0.029218196868896484,50.0,53.541666666666664,2.9075682163238525,2023-01-21
65,The Block,"Bitcoin briefly hits $23,000, remains at highest point since August",The largest cryptocurrency has rallied since the start of the year as a slightly more optimistic macro picture has emerged.  ...,50.0,50.0,2.353617548942566,66.07000000000001,75.0,99.65897798538208,2023-01-21
66,CoinGape,5 Top Stable Coins To Add To Your Portfolio This Week,Many investors are being saved by stablecoins from the almost inevitable volatility of the cryptocurrency market. Investors buy stable coins every...,72.94,75.0,99.96403157711029,80.62,62.5,2.375149726867676,2023-01-21
67,CryptoSlate,Crypto bank Silvergate reveals $2.5M exposure to Genesis,"Silvergate Capital, the parent company of Silvergate Bank, revealed limited exposure to Genesis Global Capital in a press release published on Jan...",50.0,50.0,0.2905607223510742,38.685,48.214285714285715,0.5979746580123901,2023-01-21
68,CoinGape,Top 7 Metaverse Crypto Projects With Long-Term Growth Potential,"In the year 2022, the metaverse caused a stir in the technical world. Many investors are betting on metaverse crypto projects in order to be part ...",76.335,62.5,99.98800456523895,50.0,62.5,75.31913816928864,2023-01-21
69,The Block,"Three biggest crypto stories from past week; 3AC founders raise, Genesis collapses",Crypto world drama continued this week with a number of high profile announcements and market-shifting moves. ,35.199999999999996,37.5,0.10399520397186279,53.86,57.99999999999999,86.46863102912903,2023-01-21
70,CoinGape,Crypto Lunar: 3 Crypto Gift Ideas For The Chinese New Year,"We’re fast approaching Chinese New Year, and that means the hunt for the perfect gift is on. If there are chances that you know someone who would ...",72.02,60.60606060606061,99.91041421890259,90.63,63.36363636363637,97.46638536453247,2023-01-21
71,Bitcoinist,UAE Sees Key Role For Crypto As Gulf State Eyes To Boost Trading Policies,"The United Arab Emirates (UAE) is looking to adopt cryptocurrency in a ‘major role’ in its trading policies, according to a report by Bloomberg. S...",70.095,50.0,93.01162660121918,77.115,53.125,9.25789475440979,2023-01-21
72,Bitcoinist,Is Bitcoin A ‘Fraud’ And ‘Pet Rock?’ JPMorgan CEO Jamie Dimon Says So,"Despite the prolonged crypto winter, proponents of cryptocurrencies are bullish about the industry&#8217;s prospects. And so far this year, they h...",50.0,50.0,0.04810690879821777,64.8,55.00000000000001,0.09828507900238037,2023-01-21
73,CoinGape,"Bitcoin Price Crosses 23K Mark, Will It Continue To Rally?",,50.0,50.0,0.1723170280456543,50.0,50.0,0.0,2023-01-21
74,Crypto Daily™,Mango Markets Hacker Charged With Manipulating Price Of Security,The American Securities and Exchange Commission (SEC) has charged Avraham Eisenberg with fraud and market manipulation. Eisenberg is also facing c...,38.685,50.0,2.694171667098999,15.960000000000003,47.5,0.12997984886169434,2023-01-21
75,AMBCrypto,TABOO kick starts the bull market with a 300% price increase,"Amidst mutterings of the crypto market starting its road to recovery in 2023, following one of the worst downturns in many years, some tokens have...",65.91,50.0,78.41263711452484,18.755,43.75,4.959884285926819,2023-01-21
76,AMBCrypto,Terra LUNA Classic [LUNC] Price Prediction 2025-2030: LUNC bad days are…,Disclaimer: The datasets shared in the following article have been compiled from a set of online resources and do not reflect AMBCrypto’s own rese...,22.884999999999998,36.66666666666667,82.99496471881866,67.0,65.0,0.043210387229919434,2023-01-21
77,Bitcoinist,,"Despite the prolonged crypto winter, proponents of cryptocurrencies are bullish about the industry&#8217;s prospects. And so far this year, they h...",50.0,50.0,0.0,64.8,55.00000000000001,0.09828507900238037,2023-01-21
78,CoinGape,"XRP Lawsuit: Can Judge Deny Both Ripple, SEC Summary Judgment Motion?","XRP lawsuit News: As the US SEC Vs Ripple lawsuit is waiting for the summary judgment, the crypto community anticipating several outcomes from the...",24.47,45.0,1.418796181678772,28.925,47.5,90.56364893913269,2023-01-21
79,CoinGape,"CFTC Needs More Power Over Crypto, Says Commissioner",,50.0,75.0,0.5311161279678345,50.0,50.0,0.0,2023-01-21
80,The Block,How Decentraland leaders giving money to Genesis completed a flow of capital,A significant amount of capital that started flowing when DCG invested into Decentraland appears to have more or less come full circl...,67.0,50.0,86.73395216464996,60.114999999999995,63.22916666666667,7.91395902633667,2023-01-21
81,AMBCrypto,Terra (LUNA) Price Prediction 2025-2030: Will shorting LUNA work for you?,Disclaimer: The datasets shared in the following article have been compiled from a set of online resources and do not reflect AMBCrypto’s own rese...,50.0,50.0,2.305424213409424,67.0,65.0,0.043210387229919434,2023-01-21
82,CoinGape,Union Budget 2023 Income Tax: 30% Crypto Tax Imposition Had Adverse Impact,Union Budget 2023: A unique gem in the Indian fintech landscape is cryptocurrency. India has rarely been successful in creating and growing local ...,31.94,50.0,0.00413060188293457,47.78,67.8125,24.233701825141907,2023-01-21
83,AMBCrypto,Algorand’s new announcement raises hopes of move to DeFi… Details inside,"Algorand embraced a new self-custody exchange as part of a deeper focus on DeFi. ALGO bulls regained control, but the stakes remained high as dire...",71.075,56.81818181818181,24.709081649780273,50.0,57.40909090909091,0.02917647361755371,2023-01-21
84,Cointelegraph,"Dead cat bounce? Bitcoin price nears $23,000 in fresh 5-month high","Bitcoin is not far from reclaiming its 200-week moving average, but traders are still highly suspicious of the bullish BTC price ...",27.060000000000002,54.333333333333336,0.0007390975952148438,21.48,49.333333333333336,0.056862831115722656,2023-01-21
85,AMBCrypto,Polkadot (DOT) Price Prediction 2025-2030: DOT bears at bay?,Disclaimer: The datasets shared in the following article have been compiled from a set of online resources and do not reflect AMBCrypto’s own rese...,50.0,50.0,0.33704042434692383,67.0,65.0,0.043210387229919434,2023-01-21
86,Bitcoinist,"Dogecoin Cuts CO2 Emissions By 25%, Becomes 3rd Fastest Crypto At Slashing Carbon Footprint","As a result of the coordinated efforts of chain developers and billionaire Elon Musk, the annual carbon emissions of Dogecoin decreased by around ...",24.47,50.0,91.36155545711517,50.0,30.0,1.1551707983016968,2023-01-21
87,AMBCrypto,SafeMoon (SFM) Price Prediction 2025-2030: Going long on SFM?,Disclaimer: The datasets shared in the following article have been compiled from a set of online resources and do not reflect AMBCrypto’s own rese...,50.0,47.5,24.101322889328003,67.0,65.0,0.043210387229919434,2023-01-21
