,source,title,excerpt,vader_sentiment_title,tb_sentiment_title,flair_sentiment_title,vader_sentiment_excerpt,tb_sentiment_excerpt,flair_sentiment_excerpt,date
164,"CoinDesk: Bitcoin, Ethereum, Crypto News and Price Data",Lido Stakers Can Expect Ether Withdrawals 'No Sooner Than Early May',"Lido needs to prepare the launch of its V2 testnet and finalize for the completion of several ongoing security audits of its V2 upgrade, before en...",35.199999999999996,55.00000000000001,0.0096052885055542,67.0,50.0,2.6568174362182617,2023-04-06
165,Technext,Ghanaian Uber and Bolt drivers decry ‘sudden and forceful’ digital transport tax,"Regulation is not necessarily bad. In Africa, however, regulation has become synonymous with extortion, taxation and revenue generation...",50.0,50.0,0.9441465139389038,71.55,67.5,85.33464074134827,2023-04-06
166,Crypto Daily™,"Regulatory Crackdown Pushes Up DEX Volume, Crypto Daily TV 6/4/2023",In Todays Headline TV CryptoDaily News:Decentralized exchanges had most volume in 10 months.Decentralized exchanges had a large jump in cryptocurr...,50.0,50.0,6.301864981651306,50.0,67.85714285714286,79.36618328094482,2023-04-06
167,Crypto News Flash,Revolutionizing Blockchain Gaming: MYRIA Token Takes Center Stage on OKX Exchange,"Myria&#8217;s MYRIA token launch on the OKX exchange is a significant milestone for the platform, revolutionizing blockchain gaming. With Myria&#8...",50.0,45.0,99.96512532234192,60.114999999999995,68.75,99.96590614318848,2023-04-06
168,crypto.news,Buterin and Yakovenko face off on security,"After what seemed like an eternity, Anatoly Yakovenko, co-founder of Solana Labs, and Vitalik Buterin, developer of ethereum, have surprisingly pi...",67.0,50.0,99.59114491939545,78.595,85.0,13.723194599151611,2023-04-06
169,CoinGape,CZ Clarifies ‘Misinformation’ About Binance Australia Derivatives License,"Claiming that it was only the derivatives license of Binance Australia that was canceled, the exchange&#8217;s CEO on Thursday offered an explanat...",61.315,50.0,0.6799012422561646,50.0,50.0,0.05287826061248779,2023-04-06
170,Bitcoinist,"Majority Of Crypto Investors Evaded Taxes In 2022, Study Shows","A digital currency tax firm, Divly, recently conducted a study revealing that nearly all digital asset investors did not pay taxes on their crypto...",50.0,50.0,0.12323856353759766,71.035,49.0,1.0617613792419434,2023-04-06
171,eCash,Avalanche Pre-Consensus Development Sneak Peek,"⚙️ Our dev team has been busy building, and we wanted to share some insights with you on the Avalanche development progress on eCash!&#x1f477;&#x1f...",50.0,50.0,0.438457727432251,82.38,55.00000000000001,97.6247638463974,2023-04-06
172,Seeking Alpha,BitNile Metaverse unit surpasses 675K active users,BitNile Metaverse (NASDAQ:BNMV) said on Thursday that the unit BitNile.com has surpassed 675K active users. The browser-based platform had went li...,70.095,43.333333333333336,98.52893054485321,70.095,43.333333333333336,0.0683218240737915,2023-04-06
173,crypto.ro global,NFT market reaches $2 billion in trading volume in March,"The non-fungible token (NFT) market experienced a remarkable upswing in February 2023, reaching a total trading volume of over $2 billion, as repo...",52.580000000000005,50.0,94.62319910526276,82.985,75.83333333333333,98.32039475440979,2023-04-06
174,Crypto Daily™,Alibaba Cloud and Elastos join forces to build a more secure and inclusive internet,"Alibaba Cloud International has recently announced a strategic partnership with Elastos, an open-source blockchain protocol, to develop next-gener...",79.92,72.5,98.90149235725403,50.0,50.0,99.86424446105957,2023-04-06
175,Crypto News Flash,"Unprecedented Rally Ahead: Collateral Network (COLT) Poised For 3500% Growth With Polkadot (DOT), Tezos (XTZ), And Solana (SOL)","Get ready for an extraordinary surge as Collateral Network (COLT) prepares for a staggering 3500% growth. Currently valued at $0.01, now is the pe...",77.86999999999999,80.0,99.94894862174988,89.53,58.88888888888889,99.87517893314362,2023-04-06
176,CoinGape,Is Ripple Powering India’s One Million CBDC User Goal?,"Crypto News: In the wake of India&#8217;s recent experimental projects with the central bank digital currencies (CBDCs), latest reports suggest th...",50.0,50.0,96.38032913208008,50.0,56.00000000000001,82.96610713005066,2023-04-06
177,Decrypt,Aragon’s New DAO Toolkit on Polygon Takes Aim at Voter Apathy,"Aragon’s recently launched tech stack is now live on Polygon, dropping costs for spinning up DAOs and taking aim at voter apathy.",35.199999999999996,56.81818181818181,93.42131316661835,41.105000000000004,53.40909090909091,14.912104606628418,2023-04-06
178,crypto.news,Ripple wins big in US-Mexico transfers based on Bitso’s report,"According to the 2022 report, Bitso highlighted that they processed about $3.3 billion between US and Mexico, using XRP and others.",78.595,57.49999999999999,7.192406058311462,50.0,50.0,8.586642146110535,2023-04-06
179,Nexa,NEXA: Instant Transactions and Transaction Finality,"What if a customer purchases something small, say a cup of coffee, with Nexa?Can the merchant let the customer leave the store with the coffee bef...",50.0,50.0,99.92755353450775,47.42,37.5,0.14152824878692627,2023-04-06
180,Seeking Alpha,TeraWulf increases operating hash rate by 50% in March,TeraWulf (NASDAQ:WULF) said on Thursday its March average operating hash rate increased by 50% on a monthly basis to 3.0 EH/s. The bitcoin mining ...,50.0,50.0,11.140167713165283,63.660000000000004,42.5,0.012478232383728027,2023-04-06
181,Decrypt,"Mutant Apes Take the Lead in Serum City, an ApeCoin-Powered Ethereum NFT Game",Novel Labs and Faraway are developing an independent city-building game that gives new life to Yuga Labs’ Mutant Ape Yacht Club NFTs.,50.0,30.0,75.03859102725983,65.91,45.60606060606061,99.76760149002075,2023-04-06
182,NewsBTC,Can Dogecoin Rally Further? Here’s What On-Chain-Data Says,The Dogecoin (DOGE) price experienced a whopping rally of over 35% at the beginning of the week after Twitter CEO Elon Musk replaced the Twitter l...,50.0,50.0,4.236710071563721,50.0,90.0,0.019276142120361328,2023-04-06
183,AMBCrypto,Deciphering the reasons behind Bitcoin’s [BTC] recent price correction,"BTC’s Open Interest declined and selling pressure seemed dominant across the Futures market A few metrics supported the bulls, but the rest sugges...",50.0,40.0,0.12032687664031982,63.085,45.0,0.06685853004455566,2023-04-06
184,Crypto Daily™,Singapore To Release New Crypto Client Vetting Guidance for Banks,Singapore regulators are reportedly working alongside police forces to develop uniform guidelines for banks to aid in screening potential crypto c...,50.0,56.81818181818181,99.3951290845871,50.0,50.0,9.771108627319336,2023-04-06
185,"CoinDesk: Bitcoin, Ethereum, Crypto News and Price Data","U.S. Treasury Warns That DeFi Used by North Korea, Scammers to Launder Dirty Money",The Treasury's first analysis of illicit finance risks associated with DeFi recommends the U.S. look at enhancements to its existing anti-money la...,31.94,20.0,0.16403496265411377,47.42,62.5,93.84894371032715,2023-04-06
186,Crypto News Flash,VeChain partners with fashion company to access billion-$-market in China with innovative IoT tech,"Vechain&#8217;s Chinese version, Najing Zero has been drafted by BLOCKMEME to guarantee quality. BLOCKMEME can further embrace Vechain to expand i...",72.02,75.0,99.92266893386841,84.04,50.0,98.59605431556702,2023-04-06
187,CoinJournal,Metacade Investment Soars to $16.35m As Crypto Bull Run Gains Momentum,Crypto market news has been inundated in recent weeks with the easing of markets as the crypto bull run gains momentum. Nowhere has the improvemen...,67.0,50.0,75.41644871234894,76.335,50.0,0.33855438232421875,2023-04-06
188,BlockchainReporter,Wicrypt and Peaq Ecosystem Collaborate for Democratization of the Web Access,"Wincrypt, a network that provides access to the decentralized internet, is collaborating with Peaq Network (the platform that lets developers and ...",50.0,50.0,99.15141463279724,50.0,50.0,89.87542390823364,2023-04-06
189,Tokenist,Judge Denies AMC’s Proposed Settlement in APE Conversion Lawsuit,APE shares were down 12% in premarket trading following the court decision. The post Judge Denies AMC&#8217;s Proposed Settlement in APE Conversi...,21.405,50.0,0.9230673313140869,42.345,46.11111111111111,0.006043910980224609,2023-04-06
190,"CoinDesk: Bitcoin, Ethereum, Crypto News and Price Data",Stablecoin Tether's Market Capitalization Nears Record High of $83B,Tether's market cap has increased by 20% this year mainly on account of aggressive issuance on Ethereum's rival Tron.,50.0,57.99999999999999,14.281737804412842,56.400000000000006,58.333333333333336,95.28245329856873,2023-04-06
191,Seeking Alpha,Coinbase trading volumes flat from Q4 despite rising crypto prices: BofA,"Even as cryptocurrency prices rebounded in the first quarter of 2023, Coinbase Global's (NASDAQ:COIN) transaction volumes, which account for a lar...",50.0,48.75,0.002664327621459961,50.0,56.25,1.9328832626342773,2023-04-06
192,Cointelegraph,Islam and crypto: How digital assets can comply with Islamic financial law,A look at cryptocurrency’s role in the world of Islamic banking and finance.,58.894999999999996,50.0,94.84035074710846,50.0,50.0,99.76127743721008,2023-04-06
193,Technext,Google to stop loan apps from getting users’ personal information,"Google has recently updated its policy on personal loan apps, which could have significant implications for the industry.&#8230;",35.199999999999996,50.0,0.06109178066253662,60.114999999999995,56.25,10.102185606956482,2023-04-06
194,Rubic,Rubic Weekly Report 04/06/2023,"DevelopmentLaunch of Rubic’s New ContractsOur contracts have recently been fully audited by the MixBytes Company! During the audit process, Rubic’...",50.0,50.0,3.728470206260681,50.0,53.40909090909091,98.62931370735168,2023-04-06
195,Protos,"From the US to Australia, regulatory knot around Binance tightens","Binance Australia is being probed by the country's financial regulators, resulting in its derivatives license getting revoked. The post From the U...",50.0,50.0,3.568023443222046,50.0,50.0,0.21278560161590576,2023-04-06
196,Cointelegraph,Crypto security audits and bug bounties are broken: Here’s how to fix them,Are crypto auditing incentives designed to make the client happy rather than deliver bad news? What happens if you don’t pay out bug bounties?,41.105000000000004,30.0,0.4829913377761841,67.635,52.5,0.05058944225311279,2023-04-06
197,CoinGape,"XRP Lawyer Says Government Should Seize JPMorgan’s Assets, Here’s Why",,58.894999999999996,50.0,0.041794776916503906,50.0,50.0,0.0,2023-04-06
198,Decrypt,Dogecoin Down 8% as Musk’s Twitter Hype Fades,"Dogecoin has posted an intraday loss of roughly 8%, but it still has most of its Elon Musk-assisted gains over the last seven days.",50.0,42.22222222222222,0.018167495727539062,67.53,56.666666666666664,15.491202473640442,2023-04-06
199,CryptoSlate,"CZ urges caution with AI, calls for ‘balance’","Binance CEO Changpeng &#8216;CZ&#8217; Zhao said artificial intelligence (AI) is a technology that may take over our world and make us irrelevant,...",50.0,50.0,1.3800501823425293,73.83500000000001,22.499999999999996,0.11849403381347656,2023-04-06
200,Bitcoinist,Best Bitcoin Casinos & Top Crypto Casino Sites 2023,Our handy guide to the best Bitcoin casinos in 2023 will help you find trusted operators in the crypto-gambling space. To help you make an informe...,85.92,87.5,99.97832477092743,95.67999999999999,90.0,98.98268580436707,2023-04-06
201,Bitcoinist,The 3 VIP Trading Firms In The Binance-CFTC Lawsuit Revealed,The three &#8220;VIP&#8221; quant trading firms named by the United States Commodity Futures Trading Commission (CFTC) in its lawsuit against the ...,74.11999999999999,50.0,0.3429681062698364,61.315,50.0,14.229732751846313,2023-04-06
202,Cointelegraph,Japan pushes for friendlier environment for crypto with Web3 proposals,Japan’s Web3 project team released a white paper suggesting ways to expand the country’s crypto industry to establish a welcoming atmosphere for c...,72.94,50.0,81.40716254711151,81.845,50.0,94.80522572994232,2023-04-06
203,Cryptopolitan_News,Revealed: Bitcoin whitepaper hidden on every Apple MacBook with recent version of MacOS,TL;DR BreakdownBitcoin whitepaper is hidden on every Apple MacBook computer running recent versions of the macOS software.The file can be found in...,50.0,45.83333333333333,0.2806544303894043,50.0,45.83333333333333,21.71759307384491,2023-04-06
204,Cryptopolitan_News,Japan’s Prime Minister Kishida approves Web3 whitepaper to boost the country’s crypto industry,TL;DR BreakdownJapan’s ruling Liberal Democratic Party’s Web3 project team has approved a whitepaper laying out recommendations for growing the co...,82.985,50.0,99.1987019777298,77.115,50.0,99.25104975700378,2023-04-06
205,BlockchainReporter,Myria Takes Blockchain Gaming to the Next Level with Launch of MYRIA Token on OKX Exchange,The decentralized Ethereum Layer 2 blockchain gaming platform Myria has made an announcement about the token generation event (TGE) for its native...,50.0,50.0,99.82752203941345,50.0,50.0,23.413658142089844,2023-04-06
206,Technext,Afrobubble’s Venn Oputa puts Africa on the blockchain by immortalising the legendary Queen Amina,Venn Oputa is an ideator committed to carving out room for the rich African history with the power&#8230;,50.0,100.0,99.46852326393127,84.53999999999999,59.375,99.92308020591736,2023-04-06
207,crypto.news,Bitstamp to introduce new lending product in Europe,Bitstamp has partnered with Tesseract to introduce a new crypto-lending service across specific European markets. Bitstamp is building a crypto-le...,50.0,56.81818181818181,99.74292516708374,50.0,52.27272727272727,98.22173714637756,2023-04-06
208,Cryptopolitan_News,Uniswap price analysis: Bearish momentum pulls price back to $6.07,TL;DR BreakdownUniswap price analysis shows a bearish pressureBears overwhelmed the Bulls as UNI drops back to $6.32Support for UNI is seen at $6....,50.0,50.0,7.836437225341797,52.580000000000005,50.0,0.028711557388305664,2023-04-06
209,Cointelegraph,9 examples of artificial intelligence in finance,Discover how artificial intelligence is transforming the financial sector with nine examples of AI in finance.,73.83500000000001,20.0,0.32525956630706787,73.83500000000001,35.0,4.67056930065155,2023-04-06
210,Cryptopolitan_News,Foreign investment drops by 33% in Nigeria despite booming crypto adoption,TL;DR BreakdownForeign direct investment (FDI) in Nigeria fell by 33% in 2022 due to a severe shortage of dollars.FDI decreased to $468 million fr...,50.0,43.75,0.05525648593902588,22.13,42.916666666666664,0.010254979133605957,2023-04-06
211,crypto.news,India is targeting one million CBDC users in three months,"As the world of cryptocurrency continues to expand, India is aiming to the lead in embracing this digital frontier.&#160; According to reports, wi...",50.0,50.0,0.25799572467803955,65.91,50.0,99.79859292507172,2023-04-06
212,Posschain,Increasing momentum for a privacy-first world,"Increasing momentum for a privacy-first worldIn the last two decades, big technology companies such as Google, Amazon, and Facebook have witnessed...",50.0,50.0,99.43923950195312,58.894999999999996,50.0,97.85974323749542,2023-04-06
213,Cryptopolitan_News,"Solana price analysis: Bears react, dropping SOL to the $20.66 mark",TL;DR BreakdownThe recent Solana price analysis shows a decrease in price.Price levels have dropped down to $20.66 today.Support for SOL is presen...,50.0,50.0,0.11574029922485352,50.0,46.11111111111111,18.91448199748993,2023-04-06
214,crypto.news,OKX liquid marketplace exceeds $1b in institutional trading,"OKX has announced that its on-demand institutional Liquidity Marketplace trading volume exceeded $1 billion in 2023.&#160; OKX, the 9th-largest cr...",50.0,50.0,4.901048541069031,50.0,50.0,98.27571213245392,2023-04-06
215,Cryptopolitan_News,Singapore to help banks develop universal guidance on crypto,TL;DR BreakdownSingapore’s central bank and police officials have been assisting banks to develop universal guidelines for enhancing their vetting...,70.095,50.0,99.10321831703186,50.0,50.0,99.26257729530334,2023-04-06
216,crypto.news,"Myria, an Etherem layer-2 gaming platform, launches token on OKX","Myria, an Ethereum layer-2 blockchain gaming platform, has launched its native MYRIA token on the OKX crypto exchange",50.0,50.0,0.8750736713409424,56.400000000000006,50.0,82.986319065094,2023-04-06
217,CoinGape,Elon Musk Rolls Out New Features For Twitter Blue Subscribers,,50.0,53.40909090909091,79.8635482788086,50.0,50.0,0.0,2023-04-06
218,CryptoSlate,Over 75% of crypto holders have NFTs,"Three out of four people said they owned non-fungible tokens (NFTs), a recent survey by Coin Gecko revealed. As opposed to the 75.8% who said they...",50.0,50.0,92.45927333831787,50.0,50.0,0.02010166645050049,2023-04-06
219,Cryptopolitan_News,AI Ad Creation: Meta to Commercialize Generative AI for Ad Creation,"TL;DR BreakdownMeta plans to commercialize its generative AI technology by the end of the year, which can create sentences and graphics for ad cre...",74.695,50.0,11.422514915466309,65.91,50.0,0.5928486585617065,2023-04-06
220,crypto.news,"CFTC names Binance’s three VIP clients, probably treated differently",Cryptocurrency giant Binance finds itself in hot water as the Commodity Futures Trading Commission (CFTC) accuses it of &#8220;sham&#8221; complia...,80.83,50.0,0.22704005241394043,32.99999999999999,56.25,0.014141201972961426,2023-04-06
221,CoinGape,Crypto Whales Move 214 Million XRP As Ripple Lawsuit Ruling Closes In,"XRP News: Ripple’s native crypto, XRP registered a slight decline on Thursday as the global digital saw a broad sell-off. The recent drop comes in...",38.685,50.0,1.5291661024093628,36.34,48.95833333333333,5.3177207708358765,2023-04-06
222,"CoinDesk: Bitcoin, Ethereum, Crypto News and Price Data",EU Consultation Warns on Risk of Big Players Becoming Metaverse Gatekeepers,"The European Commission raises risks to privacy, openness, cybersecurity and equality in online virtual worlds",31.94,61.25000000000001,15.980291366577148,53.86,50.0,20.42178511619568,2023-04-06
223,Posschain,What will Blockchain add to the World?,Interoperability in the blockchain space refers to the ability of two or more blockchains to communicate with and share data. We’ve seen blockchai...,50.0,50.0,77.30451822280884,77.115,75.0,96.0525393486023,2023-04-06
224,AMBCrypto,Coinbase backed plaintiffs renew legal fight to end ban on Tornado Cash,Coinbase backed plaintiffs requested a partial summary judgment in their lawsuit against the U.S. Department of Treasury. The case was filed last ...,15.960000000000003,60.0,91.20512902736664,50.0,47.5,0.18968582153320312,2023-04-06
225,CryptoSlate,The Bitcoin Whitepaper may still be secretly stored on your computer,"The Bitcoin whitepaper was found as a hidden file on Mac computers in 2020, and today rumors have been refueled as the whitepaper is confirmed to ...",50.0,30.0,0.023889541625976562,50.0,55.833333333333336,0.07902979850769043,2023-04-06
226,CRYPTOTAG,🤯 APPLE HIDES SECRET BITCOIN WHITEPAPER ON MACS: THIS IS HOW YOU CAN FIND IT!,Apple appears to have a secret document stored on your Mac(Book)!It is a PDF file of the Bitcoin Whitepaper Satoshi Nakamoto published in 2008.Of ...,37.595,25.0,94.41454410552979,50.0,30.0,0.6678253412246704,2023-04-06
227,Seeking Alpha,Soluna signs 25MW bitcoin hosting contract,Soluna (NASDAQ:SLNH) has reached a 25MW hosting contract with a bitcoin miner at its Project Sophie in Kentucky. The contract will shift business ...,50.0,50.0,4.899024963378906,55.135,50.0,0.614321231842041,2023-04-06
228,TheNewsCrypto,Arbitrum Makes Several Governance Changes After Backlash From Community,Arbitrum Foundation would be splitting AIP-1 into multiple smaller proposals.None of the 700M tokens now held in the Administrative Budget Wallet ...,50.0,50.0,19.29355263710022,50.0,50.0,0.004708766937255859,2023-04-06
229,ItsBitcoinWorld,Where to Find the Bitcoin White Paper on Your Apple Computer,"The Bitcoin white paper was discovered deep within Apple&#39;s system files on macOS Catalina or later devices. The file, labeled &#34;simpledoc.p...",50.0,50.0,1.1549443006515503,50.0,50.0,81.59299790859222,2023-04-06
230,Crypto News Flash,"USD to be backed by Bitcoin as Microstrategy purchases thousands more BTC: Could BTC surge to $30,000 by the end of the week?","With its fresh purchase of Bitcoin on Wednesday, April 5, MicroStrategy takes its total BTC holdings to more than 140,000. Michael Saylor said tha...",51.29,75.0,0.10612607002258301,65.91,63.33333333333333,1.3755977153778076,2023-04-06
231,Seeking Alpha,Iris Energy March bitcoin production rises 11% M/M,"Iris Energy (NASDAQ:IREN) mined 173 bitcoin (BTC-USD) in March 2023, reflecting a growth of around 11% from 156 bitcoins mined in February. The gr...",63.660000000000004,50.0,84.06042754650116,78.595,50.0,0.11060237884521484,2023-04-06
232,TheNewsCrypto,Avalanche Soon to Launch an Exclusive Subnet for a Web3 Game,One of the creators of the Sci-fi movie “District 9” heads the launch of this game.GUNZ is a triple-A blockchain platform on Avalanche.The Avalanc...,56.400000000000006,30.0,98.64219427108765,50.0,50.0,89.60274457931519,2023-04-06
233,"CoinDesk: Bitcoin, Ethereum, Crypto News and Price Data",First Mover Americas: Bitcoin Buckles the Day Before U.S. Jobs Report,"The latest price moves in bitcoin (BTC) and crypto markets in context for April 6, 2023. First Mover is CoinDesk’s daily newsletter that contextua...",50.0,62.5,1.0083794593811035,50.0,62.5,97.475466132164,2023-04-06
234,Crypto News Flash,"BREAKING: IOTA update to enable cross-chain interoperability with Shimmer, Bitcoin, Ethereum and other blockchains – Report",Shimmer partners with Multichain to enhance smooth interoperability between networks. IOTA holders would be able to unlock different Investment op...,50.0,43.75,0.16398131847381592,50.0,65.0,95.2431321144104,2023-04-06
235,Cointelegraph,"Charles Hoskinson: Cardano delays due to betting on wrong tech, ambitious roadmap","Cardano founder Charles Hoskinson is optimistic about the future of crypto despite the setbacks, and anticipates a high rate of Cardano adoption i...",50.0,43.75,0.43168365955352783,65.91,54.0,99.33382272720337,2023-04-06
236,Crypto Daily™,Evan Luthra Alleges Bitget Of Massive 'Scam',"Tech entrepreneur and serial crypto investor Evan Luthra has accused Bitget, a leading cryptocurrency exchange, of being involved in a widespread ...",50.0,50.0,0.1034080982208252,35.199999999999996,50.0,0.10764002799987793,2023-04-06
237,crypto.news,Singapore to help banks set standards for vetting crypto businesses,Singapore&#8217;s central bank and the police are reportedly working on establishing guidelines that would help traditional financial institutions...,70.095,50.0,99.2251306772232,70.095,50.0,2.5365591049194336,2023-04-06
238,CryptoSlate,CryptoSlate wMarket Update: Dogecoin plunges below $0.09 on a tumultuous red day,The cryptocurrency market cap saw net outflows of $27.6 billion and currently stands at $1.177 trillion — down 2.3% from $1.204 trillion. During t...,50.0,50.0,0.0061571598052978516,50.0,47.40740740740741,0.40618181228637695,2023-04-06
239,Cointelegraph,Sentiment recovers $870K after negotiations with the hacker,"The hacker sent back 414 Ether in an initial transaction and eventually sent another 51.75 ETH, returning 90% of the stolen funds.",50.0,50.0,0.3731042146682739,25.305,50.0,0.02314448356628418,2023-04-06
240,crypto.news,Mike Novogratz predicts a bull year for crypto,"According to Mike Novogratz, BTC and other crypto's are on for a good market year ahead of the recent bank events and expected interest rates. $BT...",50.0,50.0,0.0828087329864502,85.48,55.93749999999999,99.8645931482315,2023-04-06
241,Micky,Is the Bitcoin white paper really hidden in every Apple macOS?,"In a jaw-dropping revelation, technologist Andy Baio has discovered that a PDF of the Bitcoin white paper has been quietly shipped with every copy...",50.0,45.83333333333333,0.3584951162338257,50.0,50.0,99.86512064933777,2023-04-06
242,Micky,Ethereum reaches new yearly peak ahead of Shanghai hard fork,"Ether (ETH), the native token of the Ethereum blockchain, circled above $1,900 for much of Wednesday, a week before the Shanghai hard fork.&#160; ...",47.42,46.11742424242424,99.967822432518,44.865,48.47222222222222,0.4730105400085449,2023-04-06
243,CryptoSlate,M2 money supply analysis shows one clear winner in race,Definition What is M2 in money supply? M2 is a metric used to gauge the quantity of money supply in the United States. It comprises a broader rang...,87.53,55.00000000000001,91.54050052165985,71.075,50.0,1.9546926021575928,2023-04-06
244,ItsBitcoinWorld,Tron’s Sun Had this to Say about his “alleged” Deal with Binance’s CZ,"Justin Sun, the inventor of Tron, spoke out against recent reports circulating concerning the cryptocurrency market Huobi. According to Coindesk&#...",50.0,45.0,18.70214343070984,50.0,50.0,0.508156418800354,2023-04-06
245,ItsBitcoinWorld,‘Bitcoin Stamps’ NFTs Are Gaining On Ordinals,Another wave of NFTs is about to overwhelm the Bitcoin blockchain—and they are not Ordinals. The emerging STAMPS (Secure Tradeable Art Maintained ...,71.075,50.0,90.86157977581024,41.105000000000004,70.0,0.26740431785583496,2023-04-06
246,ItsBitcoinWorld,"Will Ethereum [ETH] Cross $2,000 this Week? Refer to these Indicators","On 5 April, investors awoke to good news as the crypto market turned bullish, allowing various cryptocurrencies to drive their values higher. Ethe...",50.0,50.0,0.36717355251312256,84.04,65.83333333333333,8.11355710029602,2023-04-06
