,source,title,excerpt,vader_sentiment_title,tb_sentiment_title,flair_sentiment_title,vader_sentiment_excerpt,tb_sentiment_excerpt,flair_sentiment_excerpt,date
82,CoinGape,XRP Lawyer Backs Ethereum Over Security Claims,"XRP News: The latest lawsuit against the KuCoin crypto exchange has spiked the uncertainty around Ethereum (ETH), world’s second largest crypto, n...",64.8,50.0,1.1786460876464844,24.47,62.5,0.66203773021698,2023-03-11
83,Cointelegraph,Ethereum layer-2 solutions may focus less on token incentives in the future,"Token incentive models may become obsolete as layer-2 networks focus on ease of functionality and low fees, but how will this impact decentralizat...",70.455,45.83333333333333,2.902856469154358,54.50000000000001,50.0,96.63302600383759,2023-03-11
84,CoinGape,"Circle’s USDC Redemptions Reaches $2.5 Billion In 24Hrs, Exchange Inflow $7B",Stablecoin issuer Circle&#8217;s USD Coin (USDC) redemptions reach over $2.5 billion in the last 24 hours. Investors move away from USDC stablecoi...,52.580000000000005,50.0,79.4431746006012,51.29,50.0,0.8306831121444702,2023-03-11
85,AMBCrypto,United States lawmakers call for accountability from crypto auditors,U.S. Senators Elizabeth Warren and Ron Wyden are calling for more accountability from crypto auditors. The lawmakers are alleging that the sham au...,71.075,50.0,2.6605039834976196,50.0,57.49999999999999,0.02390742301940918,2023-03-11
86,CoinGape,"Here’s Why Bitcoin, Ethereum Price Rising Amid Bank Woes, Stablecoins Depeg","The crypto market is witnessing a massive crisis as crypto-friendly banks Silvergate, Silicon Valley Bank, and now Signature Bank faces bank runs....",27.98,50.0,0.01240074634552002,18.755,50.0,0.28187036514282227,2023-03-11
87,AMBCrypto,Cardano [ADA] inflicted a bullish breakout- Are short-sellers subdued?,"Disclaimer: The information presented does not constitute financial, investment, trading, or other types of advice and is solely the writer’s opin...",50.0,50.0,0.1046299934387207,50.0,46.875,0.11563897132873535,2023-03-11
88,Cointelegraph,Maker DAO files emergency proposal addressing 3.1B USDC exposure,"""Proposal(s) implementing the above changes are expected to be posted in the next ~12 hours or less,"" says Maker.",30.910000000000004,50.0,10.30205488204956,50.0,46.666666666666664,0.7687509059906006,2023-03-11
89,NewsBTC,Binance And Coinbase Temporarily Suspend USDC Conversion After Silicon Valley Bank Collapse,"The two biggest cryptocurrency exchanges, Binance and Coinbase, have revealed that they would temporarily suspend USDC conversions on their platfo...",16.475,50.0,0.06511211395263672,34.089999999999996,50.0,0.023245811462402344,2023-03-11
90,Decrypt,Coinbase's Plan to Go 'On-Chain Native' Is a Smart Play for Fees,"By developing various on-chain products and services, Coinbase is hoping to get users onto its new Base roll-up and scoop up more revenue.",81.245,60.71428571428571,97.89299666881561,76.335,47.95454545454545,93.1533932685852,2023-03-11
91,CoinGape,Timeline Of The 2nd Largest Bank Failure In US History,,24.47,42.083333333333336,0.033855438232421875,50.0,50.0,0.0,2023-03-11
92,CoinGape,Rich Dad Poor Dad Author Predicts More Banks To Go Under,,56.400000000000006,57.91666666666666,0.08133649826049805,50.0,50.0,0.0,2023-03-11
93,CoinGape,Cryptocurrency Price Prediction Today Mar 11th: Kucoin and Bone ShibaSwap Surged 6% While Maker and Frax Share Tumbled 10-12%,Cryptocurrency price prediction today Mar 11th: the recent bloodbath in the crypto market triggered by the Silicon Valley Bank crisis has also aff...,64.8,50.0,0.021144747734069824,18.755,50.0,1.0530412197113037,2023-03-11
94,"CoinDesk: Bitcoin, Ethereum, Crypto News and Price Data",Bitcoin Regains $20K After $200M in Crypto Liquidations; Some Traders Brush Off USDC Fears,"Some traders are signaling strength for USD Coin, citing its treasury backing in U.S.-issued bonds.",28.925,50.0,0.17269551753997803,81.245,50.0,97.72455394268036,2023-03-11
95,TheNewsCrypto,Elon Musk Open to the Idea of Acquiring Struggling Silicon Valley Bank,"Elon Musk stated that he is open to the concept, which is an interesting reaction. Musk has articulated his plan to make Twitter the world's preem...",28.925,50.0,85.31926572322845,70.095,62.5,88.16956579685211,2023-03-11
96,TheNewsCrypto,Both Binance and Coinbase Temporarily Suspend USDC Conversions,Binance said it will halt USDC conversion to USD over the weekend. Circle said that Silicon Valley Bank still has $3.3 billion underpinning USDC. ...,34.089999999999996,50.0,0.10151565074920654,50.0,50.0,0.02308487892150879,2023-03-11
97,crypto.news,BlockFi warned over $227m stuck in Silicon Valley Bank,BlockFi has been warned by the bankruptcy trustee that the $227m the company has in Silicon Valley Bank (SVB) may go against bankruptcy laws,26.165,50.0,0.015240907669067383,48.71,50.0,0.8978575468063354,2023-03-11
98,The Block,"Ark picks up more Coinbase stock, adding $6.4 million","Cathie Wood’s Ark Invest picked up another tranche of Coinbase shares on Friday, purchasing about $6.4 million of the stock.",50.0,75.0,84.12826955318451,64.8,50.0,2.2238552570343018,2023-03-11
99,CoinGape,Is Vitalik Buterin Supporting USDC Amid Heavy Depegging?,"USDC Crash News: Silicon Valley Bank collapse turns out to be the biggest bank to fall since the financial crisis erupted in 2008. However, this c...",72.02,51.24999999999999,3.5717904567718506,6.25,50.0,6.8003058433532715,2023-03-11
100,U.Today,Cardano Founder Says Algorithmic Stablecoins Are Essential for Bitcoin (BTC) to Achieve Its Vision,This comes in wake of embattled Silvergate and Silicon Valley Bank (SVB) buzz,62.5,50.0,96.99741005897522,50.0,50.0,3.6142170429229736,2023-03-11
101,CoinGape,"Top Crypto Token Price For Today, March 11th",,60.114999999999995,75.0,99.97954666614532,50.0,50.0,0.0,2023-03-11
102,crypto.news,USDC depegs as Circle burns $2.34b in 24 hours,"USD Coin (USDC) has depeged from its $1 intended peg to trade as low as 81.5 cents. Meanwhile, Circle has burned $2.34b in USDC over the last day",50.0,50.0,0.005525350570678711,36.34,50.0,0.0006496906280517578,2023-03-11
103,Cryptopolitan_News,Binance and Coinbase halt USDC conversions as Silicon Valley Bank collapse sparks crypto crisis,TL;DR Breakdown Binance and Coinbase suspend USDC conversions as Silicon Valley Bank collapse sends shockwaves through crypto markets. The suspens...,9.629999999999999,50.0,1.8189281225204468,16.475,50.0,2.685144543647766,2023-03-11
104,Decrypt,"This Week in Coins: Silvergate, Silicon Valley Bank Collapse, Bitcoin and Ethereum Crash","Also this week, Capitol Hill was full of conflicting opinions as lawmakers again grappled with crypto.",14.52,50.0,0.04017651081085205,29.905000000000005,67.5,0.1519709825515747,2023-03-11
105,crypto.news,Robinhood reportedly suspends USDC depositing and trading,"Robinhood, a platform that allows the commission-free trading of, among other instruments, cryptocurrencies, via a mobile app, has halted the trad...",50.0,50.0,0.06650090217590332,50.0,43.75,0.18065571784973145,2023-03-11
106,Cryptopolitan_News,Brave browser rolls out new in-app crypto feature,TL;DR Breakdown Brave browser debuts new in-app crypto feature Ramp Network will facilitate transactions Brave commends the rise of self-custody i...,76.335,73.4090909090909,99.92171227931976,88.915,78.93939393939394,99.95528161525726,2023-03-11
107,Ordinals Finance,[BRC-20] Fungible Tokens on Bitcoin,"Launched in late January thanks to the Bitcoin network’s Segwit and Taproot upgrades, Ordinals took the crypto world by storm as more and more ent...",50.0,50.0,97.03283905982971,76.335,61.25000000000001,98.13041090965271,2023-03-11
108,Cryptopolitan_News,Lawmakers meet with regulators over Silicon Valley Bank collapse,"TL;DR Breakdown On Friday, U.S. lawmakers convened to discuss the collapse of Silicon Valley Bank (SVB) with the Federal Reserve and Federal Depos...",25.305,50.0,2.6077300310134888,25.305,50.0,10.552558302879333,2023-03-11
109,Crypto Daily™,Circle ($USDC) Has Over $3B Tied Up At Silicon Valley Bank,The issuer of the second-largest stablecoin Circle has stated that it held an undisclosed portion of its $9.8 billion cash reserves at the failed ...,50.0,50.0,0.5284130573272705,24.47,25.0,0.05765557289123535,2023-03-11
110,Finbold,"Robert Kiyosaki warns 3rd U.S. bank to crash, Peter Schiff says ‘bigger collapse’ ahead",The United States financial system has been rattled by the collapse of Silicon Valley Bank (SBV) and Silvergate Bank within … Continued,26.165,50.0,0.4032909870147705,44.865,50.0,1.7009615898132324,2023-03-11
111,AMBCrypto,"Monero scores high on social ranking, but is it enough to rejuvenate bulls",Monero enjoys healthy social volume which may aid in attracting back investors. XMR conforms to the market conditions this week despite previous r...,50.0,53.22222222222223,98.15289080142975,92.21,54.58333333333334,99.7225672006607,2023-03-11
112,Bitcoinist,Bitcoin Crash: Derivative Traders Lose $202 Million In 24 Hours,"The crypto market suddenly turned red on March 10 in the year&#8217;s worst sell-off. Bitcoin slipped below $20,000 for the first time in three mo...",17.015,50.0,0.00756382942199707,18.755,40.625,0.0003993511199951172,2023-03-11
113,Cointelegraph,Bitcoin price spikes to '$26K' in USDC terms — How high can the BTC short squeeze go?,"Bitcoin recovers from the depegging of USDC, the second-largest stablecoin, from the U.S. dollar.",50.0,54.0,0.0020503997802734375,50.0,50.0,9.510505199432373,2023-03-11
114,The Block,Weird crypto quirk sees user turn $1.45 into $2 million,The user was reacting quickly to a situation where another user had unbalanced a Curve pool while losing a similar amount of money.,41.105000000000004,25.0,0.1202017068862915,30.910000000000004,58.333333333333336,0.008153915405273438,2023-03-11
115,AMBCrypto,"Bitcoin: Fall of Silicon Valley Bank might be a silver lining for BTC, here’s why","USDC has seen increased swaps as more Bitcoin leaves exchanges. BTC volume reaches almost a three-month high as transactions go up. Fear, uncertai...",50.0,50.0,0.02377033233642578,38.685,66.5,0.0033855438232421875,2023-03-11
116,The Block,Brevan Howard takes over Dragonfly Capital Crypto Fund: Bloomberg,Global asset management firm Brevan Howard is taking over a hedge fund spun off from crypto investment company Dragonfly Capital.,50.0,50.0,6.103596091270447,68.06,45.0,15.367448329925537,2023-03-11
117,Cointelegraph,"What is ethical hacking, and how does it work?",Ethical hacking is the practice of identifying and testing vulnerabilities in a system to improve its security and prevent unauthorized access.,75.53,60.0,0.8920639753341675,89.82,60.0,1.5534281730651855,2023-03-11
118,"CoinDesk: Bitcoin, Ethereum, Crypto News and Price Data",Traders Bet on USD Coin Rebound as USDC Falls to 90 Cents,"Some $4 million in USDC futures were liquidated in the past 24 hours, Coinglass data shows.",50.0,50.0,0.011846423149108887,50.0,37.5,0.03409385681152344,2023-03-11
119,AMBCrypto,"SEC rejects VanEck’s spot BTC ETF application, yet again",The U.S. SEC on 10 March rejected the investment manager VanEck’s application to create a spot Bitcoin exchange-traded product (ETP). The SEC alle...,25.305,45.0,0.0241696834564209,35.199999999999996,45.0,0.1644134521484375,2023-03-11
120,Blockchain News,US Federal Reserve to Create Cryptocurrency Team Amid Concerns Over Unregulated Stablecoins,"The US Federal Reserve is planning to establish a specialized team of experts to keep up with developments in the cryptocurrency industry, specifi...",63.660000000000004,50.0,3.9228230714797974,50.0,50.0,99.24252033233643,2023-03-11
121,Blockchain News,"Hedera Mainnet Exploited, Leading to Theft of Liquidity Pool Tokens","Hedera Hashgraph has confirmed a smart contract exploit on its mainnet, resulting in the theft of liquidity pool tokens from decentralized exchang...",27.060000000000002,50.0,0.13912320137023926,65.91,65.35714285714286,0.8535683155059814,2023-03-11
122,Blockchain News,DOJ Appeals Against Approval of Voyager-Binance.US Asset Sale,"The DOJ has filed an appeal against the approval of Voyager Digital's Chapter 11 bankruptcy plan, which would have allowed the company to sell ass...",84.04,50.0,0.4453986883163452,73.83500000000001,50.0,0.36448240280151367,2023-03-11
123,Blockchain News,SEC Revokes License of ParagonCoin Crypto Startup,"ParagonCoin, a crypto startup backed by rapper The Game, had its license revoked by the SEC for violating securities laws by failing to file perio...",50.0,45.0,1.3208627700805664,16.475,37.5,0.06533563137054443,2023-03-11
124,Cointelegraph,"Circle’s USDC instability causes domino effect on DAI, USDD stablecoins","Following USDC’s depegging, three stablecoins — DAI, USDD and FRAX — also depegged from the U.S. dollar.",50.0,50.0,1.4733165502548218,50.0,50.0,0.00865161418914795,2023-03-11
125,Blockchain News,Thailand SEC Considers Ban on Crypto Staking and Lending,Thailand's SEC is seeking public comments on a draft regulation that would ban virtual asset service providers from offering or engaging in any cr...,22.13,45.0,0.30021965503692627,53.86,55.00000000000001,0.14131665229797363,2023-03-11
126,Blockchain News,Meta to Launch Text-Based Content App Supporting Decentralized Social Networking,"Meta, the parent company of Facebook and Instagram, is reportedly creating a new text-based content app called P92 that will support ActivityPub, ...",72.02,57.08333333333333,97.02321290969849,79.97000000000001,56.81818181818181,0.007325410842895508,2023-03-11
127,Blockchain News,Judge Considers Dismissing Shaquille ONeal and Naomi Osaka from FTX Lawsuit,A federal judge in Florida is considering dismissing Shaquille O’Neal and Naomi Osaka from the FTX lawsuit due to uncertainty about whether they w...,38.685,50.0,0.6764262914657593,24.47,43.75,0.7432430982589722,2023-03-11
128,Blockchain News,"ARK Invest Buys Record Amount of Coinbase Stock, Despite Market Volatility","Despite recent market volatility, Cathie Wood’s investment manager ARK Invest has made a record purchase of Coinbase stock, along with significant...",50.0,50.0,99.13950562477112,50.0,59.375,95.84315121173859,2023-03-11
129,Blockchain News,Degen Zoo NFT Game Draws Huge Interest After Logan Paul's Crypto Zoo Scandal,"Degen Zoo, an NFT game inspired by Logan Paul's controversial Crypto Zoo concept, has attracted massive interest, with over 115,000 wallets regist...",67.0,50.0,95.16342282295227,90.10000000000001,52.5,99.68524873256683,2023-03-11
130,Blockchain News,Nigerian President-elect's Manifesto Includes Blockchain and Crypto Regulations,Nigerian President-elect Bola Tinubu has released a manifesto proposing the implementation of blockchain technology and cryptocurrencies in Nigeri...,50.0,50.0,1.1832952499389648,50.0,50.0,6.85194730758667,2023-03-11
131,BlockchainReporter,Circle’s $3.3 Billion Held by Silicon Valley Bank Triggers USDC Depegging Crisis,"Once the issuer of USD Coin (USDC), Circle, disclosed that it was unable to withdraw $3.3 billion from its $40 billion deposits from Silicon Valle...",18.755,50.0,0.2558887004852295,50.0,25.0,3.5726338624954224,2023-03-11
132,crypto.news,"USDC de-pegs, Kraken CEO wonders if the market is losing trust in US products","By Mar. 11, USDC, a stablecoin, de-pegged, falling to as low as $0.89 during the Asian session, trackers reveal",58.894999999999996,50.0,0.059604644775390625,29.905000000000005,50.0,0.00521540641784668,2023-03-11
133,"CoinDesk: Bitcoin, Ethereum, Crypto News and Price Data",DAI Depegs as Stablecoin Rout Plagues Crypto,MakerDAO’s decentralized stablecoin hits an all-time low of 0.88 cents.,50.0,50.0,0.14199018478393555,36.34,50.0,0.0027954578399658203,2023-03-11
134,Bitcoinist,USDC Issuer Circle Reveals It Couldn’t Withdraw $3.3 Billion From Silicon Valley Bank,Stablecoin issuer Circle disclosed late Friday that around $3.3 billion of its $40 billion USDC reserves remained at Silicon Valley Bank. This com...,50.0,50.0,0.17943084239959717,50.0,35.0,0.028765201568603516,2023-03-11
135,TheNewsCrypto,Silicon Valley Bank Shut Down by Regulators Amid Financial Woes,"The bank was shut down by authorities and transferred to the supervision of FDIC. On Wednesday, SVB reported that it had sold several instruments ...",27.98,46.11111111111111,0.025576353073120117,50.0,46.11111111111111,0.019875168800354004,2023-03-11
136,The Block,USDC and DAI remain at about $0.90 following Circle’s disclosure of funds at SVB,Many stablecoins are trading below their pegs after Circle disclosed that $3.3 billion of USDC's reserves is with Silicon Valley Bank.,50.0,50.0,0.3163576126098633,50.0,75.0,0.522109866142273,2023-03-11
137,crypto.news,Rootstock integrated 7 DeFi protocols in February,"Rootstock added seven DeFi protocols, integrated new tools, and removed the BTC/rBTC two-way peg as they move closer to complete decentralization",50.0,50.0,99.12919700145721,50.0,55.90909090909091,99.78300034999847,2023-03-11
138,The Block,Here are the court cases that will shape the future of crypto,Dragonfly Capital legal counsels break down several crypto court cases that are set to answer critical legal questions for the first time and expl...,50.0,50.0,99.88438487052917,46.14,54.120370370370374,99.95882213115692,2023-03-11
139,TheNewsCrypto,Top 5 Trending Cryptocurrencies on Twitter,"Shiba Inu (SHIB) has emerged as the most trending coin of the day. Bitcoin is trading at the price of $20,567, which increased by 3.29%. Here are ...",60.114999999999995,75.0,99.80359077453613,63.660000000000004,75.0,5.644327402114868,2023-03-11
140,CoinGape,Michael Burry Warns WorldCom Like Crash On The Way After SVB,,42.345,50.0,0.32490789890289307,50.0,50.0,0.0,2023-03-11
141,crypto.news,Coinbase will not back down on staking despite SEC’s stance,"Coinbase, a renowned crypto firm, in a recent statement, asserted that it will continue pushing for it's staking services. This comes after the fi...",50.0,45.74074074074074,0.11372864246368408,50.0,45.0,0.15286505222320557,2023-03-11
142,CoinGape,Breaking: VCs Agree To Support Silicon Valley Bank Again,Venture capital firms agree to support and ask portfolio companies to resume their banking relationship with Silicon Valley Bank again if the bank...,81.845,50.0,0.9897232055664062,81.845,50.0,5.59467077255249,2023-03-11
143,AMBCrypto,Litecoin registers this milestone despite a huge liquidity plunge,Litecoin maintains strong transaction volume on BitPay earning second place after Ethereum. LTC bears dominate while the network hash rate takes a...,37.945,70.0,99.32469725608826,71.075,60.83333333333333,99.82959628105164,2023-03-11
144,TheNewsCrypto,USDC Depegs as Circle Reveals Exposure To Struggling Silicon Valley Bank,"Circle verified that $3.3 billion of the USDC reserves was lying with SVB. As of this writing, the USDC was trading at $0.8974. The price of USD C...",28.925,50.0,1.016971468925476,23.665000000000003,50.0,0.0006496906280517578,2023-03-11
145,Coingabbar,"Beware of Fake ""CryptoGPT"" Accounts Offering Giveaways on Twitter","Key Takeaways There are fake ""CryptoGPT"" accounts on #Twitter offering cryptocurrency giveaways These accounts are not affiliated with #ChatGPT, t...",26.165,25.0,0.10299384593963623,26.165,37.5,0.005459785461425781,2023-03-11
146,AMBCrypto,Bankrupt crypto lender BlockFi reveals $227M exposure to Silicon Valley Bank,Bankrupt crypto lender BlockFi has revealed a $227 million exposure to Silicon Valley Bank. BlockFi&#8217;s deposits are not insured by the FDIC s...,22.13,50.0,0.03936886787414551,22.13,50.0,0.00992119312286377,2023-03-11
147,Coingabbar,Thailand's SEC Proposes Ban on Staking and Lending Services by VASPs,Key Takeaways Thailand's Securities and #Exchange Commission (SEC) has proposed a ban on staking and lending services offered by virtual asset ser...,22.13,45.0,0.46299099922180176,51.29,47.5,80.28960525989532,2023-03-11
148,BabyMetaFi,Baby’s Weekly Highlights #39,"Wassup, babies! How’s your new month so far? Baby can’t believe how time flies just like how Baby grows. Come to check how Baby BUIDL through Febr...",50.0,50.0,99.89289343357086,70.99499999999999,55.90909090909091,79.33822870254517,2023-03-11
149,BabyMetaFi,Baby Thursday Review - Mar 2nd,"As we have just ended our February productively, we started our new month right off with several bombshells! Find them all in our first Baby Thurs...",50.0,50.0,23.34403097629547,50.0,58.40097402597403,99.73188936710358,2023-03-11
150,BabyMetaFi,Baby’s Weekly Highlights #38,"Baby could only be BUIDL or BUIDLer! 💪🏻 Significant updates on Baby Wonderland brought the 2nd island on the stage, a major upgrade and rearrangeme...",50.0,50.0,99.87110495567322,63.56999999999999,55.46875,3.8158148527145386,2023-03-11
151,Cointelegraph,USDC investor shells out $2M to receive $0.05 USDT trying to evade crash,"While the crypto market responded with a massive sell-off, not all USDC investors were lucky enough to walk away with their funds amid the uncerta...",29.905000000000005,50.0,0.06293952465057373,71.075,55.55555555555556,0.062012672424316406,2023-03-11
152,CoinGape,"Stablecoins In Trouble? USDC, DAI, USDD Depeg As SVB Crisis Deepens","Crypto News: Dealing with a heavy sell off, the global digital asset market registered a broad recovery on Saturday morning. Bitcoin, Ethereum pri...",11.085,40.0,0.25249719619750977,68.06,48.28125,82.26952254772186,2023-03-11
153,AMBCrypto,Assessing EOS agony as Silvergate shutdown leads Block.One to count losses,The Silvergate Bank situation directly affected EOS&#8217; founding company. Price action showed that the token short-term projection could be far...,16.475,50.0,0.07438361644744873,42.345,55.00000000000001,1.9170671701431274,2023-03-11
154,Coingabbar,Federal Reserve Creates Specialized Team to Monitor Cryptocurrency Industry,Key Takeaways The #Federal Reserve has formed a new team to monitor the #cryptocurrency industry The team will focus on assessing potential risks ...,63.660000000000004,50.0,99.80684816837311,36.34,52.27272727272727,99.63890612125397,2023-03-11
155,BabyMetaFi,BabySwap Community is growing with YOU!,"Howdy, babies! No matter what market conditions we are in, or how old Baby is, we always want and need enthusiastic, experienced, hospitable, and ...",62.405,50.0,99.88768398761749,70.015,75.0,99.79467391967773,2023-03-11
156,CoinGape,Doge Supporter Mark Cuban Reveals Exposure To SVB,,63.660000000000004,50.0,4.621696472167969,50.0,50.0,0.0,2023-03-11
157,AMBCrypto,Silicon Valley Bank leaves USDC bleeding- Will it impact Stablecoin market?,"USDC&#8217;s market cap fell from $43.56 billion to $38.9 billion, a drop of over 11%. As per Nansen, Circle burned $2.34 billion worth of USDC in...",50.0,50.0,0.0019609928131103516,47.42,65.0,0.06803572177886963,2023-03-11
158,Bitcoinist,Silicon Valley Bank Collapse Hammers Dogecoin Price Down 11% – More Pain For DOGE?,"The cryptocurrency market has seen a decline in the value of Dogecoin (DOGE) as massive amounts of fear, uncertainty, and doubt swept across the m...",11.109999999999998,58.611111111111114,0.0579148530960083,15.46,50.0,0.06883740425109863,2023-03-11
159,Cointelegraph,Sen. Warren calls out 'sham audits' while SVB threatens crypto bankruptcy,"Contrasting her statements against crypto auditors, numerous members highlighted the ongoing collapse of Silicon Valley Bank (SVB), a Federal Depo...",30.910000000000004,40.0,0.06483793258666992,25.305,50.0,98.4415739774704,2023-03-11
160,Coingabbar,Silicon Valley Bank Raises Concerns with Significant Sale of Assets and Stocks,Key Takeaways #Silicon Valley Bank has sold a significant amount of assets and stocks The sale has raised concerns about the bank's financial stab...,68.06,68.75,5.000776052474976,68.06,56.25,3.313368558883667,2023-03-11
161,Cryptopia,Graphic Post: Which Cryptopia Character Are You?,"Looking to find out which female Cryptopia character you are? Pause to find out, and comment on the character you got to see if people agree! Happ...",50.0,50.0,0.014954805374145508,70.99499999999999,50.0,0.14289915561676025,2023-03-11
162,CoinGape,"Crypto Prices Today: XRP Drops; Cardano, Polygon, Solana Gains Over 4% As Market Recovers","Crypto Prices Today: Bitcoin and other Altcoins are seeing a jump yet again today. As of writing, Bitcoin price increased by 2.86% in the last 24 ...",67.0,50.0,0.4521876573562622,63.660000000000004,46.875,2.659487724304199,2023-03-11
163,AMBCrypto,Polygon: Decoding Starbucks’ Siren Collection launch and whales’ move,The latest NFT from Starbucks launched on Polygon on 9 March. MATIC whales conduct the highest volume of transactions in six months. Starbucks&#82...,50.0,50.0,96.30702435970306,56.400000000000006,75.0,98.76572489738464,2023-03-11
164,"CoinDesk: Bitcoin, Ethereum, Crypto News and Price Data","U.S. Lawmakers Met With Fed, FDIC to Discuss Collapse of Silicon Valley Bank: Source",Rep. Maxine Waters convened meetings with federal bank regulators in the wake of the bank's collapse.,25.305,50.0,0.5074799060821533,25.305,50.0,92.83569753170013,2023-03-11
165,CoinGape,USDC Depegs After Circle Reveals $3.3B Reserve At Failed SBV,,24.47,25.0,0.004029273986816406,50.0,50.0,0.0,2023-03-11
166,Cointelegraph,"Coinbase reiterates that staking services will continue, despite SEC crackdown","Despite the SEC looking to crack down on supposed unregistered securities offerings via staking rewards programs, Coinbase has outlined that its s...",50.0,45.0,80.3640753030777,82.43,43.611111111111114,13.417261838912964,2023-03-11
167,"CoinDesk: Bitcoin, Ethereum, Crypto News and Price Data",USDC Stablecoin and Crypto Market Go Haywire After Silicon Valley Bank Collapses,USDC's normally stable price sank to $0.89 from $1 while Ethereum gas fees soared hours after the crypto-tied bank failed.,35.199999999999996,50.0,1.118949055671692,36.34,41.25,0.004255771636962891,2023-03-11
