,source,title,excerpt,vader_sentiment_title,tb_sentiment_title,flair_sentiment_title,vader_sentiment_excerpt,tb_sentiment_excerpt,flair_sentiment_excerpt,date
84,Crypto Daily™,Crypto Gaming United (CGU) Is Now Available for Trading on LBank Exchange,"Road Town, BVI, 18th February, 2023, ChainwireLBank Exchange, a global digital asset trading platform, listed Crypto Gaming United (CGU) on Februa...",71.075,70.0,14.64260220527649,82.43,50.0,0.13664960861206055,2023-02-18
85,Blockchain News,How Cryptocurrencies Can Help You Find Love This Valentine's Day,A Valentine's Day poll reveals that cryptocurrency may be key in compatible relationships. (Read More),89.225,75.0,99.98497366905212,50.0,62.5,86.42837405204773,2023-02-18
86,Blockchain News,The amount of ETH burned will continue to increase as transaction fees are burned,"Since September 2022, traders have started withdrawing ETH from exchanges. (Read More)",65.91,50.0,0.06855130195617676,50.0,75.0,0.189325213432312,2023-02-18
87,The Block,Yield Guild Games raising $75 million venture fund to double down on web3 gaming,"Yield Guild Games (YGG), a top web3 gaming guild based in Asia, is entering the venture capital space and raising $75 million for its first fund.",50.0,46.11111111111111,1.0455191135406494,60.114999999999995,68.75,99.2764800786972,2023-02-18
88,Blockchain News,Silvergate Bank as defendants in a proposed class-action lawsuit from an FTX user,"FTX users have suggested a class-action lawsuit against Silvergate Capital Corp., Silvergate Bank, and CEO Alan Lane. (Read More)",38.685,50.0,3.364059329032898,38.685,75.0,0.09190142154693604,2023-02-18
89,AMBCrypto,Blockchain-based government-issued bond just rolled out in Hong Kong,Hong Kong issues the first blockchain-based tokenized bond in the world. A look at how this development might impact the future of the finance ind...,50.0,50.0,0.1543283462524414,50.0,56.25,97.09437191486359,2023-02-18
90,crypto.news,Several altcoins reach a new ATH as the general crypto market starts to recover,"Bitcoin (BTC) is trading in the green despite the Thursday dip, rising 14% over the week. Ethereum (ETH), on the other hand, has gained 12% over t...",51.29,53.1060606060606,7.471621036529541,85.015,41.875,0.21690428256988525,2023-02-18
91,AMBCrypto,Chainlink (LINK) Price Prediction 2025-2030: Network adoption spurs LINK,Disclaimer: The datasets shared in the following article have been compiled from a set of online resources and do not reflect AMBCrypto’s own rese...,50.0,50.0,98.67171347141266,67.0,65.0,0.043210387229919434,2023-02-18
92,CoinGape,"Just-In: Ark Invest CEO Cathie Wood’s Next Strategy On Bitcoin, Tesla And AI",Many market leaders such as Tesla CEO Elon Musk and Ark Invest CEO Cathie Wood slammed the U.S. Federal Reserve for continuous rate hikes impairin...,50.0,50.0,95.94493508338928,50.0,62.5,0.6678074598312378,2023-02-18
93,Bitcoinist,"Almost 25% Of New Crypto In 2022 Could Have Been ‘Pump And Dumps’, Study Finds","According to the most recent study conducted by Chainalysis, unwitting users spent around $4.6 billion worth of crypto, acquiring them in fraudule...",50.0,56.81818181818181,0.506708025932312,61.315,58.75,0.040462613105773926,2023-02-18
94,crypto.news,OpenSea implements zero fees as it takes on Blur,"Amid recent wrangles between OpenSea and Blur, OpenSea has introduced new developments as it looks to win back its customer base. OpenSea will now...",50.0,50.0,2.2470593452453613,79.295,51.36363636363637,99.2326408624649,2023-02-18
95,AMBCrypto,"Binance Coin (BNB) Price Prediction 2025-2030: Despite Paxos setback, BNB rises",Disclaimer: The datasets shared in the following article have been compiled from a set of online resources and do not reflect AMBCrypto’s own rese...,50.0,50.0,99.95289146900177,67.0,65.0,0.043210387229919434,2023-02-18
96,crypto.news,Caitlin Long of Custodia Bank says crypto won’t be “uninvented” and will steadily replace banks in remittance,"Caitlin Long, the founder of Custodia Bank, handed over evidence of fraud committed by big crypto firms before last year's crisis. She also says c...",50.0,52.916666666666664,99.60160851478577,11.085,49.166666666666664,0.2596050500869751,2023-02-18
97,AMBCrypto,VeChain (VET) Price Prediction 2025-2030: VET back in the race with 11% upswing?,Disclaimer: The datasets shared in the following article have been compiled from a set of online resources and do not reflect AMBCrypto’s own rese...,50.0,50.0,82.53280818462372,67.0,65.0,0.043210387229919434,2023-02-18
98,AMBCrypto,Binance CEO denies reports of Binance pulling back from U.S. partners,Changpeng Zhao has denied rumors about Binance Holdings cutting ties with U.S.-based partners.  A recent report claimed that the crypto giant woul...,28.925,50.0,1.6366302967071533,23.665000000000003,40.0,0.8744806051254272,2023-02-18
99,CoinGape,NBA Player Paul Pierce In Trouble Over Crypto Promotion,,29.905000000000005,40.0,0.1028209924697876,50.0,50.0,0.0,2023-02-18
100,AMBCrypto,"Polygon (MATIC) Price Prediction 2025-2030: MATIC moves to pre-2022 levels, with…",Disclaimer: The datasets shared in the following article have been compiled from a set of online resources and do not reflect AMBCrypto’s own rese...,50.0,50.0,81.79124295711517,67.0,65.0,0.043210387229919434,2023-02-18
101,AMBCrypto,Ripple (XRP) Price Prediction 2025-2030: Investors show faith in XRP,Disclaimer: The datasets shared in the following article have been compiled from a set of online resources and do not reflect AMBCrypto’s own rese...,71.075,50.0,96.16305828094482,67.0,65.0,0.043210387229919434,2023-02-18
102,Bitcoinist,"OpenSea Announces 0% Trading Fees, Cuts Creator Earnings","Leading NFT marketplace, OpenSea, has made some major announcements in the last few hours. Through their official Twitter account, OpenSea listed ...",35.199999999999996,50.0,0.028243660926818848,50.0,47.70833333333333,13.651236891746521,2023-02-18
103,AMBCrypto,LGND Music offers new revenue streams for artists with virtual vinyl,"LGND Music, the one-stop-shop for digital music collectibles, announces its innovative approach to music ownership, providing a new revenue stream...",50.0,55.90909090909091,98.97536933422089,72.02,60.60606060606061,99.80789124965668,2023-02-18
104,AMBCrypto,Algorand (ALGO) Price Prediction 2025-2030: TVL spurs ALGO to…,Disclaimer: The datasets shared in the following article have been compiled from a set of online resources and do not reflect AMBCrypto’s own rese...,50.0,50.0,23.293903470039368,67.0,65.0,0.043210387229919434,2023-02-18
105,CoinGape,5 Meme Coins That Are Outperforming Shiba Inu (SHIB) And Dogecoin (DOGE) In Feb 2023,"Dogecoin (DOGE) and Shiba Inu (SHIB) are the two highest-capitalized meme cryptocurrencies in the market. As of Friday evening, DOGE and SHIB had ...",50.0,50.0,0.007545948028564453,50.0,50.0,87.80147135257721,2023-02-18
106,AMBCrypto,A look at the Bitcoin [BTC] correlation score and its essence for investors,"There is a growing convergence between Bitcoin [BTC] and traditional stocks. Bitcoin&#8217;s correlation with DXY is, however, still at a divergen...",50.0,50.0,89.88988101482391,58.894999999999996,50.0,17.96281933784485,2023-02-18
107,CoinGape,The Matrix Star Keanu Reeves Is A Crypto Fan,,65.91,50.0,88.42381834983826,50.0,50.0,0.0,2023-02-18
108,AMBCrypto,Bitcoin (BTC) Price Prediction 2025-2030: Will BTC reach $30k in 2023?,Disclaimer: The datasets shared in the following article have been compiled from a set of online resources and do not reflect AMBCrypto’s own rese...,51.29,50.0,0.15594959259033203,67.0,65.0,0.043210387229919434,2023-02-18
109,AMBCrypto,Free Bets launch a truly decentralized betting aggregator,"With the ever-tightening rules around KYC (Know Your Customer), paired with a growing appetite for anonymity amongst global digital consumers, Fre...",86.75500000000001,70.0,96.67942225933075,58.894999999999996,50.0,97.70325720310211,2023-02-18
110,BSCnews,"Core Empowers User Ownership, Says CORE Contributor","Core DAO promotes user ownership with its design, token distribution, and governance.",50.0,50.0,99.93264079093933,67.0,50.0,99.91847574710846,2023-02-18
111,AMBCrypto,Ethereum (ETH) Price Prediction 2025-2030: Developments affect ETH in this manner,Disclaimer: The datasets shared in the following article have been compiled from a set of online resources and do not reflect AMBCrypto’s own rese...,50.0,50.0,99.30809736251831,67.0,65.0,0.043210387229919434,2023-02-18
112,CoinGape,Polygon (MATIC) Bullish: Whale Caught Moving Millions Of MATIC,The MATIC token is the native token of the Polygon network. A technology platform that was launched to connect and grow Ethereum-compatible projec...,50.0,50.0,0.024390220642089844,56.400000000000006,50.0,98.54725301265717,2023-02-18
113,AMBCrypto,Cardano (ADA) Price Prediction 2025-2030: At what level will ADA stabilize?,Disclaimer: The datasets shared in the following article have been compiled from a set of online resources and do not reflect AMBCrypto’s own rese...,50.0,50.0,14.590564370155334,67.0,65.0,0.043210387229919434,2023-02-18
114,AMBCrypto,"Filecoin [FIL] hiked by 40%, investors can benefit from these levels","Disclaimer: The information presented does not constitute financial, investment, trading, or other types of advice and is solely the writer’s opin...",72.94,50.0,1.5712738037109375,50.0,46.875,0.11563897132873535,2023-02-18
115,CoinGape,"Crypto Prices Today: Bitcoin (BTC), Ethereum (ETH), Polygon (MATIC), Polkadot (DOT)","Crypto Prices Today: Bitcoin and other Altcoins are seeing a jump yet again today as Ethereum shoots past the 1700 mark. As of writing, Bitcoin pr...",50.0,50.0,24.8354434967041,50.0,40.625,3.6111295223236084,2023-02-18
116,CoinGape,Rich Dad Poor Dad Author Advices Bitcoin As Hedge Against Unstable Time,,37.5,49.375,0.1419663429260254,50.0,50.0,0.0,2023-02-18
117,BSCnews,Purchase Wifi Zones Using Pi with PiCyber Application,PiCyber’s goal is to make the internet accessible in areas without traditional internet access.,50.0,50.0,7.802093029022217,50.0,59.375,94.72997784614563,2023-02-18
118,Cointelegraph,Custodia Bank CEO slams Washington’s ‘misguided crackdown’ on crypto,Caitlin Long revealed that she had warned government agencies of major “fraud” in the crypto space months before several firms went bankrupt.,50.0,50.0,0.22557079792022705,15.46,50.208333333333336,95.75603306293488,2023-02-18
119,Cointelegraph,OpenSea implements 0% fees to win over NFT userbase lost to Blur,NFT marketplace Blur surpassed OpenSea in daily ETH trading volume as users — anticipating greater returns on their NFT investments — are looking ...,68.06,90.0,4.959008097648621,68.06,62.5,1.0993748903274536,2023-02-18
120,Cointelegraph,OpenSea implements 0% fees to win over NFT user base lost to Blur,NFT marketplace Blur surpassed OpenSea in daily ETH trading volume as users — anticipating greater returns on their NFT investments — are looking ...,68.06,50.0,8.039391040802002,68.06,62.5,1.0993748903274536,2023-02-18
121,CryptoGlobe,"Polygon ($MATIC) Could Outperform $BTC ahead of Major Launch, Popular Analyst Suggests","Polygon ($MATIC), a&#160;Layer-2 scaling solution for Ethereum that provides users with faster transactions and lower costs as a parallel blockcha...",71.075,66.5625,0.2103745937347412,51.29,50.0,99.99591112136841,2023-02-18
122,CoinGape,"Ethereum Price (ETH) Shoots Past $1,700 to Hit 5-Month High With Whale Support","After facing a bit of selling pressure on the Fed rhetoric, the crypto market is showing signs of recovery again. The Ethereum price (ETH) is up b...",70.095,47.75,3.447115421295166,35.199999999999996,50.0,15.879267454147339,2023-02-18
123,BSCnews,A Look at Pi Network’s Vision and Mission Statement,Pi Network is on track toward fulfilling its vision in the blockchain industry.,62.5,50.0,99.88539814949036,62.5,50.0,99.86878037452698,2023-02-18
124,BSCnews,A look at Pi Network’s Vision and Mission Statement,Pi Network is on track toward fulfilling its vision in the blockchain industry.,62.5,50.0,99.88539814949036,62.5,50.0,99.86878037452698,2023-02-18
125,Bitcoinist,Floki Inu Axes Way Up By 145% In The Weekly As Interest In The Meme Coin Grows,"Floki Inu, a meme currency built on top of Binance’s BNB chain, has been making big headlines of late. Amidst the big names in the meme coin space...",72.94,50.0,94.04079914093018,60.114999999999995,52.5,98.84051084518433,2023-02-18
126,CoinGape,Crypto Market News Live Updates 18 Feb: SEC charges $1.4 million to Paul Pierce for making false statements about EMAX Tokens!,"Crypto Market News Today Live Updates and Latest News: (18 February 2023): Paul Pierce, a former NBA player and star for the Boston Celtics, has a...",33.089999999999996,42.27272727272727,0.025260448455810547,50.0,48.57954545454545,1.1198848485946655,2023-02-18
127,AMBCrypto,Aptos [APT]: Bears eke out a victory over bulls – cause for concern?,"APT’s price declined by over 11% in the last 24 hours. Market indicators looked bearish, but a few metrics supported the bulls. The bearish market...",50.0,80.0,3.571152687072754,72.485,56.666666666666664,0.001710653305053711,2023-02-18
128,CoinGape,Top 3 Altcoins With A Bullish Pattern Could Explode In Coming Weeks,"The cryptocurrency market struggling to follow its early week recovery indicates the market is still in a state of uncertainty, as several crypto ...",60.114999999999995,75.0,79.66683804988861,18.154999999999998,52.5,0.036016106605529785,2023-02-18
129,NewsBTC,Brazilian Government To Clarify Bitcoin Law With New Decree,The Brazilian government is set to issue a decree that modifies some of the rules established in the Bitcoin Law approved in November 2022 by form...,50.0,56.81818181818181,24.38531517982483,71.075,50.0,1.1153489351272583,2023-02-18
130,AMBCrypto,Where do OP holders stand as Optimism reschedules Bedrock upgrade?,The Optimism team suspended the Bedrock upgrade and shifted it to a later date OP’s circulation remained low despite recent gains. According to a ...,77.115,50.0,1.396101713180542,29.549999999999997,50.0,0.014457106590270996,2023-02-18
131,CoinGape,"Top Crypto Token Price For Today, Feb 18th",,60.114999999999995,75.0,99.98736679553986,50.0,50.0,0.0,2023-02-18
132,AMBCrypto,"Filecoin [FIL] makes a stunning comeback in 2023, is this the reason?","At the time of writing, FIL jumped 25% over the previous day. Filecoin&#8217;s daily cumulative revenue over the last 180 days was second only to ...",69.08999999999999,75.0,90.5734270811081,50.0,48.333333333333336,3.0212044715881348,2023-02-18
133,Cointelegraph,YouTube appoints Web3-friendly exec as new CEO,YouTube’s new CEO Neal Mohan previously emphasized that NFTs could be an important tool for the platform’s content creators to develop additional ...,50.0,56.81818181818181,17.32463836669922,60.114999999999995,56.161616161616166,13.475042581558228,2023-02-18
134,AMBCrypto,"Litecoin’s hashrate reached new all-time high, here’s how LTC reacted",Litecoin’s hashrate reached a new all-time high on 15 February 2023. Active addresses declined but other metrics were positive.  The Litecoin Foun...,55.135,57.40909090909091,15.256541967391968,89.38,52.6530303030303,0.008296966552734375,2023-02-18
135,CryptoGlobe,Shiba Inu ($SHIB) Address Numbers Surpass 1.3 Million Ahead of Expected Shibarium Launch,The total number of addresses holding onto the meme-inspired cryptocurrency Shiba Inu ($SHIB) on the Ethereum blockchain has recently surpassed 1....,50.0,45.0,20.689505338668823,53.86,50.0,0.6492733955383301,2023-02-18
136,AMBCrypto,Ethereum [ETH] holders bridging to L1 & L2 should read this,Blockchain insight firm mentioned that L1 and L2 bridges could be risky for ETH. The wallets provided by Optimism and Arbitrum may not be as safe ...,50.0,50.0,99.52661395072937,53.785000000000004,57.49999999999999,0.44500529766082764,2023-02-18
137,CoinGape,Will These New Changes Help OpenSea Outmatch Rival Blur In NFT Race?,"OpenSea, the leading non-fungible token (NFT) marketplace, announced today that it will temporarily eliminate its 2.5% fee on sales, as well as cu...",70.095,56.81818181818181,99.95742440223694,63.660000000000004,50.0,0.1853257417678833,2023-02-18
138,Decrypt,Trader Makes $100K in Seconds Front-Running Token Listing on Binance,"A trader whose wallet had already been associated with front-running token listings on Binance made over $100,000 in profit on Friday.",50.0,50.0,3.40859591960907,72.02,50.0,5.74975311756134,2023-02-18
