,source,title,excerpt,vader_sentiment_title,tb_sentiment_title,flair_sentiment_title,vader_sentiment_excerpt,tb_sentiment_excerpt,flair_sentiment_excerpt,date
168,Cointelegraph,USDC depegs as Circle confirms $3.3B stuck with Silicon Valley Bank,"At the time of writing, USDC had lost over 10% of its value as it traded at $0.8774, and a Circle executive envisions broader implications for bus...",37.5,50.0,0.005435943603515625,51.29,50.0,0.06405115127563477,2023-03-11
169,Decrypt,"Coinbase, Binance Suspend USDC Conversions as Dollar Peg Wobbles","After Circle disclosed how much of its USDC stablecoin is backed by reserves held by Silicon Valley Bank, exchanges show caution signs.",34.089999999999996,50.0,0.005179643630981445,51.29,60.0,0.008487701416015625,2023-03-11
170,CoinGape,"USDC’s Dollar Peg Fumbles, Coinbase Pauses USDC:USD Conversions","Circle, the issuer of the USDC stablecoin is facing massive heat from the shutdown of the Silicon Valley Bank (SVB) on Friday, March 10. Circle ha...",50.0,50.0,0.006937980651855469,50.0,50.0,0.001245737075805664,2023-03-11
171,AMBCrypto,"Kucoin under regulatory pressure, can shorting yield more gains","Disclaimer: The information presented does not constitute financial, investment, trading, or other types of advice and is solely the writer’s opin...",56.315000000000005,75.0,98.4880656003952,50.0,46.875,0.11563897132873535,2023-03-11
172,"CoinDesk: Bitcoin, Ethereum, Crypto News and Price Data",Coinbase Pauses Conversions Between USDC and U.S. Dollars as Banking Crisis Roils Crypto,"Circle's USDC stablecoin was hit by the shutdown of Silicon Valley Bank, one of its key banking partners.",18.755,50.0,0.059610605239868164,50.0,50.0,0.03032088279724121,2023-03-11
173,Cointelegraph,Circle discloses $3.3B tied up at Silicon Valley Bank,Circle joined other customers and depositors in calling for the continuity of SVB in the US economy.,50.0,50.0,0.1411736011505127,50.0,43.75,75.85873603820801,2023-03-11
174,TheNewsCrypto,BitMEX Co-founder Arthur Hayes Proposes Bitcoin-backed Stablecoin,Arthur thinks the crypto community can build a USD equivalent without using the USD. NakaDollar would first include establishing a blockchain-base...,50.0,50.0,0.7294952869415283,50.0,62.5,0.8782297372817993,2023-03-11
175,The Block,Coinbase halts conversion feature between U.S. dollars and USDC,"Coinbase has halted conversions between USDC and US dollars, according to a tweet by the exchange-operator.",50.0,50.0,0.06283819675445557,50.0,50.0,0.004369020462036133,2023-03-11
176,CoinGape,BREAKING: Elon Musk Shows Interest In Buying The Troubled Silicon Valley Bank,"On Friday, March 10, California Banking regulators announced the shutdown of the Silicon Valley Bank (SVB) Financial Group. SVB ran into major tro...",50.0,25.0,13.25649619102478,50.0,51.5625,0.029295682907104492,2023-03-11
177,"CoinDesk: Bitcoin, Ethereum, Crypto News and Price Data",Circle Confirms $3.3B of USDC's Cash Reserves Stuck at Failed Silicon Valley Bank,"Silicon Valley Bank, one of the reserve banking partner for Circle's USDC stablecoin, was shut down by regulators on Friday.",17.570000000000004,25.0,0.028949975967407227,50.0,42.22222222222222,0.024825334548950195,2023-03-11
178,AMBCrypto,SHIB’s correction cleared most of 2023 gains- Can bulls prevail?,"Disclaimer: The information presented does not constitute financial, investment, trading, or other types of advice and is solely the writer’s opin...",73.515,75.0,86.78255677223206,50.0,46.875,0.11563897132873535,2023-03-11
179,The Block,Circle says $3.3 billion of USDC reserves are with Silicon Valley Bank,Circle says USDC's exposure to Silicon Valley Bank stands at $3.3 billion.,50.0,50.0,9.970980882644653,50.0,50.0,85.55961549282074,2023-03-11
180,CoinGape,"MATIC Price Analysis Points to 8-10% Relief Rally Ahead, But There’s a Catch","Silicon Valley Bank (SIVB), a crypto-friendly bank, experienced a significant decline of 60.4% in its share price on March 9th. This decline had a...",63.085,50.0,93.99532973766327,72.94,79.375,0.0034749507904052734,2023-03-11
181,BlockchainReporter,What is CryptoGPT: The Future of AI Development on Blockchain,It is possible that the differences between different technological fields will become less clear as more advanced technologies find their way int...,50.0,50.0,99.48770105838776,77.86999999999999,56.94444444444444,77.00740694999695,2023-03-11
182,AMBCrypto,Optimism: Can this new announcement save OP from the bear attack,"Optimism announced that voting for its Retroactive Public Goods Financing (RetroPGF) was ongoing, at press time.  Daily active addresses of OP inc...",77.86999999999999,56.81818181818181,99.87342953681946,86.75500000000001,47.77777777777778,4.689595103263855,2023-03-11
183,Cointelegraph,Filing shows BlockFi has uninsured $227M in Silicon Valley Bank MMMF,"BlockFi’s capital allocated to the money market mutual fund is not FDIC insured, however the fund doesn’t appear to be managed by Silicon Valley B...",50.0,50.0,0.015091896057128906,50.0,50.0,0.17979145050048828,2023-03-11
184,"CoinDesk: Bitcoin, Ethereum, Crypto News and Price Data",Circle’s USDC Endured $1B of Net Redemptions Since Silicon Valley Bank's Shutdown,Stablecoin issuer Circle held an undisclosed amount of USDC’s cash reserves at failed Silicon Valley Bank.,50.0,50.0,0.06804764270782471,24.47,25.0,0.6423622369766235,2023-03-11
185,Seeking Alpha,"Bitcoin on track for ~10% weekly loss on Fed fears, end of Silvergate Bank",Bitcoin (BTC-USD) is on track to post ~9.7% weekly loss as risk sentiment was dented by Federal Reserve Chair Jerome Powell's testimonies that sig...,18.755,50.0,0.028657913208007812,23.665000000000003,50.0,0.05041062831878662,2023-03-11
186,Decrypt,"As Silicon Valley Bank Falls, Crypto Firms Brace for 'Extinction-Level' Tech Startup Turmoil",The effects of Silicon Valley Bank's failure are only beginning to be felt. Here's what's going on.,31.94,50.0,0.14244616031646729,24.47,42.083333333333336,2.2730350494384766,2023-03-11
187,braintrust,A Message From Our Co-Founder Regarding SVB Failure.,"It has been an unprecedented week in banking, witnessing the collapse of two major institutions: Silicon Valley Bank (SVB) and Silvergate Bank. Wh...",24.47,34.166666666666664,23.913124203681946,25.305,66.5625,0.09759068489074707,2023-03-11
188,"CoinDesk: Bitcoin, Ethereum, Crypto News and Price Data",USDC Issuer Circle Says it 'Awaits Clarity' From FDIC on Silicon Valley Bank Collapse,"In its first statement following the collapse of Silicon Valley Bank, Circle declined to state how much cash it has tied up at the bank.",47.42,50.0,13.070401549339294,25.305,57.49999999999999,0.03229081630706787,2023-03-11
189,"CoinDesk: Bitcoin, Ethereum, Crypto News and Price Data",USDC Stablecoin Depegs From $1; Circle Says Operations Are Normal,"USDC dropped to $0.973, its lowest level since the collapse of FTX.",50.0,57.49999999999999,0.28034448623657227,14.984999999999998,50.0,0.0730752944946289,2023-03-11
