,source,title,excerpt,vader_sentiment_title,tb_sentiment_title,flair_sentiment_title,vader_sentiment_excerpt,tb_sentiment_excerpt,flair_sentiment_excerpt,date
244,The Block,Blockchain.com to wind down its asset management arm,"Crypto startup Blockchain.com winding down its asset management arm, which launched last April.",68.06,42.22222222222222,0.08243322372436523,72.94,46.11111111111111,0.017088651657104492,2023-03-10
245,CryptoSlate,Gaming accounts for 45% of web3 industry active wallets despite decrease in activity,"On-chain gaming accounts for 45.43% of the decentralized application (dApp) industry, even though gaming-related Daily Unique Active Wallets (dUAW...",70.095,43.333333333333336,96.06549143791199,70.095,54.02777777777777,97.04940021038055,2023-03-10
246,Crypto Daily™,How Decentralisation is Democratising Virtual Worlds and Gaming,"In the early days of the internet, the world wide web was a wild west of information, with centralised institutions controlling both the flow of d...",50.0,50.0,82.84208476543427,50.0,51.66666666666667,96.1237370967865,2023-03-10
247,CoinGape,Starbucks First NFT Collection Sold Under 20 Minutes,,50.0,62.5,4.098385572433472,50.0,50.0,0.0,2023-03-10
248,The Block,"Hedera confirms hackers stole tokens from DEXs, exploiting a bug in ‘smart contract service’",The core team at Hedera reported that the attackers targeted liquidity pools on multiple decentralized exchanges (DEXs) to steal assets.,27.98,60.71428571428571,0.12132227420806885,13.245000000000001,50.0,0.07582008838653564,2023-03-10
249,Finbold,"Crypto crisis: Bitcoin crashes below $20,000 – what’s next for investors?","After its global market capitalization dropped below the psychological threshold of $1 trillion, the cryptocurrency sector has continued to slump ...",18.755,50.0,0.02079904079437256,50.0,50.0,0.005984306335449219,2023-03-10
250,AMBCrypto,Crypto VCs ask portfolios to pull funds from Silicon Valley Bank,"Crypto-focused venture capital investors have advised their portfolio companies to withdraw funds from Silicon Valley Bank. SVB Financial Group, t...",50.0,50.0,0.3179699182510376,50.0,50.0,0.03471970558166504,2023-03-10
251,CryptoSlate,Bitcoin whales are the first cohort to start accumulating below $20k,Definition This metric breaks down the Accumulation Trend Score into the relative behaviour by various entity wallet cohorts. The post Bitcoin wh...,50.0,62.5,0.009694695472717285,50.0,47.40740740740741,83.02788436412811,2023-03-10
252,Connor Sephton,"Bitcoin Plunges Below $20,000 as Another U.S. Bank Sparks Global Market Sell-Offs","Concerns about regulatory uncertainty in the U.S. haven't gone away, but this doesn't appear to be the driving force behind Friday's downturn.",50.0,50.0,0.0540316104888916,41.105000000000004,30.0,4.055044054985046,2023-03-10
253,Crypto Adventure,BingX - A Crypto Exchange with Enhanced Copy Trading Features and More,"As the number of traders in the crypto industry grows, different people look for different products to suit their needs. One of the most popular n...",50.0,75.0,99.88431334495544,76.27999999999999,63.74999999999999,99.98420476913452,2023-03-10
254,The Block,"Ark loads up on Coinbase stock, adds more than $20 million across two funds",Ark Invest has been buying more Coinbase stock over the past few months despite increased regulatory scrutiny and dwindling trading volumes on the...,50.0,75.0,93.01169514656067,39.715,50.83333333333333,17.90315806865692,2023-03-10
255,Cointelegraph,17 biggest crypto heists of all time,Crypto exchanges are hacked surprisingly often. A few of the biggest crypto heists that occurred in the past few years are discussed in this article.,50.0,50.0,0.043514370918273926,43.6,50.625,0.011685490608215332,2023-03-10
256,CryptoSlate,Crypto liquidations top $300M as Bitcoin drops below $20k,"Bitcoin (BTC) tumbled below $20,000 for the first time since the beginning of the year and liquidated $123.25 million long positions held on the a...",60.114999999999995,75.0,0.188407301902771,50.0,55.00000000000001,0.020685791969299316,2023-03-10
257,salmonation,Understanding the Process of Creating a Blockchain Main Net,Hashtag: #blockchainmainnet Blockchain technology has revolutionized the world by providing a decentralized system for verifying and processing tr...,64.8,54.166666666666664,99.98467564582825,50.0,50.0,99.7556984424591,2023-03-10
258,Cointelegraph,Judge mulls removing Shaq and Naomi Osaka from FTX lawsuits,The plaintiffs have until December to show cause as to why the two sports stars should not be dismissed from the lawsuit.,42.345,50.0,12.144723534584045,38.685,50.0,10.855773091316223,2023-03-10
259,CryptoSlate,"Over $320M in liquidations in the past 24 hours, as Bitcoin loses $20k support",Quick Take Due to the fallout of SIlvergate Capital and possible further contagion in the bank and financial sector. The post Over $320M in liqui...,55.135,36.25,0.004065036773681641,27.060000000000002,52.083333333333336,6.458273530006409,2023-03-10
260,AMBCrypto,Hedera [HBAR] becomes the latest victim of network downtime,An unknown technical glitch sends Hedera to a grinding halt. HBAR bears turbocharging their assault as the dices fall in their favor. Hedera netwo...,36.34,60.62499999999999,0.0027179718017578125,36.34,47.5,0.7127732038497925,2023-03-10
261,Shido,Shido MasterCard & Bank Launch Date!,Shido MasterCard & Bank Launch Date! Next week we are announcing the launch date of Shido MasterCard & Bank! It's coming sooner than you think. Av...,50.0,50.0,99.97585415840149,50.0,50.0,98.90205264091492,2023-03-10
262,Cointelegraph,Meta working on text-based decentralized social network codenamed P92,"Meta is reportedly building a decentralized, text-based social network that supports ActivityPub — the decentralized social networking protocol po...",50.0,51.66666666666667,88.44701051712036,68.06,51.66666666666667,3.1253963708877563,2023-03-10
263,CryptoJelleNL,What Is the Rainbow Chart in Crypto and How To Use It?,"Bitcoin enthusiasts have developed a wide range of indicators and models to predict future prices. In this article, we take a look at one of the f...",50.0,50.0,8.918645977973938,67.0,50.0,12.520140409469604,2023-03-10
264,Altcoin Buzz,Crypto Whales Are Buying These 3 Altcoins,There are many ways how you can gain profits in crypto. One option is to follow whale wallets and see what they are buying. This shows you what th...,50.0,50.0,23.997589945793152,87.14999999999999,75.0,3.5895049571990967,2023-03-10
265,Altcoin Buzz,A Beginner’s Guide to Fantom Part 2,"Transaction fees and transaction speed are two of the major problems of older blockchains. However, newer platforms like Fantom have found ways to...",50.0,50.0,99.94044303894043,47.42,55.729166666666664,13.63089382648468,2023-03-10
266,CryptoJelleNL,How To Make a Crypto Trading Plan,"Previously, we dove into how to plan ahead and optimise your trading in 2023. In this article, we take a closer look at trading plans and the step...",50.0,50.0,79.64410781860352,72.02,41.66666666666667,75.78319907188416,2023-03-10
267,Altcoin Buzz,A Beginner’s Guide to Fantom Part 1,"Ethereum is easily the biggest blockchain, aside from Bitcoin. But for many years, Ethereum users complained about the high cost of transactions a...",50.0,50.0,99.93687570095062,28.449999999999996,59.916666666666664,7.894799113273621,2023-03-10
268,Blockchain News,Biden's Budget Proposal Includes Crackdown on Crypto Wash Sales and Doubling of Capital Gains Tax for Certain Investors,U.S. President Joe Biden's fiscal 2024 budget plan proposes a crackdown on crypto wash sales and a doubling of the capital gains tax for certain i...,77.115,60.71428571428571,0.6051540374755859,77.115,60.71428571428571,0.10505318641662598,2023-03-10
269,Cardano,Maintaining Stability: How Cardano’s Fiat-Backed USDA Stablecoin Handles Depegging,Depegging: The stablecoin kryptonite Stablecoins are cryptocurrencies designed to maintain price stability and are pegged to an external asset. Th...,50.0,50.0,99.14624691009521,68.06,50.0,0.6043404340744019,2023-03-10
270,Blockchain News,FTX Founder's Lawyers Consider Delaying Criminal Trial,Lawyers representing FTX founder Sam Bankman-Fried have hinted that they may need to delay his criminal trial due to a lack of evidence from the D...,23.665000000000003,30.0,0.5557119846343994,10.470000000000002,36.875,0.6833285093307495,2023-03-10
271,Blockchain News,Silvergate Bank Voluntary Liquidation Sparks Controversy in Crypto Industry,"The recent announcement of Silvergate Bank’s voluntary liquidation has led to a heated debate in the crypto industry, with some lawmakers labeling...",50.0,50.0,5.310371518135071,50.0,50.0,2.3794740438461304,2023-03-10
272,Bitcoinist,Biden Budget: U.S. Treasury To Impose 30% Tax On Crypto Mining Operations,"On Thursday, March 9, U.S. President Biden revealed his budget proposal for 2024. Under the Biden Budget, the U.S. Treasury Department is looking ...",44.865,50.0,2.1175265312194824,60.114999999999995,50.0,16.641828417778015,2023-03-10
273,Blockchain News,Jimmy Fallon Fights Subpoena in NFT Legal Battle,"Lawyers for Jimmy Fallon have filed a petition to quash a subpoena requiring him to testify in the Yuga Labs Inc. v. Ripps et al. case, stating th...",20.705000000000002,60.0,79.77537512779236,50.0,50.0,2.667751908302307,2023-03-10
274,Blockchain News,BitMEX Co-Founder Proposes Bitcoin-Backed Stablecoin,"Arthur Hayes, the co-founder and former CEO of BitMEX, has proposed creating a new stablecoin called the Satoshi Nakamoto Dollar (NUSD) or NakaDol...",50.0,50.0,0.2523273229598999,64.8,53.40909090909091,0.3016531467437744,2023-03-10
275,Blockchain News,Federal Judge Refuses to Consolidate Class-Action Lawsuits Against FTX Exchange,"A federal judge has denied a request to consolidate five proposed class-action lawsuits against the bankrupt crypto exchange FTX. The plaintiffs, ...",42.345,50.0,1.6011595726013184,10.18,50.0,10.862061381340027,2023-03-10
276,Blockchain News,"Mt. Gox Creditors Given Extra Month to Register Claims, Distribution Deadline Delayed","The registration deadline for Mt. Gox creditors has been pushed back by another month, allowing creditors to file claims until April 6. The distri...",38.685,50.0,0.4017472267150879,50.0,50.0,0.023823976516723633,2023-03-10
277,Blockchain News,"BaFin Declines to Classify NFTs as Securities, Recommends Case-by-Case Approach",The Federal Financial Supervisory Authority of Germany (BaFin) has stated that it is not yet prepared to classify non-fungible tokens (NFTs) as se...,73.83500000000001,50.0,0.16083717346191406,45.295,50.0,0.05785822868347168,2023-03-10
278,Blockchain News,FTX to Sell Remaining Interest in Sequoia Capital to Abu Dhabi Sovereign Wealth Fund,FTX has struck a deal with a company owned by the government of Abu Dhabi to sell its remaining interest in venture capital firm Sequoia Capital f...,86.75500000000001,50.0,0.061264634132385254,62.5,40.0,0.16773641109466553,2023-03-10
279,Blockchain News,Safeheron Discovers Security Flaw in MPC Wallets,Safeheron has identified a security flaw in MPC wallets when used with Starknet-based apps like dYdX and Fireblocks. The flaw allows attackers to ...,67.0,50.0,0.27008652687072754,52.580000000000005,50.0,0.14664828777313232,2023-03-10
280,Crypto Daily™,Community Fears Exploit As Hedera Halts Wallet And App Access,"The Hedera network has stopped all access to its wallet and app as it investigates technical irregularities, which could be due to a possible expl...",25.305,50.0,0.02804100513458252,38.685,47.91666666666667,0.0039517879486083984,2023-03-10
281,CoinGape,Breaking: Voyager Creditors To Challenge US DOJ Appeal In Binance.US-Voyager Deal,Voyager creditors committee on Friday said it will work with Debtors to challenge any appeal against the Bankruptcy Court&#8217;s approval of Bina...,53.86,50.0,1.5115141868591309,76.335,50.0,15.689289569854736,2023-03-10
282,crypto.news,Starbucks sells out 2k NFTs in under 20 minutes,"Starbucks recently released its inaugural collection of NFTs. The collection consists of 2,000 digital &#8220;stamps&#8221; named &#8220;Journey S...",50.0,50.0,4.992952942848206,50.0,50.0,99.57732260227203,2023-03-10
283,Cointelegraph,"SEC of Thailand wants public feedback on crypto lending, staking ban",Thailand’s securities regulator believes that crypto firms should not be allowed to deploy users’ deposits and provide lending services.,22.13,51.66666666666667,0.17434656620025635,64.8,50.0,0.2886652946472168,2023-03-10
284,"CoinDesk: Bitcoin, Ethereum, Crypto News and Price Data",Facebook Parent Company Meta Exploring Decentralized App: Report,"The app, codenamed P92, will be a standalone product for sharing text updates",50.0,50.0,7.9062968492507935,71.075,50.0,1.253315806388855,2023-03-10
285,SuperExet,6 Interesting and Practical AI Tools — Blockchain 101,"Recently, a chat robot program called ChatGPT has been soaring in the capital market all the way out of the circle! On YouTube, we can see that pe...",70.095,75.0,99.95378255844116,50.0,50.0,96.22628390789032,2023-03-10
286,Coingabbar,Federal Judge Denies Request to Consolidation of FTX Class-Action Lawsuits,"Key Takeaways There are multiple class-action lawsuits filed against #FTX, a #cryptocurrency exchange Plaintiffs requested the consolidation of th...",23.665000000000003,50.0,5.400460958480835,42.345,50.0,0.4439622163772583,2023-03-10
287,AMBCrypto,"Dogecoin, Shiba Inu bleed as market braces itself for FTX-like scenario","Both DOGE and SHIB registered double-digit losses in the last seven days. The number of whale transactions increased sharply, implying a sell-off....",50.0,50.0,0.3835827112197876,46.14,46.875,0.09431838989257812,2023-03-10
288,crypto.news,Hedera temporarily disables network services after exploit,"Hedera has announced that it has turned off network proxies on its mainnet due to an exploit. Critical network services like wallets, decentralize...",44.865,50.0,0.14996230602264404,47.42,46.875,0.06966888904571533,2023-03-10
289,Coingabbar,BaFin addresses legal classification of NFTs as potential securities in Germany,Key Takeaways #BaFin is the regulatory body for financial markets in Germany BaFin has addressed the legal classification of #NFTs (non-fungible t...,70.095,55.00000000000001,98.26369285583496,56.400000000000006,53.333333333333336,93.23217570781708,2023-03-10
290,"CoinDesk: Bitcoin, Ethereum, Crypto News and Price Data",Ether Hits Two-Month Low Under $1.4K as Coinbase Premium Index Dwindles,The decline comes as New York Attorney General referred to ETH as security in its lawsuit against the cryptocurrency exchange KuCoin.,36.34,50.0,0.0008821487426757812,56.400000000000006,54.659090909090914,0.02358555793762207,2023-03-10
291,WEMIX,Introducing WEMIX PLAY 3.0,"We are introducing WEMIX PLAY 3.0, a newly updated blockchain game platform of WEMIX PLAY. WEMIX PLAY, a leading blockchain gaming platform which ...",74.11999999999999,50.0,99.56389665603638,92.775,43.40909090909091,98.85938465595245,2023-03-10
292,Bonfida,Weekly Roundup,"SNS Statistics As per usual we always provide you with up-to-date Solana name service statistics every Monday. From the stats, you can see that se...",50.0,50.0,99.55664575099945,50.0,37.5,95.6583559513092,2023-03-10
293,Cointelegraph,Rapper The Game's crypto startup gets registration revoked,The SEC said that ParagonCoin Limited violated securities laws for failing to file the required periodic reports.,50.0,30.0,0.035765767097473145,12.469999999999997,45.714285714285715,0.21790862083435059,2023-03-10
294,Bonfida,Weekly Roundup,Statistics The final Monday-to-Monday stats for the month revealed that we had approximately 1.5K new domain registrations and 870 secondary sales...,50.0,50.0,99.55664575099945,50.0,42.95454545454545,0.2986311912536621,2023-03-10
295,AMBCrypto,U.S. Congressman cautions about privacy concerns regarding CBDCs,U.S. Congressman Tom Emmer believes that the introduction of CBDCs will jeopardize the financial privacy of American citizens. Emmer introduced th...,50.0,50.0,10.261568427085876,50.0,50.0,3.529214859008789,2023-03-10
296,TodayNFTNews,Crypto exchange Huobi announces discontinuing NFT services on May 13,SNEAK PEEK The maintenance and update of Huobi Cloud Wallet will terminate on February 13 followed by NFT services discontinuation on May 13 Users...,50.0,50.0,0.006067752838134766,50.0,50.0,0.026372075080871582,2023-03-10
297,CoinGape,These Altcoins See Massive Whale Activity As the Crypto Market Bleeds,The broader cryptocurrency market has entered a sharp correction falling nearly 7% and eroding nearly $70 billion of investors&#8217; wealth over ...,50.0,50.0,0.3556162118911743,69.08999999999999,51.24999999999999,0.015157461166381836,2023-03-10
298,Bonfida,Building an on-chain reputation,Previously we discussed what an on-chain identity is and explained that these are created since transactions are social by nature. Who and what we...,50.0,50.0,99.94032382965088,62.5,46.666666666666664,99.66110587120056,2023-03-10
299,Cointelegraph,US Trustee appeals NY Judge’s approval of Voyager deal with Binance.US,The United States Department of Justice filed an appeal against an approval made by N.Y. just days before to allow a billion-dollar sale of assets...,81.245,50.0,15.817216038703918,94.035,50.0,3.0292898416519165,2023-03-10
300,Cryptopia,Graphic Post: How Intellectual Property and Copyrights Affect NFTs,How Intellectual Property and Copyrights Affect NFTs ————————————————————————————————————— What is Cryptopia? Cryptopia is an upcoming blockchain ...,75.53,57.49999999999999,92.53253638744354,75.53,65.0,22.661232948303223,2023-03-10
301,AMBCrypto,SingularityNET: Why a ChatGPT hype could be AGIX’s only backing,"As the ChatGPT buzz reduced, so did the AGIX value. Widespread sentiment towards AGIX hit extreme lows. Around the beginning of the year, Artifici...",51.29,50.0,1.417011022567749,57.655,43.75,0.010433793067932129,2023-03-10
302,CoinGape,Ethereum Price Today: ETH Tumbles By 7% As Crypto Market Crashes,"Ethereum Price Today: The market is trading in red today as Bitcoin, and Altcoins including Ethereum see a tremendous decline. As of writing, Bitc...",50.0,50.0,0.03339946269989014,50.0,58.333333333333336,0.019600987434387207,2023-03-10
303,Blockhead,Ethereum is a Security Again as NYAG Sues KuCoin Exchange,"Earlier this week, US authorities declared that Ether is a commodity not a security. Now, other US authorities are claiming Ether is a security an...",67.0,50.0,89.96794521808624,26.415,46.875,0.14930963516235352,2023-03-10
304,CoinGape,Justin Sun Sends $100M To Huobi After HT Flash Crash,,29.905000000000005,50.0,0.49077272415161133,50.0,50.0,0.0,2023-03-10
305,Vexanium,How To Keep Vex Wallet Safe,Vex Wallet is a decentralized crypto wallet that allows users to send and receive VEX anytime and anywhere fast and easily. Users are fully respon...,72.02,75.0,99.0023523569107,67.0,65.83333333333333,99.48808252811432,2023-03-10
306,The Block,US DoJ appeals billion-dollar Binance.US acquisition of Voyager assets,"After New York's bankruptcy court approved Binance.US' plan to purchase Voyager's assets, the DoJ is making an effort to block the billion-dollar ...",58.894999999999996,50.0,2.45058536529541,57.655,56.81818181818181,0.17186105251312256,2023-03-10
307,CoinGape,Huobi Announces To Discontinue NFT Services After HT Flash Crash,,29.905000000000005,50.0,0.0059604644775390625,50.0,50.0,0.0,2023-03-10
308,forbitspace,Get Started With Prediction Market Testnet,Are you completely new to the Prediction Market feature? Are you unsure how to buy and sell? Then this article is for you Let’s start! Enter websi...,50.0,50.0,92.31829345226288,30.385,58.52272727272727,22.790050506591797,2023-03-10
309,TheNewsCrypto,Ethereum Tagged as Security by NY Attorney General in KuCoin Lawsuit,Crypto Exchange KuCoin sued by NYAG. NYAG stated Ethereum is a security. The leading crypto exchange KuCoin is being sued by the New York Attorney...,56.400000000000006,52.5,0.26378333568573,67.0,56.81818181818181,0.06657838821411133,2023-03-10
310,Coingabbar,Biden Proposes Doubling Capital Gains and Cracking Down on Crypto Wash Sales,"Key Takeaways President #Biden has proposed doubling the capital gains tax rate for certain investors The proposal also includes a crackdown on ""#...",67.0,42.22222222222222,0.06983578205108643,77.115,55.35714285714286,0.007939338684082031,2023-03-10
311,CoinGape,Can Bitcoin Price Crash To Sub-$15K And Ethereum $1K?,"The crypto market fell over 7% in the last 24 hours, with the global market cap now at $930 billion. In the last 24 hours, the crypto market saw t...",29.905000000000005,50.0,0.0032782554626464844,50.0,50.0,0.001722574234008789,2023-03-10
312,Cryptonews,"Bitcoin Price Prediction as Bulls Hold BTC Above $19,500 – Where is BTC Heading Now?","The world's top cryptocurrency, Bitcoin, has sharply declined, reaching its lowest value in two months. The second most valuable cryptocurrency, E...",50.0,50.0,0.012573599815368652,84.985,60.9375,0.022456049919128418,2023-03-10
313,Coingabbar,"24 Hrs Crypto Update, Mar 8: ""Is the two-month rally in the market coming to an end?""",Key Takeaways The global #cryptocurrency market cap was falling. The #crypto market's fall follows a sharp drop in the US stock market after #US F...,50.0,50.0,0.01703500747680664,29.905000000000005,47.91666666666667,0.25252699851989746,2023-03-10
314,Gitshock Finance 1,"THIS MARCH! Gitshock Finance Announces Multi-Phase Testnet Program for EVM, dapps and Cosmos Chain","Hi Gitshock Finance readers! Gitshock Labs, the team behind Gitshock Finance project announces this month as the beginning of incentives Testnet P...",50.0,50.0,99.95150566101074,69.00999999999999,30.0,93.5066431760788,2023-03-10
315,CoinGape,Crypto Market Loses $60 Billion; Bitcoin Crash Under $20K; What’s Happening?,Crypto Crash News: The global digital asset market registered a broad sell-off on Friday as fear rises around the future of United States based cr...,19.379999999999995,35.0,0.008529424667358398,42.345,50.78125,21.089968085289,2023-03-10
316,CoinGape,"Crypto Prices Today: Bitcoin Falls To $20k; XRP, Cardano Drops Over 4%; Huobi Token Tanks 21%","Crypto Prices Today: The market is trading in red today as Bitcoin, and Altcoins including Ethereum see a massive decline following SEC’s continuo...",50.0,50.0,0.010815262794494629,50.0,48.75,0.031623244285583496,2023-03-10
317,TheNewsCrypto,"Bitcoin (BTC) Price Hits $19K, Will the Decline Continue?",Price of BTC is in the $19K range whereas ETH is in the $1.4K range. The whole market is in panic as every other cryptocurrency is seen in red. Cr...,50.0,50.0,0.0056803226470947266,24.47,51.24999999999999,0.009062886238098145,2023-03-10
318,CoinGape,Breaking: Meta Explores Twitter-Like Decentralized Platform,,50.0,50.0,95.68038582801819,50.0,50.0,0.0,2023-03-10
319,MOSDEX,A Beginner’s Guide to Mosdex Arbitrage Platform: How to Profit from Crypto Market Inefficiencies,"Cryptocurrency trading has become increasingly popular in recent years, as investors seek to take advantage of the high volatility and potential f...",72.02,50.0,96.99191749095917,79.295,59.5,93.77270042896271,2023-03-10
320,TheNewsCrypto,KuCoin Wallet Declares Official Integration With Fantom,Easy access to all native Fantom assets is provided by KuCoin Wallet. All KuCoin Wallet users have direct access to the exciting dApps in the Fant...,50.0,50.0,98.86356890201569,88.915,63.888888888888886,99.40869212150574,2023-03-10
321,TheNewsCrypto,Gate.io Partners With Visa to Launch Crypto Debit Card in Europe,"Gate has announced that it is now accepting registrations and waiting lists from users. The firm’s Lithuanian subsidiary, Gate Global UAB, will in...",50.0,50.0,80.7102620601654,69.08999999999999,45.0,20.86789906024933,2023-03-10
322,Cryptopia,How Intellectual Property and Copyrights Affect NFTs,How Intellectual Property and Copyrights Affect NFTs As technology evolves so has the application of intellectual property rights to this new tech...,75.53,65.0,78.28004956245422,88.25,62.272727272727266,98.58612418174744,2023-03-10
323,Blockhead,Silvergate Pain Spreads Across Industry,"News on Thursday of crypto-friendly bank Silvergate winding up operations sent crypto markets on a downward course, with Bitcoin and Ethereum both...",24.47,50.0,0.031879544258117676,50.0,50.0,0.07614791393280029,2023-03-10
324,TheNewsCrypto,Animoca Brands Partners With Planet Hollywood to Open NFT Club,"The new NFT club is being launched in Los Angeles. The one-time Social Membership price is $2,500, while Founding Membership fee is $7,500. On Thu...",50.0,50.0,99.46698844432831,56.400000000000006,54.24242424242425,9.946343302726746,2023-03-10
325,Blockhead,Stablecoin Demand Grows After Silvergate Exodus,"Following the collapse of the crypto-focused bank Silvergate Capital, investors are flocking to dollar-equivalent tokens as a kind of alternative ...",43.6,50.0,99.76945519447327,25.305,65.0,12.49922513961792,2023-03-10
326,Bitcoinist,"Shiba Inu Ablaze With 30,000% Burn Rate – Will This Fire Up SHIB Price?","While it may have been created only in 2020, Shiba Inu &#8211; a decentralized cryptocurrency that operates on the Ethereum blockchain &#8211; has...",32.99999999999999,50.0,0.1400589942932129,62.5,50.0,99.85600709915161,2023-03-10
327,Cointelegraph,Hedera confirms exploit on mainnet led to theft of service tokens,Hedera said the March 9 smart contract exploit has not impacted the network or its consensus layer.,44.865,50.0,0.06568729877471924,65.91,60.71428571428571,24.285617470741272,2023-03-10
