,source,title,excerpt,vader_sentiment_title,tb_sentiment_title,flair_sentiment_title,vader_sentiment_excerpt,tb_sentiment_excerpt,flair_sentiment_excerpt,date
161,Finbold,Explained: What you should know about newly-listed CryptoGPT (GPT) coin,"With the rising popularity of the text-based artificial intelligence (AI) platform ChatGPT reviving the interest in the underlying technology, its...",50.0,50.0,3.2144695520401,92.405,20.0,96.79000675678253,2023-03-10
162,AMBCrypto,AI blockchain solution CryptoGPT (GPT) gets listed on leading exchange Bitget,"Bitget, the largest crypto copy trading platform, announced the listing of CryptoGPT (GPT) in the AI Zone of the spot market. The deposit service ...",65.91,50.0,99.57343935966492,50.0,50.0,0.5099862813949585,2023-03-10
163,CoinGape,Breaking: U.S. Unemployment Rate Rises To 3.6%; Bitcoin Price Spikes,"The United States has reportedly added 311,000 jobs during the month of February, according to the Bureau of Labor Statistics&#8217; most recent d...",27.98,50.0,0.0895380973815918,71.075,62.5,79.14467751979828,2023-03-10
164,Ordinals Finance,Ordinals Finance - How to Inscribe?,Please follow the steps below to create your first inscription delivered by Ordinals Finance Inscribe. Inscribing Steps First go to: https://app.o...,50.0,50.0,96.81292772293091,76.335,62.5,9.47716236114502,2023-03-10
165,crypto.news,Binance keeps its market share as Coinbase loses its grip,"Binance, is still dominating in shares despite the recent market events that saw recent plunges. This comes as Silvergate and Coinbase both record...",48.71,35.0,75.10449588298798,50.0,50.0,99.6938556432724,2023-03-10
166,"CoinDesk: Bitcoin, Ethereum, Crypto News and Price Data","Bitcoin Bounces as U.S. Adds 311K Jobs in March, Beating Expectations",The unemployment rate fell/rose/held steady to 3.X% ....,27.060000000000002,50.0,96.48067951202393,27.98,58.333333333333336,0.05964040756225586,2023-03-10
167,Protos,DoJ appeals against Voyager asset deal with Binance US,"The DoJ’s appeal against Voyager’s bankruptcy plan could confirm rumors that Binance US is under criminal investigation, just like Binance. The po...",68.06,50.0,1.3198167085647583,38.685,30.0,1.7261475324630737,2023-03-10
168,Connor Sephton,Vitalik Buterin 'Anti-Endorses' Memecoins — and Warns They Have No 'Moral Value',"""$BITE and most other coins being discussed on this forum are shitcoins, have no redeeming cultural or moral value,"" he told a little-known Reddit...",47.42,50.0,0.16318261623382568,35.199999999999996,52.25,0.0003993511199951172,2023-03-10
169,AsiaTokenFund,BitMEX Co-Founder Proposes Bitcoin-Backed Stablecoin,"Even if authorities are increasing their scrutiny of stablecoins, the community’s persistent interest in stablecoins that are not related to the U...",50.0,50.0,0.2523273229598999,72.94,50.0,12.185627222061157,2023-03-10
170,Coin Edition,"A Whale Bought 5,401,623 MATIC Worth More than $5 Million","A whale bought 5,401,623 Polygon (MATIC), worth about $5,339,174. This whale saw the current selloffs in the crypto market as the perfect buying o...",61.315,70.0,18.862831592559814,84.04,71.66666666666667,20.76510190963745,2023-03-10
171,crypto.news,US authorities to impose 30% electricity tax on crypto mining,The President Joe Biden administration has proposed imposing a 30% electricity tax on crypto mining operations in the United States. The move is a...,35.199999999999996,50.0,0.01818537712097168,67.0,50.0,0.3097951412200928,2023-03-10
172,crypto.news,Huobi to discontinue NFT services in May,Crypto exchange Huobi has announced that it will be discontinuing its NFT services in May this year. The decision has been attributed to strategic...,50.0,50.0,0.023114681243896484,50.0,50.0,0.36122798919677734,2023-03-10
173,crypto.ro global,"Huobi’s HT token drops 93% in minutes, bounces back just as fast","Huobi’s HT token, one of the larger cryptocurrencies with a market capitalization of about $630 million, experienced a wild price swing on Thursda...",50.0,55.00000000000001,21.127066016197205,50.0,65.0,0.200691819190979,2023-03-10
174,"CoinDesk: Bitcoin, Ethereum, Crypto News and Price Data",First Mover Americas: Bitcoin Battered as Markets Spiral,"The latest price moves in bitcoin (BTC) and crypto markets in context for March 10, 2023. First Mover is CoinDesk’s daily newsletter that contextu...",50.0,62.5,0.1116037368774414,50.0,62.5,95.38916647434235,2023-03-10
175,Altcoin Buzz,Push Protocol Launches on BNB Chain,"The Web3 communications platform, Push Protocol, has announced its launch on the BNB Chain to expand its offering to a broader network. The BNB Ch...",50.0,50.0,14.121049642562866,65.91,50.0,97.2616583108902,2023-03-10
176,Altcoin Buzz,Best 4 Decentralized Exchanges on Cosmos,"The Cosmos network continues to build through the bear market. In fact, many more projects have hopped on to Cosmos. Why not? The Cosmos SDK makes...",81.845,100.0,99.99492168426514,50.0,75.0,99.9649167060852,2023-03-10
177,"CoinDesk: Bitcoin, Ethereum, Crypto News and Price Data",Cathie Wood's ARK Purchases Over 350K Coinbase Shares in Biggest Buy of 2023,"ARK now owns 9.9 million COIN shares, worth $575 million which is around 3.8% of Coinbase's market cap",64.8,50.0,98.2296496629715,73.83500000000001,65.0,99.38933253288269,2023-03-10
178,CoinGape,"Breaking: Silicon Valley Bank Crashes 67% Pre-Market Amid Silvergate, Crypto Woes","SVB Financial Group, the parent firm of Silicon Valley Bank, shares plunged over 67% in pre-market hours as venture capitalists, including crypto ...",27.98,50.0,0.042307376861572266,64.8,45.0,0.61512291431427,2023-03-10
179,CoinGape,"Top Crypto Token Price For Today, March 10th",,60.114999999999995,75.0,99.97812807559967,50.0,50.0,0.0,2023-03-10
180,Altcoin Buzz,An Introduction to Bitcoin Ordinals,"Ordinals. Inscriptions. If you're a crypto newbie, these terms may seem foreign to you. If you've been in crypto for long, it is also unlikely you...",50.0,50.0,99.9535620212555,50.0,38.75,0.4441261291503906,2023-03-10
181,crypto.news,Meta develops decentralized social app to compete with Twitter,"Meta, the parent company of Instagram and Facebook, is working on a decentralized text-based content and social app similar to Twitter. The releas...",50.0,51.66666666666667,96.06420695781708,50.0,50.83333333333333,9.052279591560364,2023-03-10
182,Cointelegraph,Nigerian president-elect aims to use blockchain technology in the banking sector,The Nigerian president-elect wants to review existing SEC digital asset regulations to stimulate economic growth.,50.0,50.0,97.48876988887787,85.92,53.75,80.58324158191681,2023-03-10
183,CoinGape,"Cryptocurrency Price Prediction Today Mar 10th: SingularityNET, Dash, Conflux, and Huobi Token Experience Double-Digit Losses",Cryptocurrency price prediction today Mar 10th: the crypto market witnessed aggressive selling in the last two days and is most likely associated ...,29.905000000000005,50.0,0.001049041748046875,42.345,58.333333333333336,2.5268763303756714,2023-03-10
184,Crypto Daily™,KuCoin Sued By New York AG For Offering Unregistered Securities,"Letitia James, the New York Attorney General, has filed a suit against cryptocurrency exchange KuCoin for violating securities laws.&nbsp;&nbsp; J...",64.8,56.81818181818181,0.37950873374938965,34.089999999999996,54.659090909090914,0.3771185874938965,2023-03-10
185,crypto.news,"Silicon Valley Bank sends stock market crashing, crypto follows",Crypto-focused capital ventures investors have urged firms to withdraw funds from SVB. This comes after Silvergate bank collapsed which caused wor...,50.0,50.0,0.056561827659606934,36.34,50.0,0.05359351634979248,2023-03-10
186,TheNewsCrypto,CryptoGPT Launched its Native Token GPT,"CryptoGPT’s Native crypto token GPT is live now. CryptoGPT price increased by over 20%. Today, the Ethereum-based zero-knowledge (ZK) layer-2 bloc...",56.400000000000006,50.0,18.96190643310547,63.660000000000004,56.81818181818181,7.039210200309753,2023-03-10
187,Shido,Shido Dex Staking Platform is ready for launch!,Shido Dex Staking Platform is ready for launch! Our Staking Platform is deployed on BSC Testnet and Goerli. We have completed Beta Testing and don...,70.99499999999999,62.5,99.97115731239319,70.99499999999999,62.5,99.9954104423523,2023-03-10
188,TheNewsCrypto,Hacker Steals Tokens From Hedera Exploiting Smart Contract Vulnerability,"On March 9, Hedera successfully disabled IP proxies, cutting off network access. The network’s token, Hedera (HBAR), has dropped 9% in the previou...",17.015,60.71428571428571,0.25373101234436035,70.095,30.0,0.005799531936645508,2023-03-10
189,TheNewsCrypto,UK FCA Continues Crackdown on Illegally Operating Crypto ATMs,The FCA and the West Yorkshire Police conducted a series of searches. The agency is now collaborating with the National Economic Crime Centre. In ...,50.0,25.0,0.055792927742004395,22.884999999999998,60.0,4.2669713497161865,2023-03-10
190,TheNewsCrypto,U.S President Proposes 30% Tax on Electricity Used For Crypto Mining,"Biden has proposed a 30% tax on all power used to mine cryptocurrencies. The goal of this plan is to decrease mining activities, as stated by the ...",50.0,50.0,0.0414729118347168,50.0,50.0,0.44371187686920166,2023-03-10
191,CoinGape,"Dogecoin, Shiba Inu Drop Over 10% As Crypto Market Crash Deepens","The meme cryptos are seeing a decline of a massive 10.79% in the last 24 hours, taking the market cap down to 15.16 billion USD. The trading volum...",20.705000000000002,50.0,0.584670901298523,50.0,47.40740740740741,0.019684433937072754,2023-03-10
192,BlockchainReporter,"Bitcoin and Ethereum Down 8% Amid Biden Budget, Silvergate Collapse","With the release of the most recent budget from United States President Joe Biden and the failure of the crypto-bank Silvergate, both Bitcoin (BTC...",25.305,42.22222222222222,0.004094839096069336,43.6,53.05555555555556,0.4841655492782593,2023-03-10
193,TheNewsCrypto,Cryptocurrency Market Cap Dropped Below $1 Trillion,"The current crypto market capitalization is $928,980,961,277. The market has fallen $72 billion low. Global cryptocurrency market has fallen down ...",50.0,50.0,0.06574690341949463,13.655000000000001,48.05555555555556,0.21386146545410156,2023-03-10
194,Okcash,Okcash Official Integration with Trust Wallet: A monumental leap towards mass adoption for OK and Web3 technology,"We’re thrilled to announce that OK is now integrated with Trust Wallet across all networks — Ethereum, Binance Smart Chain, Polygon, Avalanche, Ar...",86.89,75.0,99.85614120960236,94.82,71.9047619047619,99.81127381324768,2023-03-10
195,Coin Edition,ADA Defends a Key Price Level as Market-Wide Selloff Erupted,"Dan Gambardello tweeted this morning that ADA is weathering the store quite nicely. At press time, ADA’s price is down 2.83% and is trading at $0....",50.0,50.0,21.702763438224792,74.635,61.111111111111114,0.411418080329895,2023-03-10
196,Crypto Adventure,The Secret Weapon of the Digital Foodie: The Industry No-Fee Delivery Pass,"In the post-pandemic era, common real-world practices such as ordering food have crossed into the blockchain space, spurring a new type of consume...",35.199999999999996,40.0,96.49389088153839,50.0,47.27272727272727,11.358100175857544,2023-03-10
197,CoinGape,Andrew Tate’s Bitcoin Holdings Revealed,,50.0,50.0,96.32696509361267,50.0,50.0,0.0,2023-03-10
198,AMBCrypto,Cardano: Everything you need to know about ADA’s recent tussle with bears,Cardano token continues to fail in its combat against a downswing. Long-term ADA holders are beginning to lose interest as the broader market beco...,50.0,50.0,98.23033213615417,15.960000000000003,25.0,0.0029981136322021484,2023-03-10
199,WOO Network,London's fast-growing crypto community influences UK views on digital assets,"With London rated as the most crypto-ready city in the world for businesses and start-ups, the city is also in a prime position for shaping the re...",58.894999999999996,50.0,99.91031289100647,50.0,75.0,99.91331994533539,2023-03-10
200,AMBCrypto,U.S. Fed to create new crypto team amid Stablecoins’ concerns,The U.S. Federal Reserve is planning to form a specialized team of experts to keep up with developments in the cryptocurrency industry. Barr state...,63.660000000000004,56.81818181818181,1.190185546875,50.0,50.0,95.0742095708847,2023-03-10
201,CoinGape,Hedera Council Not Ready With Solution Yet; Hbar Price To Suffer More?,"HBAR Crypto News: The Hedera (HBAR) network which runs on distributed ledger technology, Hashgraph, confirmed on Friday that the attackers took co...",11.85,60.0,0.01673102378845215,21.405,70.0,0.11613070964813232,2023-03-10
202,Bitcoinist,Blockchain.com Shutters Crypto Asset Management Arm Less Than 1 Year After It Launched,"Blockchain.com has announced the suspension of its asset management arm due to the prolonged crypto winter, as reported by Bloomberg. The company ...",72.94,41.66666666666667,0.006496906280517578,68.06,43.75,0.008577108383178711,2023-03-10
203,AMBCrypto,LBank backs Tel Aviv stock exchange’s move towards offering crypto trading,The Tel Aviv Stock Exchange (TASE) plans on expanding services to include cryptocurrency trading for clients of their nonbanking members (NBMs). T...,47.42,50.0,0.8142143487930298,50.0,50.0,85.74783504009247,2023-03-10
204,BlockchainReporter,MathWallet Collaborates with Alchemy Pay to Provide Secure and Matchless Crypto Ramp Solutions,"MathWallet has partnered up with Alchemy Pay to provide exclusive solutions. With this partnership, the off and on-ramp solutions of Alchemy Pay c...",70.095,70.0,98.994180560112,63.660000000000004,50.0,98.87771904468536,2023-03-10
205,CoinGape,"Judge Considers Removing Shaq, Naomi Osaka From FTX Lawsuit",,38.685,50.0,1.4990776777267456,50.0,50.0,0.0,2023-03-10
206,NewsBTC,Buy Signal? Bitcoin Investor Sentiment Falls To Lowest Level In Two Months,"Bitcoin and the broader crypto market took a hit over the last day, leading to bitcoin falling below $20,000 for the first time in two months. Thi...",30.910000000000004,50.0,0.0027120113372802734,42.345,56.25,0.0027000904083251953,2023-03-10
207,Crypto Daily™,Crypto headwinds gain strength,The dominoes are continuing to fall in the crypto sector. Bitcoin has lost around 10% of its value since yesterday. Bank woes The crypto market is...,88.25,50.0,99.53410625457764,28.925,50.0,0.0043392181396484375,2023-03-10
208,"CoinDesk: Bitcoin, Ethereum, Crypto News and Price Data",Replacing Silvergate’s Network Is a Challenge for Crypto Industry: JPMorgan,"Some of the services provided by Silvergate will migrate to other banks such as Signature Bank, Provident Bancorp, Metropolitan Commercial Bank an...",53.86,50.0,2.8169840574264526,50.0,47.91666666666667,0.14403462409973145,2023-03-10
209,Cointelegraph,Dogecoin hits 4-month lows vs. Bitcoin — 50% DOGE price rebound now in play,The prospects of Elon Musk abandoning Dogecoin could negatively impact its price in both Bitcoin and USD terms.,57.655,50.0,2.5823622941970825,44.865,35.0,0.09302496910095215,2023-03-10
210,crypto.news,Bitcoin breaks down below $20k amid recent market pressure,"After struggling with recovery for some time, bitcoin (BTC) has continued to lose value and is trading below $20,000 at $19,650. Since mid-January...",35.199999999999996,46.11111111111111,0.010398030281066895,26.165,50.0,0.001627206802368164,2023-03-10
211,Decrypt,"Voyager Liquidates $56M in Ethereum, SHIB, and Other ERC-20 Tokens","On-chain analytics indicate that the now-bankrupt Voyager has been steadily selling various assets, including Ethereum and Shiba Inu.",50.0,43.75,0.1637965440750122,58.894999999999996,54.166666666666664,0.4127413034439087,2023-03-10
212,CoinGape,"Wall Street Estimates On US Jobs Data, Crypto Market To Crash Further?",The U.S. Bureau of Labor Statistics will release the crucial nonfarm payrolls and unemployment rate data for the month of February today. Accordin...,29.905000000000005,50.0,0.47574639320373535,27.98,50.0,0.4785090684890747,2023-03-10
213,U.Today,"Peter Schiff Sends Warning to Crypto Community, Advises Selling Bitcoin (BTC)","Bitcoin slid below $20,000 mark for first time since January",32.99999999999999,50.0,0.9101957082748413,50.0,62.5,0.004756450653076172,2023-03-10
214,CryptoSlate,Justin Sun sets up $100M Huobi liquidity fund following HT flash crash,Huobi has set up a $100 million liquidity fund following a 90% flash crash of the exchange&#8217;s Huobi Token (HT) on March 9. The post Justin S...,29.905000000000005,50.0,0.28976500034332275,29.905000000000005,50.0,0.020393729209899902,2023-03-10
215,AMBCrypto,"Ethereum can be subjected to harsh sell pressure this week, here’s why",ETH might be prone to more sell pressure as Voyager liquidates its holdings. Long positions shift in favor of shorts as bearish market conditions ...,18.755,40.0,0.08758306503295898,52.855,61.25000000000001,0.15443265438079834,2023-03-10
216,Altcoin Buzz,Top 3 DeFi Protocols in Polygon,"Currently, it's near impossible to keep Polygon out of the news. Each week, the blockchain manages to have at least one eye-catching headline. The...",60.114999999999995,75.0,99.99606609344482,50.0,35.55555555555555,77.42895483970642,2023-03-10
217,Finbold,Ripple v. SEC: Legal expert shares predictions of 5 outcomes,With the conclusion of the widely-publicized lawsuit of the United States Securities and Exchange Commission (SEC) against blockchain company Ripp...,70.095,52.5,98.30954074859619,73.83500000000001,45.0,93.52325201034546,2023-03-10
218,Protos,‘Bitcoin Willy Wonka’ Max Keiser now works for El Salvador gov’t,Tether and Bitfinex apologists Max Keiser and Stacy Herbert now work directly inside El Salvador’s government on Bitcoin-related matters. The post...,50.0,50.0,9.725818037986755,51.29,55.00000000000001,99.05961751937866,2023-03-10
219,Altcoin Buzz,Best 3 Decentralized Exchanges in Cronos,"Cronos is a Layer 1 (L1) smart contract blockchain. On DefiLlama, Cronos ranks #9 with a total value locked (TVL) of $390.14 million. On November ...",81.845,100.0,99.99268054962158,81.245,55.35714285714286,85.69776117801666,2023-03-10
220,"CoinDesk: Bitcoin, Ethereum, Crypto News and Price Data",Silicon Valley Bank Rocks Crypto and Equity Markets Ahead of Nonfarm Payrolls,"Pressure on the U.S. banking system is questioning whether the Fed can push ahead with such an aggressive tightening cycle, analysts at ING said.",50.0,50.0,99.94131028652191,25.305,50.0,1.1323779821395874,2023-03-10
221,crypto.news,Huobi’s HT token saw 93% flash crash,"The Huobi exchange’s native HT token flash crashed a few hours ago, losing more than 93% of its value. It quickly recovered from the incident, but...",29.905000000000005,50.0,0.0012516975402832031,47.42,60.55555555555555,0.0008702278137207031,2023-03-10
222,"CoinDesk: Bitcoin, Ethereum, Crypto News and Price Data",DeFi Protocol Tender.fi Hacker Returns $1.6M Following Chainlink Oracle Glitch,"A white hat hacker that targeted DeFi protocol Tender.fi has returned $1.6 million that was stolen on Tuesday, receiving a 62.15 ether ($85,000) b...",50.0,50.0,0.06929636001586914,25.305,50.0,0.01055896282196045,2023-03-10
223,AMBCrypto,"Assessing Bitcoin’s dip to $20,000 and altcoins’ reaction to it","Bitcoin&#8217;s price has dropped to the $20,000 region for the first time in over five weeks. The dip in BTC’s price has caused over $300 million...",50.0,50.0,77.56328582763672,50.0,62.5,0.00629425048828125,2023-03-10
224,The Block,Lost and found: Aave begins first phase of token recovery rescue mission,Aave DAO delegates have voted in favor of a proposal to rescue tokens lost by users of the DeFi lending protocol.,62.5,62.5,99.62483048439026,78.595,50.0,9.0928316116333,2023-03-10
225,"CoinDesk: Bitcoin, Ethereum, Crypto News and Price Data","Finance Is Headed Toward Bank-Free, Decentralized Future: Bernstein","Bank-free decentralized finance will be a trillion-dollar asset pool with over $40 billion in revenue by 2028, the report said.",50.0,50.0,13.072064518928528,68.06,50.0,90.66563546657562,2023-03-10
226,Decrypt,Bitcoin Plummets 8% as Crypto Market Falls Below $1 Trillion,"Bitcoin plunged below $20,000 for the first time since mid-January as multiple factors placed increased pressure on the crypto industry.",50.0,50.0,0.004649162292480469,48.71,56.25,0.013193488121032715,2023-03-10
227,BlockchainReporter,Hedera Confirms Exploit as Millions of Service Tokens are Stolen Due to Mainnet Breach,"The rise of cryptocurrency has brought about a new era of decentralized finance and online transactions. However, with the growing popularity of c...",22.13,43.75,0.14511346817016602,79.295,56.81818181818181,95.36478221416473,2023-03-10
228,Finbold,"New York authorities sue KuCoin over unregistered crypto sales, labels ETH a security","Letitia James, the Attorney General of New York State, has filed a lawsuit against KuCoin for allegedly operating as a … Continued",67.0,56.81818181818181,1.119399070739746,38.685,51.43939393939394,0.3605395555496216,2023-03-10
229,Cointelegraph,Coinbase still a buy for Cathie Wood: ARK buys its biggest batch of COIN in 2023,"Amid the crypto market facing another wave of panic, Cathie Wood’s ARKK keeps bagging record amounts of Coinbase stock this year.",50.0,50.0,99.08954501152039,24.47,50.0,92.27004945278168,2023-03-10
230,U.Today,Cardano (ADA) up 6% Despite Market Turmoil as Whale Buys Dip,Cardano moves upward despite market-wide dip,63.775000000000006,50.0,93.46747398376465,50.0,50.0,78.1654804944992,2023-03-10
231,CryptoSlate,Crypto community reacts to NYAG’s lawsuit: Is Ethereum really a security?,"Neeraj Agrawal, the Director of Communications at Coin Center, disagreed with the New York Attorney General&#8217;s (NYAG) recent assessment of Et...",60.03000000000001,60.0,1.381644606590271,34.089999999999996,50.60606060606061,0.6070733070373535,2023-03-10
232,AMBCrypto,LBank Interviews youngest Web3 builder at ETHDenver,"12-year-old Jared Qin was the youngest blockchain developer to participate in ETHDenver’s BUIDLathon. On March 4, an attending delegation of globa...",50.0,50.0,97.30661809444427,50.0,50.0,83.33712816238403,2023-03-10
233,CryptoSlate,Is SVB to big to fail? Will it get rescued? Bill Ackman already calling for bail-outs,Quick Take A short timeline on what has happened to Silicon Valley Bank (SVB) and whether there is more contagion coming: SVB saw its deposits exp...,36.8,37.5,0.004756450653076172,24.525000000000002,63.888888888888886,0.021526217460632324,2023-03-10
234,Cointelegraph,Why is Bitcoin price down today?,"Bitcoin feels the pressure from new banking chaos in the United States, with BTC price action falling below $20,000 for the first time in two months.",50.0,42.22222222222222,0.7914096117019653,21.405,58.10606060606061,0.057950615882873535,2023-03-10
235,CoinGape,Biggest Crisis Ever For Crypto Market? Crash To Continue?,Crypto News: The digital assets industry is trading under heavy selling pressure due to an emerging possible crisis from the United States based b...,10.010000000000002,50.0,0.012859702110290527,28.925,45.9375,8.453142642974854,2023-03-10
236,Connor Sephton,New York's Attorney General Calls Ether a Security in Lawsuit Against KuCoin,"""One by one my office is taking action against cryptocurrency companies that are brazenly disregarding our laws and putting investors at risk,"" Le...",56.400000000000006,54.659090909090914,22.778645157814026,38.685,55.00000000000001,0.0567018985748291,2023-03-10
237,AMBCrypto,"Solana registers price correction, but these metrics remain in SOL’s favor","Solana’s price declined by more than 8% in the last 24 hours. Several metrics were negative, but revenue and fees remained unaffected. The crypto ...",77.495,50.0,98.08229207992554,33.545,51.5,0.06923079490661621,2023-03-10
238,Cryptonews,"Russian AML Regulator Says It’s Monitoring 25,000 Crypto Users – Here’s How","The top Russian anti-money laundering regulator says it is &#8220;monitoring&#8221; over 25,000 crypto users &#8211; and claims it has sophisticat...",86.485,50.0,1.1693239212036133,60.114999999999995,62.5,99.96060132980347,2023-03-10
239,NFTandGameFi,Presale for AltSignals new AI trading algorithm raises over $100k in 24 hours,"Tallinn, Estonia, 7th March, 2023, Chainwire After raising more than $100,000 in under 24 hours from their private sale, leading trading signals p...",50.0,56.81818181818181,21.73101305961609,50.0,62.5,0.33527910709381104,2023-03-10
240,DappRadar,Unlocking Exciting Developments: Why a Down Month for Blockchain Gaming is Misleading,"Despite the challenges that the blockchain industry faced in the previous year, 2023 has started off on a promising note, particularly in the real...",56.400000000000006,53.61111111111111,7.65816867351532,67.825,55.00000000000001,99.95315968990326,2023-03-10
241,Coin Edition,"Huobi Token Drops by 93% only Rise by 1,084% Ten Minutes Later",Huobi Global HT flash fell from $4.9375 to about $0.313. Data shows a $2M transaction was registered a few minutes before the crash. Huobi token’s...,50.0,50.0,0.010463595390319824,29.905000000000005,45.0,0.003725290298461914,2023-03-10
242,NFTandGameFi,Mizar Launches $MZR Token on Arbitrum and Unveils DeFi Roadmap,"London, United Kingdom, 8th March, 2023, Chainwire Mizar, a social trading platform that boasts over 10,000 users and sees daily trades in the mil...",50.0,50.0,79.62649166584015,71.075,50.83333333333333,98.38268458843231,2023-03-10
243,Bitcoinist,Crypto Regulation Overhaul Plans Gaining Traction At Republican House,Crypto regulation could see a major overhaul as House Republicans take steps to revamp the oversight of the emerging class asset.  According to Re...,71.075,50.0,99.63882565498352,68.06,53.125,1.591271162033081,2023-03-10
