,source,title,excerpt,vader_sentiment_title,tb_sentiment_title,flair_sentiment_title,vader_sentiment_excerpt,tb_sentiment_excerpt,flair_sentiment_excerpt,date
331,kommunitas,The Founder of Cash App Passed Away,"Bob Lee, the former Chief Technology Officer and founder of Cash App, has passed away after being stabbed in San Francisco. According to a report ...",50.0,50.0,7.765397429466248,27.98,50.0,0.11874735355377197,2023-04-06
332,Kryptoskatt,Tax Rules For Crypto Futures And Options Trading,Understanding the tax rules for crypto trading is crucial if you want to avoid any potential penalties from the Internal Revenue Service (IRS). Pr...,50.0,50.0,2.8900951147079468,38.685,50.0,99.96569752693176,2023-04-06
333,Cointelegraph,Reddit deploys Gen 3 NFT avatar contracts on Polygon,"Community members responded to the new development, with some praising Reddit’s marketing efforts and changing the anti-NFT narrative within the p...",50.0,50.0,94.31706070899963,77.115,56.81818181818181,98.58590960502625,2023-04-06
334,Vexanium,"VexBlash, Poadcast at TwitterSpace","Hello, Vex Buddies! How are you doing? &#x1f44b;&#x1f3fc;We have entered the second week of Ramadan already. Don&#39;t forget to take care of your...",50.0,50.0,1.7658352851867676,69.00999999999999,50.0,82.96130299568176,2023-04-06
335,Cointelegraph,Crypto trading vs. crypto investing: Key differences explained,"Crypto trading and investing are often intertwined, but key differences remain between the two methods.",50.0,50.0,97.77877926826477,50.0,50.0,99.58924651145935,2023-04-06
336,NewsBTC,"New Bitcoin Price Model Predicts Fair Price Of At Least $379,823","Raphael Zagury, chief investment officer at Swan Bitcoin, has developed a new BTC pricing model that currently calculates a fair price of $387,823...",65.91,58.93939393939394,0.028315186500549316,65.91,61.70454545454545,78.17406058311462,2023-04-06
337,CoinGape,Breaking: Big Blow To Binance; ASIC Scraps Binance Australia Derivatives AFS License,Crypto News: Australia Securities &#38; Investment Commission (ASIC) on Thursday announced that it is canceling the Australian financial services ...,50.0,50.0,0.06889700889587402,64.8,50.0,0.011715292930603027,2023-04-06
338,Kryptoskatt,7 NFT Tax Loopholes That You Should Know In 2023,"The past few years have marked an exponential growth of NFTs in the crypto world, providing exciting opportunities for artists, collectors, and in...",50.0,50.0,0.6737112998962402,90.63,49.375,99.98763501644135,2023-04-06
339,Cointelegraph,Binance Australia Derivatives license canceled by securities regulator,"In February, Binance Australia Derivatives abruptly closed certain derivatives positions and accounts, citing investor classification compliance.",64.8,50.0,1.4499813318252563,63.660000000000004,52.85714285714286,0.2056032419204712,2023-04-06
340,CoinGape,Key Dates to Watch in April,,50.0,50.0,99.81867969036102,50.0,50.0,0.0,2023-04-06
341,The Block,Bitstamp launches new lending product across crypto-friendly markets,Bitstamp joins the crypto lending game despite last year's turmoil and the collapse of big names like BlockFi and Celsius.,50.0,56.81818181818181,99.7780442237854,55.265,43.333333333333336,92.6798552274704,2023-04-06
342,Kryptoskatt,Share Pooling Crypto In The UK: How To Calculate Crypto Gains,"The HMRC recognises crypto as an asset which means individuals need to pay capital gains taxes on any profit made on its disposal. To do this, HMR...",77.86999999999999,50.0,96.4454174041748,87.53,50.0,0.22026598453521729,2023-04-06
343,Blockchain News,China and Malaysia discuss Asian Monetary Fund,China and Malaysia are discussing the creation of an Asian Monetary Fund as a way to move away from U.S. dollar hegemony. The fund was proposed at...,50.0,50.0,93.83124709129333,63.660000000000004,50.0,0.09236633777618408,2023-04-06
344,Coin Edition,Dogecoin (DOGE) Price Prediction: What to Expect in the Next 48 Hours,"After being inactive for 9.3 years, a dormant address that held 1,215,614 DOGE ($116,460) has been activated, causing a stir within the Dogecoin c...",50.0,50.0,85.0809395313263,50.0,50.0,0.0113755464553833,2023-04-06
345,Bitcoinist,Is Bitcoin Set To Revolutionize The Financial World With Its Superior Purchasing Power?,"Bitcoin, the digital currency that emerged just over a decade ago, has been gaining momentum and popularity as a potential game-changer in the fin...",77.115,67.5,0.1346588134765625,85.48,50.0,99.91788566112518,2023-04-06
346,Blockchain News,"Ether Surges to Over $1,900 Ahead of Staking Withdrawals","Ether breaks $1,900 for the first time in over seven months, ahead of the Ethereum Shanghai hard fork that will allow stakers to withdraw their ET...",50.0,50.0,5.297362804412842,56.400000000000006,48.95833333333333,0.10327696800231934,2023-04-06
347,crypto.news,Dexfreight has technology to bring real-world assets to Rootstock DeFi,"dexFreight, a blockchain-based logistics platform, partnered with Rootstock, a Bitcoin layer-2 sidechain, to leverage the power of smart contracts...",58.894999999999996,50.0,99.96936917304993,70.095,60.71428571428571,99.25011694431305,2023-04-06
348,Blockchain News,Former CTO of Square and Creator of Cash App Dies in San Francisco Stabbing,"Bob Lee, former CTO of Square and creator of Cash App, died after being stabbed in San Francisco on April 4. The CEO of Abra confirmed the news on...",50.0,35.0,16.583842039108276,12.104999999999999,60.0,0.11688470840454102,2023-04-06
349,Coin Edition,Crypto Market Grows 50% YTD Despite Q1 Crisis: CMC Report,"CoinMarketCap took to Twitter to observe that the global crypto market has seen significant growth in the first quarter of 2023, with a current ma...",75.48,50.0,91.88202917575836,76.335,57.8125,11.651703715324402,2023-04-06
350,Blockchain News,Allbridge Provides Compensation Plan for Hacked Users,"Allbridge has posted a recovery plan after being hacked for $573,000 on April 1, stating that users with funds stuck on the token bridge are first...",29.905000000000005,50.0,12.424787878990173,21.405,62.5,0.006657838821411133,2023-04-06
351,Blockchain News,Swiss Retail Bank to Offer Cryptocurrency Services,"PostFinance has partnered with Sygnum to offer customers cryptocurrency trading and storage services, including Bitcoin and Ether. (Read More)",50.0,50.0,99.40420091152191,50.0,75.0,97.91222810745239,2023-04-06
352,Blockchain News,Biden urges technology firms to prioritize safety in AI development,US President Joe Biden has called for technology companies to prioritize safety when developing and releasing artificial intelligence (AI) product...,71.075,50.0,85.63399910926819,85.48,20.0,1.7478972673416138,2023-04-06
353,The Block,Binance’s Australia Derivatives license cancelled by regulator,"After Binance requested the action, the Australian Securities and Investments Commission canceled its financial services license in the country.",37.5,50.0,0.8545219898223877,64.8,51.66666666666667,1.4018118381500244,2023-04-06
354,Blockchain News,Nigerian Crypto Community Affected by Paxful Shutdown,"The closure of Paxful, a peer-to-peer cryptocurrency marketplace, has left the Nigerian crypto community searching for alternatives. Nigeria, rank...",42.345,50.0,0.03440976142883301,50.0,30.0,0.06178617477416992,2023-04-06
355,Blockchain News,Trust Wallet Partners with Ramp and MoonPay for Crypto-to-Fiat Withdrawals,Trust Wallet has partnered with Ramp and MoonPay to offer seamless crypto-to-fiat withdrawals for its users. The feature allows Trust Wallet users...,75.53,50.0,96.24631404876709,88.25,55.00000000000001,99.28519427776337,2023-04-06
356,"CoinDesk: Bitcoin, Ethereum, Crypto News and Price Data",Binance Australia's Derivatives License Cancelled by Regulator,"The Australian Securities and Investments Commission (ASIC) has cancelled Binance Australia's derivatives license, according to a press release.",37.5,50.0,0.5863577127456665,52.580000000000005,50.0,0.670015811920166,2023-04-06
357,Bitcoinist,"Trader Loses Almost $190,000 Bidding On A Free NFT On OpenSea Pro","Barely 72 hours after OpenSea, a top non-fungible token (NFT) marketplace, launched OpenSea Pro, it has been reported that one trader fat-fingered...",62.5,52.5,0.09281635284423828,65.91,63.74999999999999,0.003516674041748047,2023-04-06
358,Crypto Daily™,OKX Liquid Marketplace Records Over USD1 Billion in Institutional Trading Volume in 2023,"Victoria, Seychelles, April 6th, 2023, ChainwireOn-demand institutional liquidity network offers futures spreads, options strategies and spot OTCR...",50.0,50.0,98.73019754886627,50.0,55.00000000000001,98.88659417629242,2023-04-06
359,TheNewsCrypto,Bitcoin White Paper Discovered in Apple’s Modern macOS,The intention behind creation is still unknown.Technologist Andy Baio shared a blog post about the finding on April 5.There seems to be a hidden c...,50.0,55.00000000000001,1.305881142616272,77.115,35.833333333333336,2.9231905937194824,2023-04-06
360,The Block,Arbitrum whales accumulate as foundation amends controversial proposals,Arbitrum whales — large holders often monitored for their potential market impact — continue to stack the Ethereum Layer 2's governance token.,39.885,77.5,13.083246350288391,50.0,55.35714285714286,0.3697216510772705,2023-04-06
361,Cryptopia,How Many Tiles Do You Need For A Dock Facility? | Cryptopia,"In this new video series, we go through our socials and answer some of our community&#39;s burning questions. Our goal is to provide clarity and u...",50.0,75.0,0.03494620323181152,70.095,56.81818181818181,99.97158348560333,2023-04-06
362,TheNewsCrypto,Shiba Inu Is an Accepted Payment Mode in Georgia,"SHIB, BTC, and ETH for commercial purchases in Georgia.Binance Pay integration with CityPay made this possible.In Georgia, Shiba Inu, Bitcoin, Eth...",63.660000000000004,50.0,99.92017447948456,44.865,50.0,97.00212776660919,2023-04-06
363,Cointelegraph,Singapore to introduce uniform screening standards for crypto bank accounts,"Potential guidelines reportedly won’t have a binding force over banks, which can rely on their own risk assessment.",50.0,50.0,75.94605088233948,36.34,65.0,0.05214810371398926,2023-04-06
364,Investor Bites,Terra Classic Price Analysis 06/04: LUNC Uptrend Momentum Fades As Bearish Pressure Persists,SNEAK PEEKTerra Classic price analysis shows a downtrend trade pattern due to the bearish pressure observed in the market.LUNC price has declined ...,35.199999999999996,58.333333333333336,0.04850625991821289,35.199999999999996,51.041666666666664,0.11234581470489502,2023-04-06
365,TheNewsCrypto,Will Bitcoin (BTC) Price Reach $30K in April?,"Bitcoin (BTC) stays in the $28K price range.The largest whale holds $1.6 billion in BTC.Bitcoin (BTC), the largest cryptocurrency in terms of mark...",51.29,50.0,0.00674128532409668,50.0,50.0,82.23883807659149,2023-04-06
366,Crypto Daily™,PostFinance Bank To Offer Customers Bitcoin And Ethereum Services,"PostFinance Bank, a financial services firm owned by the Swiss Government, has stated that it would offer its customers various regulated crypto s...",50.0,50.0,99.0068256855011,50.0,46.666666666666664,0.9256362915039062,2023-04-06
367,CoinGape,"Ripple Or US SEC, Who’s Winning Investment Contract Claim?",XRP Lawsuit: The U.S. Securities and Exchange Commission (SEC) and Ripple Labs with other defendants are waiting for the District court’s Summary ...,76.335,60.0,1.9920378923416138,53.86,44.375,0.1332312822341919,2023-04-06
368,Seeking Alpha,Bit Digital output rise 10% sequentially in March," Bit Digital (NASDAQ:BTBT) said Monday it produced 119.4 bitcoin (BTC-USD) in March, up 10% from the prior month, due to additional days during th...",50.0,50.0,15.989744663238525,50.0,47.91666666666667,0.0015556812286376953,2023-04-06
369,Coingabbar,"MicroStrategy's Bitcoin Holdings Surpass 140,000 Units Worth Over $12.6 Billion","Key TakeawaysThese were procured for roughly $4.17 billion at an average price of $29,803 per unitRecently, Saylor&#39;s MicroStrategy disbursed t...",61.315,65.0,99.6047705411911,50.0,45.83333333333333,0.04503130912780762,2023-04-06
370,AMBCrypto,Opposition to CBDCs grows after U.S-based Cato argues against its ‘risks’,"CBDC issued by the U.S. poses risks to financial privacy and economic freedom, claimed report CBDCs don’t provide unique or even additional benefi...",30.910000000000004,50.0,0.23129284381866455,73.83500000000001,59.583333333333336,0.04388391971588135,2023-04-06
371,Blockhead,"Dubai Requests Binance Info, Finally Tightens Crypto Regulation",Dubai's crypto friendly reputation just got a little unfriendlier towards Binance,50.0,50.0,76.00342035293579,74.695,54.6875,0.1282721757888794,2023-04-06
372,BitcoinWorld,Block On and Panjab DAO Announce Chandigarh Web3 Summit,"Block On and Panjab DAO, are proud to announce the upcoming Chandigarh Web3 Summit on 8th April in Chandigarh, India. The event will bring togethe...",27.98,50.0,90.6958669424057,52.580000000000005,90.0,99.57956671714783,2023-04-06
373,Coingabbar,Paxful Suspends Market Due to Crypto Downturn and Regulatory Issues,"Key TakeawaysPaxful, a peer-to-peer #cryptocurrency exchange, has suspended its market due to the ongoing pressures of the cryptocurrency downturn...",50.0,43.75,0.01944601535797119,17.015,46.875,0.11925101280212402,2023-04-06
374,CoinGape,World’s Top 25 Billionaires Lost $200 Billion Last Year,,43.6,62.5,6.836676597595215,50.0,50.0,0.0,2023-04-06
375,Coingabbar,"Tech Industry Mourns the Loss of Bob Lee, Cash App Creator","Key TakeawaysBob Lee, former CTO of Square and creator of Cash App, was fatally stabbed in San Francisco on April 4thLee was highly respected in t...",15.46,50.0,0.023156404495239258,21.355,52.666666666666664,13.953527808189392,2023-04-06
376,TaskOn,TaskOn Community Grants Program,"Share your ideas to decide how to allocate TaskOn incentives!Since its official launch last August, TaskOn has had many community members accompan...",61.315,50.0,99.51716661453247,67.975,62.5,99.40581321716309,2023-04-06
377,Coin Edition,Lido Finance Market Leader in Liquid Staking Protocols: Report,Market intelligence provider Messari (&#64;MessariCrypto) tweeted this morning that Lido Finance (LDO) has established itself as the market leader...,50.0,50.0,97.9101151227951,73.83500000000001,50.0,0.010415911674499512,2023-04-06
378,BitcoinWorld,Join the Elite at the Finance Magnates Africa Summit.,Are you ready to take advantage of a once-in-a-lifetime opportunity that will completely revamp what you do? The Finance Magnates Africa Summit FM...,64.8,50.0,99.34444427490234,92.21,57.49999999999999,2.114120125770569,2023-04-06
379,Coingabbar,Masa Finance's Soulbound Tokens Now on Coinbase Base for Credit Underwriting,Key TakeawaysMasa Finance&#39;s soulbound tokens will soon be available on #Coinbase&#39;s Base networkThis integration will allow users to associ...,69.08999999999999,9.999999999999998,99.28876757621765,61.315,43.333333333333336,99.86183643341064,2023-04-06
380,Coingabbar,Record Bitcoins Mined by Marathon Digital in the First Quarter,"Key TakeawaysIn the quarterly report shared on 3rd April, Marathon Digital announced that the company has recorded a 74% hikeThe #BTC mining organ...",50.0,56.25,0.013259053230285645,67.0,50.0,0.015062093734741211,2023-04-06
381,Blockchain News,Ethereum Projects Launch MEV Blocker to Minimize Invisible Tax,"27 Ethereum projects have launched MEV Blocker, a solution to reduce maximally extractable value (MEV), or Ethereum's invisible tax. MEV Blocker i...",50.0,50.0,99.78471398353577,81.845,50.0,97.22588360309601,2023-04-06
382,Coingabbar,Regulators Take Action Against AI-Powered Crypto Ponzi Scheme YieldTrust.ai,"Key TakeawaysAccording to Montana&#39;s securities regulator, YieldBot had been developed for Binance&#39;s BNB Smart Chain and could connect with...",50.0,55.00000000000001,1.1264920234680176,79.97000000000001,55.23809523809524,99.847811460495,2023-04-06
383,Altcoin Buzz,5 Ways to Earn Bitcoin,"Free money is always welcome, right? So, how about some Bitcoin? You&#8217;re more than happy to put your hands on that. Sats (Satoshis) are small...",50.0,50.0,99.43735897541046,94.59500000000001,71.13095238095238,99.61672723293304,2023-04-06
384,Technext,Cash App Founder Bob Lee stabbed to death in San Francisco,"Cash App Founder and chief product officer of cryptocurrency company MobileCoin, Bob Lee, was murdered in a San&#8230;",11.085,50.0,0.05186200141906738,17.015,50.0,0.7544785737991333,2023-04-06
385,Altcoin Buzz,Chainlink Beginner’s Guide – Part 1,"The crypto space has came a long way since its early days. Back then, many crypto tokens were speculative without any use cases. Fast forward till...",50.0,50.0,99.63226318359375,55.135,57.49999999999999,80.97493052482605,2023-04-06
386,Coin Edition,Golem (GLM) Price Prediction 2023-2030: Will GLM Reach $1 Soon?,"Golem Network is an open-sourced computation platform with the aim of meeting the demand for computing power. GLM, Golem Network’s ERC-20 utility ...",51.29,50.0,1.0679274797439575,43.6,50.0,99.89851415157318,2023-04-06
387,TaskOn,Introducing TaskOn v1.6.1: Improve Trust with a Reward Deposited Mark,"We are pleased to announce that TaskOn v1.6.1 has been launched, unlocking more convenient functions for both campaign creators (business-end) and...",93.6,50.0,95.40950059890747,76.335,75.0,99.26129877567291,2023-04-06
388,RikkeiFinance,How AI is transforming the gaming industry,"Millions of people worldwide enjoy playing online games, which are created for practically everyone regardless of age, gender, interests, or favor...",50.0,50.0,99.4461178779602,89.53,70.0,99.69766438007355,2023-04-06
389,NewsBTC,Dogecoin Price Prediction: Doge Rally Faded But Not Likely Over,Dogecoin rallied over 25% and cleared the $0.090 resistance against the US Dollar. DOGE is correcting gains and might find fresh bids near the $0....,50.0,50.0,0.1719444990158081,81.245,60.0,89.30838704109192,2023-04-06
390,Coin Edition,"‘Even State and Central Banks Use Gold as Hedge,’ Says Gurbacs","The Strategy Advisor at the global investment management firm Van Eck Associates Corporation, Gabor Gurbacs, shared his perspectives on the value ...",50.0,50.0,1.5968650579452515,79.295,45.0,99.75912868976593,2023-04-06
391,Cointelegraph,"Jane Street, Tower Research and Radix are Binance’s 'VIP' clients in CFTC suit: Report",The firms were cited anonymously in the CFTC's complaint describing Binance’s alleged facilitation of U.S. clients.,50.0,50.0,80.33216595649719,35.199999999999996,40.0,6.25130832195282,2023-04-06
392,"CoinDesk: Bitcoin, Ethereum, Crypto News and Price Data","Jump in Shiba Inu Breed-Themed Tokens is Unsustainable, Warn Crypto Traders","Memecoins outperformed the broader crypto markets in recent days, but there may be cause for caution ahead as some warn of imminent profit-taking.",44.865,50.0,0.045549869537353516,42.345,50.0,80.92145621776581,2023-04-06
393,"CoinDesk: Bitcoin, Ethereum, Crypto News and Price Data",Singapore Working With Banks to Provide Guidance on Crypto Businesses: Bloomberg,Singapore's central bank and police authorities have been helping banks to set uniform standards for fine-tuning their vetting approach when openi...,50.0,50.0,96.04110717773438,64.8,50.0,96.7713862657547,2023-04-06
394,Crypto News Flash,Ralph Lauren integrates Polygon (MATIC) in cooperation with BitPay as payment option in billion-$-market – Report,"Leading U.S. based fashion company Ralph Lauren, has taken to Twitter to announce that it has integrated Polygon, in cooperation with BitPay as pa...",50.0,50.0,99.61453378200531,50.0,50.0,7.680749893188477,2023-04-06
395,Cointelegraph,Bear markets are for filming: the Bitcoin Film Festival in Warsaw,"Lights, camera, Bitcoin: A Bitcoin Film Festival in Poland brought the Bitcoin revolution to the big screen.",73.83500000000001,50.0,92.19799935817719,74.695,50.0,99.61317181587219,2023-04-06
396,NewsBTC,Ethereum Price Corrects Gains But This Support Could Spark Fresh Increase,"Ethereum price rallied above the $1,900 resistance against the US Dollar. ETH is correcting gains and trading near key support at $1,880. Ethereum...",95.5,65.0,85.67287921905518,81.245,51.66666666666667,75.32657980918884,2023-04-06
397,AMBCrypto,Decoding the ‘greed’ for Ethereum but with a pinch of salt,"With Ethereum [ETH] standing at the brink of a new dawn with the Shanghai upgrade and a bullish looking crypto market, holders and investors have ...",50.0,50.0,0.10296404361724854,50.0,56.81818181818181,0.6549865007400513,2023-04-06
398,CoinGape,Peter Schiffs Lauds ChatGPT For Recommending Gold Over Bitcoin,,50.0,50.0,84.62373614311218,50.0,50.0,0.0,2023-04-06
399,Bitcoinist,"Apple Hides The Bitcoin Whitepaper On Every MacBook, Why?",Is tech giant Apple a secret supporter of Bitcoin or did an employee act on his own? This is the question currently being asked by the Bitcoin com...,41.105000000000004,50.0,0.5418241024017334,63.660000000000004,52.5,0.032970309257507324,2023-04-06
400,U.Today,Apple's Homage to Satoshi: Bitcoin White Paper Hidden in macOS,Tech blogger Andy Baio has recently uncovered a hidden easter egg within macOS systems dating back to 2018's Mojave version: a PDF of Satoshi Naka...,50.0,45.83333333333333,81.95401132106781,50.0,47.22222222222222,14.494848251342773,2023-04-06
401,"CoinDesk: Bitcoin, Ethereum, Crypto News and Price Data",ANZ Bank Completes Carbon Credits Trading as Part of Australia's CBDC Pilot,Australia and New Zealand Banking Group Limited (ANZ) has completed the first use-case of carbon credit trading as part of Australia's central ban...,68.06,50.0,91.41224324703217,58.894999999999996,53.93668831168831,0.1579880714416504,2023-04-06
402,Cointelegraph,Names of non-US FTX users demanded by mainstream media outlets,"A number of mainstream media outlets are pushing to publicize the personal details of FTX’s non-United States customers, similar to what happened ...",38.685,50.0,0.7850885391235352,53.86,50.0,1.8673747777938843,2023-04-06
403,"CoinDesk: Bitcoin, Ethereum, Crypto News and Price Data","Hidden Inside MacOS, the Bitcoin Whitepaper","Satoshi’s vision exists in every version of MacOS from Mojave to Ventura, but is not in the older High Sierra (10.13) or earlier.",50.0,41.66666666666667,0.5639642477035522,56.400000000000006,55.44444444444444,84.2115193605423,2023-04-06
404,AMBCrypto,Shiba Inu bulls beware as SHIB retests this six-week resistance yet again,"Disclaimer: The information presented does not constitute financial, investment, trading, or other types of advice and is solely the writer’s opin...",50.0,50.0,0.08573830127716064,50.0,46.875,0.11563897132873535,2023-04-06
405,Cointelegraph,OpenAI faces Canadian privacy probe alleging personal info harvesting,"Canada’s head privacy commissioner is investigating the AI firm, and watchdogs in Germany, France, Ireland and Spain could be mulling similar action.",50.0,50.0,2.3687005043029785,50.0,48.333333333333336,3.179609775543213,2023-04-06
406,Technext,Africa’s Tech ecosystem swallows over $100M in one week,.errordiv { padding:10px; margin:10px; border: 1px solid #555555;color: #000000;background-color: #f8f8f8; width:500px; }#advanced_iframe_2 {visib...,50.0,50.0,10.352015495300293,57.655,50.0,1.102873682975769,2023-04-06
407,WEMIX,"INFINITY PARTY BATTLE, Pre-Register Now!",Be a hero by defending the city from the monster attacks!We are unveiling the pre-registration of the INFINITY PARTY BATTLE!Build a team of RPG-st...,55.035000000000004,50.0,78.62711548805237,91.165,50.0,97.59006202220917,2023-04-06
408,Blockhead,Eleos Labs Brings Fraud Detection to Polygon,Eleos Labs brings FailSafe to Polygon to aid self custody security,20.705000000000002,50.0,99.66404139995575,67.0,50.0,0.19524991512298584,2023-04-06
409,PUBLISH,"Subscribe to the Jeonbuk Ilbo and earn KRW 2,000 in NEWS tokens!","PUBLISH is pleased to announce a new partnership with the Jeonbuk Ilbo, one of Korea&#39;s leading daily newspapers.As part of this exciting colla...",50.0,50.0,0.32266080379486084,88.42,61.70454545454545,99.94629919528961,2023-04-06
410,Blockhead,Avalanche's Ava Labs Inks South Korean Partnership in Asia Expansion,Ava Labs is continuing its Asia push by sealing a deal with SK Plane,50.0,50.0,99.98237490653992,50.0,50.0,87.86195516586304,2023-04-06
411,RichQUACK,Biconomy is listing #RichQUACK ( $QUACK ) for Spot Trading!,"Biconomy is a Canadian #Cryptocurrency Exchange with US MSB Licence, Ranked #23 on #CoinMarketCapStay Tuned for $4,600 #Airdrop, First register yo...",50.0,50.0,88.98558616638184,50.0,62.5,96.69129252433777,2023-04-06
412,Cointelegraph,Arbitrum poses new governance proposals after community furor,The Arbitrum Foundation has made a couple of new governance proposals following the fracas that occurred over its first attempt.,50.0,56.81818181818181,18.41227114200592,50.0,56.439393939393945,10.008910298347473,2023-04-06
413,Crypto Daily™,HeartX Unveils Token Airdrop Game “Vote-to-Earn” to Warm Up the Launch of the Platform,"Central, Singapore, April 6th, 2023, ChainwireHeartX, a Web3.0 art trading marketplace and community platform, is set to change the game for the a...",61.315,55.00000000000001,99.66535270214081,50.0,40.0,4.214158654212952,2023-04-06
414,Bounce Finance,Bounce Finance Weekly Development Update 3/14–3/21,Bounce Finance strives to provide a seamless and secure platform for users to engage in decentralized auctions. Lately our team has been working h...,50.0,50.0,7.567501068115234,79.295,53.333333333333336,95.1170027256012,2023-04-06
415,Bounce Finance,ERC-4337 & Bounce V3: Introducing Account Abstraction,"Dear Bounce community,We are thrilled to share some exciting news with you today. As you know, our goal at Bounce is to create a user-friendly, se...",50.0,50.0,99.61889982223511,95.00500000000001,72.5,89.19278085231781,2023-04-06
