,source,title,excerpt,vader_sentiment_title,tb_sentiment_title,flair_sentiment_title,vader_sentiment_excerpt,tb_sentiment_excerpt,flair_sentiment_excerpt,date
80,AMBCrypto,Uniswap [UNI] surpasses SUSHI and CRV on this front,"Uniswap had the highest network penetration among major DEXes on Ethereum. UNI was the most widely held token by top Ethereum whales, at the time ...",50.0,50.0,96.88606858253479,60.114999999999995,62.03125000000001,99.784916639328,2023-03-10
81,ItsBitcoinWorld,'CryptoGPT' Twitter Accounts Spring Up as Hashtag Trends on Twitter,"On Twitter, the hashtag ""CryptoGPT"" has been trending in relation to a putative artificial intelligence (AI) cryptocurrency coin. Alongside it, a ...",50.0,50.0,88.33146393299103,73.83500000000001,33.333333333333336,0.49108266830444336,2023-03-10
82,crypto.ro global,"Bitcoin drops below $20,000 following Biden’s budget proposal","On March 10th, the price of BTC experienced a dip below the $20,000 mark, which had not occurred in almost two months. This drop followed the anno...",50.0,50.0,0.032129883766174316,36.34,90.0,0.005555152893066406,2023-03-10
83,Crypto Daily™,"CFTC Chair Calls Ethereum A Commodity, Crypto Daily TV 10/3/2023","In Todays Headline TV CryptoDaily News: Vitalik Buterin dumps altcoins that have ""no moral value."" Vitalik Buterin, a co-founder of the Ethereum b...",50.0,50.0,0.8551508188247681,20.029999999999998,50.0,0.0022590160369873047,2023-03-10
84,ItsBitcoinWorld,Ethereum Price Nosedives and Signals A Larger Degree Decline,"The price of Ethereum was unable to break over the $1,560 and $1,565 levels of resistance. The price of ETH reached its high around $1,565 and the...",50.0,50.0,0.07040798664093018,55.135,41.5,0.46147704124450684,2023-03-10
85,crypto.news,Cathie Wood’s ARK buys 350k Coinbase shares in rough market,"Investment firm ARK, led by renowned investor Cathie Wood, purchased more than 350,000 Coinbase shares according to an email transaction report.",64.8,45.0,19.030490517616272,64.8,57.49999999999999,1.5530049800872803,2023-03-10
86,Altcoin Buzz,ZenGo Wallet Review,"ZenGo is a great wallet that’s been around since 2018. It might be the best and most secure crypto wallet you’ve never heard of. With security, pr...",50.0,50.0,93.30205023288727,96.22500000000001,83.74999999999999,99.94929730892181,2023-03-10
87,AMBCrypto,HedgeUp: The Future of Alternative Investments is off to a successful start,"With the ever-changing economic landscape and unpredictable market conditions, investors constantly seek new and innovative ways to diversify thei...",79.295,68.75,6.876781582832336,72.02,56.6969696969697,86.52956783771515,2023-03-10
88,Crypto Daily™,Bitcoin Price Analysis: Stops Hit Below 19646 - 11 March 2023,BTC/USD Extends Collapse Below 20000:&nbsp; Sally Ho&rsquo;s Technical Analysis &ndash; 11 March 2023 Bitcoin (BTC/USD) remained at the mercy of b...,42.345,50.0,3.837066888809204,47.42,50.0,0.04652440547943115,2023-03-10
89,"CoinDesk: Bitcoin, Ethereum, Crypto News and Price Data",Signature Bank Stock Down 12% in Volatile Action as Bank Selloff Continues,"SBNY shares sank as low as $64.60 at 14:45 UTC on Friday, a drop of around 28% from its opening price of just over $90.",50.0,48.61111111111111,0.13064444065093994,37.5,50.0,0.00209808349609375,2023-03-10
90,Crypto Daily™,"CFTC Chair Declares ETH A Commodity, Crypto Daily TV 10/3/2023","In Todays Headline TV CryptoDaily News: Vitalik Buterin dumps altcoins that have ""no moral value."" Vitalik Buterin, a co-founder of the Ethereum ...",50.0,50.0,1.1093378067016602,20.029999999999998,50.0,0.002771615982055664,2023-03-10
91,Connor Sephton,"CoinMarketCap News, Mar 10: Bitcoin and Ether Sink to Two-Month Lows","Also today, a new token that's attempting to capitalize on the momentum of ChatGPT is causing a huge splash on Twitter.",39.885,50.0,0.0013768672943115234,65.91,63.40909090909091,0.39471983909606934,2023-03-10
92,Connor Sephton,Podcast: The Body Blows Keep Coming for Crypto,Bitcoin falls 8% in a single day as yet another U.S. bank shows signs of distress — and it's not good news for Ether either.,50.0,50.0,0.3466784954071045,14.955000000000002,39.464285714285715,0.0015079975128173828,2023-03-10
93,crypto.news,NYAG says ethereum is security in KuCoin Lawsuit,"New York Attorney General (NYAG) Letitia James, claimed in court that ethereum (ETH) is security and exchanges should register it before offering ...",56.400000000000006,50.0,20.45670449733734,67.0,54.659090909090914,6.6060662269592285,2023-03-10
94,ItsBitcoinWorld,"Huobi Token Tanks 93% in Minutes, Justin Sun Blames Liquidations and ‘Market Behavior’","Recent events involving the Huobi token have been accompanied by some peculiar occurrences. During the early morning hours of March 10, the price ...",29.905000000000005,50.0,0.16161799430847168,57.655,52.5,0.08134841918945312,2023-03-10
95,ItsBitcoinWorld,US Fed to Create New Crypto Team amid Concerns About Unregulated Stablecoins,"According to a Fed official, the US Federal Reserve will establish a ""specialized team of specialists"" to monitor changes in the cryptocurrency se...",63.660000000000004,56.81818181818181,2.1085381507873535,50.0,50.0,12.680572271347046,2023-03-10
96,"CoinDesk: Bitcoin, Ethereum, Crypto News and Price Data",Reviewing Code is Mind-Numbing: Q&A With Bitcoin Maintainer Andrew Chow,He stumbled upon Bitcoin in high school while looking for ways to pay for his favorite video games. He now reviews and improves Bitcoin’s code for...,50.0,50.0,0.05717277526855469,82.985,66.5,99.95249807834625,2023-03-10
97,ItsBitcoinWorld,FTX Exec Loses $3.7 Million Island Home to Authorities 5 Months After Buying It,"In October of 2017, Nishad Singh, who is the Lead Engineer at FTX, purchased a vacation home in the San Juan islands for a price of $3.7 million. ...",34.089999999999996,35.0,0.006198883056640625,50.0,50.0,9.127724170684814,2023-03-10
98,ItsBitcoinWorld,U.S. DOJ Appeals New York Judge’s Decision to Approve Voyager’s Sale to Binance.US,"Late Thursday evening, the United States Department of Justice (DOJ) filed an appeal challenging the decision of a New York bankruptcy judge to ap...",50.0,56.81818181818181,2.023881673812866,88.915,55.6060606060606,1.5705019235610962,2023-03-10
99,Cointelegraph,4 ETH staking choices that say something about your personality,"From liquidity pools to liquid staking and “looping,” here are a few approaches you can take to ETH staking — categorized by the Chinese Zodiac.",50.0,50.0,84.18386280536652,50.0,45.0,81.79519474506378,2023-03-10
100,AMBCrypto,Will XRP make a comeback after the recent price decline? Data suggests…,The downtrend in the market seems to have caught up with XRP as its decline enters day two. MVRV and active addresses have also declined as holder...,50.0,50.0,13.278010487556458,70.095,43.333333333333336,0.010374188423156738,2023-03-10
101,ItsBitcoinWorld,Crypto Winter Freezes Sports Sponsorship Deals in 2023,"In a deal that is said to be worth $700 million over the course of 20 years, Crypto.com was awarded the naming rights to the home arena of the Los...",48.71,50.0,0.2809792757034302,77.86999999999999,65.0,1.4668524265289307,2023-03-10
102,ItsBitcoinWorld,"BNB Price Grinds Lower, Here’s Next Bearish Target Traders Should Watch",The price of BNB has been moving steadily lower from the $325 resistance zone over the course of the last few days. The price fell below the $300 ...,35.199999999999996,50.0,76.62758231163025,35.199999999999996,49.44444444444444,0.9465962648391724,2023-03-10
103,Crypto Daily™,Huobi To Create $100M USD Liquidity Fund,"Singapore, Singapore, 10th March, 2023, ChainwireHuobi has announced a $100 million Liquidity Fund with the aim of enhancing currency liquidity ac...",63.660000000000004,50.0,0.8917361497879028,50.0,50.0,1.5265494585037231,2023-03-10
104,ItsBitcoinWorld,Hedera confirms exploit on mainnet led to theft of service tokens,"The creators of the distributed ledger Hedera Hashgraph, Hedera, have acknowledged a smart contract vulnerability on the Hedera Mainnet that resul...",44.865,50.0,0.06568729877471924,60.114999999999995,60.71428571428571,0.4026442766189575,2023-03-10
105,ItsBitcoinWorld,"Shiba Inu Ablaze With 30,000% Burn Rate – Will This Fire Up SHIB Price?","Shiba Inu, a decentralized cryptocurrency that runs on the Ethereum blockchain, may have only been founded in 2020, but because to its memorable d...",32.99999999999999,50.0,0.1400589942932129,50.0,62.5,95.93030512332916,2023-03-10
106,BlockchainReporter,Tether Accuses WSJ of Spreading Misleading Information,"One of the largest stablecoin issuers in the world, Tether, has accused The Wall Street Journal (WSJ) of publishing and spreading false informatio...",18.755,50.0,0.07734298706054688,35.199999999999996,29.999999999999993,0.08774995803833008,2023-03-10
107,CoinstelegramEng,What happens to BTC: reasons for bitcoin fall and forecast of bitcoin,"The most capitalized cryptocurrency $BTC ends the working week with a fall. As of the morning of March 10, the coin is trading below $20 thousand....",50.0,50.0,0.09098052978515625,50.0,75.0,0.0011920928955078125,2023-03-10
108,Finbold,Could Dogecoin (DOGE) make you a millionaire?,The cryptocurrency industry continues to suffer a bearish streak that has seen its market capitalization drop below the psychological threshold … ...,50.0,50.0,6.776127219200134,15.960000000000003,50.0,0.03930330276489258,2023-03-10
109,Altcoin Buzz,Best 3 Decentralized Exchanges in NEAR,"Back in April 2020, the NEAR protocol was launched along with 1 billion $NEAR tokens. It is a Layer 1 (L1) smart contract blockchain. With this, d...",81.845,77.5,99.99382495880127,74.695,55.17857142857143,98.8535225391388,2023-03-10
110,Crypto Daily™,Logan Paul’s Doomed CryptoZoo Project Resurrected by DAOMaker,"CryptoZoo, Logan Paul&rsquo;s proposed online game project, was recently at the center of a class-action lawsuit after the YouTuber apologised to ...",18.154999999999998,50.0,9.304967522621155,43.6,41.66666666666667,0.1638263463973999,2023-03-10
111,CoinGape,BTC Price Prediction: Bitcoin Price Lost 50% Retracement Level In Its Correction Phase; More Downfall Ahead?,BTC Price Prediction: The second week of March 2023 brings more pain to the crypto market as it lost the $1 Trillion mark in total market capitali...,34.089999999999996,75.0,0.01157224178314209,14.555000000000001,58.333333333333336,0.0065386295318603516,2023-03-10
112,Altcoin Buzz,Aptos Beginner’s Guide – Part 2,Aptos is a new and much anticipated Layer 1 blockchain. It launched in October 2022. Its founders were active in Meta's defunct blockchain project...,50.0,50.0,99.76727664470673,74.695,53.38383838383839,97.86998629570007,2023-03-10
113,crypto.news,Comparing decentralized ecological credential products bridging web2 and web3,"This article compares Web3ite Pass and ENS, examining various aspects such as technical solutions, application scenarios, and prospects",50.0,70.0,96.7644602060318,72.02,50.0,81.02505207061768,2023-03-10
114,ItsBitcoinWorld,"FTX’s Loss May be Avalanche’s Gain, But Here’s Where AVAX Stands","Even though the FTX collapse severely hurt the cryptocurrency market, Avalanche was still able to gain from the situation. Popular gaming company ...",57.03,50.0,7.627156376838684,23.665000000000003,77.5,98.67079555988312,2023-03-10
115,Altcoin Buzz,Aptos Beginner’s Guide – Part 1,"Aptos is a Layer 1 blockchain. It is also one of the newer chains on the block. Its mainnet launched in October 2022. Since that date, they have b...",50.0,50.0,99.76852834224701,32.99999999999999,50.0,97.85850942134857,2023-03-10
116,ItsBitcoinWorld,"The Great Investment Debate: Bitcoin, Gold, Real Estate, or Stocks?","Some speculators call Bitcoin ""digital gold."" Since 2009, Bitcoin (BTC) has grown significantly, despite its volatility. . Since then, the price h...",81.245,75.0,1.6237348318099976,50.0,59.375,95.12970745563507,2023-03-10
117,ItsBitcoinWorld,$ADA: Cardano’s DeFi Total Value Locked Hits New All-Time High,"A new record high of 336.8 million $ADA tokens, or more than $110 million at the time of writing, has recently been reached for the total value lo...",67.0,54.939393939393945,5.521422624588013,71.075,57.96363636363636,0.07085204124450684,2023-03-10
118,crypto.news,Coinbase CEO hails reintroduction of crypto tax reform law,Coinbase CEO Brian Armstrong has lauded U.S. lawmakers’ decision to revive a bill seeking to clarify crypto tax reporting.,50.0,50.0,13.845577836036682,67.0,50.0,99.28717315196991,2023-03-10
119,Cointelegraph,Bitcoin battles $20K as trader calls bank chaos '2008 all over again',"BTC price targets extend to $18,000 with Bitcoin bulls increasingly failing to preserve $20,000 as support amid further SVB Financial fallout.",12.85,50.0,0.030106306076049805,51.29,50.0,0.017124414443969727,2023-03-10
120,ItsBitcoinWorld,Bitcoin Price Prediction as Fed Chair Powell Warns of Higher Than Expected Interest Rates – Will Crypto Prices Crash?,Bitcoin continues to be one of the most well-known and frequently traded assets in the cryptocurrency industry. Many investors have recently quest...,48.71,53.75,0.5800753831863403,58.894999999999996,63.74999999999999,99.9671071767807,2023-03-10
121,ItsBitcoinWorld,Biden Budget Plan Would Close Crypto Tax Loss Harvesting Loophole,"A measure to stop tax loss harvesting on cryptocurrency transactions will be included in U.S. President Joe Biden's proposed budget, which is sche...",34.089999999999996,50.0,1.3151615858078003,22.884999999999998,50.0,5.795130133628845,2023-03-10
122,CoinGape,Breaking: After Silvergate Now Silicon Valley Bank Considers Selling Itself; Who’s Next?,"A prominent U.S. financial institution, the Silicon Valley Bank, is looking to sunset its operations as it considers selling itself after failing ...",50.0,50.0,3.2091617584228516,37.5,62.5,0.0940173864364624,2023-03-10
123,ItsBitcoinWorld,SBF’s Lawyers Signal Need to Push Back October Criminal Trial,"Sam Bankman-Fried, the founder of FTX, has indicated that it would be essential to postpone the criminal trial for the former executive of a crypt...",23.665000000000003,40.0,2.822345495223999,17.570000000000004,43.333333333333336,0.2741485834121704,2023-03-10
124,ItsBitcoinWorld,Mt. Gox Bitcoin Whale Fund Plans to HODL After Choosing September Payout,"The Mt. Gox Investment Fund intends to keep the assets owed to it in September, per a March 9 Bloomberg story. The fund sued Mt. Gox, which filed ...",50.0,50.0,0.025194883346557617,58.894999999999996,50.0,0.9107828140258789,2023-03-10
125,Crypto Daily™,Biden Budget Proposes Taxing Crypto Miners,The proposed budget of the Biden administration has a clause that would impose taxes on the electricity usage of cryptocurrency miners.&nbsp; Tax ...,50.0,50.0,0.008511543273925781,35.199999999999996,50.0,0.18488764762878418,2023-03-10
126,ItsBitcoinWorld,Silvergate Downfall Sparks Debate Over Whose Fault It Actually Was,"The crypto-friendly bank Silvergate has decided to voluntarily liquidate its operations, which has prompted many people to offer their ideas regar...",29.905000000000005,50.0,1.8167585134506226,50.0,75.0,0.043705105781555176,2023-03-10
127,The Block,"Silicon Valley Bank plunges 60% before halt, Signature trading stopped shortly after open","Silicon Valley Bank, a popular destination for start-ups and venture firms, was halted for news pending. Signature Bank, a potential alternative t...",38.685,50.0,0.2160400152206421,71.075,65.0,0.19170045852661133,2023-03-10
128,ItsBitcoinWorld,"U.S. Government's $1B Bitcoin Transfer Spooks Investors, Bitcoin Dips","U.S. authorities moved $1 billion in bitcoin (BTC) acquired from a dark web breach to new wallet addresses on Wednesday, including one controlled ...",50.0,50.0,0.049945712089538574,50.0,49.65909090909091,0.1473069190979004,2023-03-10
129,BetterFan,Better Fan x GSIC Partnership Announcement,Better Fan has partnered with Global Sports Innovation Center (GSIC) to promote innovation and modernization of the sports industry. GSIC is a non...,81.845,75.0,87.37312257289886,95.00500000000001,56.666666666666664,95.07911205291748,2023-03-10
130,ItsBitcoinWorld,Bitcoin Miner Marathon Digital Ends Credit Ties With Struggling Silvergate Bank,"One of the biggest Bitcoin mining businesses in the US, Marathon Digital (MARA), is in the news. The mining company terminated its credit faciliti...",47.42,50.0,2.326872944831848,69.08999999999999,50.0,0.03673136234283447,2023-03-10
131,CoinGape,Just-In: Massive 485 Million SHIB Burn In Single Transaction Ahead Shibarium Release,Massive amount of SHIB burn by a whale is raising speculation in the Shiba Inu community. The whale sent over billions of SHIB tokens to Shiba Inu...,50.0,48.214285714285715,0.7135778665542603,50.0,50.0,0.4186570644378662,2023-03-10
132,ItsBitcoinWorld,Fantom (FTM) Begins March 2023 on a Negative Note — More Downside Forecast Ahead,"For hosting decentralized finance (DeFi) services for cryptocurrency investors, Fantom is a directed acyclic graph (DAG) smart-contract platform c...",14.11,55.00000000000001,0.07047951221466064,50.0,50.0,99.40542280673981,2023-03-10
133,ItsBitcoinWorld,AirBit Club Execs Face Decades in Prison after Pleading Guilty to $100M Fraud,"Six persons, each facing a potential term of 20 to 30 years in jail, have admitted to participating in a cryptocurrency ""Ponzi scheme"" that made n...",6.4,25.0,0.22640228271484375,55.135,47.5,0.1352757215499878,2023-03-10
134,ItsBitcoinWorld,Yuga Labs' Otherside Metaverse to Launch Second Trip on March 25,"Yuga Labs, the parent firm of Bored Ape Yacht Club, released fresh information on Wednesday on the second test of their gamified Otherside metaver...",50.0,50.0,99.70977008342743,52.580000000000005,45.0,0.29358863830566406,2023-03-10
135,ItsBitcoinWorld,"Bitcoin Price Bears Keep Pushing, Why Drop To $20K Is Still Possible","The price of bitcoin was unable to begin a rebound wave above the resistance zone located at $22,250. Bears continued to be active in the BTC mark...",36.34,50.0,0.14818906784057617,70.095,39.44444444444444,4.366636276245117,2023-03-10
136,ItsBitcoinWorld,"Polygon (MATIC) Price Down 27%, but Growing Traction Gives Hope",Polygon is a Layer-2 (L2) scaling solution that has been marketed as a solution to Ethereum's throughput concerns and prohibitively high gas price...,85.48,42.22222222222222,99.46751296520233,77.86999999999999,57.99999999999999,93.00222396850586,2023-03-10
137,crypto.news,Vitalik Buterin speaks against shitcoins despite recently selling them,"Through a reddit post, Vitalik expressed his stands on some of the shitcoins he disposed off in the past few days has he pushes the agenda further...",50.0,50.0,5.024689435958862,50.0,42.5,76.99994444847107,2023-03-10
138,crypto.news,"Lawyer may sue Coinbase, Robinhood for securities law violations",Leading securities lawyer Tom Grady is reportedly preparing to file a lawsuit on behalf of retail investors against top U.S. crypto exchanges Coin...,35.199999999999996,50.0,0.5507111549377441,63.660000000000004,75.0,0.4385948181152344,2023-03-10
139,ItsBitcoinWorld,"Stablecoins and Ether are ‘going to be commodities,’ Reaffirms CFTC Chair","Stablecoins and Ether are commodities, according to the head of the United States Commodities Futures Trading Commission (CFTC), and should be reg...",50.0,50.0,98.89555275440216,71.075,50.0,12.04831600189209,2023-03-10
140,CodexHTML,"The January, February, and March Burns For The Codex Burn Initiative Have Just Been Completed!","The January, February, and March burns for CDEX token have just been completed. JAN,FEB,MAR. Transaction ID: b050fd9e96546c459a8ae9868ab55ec853952...",50.0,50.0,86.139577627182,50.0,50.0,0.23130476474761963,2023-03-10
141,Decrypt,Embattled Silicon Valley Bank Seeking Outside Acquisition: Report,Trading for SVB Financial has been suspended as the parent company behind Silicon Valley Bank is reportedly seeking a buyout.,50.0,50.0,0.6020545959472656,26.165,40.0,0.024187564849853516,2023-03-10
142,Cointelegraph,5 basic principles of finance you should know,"Discover the five basic principles of finance to improve your financial literacy, including, time value of money, risk management, compounding and...",50.0,50.0,99.96027052402496,74.695,50.0,99.81013834476471,2023-03-10
143,ItsBitcoinWorld,Biden Wants to Double Capital Gains and Clamp Down on Crypto Wash Sales: Reports,"The next budget plan from U.S. President Joe Biden has a few surprises for cryptocurrency traders and investors, such as a proposal to double capi...",67.0,50.74074074074074,0.3197133541107178,61.315,47.5,1.1880964040756226,2023-03-10
144,AMBCrypto,Ripple [XRP]: Short-term bears can gain more leverage only if…,"Disclaimer: The information presented does not constitute financial, investment, trading, or other types of advice and is solely the writer’s opin...",76.335,62.5,1.416611671447754,50.0,46.875,0.11563897132873535,2023-03-10
145,ItsBitcoinWorld,Crypto Stakeholders Say No Exposure to Shuttered Silvergate,"Companies dealing in cryptocurrencies are rushing to convince investors that they do not have any corporate cash remaining at Silvergate Bank, whi...",35.199999999999996,50.0,5.064448714256287,62.5,50.0,0.06693005561828613,2023-03-10
146,"CoinDesk: Bitcoin, Ethereum, Crypto News and Price Data",On-Chain Liquidations Beckon as Ether Slumps to 2-Month Low,"Several on-chain positions are at risk of being liquidated following ether's plunge to a two-month low of $1,373.",36.34,50.0,0.0025987625122070312,25.305,50.0,0.006467103958129883,2023-03-10
147,Tradetomato,New Partner Announcement,"We are thrilled to announce our newest partner, Infinity PAD, a leading launchpad on the Binance Smart Chain. This partnership marks our first col...",50.0,56.81818181818181,99.58731532096863,84.04,67.73809523809524,99.90538358688354,2023-03-10
148,Leo Jakobson,Why Silvergate Bank is Winding Down… and Why It's a Big Blow to Crypto,"When mainstream banks were closing traders' accounts, Silvergate embraced cryptocurrency exchanges. Now it's gone and no mainstream banks want to ...",50.0,50.0,0.04738271236419678,38.685,50.0,10.614743828773499,2023-03-10
149,crypto.news,Blockchain.com closes its asset management arm,"Blockchain.com, a crypto services company, is suspending operations of its asset management subsidiary. The service had been operational for less ...",68.06,50.0,0.12314319610595703,68.06,41.66666666666667,0.009432435035705566,2023-03-10
150,Crypto Daily™,Rutherford Atayobo Throws Light Upon the Web3 Gaming Platoform SinVerse,"Exclusive live discussion with Rutherford Atayobo, the accomplished Chief Operating Officer of SinVerse - a revolutionary blockchain-based metaver...",50.0,70.0,99.86627101898193,76.335,58.409090909090914,99.61671531200409,2023-03-10
151,"CoinDesk: Bitcoin, Ethereum, Crypto News and Price Data","Banks Shouldn’t ‘Punish’ Crypto Industry, Republican Senators Urge","A crackdown on digital assets companies is reminiscent of “choke point” targeting of gun sales, Fed Governor Jerome Powell was told.",50.0,50.0,1.9508510828018188,41.105000000000004,50.0,0.21331608295440674,2023-03-10
152,Connor Sephton,CryptoGPT is Trending on Twitter… Is It All Style and No Substance?,"CryptoGPT claims that it allows users to monetize their data — and ""turn every task of daily life into a source of income."" But some on Twitter ar...",35.199999999999996,50.0,0.09292960166931152,50.0,50.0,0.1525789499282837,2023-03-10
153,crypto.news,Why is XRP down today,"In this article, we will explore why XRP&#8217;s recent price decrease and discuss how it may perform in the coming days. As of March 10, XRP, the...",50.0,42.22222222222222,2.8168201446533203,50.0,50.0,1.62181556224823,2023-03-10
154,Cointelegraph,Next stop Shanghai — Ethereum’s latest milestone approaches,The Ethereum ecosystem is edging closer to its latest milestone as the Shanghai upgrade draws near.,35.199999999999996,62.5,99.08922910690308,50.0,65.0,99.33829307556152,2023-03-10
155,The Block,DegenZoo used AI to create Logan Paul’s NFT game without him,Logan Paul was shamed for promoting NFT project CryptoZoo as a fun game without building it. The community made one anyway.,63.660000000000004,30.0,99.13828074932098,64.8,47.5,0.32209455966949463,2023-03-10
156,BlockchainReporter,Dao Maker’s Degen Zoo Defies Odds with 30-Day Development of Abandoned Logan Paul Game,"NFT game Degen Zoo, which was built from Logan Paul’s abandoned Crypto Zoo, was developed in its entirety by Christoph Zaknun in a span of 30 days...",27.060000000000002,30.0,0.12758970260620117,27.060000000000002,42.5,99.97681379318237,2023-03-10
157,AMBCrypto,Joe Biden’s government proposes 30% crypto mining tax,President Joe Biden has proposed an excise tax on cryptocurrency mining companies that is 30% of the cost of the power they use. Biden&#8217;s Fis...,50.0,50.0,0.017815828323364258,50.0,50.0,0.9976983070373535,2023-03-10
158,Crypto Daily™,Russia Mining Bill: Not Declaring Profits Could Result in Prison,A new Russian crypto mining bill proposes sending individuals who fail to declare profits derived from mining to prison. The Russian Ministry of ...,15.43,50.0,0.5035191774368286,20.029999999999998,45.45454545454545,0.0034868717193603516,2023-03-10
159,Cointelegraph,DAO Maker founder builds game based on abandoned Logan Paul project in just 30 days,"“Degen Zoo” has seen more than 115,000 wallets register to join the game, pledging over $700 million.",27.060000000000002,30.0,92.82938539981842,64.8,52.5,1.366722583770752,2023-03-10
160,The Block,Uniswap v3 will become free to use after business license expires on April 1,Uniswap v3 is set to become completely free for use as open source software after the expiration of its current business license April 1.,75.53,70.0,0.02288818359375,77.815,56.666666666666664,0.007116794586181641,2023-03-10
