,source,title,excerpt,vader_sentiment_title,tb_sentiment_title,flair_sentiment_title,vader_sentiment_excerpt,tb_sentiment_excerpt,flair_sentiment_excerpt,date
88,AMBCrypto,Cardano: Latest planned update could foster ADA rise – on one condition,"Cardano is set to implement a new update in February to enhance the network. ADA, despite its recent uptrend, remains undervalued per the MVRV Z s...",50.0,75.0,8.17863643169403,50.0,53.40909090909091,10.139140486717224,2023-01-21
89,BSCnews,"Talaxeum On Fire: Seed Sale Fully-Booked, New Advisor and Staking Testnet Launch","Ahead of the January testnet launch, Talaxeum shares a number of exciting updates.",32.99999999999999,56.81818181818181,99.87596273422241,84.53999999999999,65.0,98.43619167804718,2023-01-21
90,CoinGape,5 Blockchain Games To Play And Earn This Week,Play And Earn Games: The gaming industry has developed beyond pay-to-play and free-to-play games to include games that allow players to earn crypt...,67.0,50.0,99.89088773727417,75.53,55.00000000000001,99.50419068336487,2023-01-21
91,AMBCrypto,Solana (SOL) Price Prediction 2025-30: How high can SOL go?,Disclaimer: The datasets shared in the following article have been compiled from a set of online resources and do not reflect AMBCrypto’s own rese...,50.0,57.99999999999999,12.853306531906128,67.0,65.0,0.043210387229919434,2023-01-21
92,Cointelegraph,FTX VCs liable to ‘serious questions’ around due diligence — CFTC Commissioner,The lack of recordkeeping of FTX coupled with “an auditor no one’s ever heard of” forces the CFTC to ask questions about the mind...,50.0,40.69444444444444,1.631760597229004,22.884999999999998,50.0,0.2048581838607788,2023-01-21
93,AMBCrypto,Stellar (XLM) Price Prediction 2025-30: What’s the status of XLM?,Disclaimer: The datasets shared in the following article have been compiled from a set of online resources and do not reflect AMBCrypto’s own rese...,50.0,62.5,80.5638313293457,67.0,65.0,0.043210387229919434,2023-01-21
94,CoinGape,Twitter Lost 80% Workforce Under Elon Musk: Report,,34.089999999999996,50.0,0.014343857765197754,50.0,50.0,0.0,2023-01-21
95,AMBCrypto,Why Bitcoin investors are on edge following Genesis’ bankruptcy announcement,"Genesis’ bankruptcy filing revived concerns of a potential Bitcoin selloff. However, bulls charged through the FUD and passed the $22,000 price le...",50.0,50.0,4.9873679876327515,21.889999999999997,50.0,0.3147333860397339,2023-01-21
96,CoinGape,IPL Franchise RCB Twitter Account Hacked With BAYC Name,,29.905000000000005,50.0,0.010845065116882324,50.0,50.0,0.0,2023-01-21
97,Crypto Daily™,"LBank Exchange Will List Speed Service Mobility (SSM) on January 27, 2023","INTERNET CITY, DUBAI, 21st January, 2023, ChainwireLBank Exchange, a global digital asset trading platform, will list Speed Service Mobility (SSM)...",50.0,50.0,1.16996169090271,68.06,50.0,99.39510226249695,2023-01-21
98,CoinGape,Crypto News Live Updates Jan 21: Aptos Price Shoots By 42%; Bitcoin Up By 8%,Crypto News Today Live Updates December and Latest News: (21 January 2023) The digital asset market registered a broad recovery on Saturday mornin...,50.0,56.81818181818181,0.003892183303833008,68.06,49.48863636363636,18.25297176837921,2023-01-21
99,CoinGape,"Crypto Prices Today: Bitcoin Jumps Over 7%, Breaches 22k Mark, Solana Gets Double-Digit Boost","Crypto Prices Today: The market is trading in green today, as many significant coins have seen a massive jump in the past 24 hours. As of writing,...",70.095,50.0,12.387499213218689,60.114999999999995,54.25,2.2672325372695923,2023-01-21
100,Crypto Daily™,GroveC (GRV) Is Now Available for Trading on LBank Exchange,"INTERNET CITY, DUBAI, 21st January, 2023, ChainwireLBank Exchange, a global digital asset trading platform, listed GroveC (GRV) on Jan 19, 2023. F...",50.0,70.0,98.61931204795837,68.06,50.0,3.0977725982666016,2023-01-21
101,CoinGape,Lambda Labs Introduces An Artificial Intelligence Image Mixer,Lambda Labs has announced the release of a new AI image mixer capable of combining up to five images. The image mixer is built on the Stable Diffu...,73.83500000000001,20.0,99.30272996425629,79.295,58.409090909090914,97.96571731567383,2023-01-21
102,Cointelegraph,SBF to forfeit $700M worth of assets if found guilty of fraud,"While most of SBF’s assets have been seized, Federal prosecutor Damian Williams outlined that the government is also looking to t...",19.379999999999995,45.0,0.06848573684692383,62.075,75.0,0.7172852754592896,2023-01-21
103,CoinGape,Elon Musk Unveils New Twitter Update Coming Soon,,50.0,56.81818181818181,8.398166298866272,50.0,50.0,0.0,2023-01-21
104,Crypto Daily™,"NFT Collection Stoner Cats Price, Stats, and Review",Stoner Cats is an adult animated short series accessed exclusively by owning a collectible Stoner Cat NFTs. The NFT sales directly fund the mini-p...,50.0,50.0,99.9232530593872,50.0,46.25,87.2182697057724,2023-01-21
105,Crypto Daily™,"NFT Collection Nifty League DEGENs Price, Stats, and Review",🎮 niftyleague.com 🎮 Welcome To The Nifty League! Get ready to brawl! Nifty League is one of the first NFT gaming platforms set to change the way ...,70.095,50.0,99.99147653579712,94.405,75.0,99.0920901298523,2023-01-21
106,Crypto Daily™,"NFT Collection Polychain Monsters | BNB Chain Price, Stats, and Review",Polychain Monsters are beautifully animated digital collectibles with varying scarcities. Each Polychain Monster is backed by a truly unique NFT a...,50.0,50.0,99.4863361120224,88.58500000000001,70.41666666666667,99.99884963035583,2023-01-21
107,NewsBTC,What is SingularityNET And Why Is Its AGIX Token Exploding By 116%?,The popularity of artificial intelligence applications has been growing as popular platforms like SingularityNET and ChatGPT become mainstream. Wi...,50.0,50.0,0.022336840629577637,95.21,50.0,99.83250796794891,2023-01-21
108,Crypto Daily™,"NFT Collection Wicked Ape Bone Club Price, Stats, and Review","10,000 Skeletal Apes living on the Ethereum blockchain as ERC-721 Non-Fungible Tokens. By owning an ape, you automatically yield 10 $WCKD utility ...",23.665000000000003,50.0,99.95706081390381,50.0,50.0,0.02052485942840576,2023-01-21
109,CoinGape,Fast Recovering Hedera Coin Hints 38% Rise In Coming Weeks; Enter Now?,"Amid the recent recovery in the crypto market, the Hedera coin rebounded from the $0.037 mark and witnessed a parabolic recovery. Moreover, this V...",50.0,60.0,89.36009407043457,50.0,50.0,94.2492663860321,2023-01-21
110,Crypto Daily™,"NFT Collection Swampverse Price, Stats, and Review",Adventure through uncharted wetlands Swampverse: Creatures Swampverse: Items Swampverse: Mini Drops The total number of owners has reached 2977. N...,50.0,50.0,99.78142976760864,72.94,50.0,20.244315266609192,2023-01-21
111,Crypto Daily™,"NFT Collection T-O-S The Other Side Price, Stats, and Review","8888 Moonwalkers were each randomly generated from over 300 mystical traits. Each Moonwalker generates $MOONZ, the T-O-S utility token, that goes ...",50.0,43.75,98.96326661109924,50.0,25.0,86.47195398807526,2023-01-21
112,Bitcoinist,FTX: U.S. Authorities Seize Nearly $700 Million Of Sam Bankman-Fried’s Assets,"The FTX brouhaha continues and this time, unsurprisingly, millions of dollars in cash and assets belonging to the crypto exchange&#8217;s former b...",58.894999999999996,55.00000000000001,3.3133476972579956,58.894999999999996,50.0,0.516587495803833,2023-01-21
113,Crypto Daily™,"NFT Collection The Doggies (Snoop Dogg) Price, Stats, and Review","🐶 The Doggies - Snoop Dogg Avatars 🐶 10,000 metaverse-ready Avatars, playable in The Sandbox. Each Doggy has been generated from over 150+ traits,...",50.0,50.0,97.93882071971893,50.0,50.0,99.94436800479889,2023-01-21
114,Crypto Daily™,"NFT Collection Los Muertos World Price, Stats, and Review","54%+ unique owners. Opensea ""unique owners"" count is inaccurate due to staking in The Graveyard. Los Muertos is a 10,000-piece collection which gi...",50.0,50.0,99.99052584171295,35.199999999999996,60.416666666666664,99.53402578830719,2023-01-21
115,Crypto Daily™,"NFT Collection CryptoNinja Partners Price, Stats, and Review","CryptoNinja Partners (CNP) is a 22,222-piece collection starring CryptoNinja sub-characters. Examples of ongoing projects: ・NFT exchange mechanism...",50.0,50.0,99.93529915809631,50.0,50.0,99.77979362010956,2023-01-21
116,Crypto Daily™,"NFT Collection Wrapped MoonCatsRescue - Unofficial Price, Stats, and Review",The total number of owners has reached 725. NFT Collection Wrapped MoonCatsRescue - Unofficial Price and Sales The market capitalization of Wrappe...,50.0,50.0,6.404009461402893,58.894999999999996,50.0,14.397549629211426,2023-01-21
117,Crypto Daily™,"NFT Collection Party Ape Billionaire Club Price, Stats, and Review","The BILLIONAIRE CLUB is a private collection of 10 000 billionaire apes NFTs - unique digital collectibles. Earlier this year, a mysterious force ...",70.095,50.0,88.65915238857269,50.0,53.75,93.24397444725037,2023-01-21
118,Cointelegraph,Crypto to play 'major role' in UAE trade: foreign trade Minister,UAE’s minister of state for foreign trade Thani Al-Zeyoudi noted that as the country has attracted a lot of talent from the crypt...,67.0,48.4375,6.807157397270203,84.04,43.75,99.45289194583893,2023-01-21
119,Cointelegraph,Crypto to play 'major role' in UAE trade: foreign trade minister,UAE’s minister of state for foreign trade Thani Al-Zeyoudi noted that as the country has attracted a lot of talent from the crypt...,67.0,48.4375,6.807157397270203,84.04,43.75,99.45289194583893,2023-01-21
120,Decrypt,"Nearly $700M Worth of Assets Linked to Sam Bankman-Fried, FTX Seized by US","The assets, including more than 55 million shares in Robinhood, were seized as part of the case against the FTX founder and former CEO.",69.08999999999999,60.0,3.631177544593811,72.02,62.5,2.3657381534576416,2023-01-21
121,Crypto Daily™,"NFT Collection FoxFam Price, Stats, and Review","Fox Fam is a collection of generative characters, designed by Yum Yum Studio. The foxes are created from a set of lovingly handcrafted attributes ...",50.0,50.0,99.9406635761261,86.75500000000001,80.0,99.99711513519287,2023-01-21
122,Crypto Daily™,"NFT Collection Gutter Rats Price, Stats, and Review","Welcome to the Gutter. The Gutter Rats are a collection of 3,000 randomly generated NFTs on the Ethereum blockchain that double as membership toke...",50.0,50.0,0.00546574592590332,72.94,55.00000000000001,88.54716718196869,2023-01-21
123,Crypto Daily™,"NFT Collection Ape Gang Price, Stats, and Review","10,000 pixel Apes battling on the blockchain since June 2021. Join the Gang now and enjoy the journey as we build for the future. Owners have full...",50.0,50.0,98.20654094219208,75.53,62.5,99.78406429290771,2023-01-21
124,Crypto Daily™,"NFT Collection Voxies Legacy Price, Stats, and Review","This collection has migrated to a new contract on the Polygon blockchain, and this legacy collection should no longer be used. To see the new coll...",50.0,50.0,99.88251030445099,35.199999999999996,56.81818181818181,0.08603930473327637,2023-01-21
125,Crypto Daily™,"NFT Collection Akutar Mint Pass Price, Stats, and Review",WALLET SNAPSHOT HAS BEEN TAKEN As a Buyer: DO NO NOT COLLECT NOW WITH AN EXPECTATION OF AN AKUTAR As a Seller: DO NOT SELL WITH THE EXPECTATION...,50.0,50.0,99.78605508804321,27.67,50.0,0.1744300127029419,2023-01-21
126,Crypto Daily™,"NFT Collection The Captainz Price, Stats, and Review","9,999 PIRATE CAPTAINZ SEARCHING FOR THE LEGENDARY MEMELAND. 9,999 Captainz, with their pirate crewz, explore the Broken Seas in search of the lege...",50.0,50.0,99.981290102005,26.165,65.0,99.96849596500397,2023-01-21
127,Crypto Daily™,"NFT Collection Little Lemon Friends Price, Stats, and Review","LEMON WEBSITE | LEMON TWITTER 9,999 Little lemons that fell from the giant lemon tree, each lemon finding their own little adventures in this big ...",71.28,40.625,99.53854084014893,63.739999999999995,52.25,80.5570513010025,2023-01-21
128,Crypto Daily™,"NFT Collection Monster Ape Club | MAC Price, Stats, and Review","Monster Ape Club is a collection of 7,999 unique generated 3D Monster Apes, stored on the Ethereum Blockchain. The art is made by N-Hance Studio. ...",50.0,50.0,99.80374276638031,50.0,68.75,81.06780052185059,2023-01-21
129,Crypto Daily™,"NFT Collection Shiba Social Club Official Collection Price, Stats, and Review","The Shiba Social Club is an Elite club for the baddest of the Shiba. Our NFT collection has 7,777 unique hand-drawn Shiba with the best detail in ...",50.0,51.66666666666667,99.73604083061218,81.845,73.47222222222221,99.99738335609436,2023-01-21
130,Crypto Daily™,"NFT Collection BYOPill Price, Stats, and Review",The first consumable of the Metaverse &ndash; providing holders power-ups or visual experiences across different worlds while acting as a key for ...,50.0,50.0,99.35956597328186,50.0,52.5,99.95056986808777,2023-01-21
131,Crypto Daily™,"NFT Collection Gutter Dogs Price, Stats, and Review","Welcome to the Gutter. The Gutter Dogs are a collection of 3,000 randomly generated NFTs on the Ethereum blockchain that double as membership toke...",50.0,50.0,0.0270158052444458,72.94,55.00000000000001,96.69386148452759,2023-01-21
132,The Block,Nearly $700 million of Bankman-Fried’s assets seized by Feds: CNBC,The cash and assets seized by prosecutors were primarily made up of Robinhood shares.,58.894999999999996,55.00000000000001,1.9479990005493164,72.02,70.0,0.7332503795623779,2023-01-21
133,NewsBTC,Polkadot Could Present Buying Opportunity As Bullish Outlook Continues,"The Polkadot price has breached the $5 resistance mark in the past trading sessions. Over the last 24 hours, DOT has appreciated by 3.8%. The pric...",71.075,50.0,5.5679768323898315,75.53,49.16666666666667,0.20539164543151855,2023-01-21
134,Crypto Daily™,"NFT Collection Cryptoon Goonz Price, Stats, and Review","The Cryptoon Goonz collection consists of 6,969 generative rubber hose style characters, made up of hundreds of unique traits which not only chang...",50.0,50.0,99.93149638175964,50.0,59.375,99.62262809276581,2023-01-21
135,Crypto Daily™,"NFT Collection 8liens NFT Price, Stats, and Review",8liens have been spawned by the Ethereals for travel to other dimensions. Their main purpose is exploration and discovery. There are six different...,50.0,50.0,99.88556504249573,61.315,50.69444444444444,86.57216131687164,2023-01-21
